link,link_text,txt,site,area
https://brno.idnes.cz/auto-odstavene-krizovatka-banka-breclav-fdm-/brno-zpravy.aspx?c=A180904_100858_brno-zpravy_krut,Řidič v Břeclavi odstavil auto v rušné křižovatce a odešel do banky,"Přímo v křižovatce „zaparkoval“ v Břeclavi řidič, který si potřeboval odskočit do zdejší banky....",idnes.cz,krimi
https://plzen.idnes.cz/delnik-zavalen-besiny-klatovsko-vykopove-prace-ftc-/plzen-zpravy.aspx?c=A180904_101324_plzen-zpravy_vb,"Dělníka na Klatovsku zavalila ve výkopu zemina, zemřel na místě",V Běšinech na Klatovsku ráno zemřel dělník. Ve výkopu ho zavalila zemina. Přivolaní záchranáři už...,idnes.cz,krimi
https://praha.idnes.cz/policie-hleda-cyklisty-napadeni-strazkyne-prirody-chko-krivokladsko-12x-/praha-zpravy.aspx?c=A180904_085602_praha-zpravy_rsr,"Cyklisté jsou podezřelí z napadení strážkyně přírody, hledá je policie","Berounská policie pátrá po dvojici cyklistů, kteří jsou podezřelí z napadení strážkyně přírody na...",idnes.cz,krimi
https://hradec.idnes.cz/pozar-hradec-tesla-hasici-kralovehradecky-fio-/hradec-zpravy.aspx?c=A180904_083750_hradec-zpravy_tuu,"Požár v bývalé hradecké Tesle zavinil výboj, který zapálil hořlavé výpary",Nejvyšší patro budovy v areálu bývalého podniku Tesla v Hradci Králové v noci zachvátil požár....,idnes.cz,krimi
https://praha.idnes.cz/meindl-napadeni-sousedky-znasilneni-soud-odmitl-vypovidat-p4j-/praha-zpravy.aspx?c=A180903_165802_praha-zpravy_rsr,"Mladík obžalovaný z napadení sousedky u soudu mlčel, odmítl vypovídat","Jiří Meindl, který je obžalovaný z pokusu o vraždu své sousedky z pražských Holešovic, se u soudu...",idnes.cz,krimi
https://olomouc.idnes.cz/prostejov-ridic-drogy-policie-pervitin-hlidka-hlidka-zakaz-p4m-/olomouc-zpravy.aspx?c=A180903_114356_olomouc-zpravy_mip,"Zdrogovaného řidiče chytili za měsíc už osmkrát, zákazy ho nenapravily","Pětkrát za poslední týden, celkově osmkrát za necelý měsíc. Tolikrát se do statistik zapsal...",idnes.cz,krimi
https://usti.idnes.cz/teplice-strelba-policie-penny-market-dsq-/usti-zpravy.aspx?c=A180903_165101_usti-zpravy_pp,"U supermarketu v Teplicích zasahovala policie, nejspíš se tam střílelo","Kriminalisté vyšetřují incident, který se odpoledne odehrál u jednoho ze supermarketů v Teplicích....",idnes.cz,krimi
https://hradec.idnes.cz/nehoda-zavora-opila-cyklistka-nemocnice-hradec-kralovehradecky-pwc-/hradec-zpravy.aspx?c=A180903_134114_hradec-zpravy_tuu,"VIDEO: Opilá cyklistka narazila do nemocniční závory, víno měla s sebou","VIDEO
				
                Opilá žena na kole narazila v plné rychlosti do sklopené závory ve vrátnici Fakultní nemocnice v...",idnes.cz,krimi
https://jihlava.idnes.cz/soud-frysava-josef-fiala-kanalizace-cistirna-odpadnich-vod-penale-vysocina-1uh-/jihlava-zpravy.aspx?c=A180903_150706_jihlava-zpravy_evs,Exstarostu soudí za nevýhodnou dohodu. Fryšava může přijít o miliony,"VIDEO
				
                Před žďárským soudem stanul bývalý starosta Fryšavy pod Žákovou horou Josef Fiala. Podle obžaloby...",idnes.cz,krimi
https://plzen.idnes.cz/plasy-nehoda-ridicka-sraz-automobil-dbl-/plzen-zpravy.aspx?c=A180903_133413_plzen-zpravy_vb,Železničáři našli u kolejí na Plzeňsku zdemolované auto s mrtvou řidičkou,"VIDEO
				
                Mrtvou ženu ve zdemolovaném autě našli pracovníci drah v Plasích na Plzeňsku. Vozidlo vyjelo z...",idnes.cz,krimi
https://pardubice.idnes.cz/nasili-na-diteti-sankovani-zlocin-ublizeni-na-zdravi-pcl-/pardubice-zpravy.aspx?c=A180903_140412_pardubice-zpravy_jah,"Nevím, proč jsem s dcerou po cestě ze sáňkování mlátil o zem, říká obžalovaný","V pondělí začalo u pardubické pobočky Krajského soudu líčení s 35letým mužem, který letos v únoru...",idnes.cz,krimi
https://praha.idnes.cz/policie-pribram-zdrogovany-muz-najel-na-policii-ft4-/praha-zpravy.aspx?c=A180903_142725_praha-zpravy_rsr,"Zdrogovaný řidič najel do policisty, pak mu naboural auto","Příbramská policie vyšetřuje osmatřicetiletého řidiče, který nezastavil při silniční kontrole a...",idnes.cz,krimi
https://zlin.idnes.cz/vrazda-otec-deti-stare-mesto-soud-dqs-/zlin-zpravy.aspx?c=A180903_134508_zlin-zpravy_ras,"Muž přiznal vraždu malé dcerky, před začátkem soudu se pokusil o sebevraždu",Brutální vraždou malé dívky ve Starém Městě se začal zabývat krajský soud ve Zlíně. Tragédií...,idnes.cz,krimi
https://praha.idnes.cz/loupez-diamantu-soud-parizska-klenotnictvi-fm2-/praha-zpravy.aspx?c=A180903_133801_praha-zpravy_rsr,"Soud potrestal cizince za krádež diamantů devíti lety, oba vinu odmítají","VIDEO
				
                Za loupež v klenotnictví v centru Prahy potrestal pražský městský soud dva cizince devíti lety...",idnes.cz,krimi
https://plzen.idnes.cz/nehoda-motorkar-amputace-noha-tachovsko-silnice-fue-/plzen-zpravy.aspx?c=A180903_105542_plzen-zpravy_vb,Motorkář jel moc rychle. Při nárazu do stromu a do sloupu přišel o nohu,"Na příliš rychlou jízdu zřejmě doplatil dvaačtyřicetiletý motocyklista, který v neděli odpoledne...",idnes.cz,krimi
https://pardubice.idnes.cz/dopravni-nehoda-pribylov-skutec-policie-zraneni-ctyri-zranene-zeny-1g1-/pardubice-zpravy.aspx?c=A180903_124632_pardubice-zpravy_jah,Při čelním střetu dvou aut na Chrudimsku se zranily čtyři ženy,"Vážná dopravní nehoda se dopoledne stala na silnici mezi Přibylovem a Skutčí na Chrudimsku, kde se...",idnes.cz,krimi
https://praha.idnes.cz/praha-6-kanal-splasky-silnice-propadla-d8v-/praha-zpravy.aspx?c=A180903_123251_praha-zpravy_rsr,"Silnici v Praze 6 uzavřel vybuchlý kanál, na silnici vytekly splašky","VIDEO
				
                Na Evropské ulici v Praze 6 dopoledne vybuchl uprostřed silnice kanál. Doprava směrem do centra...",idnes.cz,krimi
https://usti.idnes.cz/pozar-byvala-slevarna-varnsdorf-sudy-pneumatiky-zasah-hasici-policie-vysetrovani-gk6-/usti-zpravy.aspx?c=A180903_114427_usti-zpravy_vac2,Hasiči se při zásahu ukrývali před padající střechou i explozemi sudů,Tři hodiny bojovali hasiči s požárem bývalé slévárny ve Varnsdorfu. Vzplál tam nahromaděný odpad. V...,idnes.cz,krimi
https://olomouc.idnes.cz/pistole-muz-strelba-plumlov-prostejov-vytrznictvi-f94-/olomouc-zpravy.aspx?c=A180903_111327_olomouc-zpravy_mip,"Opilého muže v noci rozčílil hlasitý hovor u sousedů, tak začal střílet",Svérázným způsobem se dožadoval klidu opilý muž v obci na Prostějovsku. Když ho v noci rušil...,idnes.cz,krimi
https://ostrava.idnes.cz/kuzel-policie-cr-vresinska-ostrava-bomba-vyhrozoval-pc7-/ostrava-zpravy.aspx?c=A180903_095714_ostrava-zpravy_jog,"Za vyhrožování výbušninou v Ostravě muž pykat nebude, byl nepříčetný","VIDEO
				
                Zřejmě vůbec netušil, co dělá, navíc si nejspíše ani neuvědomoval dosah svého počínání. Tak...",idnes.cz,krimi
https://budejovice.idnes.cz/nehoda-stret-ridic-protismer-brloh-motorkarka-fqr-/budejovice-zpravy.aspx?c=A180903_104051_budejovice-zpravy_khr,"Řidič auta přejel do protisměru a srazil motorkářku, je vážně zraněná",Vážná dopravní nehoda auta a motocyklu omezila ráno provoz na silnici na Českokrumlovsku. Řidičku...,idnes.cz,krimi
https://praha.idnes.cz/kyselina-nehoda-barely-odolena-voda-d6t-/praha-zpravy.aspx?c=A180903_074927_praha-zpravy_alh,"Z auta vypadly barely a rozlilo se tisíc litrů kyseliny, řidič ujel","VIDEO
				
                U Odoleny Vody nedaleko Prahy vypadly v noci z auta na silnici dva tisícilitrové barely s...",idnes.cz,krimi
https://kultura.zpravy.idnes.cz/milos-cajthaml-na-odstrel-literarni-cena-knizniho-klubu-p2g-/literatura.aspx?c=A180828_165512_literatura_kiz,Kdo je Na odstřel? Literární cenu Knižního klubu vyhrál Cajthaml,"Chlapecké představy o mužnosti a odpovědi na otázku, co je to vlastně mužský vzor. Tím se zabývá...",idnes.cz,kultura
https://kultura.zpravy.idnes.cz/muzikal-vlasy-simon-caban-divadlo-kalich-ffj-/divadlo.aspx?c=A180904_144616_divadlo_ts,"VIDEO: Virtuální svět, genderová otázka. Muzikál Vlasy řeší naše problémy","VIDEO
				
                Na jaře jej poprvé představili na tiskové konferenci, v září je tu předpremiéra. Ač se muzikál...",idnes.cz,kultura
https://kultura.zpravy.idnes.cz/zivot-herce-frantisek-nemec-portret-jiri-strach-petasedmdesat-p7r-/filmvideo.aspx?c=A180904_093442_filmvideo_ts,Jízda s Františkem Němcem. Dojde na majora Zemana i jedno jediné zaklení,"V portrétu Františka Němce, který k jeho pětasedmdesátinám večer vysílá ČT 2, se herec proslulý...",idnes.cz,kultura
https://kultura.zpravy.idnes.cz/bratr-z-ledu-recenze-0q9-/literatura.aspx?c=A180904_104149_literatura_ts,"RECENZE: Vločky, kry, chlad duše. Bratr z ledu je dobrodružná výprava","Polární led. Led v nás. Ledové vztahy. Neproniknutelný nemocný bratr, ve kterém se nikdo nevyzná....",idnes.cz,kultura
https://kultura.zpravy.idnes.cz/bruce-willis-smrtonosna-past-d20-/filmvideo.aspx?c=A180904_094140_filmvideo_spm,Šestá Smrtonosná past má podle postavy Bruce Willise jméno McClane,"VIDEO
				
                Příští pokračování série Smrtonosná past mění název. Šestý díl, který se původně chystal pod...",idnes.cz,kultura
https://kultura.zpravy.idnes.cz/support-lesbiens-nova-deska-glow-d4x-/hudba.aspx?c=A180903_122714_hudba_ts,"Každý má v krku jiný materiál, líčí Support Lesbiens s novým zpěvákem","Jaká bude nová deska Support Lesbiens? Jemnější, než jsou možná posluchači zvyklí. Alespoň podle...",idnes.cz,kultura
https://kultura.zpravy.idnes.cz/kviz-rychle-sipy-jaroslav-foglar-dqd-/literatura.aspx?c=A180814_150132_literatura_jan,"KVÍZ: Jak znáte Rychlé šípy a Jaroslava Foglara, plantážníci?","DoporučujemeMirek Dušín, Jarka Metelka, Jindra Hojer, Červenáček a Rychlonožka. Příběhy Rychlých šípů od Jaroslava...",idnes.cz,kultura
https://kultura.zpravy.idnes.cz/labor-day-navstevnost-americkych-kin-dwp-/filmvideo.aspx?c=A180903_153832_filmvideo_ts,Kina odolávají Netflixu. Americké sály zažily nejlepší léto dvacetiletí,"VIDEO
				
                Poslední víkend hollywoodského léta, které tradičně uzavřel americký svátek Labor Day, završil...",idnes.cz,kultura
https://kultura.zpravy.idnes.cz/dvorakova-praha-2018-prolog-0yq-/hudba.aspx?c=A180903_112740_hudba_era,Skryté stopy skladatele Dvořáka. Chodil k McDonaldovi i do Ponrepa,"K nejlepším nápadům, s nimiž přišel festival Dvořákova Praha, jsou výpravy do míst spojených s...",idnes.cz,kultura
https://kultura.zpravy.idnes.cz/labyrint-iii-3-recenze-jiri-strach-dla-/filmvideo.aspx?c=A180903_101808_filmvideo_ts,RECENZE: Ještě pochmurnější. I třetí Labyrint je návykový,"VIDEO
				
                Obě předchozí řady sledovalo nad milion diváků, od pondělí to mysteriózní krimi Labyrint zkusí...",idnes.cz,kultura
https://kultura.zpravy.idnes.cz/zebricek-kin-duverny-nepritel-upgrade-palach-fnl-/filmvideo.aspx?c=A180903_135902_filmvideo_spm,Souboj dvou sci-fi vyhrál překvapivě domácí Důvěrný nepřítel s Dykem,"VIDEO
				
                Jak australský Upgrade, tak český Důvěrný nepřítel vyprávějí o riskantní umělé inteligenci. Ze...",idnes.cz,kultura
https://kultura.zpravy.idnes.cz/serial-nova-profesor-t-0bl-/filmvideo.aspx?c=A180903_132842_filmvideo_spm,Pavel Řezníček má titulní roli v krimiseriálu Novy Profesor T,"Herec Pavel Řezníček, který se proslavil hlavní rolí v krimithrilleru ČT Cirkus Bukowsky, zastoupí...",idnes.cz,kultura
https://kultura.zpravy.idnes.cz/muzikal-galileo-divadlo-hybernia-2019-vstupenky-fqg-/divadlo.aspx?c=A180830_123720_divadlo_vha,Vrací se Galileo s Ledeckým i Chýlkovou. Kupte si vstupenky přednostně,Exkluzivně jen v roce 2019 v pražském Divadle Hybernia se vrátí na scénu jeden z nejúspěšnějších...,idnes.cz,kultura
https://zpravy.idnes.cz/google-doodle-oskar-schlemmer-dkc-/mediahub.aspx?c=A180904_110235_mediahub_jpl,Google vzpomíná na všestranného umělce Oskara Schlemmera,"Vyhledávač Google připomíná výročí narození německého malíře, designéra, sochaře a choreografa...",idnes.cz,kultura
https://kultura.zpravy.idnes.cz/rainier-fog-alice-in-chains-recenze-dtn-/hudba.aspx?c=A180831_134524_hudba_ts,"RECENZE: Staré, nové a vše dobré. S Alice in Chains se musí počítat",Americká rocková kapela Alice in Chains má se svou novou deskou Rainier Fog spojenou řadu...,idnes.cz,kultura
https://kultura.zpravy.idnes.cz/komedie-zeny-v-behu-zlata-adamovska-du8-/filmvideo.aspx?c=A180902_125504_filmvideo_spm,Zlata Adamovská si v komedii Ženy v běhu vyzkouší dámský maraton,Podle vlastního scénáře natáčí Martin Horský svou režijní prvotinu s názvem Ženy v běhu. Do hlavní...,idnes.cz,kultura
https://kultura.zpravy.idnes.cz/recenze-vsechno-bude-olmo-omerzu-d4l-/filmvideo.aspx?c=A180831_112836_filmvideo_spm,"RECENZE: Páni kluci stále věří, že Všechno bude. Dost možná film roku","VIDEO
				
                I kdyby na letošním karlovarském festivalu snímek Všechno bude nedostal cenu za režii, bylo by...",idnes.cz,kultura
https://kultura.zpravy.idnes.cz/bono-vox-prisel-o-hlas-u2-koncert-v-berline-zruseny-koncert-pog-/hudba.aspx?c=A180902_100250_show_aktual_fer,Bono z U2 přišel během koncertu v Berlíně o hlas. Kapela hraní zrušila,Frontman irské rockové kapely U2 Bono přišel o hlas krátce po začátku koncertu v Berlíně. Zpěvák...,idnes.cz,kultura
https://kultura.zpravy.idnes.cz/anna-cima-probudim-se-na-sibuji-nakladatelstvi-paseka-japonsko-roman-1ie-/literatura.aspx?c=A180831_160254_literatura_kiz,RECENZE: Letošek má svůj objev. Román Probudím se na Šibuji a autorku Cimu,"Z Japonska znáte jen Harukiho Murakamiho, sushi a samuraje? Román Probudím se na Šibuji debutující...",idnes.cz,kultura
https://kultura.zpravy.idnes.cz/1-proti-vsem-soutez-tv-prima-prvni-dojmy-fd2-/filmvideo.aspx?c=A180831_115526_filmvideo_spm,PRVNÍ DOJMY: Soutěž 1 proti všem je jenom loterie v přímém přenosu,"VIDEO
				
                Proti konkurenční zábavě Novy Tvoje tvář má známý hlas si novinka Primy 1 proti všem připisuje...",idnes.cz,kultura
https://kultura.zpravy.idnes.cz/recenze-psi-dny-meetfactory-d1g-/divadlo.aspx?c=A180831_132236_divadlo_ts,RECENZE: Halucinace na písečné pláži kazí jenom klišé okoralé alkoholičky,Nezvyklé prostředí doprovází letní divadelní novinku MeetFactory. Hraje se o zapomenutém ostrově...,idnes.cz,kultura
https://kultura.zpravy.idnes.cz/herec-jan-kalous-zemrel-daber-kevin-sam-doma-fei-/filmvideo.aspx?c=A180831_140829_filmvideo_ts,"Zemřel devětatřicetiletý herec Jan Kalous, hlas Kevina ze Sám doma","Ve věku 39 let zemřel herec Jan Kalous. Objevil se v mnoha filmech i seriálech, ale nejvíc se...",idnes.cz,kultura
https://kultura.zpravy.idnes.cz/letni-festivaly-2018-0n6-/hudba.aspx?c=A180830_130621_hudba_vha,"KOMENTÁŘ: Tuzemské festivaly se snaží, světové však ještě nejsou","I v roce 2018 dovezli pořadatelé letních festivalů velká jména, například Lanu Del Rey nebo mnoha...",idnes.cz,kultura
https://kultura.zpravy.idnes.cz/recenze-kubik-hrdina-0l8-/filmvideo.aspx?c=A180831_424195_filmvideo_spm,RECENZE: Animovaná pohádka Kubík hrdina má pochopení pro zbabělce,"VIDEO
				
                Animovaná islandská pohádka Kubík hrdina sice po filmařské stránce představuje běžný dětský doplněk...",idnes.cz,kultura
https://kultura.zpravy.idnes.cz/jana-fabianova-alenka-alice-a-voda-ziva-semafor-muzikal-deutsch-p7c-/divadlo.aspx?c=A180831_161755_divadlo_ts,Jana Fabiánová se ze Států vrací do živých vod Semaforu,"Něco z Alenky, něco z Erbena, něco od Suchého. Bývalá členka Semaforu Jana Fabiánová, která...",idnes.cz,kultura
https://kultura.zpravy.idnes.cz/televizionar-vsichni-proti-vsem-startuje-bitva-podzimu-pkv-/filmvideo.aspx?c=A180831_111615_filmvideo_spm,TELEVIZIONÁŘ: Všichni proti všem. Právě startuje bitva podzimu,"VIDEO
				
                Stylově hned v první den prvního podzimního měsíce, který symbolizuje start hlavní televizní...",idnes.cz,kultura
https://kultura.zpravy.idnes.cz/hana-podolska-umeleckoprumyslove-muzeum-vystava-moda-prvni-republika-13a-/vytvarne-umeni.aspx?c=A180831_154517_vytvarne-umeni_kiz,"OBRAZEM: Co se šilo pro Adinu Mandlovou, odhaluje výstava o Podolské",Hana Podolská je legendou prvorepublikového módního návrhářství. V Praze provozovala jeden z...,idnes.cz,kultura
https://kultura.zpravy.idnes.cz/neil-diamond-hot-august-night-iii-recenze-f1c-/hudba.aspx?c=A180830_112109_hudba_vha,RECENZE: Poslouchat koncert Neila Diamonda je prostě stále čirá radost,"Americký zpěvák Neil Diamond letos v lednu ohlásil, že kvůli Parkinsonově nemoci končí s živým...",idnes.cz,kultura
https://kultura.zpravy.idnes.cz/recenze-krejzovi-serial-tv-prima-d4v-/filmvideo.aspx?c=A180831_424196_filmvideo_spm,RECENZE: Kdo jsou seriáloví Krejzovi? V podstatě Nováci se zvířátky,"VIDEO
				
                Když Čechov psal Dvě sestry, poradil mu Jára Cimrman: Není to málo, Antone Pavloviči? Seriálu...",idnes.cz,kultura
https://kultura.zpravy.idnes.cz/deska-ruze-film-limbo-lucie-vondrackova-fct-/filmvideo.aspx?c=A180831_091847_filmvideo_spm,"Vydání desky i nový film teď musí počkat, potvrdila Lucie Vondráčková","VIDEO
				
                Zpěvačka a herečka Lucie Vondráčková posouvá kvůli rozvodu vydání desky Růže i natáčení filmu Hotel...",idnes.cz,kultura
https://kultura.zpravy.idnes.cz/karikaturiste-nakladatelstvi-paseka-dsy-/literatura.aspx?c=A180830_154417_literatura_kiz,Švejk do státního znaku? Karikaturisté se v 60. letech nebáli,Českého lva na státním znaku nahradili ocasem obdařeným Švejkem. Nikitovi Chruščovovi dali do ruky...,idnes.cz,kultura
https://kultura.zpravy.idnes.cz/alfa-recenze-cy4-/filmvideo.aspx?c=A180830_115457_filmvideo_ts,RECENZE: Variace na Eduarda Štorcha. Jak pralidé našli domácí mazlíčky,"VIDEO
				
                Premiérový film Alfa slibuje „velkolepé dobrodružství mladého lovce a vlka za poslední doby ledové...",idnes.cz,kultura
https://kultura.zpravy.idnes.cz/nesnesitelna-tekutost-byti-sklenenka-jatka78-vit-neznal-katerina-dvorakova-1b3-/divadlo.aspx?c=A180829_153807_divadlo_ts,OBRAZEM: Nesnesitelnou tekutost bytí zakusí herečka v obrovském akváriu,"Dvanáct tisíc litrů vody a jedna herečka. To je obsazení nezvyklého, technicky velice náročného...",idnes.cz,kultura
https://kultura.zpravy.idnes.cz/ariana-grande-sweetener-recenze-dnq-/hudba.aspx?c=A180828_104239_hudba_vha,RECENZE: Ariana Grande rozmanitou deskou uvádí to lepší ze současného popu,"VIDEO
				
                Žánrově těžko zařaditelná, díky tomu ovšem rozhodně pestrá. Tak lze popsat čtvrtou desku Ariany...",idnes.cz,kultura
https://kultura.zpravy.idnes.cz/dan-mccafferty-doctor-victor-dio-/hudba.aspx?c=A180828_142030_hudba_vha,Dan McCafferty z Nazarethu točil v Praze klip převlečený za bezdomovce,Skotský zpěvák Dan McCafferty známý především ze slavné kapely Nazareth točí sólovou desku. K...,idnes.cz,kultura
https://kultura.zpravy.idnes.cz/recky-reziser-costa-gavras-dementoval-zpravy-o-svem-umrti-pae-/literatura.aspx?c=A180830_151919_filmvideo_spm,Řecký režisér Costa-Gavras dementoval zprávy o svém úmrtí,Informaci o režisérově údajném skonu přinesly světové agentury. Sám Costa-Gavras vystoupil ve...,idnes.cz,kultura
https://kultura.zpravy.idnes.cz/mirka-miskechova-broucek-klip-dk1-/hudba.aspx?c=A180830_104534_hudba_vha,VIDEO: Písničkářka Miškechová představuje Broučka a zpívá ho česky,Slovenská písničkářka Mirka Miškechová vydá koncem září svou druhou studiovou desku My name is...,idnes.cz,kultura
https://ekonomika.idnes.cz/jihoafricka-republika-stavka-belosi-diskriminace-sasol-pj1-/eko-zahranicni.aspx?c=A180904_113159_eko-zahranicni_svob,Rasová diskriminace naruby. Jihoafrická firma nenabídla podíl bělochům,Jihoafrická Unie solidarity vyhlásila stávku v petrochemické firmě Sasol. Jejími členy jsou...,idnes.cz,ekonomika
https://ekonomika.idnes.cz/nelegalni-bublinkova-folie-pokuta-dr8-/ekoakcie.aspx?c=A180904_152442_ekoakcie_svob,Prasklo to. Úřady už počtvrté odhalily tajnou výrobnu bublinkové fólie,"Společnost Jasobal, která vyrábí bublinkovou fólii, dostala již čtvrtou pokutu. Tentokrát musí...",idnes.cz,ekonomika
https://brno.idnes.cz/bonbony-reklamni-cukrovinky-kajinek-premiera-sweet-radomir-havlik-rozhovor-1sx-/brno-zpravy.aspx?c=A180904_425034_brno-zpravy_krut,"Bonbony pro Kajínka? Šel bych do toho znovu, říká dodavatel cukrovinek",Už před čtvrt stoletím začala brněnská rodinná firma Premiera Sweet jako první v Česku dodávat...,idnes.cz,ekonomika
https://ekonomika.idnes.cz/tesco-mysi-trus-as-0nk-/ekoakcie.aspx?c=A180904_152830_ekoakcie_fih,Inspekce uzavřela Tesco v Aši. V obchodě našla myší trus,Státní zemědělská a potravinářská inspekce uzavřela obchodní dům řetězce Tesco v Aši na Chebsku....,idnes.cz,ekonomika
https://ekonomika.idnes.cz/vyzkum-avokado-kazdy-den-300-dolaru-dr2-/eko-zahranicni.aspx?c=A180904_132013_eko-zahranicni_svob,Avokádo jako přivýdělek? Vědci v USA nabízejí peníze za podíl na výzkumu,"Skupina čtyř amerických univerzit shání 1 000 lidí, kteří budou ochotni se zúčastnit jejich...",idnes.cz,ekonomika
https://ekonomika.idnes.cz/putin-rusko-investice-sankce-ekonomika-fc4-/eko-zahranicni.aspx?c=A180904_110350_eko-zahranicni_mato,"Putin tlačí oligarchy do investic, mají oživit ruskou ekonomiku","Poté co Kreml uložil k ledu plán na zvýšení daní pro velké ruské firmy, snaží se je přimět k tomu,...",idnes.cz,ekonomika
https://ekonomika.idnes.cz/rusko-bojovy-robot-igorek-kalasnikov-d8z-/eko-zahranicni.aspx?c=A180821_133837_zahranicni_aha,"Kalašnikov představil chodícího bojového robota, dal mu jméno Igorek",DoporučujemeKoncept pohyblivého antropomorfního robota představil na veletrhu Armija 2018 ruský koncern Kalašnikov....,idnes.cz,ekonomika
https://ekonomika.idnes.cz/liftago-taxi-expanze-krajska-mesta-dts-/eko-doprava.aspx?c=A180904_114800_ekoakcie_fih,Liftago expanduje. Konkurent Uberu chce letos do všech krajských měst,Česká přepravní platforma Liftago chce do konce roku expandovat do všech krajských měst. Dosud...,idnes.cz,ekonomika
https://ekonomika.idnes.cz/mzdy-vyvoj-2018-00x-/ekonomika.aspx?c=A180904_093925_ekonomika_fih,"Mzdy vyrostly téměř o desetinu, na výplatnici máme o 2 500 více než loni","Průměrné mzdy opět silně rostou. Ve druhém čtvrtletí se vyhouply na 31 851 korun. Růstem o 8,6...",idnes.cz,ekonomika
https://ekonomika.idnes.cz/nedokoncene-vzdelani-studie-statni-rozpocet-fn4-/ekonomika.aspx?c=A180903_205236_ekonomika_zaz,"Nedokončené vzdělání se nevyplácí státu ani lidem, spočítala studie","Absolvent s maturitou si za život vydělá v průměru o třetinu více než vyučený, a dokonce o 60...",idnes.cz,ekonomika
https://ekonomika.idnes.cz/trump-sanders-twitter-amazon-d2o-/eko-zahranicni.aspx?c=A180903_154904_eko-zahranicni_mato,"Trumpovy narážky Amazon přešel, kritiku senátora Sanderse už ne",Internetový gigant Amazon čelil v posledních měsících kritice na několika politických frontách....,idnes.cz,ekonomika
https://ekonomika.idnes.cz/ing-pokuta-prani-penez-0bk-/eko-zahranicni.aspx?c=A180904_105044_eko-zahranicni_fih,ING zaplatí obří pokutu 20 miliard. Nedodržela zákon o praní peněz,"Astronomickou pokutu 775 milionů eur, v přepočtu téměř dvacet miliard korun, zaplatí největší...",idnes.cz,ekonomika
https://ekonomika.idnes.cz/fincentrum-swiss-life-akvizice-stuchlik-ff5-/ekoakcie.aspx?c=A180904_085047_ekoakcie_fih,"Kandidát na primátora Stuchlík se zbavil Fincentra, koupili ho Švýcaři","Švýcarská skupina Swiss Life kupuje finančně-poradenskou společnost Fincentrum, kterou zakládal a...",idnes.cz,ekonomika
https://ekonomika.idnes.cz/eet-zmena-certifikatu-financni-sprava-dxj-/ekonomika.aspx?c=A180904_151051_ekonomika_jan,"Pokladny s EET mohou mít problémy, mění se certifikát","Finanční správa nabádá podnikatele napojené na EET, aby zkontrolovali, zda je jejich zařízení s...",idnes.cz,ekonomika
https://ekonomika.idnes.cz/kurovec-kalamita-vojacek-lesy-cr-dor-/ekonomika.aspx?c=A180903_170841_ekonomika_fih,"O kůrovci uslyšíme roky. Hledáme posily v cizině, řekl nový šéf Lesů","Na zpracování dřeva z kůrovcové kalamity hledají Lesy ČR kapacity také v zahraničí, například v...",idnes.cz,ekonomika
https://ekonomika.idnes.cz/argentina-uspory-peso-krize-dgf-/eko-zahranicni.aspx?c=A180903_163937_eko-zahranicni_fih,"Argentina ruší ministerstva, zavádí úsporná opatření a zvyšuje cla","Argentina zavádí opatření, která mají stabilizovat skomírající ekonomiku. Ruší několik ministerstev...",idnes.cz,ekonomika
https://ekonomika.idnes.cz/cina-investuje-v-africe-rozvoj-pomoc-dvw-/eko-zahranicni.aspx?c=A180903_103251_eko-zahranicni_are,"Čína posiluje svůj vliv v Africe, tamním státům poskytne 60 miliard dolarů","Čína poskytne dalších 60 miliard dolarů (1,3 bilionu korun) na rozvoj afrických zemí. Na úvod...",idnes.cz,ekonomika
https://ekonomika.idnes.cz/coca-cola-automaty-skoly-089-/test.aspx?c=A180903_134409_ekonomika_fih,Coca-Cola se stahuje se sladkými nápoji ze středních škol,"Nápojařská firma Coca-Cola už nebude nabízet na středních školách v České republice sladké nápoje,...",idnes.cz,ekonomika
