link,link_text,txt,site,area
https://olomouc.idnes.cz/olomouc-nocni-pozar-byt-dum-evakuace-kour-zraneni-hasici-pem-/olomouc-zpravy.aspx?c=A180910_094729_olomouc-zpravy_stk,"Požár vyhnal v noci z domu třicet lidí, obyvatelka se nadýchala kouře",Nepříjemnou noc zažilo téměř třicet obyvatel jednoho z olomouckých domů. Kvůli požáru v jednom z...,idnes.cz,krimi
https://brno.idnes.cz/hodoninsko-ridic-zacatecnik-nehoda-auto-na-strese-potok-p2d-/brno-zpravy.aspx?c=A180910_104407_brno-zpravy_krut,"Řidič začátečník podcenil rychlost auta, skončil na střeše v potoce","Své řidičské schopnosti výrazně přecenil osmnáctiletý mladík, který jel v sobotu večer po silnici...",idnes.cz,krimi
https://praha.idnes.cz/vykop-vystaviste-unik-plynu-uzavirka-praha-fmm-/praha-zpravy.aspx?c=A180910_091116_praha-zpravy_rsr,"Z výkopu u pražského Výstaviště unikal plyn, nejezdily kvůli tomu tramvaje","Pražští hasiči dopoledne uzavřeli část ulice U Výstaviště, kde z výkopu unikal plyn. Silnice byla...",idnes.cz,krimi
https://praha.idnes.cz/ridic-pod-vlivem-drog-obytny-karavan-policie-honicka-nehoda-p4l-/praha-zpravy.aspx?c=A180907_150029_praha-zpravy_rsr,"VIDEO: Zdrogovaný řidič ujížděl strážníkům v karavanu, třikrát naboural",Strážníci z Prahy 12 ve čtvrtek pronásledovali řidiče v karavanu. Ten projížděl i jednosměrnou...,idnes.cz,krimi
https://olomouc.idnes.cz/olomouc-holice-nehoda-mercedes-riskantni-jizda-ridic-utekl-pod-/olomouc-zpravy.aspx?c=A180907_170228_olomouc-zpravy_stk,"Neznámý řidič se zmocnil auta, při riskantní jízdě naboural a utekl",Dopravní nehodu plnou nejasností vyšetřují policisté z Olomouce. Na kraji města havaroval při...,idnes.cz,krimi
https://hradec.idnes.cz/opili-cizinci-ridili-auto-po-oslave-hradec-kralove-policie-benzinka-1p6-/hradec-zpravy.aspx?c=A180907_143130_hradec-zpravy_tuu,"VIDEO: Dva cizinci po oslavě řídili auto, opilejšího střídal méně opilý","Hradecká policie zadržela na benzinové pumpě dva opilé řidiče v jednom autě. Cizinci vypověděli, že...",idnes.cz,krimi
https://zlin.idnes.cz/matka-dite-pohresovani-kromeriz-vazba-soud-obvineni-f9s-/zlin-zpravy.aspx?c=A180907_160417_zlin-zpravy_ras,"Matka odmítá sdělit, kde je její dítě. Soud ji poslal do vazby","Ve vazbě skončila matka čtyřletého chlapce z Kroměřížska, který je od června pohřešovaný. Hoch je...",idnes.cz,krimi
https://pardubice.idnes.cz/cizinecka-policie-na-spravedlnosti-pardubice-zatah-fxu-/pardubice-zpravy.aspx?c=A180907_132906_pardubice-zpravy_skn,Na stavbě před policejním ředitelstvím pracovalo načerno patnáct cizinců,Na stavbě bytového komplexu Na Spravedlnosti v Pardubicích pracovali načerno zahraniční dělníci....,idnes.cz,krimi
https://usti.idnes.cz/pad-zena-selfie-mariina-vyhlidka-jetrichovice-ceske-svycarsko-vazne-zraneni-1sc-/usti-zpravy.aspx?c=A180907_135147_usti-zpravy_vac2,Dívka se při focení zřítila ze skalní vyhlídky v Českém Švýcarsku,"Vážné zranění utrpěla ve čtvrtek v podvečer dvaadvacetiletá dívka, která v národním parku České...",idnes.cz,krimi
https://ostrava.idnes.cz/kun-jezdkyne-projizdka-pad-zraneni-novy-jicin-f4j-/ostrava-zpravy.aspx?c=A180907_142837_ostrava-zpravy_woj,"Po setmění se s jezdkyní splašil kůň. Je vážně zraněna, zvíře zahynulo",Při večerní projížďce spadla na Novojičínsku z koně třiačtyřicetiletá žena. S vážnými úrazy leží v...,idnes.cz,krimi
https://pardubice.idnes.cz/soud-rakovina-usti-nad-orlici-pozustali-nepriznal-odskodne-pqh-/pardubice-zpravy.aspx?c=A180907_121904_pardubice-zpravy_skn,"Pozůstalí po oběti rakoviny odškodnění nevysoudili, lékař nechyboval","Odvolací soud v Pardubicích zamítl žalobu pozůstalých po ženě, která v roce 2009 zemřela na...",idnes.cz,krimi
https://zlin.idnes.cz/rallye-nehoda-lopenik-obzaloba-plasek-bujacek-federace-smrt-ctyr-divek-1zr-/zlin-zpravy.aspx?c=A180907_110725_zlin-zpravy_ras,Za smrt čtyř dívek při rallye jsou nově obžalováni další čtyři lidé,Kromě původně souzeného traťového komisaře stanou před soudem kvůli smrti čtyř dívek při rallye v...,idnes.cz,krimi
https://olomouc.idnes.cz/veska-olomoucko-tragicka-nehoda-mrtvy-cyklista-policie-shani-svedky-1jc-/olomouc-zpravy.aspx?c=A180907_104707_olomouc-zpravy_stk,"U silnice ležel vybouraný cyklista, našli ho až druhý den mrtvého",Tragickou nehodu vyšetřují už několik dní policisté z Olomoucka. U silnice byl nalezen mrtvý...,idnes.cz,krimi
https://vary.idnes.cz/kradez-platebni-karta-penezenka-senior-policie-frf-/vary-zpravy.aspx?c=A180907_111630_vary-zpravy_ba,"Seniorovi se udělalo špatně a požádal kolemjdoucího o pomoc, muž jej okradl","Policisté dopadli zloděje, který okradl seniora se zdravotními potížemi. Devětasedmdesátiletý muž...",idnes.cz,krimi
https://liberec.idnes.cz/muz-vezl-na-babete-v-bedrichove-dve-deti-a-naboural-fvv-/liberec-zpravy.aspx?c=A180907_084100_liberec-zpravy_tm,"Muž bez řidičáku vezl na babetě děti a nedal přednost, všichni jsou zranění","Ukázkovou nezodpovědnost předvedl v Bedřichově muž, který se vydal na projížďku na babetě. Na...",idnes.cz,krimi
https://pardubice.idnes.cz/pozar-senik-opatovec-svitavsko-pricina-vysetrovani-hasici-pq0-/pardubice-zpravy.aspx?c=A180907_092403_pardubice-zpravy_skn,"Za obří požár seníku na Svitavsku může samovznícení, ukázalo vyšetřování",Srpnový obří požár seníku v Opatovci na Svitavsku způsobilo samovznícení. Vyplývá to ze závěrů...,idnes.cz,krimi
https://plzen.idnes.cz/nehoda-plasy-plzensko-balon-uzavirka-pohrebni-sluzba-pdy-/plzen-zpravy.aspx?c=A180907_085028_plzen-zpravy_vb,Do pohřebního vozu s nebožtíkem narazil přívěs s horkovzdušným balonem,Kuriózní nehoda se stala ve čtvrtek dopoledne v Plasích na Plzeňsku. Převrátil se tam přívěs s...,idnes.cz,krimi
https://praha.idnes.cz/nehoda-dalnice-d4-auto-do-stromu-jiloviste-fg6-/praha-zpravy.aspx?c=A180907_093155_praha-zpravy_rsr,"Felicia vyjela z dálnice do lesa, řidiče odvezla záchranka","Středočeští záchranáři ráno zasahovali u řidiče, který vyjel mimo dálnici D4 a s autem naboural do...",idnes.cz,krimi
https://brno.idnes.cz/soud-radek-baranek-nehoda-opilost-smrt-chodkyne-breclav-pjo-/brno-zpravy.aspx?c=A180906_163254_brno-zpravy_krut,Řidič dostal čtyři roky za smrt chodkyně. U soudu mu zavařil obhájce,"Čtyřletý trest dostal u břeclavského okresního soudu Radek Baránek, který je obžalovaný, že loni v...",idnes.cz,krimi
https://olomouc.idnes.cz/olomouc-zlodej-kalhoty-alkohol-vyhrozovani-pobodani-policie-pui-/olomouc-zpravy.aspx?c=A180906_170248_olomouc-zpravy_stk,"Zloděj si nacpal do kalhot alkohol a deodoranty, ostrahu chtěl bodnout","Dramatické chvíle se ve středu odehrály v jednom z olomouckých supermarketů, kde ostraha přistihla...",idnes.cz,krimi
https://plzen.idnes.cz/vrtulnik-pad-nehoda-podnikatel-plzen-borska-pole-bangkok-post-p6s-/plzen-zpravy.aspx?c=A180906_155044_plzen-zpravy_vb,O pádu vrtulníku v Plzni píše kvůli smrti tří Thajců i Bangkok Post,"O tragickém pádu vrtulníku v Plzni, při kterém ve středu zahynuli čtyři lidé, informuje i list...",idnes.cz,krimi
https://budejovice.idnes.cz/nadrazi-ceske-budejovice-policie-cizinec-strecha-vlak-pf1-/budejovice-zpravy.aspx?c=A180906_130545_budejovice-zpravy_jbr,"Muž vyšplhal na střechu nádraží, policii takto zaměstnal už několikrát","Rozruch na českobudějovickém nádraží způsobil cizinec, který se pohyboval po jeho areálu. Vyšplhal...",idnes.cz,krimi
https://praha.idnes.cz/prives-kone-nehoda-prevratil-policie-dalnice-pribram-p0i-/praha-zpravy.aspx?c=A180906_135658_praha-zpravy_rsr,"Na silnici u Příbrami se převrátil přívěs s koňmi, zvířata se rozutekla","Dopravu u Příbrami odpoledne zkomplikovala havárie přívěsného vozíku s koňmi, který se převrátil na...",idnes.cz,krimi
https://vary.idnes.cz/dopravni-nehoda-osobak-motorka-zranene-divky-karlovy-vary-policie-1dl-/vary-zpravy.aspx?c=A180906_142600_vary-zpravy_ba,"Senior nedal přednost dvěma dívkám na motorce, skončily v nemocnici",Třiaosmdesátiletý řidič nedal v Karlových Varech přednost dvěma dívkám na motorce. Obě po kolizi...,idnes.cz,krimi
https://hradec.idnes.cz/verejna-zakazka-tendr-obzaloba-manipulace-zjednani-vyhody-revitalizace-hospital-kuks-kralovehradecky-is9-/hradec-zpravy.aspx?c=A180906_122933_hradec-zpravy_tuu,"Žalobce viní čtyři lidi, že pomohli firmě k stamilionové zakázce na Kuksu",Za zmanipulování zakázky na oživení barokního hospitalu Kuks na Trutnovsku čelí čtyři lidé...,idnes.cz,krimi
https://plzen.idnes.cz/vrtulnik-podnikatel-manevr-plzen-borska-pole-pad-f7d-/plzen-zpravy.aspx?c=A180906_120213_plzen-zpravy_vb,Se zříceným vrtulníkem z Plzně létal hazardér známý nebezpečnými manévry,"Na hraně zákona se podle zjištění  MF DNES mnohdy pohyboval podnikatel B. D. ze Šťáhlav, který...",idnes.cz,krimi
https://praha.idnes.cz/nehoda-autobusy-ladvi-cestujici-zraneni-praha-f4t-/praha-zpravy.aspx?c=A180906_131839_praha-zpravy_rsr,"U metra Ládví se srazily dva autobusy, dvě cestující mají zraněnou hlavu",Dopoledne se u autobusové zastávky Ládví srazily dva autobusy. Dvě ženy mají po nehodě zraněnou...,idnes.cz,krimi
https://brno.idnes.cz/prehozeny-jiskrici-drat-vysoke-napeti-klobouky-u-brna-p11-/brno-zpravy.aspx?c=A180906_105343_brno-zpravy_krut,"Přes vysoké napětí někdo přehodil drát, tvůrce smrtící pasti hledá policie",Nebezpečnou elektrickou past nastražil neznámý pachatel v Kloboukách u Brna. Přes vedení vysokého...,idnes.cz,krimi
https://kultura.zpravy.idnes.cz/zebrik-kin-sestra-0zy-/filmvideo.aspx?c=A180910_134328_filmvideo_spm,"Kinům vládla hororová Sestra, za víkend přilákala 65 tisíc fanoušků","Premiérový horor Sestra, který odhaluje tajemství jeptišek v rumunském klášteru, získal při svém...",idnes.cz,kultura
https://kultura.zpravy.idnes.cz/teroristka-iva-janzurova-radek-bajgar-dxt-/filmvideo.aspx?c=A180910_426082_filmvideo_spm,"Nosím dvě patrony na podvazku, líčí Iva Janžurová coby Teroristka","VIDEO
				
                Iva Janžurová coby noblesní důchodkyně s vražednou brokovnicí zosobňuje symbol filmu Teroristka,...",idnes.cz,kultura
https://kultura.zpravy.idnes.cz/egypt-station-paul-mccartney-recenze-dwu-/hudba.aspx?c=A180907_150648_hudba_ts,RECENZE: McCartney to znovu dokázal. Egypt Station je příjemná deska,Paul McCartney právě vydává novou desku Egypt Station. A podobně jako předchozí počin New se i...,idnes.cz,kultura
https://kultura.zpravy.idnes.cz/teorie-velkeho-tresku-keith-carradine-dxq-/filmvideo.aspx?c=A180909_174024_filmvideo_spm,Do Teorie velkého třesku se vrátí Keith Carradine coby otec Penny,"VIDEO
				
                V poslední, dvanácté řadě seriálu Teorie velkého třesku, která se ve Spojených státech začne...",idnes.cz,kultura
https://kultura.zpravy.idnes.cz/ricky-martin-koncert-praha-recenze-dtx-/hudba.aspx?c=A180910_030145_hudba_vha,RECENZE: Rickymu Martinovi nestačilo mrkání. Do své show dal všechno,"VIDEO
				
                Koncert Rickyho Martina je přesně ten typ akce, který v mnohých vzbuzuje předsudky už dlouho...",idnes.cz,kultura
https://kultura.zpravy.idnes.cz/dvorakova-praha-2018-039-/hudba.aspx?c=A180909_120513_hudba_era,GLOSÁŘ: Probuzený umrlec a hvězdná chvíle s Leonardem Bernsteinem,Festival Dvořákova Praha má za sebou první dva koncerty. Po pátečním provedení Dvořákovy kantáty...,idnes.cz,kultura
https://kultura.zpravy.idnes.cz/kviz-rychle-sipy-jaroslav-foglar-dqd-/literatura.aspx?c=A180814_150132_literatura_jan,"KVÍZ: Jak znáte Rychlé šípy a Jaroslava Foglara, plantážníci?","DoporučujemeMirek Dušín, Jarka Metelka, Jindra Hojer, Červenáček a Rychlonožka. Příběhy Rychlých šípů od Jaroslava...",idnes.cz,kultura
https://kultura.zpravy.idnes.cz/voxel-tehotna-klip-0aj-/hudba.aspx?c=A180830_110007_hudba_vha,VIDEO: Písničkář Voxel se vžívá do strastí své ženy v klipu Těhotná,"Písničkář Voxel představuje videoklip, který natočil k nové písni Těhotná. Oproti jeho předchozí...",idnes.cz,kultura
https://kultura.zpravy.idnes.cz/trailer-oni-a-silvio-berlusconi-sorrentino-fee-/filmvideo.aspx?c=A180907_130708_filmvideo_spm,VIDEO: Berlusconiho divoké večírky ožijí ve filmu Oni a Silvio,"VIDEO
				
                Paolo Sorrentino po filmech Velká nádhera či Mládí a seriálu Mladý papež natočil provokativní...",idnes.cz,kultura
https://kultura.zpravy.idnes.cz/divadlo-divadelni-sezona-2018-2019-vyroci-csr-sto-let-f6b-/divadlo.aspx?c=A180907_121110_divadlo_ts,"Dvě Libuše, jeden Švec. Sto let republiky oslaví i naše divadla","Česká divadelní scéna zahajuje speciální sezonu, hned v jejím úvodu totiž mají soubory šanci...",idnes.cz,kultura
https://kultura.zpravy.idnes.cz/predator-evoluce-pokracovani-d2l-/filmvideo.aspx?c=A180907_144742_filmvideo_ts,Opět není čas na krvácení. Predátor se v Evoluci vrací větší a silnější,"VIDEO
				
                Nebylo to natáčení snů. Arnold Schwarzenegger hubnul kvůli kondici, režisér proto, že nesnášel...",idnes.cz,kultura
https://kultura.zpravy.idnes.cz/recenze-ondrej-klimek-0ud-/hudba.aspx?c=A180906_425367_hudba_spm,RECENZE: Méně bývá více. Ondřej Klímek se topí v chtěné pestrosti,"Ondřej Klímek je dechař. Na saxofon či příčnou flétnu hraje v kapelách BSP, Sexy Dancers nebo...",idnes.cz,kultura
https://kultura.zpravy.idnes.cz/sentimentalni-roman-bianca-bellova-recenze-fka-/literatura.aspx?c=A180907_145540_literatura_ts,RECENZE: Sex a smrt. Před Jezerem byla Bellová nesentimentální novelistka,"Bianca Bellová, která před dvěma lety zazářila prózou Jezero, vydává podruhé svoji prvotinu. Kniha...",idnes.cz,kultura
https://kultura.zpravy.idnes.cz/thom-artway-all-i-know-recenze-dk9-/hudba.aspx?c=A180907_142347_hudba_ts,RECENZE: All I Know. Písničkář Thom Artway překročil svůj stín,"VIDEO
				
                Díky své debutové desce Hedgehog dosáhl na dvě ceny Anděl, očekávání od druhého alba tudíž byla...",idnes.cz,kultura
https://kultura.zpravy.idnes.cz/sen-v-cervenem-dome-skutr-divadlo-v-dlouhe-fi1-/divadlo.aspx?c=A180907_093243_divadlo_ts,Smrt otce i plyšový medvěd. Sen v červeném domě vychází z lidské paměti,Panenka s ustřiženou řasou. Malá mořská víla. Čupr Lojzíček. Herci pražského Divadla v Dlouhé se...,idnes.cz,kultura
https://kultura.zpravy.idnes.cz/volyn-film-televizionar-stepan-bandera-fc1-/filmvideo.aspx?c=A180907_143148_filmvideo_ts,"TELEVIZIONÁŘ: Volyň. Masakr, který na Ukrajině zakázali hrát","Je to čirá hrůza. Ani Grizzly zabiják, ani Brána temnoty, ani Země zombií, které jí v sobotním...",idnes.cz,kultura
https://kultura.zpravy.idnes.cz/trailer-toman-ales-prochazka-klement-gottwald-fqd-/filmvideo.aspx?c=A180907_174639_filmvideo_spm,VIDEO: Piju na vítězství! Jak Aleš Procházka hraje Klementa Gottwalda,"VIDEO
				
                Ve filmu Toman si roli Klementa Gottwalda, „největšího masového vraha v našich dějinách“, jak svou...",idnes.cz,kultura
https://kultura.zpravy.idnes.cz/dum-umeleckeho-poltergeista-divadlo-x10-dup-recenze-f87-/divadlo.aspx?c=A180906_151052_divadlo_ts,RECENZE: Genius loci nestačí. Prohlídka strašidelného domu se nepovedla,"Přejete si to strašidelný? ptají se tvůrci představení Dům uměleckého poltergeista, které diváky...",idnes.cz,kultura
https://kultura.zpravy.idnes.cz/glosa-oscar-cxj-/filmvideo.aspx?c=A180907_133825_filmvideo_spm,"GLOSA: Oscar pro nejoblíbenější filmy se odkládá, zato ostuda sílí","VIDEO
				
                Americká filmová akademie se chová jako hloupý kabinet. V srpnu ohlásila zavedení kategorie Oscarů...",idnes.cz,kultura
https://kultura.zpravy.idnes.cz/recenze-serial-tatove-na-tahu-prima-d6f-/filmvideo.aspx?c=A180906_161628_filmvideo_spm,RECENZE: Aspoň Tátové na tahu mají rozum. Nejsnesitelnější nový seriál,"Z podzimních televizních premiér přinášejí zatím nejpříjemnější překvapení Tátové na tahu, které...",idnes.cz,kultura
https://kultura.zpravy.idnes.cz/michael-caine-jan-zizka-07m-/filmvideo.aspx?c=A180906_171431_filmvideo_spm,Držitel dvou Oscarů Michael Caine si zahraje v historickém filmu Jan Žižka,"VIDEO
				
                Britský herec Michael Caine vstoupí do historického filmu Jan Žižka. Po boku Bena Fostera v titulní...",idnes.cz,kultura
https://kultura.zpravy.idnes.cz/zemrel-burt-reynolds-herec-hollywood-polda-a-bandita-pca-/filmvideo.aspx?c=A180906_213712_filmvideo_spm,"Zemřel Burt Reynolds, představitel dobrodruhů a hrdina Hříšných nocí","VIDEO
				
                Ve věku 82 let zemřel americký herec Burt Reynolds, držitel Zlatého glóbu za snímek Hříšné noci....",idnes.cz,kultura
https://kultura.zpravy.idnes.cz/thom-artway-za-scenou-sziget-all-i-know-nova-deska-fvm-/hudba.aspx?c=A180831_135648_hudba_kiz,"Nepotřebuju se překonávat, to je cesta do pekel, řekl Artway Za scénou","VIDEO
				
                Před dvěma lety rádia zaplavil hit I Have No Inspiration z debutové desky Hedgehog zpěváka Thoma...",idnes.cz,kultura
https://kultura.zpravy.idnes.cz/video-jan-palach-triky-06z-/filmvideo.aspx?c=A180906_144832_filmvideo_spm,VIDEO: Aby se tank nepropadl do metra. Jak vznikly triky z Jana Palacha,"VIDEO
				
                Historický film Jan Palach, který vstoupil do kin k padesátému výročí invaze, se odehrává v...",idnes.cz,kultura
https://budejovice.idnes.cz/nahum-tevet-dum-umeni-vystava-sochar-izrael-ceske-budejovice-p5y-/budejovice-zpravy.aspx?c=A180907_115237_budejovice-zpravy_khr,Z Belgie pod Černou věž. Izraelský sochař vystavuje poprvé v Česku,"Vystavoval v Benátkách, Mnichově, Římě, naposledy v belgickém Gentu. Dílo izraelského sochaře...",idnes.cz,kultura
https://kultura.zpravy.idnes.cz/hana-zagorova-ja-nemam-strach-djc-/hudba.aspx?c=A180830_174741_hudba_vha,"VIDEO: Jedna krásnější než druhá, chválí nové písně Hana Zagorová","Pop, šanson a opět skladby mladších autorů od Hynka Tomana ze Support Lesbiens po Radůzu. Taková...",idnes.cz,kultura
https://kultura.zpravy.idnes.cz/prvni-republika-iii-3-serial-recenze-db3-/filmvideo.aspx?c=A180906_094156_filmvideo_ts,RECENZE: Muži tropí hlouposti. Třetí První republika nabídne box i sex,Rodina Valentových se prodrala až do třetí série. První republiku III nasadí ČT od pátku a slibuje...,idnes.cz,kultura
https://kultura.zpravy.idnes.cz/pohadka-viktor-preiss-hodinaruv-ucen-dwo-/filmvideo.aspx?c=A180906_090331_filmvideo_spm,Viktor Preiss se vrací ve filmové pohádce Hodinářův učeň,"U Kamenického Šenova začalo natáčení pohádky Hodinářův učeň, kterou napsala a režíruje Jitka...",idnes.cz,kultura
https://kultura.zpravy.idnes.cz/fina-cokolada-lucie-vondrackova-dnp-/hudba.aspx?c=A180905_145911_hudba_ts,VIDEO: Náš dům se ve tmě ztrácí. Vondráčková nazpívala píseň k pohádce,Ke knižní pohádce Fína Čokoláda nazpívala stejnojmennou píseň zpěvačka Lucie Vondráčková. Skladba...,idnes.cz,kultura
https://kultura.zpravy.idnes.cz/do-kina-vsechno-bude-mcqueen-d1i-/filmvideo.aspx?c=A180903_153845_filmvideo_spm,DO KINA: Ze čtyř novinek jasně vede domácí jízda Všechno bude,"VIDEO
				
                S počátkem školního roku kupodivu chybí novinka pro děti, zato kolekce premiér nabízí horor,...",idnes.cz,kultura
https://budejovice.idnes.cz/stifter-kniha-spisovatel-sberatel-snehu-ffa-/budejovice-zpravy.aspx?c=A180905_425240_budejovice-zpravy_epkub,Chlapcům se zjeví mrtvý kamarád. Štifter napsal román ze starých Budějovic,Historický román s prvky detektivky i mysteriózního thrilleru napsal Jan Štifter. Stejně jako své...,idnes.cz,kultura
https://kultura.zpravy.idnes.cz/video-kralove-zlodeju-0u8-/filmvideo.aspx?c=A180904_152450_filmvideo_spm,"VIDEO: Slepí, hluší, chromí. Gang důchodců spáchal loupež století","VIDEO
				
                Kriminální příběh Králové zlodějů, který do našich kin přijde 18. října, vznikl podle skutečné...",idnes.cz,kultura
https://kultura.zpravy.idnes.cz/hra-o-truny-8-osma-serie-finale-dk3-/filmvideo.aspx?c=A180904_171920_filmvideo_ts,Zima se blíží. A poslední Hra o trůny? Co zatím víme o finále seriálu,Už více než rok čekají televizní fanoušci na pokračování seriálu Hra o trůny. Stanice HBO si s...,idnes.cz,kultura
https://kultura.zpravy.idnes.cz/trailer-beze-stop-0md-/filmvideo.aspx?c=A180905_131005_filmvideo_spm,VIDEO: Toto bude Jan Žižka. Novince Beze stop vévodí Ben Foster,"VIDEO
				
                Americký herec Ben Foster, budoucí představitel Jana Žižky, má hlavní roli ve snímku Beze stop,...",idnes.cz,kultura
https://kultura.zpravy.idnes.cz/lenka-nova-dopisy-nova-deska-ve-dvou-tour-fpw-/hudba.aspx?c=A180905_123609_hudba_ts,Pošlete Lence Nové dopis. Třeba podle něj nachystá píseň na novou desku,"Zpěvačka Lenka Nová pokračuje v sérii koncertů nazvané Ve dvou tour, kde ji doprovází pouze klavír...",idnes.cz,kultura
https://kultura.zpravy.idnes.cz/studio-dva-na-perstyne-mala-scena-dqf-/divadlo.aspx?c=A180905_114454_divadlo_ts,Studio DVA se rozroste o prostor bývalého kina Perštýn,"Studio DVA, jedno z nejoblíbenějších komerčních divadel v Praze, otevírá v říjnu svou Malou scénu....",idnes.cz,kultura
https://kultura.zpravy.idnes.cz/mcqueen-recenze-0jp-/filmvideo.aspx?c=A180905_093701_filmvideo_ts,RECENZE: Spíš temný Vetřelec než lesklé hadříky. Tak viděl svět McQueen,"VIDEO
				
                Život módního návrháře Alexandera McQueena vedl od krejčovských začátků přes proslulost vybojovanou...",idnes.cz,kultura
https://ekonomika.idnes.cz/pentagon-usa-zbrane-umela-inteligence-dxf-/eko-zahranicni.aspx?c=A180910_134648_eko-zahranicni_mato,"Pentagon vyvíjí „přemýšlející“ zbraně, do umělé inteligence investuje miliardy",Americký armádní výzkum využití umělé inteligence dostane v příštích letech významnou finanční...,idnes.cz,ekonomika
https://ekonomika.idnes.cz/dieselgate-manipulace-emise-volkswagen-soud-fmy-/eko-zahranicni.aspx?c=A180910_123513_eko-zahranicni_fih,U německého soudu se hraje o čtvrt bilionu korun za Dieselgate,"V Německu začal ostře sledovaný soud, který může koncern Volkswagen vyjít velmi draho. Společnost...",idnes.cz,ekonomika
https://ekonomika.idnes.cz/temelin-elektrarna-nehoda-09o-/ekonomika.aspx?c=A180910_140503_ekonomika_fih,"Technici v Temelíně přepustili vodu do špatné nádrže, nikoho neohrozili","V jaderné elektrárně Temelín přepustili pracovníci 7. září vodu do jiné nádrže, než kam měla voda...",idnes.cz,ekonomika
https://ekonomika.idnes.cz/cefc-group-china-company-cina-marcela-hrda-pivovary-lobkowicz-predstavenstvo-odstoupeni-gvz-/ekoakcie.aspx?c=A180910_145206_ekoakcie_tanc,Hrdá končí ve vedení české CEFC. Z představenstva odešla z vlastní vůle,Po dvou a půl letech skončila ve vedení české společnosti CEFC Group (Europe) Company čínské...,idnes.cz,ekonomika
https://ekonomika.idnes.cz/ceska-posta-nedostatek-zamestnancu-d66-/ekoakcie.aspx?c=A180910_112625_ekoakcie_svob,"Pošta bojuje s nedostatkem zaměstnanců, mnohdy pracují až dvanáct hodin",Loni opustil Českou poštu každý čtvrtý zaměstnanec. Většinu odradil nízký plat v kombinaci s...,idnes.cz,ekonomika
https://ekonomika.idnes.cz/hluk-letiste-praha-pokuty-09w-/eko-doprava.aspx?c=A180910_110114_eko-doprava_fih,Létají v noci a většími letadly. Letiště Praha začalo trestat za hluk,"VIDEO
				
                V okolí pražského letiště roste hluk vinou některých dopravců. Ti používají například jiná letadla,...",idnes.cz,ekonomika
https://ekonomika.idnes.cz/rusko-bojovy-robot-igorek-kalasnikov-d8z-/eko-zahranicni.aspx?c=A180821_133837_zahranicni_aha,"Kalašnikov představil chodícího bojového robota, dal mu jméno Igorek",DoporučujemeKoncept pohyblivého antropomorfního robota představil na veletrhu Armija 2018 ruský koncern Kalašnikov....,idnes.cz,ekonomika
https://ekonomika.idnes.cz/nezamestnanost-hospodarstvi-srpen-statistika-fr6-/ekonomika.aspx?c=A180910_091055_ekonomika_fih,"Nezaměstnanost stagnuje, míst přibývá. Třetina lidí nepracuje déle než rok","Bez práce bylo v srpnu 230 499 lidí, nejméně od roku 1997. Nezaměstnanost v druhém prázdninovém...",idnes.cz,ekonomika
https://ekonomika.idnes.cz/jack-ma-alibaba-cina-vedeni-09w-/eko-zahranicni.aspx?c=A180910_095922_eko-zahranicni_mato,Výměna v čele internetového gigantu Alibaba. Jack Ma příští rok skončí,"Šéf a spoluzakladatel čínského internetového obchodu Alibaba Jack Ma, jeden z nejbohatších obyvatel...",idnes.cz,ekonomika
https://ekonomika.idnes.cz/regiojet-ztrata-vysledky-jancura-vlaky-f0d-/eko-doprava.aspx?c=A180910_095458_eko-doprava_fih,"Vlaky RegioJet loni prodělaly 36 milionů, třikrát víc než předloni",RegioJet podnikatele Radima Jančury loni na železnici prohloubil ztrátu. Meziročně narostla třikrát...,idnes.cz,ekonomika
https://ekonomika.idnes.cz/autorsky-zakon-smernice-evropska-unie-vydavatele-google-facebook-1c7-/eko_euro.aspx?c=A180909_153309_eko_euro_rts,PŘEHLEDNĚ: Proč se mění pravidla pro využívání obsahu na internetu,"Europoslanci ve středu rozhodnou o podobě směrnice o autorském právu, která má změnit pravidla pro...",idnes.cz,ekonomika
