link,link_text,txt,site,area
https://praha.idnes.cz/dejvice-policie-kuplistvi-nevestinec-obvineni-fl6-/praha-zpravy.aspx?c=A181218_111736_praha-zpravy_rsr,"Kuplíři v Dejvicích provozovali nevěstinec, přišli si na pět milionů",Muže a tři ženy obvinili policisté z kuplířství. Skupina podle kriminalistů provozovala nevěstinec...,idnes.cz,krimi
https://praha.idnes.cz/kladno-ridic-horici-auto-pozar-nehoda-policie-fag-/praha-zpravy.aspx?c=A181218_095731_praha-zpravy_rsr,"VIDEO: Řidič narazil do sloupu a do zdi, od hořící dodávky utekl","Motoristu, který v pondělí večer v Kladně utekl od nehody, hledají policisté. Šofér dodávky vjel na...",idnes.cz,krimi
https://brno.idnes.cz/soud-napadeni-kvitova-brno-zondra-dre-/brno-zpravy.aspx?c=A181218_091255_brno-zpravy_vh,"Soud bude pokračovat i bez Kvitové, tenistku vyslechnou po grandslamu","Soud s mužem obžalovaným z útoku na tenistku Petru Kvitovou bude pokračovat v lednu, přestože...",idnes.cz,krimi
https://praha.idnes.cz/hadka-expartneru-muz-zemrel-nemocnice-pokus-o-vrazdu-policie-haje-strileni-16y-/praha-zpravy.aspx?c=A181218_091528_praha-zpravy_rsr,"Střelec, který zranil expartnerku a chtěl se zabít, zemřel v nemocnici","Muž, který v neděli v pražských Hájích postřelil svoji bývalou partnerku a pak se pokusil o...",idnes.cz,krimi
https://praha.idnes.cz/cernohorec-gang-zadrzeni-policie-video-dyh-/praha-zpravy.aspx?c=A181217_172250_praha-zpravy_zuf,Policie potvrdila zadržení hledaného Černohorce. Ukázala video ze zásahu,"Česká policie potvrdila, že ve středu večer zadržela v Praze pětapadesátiletého muže, na nějž byl v...",idnes.cz,krimi
https://praha.idnes.cz/nehoda-celni-srazka-aut-u-velvar-dva-vrtulniky-zachranari-p3j-/praha-zpravy.aspx?c=A181217_160950_praha-zpravy_rsr,"U Velvar se srazila dvě auta, muž a žena jsou těžce zranění",Vážná nehoda dvou automobilů se stala odpoledne u Velvar na Mělnicku. Při kolizi se těžce zranili...,idnes.cz,krimi
https://praha.idnes.cz/soud-opencard-tomas-hudecek-radni-podminka-rozsudek-fy8-/praha-zpravy.aspx?c=A181217_154737_praha-zpravy_rsr,Rozhořčený exprimátor Hudeček dostal v kauze Opencard znovu podmínku,Městský soud v Praze i napodruhé uložil totožné podmíněné tresty v kauze Opencard a pražských...,idnes.cz,krimi
https://vary.idnes.cz/okresni-soud-cheb-kapelnik-dusan-conka-dzino-vera-bila-pfo-/vary-zpravy.aspx?c=A181217_150307_vary-zpravy_ba,"Chystal comeback Věry Bílé, teď její dvorní kapelník stojí před soudem","Měl to být comeback snů. Romskou zpěvačku Věru Bílou, nad kterou už mnozí zlomili hůl, prý čekal...",idnes.cz,krimi
https://pardubice.idnes.cz/benzinka-cerpaci-stanice-prepadeni-penize-rozhovice-cigarety-pu8-/pardubice-zpravy.aspx?c=A181217_141735_pardubice-zpravy_skn,"VIDEO: Zakuklenec s nožem chtěl peníze a cigarety, pumpařka utrpěla šok",Čerpací stanici v Rozhovicích na Chrudimsku přepadl v neděli večer maskovaný muž s nožem....,idnes.cz,krimi
https://brno.idnes.cz/nehoda-nakladak-restaurace-usnuti-drs-/brno-zpravy.aspx?c=A181217_132239_brno-zpravy_krut,"Řidič náklaďáku při jízdě usnul a vjel do restaurace, naštěstí měla zavřeno",V průjezdu restaurace v Kunštátu na Blanensku dopoledne nechtěně zaparkoval nákladní vůz Tatra....,idnes.cz,krimi
https://kultura.zpravy.idnes.cz/marpo-otakar-iii-02n-/hudba.aspx?c=A181219_141920_hudba_ts,Marpo vydal v třiatřiceti biografii. Děkuje Chinaski a mluví o Lenny,Vzestupy i pády rapera a boxera Marpa líčí opulentní kniha nazvaná Otakar III. Hudebník v ní líčí...,idnes.cz,kultura
https://kultura.zpravy.idnes.cz/komentar-film-nominace-na-oscary-cesky-zastupce-neni-pcq-/filmvideo.aspx?c=A181218_160329_filmvideo_ts,KOMENTÁŘ: Točíme šedesát filmů ročně. Ale Oscary hledají jen jeden,O sošku Oscara za nejlepší neanglicky mluvený film se letos ucházelo 87 filmů. Do devítky...,idnes.cz,kultura
https://kultura.zpravy.idnes.cz/za-scenou-zdenek-zelenka-kouzelnik-zito-vanocni-pohadka-p28-/filmvideo.aspx?c=A181212_114509_filmvideo_kiz,Jaká má být štědrovečerní pohádka? Zdeněk Zelenka bude hostem Za scénou,O štědrovečerní nadílku České televize se letos postaral režisér Zdeněk Zelenka. Jaký bude jeho...,idnes.cz,kultura
https://kultura.zpravy.idnes.cz/zeme-ceska-domov-muj-vrsovicke-divadlo-mana-milan-kacmarcik-p42-/divadlo.aspx?c=A181219_100409_divadlo_ts,Je země česká domov můj? Jsem hrdý Čech? ptá se vršovický vlastenec,"Osud pozapomenutého vršovického občana, který stál u vzniku Československa, nabízí novinka s...",idnes.cz,kultura
https://kultura.zpravy.idnes.cz/traktor-sachoffnice-recenze-d18-/hudba.aspx?c=A181218_170225_hudba_ts,RECENZE: Traktor postavil na Šachoffnici příjemný hard rock i vtípky,"Tvrdá, ale melodická, tak jde ve stručnosti charakterizovat desku, kterou hardrocková kapela...",idnes.cz,kultura
https://kultura.zpravy.idnes.cz/kurator-kniha-pruvodce-umenim-po-praze-galerie-fl7-/literatura.aspx?c=A181218_124851_literatura_kiz,Praha jako jedna velká výstava. Kurátor ukazuje nový pohled na umění,"„Tak dlouho jsme čekali na pořádný přehled pražských galerií, až jsme ho napsali sami,“ říkají...",idnes.cz,kultura
https://kultura.zpravy.idnes.cz/80-vyroci-rychlych-sipu-jaroslav-foglar-kviz-fmf-/literatura.aspx?c=A180814_150132_literatura_jan,"KVÍZ: Jak znáte Rychlé šípy a Jaroslava Foglara, plantážníci?","DoporučujemeMirek Dušín, Jarka Metelka, Jindra Hojer, Červenáček a Rychlonožka. Příběhům Rychlých šípů od Jaroslava...",idnes.cz,kultura
https://vstupenky.idnes.cz/fenomenalni-kytarista-slash-predstavi-v-o2-arene-novou-desku-p5i-/ticket.aspx?c=A181214_113043_ticket_kov,Fenomenální kytarista Slash představí v O2 areně novou desku,DoporučujemeSlavný kytarista skupiny Guns N' Roses Slash vydal v září sólovou desku Living The Dream. Představí ji...,idnes.cz,kultura
https://kultura.zpravy.idnes.cz/kapela-zrni-spici-zpevnik-09j-/hudba.aspx?c=A181218_123211_hudba_ts,"Já, Zrní. Sami si nepamatujeme starší písničky, vysvětluje kapela zpěvník","Kapela Zrní má novou nahrávku s názvem Spící, konkrétně je to EP tematicky navazující na předchozí...",idnes.cz,kultura
https://kultura.zpravy.idnes.cz/mary-poppins-se-vraci-recenze-d2u-/filmvideo.aspx?c=A181218_100631_filmvideo_ts,RECENZE: Mary Poppins je zpět. Muzikál z jiných časů asi točili labouristé,"Tančí, zpívá a čaruje stejně přirozeně jako v roce 1964, kdy kouzelná chůva se svým deštníkem...",idnes.cz,kultura
https://kultura.zpravy.idnes.cz/revizor-ales-prochazka-divadlo-na-vinohradech-f4z-/divadlo.aspx?c=A181218_113448_divadlo_ts,"Po revoluci by mě nenapadlo, že Revizora bude opět třeba, říká Procházka","Po třiceti letech se herec Aleš Procházka vrací do Gogolova Revizora, v pražském Divadle na...",idnes.cz,kultura
https://kultura.zpravy.idnes.cz/the-doors-hollywood-bowl-film-d2y-/hudba.aspx?c=A181217_163607_hudba_vha,VIDEO: Jediný a jedinečný. Do kin míří záznam koncertu The Doors,Po padesáti letech od samotné události a třicet let od prvního vydání se vrací koncertní záznam The...,idnes.cz,kultura
https://kultura.zpravy.idnes.cz/roma-recenze-alfonso-cuaron-dp6-/filmvideo.aspx?c=A181217_140929_filmvideo_ts,RECENZE: Jedním slovem síla. Roma je velký film z malé obrazovky,"Oscarový tvůrce Alfonso Cuarón se vrátil k podstatě. Ke svému dětství v Mexiku, k rodnému jazyku,...",idnes.cz,kultura
https://kultura.zpravy.idnes.cz/vsechno-bude-film-nominace-oscar-dah-/filmvideo.aspx?c=A181218_060015_filmvideo_spm,Český snímek Všechno bude neprošel do výběru na cizojazyčného Oscara,Český snímek Všechno bude od režiséra Olma Omerzua se do užší nominace na Oscary v kategorii...,idnes.cz,kultura
https://kultura.zpravy.idnes.cz/navrat-krale-sumavy-komiks-vojtech-masek-karel-osoha-labyrint-pbm-/literatura.aspx?c=A181217_150203_literatura_kiz,RECENZE: Návrat krále Šumavy v komiksu skvěle navazuje. Připomíná Hasila,V pražském Labyrintu vyšel první díl komiksové trilogie Návrat krále Šumavy. Kniha realizovaná...,idnes.cz,kultura
https://kultura.zpravy.idnes.cz/cesky-atlas-recenze-04n-/literatura.aspx?c=A181217_121326_literatura_ts,"RECENZE: Český atlas ví, kde je Lavička neřesti a v Ostravě sopka",Posledním dílem věnovaným severní Moravě a Slezsku končí dlouholetý projekt Český atlas. Veledílo...,idnes.cz,kultura
https://kultura.zpravy.idnes.cz/za-scenou-jiri-dvorak-stardance-lenka-nora-navorkova-pcz-/filmvideo.aspx?c=A181216_161339_filmvideo_kiz,"Nechtěl jsem, aby mě po parketu honili s bičem, řekl vítěz StarDance","Ač se bál, že po náročném tanečním půlroce nevstane, dorazil nakonec čerstvý vítěz letošní...",idnes.cz,kultura
https://kultura.zpravy.idnes.cz/ariana-grande-praha-2019-0ts-/hudba.aspx?c=A181217_123552_hudba_vha,Popová hvězda Ariana Grande přiveze v září 2019 novinky i hity,"Americká zpěvačka Ariana Grande ohlásila světové turné, na které v příštím roce vyjede na podporu...",idnes.cz,kultura
https://kultura.zpravy.idnes.cz/zebrik-kin-aquaman-0nj-/filmvideo.aspx?c=A181217_133136_filmvideo_spm,"Freddieho Mercuryho sesadil z trůnu až Aquaman, našel 76 tisíc diváků",Kralování snímku Bohemian Rhapsody věnovaného Freddiemu Mercurymu ze skupiny Queen ukončil v Česku...,idnes.cz,kultura
https://kultura.zpravy.idnes.cz/divine-attraction-atmosphere-klip-d5v-/hudba.aspx?c=A181217_111216_hudba_vha,VIDEO: V Česku usazení Američané Divine Attraction míří do atmosféry,Poprockové experimentální duo Divine Attraction z Los Angeles působí dlouhodobě v Česku. Po kladně...,idnes.cz,kultura
https://kultura.zpravy.idnes.cz/ceskoslovensky-beat-fest-2018-dpx-/hudba.aspx?c=A181217_091549_hudba_vha,GLOSA: Veteráni i naděje bigbítu doputovali do Lucerny ze Slovenska,Byl to hodně vzpomínkový večer – hrály se písně Rolling Stones i rokenroly z padesátých let....,idnes.cz,kultura
https://kultura.zpravy.idnes.cz/trailer-jak-vycvicit-draka-3-dp0-/filmvideo.aspx?c=A181216_152257_filmvideo_spm,VIDEO: Utřete toho draka! Hrdina Hry o trůny baví v nevšední upoutávce,"Místo běžných sestřihů zve na film Jak vycvičit draka 3 vtipný skeč, v němž Kit Harington propojil...",idnes.cz,kultura
https://kultura.zpravy.idnes.cz/bill-burr-komik-v-praze-praha-vystoupeni-ffy-/divadlo.aspx?c=A181214_155613_divadlo_ts,"V padesáti se nechovejte jako čtyřicátníci, poradí v Praze komik Bill Burr",Časopis Rolling Stone jej označuje za jednoho z nejlepších komiků všech dob. Zda je to skutečně...,idnes.cz,kultura
https://pardubice.idnes.cz/peckova-starosta-chrudim-festival-pilny-ffr-/pardubice-zpravy.aspx?c=A181217_445901_pardubice-zpravy_skn,"Chrudimský festival je v ohrožení, pěvkyně Pecková čeká na omluvu","Po dvou ročnících možná skončí v Chrudimi festival Zlatá Pecka, který založila operní pěvkyně...",idnes.cz,kultura
https://kultura.zpravy.idnes.cz/metropolitni-opera-la-traviata-d3d-/hudba.aspx?c=A181216_125825_hudba_era,"RECENZE: Drogy si newyorská „Zbloudilá“ nepíchá, ale zato padla do kýče","Trochu připomíná Meryl Streepovou a navíc zpívá, přirozeně lépe než Božská Florence. Řeč je o...",idnes.cz,kultura
https://kultura.zpravy.idnes.cz/julius-satinsky-gundzovnik-magazin-slovart-kniha-fwp-/literatura.aspx?c=A181214_144843_literatura_kiz,"Dášeňka mě odmítla, píše Satinský ve svých klebetnících","Herec Július Satinský byl talentovaným psavcem. Psal si scénky, přispíval do časopisů. Jeden...",idnes.cz,kultura
https://kultura.zpravy.idnes.cz/mary-poppins-se-vraci-muzikal-film-dtg-/filmvideo.aspx?c=A181214_135551_filmvideo_ts,Návrat Disneyho legendy. Zpívající Mary Poppins znovu létá nad zemí,"Ještě před premiérou si muzikál Mary Poppins se vrací připsal rekord: 54 roků, jež uplynuly od...",idnes.cz,kultura
https://kultura.zpravy.idnes.cz/jelen-forum-karlin-michal-tucny-misa-tucna-koncert-recenze-par-/hudba.aspx?c=A181216_022428_hudba_vha,RECENZE: Pověste ho vejš! Jelen důstojně uctil Michala Tučného,Kromě vlastních hitů byla hlavním tahákem v sobotu zakončeného turné kapely Jelen vzpomínka na...,idnes.cz,kultura
https://kultura.zpravy.idnes.cz/bruce-springsteen-on-broadway-netflix-dha-/hudba.aspx?c=A181214_120644_hudba_vha,Springsteen a jeho show z Broadwaye míří na obrazovky počítačů,Bruce Springsteen v sobotu zazpíval a zahrál poslední tisícovce diváků intimní show v broadwayském...,idnes.cz,kultura
https://kultura.zpravy.idnes.cz/evropske-filmove-ceny-studena-valka-d7j-/filmvideo.aspx?c=A181215_202829_filmvideo_spm,"Evropským filmem roku je polská Studená válka, čestnou cenu má Fiennes","Evropským filmem roku se stala polská romance Studená válka, herecké ceny mají Marcello Fonte a...",idnes.cz,kultura
https://kultura.zpravy.idnes.cz/mariah-carey-caution-recenze-dgh-/hudba.aspx?c=A181214_153337_hudba_ts,RECENZE: Zpěvačka i autorka. Mariah Carey je stále hudebním úkazem,"Albová novinka americké zpěvačky Mariah Carey možná není přelomovou deskou, ale přináší několik...",idnes.cz,kultura
https://kultura.zpravy.idnes.cz/navsteva-recenze-narodni-divadlo-nova-scena-david-prachar-emil-hakl-1f5-/divadlo.aspx?c=A181214_132645_divadlo_ts,RECENZE: Čtyři umaštěné trosky dokázaly na Novou scénu dostat herectví,"Paranoia je od toho, aby člověk viděl realisticky. Dokumentovat samotu mne dvakrát nebaví....",idnes.cz,kultura
https://kultura.zpravy.idnes.cz/televizionar-dabel-se-tremi-zlatymi-vlasy-fjp-/filmvideo.aspx?c=A181214_115322_filmvideo_ts,TELEVIZIONÁŘ: Popelce předchází hodně chabý Ďábel se třemi zlatými vlasy,"Ještě si jich užijeme dost a dost, nicméně máme už půlku prosince a tradiční Tři oříšky pro Popelku...",idnes.cz,kultura
https://kultura.zpravy.idnes.cz/harry-potter-zeman-parodie-video-michal-orsava-fln-/filmvideo.aspx?c=A181214_170737_filmvideo_kiz,VIDEO: Takto se točila parodie na Harryho Pottera se Zemanem a Babišem,Hitem internetu se stalo video autorů Michala Orsavy a Michaely Lovecké. Jejich parodie na Harryho...,idnes.cz,kultura
https://kultura.zpravy.idnes.cz/anketa-nejlepsi-vanocni-pohadka-25-let-stedrovecerni-premiera-p5y-/filmvideo.aspx?c=A181204_140849_filmvideo_ts,Projděte si všechny štědrovečerní pohádky za posledních pětadvacet let,"Novodobou tradici, podle níž každý Štědrý večer vysílá vlastní či koprodukční premiérovou pohádku,...",idnes.cz,kultura
https://vstupenky.idnes.cz/sergei-polunin-ve-sve-choreografii-a-ve-scene-davida-lachapella-p7n-/ticket.aspx?c=A181218_165148_ticket_kov,Sergei Polunin ve své choreografii a ve scéně Davida LaChapella,"Světová baletní superstar Sergei Polunin uvede poprvé v Praze své představení Satori, k němuž sám...",idnes.cz,kultura
https://vstupenky.idnes.cz/titanic-vystava-brno-05k-/doporucene.aspx?c=A181217_183039_ticket-doporucene_kov,TITANIC výstava Brno,,idnes.cz,kultura
https://vstupenky.idnes.cz/lords-of-the-sounds-privazi-muziku-z-fantasy-filmu-serialu-a-her-p8y-/doporucene.aspx?c=A181217_143041_ticket-doporucene_kov,"Lords Of The Sounds přiváží muziku z fantasy filmů, seriálů a her",Slavný symfonický orchestr Lords Of The Sounds vystoupí v dubnu na pěti místech v Česku s novým...,idnes.cz,kultura
https://ekonomika.idnes.cz/nezdrave-jidlo-u-pokladen-vyzkum-d49-/eko-zahranicni.aspx?c=A181219_095602_eko-zahranicni_nio,"Když ho nenajdou u pokladen, nezdravé jídlo lidé nekoupí, tvrdí průzkum","Pokud supermarkety nestrkají sladkosti a brambůrky lidem pod nos do regálů u pokladen, zákazníci...",idnes.cz,ekonomika
https://ekonomika.idnes.cz/hazard-ministerstvo-financi-dohled-kontrola-zakazka-pcw-/ekonomika.aspx?c=A181219_142527_ekonomika_rts,"Ministerstvo má smlouvu na velkého bratra pro hazard. Po 2,5letém snažení","IT systém pro dohled nad hazardem bude centrálně shromažďovat informace o tom, kdo kolik, kde a kdy...",idnes.cz,ekonomika
https://ekonomika.idnes.cz/brcka-plast-papir-test-069-/ekonomika.aspx?c=A181218_170810_ekonomika_rts,"VIDEO: Z papíru, škrobu i slámy. Testovali jsme náhrady plastových brček",Zákaz plastových brček v Evropě se blíží. Některé podniky je ale začaly nahrazovat ekologičtějšími...,idnes.cz,ekonomika
https://zpravy.idnes.cz/snemovna-rozpocet-2019-vlada-d0h-/domaci.aspx?c=A181219_045813_domaci_kop,"Školství jako priorita? Pokrytectví, rozzlobila se exministryně Valachová","Přímý přenos
                Zákon roku, státní rozpočet na rok 2019 s plánovaným schodkem 40 miliard korun, schvalují ve středu...",idnes.cz,ekonomika
https://ekonomika.idnes.cz/musk-tesla-tunel-doprava-los-angeles-spacex-hyperloop-pp6-/eko-zahranicni.aspx?c=A181219_090506_eko-zahranicni_mato,"Musk představil svou podzemní dálnici, má vyřešit dopravu v Los Angeles",Americký miliardář Elon Musk v Los Angeles představil svůj testovací tunel pro vysokorychlostní...,idnes.cz,ekonomika
https://brno.idnes.cz/zetor-propousteni-zamestnanci-delnici-zajem-firmy-prace-zamestnanost-duchod-1xs-/brno-zpravy.aspx?c=A181219_446411_brno-zpravy_krut,"Firmy mají zájem o lidi propuštěné ze Zetoru, nabídky už se hrnou","Zaměstnanci, které na konci ledna začne propouštět brněnská společnost Zetor, by měli najít práci...",idnes.cz,ekonomika
https://wiki.idnes.cz/oteviraci-doba-o-svatcich-0hx-/byznys.aspx?klic=456717,Otevírací doba obchodů o svátcích,"DoporučujemeZákon o prodejní době v maloobchodě a velkoobchodě nařizuje, že obchody s plochou nad 200 m² musí mít...",idnes.cz,ekonomika
https://ekonomika.idnes.cz/pet-lahev-plast-odpad-recyklace-trideni-fc1-/ekonomika.aspx?c=A181218_202424_ekonomika_mato,Vratné PET lahve. Firmy zkoušejí zdokonalit recyklaci plastových obalů,"Evropská směrnice o omezení jednorázových plastů bude zřejmě od členských zemí požadovat, aby do...",idnes.cz,ekonomika
https://ekonomika.idnes.cz/autoskola-cena-komisar-doprava-ridicsky-prukaz-ridicak-piy-/eko-doprava.aspx?c=A181218_446032_eko-doprava_rts,Česko jako továrna na řidičáky. Tuzemské průkazy jsou za hubičku,České autoškoly patří v rámci Evropy k nejlacinějším. Cena běžného kurzu pro absolvování řidičského...,idnes.cz,ekonomika
https://ekonomika.idnes.cz/cina-muslimove-tabory-prace-usa-dng-/eko-zahranicni.aspx?c=A181218_152542_eko-zahranicni_rts,Muslimové šijí v čínských táborech sportovní oblečení pro USA. Nedobrovolně,Čína nutí příslušníky muslimských menšin šít v internačních táborech v otrockých podmínkách...,idnes.cz,ekonomika
https://ekonomika.idnes.cz/ceske-drahy-platy-mzdy-odbory-d2s-/ekoakcie.aspx?c=A181218_160913_ekoakcie_rts,"Strojvůdci a další zaměstnanci ČD dostanou přidáno 5,5 procenta","České dráhy zvýší příští rok svým zaměstnancům mzdy o 5,5 procenta. Vzrůst by měly i některé...",idnes.cz,ekonomika
https://ekonomika.idnes.cz/d1-oprava-zakazka-tendr-vysocina-doprava-fdt-/eko-doprava.aspx?c=A181218_122708_eko-doprava_cfr,Na D1 u Humpolce se dělníci vrátí nejdříve v létě. Bude nová soutěž,Nová stavební firma se na rozestavěné dálnici D1 mezi Humpolcem a Větrným Jeníkovem objeví nejdříve...,idnes.cz,ekonomika
https://ekonomika.idnes.cz/brexit-dohoda-cesko-obchod-evropska-unie-ffn-/eko-zahranicni.aspx?c=A181217_183408_eko-zahranicni_rts,PŘEHLEDNĚ: Čtyři scénáře brexitu pro české firmy. Ani jeden není dobrý,"Jen 101 dnů zbývá, než Velká Británie opustí Evropskou unii. Stále však není jasné, jak rozvod...",idnes.cz,ekonomika
https://ekonomika.idnes.cz/booking-pokuta-nekala-soutez-uohs-urad-pro-kontrolu-hospodarske-souteze-1lh-/ekoakcie.aspx?c=A181218_130438_ekoakcie_rts,"Portál Booking.com zvýhodňoval sám sebe. Dostane pokutu 8,3 milionu","Úřad pro ochranu hospodářské soutěže uložil portálu pro rezervaci ubytování Booking.com pokutu 8,3...",idnes.cz,ekonomika
https://ekonomika.idnes.cz/zetor-problemy-vyroba-autoprumysl-d65-/ekoakcie.aspx?c=A181218_101738_ekoakcie_fih,Zetor má problémy. Výrobce traktorů propouští stovky lidí,Brněnský Zetor propustí do konce března čtyřicet procent zaměstnanců. Do potíží se slavná brněnská...,idnes.cz,ekonomika
https://ekonomika.idnes.cz/silnicari-rsd-dalnice-d1-oprava-dzg-/eko-doprava.aspx?c=A181218_081901_eko-doprava_fih,Stavbaři z problémového úseku D1 odstoupili od smlouvy s ŘSD,"Firmy, které opravují nejdelší modernizovaný úsek dálnice D1 mezi Humpolcem a Větrným Jeníkovem,...",idnes.cz,ekonomika
https://ekonomika.idnes.cz/billboardy-dalnice-zakazane-odstraneni-reklama-silnicari-ministerstvo-dopravy-gdt-/ekonomika.aspx?c=A181218_064349_ekonomika_pmk,"Silnice a dálnice stále lemují billboardy, někde jich dokonce přibývá",V okolí tuzemských dálnic a silnic první třídy stále zůstává více než tisícovka nelegálních...,idnes.cz,ekonomika
https://ekonomika.idnes.cz/test-rychlost-nakupu-e-shop-skener-scan-go-click-go-f8c-/test.aspx?c=A181211_151603_test_jan,"TEST DNES: E-shop ušetří při nakupování čas, skener v hypermarketu nervy","Před Vánocemi na nákupy dárků a potravin vyplýtváme tolik času, že se hodí každý uspořený okamžik....",idnes.cz,ekonomika
https://ekonomika.idnes.cz/rychlovlaky-sinkanzen-draha-koleje-brno-breclav-szdc-p0w-/eko-doprava.aspx?c=A181217_445807_eko-doprava_rts,"Brněnský šinkanzen naráží na soláry, SŽDC neuhlídala ochranu rychlostní trati",Správci železnic objevili při přípravě jednoho ze tří pilotních úseků vysokorychlostních tratí...,idnes.cz,ekonomika
https://zpravy.idnes.cz/babis-afrika-eu-nigerie-ekonomika-videnske-forum-rwanda-kagame-p6x-/zahranicni.aspx?c=A181218_101336_zahranicni_luka,"Babiš jednal se zástupci Afriky, vidí pro české firmy velký potenciál","(Od zpravodaje iDNES.cz) 
                Vrcholem vídeňského Fóra EU-Afrika bylo pro Česko dvoustranné jednání premiéra Andreje Babiše s...",idnes.cz,ekonomika
https://ekonomika.idnes.cz/island-turismus-cestovni-ruch-krize-dluhopis-aerolinky-pk4-/eko-zahranicni.aspx?c=A181217_171517_eko-zahranicni_mato,Island ohrožuje turistická bublina. Klíčový sektor stagnuje,Deset let po finančním kolapsu způsobeném finanční krizí se nad severskou zemí opět stahují mračna....,idnes.cz,ekonomika
https://ekonomika.idnes.cz/prace-zamestnani-benefit-pracovni-doba-tyden-odbory-fya-/eko-zahranicni.aspx?c=A181217_143536_eko-zahranicni_mato,Méně stresu a vyhoření. Firmy zkoušejí čtyřdenní pracovní týden,"Pro mnohé zaměstnance to zní jako utopie, světové firmy však čím dál tím víc experimentují se...",idnes.cz,ekonomika
https://ekonomika.idnes.cz/financni-zprava-podvod-emaily-ministerstvo-financi-fyz-/ekonomika.aspx?c=A181217_171238_ekonomika_rts,Podvodníci v Plzeňském kraji se vydávají za berňák. Chtějí po lidech peníze,"Plzeňským krajem se se šíří e-maily, které se tváří jako oficiální obsílka finančních úřadů. Dopis...",idnes.cz,ekonomika
https://ekonomika.idnes.cz/dopravni-podnik-praha-metro-vystavba-zakazka-fa5-/ekoakcie.aspx?c=A181217_142559_ekoakcie_rts,Příprava metra D se mohla prodražit o 58 milionů. Radní sporný dodatek stopli,"Dopravní podnik hlavního města Prahy (DPP) měl v pondělí projednával dokument, který by prodražil...",idnes.cz,ekonomika
https://ekonomika.idnes.cz/vanocni-darky-amazon-distribuce-stavka-zamestnanci-fhw-/ekoakcie.aspx?c=A181217_151203_ekoakcie_jn,Vánoční dárky v ohrožení. Německá distribuční centra Amazonu stávkují,Teď by se hodil Santa Claus s rychlým spřežením sobů. Zaměstnanci dvou německých distribučních...,idnes.cz,ekonomika
https://ekonomika.idnes.cz/rakousko-afrika-eu-cesko-babis-vlada-obchod-digitalizace-p24-/eko-zahranicni.aspx?c=A181217_100525_zahranicni_luka,"EU pozvedne obchod s Afrikou, Babiš a české firmy vyrážejí do Vídně","(Od  zvláštního zpravodaje iDNES.cz)
                Digitalizace a inovace budou středobodem úterního fóra ve Vídni, kde se stovky podnikatelů i...",idnes.cz,ekonomika
https://ekonomika.idnes.cz/d1-kolaps-oprava-tok-doprava-dalnice-pruh-ffo-/eko-doprava.aspx?c=A181217_090457_eko-doprava_mato,"Problémový úsek D1 se rozšíří o jeden pruh, dokončí ho jiná firma",Ředitelství silnic a dálnic (ŘSD) kvůli zpoždění prací na opravovaném úseku D1 mezi Humpolcem na...,idnes.cz,ekonomika
https://ekonomika.idnes.cz/pracovni-trh-nezamestnanost-nemecko-ekonomika-rust-benefity-pu2-/eko-zahranicni.aspx?c=A181216_130922_eko-zahranicni_mato,Nemá kdo obsluhovat. Německo bojuje s rekordním nedostatkem pracovníků,"Německo se potýká s rekordním nedostatkem zaměstnanců, v zemi je několik set tisíc volných...",idnes.cz,ekonomika
https://ekonomika.idnes.cz/trh-knihy-nakladatele-spojeni-dke-/ekonomika.aspx?c=A181216_210521_ekonomika_bur,"Na trhu s knihami se točí miliardy. Nakladatelé se spojují, aby obstáli","Ještě rok poté, co druhé největší nakladatelství Euromedia Group a jednička mezi knižními sítěmi...",idnes.cz,ekonomika
https://ekonomika.idnes.cz/hracky-cesko-svetova-velmoc-d11-/ekonomika.aspx?c=A181217_135848_ekonomika_jn,"Stavebnice, panenky, modely. Česko je evropskou hračkářskou velmocí",Česká republika je největším vývozcem hraček v Evropě. Hodnota jejich exportu dosahuje dvou miliard...,idnes.cz,ekonomika
