link,link_text,txt,site,area
https://www.lidovky.cz/domov/babis-navrhne-aby-cesko-nepodepsalo-pakt-osn-podle-nej-stira-rozdily-mezi-legalni-a-nelegalni-migraci.A181101_162939_ln_domov_ele,"Babiš navrhne, aby Česko nepodepsalo globální pakt OSN o migraci","Premiér Andrej Babiš (ANO) bude navrhovat, aby Česko po vzoru Maďarska a Rakouska nepřistoupilo ke globálnímu paktu Organizace spojených národů (OSN)...",lidovky.cz,domov
https://www.lidovky.cz/domov/fotky-jako-dukaz-dokumentace-k-mostu-na-vltavske-se-neztratila-tvrdi-tsk-praha.A181101_160332_ln_domov_tn,"Fotky jako důkaz. Dokumentace k mostu na Vltavské se neztratila, tvrdí TSK Praha",Pražská Technická správa komunikací (TSK) popřela středeční vyjádření čestného předsedy České komory autorizovaných inženýrů a techniků ve výstavbě...,lidovky.cz,domov
https://www.lidovky.cz/domov/video-hazard-na-silnici-agresivni-vybrzdovac-v-rychlosti-zablokoval-smykem-jizdni-pruh.A181101_141249_ln_domov_rsa,VIDEO: Hazard na silnici. Agresivní ‚vybržďovač‘ v rychlosti zablokoval smykem jízdní pruh,"Stačilo zatroubení na kruhovém objezdu. Řidiče, jemuž nebylo ani určeno, vyprovokovalo natolik, že cíleně ohrožoval ostatní účastníky provozu....",lidovky.cz,domov
https://www.lidovky.cz/domov/policie-vysetruje-vrazdu-dvou-zen-na-pisecku-nikomu-dalsimu-udajne-nebezpeci-nehrozi.A181101_150147_ln_domov_tn,"Policie vyšetřuje vraždu dvou žen na Písecku, nikomu dalšímu údajně nebezpečí nehrozí","Jihočeští kriminalisté vyšetřují od čtvrtečního rána vraždu dvou dospělých žen. Jejich těla lidé našli u obce Bor u Protivína na Písecku, uvedl...",lidovky.cz,domov
https://www.lidovky.cz/domov/soud-potvrdil-bartosovi-podminku-za-protizidovske-texty-a-projevy.A181101_144014_ln_domov_ssu,Soud potvrdil Bartošovi podmínku za protižidovské texty a projevy,Odvolací pražský městský soud ve čtvrtek uložil předsedovi krajně pravicové Národní demokracie Adamu B. Bartošovi dvouletý podmíněný trest s tříletou...,lidovky.cz,domov
https://www.lidovky.cz/domov/hnuti-duha-si-stezuje-na-dodatecne-podminky-grantu-vyzadujici-jeho-nekriticnost.A181101_134919_ln_domov_ssu,"Ministerstvo chce schvalovat naše zprávy a materiály, stěžuje si na granty Hnutí Duha","Hnutí Duha uvedlo, že mu ministerstvo životního prostředí (MŽP) ukládá v rozhodnutí o přidělení grantu podmínky omezující nezávislost a vyjadřování...",lidovky.cz,domov
https://www.lidovky.cz/domov/sef-bernaku-janecek-rezignoval-na-funkci-skonci-na-konci-prosince.A181101_094711_ln_domov_ssu,"Šéf ‚berňáku‘ Janeček rezignoval na funkci, skončí na konci prosince","Generální ředitel Finanční správy Martin Janeček požádal o odvolání, skončit chce k letošnímu 27. prosinci. Ministryně financí Alena Schillerová (za...",lidovky.cz,domov
https://www.lidovky.cz/novinari/jan-horak.N3890,Jan Horák,"Prezident Miloš Zeman se naposledy ukázal v Poslanecké sněmovně minulý týden, vyrazil tam podpořit vládu při projednávání státního rozpočtu. Tento...",lidovky.cz,domov
https://www.lidovky.cz/domov/pirati-v-brne-schvalili-koalicni-smlouvu-s-ods-kdu-csl-a-cssd.A181101_121221_ln_domov_ssu,Piráti v Brně schválili koaliční smlouvu. Primátorkou bude Vaňková,"Piráti v Brně schválili hlasováním v členské základně koaliční smlouvu s ODS, KDU-ČSL a ČSSD. Vyplývá to z diskusního fóra Pirátů. Dvoudenní...",lidovky.cz,domov
https://www.lidovky.cz/domov/vanocni-strom-na-staromestskem-namesti-bude-z-liberecka.A181101_112931_ln_domov_ssu,Vánoční strom na Staroměstském náměstí bude z Liberecka,"Na pražském Staroměstském náměstí bude stát vánoční strom z Rynoltic v Libereckém kraji. Organizátoři jej vybrali ze tří desítek stromů, které...",lidovky.cz,domov
https://sport.lidovky.cz/litvinov-potreti-za-sebou-nebodoval-tentokrat-doma-podlehl-pardubicim-13i-/hokej.aspx?c=A181103_174638_ln-sport-hokej_dak,Litvínov potřetí za sebou nebodoval. Tentokrát doma podlehl Pardubicím,Hokejisté Litvínova podlehli v dohrávce 16. kola extraligy doma Pardubicím 3:4 a potřetí za sebou nebodovali. Dynamo naopak vyhrálo druhý ze tří...,lidovky.cz,sport
https://sport.lidovky.cz/plzen-vydrela-vyhru-nad-banikem-ten-nepromenil-penaltu-pim-/fotbal.aspx?c=A181103_165952_ln-sport-fotbal_dak,"Plzeň vydřela výhru nad Baníkem, ten neproměnil penaltu",Fotbalisté Plzně vyhráli ve 14. ligovém kole v Ostravě 1:0 a oplatili soupeři středeční vyřazení v osmifinále domácího poháru. Bojovný zápas rozhodl...,lidovky.cz,sport
https://sport.lidovky.cz/mladicka-bilesova-je-pred-dalsim-milnikem-muze-byt-rekordni-drzitelkou-medaili-19u-/ostatni-sporty.aspx?c=A181103_161040_ln-sport-ostatni_dak,Mladičká Bilesová je před dalším milníkem. Může být rekordní držitelkou medailí,"Američanka Simone Bilesová vyhrála na mistrovství světa ve sportovní gymnastice po soutěžích družstev, víceboji a přeskoku i prostná a svou rekordní...",lidovky.cz,sport
//www.lidovky.cz/novinar.aspx?idnov=115,Jaroslav Tomas,"Česká extraliga nemá kvalitu a nejsou v ní hráči, kteří by si zasloužili nominaci do národního týmu. Ostrá slova nového reprezentační kouče Miloše...",lidovky.cz,sport
https://sport.lidovky.cz/muj-agent-dostava-nove-nabidky-uvidime-jak-se-moje-fotbalova-kariera-vyvine-zu-1hr-/fotbal.aspx?c=A181103_132142_ln-sport-fotbal_dak,"Můj agent dostává nové nabídky. Uvidíme, jak se moje fotbalová kariéra vyvine, zůstává Bolt tajemný","Usain Bolt se nehodlá vzdát snu o kariéře profesionálního fotbalisty, i když v pátek definitivně sešlo z jeho angažmá v australském ligovém klubu...",lidovky.cz,sport
https://sport.lidovky.cz/infantino-mel-pomahat-bohatym-klubum-k-prominuti-trestu-tvrdi-football-leaks-1x5-/fotbal.aspx?c=A181103_120455_ln-sport-fotbal_dak,"Infantino měl pomáhat bohatým klubům k prominutí trestů, tvrdí Football Leaks",Šéf světového fotbalu Gianni Infantino údajně ještě v době svého působení v evropské unii UEFA pomohl bohatým klubům Manchesteru City a Paris...,lidovky.cz,sport
//www.lidovky.cz/novinar.aspx?idnov=3709,Jaroslav Šindelář,"Pokud by platila stará pravda o tom, že derby pražských S favorit nevyhrává, zítřejší 290. klání Sparty a Slavie by ovládl domácí tým z Letné. Slavia...",lidovky.cz,sport
https://sport.lidovky.cz/hapal-bude-s-tak-nizkym-platem-slovenskym-zbohatlikum-pro-srandu-zlobi-se-golonka-gjm-/fotbal.aspx?c=A181102_145359_ln-sport-fotbal_lar,"Hapal bude s tak nízkým platem slovenským zbohatlíkům pro srandu, zlobí se Golonka","Slovenská média v tomto týdnu odhalila, že Pavel Hapal bude v novém angažmá na lavičce slovenské fotbalové reprezentace měsíčně brát 15 tisíc eur...",lidovky.cz,sport
https://sport.lidovky.cz/real-navrhuje-top-tymum-odtrzeni-od-uefa-a-zalozeni-vlastni-superligy-1zb-/fotbal.aspx?c=A181102_212044_ln-sport-fotbal_lar,Real navrhuje top týmům odtržení od UEFA a založení vlastní Superligy,"Německý deník Der Spiegel přišel v pátek se zprávou, že 16 evropských klubů obnovilo myšlenku účastnit se po vzoru basketbalové Euroligy vlastní...",lidovky.cz,sport
https://sport.lidovky.cz/liberec-se-dostal-do-cela-extraligy-tu-vede-spolu-se-spartou-a-hradcem-12g-/hokej.aspx?c=A181102_203912_ln-sport-hokej_lar,"Liberec se dostal do čela extraligy, tu vede spolu se Spartou a Hradcem","Hokejisté Liberce zvítězili v 16. kole extraligy nad posledním Chomutovem 2:1 a vyhoupli se do čela tabulky, kterou vedou o skóre před druhou Spartou...",lidovky.cz,sport
https://sport.lidovky.cz/bohemians-podruhe-za-sebou-prohrali-proti-teplicim-neudrzeli-vedeni-2-1-1mi-/fotbal.aspx?c=A181102_195356_ln-sport-fotbal_lar,Bohemians podruhé za sebou prohráli. Proti Teplicím neudrželi vedení 2:1,"Fotbalisté Bohemians 1905 nedokázali ani pošesté v řadě zvítězit na svém hřišti. Ve 14. kole Fortuna ligy sice vedli po poločase nad Teplicemi 2:1,...",lidovky.cz,sport
//www.lidovky.cz/novinar.aspx?idnov=3850,Tomáš Zatloukal,"Tentokrát opravdu přijel, neskrečoval svou cestu do Prahy jako před osmi lety. Legendární boxer Mike Tyson podruhé navštívil Česko. Skalní fandy v...",lidovky.cz,sport
https://sport.lidovky.cz/zlaty-dul-pro-nhl-v-americe-se-konecne-bude-moci-legalne-sazet-na-zapasy-1mq-/hokej.aspx?c=A181102_150606_ln-sport-hokej_lar,Zlatý důl pro NHL. V Americe se konečně bude moci legálně sázet na zápasy,"Vsadit si na výsledek zápasu, počet žlutých karet nebo první získaný set? Pro evropského sportovního nadšence běžně dostupná věc, o fanoušcích ve...",lidovky.cz,sport
//www.lidovky.cz/novinar.aspx?idnov=89,Miloslav Novák,"Slavia má formu, vyhrává doma, venku, v lize i v pohárech. A Sparta? Tři porážky z posledních čtyř ligových zápasů, všechny ze hřišť soupeřů. „Derby...",lidovky.cz,sport
//www.lidovky.cz/novinar.aspx?idnov=3642,Matěj Tomíček,"V týmové časovce nebyl na rozdíl od Chrise Frooma chráněným jezdcem. Kdyby přišel defekt nebo pád, jeho sen o titulu z Tour by vzal za své. Po deváté...",lidovky.cz,sport
https://sport.lidovky.cz/bolt-hrat-fotbal-v-sydney-nakonec-nebude-nedomluvil-se-na-podminkach-smlouvy-1st-/fotbal.aspx?c=A181102_135816_ln-sport-fotbal_lar,Bolt hrát fotbal v Sydney nakonec nebude. Nedomluvil se na podmínkách smlouvy,Z angažmá bývalého fenomenálního jamajského sprintera Usaina Bolta ve fotbalovém týmu Central Coast Mariners definitivně sešlo. Australský klub...,lidovky.cz,sport
//www.lidovky.cz/novinar.aspx?idnov=115,Jaroslav Tomas,"Hokejová KHL slaví stoleté výročí od narození Anatolije Tarasova, legendárního trenéra, jemuž se přezdívá otec ruského hokeje. A ráda by na jeho...",lidovky.cz,sport
https://sport.lidovky.cz/sef-zivanickeho-fotbalu-pokud-nas-v-tom-ostatni-nechaji-zametou-s-nami-1ey-/fotbal.aspx?c=A181101_193706_ln-sport-fotbal_rkj,"Šéf živanického fotbalu: Pokud nás v tom ostatní nechají, zametou s námi","Pondělním otevřeným dopisem na Komisi rozhodčích fotbalové asociace, ve kterém kritizuje nečisté praktiky v České fotbalové lize se předseda TJ Sokol...",lidovky.cz,sport
https://sport.lidovky.cz/motokrosovi-gladiatori-se-vraci-do-prahy-v-o2-arene-budou-letat-snezne-skutry-i-harley-davidson-iib-/ostatni-sporty.aspx?c=A181031_151141_ln_domov_rsa,Motokrosoví gladiátoři se vrací do Prahy. V O2 areně budou létat sněžné skútry i Harley-Davidson,Do Prahy se opět po roce vrátí létající gladiátoři. Libeňská O2 arena přivítá v sobotu 3. listopadu freestyle motokrosovou show FMX Gladiator Games....,lidovky.cz,sport
https://sport.lidovky.cz/jak-hrat-bez-krmencika-tuto-otazku-resi-plzen-i-silhavy-pia-/fotbal.aspx?c=A181101_204644_ln-sport-fotbal_rkj,Krmenčík bude Plzni chybět po zbytek sezony. Nahradí jej Komličenko?,"Včera utrpěla fotbalová Plzeň dvě velké ztráty. Jednak v osmifinále MOL Cupu padla s Baníkem Ostrava, ale hlavně se definitivně potvrdila diagnóza...",lidovky.cz,sport
https://sport.lidovky.cz/nhl-frolik-prispel-golem-k-obratu-calgary-z-1-4-skoroval-frk-a-simon-p97-/hokej.aspx?c=A181102_071123_ln-sport-hokej_ele,"NHL: Frolík přispěl gólem k obratu Calgary z 1:4, skóroval Frk a Simon","Útočník Michael Frolík se podílel ve čtvrtečním utkání NHL gólem na obratu Calgary, které otočilo ve třetině zápas s Coloradem z 1:4 na konečných...",lidovky.cz,sport
https://sport.lidovky.cz/prijede-nhl-do-prahy-uz-pristi-rok-komisar-souteze-rika-ze-ano-p6q-/hokej.aspx?c=A181101_192732_ln-sport-hokej_rkj,"Přijede NHL do Prahy už příští rok? Komisař soutěže říká, že ano","Komisař NHL Gary Bettman prohlásil, že by příští ročník nejslavnější hokejové ligy mohl odstartovat zápasem v Praze. Řekl to na dnešní tiskové...",lidovky.cz,sport
https://sport.lidovky.cz/zadna-podminka-pro-barose-ostravsky-utocnik-s-prosbou-o-prominuti-neuspel-16e-/fotbal.aspx?c=A181101_164934_ln-sport-fotbal_rkj,Žádná podmínka pro Baroše. Ostravský útočník s prosbou o prominutí neuspěl,Ostravský fotbalista Milan Baroš neuspěl u disciplinární komise s žádostí o prominutí posledního utkání z pětizápasového trestu za vyloučení proti...,lidovky.cz,sport
//www.lidovky.cz/novinar.aspx?idnov=455,Karel Knap,"Klidné přežívání rentiéra? Kdeže! Radek Štěpánek jen zvolna vstřebává příval nedávných zážitků. Nejprve si uspořádal grandiózní rozlučku v O2 areně,...",lidovky.cz,sport
https://sport.lidovky.cz/jidlo-proti-nabozenstvi-kriketistum-indie-nabidli-v-anglii-hovezi-s-testovinami-g1e-/ostatni-sporty.aspx?c=A181101_112325_ln-sport-ostatni_rkj,Jídlo proti náboženství. Kriketistům Indie nabídli v Anglii hovězí s těstovinami,"Jsou jídla, která si určitě nedovolíte nabídnout určité sortě lidí. Vepřové muslimům, maso veganům, jídlo s lepkem bezlepkářům. Podobné faux paux si...",lidovky.cz,sport
https://sport.lidovky.cz/zakaz-vyjezdu-do-francie-slaviste-se-za-rvacky-v-kodani-nepodivaji-do-bordeaux-1hy-/fotbal.aspx?c=A181101_133815_ln-sport-fotbal_rkj,Zákaz výjezdu do Francie. Slávisté se za rvačky v Kodani nepodívají do Bordeaux,"Fanoušci fotbalové Slavie nesmí za výtržnosti v Kodani na příští venkovní zápas Evropské ligy v Bordeaux, který se bude hrát ve čtvrtek 29....",lidovky.cz,sport
https://sport.lidovky.cz/malika-mrzi-ze-musi-resit-vic-politiku-nez-fotbal-f7g-/fotbal.aspx?c=A181101_124225_ln-sport-fotbal_rkj,"Asociaci vede více lidí. A není to jen Berbr, říká předseda FAČR Malík","Předseda Fotbalové asociace ČR Martin Malík připouští, že dosavadních jedenáct měsíců ve funkci bylo těžších, než si sám po úspěchu na loňské valné...",lidovky.cz,sport
https://sport.lidovky.cz/krmencik-musi-na-operaci-kolena-sezona-pro-nej-skoncila-pi2-/fotbal.aspx?c=A181101_090122_ln-sport-fotbal_ssu,"Velká ztráta pro Plzeň. Kanonýr Krmenčík, oceňovaný až na 300 milionů, má po sezoně",Plzeňský útočník Michael Krmenčík musí s přetrženým zkříženým vazem v levém koleni na operaci. Pětadvacetiletý český fotbalový reprezentant si kvůli...,lidovky.cz,sport
https://sport.lidovky.cz/brankar-zlamal-byl-ve-skotsku-uderen-fanouskem-typicke-derby-rikal-jeho-kouc-1s5-/fotbal.aspx?c=A181101_121222_ln-sport-fotbal_rkj,VIDEO: Brankáře Zlámala napadli skotští fanoušci. Během zápasu dostal pěstí,"Místní derby jsou vždy vyhecovaná. V Čechách se o tom opět přesvědčíme v neděli, kdy na Letnou zamíří Slavia, o level výše posunuli násilnosti...",lidovky.cz,sport
https://sport.lidovky.cz/jak-zabit-dalsi-tenisovou-soutez-tentokrate-fed-cup-fy7-/ostatni-sporty.aspx?c=A181031_111601_ln-sport-ostatni_rkj,"KOMENTÁŘ: Jak zabít další tenisovou soutěž, tentokráte Fed Cup","Finále tenisového Fed Cupu ztrácí na atraktivitě. Ovšem ne v českém podání, to jen za Spojené státy nebudou hrát nejlepší hráčky. Oficiálně jsou...",lidovky.cz,sport
https://sport.lidovky.cz/kluci-kvuli-rozhodcim-radsi-skonci-s-fotbalem-zivanice-vytahly-do-boje-se-sudimi-gpd-/fotbal.aspx?c=A181031_171832_ln-sport-fotbal_rkj,‚Kluci kvůli rozhodčím radši skončí s fotbalem.’ Živanice vytáhly do boje se sudími,"Jeho klub o víkendu v posledním kole České fotbalové ligy (ČFL) zvítězil 1:0 nad Pískem, přesto po něm předseda živanického Sokola Petr Špaček...",lidovky.cz,sport
https://sport.lidovky.cz/maradonovi-postavili-sochu-byl-to-milnik-nasi-historie-tvrdi-tvurce-dila-1lu-/fotbal.aspx?c=A181101_111819_ln-sport-fotbal_rkj,"Maradonovi postavili sochu. Byl to milník naší historie, tvrdí tvůrce díla",Argentina oslavila 58. narozeniny své fotbalové legendy Diega Maradony odhalením bronzové sochy. Dílo odkazuje na jeho slavné sólo ze zápasu proti...,lidovky.cz,sport
https://sport.lidovky.cz/byvaly-boxer-mike-tyson-prijel-do-prahy-nechtel-po-nas-kaviar-rika-organizator-1yh-/ostatni-sporty.aspx?c=A181031_204628_ln-sport-ostatni_rkj,"Bývalý boxer Mike Tyson přijel do Prahy. Nechtěl po nás kaviár, říká organizátor","Žádný kaviár nebo ústřice, stačí ovoce, dobrý pražský hotel a lepší auto. „Nejsou to přehnané hvězdné manýry,“ říká k příjezdu bývalého boxerského...",lidovky.cz,sport
https://sport.lidovky.cz/penize-az-na-prvnim-miste-rozsireni-fotbaloveho-ms-neni-bohuliba-cinnost-1l3-/fotbal.aspx?c=A181031_203802_ln-sport-fotbal_rkj,Peníze až na prvním místě? Rozšíření fotbalového MS není bohulibá činnost,Navýšení počtu týmů na fotbalovém mistrovství světa se odhlasovalo v lednu loňského roku. 48 týmů se mělo představit až na šampionátu v roce 2026....,lidovky.cz,sport
https://sport.lidovky.cz/chicago-prohralo-ve-vancouveru-rutta-zustal-opet-mezi-nahradniky-1cz-/hokej.aspx?c=A181101_072207_ln-sport-hokej_ssu,"Chicago prohrálo ve Vancouveru, Rutta zůstal opět mezi náhradníky","Vancouver porazil v jediném středečním utkání NHL na svém ledě Chicago 4:2. Z českých hokejistů zasáhl do hry jen David Kämpf, který nastupoval ve...",lidovky.cz,sport
https://sport.lidovky.cz/vitkovice-zdolaly-spartu-a-vyskocily-na-pate-misto-extraligy-p6n-/hokej.aspx?c=A181031_205955_ln-sport-hokej_rkj,Vítkovice zdolaly Spartu a vyskočily na páté místo extraligy,Hokejisté Vítkovic vyhráli v dohrávaném zápase 15. kola extraligy na ledě Sparty 4:1 a posunuli se v tabulce na páté místo. Dvěma góly se na výhře...,lidovky.cz,sport
https://www.lidovky.cz/kultura/serialy-s-lekari-tahnou-patri-k-tem-divacky-nejoblibenejsim.A181103_144132_ln_kultura_rsa,Seriály s lékaři táhnou. V Česku je nejsledovanější Ordinace v růžové zahradě,České televizní seriály z lékařského prostředí patří vedle detektivních sérií k divácky nejúspěšnějším. Jejich masovou oblibu 5. listopadu 1978...,lidovky.cz,kultura
https://www.lidovky.cz/kultura/recenze-nenavratne-ztracene-levactvi-levak-se-ztratil-pri-odlivu-reality.A181102_105023_ln_kultura_jto,RECENZE: Nenávratně ztracené leváctví. Levák se ztratil při odlivu reality,"Bilanci překladů polské literatury do češtiny, která je výrazně slabší ve srovnání s expanzí děl našich autorů k severním sousedům, vylepšuje nyní...",lidovky.cz,kultura
https://www.lidovky.cz/novinari/jaroslav-totusek.N3899,Jaroslav Totušek,"Britský režisér údajně připravuje pokračování Gladiátora, jednoho ze svých nejpopulárnějších filmů. Přizval si na pomoc scenáristu nového Top Gunu....",lidovky.cz,kultura
https://www.lidovky.cz/novinari/tereza-navratilova.N4181,Tereza Navrátilová,Fotografie ze života lidí s mentálním postižením i módní návrhy představí v neděli 4. listopadu spolek Fotografiemi pro radost na třetím ročníku...,lidovky.cz,kultura
https://www.lidovky.cz/kultura/akcni-americky-snimek-o-prevratu-v-kremlu-nedostal-v-rusku-povoleni-k-promitani.A181102_192211_ln_zahranici_ele,Americký akční film o převratu v Kremlu má v Rusku problém. Nedostal povolení k promítání,"Ruské úřady pozdržely uvedení do kin amerického akčního filmu Útok z hlubin, v němž americké vojenské jednotky mají zachránit ruského prezidenta při...",lidovky.cz,kultura
https://www.lidovky.cz/novinar.aspx?idnov=493,Jana Machalická,"Jevištní adaptaci Gombrowiczova románu Pornografie nastudoval v Činoherním studiu režisér David Šiktanc. Je to inscenace poctivá, stylová s dobrými...",lidovky.cz,kultura
https://www.lidovky.cz/novinari/jaroslav-totusek.N3899,Jaroslav Totušek,Mediální gigant Netflix zveřejnil v pátek 2. listopadu poslední sérii úspěšného thrilleru z politického prostředí Dům z karet (House of Cards). Tato...,lidovky.cz,kultura
https://www.lidovky.cz/kultura/recenze-vystava-vitejte-v-tezkych-casech-existuji-vubec-takove.A181102_094739_ln_kultura_jto,RECENZE: Výstava Vítejte v těžkých časech! Existují vůbec takové?,"V pražském centru Dox právě probíhá výstava nazvaná Vítejte v těžkých časech, která navazuje na předešlou expozici Vítejte v kapitalismu. Koncepci...",lidovky.cz,kultura
https://www.lidovky.cz/kultura/recenze-bohemian-rhapsody-chytlavy-popovy-film-o-queenech.A181101_105220_ln_kultura_jto,RECENZE: Bohemian Rhapsody. Chytlavý popový film o Queenech,"Rami Malek oživuje Freddieho Mercuryho ve filmovém příběhu Bohemian Rhapsody o zlatých časech skupiny Queen, který jako chytlavý, emotivní pop song...",lidovky.cz,kultura
https://www.lidovky.cz/novinari/marcel-kabat.N2324,Marcel Kabát,"Do kin vstupuje snímek šestadvacetiletého režiséra Martina Páva, který se vypravil do jednoho z největších afrických slumů v keňském Nairobi. Na...",lidovky.cz,kultura
https://www.lidovky.cz/kultura/soutez-zneklidnujici-thriller-vyhrajte-knihu-klub-vrahu.A181029_143521_ln_kultura_ape,SOUTĚŽ: Zneklidňující thriller. Vyhrajte knihu Klub vrahů,"Klub vrahů je zneklidňující thriller. Napětí příběhu, který se zpočátku tváří spíš jako detektivka, se stupňuje až k hororové atmosféře, která...",lidovky.cz,kultura
https://www.lidovky.cz/kultura/ctete-usima-velky-audioknizni-ctvrtek-prinasi-petra-pana-ci-zivotopis-tomase-holeho.A181101_075950_ln_kultura_ssu,Čtěte ušima. Velký audioknižní čtvrtek přináší Petra Pana či životopis Tomáše Holého,"Na pultech knihkupectví v Česku se ve čtvrtek v rámci Velkého audioknižního čtvrtka objeví 11 namluvených knih. Akce na propagaci knih, které se...",lidovky.cz,kultura
https://www.lidovky.cz/novinari/jaroslav-totusek.N3899,Jaroslav Totušek,Do českých kin míří dlouho očekávaný film Bohemian Rhapsody. Ten mapuje vzestup kapely Queen a jejího frontmana Freddieho Mercuryho. Snímek ale měl...,lidovky.cz,kultura
https://www.lidovky.cz/novinari/jaroslav-totusek.N3899,Jaroslav Totušek,"První listopadový týden míří do českých kin sedm snímků. Dramatický příběh skupiny Queen doplní americká romantická komedie s Luckou Vondráčkovou,...",lidovky.cz,kultura
https://www.lidovky.cz/novinari/jaroslav-totusek.N3899,Jaroslav Totušek,"Jedna, dvě, bubák jde. Server Lidovky.cz vám přináší několik diváky výborně hodnocených tipů na děsivou Halloweenskou podívanou, při které se...",lidovky.cz,kultura
https://www.lidovky.cz/novinar.aspx?idnov=2324,Marcel Kabát,"Cenu v hlavní soutěži festivalu, nazvané Opus bonum, udělil jakožto jediný porotce uznávaný polský režisér Krzysztof Zanussi. Ocenil snímek Volný...",lidovky.cz,kultura
https://www.lidovky.cz/kultura/recenze-kralove-zlodeju-jsou-hajzlici-ze-stare-skoly.A181030_100830_ln_kultura_jto,RECENZE: Králové zlodějů jsou hajzlíci ze staré školy,"Důchodci nevykrádají sejfy s diamanty každý den. Když se tak stane, hned je z toho dobrý námět na film. Britští Králové zlodějů se sirem Michaelem...",lidovky.cz,kultura
https://www.lidovky.cz/kultura/video-teda-ty-mas-ale-pero-viki-nataceni-snezenek-a-machru-byla-velka-party.A181030_120547_ln_kultura_jto,"VIDEO: ‚Teda ty máš ale péro, Viki!‘ Natáčení Sněženek a machrů byla velká párty","Vznik filmu Sněženky a machři provázely všechny myslitelné i nemyslitelné obtíže. Točilo se narychlo, v zimě, na horách, s velkým počtem herců....",lidovky.cz,kultura
https://www.lidovky.cz/novinari/jaroslav-totusek.N3899,Jaroslav Totušek,"Wireless Festival, jeden z největších hip-hopových a rapových festivalů na světě, se každý rok koná v londýnském parku ve Finsbury (Finsbury Park)....",lidovky.cz,kultura
https://www.lidovky.cz/kultura/kresleny-rasismus-tvurci-simpsonovych-se-kvuli-kontroverzi-udajne-rozhodli-odstranit-apua.A181030_102500_ln_kultura_jto,Kreslený rasismus. Tvůrci Simpsonových se kvůli kontroverzi prý rozhodli odstranit Apua,Podle scenáristy Adiho Shankara se tvůrci Simpsonových rozhodli odstranit postavu indicko-amerického prodavače Apua Nahasapeemapetilona. Důvodem má...,lidovky.cz,kultura
https://www.lidovky.cz/kultura/soutez-vyhrajte-novou-knihu-hovory-s-tgm.A181030_133644_ln_kultura_ape,SOUTĚŽ: Vyhrajte novou knihu Hovory s TGM,"Hovory s TGM jsou nejen knihou Karla Čapka, která v letech 1928–1935 zachytila život a názory prvního čs. prezidenta. Dnes jsou už i celovečerním...",lidovky.cz,kultura
https://www.lidovky.cz/kultura/jak-se-zije-ve-vezeni-nejlepsim-ceskym-filmem-na-festivalu-v-jihlave-byl-uzamceny-svet.A181030_100200_ln_kultura_jto,Jak se žije ve vězení? Nejlepším českým filmem na festivalu v Jihlavě byl Uzamčený svět,Nejlepším českým dokumentem se na letošním mezinárodním festivalu dokumentárních filmů v Jihlavě stal Uzamčený svět dokumentaristy a scenáristy Karla...,lidovky.cz,kultura
https://www.lidovky.cz/novinari/ondrej-bezr.N3784,Ondřej Bezr,"Nové album písničkáře Jaroslava Hutky nese název 100 let a je bez výjimky politické. Natočil je ke stému výročí vzniku republiky, přestože s...",lidovky.cz,kultura
https://www.lidovky.cz/novinari/jaroslav-totusek.N3899,Jaroslav Totušek,Populární taneční soutěž StarDance je právě v plném proudu. Tanečníci z řad celebrit mají už teď za sebou dlouhé hodiny tréninku a odříkání. Někteří...,lidovky.cz,kultura
https://www.lidovky.cz/novinari/jaroslav-totusek.N3899,Jaroslav Totušek,"Společnost Disney plánuje restartovat značku Pirátů z Karibiku, tentokrát od scenáristů úspěšného Deadpoola. Podle scenáristy původních filmů se ale...",lidovky.cz,kultura
