link,link_text,txt,site,area
https://www.lidovky.cz/moskva-mise-opcw-v-dume-byla-odlozena-kvuli-americkym-naletum-puy-/zpravy-svet.aspx?c=A180416_171920_ln_zahranici_mha,Inspektory OPCW Syřané a Rusové odmítají vpustit na místo chemického útoku. Mayová: Snaží se zakrýt stopy,"Ředitel mezinárodní organizace pro zákaz chemických zbraní (OPCW) v pondělí v podvečer uvedl, že syrští a ruští vojáci...",lidovky.cz,title
//www.lidovky.cz/novinar.aspx?idnov=3065,Kateřina Menzelová,Příběh čínských investic v Česku bude mít tento týden pokračování. Do Prahy zavítají vrcholní manažeři obřího čínského...,lidovky.cz,title
https://www.lidovky.cz/pohreb-milose-formana-probehl-v-nedeli-v-rodinnem-kruhu-pib-/lide.aspx?c=A180416_163424_lide_ele,Pohřeb Miloše Formana proběhl v neděli v rodinném kruhu v americkém Warrenu,"Se zesnulým režisérem Milošem Formanem se konalo poslední rozloučení v neděli v americkém městě Warren, kde umělec žil....",lidovky.cz,title
https://www.lidovky.cz/praha-zverejnila-novy-metropolitni-plan-pripominky-lze-davat-od-cervna-1al-/zpravy-domov.aspx?c=A180416_125300_ln_domov_lar,‚Ukřižovaná primátorka‘. Praha zveřejnila nový Metropolitní plán,Pražský Institut plánování a rozvoje (IPR) předal magistrátu návrh Metropolitního plánu. Dokument bude možné od 27....,lidovky.cz,title
https://www.lidovky.cz/uder-byl-nevyhnutelny-a-presny-vojensky-zasah-nic-neresi-projdete-si-babisova-vyjadreni-k-syri-ijq-/zpravy-domov.aspx?c=A180416_104920_ln_domov_mpr,‚Úder byl nevyhnutelný a přesný.‘ ‚Vojenský zásah nic neřeší.‘ Projděte si Babišova vyjádření k Sýrii,Premiér v demisi Andrej Babiš během víkendu předvedl názorový veletoč na dění v Sýrii. Zatímco v sobotu hájil nálet...,lidovky.cz,title
https://www.lidovky.cz/machacek-praha-a-trump-opet-v-titulcich-dyv-/monitor-jana-machacka.aspx?c=A180416_134857_monitor-jana-machacka_mpr,Praha a Trump opět v titulcích,"Americká tisková agentura a server McClatchy v pátek uvedly, že zvláštní...",lidovky.cz,title
https://www.lidovky.cz/vlaceni-obvinenych-k-soudu-v-poutech-je-podle-ratha-barbarstvi-pbs-/zpravy-domov.aspx?c=A180416_162304_ln_domov_ele,Vláčení obviněných k soudu v poutech je podle Ratha barbarství,Vedení obviněných v poutech k soudnímu jednání považuje bývalý hejtman David Rath za přežitek někdejšího komunistického...,lidovky.cz,title
https://www.lidovky.cz/prazsky-sherwood-bude-bezpecnejsi-magistrat-zajistil-nove-bezpecnostni-tymy-1yf-/zpravy-domov.aspx?c=A180416_142709_ln_domov_lar,"Pražský Sherwood bude bezpečnější, magistrát zajistil nové bezpečnostní týmy","Vrchlického sady u pražského hlavního nádraží hlídají nové bezpečnostní týmy, zajištěné magistrátem. Mají za úkol...",lidovky.cz,title
https://www.lidovky.cz/potycku-v-zemanove-stabu-vyhodnotila-policie-jako-prestupek-ptq-/zpravy-domov.aspx?c=A180416_141647_ln_domov_lar,Potyčku v Zemanově štábu vyhodnotila policie jako přestupek,Lednovou potyčku mezi novináři a příznivci prezidenta Miloše Zemana...,lidovky.cz,title
https://byznys.lidovky.cz/cesi-stale-vice-kupuji-zbozi-s-oznacenim-retezce-f6i-/firmy-trhy.aspx?c=A180416_110745_ln_domov_lar,Češi stále více kupují zboží s označením řetězce,Prodeje zboží prodávaného pod privátní značkou obchodních řetězců v...,lidovky.cz,title
https://www.lidovky.cz/v-postupu-nemeckych-uradu-vuci-amrimu-nasla-policie-pres-250-nedostatku-1md-/zpravy-svet.aspx?c=A180416_155241_ln_zahranici_ele,V postupu německých úřadů vůči Amrimu našla policie přes 250 nedostatků,"V postupu německé policie v případě teroristy Anisi Amriho, který při...",lidovky.cz,title
https://www.lidovky.cz/slovensky-ministr-vnitra-oznamil-demisi-odmita-odvolat-policejniho-prezidenta-gfi-/zpravy-svet.aspx?c=A180416_142732_ln_zahranici_mha,Slovenský ministr vnitra oznámil demisi. Odmítá odvolat policejního prezidenta,Nový slovenský ministr vnitra Tomáš Drucker v pondělí před novináři...,lidovky.cz,title
https://www.lidovky.cz/rusove-mohou-mit-podle-byvaleho-sefa-fbi-na-trumpa-kompromitujici-informace-1vr-/zpravy-svet.aspx?c=A180416_072014_ln_zahranici_lar,"Trump nemá morálně na úřad prezidenta, řekl bývalý šéf FBI Comey","Rusové možná mají na amerického prezidenta Donalda Trumpa kompromitující informace, řekl v neděli někdejší ředitel...",lidovky.cz,title
https://byznys.lidovky.cz/prazske-letiste-se-zacatkem-kvetna-stane-plne-nekurackym-pmf-/doprava.aspx?c=A180416_153155_ln-doprava_ele,Pražské letiště se začátkem května stane plně nekuřáckým,Letiště Václava Havla v Praze se od 1. května stane plně nekuřáckým. Od tohoto data tak nebude možné kouřit ve všech...,lidovky.cz,title
https://byznys.lidovky.cz//foto.aspx?c=A180416_140428_ln-auto_pkk,"Podívejte se, jak Škodovku nastartovalo spojení s Volkswagenem během první dekády",Před 27 lety vstoupila automobilka Škoda do koncernu Volkswagen. Oficiální spolupráce byla odstartována 16. dubna 1991....,lidovky.cz,title
https://byznys.lidovky.cz/karlovarsky-festival-bude-misto-cez-sponzorovat-kretinsky-pl2-/firmy-trhy.aspx?c=A180416_134742_ln_domov_lar,Karlovarský festival bude místo ČEZ sponzorovat Křetínský,Hlavním sponzorem Mezinárodního filmového festivalu (MFF) Karlovy...,lidovky.cz,title
https://byznys.lidovky.cz/cesi-stale-vice-kupuji-zbozi-s-oznacenim-retezce-f6i-/firmy-trhy.aspx?c=A180416_110745_ln_domov_lar,Češi stále více kupují zboží s označením řetězce,Prodeje zboží prodávaného pod privátní značkou obchodních řetězců v...,lidovky.cz,title
https://sport.lidovky.cz/prostitutkami-a-loveckymi-vypravami-uplacelo-rusko-kritizovaneho-sefa-biatlonu-gg9-/ostatni-sporty.aspx?c=A180416_142614_ln-sport-ostatni_lar,Prostitutkami a loveckými výpravami uplácelo Rusko kritizovaného šéfa biatlonu,Rusko prý předsedu Mezinárodní biatlonové federace Anderse Besseberga uplácelo za přehlížení dopingu prostitutkami a...,lidovky.cz,title
https://www.lidovky.cz/rodinka-ztracena-ve-vesmiru-novy-serial-je-jiz-treti-verzi-jednoho-pribehu-16p-/kultura.aspx?c=A180416_104849_ln_kultura_jto,Rodinka ztracená ve vesmíru. Nový seriál je již třetí verzí jednoho příběhu,"Rodina Robinsonových se shodou náhod octne na obyvatelné, ale neznámé planetě. Musí se naučit žít s...",lidovky.cz,title
https://www.lidovky.cz/konec-schuzkam-v-hotelovych-pokojich-nove-smernice-maji-zabranit-sexualnimu-obtezovani-gb1-/kultura.aspx?c=A180416_114337_ln_kultura_jto,Konec schůzkám v hotelových pokojích. Nové směrnice mají zabránit sexuálnímu obtěžování,"Americké herecké sdružení (Screen Actors Guild of America) vydalo nové směrnice, které mají zamezit...",lidovky.cz,title
https://www.lidovky.cz/jime-ze-stejne-misky-rika-duo-jan-sahara-hedl-a-blanka-srumova-p5k-/kultura.aspx?c=A180413_102856_ln_kultura_jto,"Jíme ze stejné misky, říká duo Jan Sahara Hedl a Blanka Šrůmová","Skupina Něžná noc, založená Blankou Šrůmovou (dříve mj. Tichá dohoda) a Janem Saharou Hedlem...",lidovky.cz,title
https://relax.lidovky.cz/amatersti-archeologove-nasli-na-rujane-stribrny-poklad-pjg-/zajimavosti.aspx?c=A180416_164732_ln-zajimavosti_ele,Amatérští archeologové našli na Rujaně stříbrný poklad,"Archeologové našli na německém ostrově Rujana v Baltském moři stovky více než 1000 let starých mincí, prstenů, perel, náramků či náhrdelníků. Podle agentury DPA jsou spojovány s dobou legendárního dánského krále Haralda I., přezdívaného Modrozub.",lidovky.cz,title
https://www.lidovky.cz/slavna-vousata-zpevacka-conchita-wurst-priznala-ze-je-hiv-pozitivni-1i9-/lide.aspx?c=A180416_105955_ln_zahranici_lar,"Slavná vousatá zpěvačka Conchita Wurst přiznala, že je HIV pozitivní","Rakouský zpěvák Thomas Neuwirth, vystupující pod uměleckým jménem Conchita Wurst, je infikován virem HIV. Nyní 29letý...",lidovky.cz,title
https://cestovani.lidovky.cz/nomadi-jine-pary-spolu-dum-stavi-my-ho-borime-prestehovali-jsme-se-do-dodavky-1w1-/aktuality.aspx?c=A180415_171334_aktuality_ape,"NOMÁDI: Jiné páry spolu dům staví, my ho boříme. Přestěhovali jsme se do dodávky","""Do nájmu jsme jít nechtěli, a splácet třicet let hypotéku už vůbec ne,"" popisuje začátek života na cestě Tomáš...",lidovky.cz,title
https://www.lidovky.cz/sezona-chrestozroutu-zacala-sklizen-tento-rok-obohati-specialni-typ-fialoveho-chrestu-guj-/dobra-chut.aspx?c=A180415_201752_dobra-chut_ele,Sezona chřestožroutů začala. Sklizeň tento rok obohatí speciální typ fialového chřestu,Chřestová sezona v Česku je zahájena. Sklizeň bílého šparglu začala...,lidovky.cz,title
https://relax.lidovky.cz/obri-modry-penis-na-budove-pobouril-obyvatele-stockholmu-bude-premalovan-1rs-/zajimavosti.aspx?c=A180416_083203_ln-zajimavosti_lar,"Obří modrý penis na budově pobouřil obyvatele Stockholmu, bude přemalován",Vztyčený modrý penis namalovaný přes pět pater na fasádě jedné budovy ve Stockholmu pobouřil místní obyvatele. Dílo...,lidovky.cz,title
https://www.lidovky.cz/whisky-je-uz-po-staleti-tvorena-stejnymi-ingrediencemi-neni-cas-na-inovaci-1tx-/dobra-chut.aspx?c=A180415_222718_dobra-chut_ele,Whisky je už po staletí tvořena stejnými ingrediencemi. Není čas na inovaci?,Skotská whisky je už po staletí tvořena stejnými ingrediencemi....,lidovky.cz,title
https://www.lidovky.cz/claudia-cardinale-filmova-kraska-s-bolestnou-minulosti-pi4-/lide.aspx?c=A180414_203519_lide_krku,Claudia Cardinalová: filmová kráska s bolestnou minulostí slaví 80. narozeniny,"Točila s Viscontim i Fellinim, byla hereckou partnerkou Marcella Mastroianniho, Alaina Delona i Jeana-Paula Belmonda....",lidovky.cz,title
https://www.lidovky.cz/kabat-forman-tu-byl-jako-dukaz-ze-svoboda-vitezi-nad-arogantni-hlouposti-14f-/nazory.aspx?c=A180415_204907_ln_nazory_ele,,"Česká etapa filmařské kariéry Miloše Formana trvala jen několik let, a přece natočil jedny z nejdůležitějších filmů,...",lidovky.cz,title
https://www.lidovky.cz/petracek-mamut-patri-palave-co-nam-pripomina-dvouste-vyroci-narodniho-muzea-1vy-/nazory.aspx?c=A180415_134636_ln_nazory_krku,,Patří Národní muzeum do muzea? Nebo má i v 21. století smysl? Tyto otázky si můžeme klást o víkendu. V neděli uplyne od...,lidovky.cz,title
https://www.lidovky.cz/klesla-avast-obouva-svet-it-muze-byt-dalsi-cesky-trumf-ppy-/nazory.aspx?c=A180413_220640_ln_nazory_ele,,"Abychom nezapomněli, kdy půjdete na burzu? Jednou a tou samou otázkou se na konci doslova každého rozhovoru v...",lidovky.cz,title
http://ceskapozice.lidovky.cz/prazsky-cas-sede-eminence-cinskeho-byznysu-v-cesku-se-nachylil-p77-/tema.aspx?c=A180412_123656_pozice-tema_lube,Pražský čas šedé eminence čínského byznysu v Česku se nachýlil,"Peking neprodloužil mandát velvyslankyni Ma Kche-čching, jež otvírala dveře investicím CEFC a „rovnala“ české politiky....",lidovky.cz,title
http://ceskapozice.lidovky.cz/odborari-chteji-prosadit-37-5hodinovy-pracovni-tyden-fyi-/tema.aspx?c=A180412_131359_pozice-tema_lube,"Odboráři chtějí prosadit 37,5hodinový pracovní týden","V České republice se bez práce nachází nejméně lidí v celé Evropské unii, firmy trpí personálním nedostatkem a odbory...",lidovky.cz,title
http://ceskapozice.lidovky.cz/radeji-kvalitu-cechum-zacina-zalezet-na-tom-co-piji-fw9-/tema.aspx?c=A180413_151751_pozice-tema_houd,"Raději kvalitu. Čechům začíná záležet na tom, co pijí",Poprvé v historii v České republice převládl prodej jedenáctek a dvanáctek nad výčepními pivy. Dražší ležáky si lidé...,lidovky.cz,title
https://brno.idnes.cz/amalka-jezkova-vzacna-nemoc-kuze-ichtyoza-pro-detsky-smich-pok-/brno-zpravy.aspx?c=A180413_395163_brno-zpravy_krut,"Amálka se musí vyhýbat slunci, nemoc ji denně připraví o kbelík kůže",Podobně jako princezna Jitřenka z pohádky O bílé laňce se musí vyhýbat slunečním paprskům. Na rozdíl od ní však tříletou Amálku Ježkovou z Hrabenova u...,lidovky.cz,title
https://auto.idnes.cz/test-letni-pneumatiky-guma-tomket-michelin-tomket-fwo-/automoto.aspx?c=A180408_193105_auto_ojetiny_fdv,Test letních gum: české pláště z Číny srovnali se zavedenými značkami,"České pneumatiky s čínským rodným listem Tomket za sebou mají první nezávislý test. Značku, která sází na nízkou cenu, ale slibuje zároveň dobré jízdní...",lidovky.cz,title
https://byznys.lidovky.cz/prazske-letiste-se-zacatkem-kvetna-stane-plne-nekurackym-pmf-/doprava.aspx?c=A180416_153155_ln-doprava_ele,Pražské letiště se začátkem května stane plně nekuřáckým,Letiště Václava Havla v Praze se od 1. května stane plně nekuřáckým. Od tohoto data tak nebude možné kouřit ve všech interiérových prostorech letiště...,lidovky.cz,business
/foto.aspx?c=A180416_140428_ln-auto_pkk,"Podívejte se, jak Škodovku nastartovalo spojení s Volkswagenem během první dekády",Před 27 lety vstoupila automobilka Škoda do koncernu Volkswagen. Oficiální spolupráce byla odstartována 16. dubna 1991. Za tu dobu se z české značky...,lidovky.cz,business
https://byznys.lidovky.cz/karlovarsky-festival-bude-misto-cez-sponzorovat-kretinsky-pl2-/firmy-trhy.aspx?c=A180416_134742_ln_domov_lar,Karlovarský festival bude místo ČEZ sponzorovat Křetínský,"Hlavním sponzorem Mezinárodního filmového festivalu (MFF) Karlovy Vary po odchodu dlouholetého generální partnera, elektrárenské společnosti ČEZ bude...",lidovky.cz,business
https://byznys.lidovky.cz/cesi-stale-vice-kupuji-zbozi-s-oznacenim-retezce-f6i-/firmy-trhy.aspx?c=A180416_110745_ln_domov_lar,Češi stále více kupují zboží s označením řetězce,Prodeje zboží prodávaného pod privátní značkou obchodních řetězců v loňském roce po letech stagnace mírně ožily. Jejich podíl na celkových prodejích...,lidovky.cz,business
https://pr.lidovky.cz/pro-moderni-betonove-sterky-v-koupelnach-vsadte-na-kvalitu-a-reference-1ml-/byz-sdeleni.aspx?c=A180405_112224_byz-sdeleni_jedli,Pro moderní betonové stěrky v koupelnách vsaďte na kvalitu a reference,"Plánujete použít moderní betonové stěrky do namáhaných prostor, jako jsou koupelny či kuchyně? Pak je důležité myslet nejen na krásný design, ale zejména na...  
					celý článek",lidovky.cz,business
https://byznys.lidovky.cz/tok-dalnice-d6-nebude-hotova-pred-rokem-2026-ff7-/doprava.aspx?c=A180416_093457_ln-doprava_lar,Ťok: Dálnice D6 nebude hotová před rokem 2026,Dálnice D6 nebude podle ministra dopravy Dana Ťoka (za ANO) dokončena před rokem 2026. Ministr to řekl v pondělí u příležitosti vládní návštěvy v...,lidovky.cz,business
https://byznys.lidovky.cz/digitalni-supermodelky-skladaji-se-jen-z-pixelu-na-instagramu-ale-vydelavaji-realne-penize-gxu-/firmy-trhy.aspx?c=A180408_153517_firmy-trhy_prop,"Digitální supermodelky. Skládají se jen z pixelů, na Instagramu ale vydělávají reálné peníze","Krásné, populární, falešné. I tak se dá shrnout rodící se instagramový trend takzvaných digitálních modelek, které svým realistickým vzhledem často...",lidovky.cz,business
https://www.lidovky.cz/novinar.aspx?idnov=3555,Miroslav Petr,Před dvěma lety koupil Ladislav Vrtiš s Filipem Millerem v Plzni krachující minipivovar s jedním zaměstnancem. Investovali úspory a denně od rána do...,lidovky.cz,business
https://byznys.lidovky.cz/ctu-se-ma-od-evropske-komise-dozvedet-zda-muze-regulovat-tuzemsky-mobilni-trh-1hq-/firmy-trhy.aspx?c=A180415_151135_firmy-trhy_ele,"ČTÚ se má od Evropské komise dozvědět, zda může regulovat tuzemský mobilní trh","Česko by mělo zhruba v polovině letošního roku dostat od Evropské komise stanovisko, zda může zavést regulaci tuzemského mobilního trhu. Českému...",lidovky.cz,business
https://byznys.lidovky.cz/sef-reklamni-firmy-wpp-martin-sorrell-kvuli-vysetrovani-odstoupil-11g-/firmy-trhy.aspx?c=A180415_150041_firmy-trhy_ele,Šéf reklamní firmy WPP Martin Sorrell kvůli vyšetřování odstoupil,"Šéf společnosti WPP Martin Sorrell, který z firmy o dvou lidech vytvořil největší reklamní agenturu světa, oznámil rezignaci. Důvodem je podezření,...",lidovky.cz,business
https://byznys.lidovky.cz/v-centru-prahy-nepojedou-na-dvou-tratich-temer-cely-den-tramvaje-p8w-/doprava.aspx?c=A180415_071750_ln-doprava_krku,V Praze v neděli nepojedou tramvaje kolem Hradu a mezi Lazarskou a Jindřišskou,V centru Prahy bude v neděli téměř celý den přerušen provoz tramvají přes Václavské náměstí a kolem Pražského hradu. Přerušeny byly i noční linky na...,lidovky.cz,business
https://www.lidovky.cz/novinar.aspx?idnov=3905,Karolína Krupková,"Češi si při vaření kávy zakládají především na rychlé přípravě. Okrádají se tím ale o aroma a chuť kofeinového nápoje. Tradiční turek, platící za...",lidovky.cz,business
https://www.lidovky.cz/novinar.aspx?idnov=3320,Michal Pavec,Velkou rybu v moři českých zakázek ulovil výběrčí slovenského mýta SkyToll posílený kapitálem od PPF. Poplatky na tuzemských dálnicích chce vybírat s...,lidovky.cz,business
https://byznys.lidovky.cz/kvuli-pseudomoru-nahlasi-stavy-drubeze-chovatele-z-30-katastru-p75-/firmy-trhy.aspx?c=A180414_144050_firmy-trhy_krku,Kvůli pseudomoru nahlásí stavy drůbeže chovatelé z 30 katastrů na Zlínsku,"Chovatelé drůbeže musí kvůli výskytu pseudomoru, takzvané Newcastleské nemoci, nahlásit početní stavy svých chovů. Týká se to chovatelů z 30...",lidovky.cz,business
https://www.lidovky.cz/novinar.aspx?idnov=4092,Patrik Kozlík,"První elektrická silnice na světě, kde se mohou dobíjet ekologická auta, vznikla ve Švédsku. Elektrodráha, která se nachází poblíž Stockholmu, je...",lidovky.cz,business
https://byznys.lidovky.cz/skoda-se-spoji-ve-skupine-volume-s-automobilkou-volkswagen-a-seat-p9h-/firmy-trhy.aspx?c=A180413_121916_firmy-trhy_pkk,"Škoda spojí síly s automobilkou Volkswagen a Seat, zaměří se na masový trh","Německý výrobce automobilů Volkswagen v pátek potvrdil, že značka Škoda se v rámci reorganizace koncernu stane součástí nově vytvořené skupiny...",lidovky.cz,business
https://byznys.lidovky.cz/arcelormittal-chce-prodat-i-podniky-v-makedonii-ci-lucembursku-pv0-/firmy-trhy.aspx?c=A180413_110348_ln_domov_ele,ArcelorMittal chce prodat i podniky v Makedonii či Lucembursku,"Mezi továrnami, které chce skupina ArcelorMittal prodat jako kompenzaci v souvislosti s koupí italské ocelárny Ilva, jsou kromě podniků v Ostravě,...",lidovky.cz,business
https://byznys.lidovky.cz/dve-tretiny-starozitniku-neprosly-kontrolou-ceske-obchodni-inspekce-1es-/firmy-trhy.aspx?c=A180413_105551_firmy-trhy_pkk,Dvě třetiny starožitníků neprošly kontrolou České obchodní inspekce,Téměř dvě třetiny starožitníků neprošly koncem loňského roku kontrolou České obchodní inspekce (ČOI). Během dvou měsíců kontroloři prověřili v Česku...,lidovky.cz,business
https://byznys.lidovky.cz/trump-zvazuje-navrat-usa-k-obchodni-dohode-tpp-fqx-/firmy-trhy.aspx?c=A180413_082410_firmy-trhy_ele,Trump zvažuje návrat USA k obchodní dohodě TPP,"Americký prezident Donald Trump požádal své obchodní poradce, aby prozkoumali možnost návratu Spojených států k dohodě o volném obchodu s názvem...",lidovky.cz,business
https://byznys.lidovky.cz/druhe-kolo-zluto-zelene-cenove-valky-regiojet-hrozi-flixbusu-predzalobni-vyzvou-giv-/doprava.aspx?c=A180412_095702_ln-doprava_ele,"Druhé kolo žluto-zelené cenové války. RegioJet nařkl FlixBus z predátorských cen, ten to odmítá","Konkurenční boj mezi žlutými autobusy RegioJet a zeleným FlixBusem se vyostřuje. Firma FlixBus, která vstoupila na český trh teprve před osmi měsíci,...",lidovky.cz,business
https://byznys.lidovky.cz/world-press-photo-vyhral-snimek-protestujiciho-venezuelana-v-plamenech-145-/media.aspx?c=A180412_224948_ln-media_ele,World Press Photo vyhrál snímek protestujícího Venezuelana v plamenech,Vítězem letošního ročníku prestižní fotografické soutěže World Press Photo je Ronaldo Schemidt pracující pro agenturu AFP s mrazivým snímkem hořícího...,lidovky.cz,business
https://byznys.lidovky.cz/eskalatory-na-veleslavine-splnily-testy-rozjedou-se-v-patek-p5d-/doprava.aspx?c=A180412_160744_ln-doprava_ele,"Eskalátory na Veleslavíně splnily testy, rozjedou se v pátek","Pražský dopravní podnik (DPP) spustí v pátek ráno nové eskalátory ve stanici metra A Nádraží Veleslavín, kde lidé přestupují na autobusy mířící na...",lidovky.cz,business
https://byznys.lidovky.cz/video-aero-uspesne-otestovalo-novou-verzi-vystrelovaciho-sedadla-vs-20-13m-/firmy-trhy.aspx?c=A180412_115644_firmy-trhy_sij,VIDEO: Aero otestovalo novou verzi vystřelovacího sedadla VS-20,Společnost Aero Vodochody pokračuje ve vylepšování letounů L-159 českého letectva podle specifických požadavků Armády ČR. Letouny budou vybaveny...,lidovky.cz,business
https://byznys.lidovky.cz/televize-mall-hlasi-dalsi-posily-ze-streamu-porady-budou-mit-vanek-zuna-i-gebrian-g1b-/media.aspx?c=A180412_110932_ln-media_rsa,Televize Mall hlásí další posily ze Streamu. Své pořady budou mít Vaněk i ‚Koko‘,Internetová televize Mall Group částečně odhalila své programové schéma. Pořady budou mít na jejich obrazovkách známé tváře jako třeba šéfkuchař...,lidovky.cz,business
https://byznys.lidovky.cz/kladenska-hut-poldi-byla-vydrazena-za-261-milionu-korun-pfv-/firmy-trhy.aspx?c=A180412_105317_firmy-trhy_ele,Kladenská huť Poldi byla vydražena za 261 milionů korun,"Zkrachovalá kladenská huť Poldi byla ve čtvrtek vydražena za 261 milionů korun. Podnik, který je jen částí někdejšího rozsáhlého koncernu, je od...",lidovky.cz,business
https://byznys.lidovky.cz/avast-si-letos-pujde-na-londynskou-burzu-pro-200-milionu-usd-po3-/firmy-trhy.aspx?c=A180412_095534_firmy-trhy_ele,Avast si letos půjde na londýnskou burzu pro 200 milionů USD,Původně česká antivirová firma Avast chce emisí akcií na londýnské burze letos v květnu získat zhruba 200 milionů dolarů. Plánuje tak snížit...,lidovky.cz,business
https://www.lidovky.cz/novinar.aspx?idnov=4092,Patrik Kozlík,"Rozšiřující se trh bikesharingových firem je zřetelný. Tento trend využil také Matěj Žák, který založil službu s názvem What The Hill. Oficiální...",lidovky.cz,business
https://www.lidovky.cz/novinar.aspx?idnov=4092,Patrik Kozlík,"Česká aplikace Záchranka, která funguje už dva roky, míří za hranice. Na území Rakouska se spustí v pátek sesterská aplikace Rettung. Obě země se...",lidovky.cz,business
https://byznys.lidovky.cz/tarifni-mzdy-ve-skode-auto-vzrostou-o-12-procent-muzou-tak-presahnout-50-tisic-1sx-/firmy-trhy.aspx?c=A180411_201027_firmy-trhy_ele,"Tarifní mzdy ve Škodě Auto vzrostou o 12 procent, můžou tak přesáhnout 50 tisíc",Tarifní mzdy zaměstnanců Škody Auto vzrostou zpětně od 1. dubna o 12 procent. Zaměstnanci zároveň obdrží jednorázovou platbu ve výši 7000 korun v...,lidovky.cz,business
https://byznys.lidovky.cz/push-up-podprsenky-a-tanga-na-ustupu-ceske-zeny-davaji-prednost-pohodli-1an-/firmy-trhy.aspx?c=A180411_144441_firmy-trhy_pkk,Push-up podprsenky a tanga na ústupu. České ženy dávají přednost pohodlí,Češi kladou při nákupu spodního prádla čím dál víc důraz na pohodlí a přirozenost než cenu. Roste obliba bavlněného prádla. České ženy ustupují od...,lidovky.cz,business
https://byznys.lidovky.cz/celnici-kontroluji-legalnost-zamestnancu-v-ceske-pobocce-amazonu-1c2-/firmy-trhy.aspx?c=A180411_111322_firmy-trhy_pkk,Celníci kontrolují legálnost zaměstnanců v českém skladu Amazonu,"Celníci a policisté ve středu zasahují v areálu Amazonu v Dobrovízi u Prahy, kontrolují, zda jsou všichni pracovníci zaměstnáni legálně. Celníci...",lidovky.cz,business
https://byznys.lidovky.cz/v-cesku-krachuji-male-prodejny-loni-jich-skoncilo-pres-tisic-prd-/firmy-trhy.aspx?c=A180411_101610_firmy-trhy_lar,"V Česku krachují malé prodejny, loni jich skončilo přes tisíc",Loni ukončilo činnost v malých obcích 1082 venkovských prodejen. Trend zanikání malých obchodů tak zrychlil tempo. Informovala o tom Asociace českého...,lidovky.cz,business
https://www.lidovky.cz/novinar.aspx?idnov=3555,Miroslav Petr,"Memorandum o prodloužení státní podpory stlačeného zemního plynu do roku 2025 prošlo vládou. Ministerstvo průmyslu se tento dokument, který dává...",lidovky.cz,business
https://byznys.lidovky.cz/kretinskeho-skupine-epif-stoupl-zisk-o-8-procent-na-temer-40-miliard-1dk-/firmy-trhy.aspx?c=A180411_100235_firmy-trhy_lar,Křetínského skupině EPIF stoupl zisk o 8 procent na téměř 40 miliard,"Skupině EP Infrastructure (EPIF), která je jednou z hlavních větví Energetického a průmyslového holdingu (EPH) podnikatele Daniela Křetínského,...",lidovky.cz,business
https://www.lidovky.cz/novinar.aspx?idnov=3320,Michal Pavec,K získání jedné z největších zakázek v Česku má významně nakročeno konsorcium složené ze společností SkyToll a CzechToll. Ministerstvo dopravy si v...,lidovky.cz,business
https://www.lidovky.cz/novinar.aspx?idnov=3320,Michal Pavec,"Měl to být aspoň dočasný smír mezi naštvanými taxikáři a řidiči, kteří s pomocí mobilní aplikace vykonávají v podstatě stejné povolání. Memorandum...",lidovky.cz,business
