link,link_text,txt,site,area
https://www.lidovky.cz/i-lonsky-rok-byl-v-cesku-teplejsi-nez-obvykle-ne-ale-rekordne-prs-/zpravy-domov.aspx?c=A180122_151616_ln_domov_ele,I loňský rok byl v Česku teplejší než obvykle. Rekordy ale nepadaly,"Rok 2017 byl v Česku s průměrnou teplotou 8,6 stupně Celsia opět teplejší než obvykle, tři předešlé roky přinesly ale odchylku ještě výraznější a...",lidovky.cz,domov
https://www.lidovky.cz/novinar.aspx?idnov=2368,Šárka Kabátová,"Předvolební debatu s prezidentem Milošem Zemanem, které se Jiří Drahoš podle jeho slibu záměrně nezúčastnil, sledovalo v neděli večer na televizi...",lidovky.cz,domov
https://www.lidovky.cz/nepravdy-a-zavadejici-vyroky-prevalcovaly-fakta-jak-si-zeman-vedl-v-solo-debate-na-nove-glh-/zpravy-domov.aspx?c=A180122_131320_ln_domov_ele,Rozbor Zemanova vystoupení na Nově: nepravdy a zavádějící výroky převálcovaly fakta,Nepřesnosti ve vlastních postojích i v hodnocení historie. Tak dopadla analýza tvrzení Miloše Zemana v první „debatě“ kampaně před druhým kolem...,lidovky.cz,domov
https://www.lidovky.cz/policie-by-mela-brzy-dostat-usneseni-o-vydani-babise-a-faltynka-p7s-/zpravy-domov.aspx?c=A180122_140407_ln_domov_ele,"Policie by brzy měla dostat usnesení o vydání Babiše a Faltýnka, pak bude pokračovat v trestním stíhání",Policie by měla brzy dostat sněmovní usnesení o vydání premiéra Andreje Babiše (ANO) a místopředsedy hnutí ANO Jaroslava Faltýnka k trestnímu stíhání...,lidovky.cz,domov
https://www.lidovky.cz/predvolebni-spoty-jsou-opet-ve-vysilani-ceske-televize-tentokrat-i-zemanuv-1v2-/zpravy-domov.aspx?c=A180122_125553_ln_domov_ele,"Předvolební spoty jsou opět ve vysílání České televize, tentokrát i Zemanův",Česká televize zahájila vysílání předvolebních spotů finalistů prezidentské volby. Oproti prvnímu kolu video dodal i současný prezident Miloš Zeman....,lidovky.cz,domov
https://www.lidovky.cz/neslo-o-nedbalost-tvrdi-v-kauze-padu-ditete-vlakvedouci-pjg-/zpravy-domov.aspx?c=A180122_122205_ln_domov_ele,"Kauza pádu dítěte z vlaku: Nešlo o nedbalost, tvrdí vlakvedoucí. Vůz měl také technické nedostatky","Vlakvedoucí obžalovaná v případu tragické nehody, při níž předloni zemřela dvouletá dívka po pádu z vlaku na Olomoucku, popřela u soudu svou vinu....",lidovky.cz,domov
https://www.lidovky.cz/soud-propustil-dbaleho-z-psychiatrie-znalci-dokoncili-pozorovani-109-/zpravy-domov.aspx?c=A180122_110210_ln_domov_ele,"Soud propustil Dbalého z psychiatrie, posudek znalců ovlivní soudní jednání","Soudkyně k pátku propustila bývalého ředitele pražské Nemocnice Na Homolce Vladimíra Dbalého z psychiatrické léčebny, kde byl kvůli zkoumání...",lidovky.cz,domov
https://www.lidovky.cz/skoda-po-pozaru-hotelu-v-praze-presahne-podle-odhadu-20-mil-kc-plu-/zpravy-domov.aspx?c=A180122_103625_ln_domov_ele,"Požár hotelu v Praze: policisté prověřují případ jako trestný čin, škoda přesáhne 20 milionů","Škoda, kterou v sobotu večer způsobil tragický požár v hotelu Eurostars David v pražské Náplavní ulici, přesáhne podle odhadu hasičů 20 milionů...",lidovky.cz,domov
https://www.lidovky.cz/ministerstvo-pro-mistni-rozvoj-ma-chyby-v-ucetnictvi-uvedl-nku-pw8-/zpravy-domov.aspx?c=A180122_084603_ln_domov_ele,"Ministerstvo pro místní rozvoj má chyby v účetnictví za zhruba 8 miliard korun, uvedl kontrolní úřad","Ministerstvo pro místní rozvoj (MMR) nevedlo za rok 2016 správné, úplné a průkazné účetnictví. Vyplývá to z prověrky Nejvyššího kontrolního úřadu...",lidovky.cz,domov
https://www.lidovky.cz/pruzkum-drahose-chce-47-pct-zemana-43-pct-desetina-jeste-vaha-pn3-/zpravy-domov.aspx?c=A180122_074423_ln_domov_ele,"Boj o Hrad bude těsný: Drahoše chce 47 %, Zemana 43 %, desetina ještě váhá, tvrdí průzkum","Zvolit prezidentem bývalého předsedu Akademie věd Jiřího Drahoše je rozhodnuto 47 procent voličů, pro současnou hlavu státu Miloše Zemana chce ve...",lidovky.cz,domov
https://www.lidovky.cz/novinar.aspx?idnov=2368,Šárka Kabátová,Tajemný spolek Přátel Miloše Zemana je jedním z hlavních sponzorů prezidentovy kampaně. Na Zemanovu propagaci zatím daroval přes osm milionů korun....,lidovky.cz,domov
https://sport.lidovky.cz/muzu-ji-umlatit-musim-uhrat-hodne-es-a-viteznych-uderu-burcuje-se-pliskova-1um-/ostatni-sporty.aspx?c=A180123_163434_ln-sport-ostatni_lar,"Můžu ji umlátit. Musím uhrát hodně es a vítězných úderů, burcuje se Plíšková","Vzdálený kurt číslo 21, ostré australské slunce, žádný velký šrumec. Zatímco opodál se stála fronta na podpisy Rafaela Nadala, tady v plné...",lidovky.cz,sport
https://sport.lidovky.cz/potvrzeno-stanciu-prestoupil-do-sparty-za-rekordnich-117-milionu-korun-1my-/fotbal.aspx?c=A180123_141814_ln-sport-fotbal_vlh,Potvrzeno. Stanciu přestoupil do Sparty za rekordních 117 milionů korun,Záložník Nicolae Stanciu přestoupil do Sparty a stal se nejdražším fotbalistou v historii české ligy. Pražský klub za rumunského reprezentanta...,lidovky.cz,sport
https://sport.lidovky.cz/ceske-deblistky-i-ukrajinka-svitolinova-prekvapive-vypadly-v-melbourne-ve-ctvrtfinale-gt4-/ostatni-sporty.aspx?c=A180123_090030_ln-sport-ostatni_ele,"Nadal, české tenistky a Svitolinová překvapivě vypadli v Melbourne ve čtvrtfinále","V pohromu favoritů se změnil devátý hrací den tenisového Australian Open. Ve čtvrtfinále skončil zraněný Rafael Nadal, šampion melbournského...",lidovky.cz,sport
https://sport.lidovky.cz/prazsky-magistrat-da-tenisovemu-svazu-dva-miliony-na-fed-cup-p56-/ostatni-sporty.aspx?c=A180123_115211_ln-sport-ostatni_lar,Pražský magistrát dá tenisovému svazu dva miliony na Fed Cup,Český tenisový svaz dostane od pražského magistrátu dvoumilionovou dotaci na uspořádání zápasu prvního kola Fed Cupu proti Švýcarsku. Rozhodli o tom...,lidovky.cz,sport
https://sport.lidovky.cz/dalsi-tvrda-rana-pro-rusy-do-pchjongcchangu-nesmi-jet-dva-velci-adepti-na-medaili-gd8-/ostatni-sporty.aspx?c=A180123_112331_ln-sport-ostatni_lar,Další tvrdá rána pro Rusy. Do Pchjongčchangu nesmí jet dva velcí adepti na medaili,"Biatlonista Anton Šipulin a běžec na lyžích Sergej Usťugov jsou dalšími elitními ruskými sportovci, kterým Mezinárodní olympijský výbor nepovolil...",lidovky.cz,sport
https://sport.lidovky.cz/nhl-mrazek-vychytal-druhou-nulu-za-sebou-pomohl-tak-k-vyhre-na-new-jersey-1qh-/hokej.aspx?c=A180123_080733_ln-sport-hokej_ele,NHL: Mrázek vychytal druhou nulu za sebou. Pomohl tak k výhře nad New Jersey,"Petr Mrázek vychytal v NHL podruhé za sebou čisté konto. Český gólman zneškodnil na ledě New Jersey 37 střel, dovedl Detroit k výhře 3:0 a byl...",lidovky.cz,sport
https://www.lidovky.cz/novinar.aspx?idnov=3709,Jaroslav Šindelář,"Do světel ramp dostalo korejského tenistu Čong Hjona nečekané vítězství 7:6, 7:5, 7:6 nad šestinásobným vítězem z Melbourne a bývalou světovou...",lidovky.cz,sport
https://sport.lidovky.cz/korejska-hvezda-v-ruskych-barvach-nesmi-na-domaci-hry-do-pchjongcchangu-136-/ostatni-sporty.aspx?c=A180122_192737_ln-sport-ostatni_lar,Korejská hvězda v ruských barvách nesmí na ‚domácí‘ hry do Pchjongčchangu,"Hvězda rychlobruslení na krátké dráze Viktor An je podle agentury TASS jedním z ruských sportovců, kterým komise Mezinárodního olympijského výboru...",lidovky.cz,sport
https://sport.lidovky.cz/manchester-united-ziskal-hvezdu-arsenalu-sancheze-misto-nej-jde-do-londyna-mchitarjan-gqu-/fotbal.aspx?c=A180122_194552_ln-sport-fotbal_lar,Manchester United získal hvězdu Arsenalu Sáncheze. Místo něj jde do Londýna Mchitarjan,Chilský fotbalista Alexis Sánchez přestupuje z Arsenalu do konkurenčního Manchesteru United výměnou za arménskou hvězdu Henrika Mchitarjana.,lidovky.cz,sport
https://sport.lidovky.cz/pliskova-prekvapeni-nedopustila-otocila-duel-se-strycovou-a-je-ve-ctvrtfinale-19o-/ostatni-sporty.aspx?c=A180122_153725_ln-sport-ostatni_lar,Plíšková překvapení nedopustila. Otočila duel se Strýcovou a je ve čtvrtfinále,"Karolína Plíšková stejně jako loni postoupila do čtvrtfinále Australian Open, když po Lucii Šafářové porazila i další krajanku Barboru Strýcovou 6:7,...",lidovky.cz,sport
https://sport.lidovky.cz/ronaldo-ani-behem-zapasu-neodolal-zkrvaveny-kontroloval-svuj-vzhled-na-mobilu-19l-/fotbal.aspx?c=A180122_170006_ln-sport-ostatni_lar,Zkrvavený Ronaldo ani během zápasu neodolal. Kontroloval svůj vzhled na mobilu,"Vždycky bývá perfektně načesaný, oholený, uhlazený. Ani vlásek nakřivo. Během nedělního ligového zápasu proti La Coruni ale dostal dokonalý vzhled...",lidovky.cz,sport
https://www.lidovky.cz/novinar.aspx?idnov=521,Miroslav Němý,"Co by to bylo za Australian Open, kdyby na sebe tihle dva nenarazili! Turnaj již potřetí za sebou zažije duel legendy Rogera Federera proti českému...",lidovky.cz,sport
https://www.lidovky.cz/novinar.aspx?idnov=3642,Matěj Tomíček,Snowboardová hvězda Ester Ledecká vyhrála i čtvrtý závod Světového poháru v obřím slalomu v sezoně. Nedělní zápolení pak kvůli nemoci vynechala.,lidovky.cz,sport
https://sport.lidovky.cz/berdych-citim-pohodu-jako-ve-wimbledonu-s-rogerem-musim-jit-na-hranu-11t-/ostatni-sporty.aspx?c=A180122_081629_ln-sport-ostatni_ele,Berdych: S Federerem ze sebe budu muset vymáčknout maximum,"Tomáš Berdych je zpátky tam, kde se dokázal držet dlouhé roky. „Tenis si teď moc užívám. Jsem zdravý, cítím radost – a výsledky přicházejí,“ řekl po...",lidovky.cz,sport
https://sport.lidovky.cz/berdych-presel-pres-fogniniho-do-ctvrtfinale-australian-open-puk-/ostatni-sporty.aspx?c=A180122_071647_ln-sport-ostatni_ele,"Berdych je ve čtvrtfinále Australian Open, Djokovič i Thiem překvapivě končí","Tomáš Berdych porazil v osmifinále Australian Open Itala Fabia Fogniniho hladce 6:1, 6:4 a 6:4. Devatenáctý nasazený si tak posedmé v Melbourne...",lidovky.cz,sport
https://sport.lidovky.cz/kase-a-hertl-asistovali-vegas-se-posunul-do-cela-nhl-fx9-/hokej.aspx?c=A180122_070021_ln-sport-hokej_ele,"NHL: Kaše a Hertl asistovali, Vegas se posunul do čela NHL","Hokejový útočník Ondřej Kaše si připsal v nedělním utkání NHL asistenci a byl vyhlášen druhou hvězdou zápasu, ale s Anaheimem doma podlehl San Jose...",lidovky.cz,sport
https://www.lidovky.cz/novinar.aspx?idnov=1572,Antonín Vavrda,Specializovaná společnost Gracenote počítala ještě na začátku ledna s osmi českými cennými kovy z letošní olympiády. Své počty po oficiálním ukončení...,lidovky.cz,sport
https://sport.lidovky.cz/rychlobruslarska-kralovna-sablikova-se-v-erfurtu-medailove-naladila-na-olympiadu-gjo-/ostatni-sporty.aspx?c=A180121_201451_ln-sport-ostatni_atv,Rychlobruslařská královna Sáblíková se v Erfurtu medailově naladila na olympiádu,Rychlobruslařka Martina Sáblíková úspěšně zvládla generálku na olympijské hry v Pchjongčchangu. V Erfurtu sice při Světovém poháru nedokázala...,lidovky.cz,sport
https://sport.lidovky.cz/sen-se-stal-skutecnosti-do-koreje-pojedou-take-zvaricova-a-veteran-soukup-15d-/ostatni-sporty.aspx?c=A180121_160115_ln-sport-ostatni_atv,Sen se stal skutečností. Do Koreje pojedou také Zvařičová a veterán Soukup,Český biatlonový tým pro zimní olympijské hry v Pchjongčchangu doplnili Jaroslav Soukup a Veronika Zvařičová. O obsazení posledního místa mezi ženami...,lidovky.cz,sport
https://www.lidovky.cz/novinar.aspx?idnov=521,Miroslav Němý,"Takových soupeřů se v tenisu moc nevidí. A určitě nejen proto, že má Fabio Fognini na tričku, na potítku i na čelence lebky. „Je to strašně atypický...",lidovky.cz,sport
https://sport.lidovky.cz/real-po-trech-zapasech-v-lize-zvitezil-na-demolici-se-podilel-konecne-i-ronaldo-1yd-/fotbal.aspx?c=A180121_195744_ln-sport-fotbal_atv,"Real po třech zápasech v lize zvítězil, na demolici se podílel konečně i Ronaldo",Fotbalisté Barcelony zůstali i po dvacátém kole španělské ligy neporaženi. Na hřišti Betisu Sevilla zvítězili 5:0 a v čele tabulky mají po šesté...,lidovky.cz,sport
https://sport.lidovky.cz/vydarena-generalka-sablikova-byla-pri-navratu-do-svetoveho-poharu-treti-na-trojce-gjq-/ostatni-sporty.aspx?c=A180121_173613_ln-sport-ostatni_atv,Vydařená generálka. Sáblíková byla při návratu do Světového poháru třetí na trojce,Rychlobruslařka Martina Sáblíková byla třetí v závodu na 3000 metrů na Světovém poháru v Erfurtu. V posledním startu před olympijskými hrami v...,lidovky.cz,sport
https://sport.lidovky.cz/psg-bez-neymara-o-desiti-padl-lyon-proti-lidrovi-rozhodl-v-nastaveni-1ip-/fotbal.aspx?c=A180121_230711_ln-sport-fotbal_effe,"PSG bez Neymara o desíti padl, Lyon proti lídrovi rozhodl v nastavení",Gólem ve čtvrté minutě nastavení rozhodli fotbalisté Lyonu v 22. kole francouzské ligy o vítězství 2:1 nad vedoucím Paris St. Germain. Zásluhou...,lidovky.cz,sport
https://sport.lidovky.cz/extraliga-sparta-obratila-zapas-s-vitkovicemi-a-zvitezila-potreti-v-rade-1l0-/hokej.aspx?c=A180121_192450_ln-sport-hokej_atv,Extraliga: Sparta obrátila zápas s Vítkovicemi a zvítězila potřetí v řadě,"Hokejisté Sparty obrátili v 42. kole extraligy zápas s Vítkovicemi, zvítězili 4:3 po samostatných nájezdech a radovali se z úspěchu ve vzájemném...",lidovky.cz,sport
https://www.lidovky.cz/novinar.aspx?idnov=521,Miroslav Němý,"Po mečbolu si radostně poskočila - jak by ne! Tenistka Barbora Strýcová je potřetí za sebou v osmifinále Australian Open, soupeřce dala lekci poměrem...",lidovky.cz,sport
https://sport.lidovky.cz/oba-cesi-byli-v-hromadnem-zavode-do-dvacitky-vitkove-se-generalka-na-oh-nepovedla-gfk-/ostatni-sporty.aspx?c=A180121_134342_ln-sport-ostatni_effe,"Oba Češi byli v hromadném závodě do dvacítky, Vítkové se generálka na OH nepovedla",V nedělních závodech Světového poháru s hromadným startem v Anterselvě si lépe vedla mužská část českého biatlonového týmu. Ondřej Moravec skončil...,lidovky.cz,sport
https://www.lidovky.cz/novinar.aspx?idnov=1572,Antonín Vavrda,Stíhačku žen v italské Anterselvě ovládla Němka Laura Dahlmeierová před Italkou Dorotheou Wiererovou a Běloruskou Darjou Domračevovou. Ta se v...,lidovky.cz,sport
https://sport.lidovky.cz/muller-a-lewandowski-ridili-vyhru-bayernu-nad-bremami-a-mnichov-miri-za-titulem-g01-/fotbal.aspx?c=A180121_174415_ln-sport-fotbal_atv,Müller a Lewandowski řídili výhru Bayernu nad Brémami a Mnichov míří za titulem,"Fotbalisté Bayernu Mnichov díky dvěma zásahům Thomase Müllera a Roberta Lewandowského porazili v 19. kole německé ligy Brémy 4:2, za které utkání...",lidovky.cz,sport
https://sport.lidovky.cz/australian-open-allertova-konci-v-osmifinale-woznicka-a-nadal-jdou-dal-1ew-/ostatni-sporty.aspx?c=A180121_083314_ln-sport-ostatni_ele,"Australian Open: Allertová končí v osmifinále, Woznická a Nadal jdou dál",Druhá nasazená Caroline Wozniacká z Dánska postoupila do čtvrtfinále tenisového Australian Open. Vítězka Turnaje mistryň porazila Slovenku Magdalenu...,lidovky.cz,sport
https://www.lidovky.cz/novinar.aspx?idnov=115,Jaroslav Tomas,Podmanili si extraligu. A v únoru spolu pojedou na olympiádu. Milan Gulaš a Tomáš Mertl. Jeden je nejproduktivnějším hráčem a zároveň nejlepším...,lidovky.cz,sport
https://sport.lidovky.cz/pastrnak-se-tremi-body-podilel-na-vyhre-bostonu-v-montrealu-pqw-/hokej.aspx?c=A180121_080408_ln-sport-hokej_ele,NHL: Pastrňák se třemi body podílel na výhře Bostonu v Montrealu,Útočník David Pastrňák přispěl v sobotním utkání NHL třemi body za dvě branky a asistenci k výhře hokejistů Bostonu 4:1 v Montrealu a byl zvolen...,lidovky.cz,sport
https://www.lidovky.cz/novinar.aspx?idnov=1572,Antonín Vavrda,V tureckém Erzuruma ovládla v sobotu česká olympijská šampionka Eva Samková závod Světového poháru ve snowboardcrossu. Osmý triumf mezi elitou byl...,lidovky.cz,sport
https://www.lidovky.cz/novinar.aspx?idnov=110,Jan Palička,"Rodina a přátelé už vymýšleli dárky, kterými ho 9. února překvapí. Šedesátiny se blížily. Jenže Cyrille Regis, anglický fotbalista narozený v...",lidovky.cz,sport
https://www.lidovky.cz/novinar.aspx?idnov=521,Miroslav Němý,Takhle vypadá čistá sportovní euforie - stačilo se podívat do tváře Tomáše Berdycha po jeho vítězném 3. kole na Australian Open. „Když je moje tělo v...,lidovky.cz,sport
https://www.lidovky.cz/novinar.aspx?idnov=455,Karel Knap,Převálcoval Ručinského. Jágr ho viděl brečet. V Naganu překonal Haška. Se sousedem Svobodou mastil karty. Výměna do Toronta krachla kvůli Kaberlemu....,lidovky.cz,sport
https://www.lidovky.cz/novinar.aspx?idnov=521,Miroslav Němý,"Lehké strniště na jeho tváři není v časech módních vousů ničím mimořádným, Jan Příhoda si i tak musí zvykat. „Celý minulý rok jsem chodil nahladko,“...",lidovky.cz,sport
https://www.lidovky.cz/ruske-urady-nechteji-pustit-do-kin-satiru-o-stalinovi-vyvolava-nenavist-a-nici-dustojnost-ruskeho-iqc-/kultura.aspx?c=A180123_161749_ln_kultura_ele,Ruské úřady nechtějí pustit do kin satiru o Stalinovi. ‚Vyvolává nenávist a ničí důstojnost ruského člověka‘,Ruské úřady zakázaly promítat v Rusku britsko-francouzskou filmovou komedii The Death of Stalin (Stalinova smrt) o boji o moc po smrti komunistického...,lidovky.cz,kultura
https://www.lidovky.cz/divadelni-okenko-nektera-rozhodnuti-prinaseji-jenom-zkazu-poh-/kultura.aspx?c=A180116_122150_ln_kultura_ape,DIVADELNÍ OKÉNKO: Maryša v Národním. Některá rozhodnutí přinášejí jenom zkázu,"Maryša otráví Vávru jedem nasypaným do kávy. Nebude mnoho diváků, kteří by zasedli do hlediště, aniž by tušili, jak příběh dívky provdané proti její...",lidovky.cz,kultura
https://www.lidovky.cz/nejvice-nominaci-na-oscara-ma-snimek-tvar-vody-na-paty-mu-slape-film-dunkerk-16a-/kultura.aspx?c=A180123_153046_ln_kultura_ele,"Nejvíce nominací na Oscara má snímek Tvář vody, na paty mu šlape film Dunkerk",Nejvíce nominací na americkou filmovou cenu Oscar letos připadlo snímku Tvář vody mexického režiséra Guillerma del Toro. Film z dob studené války z...,lidovky.cz,kultura
https://www.lidovky.cz/colours-of-ostrava-calexico-kaleo-dlh-/kultura.aspx?c=A180123_115416_ln_kultura_bez,"Kaleo, Calexico, Future Islands. Colours of Ostrava lákají hudební fajnšmekry","Mezinárodní festival Colours of Ostrava přidává do svého programu další čtyři velká světová jména: synth-popové Future Islands, kteří mají pověst...",lidovky.cz,kultura
https://www.lidovky.cz/film-zlaty-podraz-cechoslovaci-opet-bojuji-proti-rudym-teplakum-cccp-129-/kultura.aspx?c=A180122_112458_ln_kultura_ele,Film Zlatý podraz: Čechoslováci opět bojují proti rudým teplákům CCCP,Film Zlatý podraz je vlastně příběhem dvou vášní. Lásky mladých lidí ve válkou a totalitou zdevastované Evropě. A lásky Čechoslováků k basketbalu....,lidovky.cz,kultura
https://www.lidovky.cz/kralovna-duchu-ze-slovacka-a-studio-rubin-uvadi-hru-nobelistky-elfriede-jelinekove-gee-/kultura.aspx?c=A180122_104809_ln_kultura_ape,Královna duchů ze Slovácka. A studio Rubín uvádí hru nobelistky Elfriede Jelinekové,Studio Rote a A studio Rubín uvedou poprvé na českém jevišti hru rakouské spisovatelky Elfriede Jelinekové Královna duchů. O roli zfanatizované...,lidovky.cz,kultura
https://www.lidovky.cz/ano-i-ja-jsem-mizantrop-rika-o-sobe-vytvarnik-jan-svankmajer-pqx-/kultura.aspx?c=A180119_103102_ln_kultura_jto,"Ano, i já jsem mizantrop, říká o sobě výtvarník Jan Švankmajer",Jeho hvězdou je odjakživa surrealismus a svůj první loutkový film Poslední trik pana Schwarcewalldea a pana Edgara natočil v roce 1964. Ten poslední...,lidovky.cz,kultura
https://www.lidovky.cz/novinar.aspx?idnov=493,Jana Machalická,"Knížka herečky Marie Tomášové Věřit napsaným slovům, která má formu koláže poskládané ze vzpomínek, je něco jako otisk duše. Vroucí, okouzlené,...",lidovky.cz,kultura
https://www.lidovky.cz/den-plny-prevleku-a-kouzel-meetfactory-zve-na-soiree-michajici-nekolik-druhu-umeni-gkg-/kultura.aspx?c=A180120_144741_ln_kultura_jto,Den plný převleků a kouzel. Meetfactory zve na soirée míchající několik druhů umění,"Před půl rokem otázka, co je to „soirée”, v továrně zazněla poprvé. Nyní mají jasněji a zvou na večer galerijní dramaturgie v MeetFactory. Gili...",lidovky.cz,kultura
https://www.lidovky.cz/pri-nataceni-jsem-mel-kondom-v-zubech-rika-dansky-herec-claes-bang-phk-/kultura.aspx?c=A180119_104355_ln_kultura_jto,"Při natáčení jsem měl kondom v zubech, říká dánský herec Claes Bang",Dánský herec Claes Bang získal Evropskou filmovou cenu pro nejlepšího herce za svůj výkon v satirické komedii Čtverec švédského režiséra Rubena...,lidovky.cz,kultura
https://www.lidovky.cz/recenze-viva-lubos-plny-vnimavy-malir-zachycuje-tesne-rozpojeny-svet-1zd-/kultura.aspx?c=A180119_105056_ln_kultura_jto,RECENZE: Viva Luboš Plný! Vnímavý malíř zachycuje těsně rozpojený svět,Jediným českým výtvarníkem se na letošním benátském bienále stal samouk Luboš Plný. Pražský DOX mu nedávno otevřel zatím největší samostatnou výstavu...,lidovky.cz,kultura
https://www.lidovky.cz/recenze-povereni-nevyrazna-rozprava-o-revoluci-postrada-nasazeni-1dg-/kultura.aspx?c=A180119_101828_ln_kultura_jto,RECENZE: Pověření. Nevýrazná rozprava o revoluci postrádá nasazení,"Režisér Michal Hába a jeho soubor Lachende Bestien uvedli v české premiéře, jen několik dní před nastudováním v brněnském HaDivadle, hru známého...",lidovky.cz,kultura
https://www.lidovky.cz/stivinova-ma-novou-kolegyni-pohlavni-zivoty-siamskych-dvojcat-preobsadili-17w-/kultura.aspx?c=A180116_130609_ln_kultura_ape,Stivínová má novou kolegyni. Pohlavní životy siamských dvojčat přeobsadili,Inscenace Pohlavní životy siamských dvojčat se v pražském divadle Meetfactory dočkala velké změny. Jednu ze dvou hlavních postav vedení divadla...,lidovky.cz,kultura
https://www.lidovky.cz/recenze-domestic-arenas-nerozumime-jinym-ale-vlastne-ani-sami-sobe-1dl-/kultura.aspx?c=A180119_095523_ln_kultura_jto,"RECENZE: Domestic Arenas. Nerozumíme jiným, ale vlastně ani sami sobě","Výstava Domestic Arenas, která je ode dneška k vidění v Galerii Rudolfinum, nám připomíná, jak se dnešní společnost ztrácí v politické korektnosti a...",lidovky.cz,kultura
https://www.lidovky.cz/novinar.aspx?idnov=3899,Jaroslav Totušek,"Život Richarda Lestera je stejně pozoruhodný, jako jsou jeho filmy. Bývalý studiový uklízeč v šedesátých letech pomáhal kapelu Beatles dostat do...",lidovky.cz,kultura
https://www.lidovky.cz/novinar.aspx?idnov=3899,Jaroslav Totušek,Japonská dívčí kapela Kasotsuka Shojo (Dívky z kryptoměny) postavila celou svou uměleckou existenci na fenoménu virtuálních měn. Každá z dívek...,lidovky.cz,kultura
https://www.lidovky.cz/novinar.aspx?idnov=3899,Jaroslav Totušek,"Očekávaný filmový hit Tomb Raider na motivy stejnojmenné videoherní ságy se představuje druhou ukázkou. Slibuje akci, objevování zapomenutých hrobek...",lidovky.cz,kultura
https://www.lidovky.cz/soutez-v-hlavni-roli-pomsta-vyhrajte-knihu-divka-jmenem-sus-pla-/kultura.aspx?c=A180118_134212_ln_kultura_ape,SOUTĚŽ: V hlavní roli pomsta. Vyhrajte knihu Dívka jménem Sus,"Jonas T. Bengtsson přichází s novým románem, ve kterém nám představuje dalšího hrdinu, jenž by se jen stěží vešel do škatulky „obyčejný Dán“. Přesto...",lidovky.cz,kultura
https://www.lidovky.cz/novinar.aspx?idnov=2324,Marcel Kabát,"Lze ještě přesvědčivě vyrukovat s pravdou tak notorickou, že se tiskne na knižních záložkách a zná ji ta nejnaivnější postava z celého filmu?...",lidovky.cz,kultura
https://www.lidovky.cz/loving-vincent-tragicky-osud-slavneho-malire-jako-animovany-film-p90-/kultura.aspx?c=A180117_113440_ln_kultura_ape,Loving Vincent. Tragický osud slavného malíře jako animovaný film,Snímek o malíři Vincentovi van Goghovi s názvem Loving Vincent je první celovečerní animovaný film na světě vytvořený výhradně z olejomaleb na...,lidovky.cz,kultura
https://www.lidovky.cz/magicke-mexiko-kytara-napric-zanry-dtx-/kultura.aspx?c=A180117_161111_ln_kultura_bez,Magické Mexiko přinese do Hybernie žhavou atmosféru fiesty,Festival Kytara napříč žánry v samostatném projektu México Mágico / Magické Mexiko přinese 24. ledna do pražské Hybernie atmosféru nefalšované...,lidovky.cz,kultura
https://www.lidovky.cz/divadelni-okenko-vysmech-homofobii-i-rozmlzene-sexualni-identite-1cu-/kultura.aspx?c=A180116_125010_ln_kultura_ape,DIVADELNÍ OKÉNKO: Výsměch homofobii i rozmlžené sexuální identitě,"Židovka Helena má tři děti – lesbu, transsexuála a sadomasochistu. Homosexuální televizní bavič Charles a jeho asistent Shane vystupují v televizní...",lidovky.cz,kultura
https://www.lidovky.cz/betula-pendula-0px-/kultura.aspx?c=A180117_142343_ln_kultura_bez,Alternativní legenda Betula pendula je opět na Cestě,Na konci 80. let byla skupina Betula pendula z Valašského Meziříčí velkou hvězdou české alternativní scény.,lidovky.cz,kultura
https://www.lidovky.cz/novinar.aspx?idnov=2324,Marcel Kabát,Po ostré kritice ruských elit ve filmu Leviatan se režisér Andrej Zvjagincev v dramatu Nemilovaní vrací k tématu poničených rodinných vazeb.,lidovky.cz,kultura
