link,link_text,txt,site,area
https://www.lidovky.cz/evropska-komise-posuzuje-zpravu-olaf-o-financovani-capiho-hnizda-p9u-/zpravy-domov.aspx?c=A171222_122820_ln_domov_ele,"České úřady už vyňaly Čapí hnízdo z projektů financovaných z EU, řekla mluvčí komise",Podle Evropské komise české úřady vyňaly farmu Čapí hnízdo z projektů spolufinancovaných z evropských fondů. V pátek to...,lidovky.cz,title
//www.lidovky.cz/novinar.aspx?idnov=3839,Jiří Sládek,"V nejsledovanějších volbách ve Španělsku od chvíle, kdy tam před téměř 40 lety padla Frankova diktatura, zvítězily...",lidovky.cz,title
https://www.lidovky.cz/vlada-od-pristiho-roku-pocita-se-zrusenim-73-mist-na-ministerstvech-a-uradu-vlady-gfs-/zpravy-domov.aspx?c=A171222_114028_ln_domov_ele,Propouštění na Úřadu vlády a ministerstvech. Babišův kabinet zruší 73 míst,"Na ministerstvech a Úřadu vlády ubude 14 sekcí, zrušeno bude celkem 23 služebních a 50 pracovních míst. Na návrh...",lidovky.cz,title
//www.lidovky.cz/novinar.aspx?idnov=3554,Martin Shabu,"V kauze Čapí hnízdo, mířící na premiéra Andreje Babiše, ve čtvrtek zazněla novinka. A to u Okresního soudu Praha-západ...",lidovky.cz,title
//www.lidovky.cz/novinar.aspx?idnov=2324,Marcel Kabát,"Film režiséra Milana Cieslara se prezentuje jako komedie, ale ve skutečnosti je to děsivý horor, a to hned v několika...",lidovky.cz,title
https://www.lidovky.cz/machacek-rok-2017-v-evrope-byl-asi-lepsi-pozitivnejsi-a-klidnejsi-nez-se-cekalo-1v0-/monitor-jana-machacka.aspx?c=A171222_132833_monitor-jana-machacka_mpr,"Rok 2017 v Evropě… Byl asi lepší, pozitivnější a klidnější, než se čekalo","1. Na prvním místě v řadě dobrých zpráv stojí Francie. Hrozilo, že by se...",lidovky.cz,title
https://www.lidovky.cz/zemana-by-podle-pruzkumu-volilo-32-procent-lidi-drahose-21-5-treti-je-horacek-1r6-/zpravy-domov.aspx?c=A171222_144229_ln_domov_ele,"Zemana by podle průzkumu volilo 32 procent lidí, Drahoše 21,5. Třetí je Horáček","Stávající hlavě státu Miloši Zemanovi by v přímé volbě prezidenta dalo hlas nejvíce lidí, a to 32 procent. Vyplývá to z...",lidovky.cz,title
https://www.lidovky.cz/muz-v-praze-napadl-pestmi-dve-zeny-a-chtel-na-ne-postvat-psa-skoncily-v-nemocnici-gdy-/zpravy-domov.aspx?c=A171222_143212_ln_domov_ele,"Muž v Praze napadl pěstmi dvě ženy a chtěl na ně poštvat psa, skončily v nemocnici","Policie hledá muže, který koncem listopadu v Čimickém háji v Praze zaútočil pěstmi na dvě ženy. Navíc při tom vybízel...",lidovky.cz,title
https://www.lidovky.cz/do-kostela-chodi-pravidelne-desetina-cechu-o-vanocich-dve-petiny-p8p-/zpravy-domov.aspx?c=A171222_122514_ln_domov_ele,"Do kostela chodí pravidelně desetina Čechů, o Vánocích dvě pětiny","Jen méně než desetina Čechů chodí pravidelně, aspoň jednou měsíčně,...",lidovky.cz,title
https://www.lidovky.cz/privoz-nahrazujici-spadlou-lavku-v-troji-vypluje-poprve-v-sobotu-rano-13n-/zpravy-domov.aspx?c=A171222_121736_ln_domov_ele,Přívoz nahrazující spadlou lávku v Troji vypluje poprvé v sobotu ráno,Přívoz nahrazující zřícenou lávku mezi Císařským ostrovem a Trojou...,lidovky.cz,title
https://www.lidovky.cz/lavrov-a-johnson-se-v-moskve-pohadali-kvuli-ruskem-vmesovani-do-voleb-1kj-/zpravy-svet.aspx?c=A171222_133932_ln_zahranici_mha,Lavrov a Johnson se v Moskvě pohádali kvůli ruskému vměšování do voleb,Ministři zahraničí Ruska a Británie Sergej Lavrov a Boris Johnson se...,lidovky.cz,title
https://www.lidovky.cz/podle-spanelskeho-premiera-lze-s-katalanci-jednat-musi-ale-dodrzovat-ustavu-1vg-/zpravy-svet.aspx?c=A171222_150452_ln_zahranici_ele,Podle španělského premiéra lze s Katalánci jednat. Musí ale dodržovat ústavu,"Španělský premiér Mariano Rajoy je přesvědčen, že Katalánsko po...",lidovky.cz,title
https://www.lidovky.cz/usa-chteji-podle-putina-odejit-od-smlouvy-o-raketach-z-roku-1987-puu-/zpravy-svet.aspx?c=A171222_140737_ln_zahranici_mha,Putin: USA chtějí odejít od smlouvy o raketách středního doletu. Moskva musí reagovat,"Ruský prezident Vladimir Putin ve čtvrtek obvinil Spojené státy, že hodlají vypovědět smlouvu o raketách středního a...",lidovky.cz,title
https://byznys.lidovky.cz/uzivatele-zaluji-apple-zamerne-zpomalujete-starsi-iphony-zlobi-se-na-vyrobce-1h1-/firmy-trhy.aspx?c=A171222_152050_firmy-trhy_ele,"Uživatelé žalují Apple. Záměrně zpomalujete starší iPhony, zlobí se na výrobce",Americká technologická společnost Apple čelí ve Spojených státech dvěma hromadným žalobám kvůli záměrnému snižování...,lidovky.cz,title
https://byznys.lidovky.cz/babisova-vlada-vymenila-vetsinu-ridiciho-vyboru-ceskych-drah-pu1-/doprava.aspx?c=A171222_142705_ln-doprava_ele,Babišova vláda vyměnila většinu řídicího výboru Českých drah,Vláda v pátek vyměnila většinu řídicího výboru Českých drah a jednoho ze sedmi členů správní rady Správy železniční...,lidovky.cz,title
https://byznys.lidovky.cz/bitcoin-klesl-pod-13-tisic-dolaru-za-5-dni-ztratil-tretinu-hodnoty-px3-/firmy-trhy.aspx?c=A171222_123148_firmy-trhy_ele,"Bitcoin klesl pod 13 tisíc dolarů, za 5 dní ztratil třetinu hodnoty",Cena digitální měny bitcoin v pátek klesla pod 13 tisíc dolarů (asi...,lidovky.cz,title
https://www.lidovky.cz/plzensti-japonci-opustili-smichov-duf-/pivo.aspx?c=A171221_212642_ln_domov_ele,‚Plzeňští‘ Japonci opustili Smíchov. Staropramen bude místo piva Asahi vařit americký Miller,Pivovary Staropramen ukončily licenční výrobu prémiové značky...,lidovky.cz,title
https://sport.lidovky.cz/fanousci-komety-jedou-na-spartu-vlakem-primo-od-stadionu-pex-/hokej.aspx?c=A171222_135736_ln-sport-hokej_lar,Fanoušci Komety jedou na Spartu vlakem přímo od stadionu,Hokejisté Brna se před polednem vydali do Prahy se svými příznivci speciálně vypraveným vlakem k večernímu...,lidovky.cz,title
https://www.lidovky.cz/kde-piji-muzy-00j-/kultura.aspx?c=A171221_164432_ln_kultura_bez,"Kniha o pražských pivnicích vede čtenáře za Juráčkem, Topolem i Lidovkami",Už počtvrté zve Lukáš Berný na vycházku po populárních pražských lokálech. Aktuální svazek série...,lidovky.cz,title
https://www.lidovky.cz/beata-hlavenkova-recenze-0xn-/kultura.aspx?c=A171221_163933_ln_kultura_bez,RECENZE: U Hlavenků mají Vánoce plné hudby,Své čtvrté sólové album ladila pianistka a skladatelka Beata Hlavenková vánočně. Přestože je...,lidovky.cz,title
https://www.lidovky.cz/krev-v-mrakodrapu-nebo-rodinna-pohoda-u-krbu-jake-podoby-maji-vanoce-v-hollywoodu-g1k-/kultura.aspx?c=A171221_144227_ln_kultura_jto,Krev v mrakodrapu nebo rodinná pohoda u krbu. Jaké podoby mají Vánoce v Hollywoodu,"Některé se povedly, jiné méně. Některé jsou populární, přestože kritik by je nedoporučil. A valná...",lidovky.cz,title
https://www.lidovky.cz/rozhovor-o-sexu-a-vire-s-dlouholetou-hlavou-katolicke-cirkve-v-cechach-miloslavem-vlkem-guj-/lide.aspx?c=A171112_124515_lide_ele,"Sex a víra? Do člověka je možné vstoupit i jinak, říkal kardinál Vlk v 90. letech",U příležitosti dvacetiletého výročí magazínu Pátek Lidových novin výjimečně odemykáme rozhovory s významnými českými osobnostmi. Co všechno zmůže náš „Programátor“ a proč konec není absolutní? Někdejší pražský arcibiskup a primas český Miloslav Vlk (1932–2017) poskytl magazínu Pátek LN tento velmi...,lidovky.cz,title
https://www.lidovky.cz/proc-by-me-melo-zmenit-ze-me-videl-milion-lidi-na-platne-pta-se-anna-ctvrtnickova-g0z-/lide.aspx?c=A171221_210658_ln_noviny_ele,"Proč by mě mělo změnit, že mě viděl milion lidí na plátně, ptá se Anna Čtvrtníčková","Tahle deváťačka z Prahy bude patřit k hlavním hvězdám letošních českých televizních Vánoc. Pohádku Anděl Páně 2, kde...",lidovky.cz,title
https://www.lidovky.cz/heryan-konecne-patek-na-patek-jsem-se-tesil-jako-mlady-dneska-vyhrava-nedele-16x-/lide.aspx?c=A171221_202158_lide_ele,"HERYÁN: Konečně pátek? Těšil jsem se na něj jako mladý, dneska vyhrává neděle",Konečně pátek? Ten pocit zpravidla u mě nenastává. Od pondělka do pátku se živím jako učitel a přitom ve „volném čase“...,lidovky.cz,title
https://cestovani.lidovky.cz/prinasime-prehled-kde-se-da-v-zime-bruslit-primo-v-centrech-mest-pst-/aktuality.aspx?c=A171220_132414_ln_domov_ele,"Bruslení v centrech měst je stále oblíbenější. Podívejte se, kam vyrazit",Venkovní veřejné bruslení je mezi lidmi stále oblíbenější a roste...,lidovky.cz,title
https://www.lidovky.cz/lakadlo-pro-deti-a-bez-kosti-zkuste-letos-kapri-hranolky-pk0-/dobra-chut.aspx?c=A171204_145246_dobra-chut_ape,Lákadlo pro děti a bez kostí. Zkuste letos kapří hranolky,"Vánoce bez kapra? To by nebylo ono. Záleží jen na vás, jakému způsobu přípravy dáváte přednost. Vůně smažených rybích...",lidovky.cz,title
https://www.lidovky.cz/kostymu-je-dulezity-pomaha-vzit-se-do-role-rika-herec-igor-orozovic-1p7-/lide.aspx?c=A171214_123253_lide_ape,"Kostým je důležitý, pomáhá vžít se do role, říká herec Igor Orozovič","Hraje Švandu dudáka, podivínského Soleného ve Třech sestrách,...",lidovky.cz,title
https://cestovani.lidovky.cz/tip-na-zimni-vylet-hrad-kasperk-laka-na-specialni-prohlidky-po7-/aktuality.aspx?c=A171218_131523_aktuality_ape,Tip na zimní výlet: hrad Kašperk láká na speciální prohlídky,"Kašperk, majestátní strážní hrad v sousedství šumavských Kašperských Hor, od 28. prosince do 1. ledna otevře své brány...",lidovky.cz,title
https://www.lidovky.cz/kdo-podpori-varsavu-0q3-/nazory.aspx?c=A171221_215244_ln_nazory_ele,,Polsko platí daň za svou solitérnost v rámci EU. Každé fungující společenství má svou „zbraň posledního soudu“. NATO ji...,lidovky.cz,title
https://www.lidovky.cz/machacek-ek-zaluje-polsko-rozkol-mezi-vychodem-a-zapadem-pk1-/monitor-jana-machacka.aspx?c=A171221_124315_monitor-jana-machacka_sij,,Evropská komise se ve středu poprvé po šedesáti letech své existence rozhodla obžalovat členský stát z porušování...,lidovky.cz,title
https://www.lidovky.cz/mlatic-ne-komunista-o-cem-vypovida-snemovni-vetsina-pro-ondracka-ph6-/nazory.aspx?c=A171220_200345_ln_nazory_ele,,"Patříte-li k fajnšmekrům zkoumajícím neudálosti, jednu přineslo úterý. Poslanec Zdeněk Ondráček (KSČM) byl zvolen šéfem...",lidovky.cz,title
http://ceskapozice.lidovky.cz/nabidka-nove-internetove-sluzby-na-hlidani-senioru-narusta-pq1-/tema.aspx?c=A171220_222805_pozice-tema_lube,Nabídka nové internetové služby na hlídání seniorů narůstá,"Na staré lidi, kteří jsou v zásadě soběstační, ale pomoc by potřebovali, cílí nový typ služby. Na internetu se vedle...",lidovky.cz,title
http://ceskapozice.lidovky.cz/fotbalovy-berbrstan-opevnil-sve-hradby-fcn-/tema.aspx?c=A171222_100627_pozice-tema_houd,Fotbalový Berbrstán opevnil své hradby,"Výběr nového šéfa českého fotbalu ovlivnily bouřlivé projevy Miroslava Pelty a zástupce UEFA Grigorije Surkise, který...",lidovky.cz,title
http://ceskapozice.lidovky.cz/panama-papers-rozpacity-konec-vysetrovani-eu-kauzy-danovych-raju-1c6-/tema.aspx?c=A171220_005000_pozice-tema_lube,Panama Papers: Rozpačitý konec vyšetřování EU kauzy daňových rájů,Kauza Panama Papers ve světě postupně vyzněla do ztracena. A přinejmenším podobně končí i vyšetřování Evropského...,lidovky.cz,title
https://ekonomika.idnes.cz/uctenkovka-zavislost-sberaci-vymena-uctenek-fnt-/ekonomika.aspx?c=A171221_090851_ekonomika_pas,"VIDEO: Propadli Účtenkovce. Rozdělují nákupy, vybírají koše a s účty i kšeftují","Přibližně půl milionu Čechů hraje loterii Účtenkovka. A někteří jí úplně propadli. Nákupy u pokladny rozdělují na více částí, sbírají účtenky ze země,...",lidovky.cz,title
https://cestovani.idnes.cz/rozdelena-mesta-evropy-hranice-cesky-tesin-nova-gorica-mostar-komarno-1zt-/kolem-sveta.aspx?c=A171220_124738_kolem-sveta_hig,"Když se krájí Evropa. Smutné výlety do měst, které rozdělila hranice","Za symbol rozděleného města byl vždy především považován německý Berlín. Avšak podobná situace, kdy následkem četných dějinných událostí došlo k dělení...",lidovky.cz,title
https://byznys.lidovky.cz/uzivatele-zaluji-apple-zamerne-zpomalujete-starsi-iphony-zlobi-se-na-vyrobce-1h1-/firmy-trhy.aspx?c=A171222_152050_firmy-trhy_ele,"Uživatelé žalují Apple. Záměrně zpomalujete starší iPhony, zlobí se na výrobce",Americká technologická společnost Apple čelí ve Spojených státech dvěma hromadným žalobám kvůli záměrnému snižování výkonu některých starších...,lidovky.cz,business
https://byznys.lidovky.cz/babisova-vlada-vymenila-vetsinu-ridiciho-vyboru-ceskych-drah-pu1-/doprava.aspx?c=A171222_142705_ln-doprava_ele,Babišova vláda vyměnila většinu řídicího výboru Českých drah,Vláda v pátek vyměnila většinu řídicího výboru Českých drah a jednoho ze sedmi členů správní rady Správy železniční dopravní cesty (SŽDC). V obou...,lidovky.cz,business
https://byznys.lidovky.cz/bitcoin-klesl-pod-13-tisic-dolaru-za-5-dni-ztratil-tretinu-hodnoty-px3-/firmy-trhy.aspx?c=A171222_123148_firmy-trhy_ele,"Bitcoin klesl pod 13 tisíc dolarů, za 5 dní ztratil třetinu hodnoty","Cena digitální měny bitcoin v pátek klesla pod 13 tisíc dolarů (asi 282 tisíc korun), ještě v neděli se přitom blížila 20 tisíc dolarů. Tato...",lidovky.cz,business
https://byznys.lidovky.cz/prodejcum-zlata-pred-vanocemi-stouply-obchody-o-desitky-procent-phd-/firmy-trhy.aspx?c=A171222_110210_firmy-trhy_ele,Prodejcům zlata před Vánocemi stouply obchody o desítky procent,Hlavním prodejcům investičního zlata v Česku letos před Vánocemi meziročně vzrostl objem prodejů až o desítky procent. Výrazně vyšší zájem je i o...,lidovky.cz,business
https://pr.lidovky.cz/sprchova-toaleta-grohe-sensia-arena-nabizi-toaletu-i-bidet-v-jednom-1f0-/byz-sdeleni.aspx?c=A171208_132724_byz-sdeleni_jedli,Sprchová toaleta GROHE Sensia Arena nabízí toaletu i bidet v jednom,"Jemnou a účinnou očistu pomocí vody místo toaletního papíru vám dopřeje sprchová toaleta GROHE Sensia Arena, která se pyšní mnoha oceněními. Pořídit ji můžete...  
					celý článek",lidovky.cz,business
https://byznys.lidovky.cz/retezec-albert-se-vymanil-ze-ztrat-trzby-dosahly-50-miliard-korun-phj-/firmy-trhy.aspx?c=A171222_102049_firmy-trhy_ele,"Řetězec Albert se vymanil ze ztrát, tržby dosáhly 50 miliard korun","Tržby obchodního řetězce Albert v Česku loni stouply na 49,6 miliardy korun. Společnost dosáhla zisku 3,8 milionu korun. V předchozím finančním roce,...",lidovky.cz,business
https://byznys.lidovky.cz/facebook-chce-konkurovat-youtube-podepsal-smlouvu-se-spolecnosti-umg-1zk-/firmy-trhy.aspx?c=A171222_094418_firmy-trhy_ele,Facebook chce konkurovat YouTube. Podepsal smlouvu se společností UMG,Provozovatel sociální sítě Facebook podepsal několikaletou smlouvu s jedním z největších hudebních vydavatelství na světě Universal Music Group...,lidovky.cz,business
https://www.lidovky.cz/plzensti-japonci-opustili-smichov-duf-/pivo.aspx?c=A171221_212642_ln_domov_ele,‚Plzeňští‘ Japonci opustili Smíchov. Staropramen bude místo piva Asahi vařit americký Miller,Pivovary Staropramen ukončily licenční výrobu prémiové značky japonského koncernu Asahi. Nahradilo ji americké pivo Miller. Smíchovský pivovar...,lidovky.cz,business
https://www.lidovky.cz/novinar.aspx?idnov=3961,Jiří Bigas,Do aukce jde vůz Adolfa Hitlera. Mercedes-Benz 770K Grosser Offener Tourenwagens z roku 1939 se bude dražit 17. ledna v americkém městě Scottsdale ve...,lidovky.cz,business
https://www.lidovky.cz/novinar.aspx?idnov=3934,David Krkoška,"Firma Apple ve čtvrtek potvrdila podezření svých zákazníků a přiznala, že úmyslně zpomaluje starší verze telefonu iPhone. Snaží se tak prý zabránit...",lidovky.cz,business
https://byznys.lidovky.cz/dr-max-koupil-600-lekaren-v-rumunsku-a-stal-se-jednickou-na-trhu-puz-/firmy-trhy.aspx?c=A171221_153312_firmy-trhy_ele,Dr.Max koupil 600 lékáren v Rumunsku a stal se jedničkou na trhu,"Lékárenský řetězec Dr.Max ze skupiny Penta koupil v Rumunsku firmu A & D Pharma, která vlastní 600 lékáren Sensiblu a Punkt a také velkoobchodní...",lidovky.cz,business
https://byznys.lidovky.cz/jak-se-bude-jezdit-prahou-o-svatcich-mhd-bude-mit-o-stedrem-dni-prodlouzene-intervaly-gnj-/doprava.aspx?c=A171221_152119_ln-doprava_ele,Jak se bude jezdit Prahou o svátcích? MHD čekají o Štědrém dni prodloužené intervaly,Spoje pražské MHD budou na Štědrý den a Silvestra jezdit podle sobotních jízdních řádů. V oba svátky vánoční a na Nový rok budou platit nedělní řády....,lidovky.cz,business
https://byznys.lidovky.cz/cnb-ponechala-urokove-sazby-beze-zmeny-dyo-/statni-pokladna.aspx?c=A171221_130537_statni-pokladna_sij,ČNB ponechala úrokové sazby beze změny,Pro ponechání úrokových sazeb beze změny ve čtvrtek hlasovalo pět ze sedmi členů bankovní rady. Dva členové hlasovali pro zvýšení základní úrokové...,lidovky.cz,business
https://byznys.lidovky.cz/cd-dostaly-pokutu-368-mil-za-zneuziti-dominantniho-postaveni-plr-/doprava.aspx?c=A171221_102115_ln-doprava_ele,ČD dostaly pokutu 368 milionů za zneužití dominantního postavení,České dráhy dostaly od Úřadu pro ochranu hospodářské soutěže (ÚOHS) nepravomocnou pokutu 368 milionů korun. Zneužily dominantní postavení v soutěžích...,lidovky.cz,business
https://www.lidovky.cz/novinar.aspx?idnov=2117,Vojtěch Wolf,"Pět let byli Češi zvyklí na to, že ceny elektrické energie klesaly. Od příštího roku je tomu konec. Naopak růst nákladů může být citelný. I těm...",lidovky.cz,business
https://byznys.lidovky.cz/prezident-zeman-podepsal-statni-rozpocet-na-pristi-rok-pjn-/statni-pokladna.aspx?c=A171220_164950_ln_domov_ele,Prezident Zeman podepsal státní rozpočet na příští rok,Prezident Miloš Zeman ve středu podepsal zákon o státním rozpočtu na příští rok. Na twitteru o tom informoval jeho mluvčí Jiří Ovčáček. Rozpočet v...,lidovky.cz,business
https://byznys.lidovky.cz/soudni-dvur-eu-uber-je-prepravni-sluzba-a-musi-zadat-o-licenci-pui-/doprava.aspx?c=A171220_100002_ln-doprava_ele,Soudní dvůr EU: Uber je přepravní služba a musí žádat o licenci,"Uber je přepravní služba, a musí tedy žádat o licenci a povolení podle příslušných zákonů zemí Evropské unie. Rozhodl tak ve středu Soudní dvůr EU,...",lidovky.cz,business
https://www.lidovky.cz/novinar.aspx?idnov=3961,Jiří Bigas,"Velký bratr se dívá. Reportér BBC otestoval největší síť bezpečnostních kamer na světě. Před čínskou sledovací chobotnicí, která umí rozpoznávat...",lidovky.cz,business
https://byznys.lidovky.cz/prumerna-sazba-hypotek-v-listopadu-stoupla-na-2-15-procenta-zajem-presto-stoupa-1y5-/moje-penize.aspx?c=A171220_074717_moje-penize_ele,"Průměrná sazba hypoték v listopadu stoupla na 2,15 procenta. Zájem přesto stoupá","Průměrná úroková sazba hypoték v listopadu stoupla na 2,15 procenta z říjnových 2,10 procenta. Vyplývá to z údajů Fincentra Hypoindexu. Loni v...",lidovky.cz,business
https://byznys.lidovky.cz/snemovna-schvalila-statni-rozpocet-se-schodkem-50-miliard-korun-psp-/statni-pokladna.aspx?c=A171219_202833_statni-pokladna_ele,Sněmovna schválila státní rozpočet se schodkem 50 miliard korun. Proti byla ODS a TOP 09,Sněmovna v úterý schválila státní rozpočet na příští rok. Schválený schodek má proti letošnímu klesnout o deset miliard korun na 50 miliard korun....,lidovky.cz,business
https://byznys.lidovky.cz/tatra-zacne-montovat-svoje-nakladni-vozy-v-azerbajdzanu-dosud-je-tam-jen-vyvazela-gj1-/firmy-trhy.aspx?c=A171219_192400_firmy-trhy_ele,"Tatra začne montovat svoje nákladní vozy v Ázerbájdžánu, dosud je tam jen vyvážela","Kopřivnická automobilka Tatra začne montovat své nákladní automobily v Ázerbájdžánu, dosud je tam jen vyvážela. V Baku se na tom dohodla společnost...",lidovky.cz,business
https://byznys.lidovky.cz/miliardar-vitek-ziskal-kontrolu-nad-dostihy-v-chuchli-predstavi-novou-vizi-zavodiste-gl0-/firmy-trhy.aspx?c=A171219_180610_firmy-trhy_ele,Miliardář Vítek získal kontrolu nad dostihy v Chuchli. Představí novou vizi závodiště,"Miliardář Radovan Vítek získal kontrolu nad dostihy v pražské Velké Chuchli. Vítkova rodina získala podíl 93,6 procenta ve společnosti Turf Holding,...",lidovky.cz,business
https://byznys.lidovky.cz/cinska-cefc-a-penta-jsou-jedinymi-zajemci-o-majitele-novy-cme-plb-/firmy-trhy.aspx?c=A171219_174750_firmy-trhy_ele,"Čínská CEFC a Penta jsou jedinými zájemci o majitele Novy, CME",Čínská energetická a investiční skupina CEFC a česko-slovenská finanční skupina Penta Investments jsou jedinými zájemci o koupi podílu ve společnosti...,lidovky.cz,business
https://www.lidovky.cz/novinar.aspx?idnov=3320,Michal Pavec,"Byl to očekávaný scénář: český stát se odmítl vzdát své strategické nafty, kterou letos kompletně odvezl z německých skladů. Vydání paliva za...",lidovky.cz,business
https://byznys.lidovky.cz/mobilni-tarify-v-cr-jsou-desitky-procent-nad-eu-fl8-/firmy-trhy.aspx?c=A171219_122937_firmy-trhy_ele,Ceny mobilních tarifů jsou v Česku opět výrazně nad průměrem EU,Ceníkové ceny tuzemských mobilních operátorů jsou stále desítky procent nad evropským průměrem. Například čtyřčlenná rodina v Česku platí o 19...,lidovky.cz,business
https://byznys.lidovky.cz/hotel-za-dve-miliardy-u-staromestskeho-namesti-nebude-pfy-/firmy-trhy.aspx?c=A171219_123804_firmy-trhy_mpr,Hotel za dvě miliardy u Staroměstského náměstí nebude,"Pražští radní rozhodli o ukončení nájemních smluv se společností Akroterion, která chtěla u Staroměstského náměstí otevřít hotel Ritz-Carlton....",lidovky.cz,business
https://byznys.lidovky.cz/vsech-150-zamestnancu-poldi-dostane-vypoved-firma-je-v-konkursu-pb7-/firmy-trhy.aspx?c=A171219_121941_firmy-trhy_mpr,"Všech 150 zaměstnanců Poldi dostane výpověď, firma je v konkursu","Všichni zbývající zaměstnanci kladenské Poldi, tedy asi 150 lidí, dostanou do konce roku výpověď. Řekl to insolvenční správce Adam Sigmund. Firma je...",lidovky.cz,business
https://byznys.lidovky.cz/pruzkum-o-firemni-vecirky-neni-zajem-zamestnanci-chteji-penize-psr-/firmy-trhy.aspx?c=A171219_112636_firmy-trhy_ele,"Průzkum: O firemní večírky není zájem, zaměstnanci chtějí peníze","I když valná většina zaměstnavatelů z výrobního sektoru organizuje pro své zaměstnance vánoční večírek, lidé o ně prakticky nestojí. Podle průzkumu...",lidovky.cz,business
https://byznys.lidovky.cz/studie-osn-jen-petina-vyhozene-elektroniky-se-ve-svete-recykluje-p9f-/firmy-trhy.aspx?c=A171219_075711_firmy-trhy_mpr,Lidstvo loni vyhodilo elektroniku o váze 4500 'Eiffelovek’. Jen pětina se recykluje,"Lidstvo loni vyhodilo 44,7 milionu tun použité elektroniky, což je v průměru 6,1 kilogramu na jednoho člověka. Takový je závěr čerstvé studie...",lidovky.cz,business
https://byznys.lidovky.cz/znecisteni-ovzdusi-v-tunelech-prahy-prekracuje-limity-az-15krat-pw5-/doprava.aspx?c=A171218_164715_ln-doprava_ele,Znečištění ovzduší v pražských tunelech překračuje až 15krát limity,Znečištění vzduchu v tunelech městského silničního okruhu v Praze přesahuje povolené limity. Krátkodobá koncentrace polétavého prachu místy dosahuje...,lidovky.cz,business
https://byznys.lidovky.cz/druheho-kola-uctenkove-loterie-se-zucastnilo-temer-pul-milionu-lidi-1i1-/statni-pokladna.aspx?c=A171218_155325_statni-pokladna_ele,Druhého kola účtenkové loterie se zúčastnilo téměř půl milionu lidí,"Do druhého slosování účtenkové loterie k elektronické evidenci tržeb se zapojilo 477 952 aktivních hráčů, kteří zaregistrovali 17,2 milionu účtenek....",lidovky.cz,business
https://www.lidovky.cz/novinar.aspx?idnov=3927,Petr Kain,"Naprostá většina reklam je zaměřená na ženy, v naprosté většině případů je ale přitom alespoň doposud vytvářeli a zadávali muži. Proto nejsou reklamy...",lidovky.cz,business
https://www.lidovky.cz/novinar.aspx?idnov=3927,Petr Kain,Petr Koblic stojí v čele pražské burzy již třináct let. Takovou bilancí se nemůže pochlubit šéf žádné jiné evropské burzy. Co burzovní svět v...,lidovky.cz,business
https://www.lidovky.cz/novinar.aspx?idnov=3555,Miroslav Petr,Od ledna se v Česku opět zvýší spotřební daň z tabákových výrobků. A tím i cena kuřiva. Minimální sazba z jedné krabičky cigaret vzroste o víc než...,lidovky.cz,business
https://byznys.lidovky.cz/v-praze-zamrzlo-asi-40-tisic-bytu-proto-jdou-jejich-ceny-stale-nahoru-11r-/firmy-trhy.aspx?c=A171217_142405_firmy-trhy_ele,V Praze ‚zamrzlo‘ asi 40 tisíc bytů. Proto jdou jejich ceny stále nahoru,V Praze je v současné době v povolovacím procesu „zamrzlých“ 900 projektů s přibližně 40 tisíci byty. Toto číslo přitom výrazně narostlo v posledních...,lidovky.cz,business
https://byznys.lidovky.cz/za-darky-utratime-az-10-tisic-zeny-je-vetsinou-nakoupi-v-rijnu-muzi-na-posledni-chvili-ga0-/firmy-trhy.aspx?c=A171217_122730_firmy-trhy_ele,"Za dárky utratíme až 10 tisíc. Ženy je většinou nakoupí v říjnu, muži na poslední chvíli","Třetina lidí vůbec nekupuje vánoční stromek. Cukroví na svátky naopak peče 75 procent českých domácností, pouze tři procenta Čechů cukroví vůbec...",lidovky.cz,business
