link,link_text,txt,site,area
https://hradec.idnes.cz/ustavni-stiznost-rozsudek-vrchniho-soudu-lukas-necesany-p36-/hradec-zpravy.aspx?c=A181214_083922_hradec-zpravy_the,"Je to válka soudů, tvrdí právník Nečesaného. Podal ústavní stížnost",Advokát Lukáše Nečesaného Zdeněk Koudelka podal novou ústavní stížnost v kauze pokusu o vraždu...,idnes.cz,krimi
https://plzen.idnes.cz/vladimir-slavotinek-policie-zasahova-jednotka-pistole-mercedes-superb-plzen-honicka-zasah-zneuziti-p-i78-/plzen-zpravy.aspx?c=A181213_164328_plzen-zpravy_jzk,Soud znovu projedná zákrok důstojníka policejní zásahovky proti řidiči,Zástupce šéfa krajské zásahové jednotky Vladimír Slavotínek půjde znovu před soud za loňský...,idnes.cz,krimi
https://pardubice.idnes.cz/sklenik-plynova-kamna-smrt-ddl-/pardubice-zpravy.aspx?c=A181213_150819_pardubice-zpravy_skn,"Muž přitápěl ve skleníku, zabil ho unikající oxid uhelnatý","Hasiči se záchranáři před polednem oživovali muže z Vysokého Mýta, který si ve skleníku přitápěl...",idnes.cz,krimi
https://hradec.idnes.cz/rozsudek-biti-soud-partnerky-utok-spolubydlici-rychnovsko-ubytovna-1k3-/hradec-zpravy.aspx?c=A181213_134627_hradec-zpravy_the,"Za útok na partnerku a spolubydlícího dostal cizinec 4,5 roku vězení",Za zbití krajana kovovou tyčí a napadení partnerky si Polák Pavel G. u Krajského soudu v Hradci...,idnes.cz,krimi
https://plzen.idnes.cz/straznici-cizinec-plzen-ubytovna-modleni-nocni-klid-sanitka-pr8-/plzen-zpravy.aspx?c=A181213_132102_plzen-zpravy_jzk,"Ubytovnou se uprostřed noci nesl řev, cizinec nutil manželku k modlení",Neobvyklý případ rušení nočního klidu řešili v noci na dnešek plzeňští strážníci. Zavolala je...,idnes.cz,krimi
https://budejovice.idnes.cz/uterky-vrazda-u-schwarzenberskeho-kanalu-sumava-telo-muz-policie-patrani-15a-/budejovice-zpravy.aspx?c=A181213_125853_budejovice-zpravy_epkub,"U zavražděného na Šumavě ležely utěrky, policie pátrá po jejich původu","Policisté pátrají po původu utěrek, které ležely u muže zavražděného u Nové Pece na Šumavě. Nahé...",idnes.cz,krimi
https://hradec.idnes.cz/obvineni-obzaloba-soud-zpronevera-hekele-reditel-spolku-cerveny-kriz-hradec-kralove-gag-/hradec-zpravy.aspx?c=A181213_110356_hradec-zpravy_the,Souzeného exšéfa hradeckého červeného kříže nově obvinili ze zpronevěry,"Šéfa někdejší pobočky Českého červeného kříže v Hradci Králové, který je souzený za dotační...",idnes.cz,krimi
https://usti.idnes.cz/mrtva-prostitutka-nakladni-ulice-teplice-pitva-vrazda-policie-patra-po-pachateli-ggu-/usti-zpravy.aspx?c=A181213_121439_usti-zpravy_vac2,"Mrtvá žena nalezená v Teplicích byla zavražděna, pachatel zatím uniká","Kriminalisté stále pátrají po pachateli, jehož obětí se v Teplicích stala mladá prostitutka. Její...",idnes.cz,krimi
https://plzen.idnes.cz/ivanov-soud-terorismus-vyhruzky-drogy-tereza-h-lauha-soud-vezeni-vyhosteni-1wg-/plzen-zpravy.aspx?c=A181213_112317_plzen-zpravy_jzk,Za hrozbu Pákistánu terorem kvůli Tereze potvrdil soud 40 měsíců vězení,"Vrchní soud v Praze potvrdil 40 měsíců vězení mladému Bulharovi žijícímu v Plzni, který kvůli Češce...",idnes.cz,krimi
https://olomouc.idnes.cz/novy-malin-nehoda-kychnuti-srazka-auto-v-protismeru-f9v-/olomouc-zpravy.aspx?c=A181213_112730_olomouc-zpravy_stk,"Řidič náhle kýchl, přejel do protisměru a narazil do protijedoucího auta","Vážné následky mělo kýchnutí, které náhle přišlo na jednoho z řidičů na Šumpersku. Rozhodilo jej...",idnes.cz,krimi
https://kultura.zpravy.idnes.cz/cesky-atlas-recenze-04n-/literatura.aspx?c=A181217_121326_literatura_ts,"RECENZE: Český atlas ví, kde je Lavička neřesti a v Ostravě sopka",Posledním dílem věnovaným severní Moravě a Slezsku končí dlouholetý projekt Český atlas. Veledílo...,idnes.cz,kultura
https://kultura.zpravy.idnes.cz/ariana-grande-praha-2019-0ts-/hudba.aspx?c=A181217_123552_hudba_vha,Popová hvězda Ariana Grande přiveze v září 2019 novinky i hity,"Americká zpěvačka Ariana Grande ohlásila světové turné, na které v příštím roce vyjede na podporu...",idnes.cz,kultura
https://kultura.zpravy.idnes.cz/za-scenou-jiri-dvorak-stardance-lenka-nora-navorkova-pcz-/filmvideo.aspx?c=A181216_161339_filmvideo_kiz,"Nechtěl jsem, aby mě po parketu honili s bičem, řekl vítěz StarDance","Ač se bál, že po náročném tanečním půlroce nevstane, dorazil nakonec čerstvý vítěz letošní...",idnes.cz,kultura
https://kultura.zpravy.idnes.cz/zebrik-kin-aquaman-0nj-/filmvideo.aspx?c=A181217_133136_filmvideo_spm,"Freddieho Mercuryho sesadil z trůnu až Aquaman, našel 76 tisíc diváků",Kralování snímku Bohemian Rhapsody věnovaného Freddiemu Mercurymu ze skupiny Queen ukončil v Česku...,idnes.cz,kultura
https://kultura.zpravy.idnes.cz/divine-attraction-atmosphere-klip-d5v-/hudba.aspx?c=A181217_111216_hudba_vha,VIDEO: V Česku usazení Američané Divine Attraction míří do atmosféry,Poprockové experimentální duo Divine Attraction z Los Angeles působí dlouhodobě v Česku. Po kladně...,idnes.cz,kultura
https://kultura.zpravy.idnes.cz/ceskoslovensky-beat-fest-2018-dpx-/hudba.aspx?c=A181217_091549_hudba_vha,GLOSA: Veteráni i naděje bigbítu doputovali do Lucerny ze Slovenska,Byl to hodně vzpomínkový večer – hrály se písně Rolling Stones i rokenroly z padesátých let....,idnes.cz,kultura
https://kultura.zpravy.idnes.cz/80-vyroci-rychlych-sipu-jaroslav-foglar-kviz-fmf-/literatura.aspx?c=A180814_150132_literatura_jan,"KVÍZ: Jak znáte Rychlé šípy a Jaroslava Foglara, plantážníci?","DoporučujemeMirek Dušín, Jarka Metelka, Jindra Hojer, Červenáček a Rychlonožka. Příběhům Rychlých šípů od Jaroslava...",idnes.cz,kultura
https://vstupenky.idnes.cz/nejvetsi-cesky-festival-votvirak-nabizi-do-ledna-vyhodnejsi-vstupne-12j-/ticket.aspx?c=A181212_173043_ticket_kov,Největší český festival Votvírák nabízí do ledna výhodnější vstupné,DoporučujemeVotvírák je největší multižánrový festival zaměřený na českou a slovenskou tvorbu. Proběhne 14. - 16....,idnes.cz,kultura
https://kultura.zpravy.idnes.cz/trailer-jak-vycvicit-draka-3-dp0-/filmvideo.aspx?c=A181216_152257_filmvideo_spm,VIDEO: Utřete toho draka! Hrdina Hry o trůny baví v nevšední upoutávce,"Místo běžných sestřihů zve na film Jak vycvičit draka 3 vtipný skeč, v němž Kit Harington propojil...",idnes.cz,kultura
https://kultura.zpravy.idnes.cz/bill-burr-komik-v-praze-praha-vystoupeni-ffy-/divadlo.aspx?c=A181214_155613_divadlo_ts,"V padesáti se nechovejte jako čtyřicátníci, poradí v Praze komik Bill Burr",Časopis Rolling Stone jej označuje za jednoho z nejlepších komiků všech dob. Zda je to skutečně...,idnes.cz,kultura
https://pardubice.idnes.cz/peckova-starosta-chrudim-festival-pilny-ffr-/pardubice-zpravy.aspx?c=A181217_445901_pardubice-zpravy_skn,"Chrudimský festival je v ohrožení, pěvkyně Pecková čeká na omluvu","Po dvou ročnících možná skončí v Chrudimi festival Zlatá Pecka, který založila operní pěvkyně...",idnes.cz,kultura
https://kultura.zpravy.idnes.cz/metropolitni-opera-la-traviata-d3d-/hudba.aspx?c=A181216_125825_hudba_era,"RECENZE: Drogy si newyorská „Zbloudilá“ nepíchá, ale zato padla do kýče","Trochu připomíná Meryl Streepovou a navíc zpívá, přirozeně lépe než Božská Florence. Řeč je o...",idnes.cz,kultura
https://kultura.zpravy.idnes.cz/julius-satinsky-gundzovnik-magazin-slovart-kniha-fwp-/literatura.aspx?c=A181214_144843_literatura_kiz,"Dášeňka mě odmítla, píše Satinský ve svých klebetnících","Herec Július Satinský byl talentovaným psavcem. Psal si scénky, přispíval do časopisů. Jeden...",idnes.cz,kultura
https://kultura.zpravy.idnes.cz/mary-poppins-se-vraci-muzikal-film-dtg-/filmvideo.aspx?c=A181214_135551_filmvideo_ts,Návrat Disneyho legendy. Zpívající Mary Poppins znovu létá nad zemí,"Ještě před premiérou si muzikál Mary Poppins se vrací připsal rekord: 54 roků, jež uplynuly od...",idnes.cz,kultura
https://kultura.zpravy.idnes.cz/jelen-forum-karlin-michal-tucny-misa-tucna-koncert-recenze-par-/hudba.aspx?c=A181216_022428_hudba_vha,RECENZE: Pověste ho vejš! Jelen důstojně uctil Michala Tučného,Kromě vlastních hitů byla hlavním tahákem v sobotu zakončeného turné kapely Jelen vzpomínka na...,idnes.cz,kultura
https://kultura.zpravy.idnes.cz/bruce-springsteen-on-broadway-netflix-dha-/hudba.aspx?c=A181214_120644_hudba_vha,Springsteen a jeho show z Broadwaye míří na obrazovky počítačů,Bruce Springsteen v sobotu zazpíval a zahrál poslední tisícovce diváků intimní show v broadwayském...,idnes.cz,kultura
https://kultura.zpravy.idnes.cz/evropske-filmove-ceny-studena-valka-d7j-/filmvideo.aspx?c=A181215_202829_filmvideo_spm,"Evropským filmem roku je polská Studená válka, čestnou cenu má Fiennes","Evropským filmem roku se stala polská romance Studená válka, herecké ceny mají Marcello Fonte a...",idnes.cz,kultura
https://kultura.zpravy.idnes.cz/mariah-carey-caution-recenze-dgh-/hudba.aspx?c=A181214_153337_hudba_ts,RECENZE: Zpěvačka i autorka. Mariah Carey je stále hudebním úkazem,"Albová novinka americké zpěvačky Mariah Carey možná není přelomovou deskou, ale přináší několik...",idnes.cz,kultura
https://kultura.zpravy.idnes.cz/navsteva-recenze-narodni-divadlo-nova-scena-david-prachar-emil-hakl-1f5-/divadlo.aspx?c=A181214_132645_divadlo_ts,RECENZE: Čtyři umaštěné trosky dokázaly na Novou scénu dostat herectví,"Paranoia je od toho, aby člověk viděl realisticky. Dokumentovat samotu mne dvakrát nebaví....",idnes.cz,kultura
https://kultura.zpravy.idnes.cz/televizionar-dabel-se-tremi-zlatymi-vlasy-fjp-/filmvideo.aspx?c=A181214_115322_filmvideo_ts,TELEVIZIONÁŘ: Popelce předchází hodně chabý Ďábel se třemi zlatými vlasy,"Ještě si jich užijeme dost a dost, nicméně máme už půlku prosince a tradiční Tři oříšky pro Popelku...",idnes.cz,kultura
https://kultura.zpravy.idnes.cz/harry-potter-zeman-parodie-video-michal-orsava-fln-/filmvideo.aspx?c=A181214_170737_filmvideo_kiz,VIDEO: Takto se točila parodie na Harryho Pottera se Zemanem a Babišem,Hitem internetu se stalo video autorů Michala Orsavy a Michaely Lovecké. Jejich parodie na Harryho...,idnes.cz,kultura
https://kultura.zpravy.idnes.cz/evropske-filmove-ceny-2018-anna-geislerova-sevilla-f6h-/filmvideo.aspx?c=A181214_105201_filmvideo_ts,"O evropské Oscary zase nebojujeme, Geislerová alespoň jednu cenu předá",Historie se opakuje. Stejně jako loni nemá Česko ve finále Evropských filmových cen žádného...,idnes.cz,kultura
https://kultura.zpravy.idnes.cz/lonely-horny-only-a-studio-rubin-anita-krausova-ftq-/divadlo.aspx?c=A181214_102727_divadlo_ts,Nejen o anonymním sexu. V Rubínu zazní námluvy kosatek i disko,Ženské prsty zabořené do rozkrojeného grapefruitu. Nejnovější premiéru pražského A studia Rubín...,idnes.cz,kultura
https://kultura.zpravy.idnes.cz/febiofest-fero-fenic-0ln-/filmvideo.aspx?c=A181214_075134_filmvideo_spm,Hvězda s krabicemi. Fenič vybral deset okamžiků čtvrtstoletí Febiofestu,"Před pětadvaceti lety, 13. prosince 1993, se konal první ročník Febiofestu. Z původně komorní...",idnes.cz,kultura
https://kultura.zpravy.idnes.cz/filmove-knihy-paolo-sorrentino-tarantino-woody-allen-pfx-/literatura.aspx?c=A181213_132843_literatura_kiz,Paolo Sorrentino píše o cizích lidech. Ti zase o Allenovi a Tarantinovi,Nakladatelství Omega na trh uvedlo hned tři publikace od nebo o filmových tvůrcích. Tou...,idnes.cz,kultura
https://kultura.zpravy.idnes.cz/bob-dylan-lucerna-2019-04s-/hudba.aspx?c=A181213_154958_hudba_vha,Třikrát Dylan. Legendární písničkář zavítá v dubnu do pražské Lucerny,Americký hudebník Bob Dylan se po roce vrací do Česka. Po úžasném letošním koncertě v Brně se...,idnes.cz,kultura
https://kultura.zpravy.idnes.cz/hrdinove-audiokniha-ivan-trojan-fotbal-d91-/divadlo.aspx?c=A181212_150251_divadlo_ts,AUDIO: Připomeňte si památný zápas na Euru 2004 v podání Ivana Trojana,"Do čtrnáct let starých okamžiků, kdy čeští fotbalisté porazili na Euru 2004 v základní skupině...",idnes.cz,kultura
https://kultura.zpravy.idnes.cz/aquaman-recenze-0iw-/filmvideo.aspx?c=A181213_122158_filmvideo_ts,RECENZE: Urostlý Aquaman hraje mokrou Hru o trůny úmorných 143 minut,"Tvrdí o sobě, že není barbar, miluje umění a jako jeden z mála ještě čte knihy. Ovšem v titulní...",idnes.cz,kultura
https://kultura.zpravy.idnes.cz/trailer-godzila-ii-0nk-/filmvideo.aspx?c=A181213_091800_filmvideo_spm,VIDEO: Zase tu někdo dupe. V létě dorazí Godzilla II Král monster,Země se znovu bude otřásat pod kroky obrovitých příšer. Po filmech Godzilla či Kong: Ostrov lebek...,idnes.cz,kultura
https://kultura.zpravy.idnes.cz/krystof-na-strahove-zaznam-koncertu-recenze-f37-/hudba.aspx?c=A181213_125344_hudba_ts,RECENZE: Kapela Kryštof svůj vysněný Strahov zbytečně kouskuje,Kapela Kryštof vydala záznam ze své loňské pompézní oslavy pětadvaceti let na stadionu na Strahově...,idnes.cz,kultura
https://kultura.zpravy.idnes.cz/trailer-zkaza-dejvickeho-divadla-ivan-trojan-martha-issova-pot-/filmvideo.aspx?c=A181212_113939_filmvideo_spm,VIDEO: Celou Zkázu Dejvického divadla stihnou kina za jeden večer,Celý seriál České televize Zkáza Dejvického divadla zahrají v předpremiéře vybraná kina v jednom...,idnes.cz,kultura
https://kultura.zpravy.idnes.cz/vstupenky-na-doktor-ox-votvirak-okor-se-slevou-f52-/divadlo.aspx?c=A181211_093055_divadlo_nh,TIPY NA DÁRKY: Vánoční bonus nabízí muzikál s Kornem i největší český festival,"Vstupenky na kulturní události se staly oblíbeným vánočním dárkem a uvědomují si to i pořadatelé,...",idnes.cz,kultura
https://kultura.zpravy.idnes.cz/chinaski-forum-karlin-recenze-dkz-/hudba.aspx?c=A181213_095329_hudba_vha,"RECENZE: Chinaski učili, jak zvládnout duet bez zpěvačky a hity bez dechů",Kapela Chinaski ve středu ve vyprodaném pražském Foru Karlín završila svou první sezonu v nové...,idnes.cz,kultura
https://vstupenky.idnes.cz/titanic-vystava-brno-05k-/doporucene.aspx?c=A181217_183039_ticket-doporucene_kov,TITANIC výstava Brno,,idnes.cz,kultura
https://vstupenky.idnes.cz/lords-of-the-sound-music-is-coming-drp-/doporucene.aspx?c=A181217_143041_ticket-doporucene_kov,LORDS OF THE SOUND - Music is coming,,idnes.cz,kultura
https://vstupenky.idnes.cz/prague-philharmonic-orchestra-dzp-/doporucene.aspx?c=A181217_140106_ticket-doporucene_kov,PRAGUE PHILHARMONIC ORCHESTRA,,idnes.cz,kultura
https://vstupenky.idnes.cz/metallica-s-m-tribute-show-a-symfonicky-orchestr-f6t-/doporucene.aspx?c=A181217_133042_ticket-doporucene_kov,METALLICA S&M; Tribute Show a symfonický orchestr,,idnes.cz,kultura
https://vstupenky.idnes.cz/okor-se-stavou-2019-open-air-festival-duj-/doporucene.aspx?c=A181217_121702_ticket-doporucene_kov,Okoř se šťávou 2019 - Open air festival,,idnes.cz,kultura
https://ekonomika.idnes.cz/island-turismus-cestovni-ruch-krize-dluhopis-aerolinky-pk4-/eko-zahranicni.aspx?c=A181217_171517_eko-zahranicni_mato,Island ohrožuje turistická bublina. Klíčový sektor stagnuje,Deset let po finančním kolapsu způsobeném finanční krizí se nad severskou zemí opět stahují mračna....,idnes.cz,ekonomika
https://ekonomika.idnes.cz/prace-zamestnani-benefit-pracovni-doba-tyden-odbory-fya-/eko-zahranicni.aspx?c=A181217_143536_eko-zahranicni_mato,Méně stresu a vyhoření. Firmy zkoušejí čtyřdenní pracovní týden,"Pro mnohé zaměstnance to zní jako utopie, světové firmy však čím dál tím víc experimentují se...",idnes.cz,ekonomika
https://ekonomika.idnes.cz/financni-zprava-podvod-emaily-ministerstvo-financi-fyz-/ekonomika.aspx?c=A181217_171238_ekonomika_rts,Podvodníci v Plzeňském kraji se vydávají za berňák. Chtějí po lidech peníze,"Plzeňským krajem se se šíří e-maily, které se tváří jako oficiální obsílka finančních úřadů. Dopis...",idnes.cz,ekonomika
https://ekonomika.idnes.cz/dopravni-podnik-praha-metro-vystavba-zakazka-fa5-/ekoakcie.aspx?c=A181217_142559_ekoakcie_rts,Příprava metra D se mohla prodražit o 58 milionů. Radní sporný dodatek stopli,"Dopravní podnik hlavního města Prahy (DPP) měl v pondělí projednával dokument, který by prodražil...",idnes.cz,ekonomika
https://ekonomika.idnes.cz/vanocni-darky-amazon-distribuce-stavka-zamestnanci-fhw-/ekoakcie.aspx?c=A181217_151203_ekoakcie_jn,Vánoční dárky v ohrožení. Německá distribuční centra Amazonu stávkují,Teď by se hodil Santa Claus s rychlým spřežením sobů. Zaměstnanci dvou německých distribučních...,idnes.cz,ekonomika
https://ekonomika.idnes.cz/rakousko-afrika-eu-cesko-babis-vlada-obchod-digitalizace-p24-/eko-zahranicni.aspx?c=A181217_100525_zahranicni_luka,"EU pozvedne obchod s Afrikou, Babiš a české firmy vyrážejí do Vídně","(Od  zvláštního zpravodaje iDNES.cz)
                Digitalizace a inovace budou středobodem úterního fóra ve Vídni, kde se stovky podnikatelů i...",idnes.cz,ekonomika
https://ekonomika.idnes.cz/ucpana-d1-ministerstvo-policie-rsd-snih-kolona-dan-tok-pf4-/eko-doprava.aspx?c=A181213_115948_eko-doprava_svob,Kvůli kolapsu D1 ministerstvo zvažuje zakázat kamiony v levém pruhu,DoporučujemeMinistr dopravy Dan Ťok viní z kolapsu dopravy na dálnici D1 především řidiče kamionů a dokonce ve spolupráci...,idnes.cz,ekonomika
https://ekonomika.idnes.cz/d1-kolaps-oprava-tok-doprava-dalnice-pruh-ffo-/eko-doprava.aspx?c=A181217_090457_eko-doprava_mato,"Problémový úsek D1 se rozšíří o jeden pruh, dokončí ho jiná firma",Ředitelství silnic a dálnic (ŘSD) kvůli zpoždění prací na opravovaném úseku D1 mezi Humpolcem na...,idnes.cz,ekonomika
https://ekonomika.idnes.cz/pracovni-trh-nezamestnanost-nemecko-ekonomika-rust-benefity-pu2-/eko-zahranicni.aspx?c=A181216_130922_eko-zahranicni_mato,Nemá kdo obsluhovat. Německo bojuje s rekordním nedostatkem pracovníků,"Německo se potýká s rekordním nedostatkem zaměstnanců, v zemi je několik set tisíc volných...",idnes.cz,ekonomika
https://ekonomika.idnes.cz/trh-knihy-nakladatele-spojeni-dke-/ekonomika.aspx?c=A181216_210521_ekonomika_bur,"Na trhu s knihami se točí miliardy. Nakladatelé se spojují, aby obstáli","Ještě rok poté, co druhé největší nakladatelství Euromedia Group a jednička mezi knižními sítěmi...",idnes.cz,ekonomika
https://ekonomika.idnes.cz/hracky-cesko-svetova-velmoc-d11-/ekonomika.aspx?c=A181217_135848_ekonomika_jn,"Stavebnice, panenky, modely. Česko je evropskou hračkářskou velmocí",Česká republika je největším vývozcem hraček v Evropě. Hodnota jejich exportu dosahuje dvou miliard...,idnes.cz,ekonomika
https://ekonomika.idnes.cz/francie-protest-zlute-vesty-rozpocet-schodek-eu-pravidla-macron-phm-/eko-zahranicni.aspx?c=A181217_095836_eko-zahranicni_mato,Daň za protesty žlutých vest. Francie poruší rozpočtové pravidlo EU,"Rozpočtový schodek Francie se bude příští rok pohybovat kolem 3,2 procenta hrubého domácího...",idnes.cz,ekonomika
https://ekonomika.idnes.cz/coi-vanoce-nebezpecne-svetelne-retezy-pozar-fmr-/test.aspx?c=A181217_104219_test_jn,"ČOI objevila nebezpečné světelné řetězy na stromek, způsobí úraz i požár",Inspektoři České obchodní inspekce (ČOI) objevili v tržnicích i běžných prodejnách v západních...,idnes.cz,ekonomika
https://ekonomika.idnes.cz/prace-dalnice-d1-delnici-rsd-ddk-/ekonomika.aspx?c=A181216_153454_ekonomika_bur,ŘSD zkontrolovalo problematický úsek D1. O víkendu tu nebyl jediný dělník,"Zástupci Ředitelství silnic a dálnic (ŘSD) zkontrolovali problematický úsek dálnice D1 u Humpolce,...",idnes.cz,ekonomika
https://ekonomika.idnes.cz/norsko-ropa-zemni-plyn-klima-fosilni-paliva-fz3-/eko-zahranicni.aspx?c=A181213_130952_eko-zahranicni_mato,"Omezování fosilních paliv nás bude stát téměř bilion dolarů, varují Norové",Tlak na omezování fosilních paliv může Norsko připravit o majetek v hodnotě 800 miliard amerických...,idnes.cz,ekonomika
https://ekonomika.idnes.cz/nemocnice-naklady-lecba-pojistovna-kraje-penize-ucet-pcs-/ekonomika.aspx?c=A181214_445326_ekonomika_rts,Stejná léčba za jiné peníze. Fakultní nemocnice účtují víc než krajské,"Lidé ve městech, kde jsou velké fakultní nemocnice patřící ministerstvu, dostávají v přepočtu na...",idnes.cz,ekonomika
https://ekonomika.idnes.cz/svabi-cina-brouk-kuchynske-zbytky-odpad-f0t-/eko-zahranicni.aspx?c=A181213_105409_eko-zahranicni_svob,O zbytky jídla se v Číně místo prasat postarají švábi,"Číňané momentálně ročně vyprodukují více zbytků jídla, než jsou schopni zkompostovat. Kvůli hrozbě...",idnes.cz,ekonomika
https://ekonomika.idnes.cz/vanocni-trhy-evropa-tallinn-jakarta-drazdany-riga-norimberk-heidelberg-1nn-/eko-zahranicni.aspx?c=A181214_113934_eko-zahranicni_svob,"OBRAZEM: Svařák, Santa a ozdoby. Vánoční trhy najdete nejen v Evropě",Češi na adventních věncích brzy zapálí třetí svíčku a mnozí začínají plánovat výlety na vánoční...,idnes.cz,ekonomika
https://ekonomika.idnes.cz/varena-strava-pro-psy-mixano-hundebar-d8y-/ekonomika.aspx?c=A181213_111631_ekonomika_are,Zdravě se mohou stravovat i psi. Firmy jim vyvařují z čerstvých surovin,"Doby, kdy lidé krmili své mazlíčky zbytky od stolu a levnými granulemi, jsou pryč. Za čerstvé a...",idnes.cz,ekonomika
https://ekonomika.idnes.cz/developer-druzstvo-bydleni-vystavba-nemovitost-hypoteka-pns-/ekonomika.aspx?c=A181214_182421_ekonomika_mato,"Družstevní bydlení je na vzestupu, všímají si toho i developeři","Složí zhruba třetinu ceny bytu a zbytek splácejí. I takto mnozí Češi bydlí „ve vlastním“, aniž by...",idnes.cz,ekonomika
https://ekonomika.idnes.cz/bez-smartphonu-soutez-vitaminwater-milenialove-telefon-coca-cola-10d-/eko-zahranicni.aspx?c=A181214_094126_eko-zahranicni_div,Výzva pro závislé mileniály: 100 000 dolarů za roční půst bez smartphonu,Jsou američtí mileniálové ochotní vzdát se na jeden rok používání svého smartphonu? Značka nápojů...,idnes.cz,ekonomika
https://jihlava.idnes.cz/kolaps-d1-oprava-kaverny-humpolec-rozsireni-pruhu-geosan-stavbari-10u-/jihlava-zpravy.aspx?c=A181214_172610_jihlava-zpravy_klu,"Opravte kaverny a rozšiřte pruhy na D1 u Humpolce, nařizuje ŘSD stavbařům","Ředitelství silnic a dálnic vyzvalo firmu Geosan Group, která v konsorciu opravuje kritický úsek D1...",idnes.cz,ekonomika
https://ekonomika.idnes.cz/cr-lesy-vlada-ekologie-kurovec-kalamita-tezba-fam-/ekonomika.aspx?c=A181214_123005_ekonomika_jadv,Nižší DPH i dotace na obnovu lesů. Stát představil plán boje s kůrovcem,Ministerstvo zemědělství představilo sérii kroků pro boj s kůrovcem. Očekává se další zhoršování...,idnes.cz,ekonomika
https://ekonomika.idnes.cz/vino-zweigelt-zmena-nazvu-zweigeltrebe-nacismus-aktiviste-pq1-/eko-zahranicni.aspx?c=A181214_113136_eko-zahranicni_svob,"Změňme název odrůdy Zweigelt, byl to nacista, žádají rakouští aktivisté",Aktivisté z vídeňského kulturního centra IODE požadují změnu názvu vinné odrůdy známé jako...,idnes.cz,ekonomika
https://ekonomika.idnes.cz/recese-krize-usa-pruzkum-duke-univerzity-manazeri-firmy-pze-/eko-zahranicni.aspx?c=A181214_094943_eko-zahranicni_fih,"Růst je u konce. Příští rok zasáhne USA recese, věští američtí manažeři",Mezi americkými manažery se šíří negativní nálada. Téměř polovina finančních ředitelů oslovených v...,idnes.cz,ekonomika
https://ekonomika.idnes.cz/vanoce-cena-srovnani-zbozi-darky-naklady-ffy-/test.aspx?c=A181213_153736_test_mato,České Vánoce jsou levnější než slovenské. Může za to růst mezd,"Příjmy Čechů i Slováků v posledních letech rostly, a tak i Vánoce jsou pro průměrné domácnosti obou...",idnes.cz,ekonomika
https://ekonomika.idnes.cz/retezce-kradez-zlodej-ztrata-zbozi-kamery-bezpecnost-pfl-/ekonomika.aspx?c=A181213_194515_ekonomika_mato,"Zloději oberou řetězce o desítky milionů ročně, způsoby kradení se mění",Rozšiřování samoobslužných pokladen a dalších moderních technologií inspiruje zloděje k novým...,idnes.cz,ekonomika
https://ekonomika.idnes.cz/krvava-avokado-krev-drogy-gangy-mexiko-restaurace-konec-p2q-/eko-zahranicni.aspx?c=A181213_160009_eko-zahranicni_svob,"Konec „krvavých“ avokád. Nechceme podporovat gangy, tvrdí restaurace",Obliba avokáda během uplynulých deseti let rapidně vzrostla. Na internetu se objevily desítky...,idnes.cz,ekonomika
https://ekonomika.idnes.cz/snezeni-kalamita-silnicari-dalnice-d1-dsa-/eko-doprava.aspx?c=A181213_114431_eko-doprava_cfr,Ťok dal ultimátum stavební firmě. D1 u Humpolce má dostavět do pondělí,"Ministr dopravy Dan Ťok pohrozil česko-italskému sdružení, které modernizuje dálnici D1 u Humpolce....",idnes.cz,ekonomika
https://ekonomika.idnes.cz/dalnice-kamion-levy-pruh-zakaz-cesmad-rozhovor-flx-/eko-doprava.aspx?c=A181213_182707_eko-doprava_svob,"Už by to nebyly dálnice, říká o zákazu jízdy kamionů vlevo šéf svazu dopravců",V návaznosti na kolaps dopravy na nejvytíženější české dálnici D1 oznámil ministr dopravy Dan Ťok...,idnes.cz,ekonomika
https://ekonomika.idnes.cz/cez-platy-mzdy-odmeny-odbory-dia-/ekoakcie.aspx?c=A181213_152042_ekoakcie_rts,"Kompromis. Mzdy vzrostou alespoň o pět procent, dohodli se odboráři s ČEZ","Odboráři integrovaných dceřiných firem skupiny ČEZ, mezi které patří mimo jiné společnosti ČEZ...",idnes.cz,ekonomika
