link,link_text,txt,site,area
https://zpravy.idnes.cz/nehoda-olomoucko-umrti-079-/krimi.aspx?c=A171219_185848_krimi_evam,"Auto na Olomoucku po nehodě narazilo střechou do stromu, řidička zemřela","Při nehodě osobního automobilu zemřela v úterý u Města Libavá na Olomoucku řidička, dva spolujezdci...",idnes.cz,krimi
https://praha.idnes.cz/cizinec-berounsko-snih-led-naledi-uvazl-s-cisternou-navigace-beroun-116-/praha-zpravy.aspx?c=A171219_154205_praha-zpravy_nuc,Nizozemský řidič dovezl cisternu podle navigace do příkopu na Berounsku,"Nepříjemnou situaci zažívá řidič cisterny z Nizozemska, který se řídil navigací a dojel na zamrzlou...",idnes.cz,krimi
https://ostrava.idnes.cz/maros-gajdosik-krajsky-soud-ostrava-reskator-fom-/ostrava-zpravy.aspx?c=A171219_123612_ostrava-zpravy_jog,Reskátora soudí za postřelení souseda. Sám se chtěl zabít a oslepl,Krajský soud v Ostravě se v úterý začal zabývat údajnou vinou slovenského podnikatele Maroše...,idnes.cz,krimi
https://kultura.zpravy.idnes.cz/andel-pane-3-jiri-strach-rozhovor-doh-/filmvideo.aspx?c=A171222_102046_filmvideo_ts,"Úspěch Anděla Páně přilákal hladové psy, krmit je nehodlám, říká Strach","První pohádka o čertovi Uriášovi a andělovi Petronelovi se stala vánoční klasikou, druhý díl našel...",idnes.cz,kultura
https://kultura.zpravy.idnes.cz/marpo-chinaski-dead-man-walking-dmm-/hudba.aspx?c=A171222_151907_hudba_vha,"Na Chinaski do klubu nejdu, vyrazím na vlastní turné, říká Marpo","V tomto týdnu odehrál Otakar Petřina poslední koncert jako bubeník kapely Chinaski, z níž odchází...",idnes.cz,kultura
https://kultura.zpravy.idnes.cz/zdenek-piskula-rozhovor-pohadka-tri-bratri-nejlepsi-pritel-pql-/filmvideo.aspx?c=A171222_094735_filmvideo_ts,"Děti nejsou hloupé, proto chci do pohádek vnést inteligenci, říká Piškula","Zatímco v pohádkovém filmu Jana a Zdeňka Svěrákových Tři bratři byl Zdeněk Piškula ještě chlapcem,...",idnes.cz,kultura
https://kultura.zpravy.idnes.cz/retro-knihy-bez-praci-legraci-depeche-mode-fgv-/literatura.aspx?c=A171221_131309_literatura_kiz,Retro už umíme bez patosu. Připomeňte si reklamu na hlízy i Tatru 603,Retro je stále v kurzu. Alespoň ve světě knih. Vybírat si čtenáři tentokrát mohou mezi knihou Retro...,idnes.cz,kultura
https://kultura.zpravy.idnes.cz/ferdinand-recenze-0mm-/filmvideo.aspx?c=A171221_153105_filmvideo_ts,RECENZE: Chytrý Ferdinand. Animovaný zvířecí Gándhí dává lekci matadorům,"Není divu, že novinka našich kin jménem Ferdinand získala nedávno dvě nominace na Zlatý glóbus, pro...",idnes.cz,kultura
https://kultura.zpravy.idnes.cz/collegium-1704-a-ceska-filharmonie-koncerty-f1v-/hudba.aspx?c=A171221_124030_hudba_era,GLOSÁŘ: Duchovní výlet do Benátek a souboj v České filharmonii,Adventní koncerty nemusejí nabízet vždy jen obehrávání notoricky známých melodií. Soubor Collegium...,idnes.cz,kultura
https://kultura.zpravy.idnes.cz/trailer-smrtelne-stroje-08n-/filmvideo.aspx?c=A171220_172951_filmvideo_spm,"VIDEO: Do roka dorazí Smrtelné stroje, debut spolurežiséra Hobita","Za necelý rok, přesně 13. prosince 2018, vstoupí do našich kin akční sci-fi Smrtelné stroje....",idnes.cz,kultura
https://kultura.zpravy.idnes.cz/vrazda-krale-gonzaga-recenze-did-/divadlo.aspx?c=A171221_112251_divadlo_ts,RECENZE: Strhující vražda krále. Nejen Trojan s Myšičkou zabili Gonzaga,"Pražské Dejvické divadlo slaví pětadvacet let nezvyklou, ale strhující premiérou Vraždy krále...",idnes.cz,kultura
https://kultura.zpravy.idnes.cz/vypsana-fixa-koncert-lucerna-praha-turne-glosa-mardi-pcn-/hudba.aspx?c=A171221_121845_hudba_vha,GLOSA: Vypsaná fixa v Lucerně fungovala jako soundtrack k vylomeninám,Koncertem ve Velkém sále pražské Lucerny vyvrcholilo ve středu turné Vypsané fixy k její letošní...,idnes.cz,kultura
https://kultura.zpravy.idnes.cz/trailer-laska-nebeska-tv-vanoce-d3i-/filmvideo.aspx?c=A171220_094236_filmvideo_spm,VIDEO: Jak se měl Mr. Bean v Lásce nebeské proměnit v anděla,"K novodobé klasice televizních Vánoc patří romantická komedie Láska nebeská, kterou letos...",idnes.cz,kultura
https://kultura.zpravy.idnes.cz/do-kina-film-jumanji-vitejte-v-dzungli-spindl-ferdinand-ladime-3-cukrar-universum-brdecka-g6y-/filmvideo.aspx?c=A171219_165852_filmvideo_spm,"DO KINA: Ani Špindl, ani Jumanji. Na Zlaté globy útočí Ferdinand","Většina ze šesti novinek týdne dává najevo, že před Vánocemi chtějí diváky hlavně bavit. Včetně...",idnes.cz,kultura
https://kultura.zpravy.idnes.cz/concentus-moraviae-0oz-/hudba.aspx?c=A171221_094723_hudba_ts,"Ve vážné hudbě se dá zhmotnit Dracula, hrnec i smeták. Bach opěvoval kávu","Že i vážná hudba může být plná legrace, dokáže 23. ročník festivalu moravských měst Concentus...",idnes.cz,kultura
https://kultura.zpravy.idnes.cz/vanocni-pisne-2017-02k-/hudba.aspx?c=A171220_180203_hudba_vha,Mezi vánoční songy letos přibyly novinky i předělávky klasických hitů,"V sezoně vánočních alb pozvedly prapor především ženy, a to jak na světové scéně, tak u nás....",idnes.cz,kultura
https://kultura.zpravy.idnes.cz/hvezdne-valky-komentar-0vf-/filmvideo.aspx?c=A171219_124243_filmvideo_ts,KOMENTÁŘ: A zazvonil zvonec? Když Hvězdné války ztratí kouzlo pohádek,"Bylo nebylo, před čtyřiceti lety to vypadalo vážně jako pohádka. Jistý George Lucas měl nápad,...",idnes.cz,kultura
https://kultura.zpravy.idnes.cz/s-certy-nejsou-zerty-hynek-bocan-za-scenou-pokracovani-druhy-dil-phf-/filmvideo.aspx?c=A171219_162326_filmvideo_kiz,"Na pokračování S čerty nejsou žerty už je pozdě, řekl Bočan Za scénou","Na pokračování pohádky S čerty nejsou žerty je už pozdě, prozradil její režisér Hynek Bočan v...",idnes.cz,kultura
https://kultura.zpravy.idnes.cz/kopacky-a-zlatokopky-zavist-v-cechach-vondruska-husitska-epopej-recenze-149-/literatura.aspx?c=A171220_100207_literatura_ts,RECENZE: Pod stromeček se vejde i fotbalový erotikon či nový Vondruška,"Těm, kdo shánějí ještě na poslední chvíli něco pod stromeček, nabízí knižní trh tři české novinky.",idnes.cz,kultura
https://kultura.zpravy.idnes.cz/masters-od-rock-2018-gene-simmons-kiss-dbw-/hudba.aspx?c=A171220_155412_hudba_vha,Na Masters of Rock míří muzikant s nejdelším jazykem Gene Simmons z Kiss,Jedna z největších osobností rockové historie a zakladatel slavných Kiss Gene Simmons vystoupí...,idnes.cz,kultura
https://kultura.zpravy.idnes.cz/jumanji-vitejte-v-dzungli-recenze-drr-/filmvideo.aspx?c=A171220_111528_filmvideo_ts,RECENZE: Co se stalo z původně rodinného Jumanji? Prostě spotřební zboží,Kolega Owen Gleiberman z Variety popsal zážitek z filmu Jumanji: Vítejte v džungli! zcela přesně....,idnes.cz,kultura
https://kultura.zpravy.idnes.cz/charles-aznavour-koncert-praha-2018-dl5-/hudba.aspx?c=A171220_110246_hudba_vha,"V březnu dorazí Aznavour, legenda šansonu se vrátí po dvou letech","Působilo to jako malý zázrak, když si loni v dubnu ve svých jednadevadesáti letech dopřál svou...",idnes.cz,kultura
https://kultura.zpravy.idnes.cz/trailer-jiri-menzel-tlumocnik-simonischek-f2z-/filmvideo.aspx?c=A171220_100127_filmvideo_spm,VIDEO: V hlavní roli Jiří Menzel. Představuje se film Tlumočník,"Film režiséra Martina Šulíka Tlumočník, v němž hlavní role vytvořili oscarový tvůrce Jiří Menzel a...",idnes.cz,kultura
https://kultura.zpravy.idnes.cz/one-more-light-live-linkin-park-recenze-d9e-/hudba.aspx?c=A171219_150723_hudba_ts,RECENZE: One More Light. Chester Bennington se naživo loučí se vší parádou,"Linkin Park pustili do světa první desku od úmrtí Chestera Benningtona a poslední, na níž se osobně...",idnes.cz,kultura
https://kultura.zpravy.idnes.cz/hrebejk-tv-film-nadpraporcik-redl-ondrej-sokol-zlocin-pfi-/filmvideo.aspx?c=A171219_120404_filmvideo_spm,Ondřej Sokol jako nadpraporčík Rédl odhalí zločiny divokých 90. let,Ondřej Sokol jako nadpraporčík Rédl ve stejnojmenném thrilleru odhaluje kriminální pozadí podivného...,idnes.cz,kultura
https://kultura.zpravy.idnes.cz/spindl-recenze-film-jaroslav-sauer-milan-cieslar-vasut-polivkova-krausova-kohak-gp7-/filmvideo.aspx?c=A171219_104827_filmvideo_ts,RECENZE: Poslední letošní hřebíček do rakve českého filmu je Špindl,Až na dvě tři solidní výjimky to byl filmový rok plný utrpení a komedii Špindl teď připadla role...,idnes.cz,kultura
https://kultura.zpravy.idnes.cz/carodejky-ze-salemu-divadlo-na-vinohradech-fjs-/divadlo.aspx?c=A171219_113814_divadlo_ts,Čarodějky ze Salemu. Předvánoční Vinohrady nabízejí inkviziční drama,"Příběh zfanatizovaných dívek, kterým bylo dogmatiky dopřáno sluchu a které svými udáními o...",idnes.cz,kultura
https://kultura.zpravy.idnes.cz/vanoce-jiri-strach-anketa-andel-pane-2-dsp-/filmvideo.aspx?c=A171218_170844_filmvideo_spm,ANKETA: Jiří Strach sestavil program vánoční televize. Jaký zvolíte vy?,"Režisér Jiří Strach je favoritem letošních televizních Vánoc, na Štědrý večer vysílá ČT jeho...",idnes.cz,kultura
https://kultura.zpravy.idnes.cz/michal-prokop-rozhovor-0v6-/hudba.aspx?c=A171218_110636_hudba_ts,"Pád zdi jsem sledoval u Joea Kučery doma v Berlíně, vzpomíná Prokop",Michal Prokop se v rámci pátečního vánočního koncertu v pražském Foru Karlín vrátí ke svým...,idnes.cz,kultura
https://kultura.zpravy.idnes.cz/iva-pazderkova-klip-cerny-sal-puskin-dvx-/hudba.aspx?c=A171218_180903_hudba_vha,"VIDEO: Pazderková zpívá Puškina, klip je lehce temný a plný emocí",Herečka a zpěvačka Iva Pazderková loni vydala album nazvané Horská Lesní Ekologická Tvá Živá...,idnes.cz,kultura
https://brno.idnes.cz/chinaski-posledni-koncert-brno-dmn-/brno-zpravy.aspx?c=A171219_102730_brno-zpravy_krut,"Chinaski hráli v Brně naposledy ve starém složení, hity provázel aplaus","Hlasitým potleskem a jásáním oslavovali v pondělí večer diváci každou písničku skupiny Chinaski,...",idnes.cz,kultura
https://kultura.zpravy.idnes.cz/zivot-podle-jonesovych-divadlo-ungelt-dyf-/divadlo.aspx?c=A171218_113409_divadlo_ts,"Manželé ve střetu. Hybnerová, Hampl, Štěpánková i Táborský hrají Jonesovy","Dvě premiéry během jednoho měsíce nabídlo svým divákům Divadlo Ungelt. Po Pardálovi, ve kterém se...",idnes.cz,kultura
https://kultura.zpravy.idnes.cz/festival-hip-hop-zije-2018-praha-ostrava-hiphopovy-kontrafakt-majk-spirit-separ-pil-c-ger-/hudba.aspx?c=A171218_154725_hudba_vha,"Hiphopový festival zamíří do Prahy, nabídne průřez tuzemskou scénou","Festival Hip Hop Žije, který má ambici představit to nejlepší z české a slovenské scény, se příští...",idnes.cz,kultura
https://kultura.zpravy.idnes.cz/zebrik-kin-star-wars-0ll-/filmvideo.aspx?c=A171218_134935_filmvideo_spm,Start nového dílu Star Wars u nás vidělo 201 tisíc fanoušků,Vesmírná pohádka Star Wars je stále v módě. Na osmou epizodu Poslední z Jediů přišlo za první...,idnes.cz,kultura
https://kultura.zpravy.idnes.cz/madonna-koncert-rebel-heart-tour-recenze-ffb-/hudba.aspx?c=A171218_090927_filmvideo_ts,RECENZE: Bez křížů a banánů. Madonně ze záznamu chybí blyštivé pozlátko,"Záznam koncertu ze Sydney v rámci Rebel Heart Tour přináší stejnou show, jakou si mohlo užít i...",idnes.cz,kultura
https://kultura.zpravy.idnes.cz/joan-baez-koncert-praha-2018-0yx-/hudba.aspx?c=A171218_115002_hudba_vha,"V březnu se vrátí Joan Baez, slavná písničkářka přiveze i nové album","Jedna z nejuznávanějších hudebních ikon, americká písničkářka Joan Baez vystoupí 28. března 2018 v...",idnes.cz,kultura
https://kultura.zpravy.idnes.cz/tipy-na-darky-knihy-mraziva-hlubina-ledni-medved-lide-a-dejiny-pepouchova-recka-dovolena-gu0-/literatura.aspx?c=A171216_032239_literatura_ts,TIPY NA DÁRKY: Na zimní večery se hodí Lední medvěd i Mrazivá hlubina,"Kolekci osobních tipů zahajuje rozsáhlá kniha, která může vystačit i pilnému čtenáři na celou zimu.",idnes.cz,kultura
https://kultura.zpravy.idnes.cz/colours-of-ostrava-london-grammar-johann-johannsson-jon-hopkins-phc-/hudba.aspx?c=A171218_025832_hudba_vha,"Colours přivítají britské miláčky i producenta, který dělal s Coldplay","London Grammar, jedna z nejúspěšnějších současných britských skupin, zažije tuzemskou premiéru na...",idnes.cz,kultura
https://kultura.zpravy.idnes.cz/ceskoslovensky-beatovy-festival-po-padesati-letech-glosa-p3q-/hudba.aspx?c=A171218_024346_hudba_vha,GLOSA: Tolerance plno. Bigbíťáci tleskali Primitivům a pískali na Klause,Po půl století se v pražské Lucerně sešli někteří účastníci 1. československého beatového festivalu...,idnes.cz,kultura
https://ekonomika.idnes.cz/dluh-ceska-republika-obsluha-financovani-fp3-/ekonomika.aspx?c=A171222_140328_ekonomika_rts,Státní dluh se Česku prodražuje. Napřesrok vyjde na 352 miliard,"Ministerstvo financí bude příští rok potřebovat na financování státního dluhu 351,6 miliardy korun....",idnes.cz,ekonomika
https://ekonomika.idnes.cz/bitocin-kurz-propad-0q1-/eko-zahranicni.aspx?c=A171222_152954_eko-zahranicni_rts,"Bitcoin se propadá, za pět dní odepsal více než třicet procent","Cena digitální měny bitcoin v pátek klesla pod 12 000 dolarů, ještě v neděli se přitom blížila 20...",idnes.cz,ekonomika
https://ekonomika.idnes.cz/reklama-twisto-zakazana-0wt-/ekonomika.aspx?c=A171222_103459_ekonomika_fih,"Urážka Krista, zakázala rada televizní reklamu služby Twisto",Rada pro reklamu rázně uťala zjevení „Twista Splatitele“ na televizních obrazovkách. Spot byl po...,idnes.cz,ekonomika
https://ekonomika.idnes.cz/ceske-drahy-vlada-ministerstvo-dopravy-fcu-/eko-doprava.aspx?c=A171222_145744_eko-doprava_tanc,"Vládní personální průvan pokračuje, mění se řídicí výbor Českých drah",Vláda v pátek vyměnila většinu řídicího výboru Českých drah a jednoho ze sedmi členů správní rady...,idnes.cz,ekonomika
https://ekonomika.idnes.cz/albert-ahold-trzby-retezec-obchod-dln-/ekoakcie.aspx?c=A171222_095931_ekoakcie_tanc,Řetězec Albert se vymanil ze ztrát. Tržby zvýšil na 50 miliard korun,"Tržby obchodního řetězce Albert v Česku loni stouply na 49,6 miliardy korun. Společnost dosáhla...",idnes.cz,ekonomika
https://ekonomika.idnes.cz/boeing-embraer-fuze-obchod-akvizice-d63-/eko-doprava.aspx?c=A171222_084908_eko-doprava_fih,Velký letecký obchod na obzoru? Boeing chce koupit Embraer,Americký výrobce letadel Boeing má zájem o převzetí brazilského konkurenta Embraer. Brazilský...,idnes.cz,ekonomika
https://ekonomika.idnes.cz/alena-schillerova-ministryne-financi-rozhovor-mf-dnes-p1l-/ekonomika.aspx?c=A171221_211429_ekonomika_mpl,"Pivo zlevníme, chleba ne. Budu spíš skrblík, říká ministryně Schillerová",Nová ministryně financí Alena Schillerová hodlá snižovat daně a zároveň držet rozpočet na uzdě....,idnes.cz,ekonomika
https://ekonomika.idnes.cz/uctenkovka-zavislost-sberaci-vymena-uctenek-fnt-/ekonomika.aspx?c=A171221_090851_ekonomika_pas,"VIDEO: Propadli Účtenkovce. Rozdělují nákupy, vybírají koše a s účty i kšeftují",Přibližně půl milionu Čechů hraje loterii Účtenkovka. A někteří jí úplně propadli. Nákupy u...,idnes.cz,ekonomika
https://olomouc.idnes.cz/jesenicko-konec-zavodu-touax-supikovice-propousteni-pf0-/olomouc-zpravy.aspx?c=A171222_074018_olomouc-zpravy_fka,"Na Jesenicku končí další fabrika, Touax v Supíkovicích propustí 287 lidí",Po nedávném pádu jesenického Hardu avizuje konec další fabrika na severu Olomouckého kraje. Zánik...,idnes.cz,ekonomika
https://ekonomika.idnes.cz/facebook-vekova-diskriminace-nabor-zamestnancu-f5m-/eko-zahranicni.aspx?c=A171221_101232_eko-zahranicni_div,Diskriminace přes sociální sítě. Náboráři na nich cílí jen na mladé lidi,"Desítky společností používají v USA sociální média a technologické platformy k tomu, aby při...",idnes.cz,ekonomika
https://ekonomika.idnes.cz/potravinove-banky-statistika-charita-sbirky-jidlo-plytvani-prq-/ekonomika.aspx?c=A171221_122523_ekonomika_mato,"Darovaného jídla je stále víc. Od ledna hrozí, že se bude kazit ve skladech",Každým rokem se vybere v charitativních sbírkách víc jídla.  Od ledna navíc budou mít prodejny s...,idnes.cz,ekonomika
https://ekonomika.idnes.cz/travel-service-pronajem-letadla-dag-/eko-doprava.aspx?c=A171221_150457_eko-doprava_rts,"Zimní poločas. Travel Service pronajme 16 letadel do Kanady, USA a Haiti",Tuzemský letecký dopravce Travel Service pronajme na zimu 16 letounů Boeing 737-800 i s posádkami...,idnes.cz,ekonomika
https://ekonomika.idnes.cz/podvod-banker-fabien-gaglio-hottinger-ponziho-schema-pcw-/eko-zahranicni.aspx?c=A171219_122221_eko-zahranicni_mato,Gigantický podvod. Bankéř obral své klienty o téměř tři miliardy korun,"Před pěti lety se francouzský bankéř Fabien Gaglio přiznal, že během patnácti let obral své klienty...",idnes.cz,ekonomika
https://ekonomika.idnes.cz/lufthansa-aerolinky-evropska-komise-dusseldorf-fuq-/eko-zahranicni.aspx?c=A171221_171403_eko-zahranicni_mato,"Lufthansa nabobtná o desítky letadel, Evropská komise nákup povolila",Evropská komise ve čtvrtek schválila plán německé letecké společnosti Lufthansa na koupi divize LG...,idnes.cz,ekonomika
https://ekonomika.idnes.cz/cnb-urokova-sazba-uver-0b2-/ekonomika.aspx?c=A171221_130150_ekonomika_hm1,"Beze změny. ČNB nechala základní úrokovou sazbu 0,5 procenta","Bankovní rada ČNB dnes ponechala úrokové sazby beze změny. Základní sazba, od které se odvíjí...",idnes.cz,ekonomika
https://ekonomika.idnes.cz/niki-lauda-aerolinie-rakousko-dk1-/eko-doprava.aspx?c=A171221_141229_eko-zahranicni_mato,"Lauda se nevzdává svých leteckých snů, plánuje koupit zpátky aerolinky Niki",Bývalý automobilový závodník Niki Lauda podal nabídku na převzetí insolventních rakouských...,idnes.cz,ekonomika
https://ekonomika.idnes.cz/ceske-drahy-uohs-pokuta-konkurence-rychliky-predatorske-ceny-p6o-/eko-doprava.aspx?c=A171221_100510_eko-doprava_hm1,ČD podle úřadu použily predátorské ceny. Vyfasovaly pokutu 368 milionů,České dráhy dostaly od Úřadu pro ochranu hospodářské soutěže nepravomocnou pokutu téměř 368 milionů...,idnes.cz,ekonomika
https://ekonomika.idnes.cz/letiste-praha-pocet-odbavenych-rekord-dxz-/eko-doprava.aspx?c=A171221_094034_eko-doprava_div,Letiště Praha překonalo rekord. Odbavilo více než 15 milionů cestujících,"Pražské letiště ve čtvrtek ráno pokořilo svůj rekord. Odbavilo 15 milionů cestujících, což je...",idnes.cz,ekonomika
https://ekonomika.idnes.cz/flakani-zneuzivani-pracovniho-casu-vanoce-darky-fu9-/ekonomika.aspx?c=A171220_105845_ekonomika_fih,Honba zaměstnanců za dárky vyjde firmy draho. Každý profláká 6 tisíc,"Sto minut, tedy skoro hodinu a tři čtvrtě, zaměstnanci v tuzemských firmách v předvánočním měsíci...",idnes.cz,ekonomika
https://auto.idnes.cz/bernhard-maier-rozhovor-skoda-auto-budoucnost-elektromobil-ply-/automoto.aspx?c=A171220_132059_automoto_hig,"Procházíme největší změnou v historii, říká šéf Škody Auto","„Jezdím superbem a karoqem. Ale toho má teď půjčeného dcera a mám dojem, že mi ho hned tak...",idnes.cz,ekonomika
https://vary.idnes.cz/rozhovor-prospektor-otto-janout-lithium-cinovec-tisova-kobalt-pw8-/vary-zpravy.aspx?c=A171221_371984_vary-zpravy_ba,"Do Cínovce jsme dali deset let života, říká muž, který tam našel lithium",Krušné hory zná jako své boty. Nad mapami starých důlních děl dokáže vyprávět příběhy starých...,idnes.cz,ekonomika
https://ekonomika.idnes.cz/salmoneloza-francie-lactalis-detska-vyziva-kojenecka-vyziva-ptd-/test.aspx?c=A171221_113747_test_hm1,Salmonela v dětské výživě. Francouzi stahují 720 šarží výrobků z oběhu,Největší francouzská mlékárenská společnost Lactalis stahuje ve Francii a ve světě další výrobky...,idnes.cz,ekonomika
https://praha.idnes.cz/ricany-nemocnice-agel-praha-stredocesky-kraj-f3b-/praha-zpravy.aspx?c=A171221_111312_praha-zpravy_nuc,"Říčanskou nemocnici koupila skupina Agel, slibuje kvalitnější péči","Nemocnici v Říčanech u Prahy bude od ledna provozovat skupina Agel, která v České republice vlastní...",idnes.cz,ekonomika
https://ekonomika.idnes.cz/hypoteky-uvery-na-bydleni-refinancovani-urokova-sazba-cnb-pap-/ekonomika.aspx?c=A171220_371738_ekonomika_hm1,Superlevné úvěry končí. Hypotéky zdraží a stoupne zájem o refinancování,Půjčit si na nový byt či rekonstrukci domu bude příští rok dražší. Česká národní banka chce...,idnes.cz,ekonomika
https://ekonomika.idnes.cz/dr-max-rumunsko-akvizice-penta-nakup-lekarna-lekarny-p01-/ekoakcie.aspx?c=A171221_091304_ekoakcie_hm1,Dr.Max vzal útokem Rumunsko. Ke svým 31 lékárnám přikoupil dalších 600,"Lékárenský řetězec Dr.Max ze skupiny Penta koupil v Rumunsku firmu A & D Pharma, která vlastní 600...",idnes.cz,ekonomika
https://ekonomika.idnes.cz/cepro-pohledavky-soud-podvody-deu-/ekoakcie.aspx?c=A171215_121003_ekoakcie_are,Čepro přitahuje podvodníky. Fiktivní pohledávky trápí firmu už přes 10 let,Pokusy o tunelování státního Čepra nekončí. Kvůli podvodům vede palivářský podnik šest soudních...,idnes.cz,ekonomika
https://ekonomika.idnes.cz/nakup-kapra-cxj-/ekonomika.aspx?c=A171220_152908_ekonomika_div,"VIDEO: V čem prodejci chybují, a jak poznat, kde si koupit kapra?",Prodej kaprů je v plném proudu. Na jejich prodej se zaměřují i veterináři.  Z jejich zjištění...,idnes.cz,ekonomika
https://ekonomika.idnes.cz/gazprom-nord-stream-2-dovoz-plyn-plynovod-fgl-/eko-zahranicni.aspx?c=A171219_122407_eko-zahranicni_div,Boj o Evropu. Gazprom dá na plynovod Nord Stream 2 o desítky miliard víc,Boj o Evropu. I tak by se dala nazvat snaha ruského plynařského giganta Gazprom. Ruský vývozce...,idnes.cz,ekonomika
https://ekonomika.idnes.cz/tesco-novy-smichov-hypermarket-moda-plany-fj4-/ekoakcie.aspx?c=A171220_115903_ekoakcie_fih,Tesco na Smíchově se smrsklo na polovinu. Ve zbytku bude móda,Jedno z největších a nejziskovějších obchodních center v Česku prochází velkými změnami. Obchodní...,idnes.cz,ekonomika
https://ekonomika.idnes.cz/pohrebni-sluzby-japonsko-kremacni-okno-fct-/eko-zahranicni.aspx?c=A171220_102751_eko-zahranicni_are,Na hřbitov jako do autokina. V Japonsku zkoušejí kremační okénko,Stávají se pohřební tradice minulostí? V Japonsku totiž zprovoznili první kremační okénko. Stačí...,idnes.cz,ekonomika
https://jihlava.idnes.cz/dalnice-oprava-omezeni-velke-mezirici-lhotka-rsd-zpozdeni-penale-colas-13f-/jihlava-zpravy.aspx?c=A171220_130250_jihlava-zpravy_epsal,"Firmy nestihly opravit část D1 před zimou, hrozí dlouhé uzavírky",Postupná rekonstrukce dálnice D1 mezi Prahou a Brnem se výrazně „zasekla“ v úseku mezi 146. a 153....,idnes.cz,ekonomika
https://ekonomika.idnes.cz/uber-prepravni-sluzba-zprostredkovatel-soudni-dvur-eu-pj0-/eko-doprava.aspx?c=A171220_095808_eko-doprava_hm1,"Uber je přepravní služba a musí mít licenci, rozhodl Soudní dvůr EU","Uber je přepravní služba, a musí tedy žádat o licenci a povolení podle příslušných zákonů zemí...",idnes.cz,ekonomika
https://ekonomika.idnes.cz/unipetrol-minoritni-akcionar-paulinino-limited-pkn-orlen-pnd-/ekoakcie.aspx?c=A171220_092330_ekoakcie_fih,J&T; pustila svůj podíl v Unipetrolu. Poláci budou mít už 80 procent,"Společnost Paulinino Limited, která je součástí skupiny J&T;, prodá polské společnosti PKN Orlen...",idnes.cz,ekonomika
https://ekonomika.idnes.cz/mcdonald-s-vegan-burger-finsko-svedsko-novinka-fli-/test.aspx?c=A171220_082002_test_fih,McDonald’s rozšiřuje nabídku o veganský burger. Zatím ve Finsku a Švédsku,"Po Finsku také ve Švédsku nasadí řetězec restaurací McDonald’s veganský burger. Sendvič McVegan,...",idnes.cz,ekonomika
https://ekonomika.idnes.cz/vlada-rozpocet-ministerstvo-financi-dsm-/ekonomika.aspx?c=A171219_193740_ekonomika_evam,"Rozpočet na příští rok bude opět štědrý, spoléhá se na růst","Češi si na své útraty mají zase půjčovat, přestože ekonomika bude pokračovat v růstu nebývalým...",idnes.cz,ekonomika
https://bydleni.idnes.cz/rekonstrukce-a-dostavba-domu-dum-architekt-fk1-/rekonstrukce.aspx?c=A171221_093458_stavba_rez,"Architekti, kteří mají radši rekonstrukce než novostavby. Ctí historii",V přírodě se koloběh nezastaví. Nové vystřídá staré. Podobně tomu bývá i u domů. Starý dům je...,idnes.cz,bydleni
https://bydleni.idnes.cz/garsonka-rekonstrukce-pronajem-airbnb-byt-v-praze-maly-byt-1-kk-p7q-/rekonstrukce.aspx?c=A171218_153422_rekonstrukce_web,"Obývák, ložnice a jídelní kout v jednom. Vše vyřešil šikovný nápad",I na pár metrů čtverečních se dá vměstnat celý byt. Díky nápaditosti designérů je možné rychle...,idnes.cz,bydleni
https://bydleni.idnes.cz/norsko-vanoce-stedry-den-vyzdoba-ozdoby-stromecek-fwx-/architektura.aspx?c=A171219_174136_architektura_web,Dům z katalogu předělávali půl roku. Všechno mají do puntíku promyšlené,Norská novinářka a blogerka Anette Talstadová slaví se svým partnerem Jogeirem Skinnesem a dvěma...,idnes.cz,bydleni
https://bydleni.idnes.cz/vanocni-darky-do-bytu-0tj-/architektura.aspx?c=A171220_211719_architektura_rez,Designové dárky na poslední chvíli aneb jak nakoupit v pohodě a klidu,Kupujete dárky na poslední chvíli? Nic výjimečného. Pokud zrovna nemilujete nákupní centra a...,idnes.cz,bydleni
