link,link_text,txt,site,area
https://www.lidovky.cz/hvezda-sexu-ve-meste-potvrdila-kandidaturu-na-guvernerku-new-yorku-11a-/lide.aspx?c=A180319_192532_lide_ele,Hvězda Sexu ve městě kandiduje na guvernérku New Yorku. Nixonová by mohla nahradit nepopulárního Cuoma,Hvězda seriálu a filmů Sex ve městě Cynthia Nixonová v pondělí oznámila kandidaturu na post guvernérky New Yorku. Svou...,lidovky.cz,title
https://byznys.lidovky.cz/test-samoriditelneho-vozu-skoncil-v-arizone-tragicky-pri-nehode-zemrela-zena-1xr-/auto.aspx?c=A180319_180447_ln-auto_ele,"První oběť samořiditelného vozu. V Arizoně testovací vůz Uberu srazil ženu, nehodu nepřežila","Zkušební jízda samořiditelného vozidla Uber dopadla v Arizoně smrtelnou nehodou, při které zemřela jedna žena....",lidovky.cz,title
https://www.lidovky.cz/predstavitele-sanghaje-potvrdili-mynarovi-ze-sef-cefc-je-v-cine-vysetrovan-pro-poruseni-zakona-i23-/zpravy-domov.aspx?c=A180319_163436_ln_zahranici_ele,"Šéf CEFC je v Číně vyšetřován pro porušení zákona, odejde z vedení firmy. Zemanovým poradcem zatím zůstane","Šéf CEFC a poradce prezidenta Miloše Zemana Jie Ťien-ming je v Číně vyšetřován pro podezření z porušení zákona,...",lidovky.cz,title
//www.lidovky.cz/novinar.aspx?idnov=3851,Martin Hampejs,V novém volebním období prezidenta Vladimira Putina můžeme očekávat zesílení ruského nátlaku na Západ a mezinárodní...,lidovky.cz,title
//www.lidovky.cz/novinar.aspx?idnov=3890,Jan Horák,"V průběhu jara přibude v Praze nové zdravotnické zařízení. Otevře se v části letohrádku Hadovka, jenž přiléhá k pozemku...",lidovky.cz,title
https://www.lidovky.cz/machacek-vypukne-v-patek-obchodni-valka-s-usa-f37-/monitor-jana-machacka.aspx?c=A180319_124238_monitor-jana-machacka_sij,Vypukne v pátek obchodní válka s USA?,Trumpova zahraniční politika se jeví příliš často jako velice náhodná. Píše to...,lidovky.cz,title
https://www.lidovky.cz/atom-muzeum-v-brdech-ziskalo-do-expozic-jadernou-minu-pdy-/zpravy-domov.aspx?c=A180319_184442_ln_domov_ele,Atom muzeum v Brdech získalo do expozic jadernou minu,"Atom muzeum v Brdech, bývalý sklad sovětské jaderné munice, získalo jadernou minu. Zájem o prohlídky expozic loni...",lidovky.cz,title
https://www.lidovky.cz/babis-zahajil-kazenske-rizeni-s-murinem-kvuli-udajnemu-kazenskemu-prestupku-sef-gibs-se-chce-branit-irf-/zpravy-domov.aspx?c=A180319_151846_ln_domov_gib,Babiš zahájil řízení s Murínem kvůli údajnému kázeňskému přestupku. Šéf GIBS se chce bránit,Premiér v demisi Andrej Babiš (ANO) v pondělí zahájil kázeňské řízení s ředitelem Generální inspekce bezpečnostních...,lidovky.cz,title
https://www.lidovky.cz/cizinec-celi-obzalobe-za-silvestrovskou-nehodu-v-praze-usmrtil-pri-ni-turistku-gdb-/zpravy-domov.aspx?c=A180319_160458_ln_domov_ele,"Cizinec čelí obžalobě za silvestrovskou nehodu v Praze, usmrtil při ní turistku","Státní zastupitelství obžalovalo cizince, který o silvestrovské noci...",lidovky.cz,title
https://www.lidovky.cz/ruske-tvrzeni-o-puvodu-novicoku-by-mela-odmitnout-vlada-uvedli-senatori-1qd-/zpravy-domov.aspx?c=A180319_150418_ln_domov_ele,"Ruské tvrzení o původu Novičoku by měla odmítnout vláda, uvedli senátoři",Vláda ANO by podle skupiny senátorů měla odmítnout spekulativní...,lidovky.cz,title
https://www.lidovky.cz/utok-v-salisbury-je-cast-vzorce-ruskeho-chovani-mini-stoltenberg-py9-/zpravy-svet.aspx?c=A180319_180222_ln_zahranici_ele,"Útok v Salisbury je část vzorce ruského chování, míní Stoltenberg",Dosavadní reakce Ruské federace v souvislosti s nedávným použitím...,lidovky.cz,title
https://www.lidovky.cz/ukrajinsky-pilot-ktereho-rusko-vinilo-ze-sestreleni-mh17-byl-nalezen-mrtvy-16r-/zpravy-svet.aspx?c=A180319_144107_ln_zahranici_ele,"Ukrajinský pilot, kterého Rusko obvinilo ze sestřelení MH17, byl nalezen mrtvý",Bývalý ukrajinský pilot Vladislav Vološin obviňovaný Moskvou ze...,lidovky.cz,title
https://www.lidovky.cz/spolecnost-ziskala-data-o-milionech-uzivatelu-facebooku-vyuzila-je-i-pri-volbach-v-usa-glm-/zpravy-svet.aspx?c=A180319_125835_ln_zahranici_mha,Společnost nečestně získala data o uživatelích Facebooku. Využila je i při volbách v USA,Na sociální síť Facebook a jejího generálního ředitele Marka Zuckerberga se snesla kritika od zákonodárců z obou stran...,lidovky.cz,title
https://byznys.lidovky.cz/jedna-z-nejbohatsich-charit-ma-na-uctu-475-miliard-korun-odkazal-ji-to-zakladatel-ikea-ged-/firmy-trhy.aspx?c=A180319_150726_firmy-trhy_ele,"Jedna z nejbohatších charit má na účtu 475 miliard korun, odkázal jí je zakladatel IKEA","Zakladatel nábytkové velmoci IKEA, Ingvar Kamprad, odkázal švédské neziskové organizaci Kamprad Family Foundation sumu...",lidovky.cz,title
https://www.lidovky.cz/vyvoz-ceskeho-piva-do-ciny-loni-klesl-temer-o-polovinu-p12-/pivo.aspx?c=A180319_142834_ln-pivo_pkk,Vývoz českého piva do Číny loni klesl téměř o polovinu,Vývoz českého piva do Číny se loni snížil o 43 procent na 19 585 hektolitrů. Uvádějí to celní statistiky. Export tak...,lidovky.cz,title
https://byznys.lidovky.cz/tok-chce-usetrit-750-milionu-pri-provozu-myta-vyzval-kapsch-k-jednani-1gq-/doprava.aspx?c=A180319_135301_ln-doprava_pkk,Ťok chce ušetřit 750 milionů při provozu mýta. Vyzval Kapsch k jednání,Ministr dopravy Dan Ťok vyzval vedení firmy Kapsch k jednání o...,lidovky.cz,title
https://byznys.lidovky.cz/pri-deleni-cez-musi-strategicke-veci-zustat-statu-uvedl-babis-puu-/firmy-trhy.aspx?c=A180319_125730_firmy-trhy_ele,"Při dělení ČEZ musí strategické věci zůstat státu, uvedl Babiš",Při případném dělení energetické společnosti ČEZ si vláda musí...,lidovky.cz,title
https://sport.lidovky.cz/neni-to-fer-dostavam-desetkrat-mene-penez-nez-mcenroe-zlobi-se-navratilova-1tv-/ostatni-sporty.aspx?c=A180319_104415_ln-sport-ostatni_lar,"Není to fér. Dostávám desetkrát méně peněz než McEnroe, zlobí se Navrátilová",Dlouholetá bojovnice za rovnost pracovních příležitostí pro obě pohlaví Martina Navrátilová se zlobí. V rozhovoru pro...,lidovky.cz,title
https://www.lidovky.cz/chlapec-z-medu-herec-shia-labeouf-si-ve-sve-autobiografii-zahraje-vlastniho-otce-g05-/kultura.aspx?c=A180319_112943_ln_kultura_jto,Chlapec z medu. Herec Shia LaBeouf si ve své autobiografii zahraje vlastního otce,Hollywoodský herec Shia LaBeouf si napsal a bude také režírovat svůj autobiografický snímek Honey...,lidovky.cz,title
https://www.lidovky.cz/navstevnosti-kin-vevodila-druhy-tyden-ceska-komedie-tatova-volha-p9t-/kultura.aspx?c=A180319_155822_ln_kultura_ele,Návštěvnosti kin vévodila druhý týden česká komedie Tátova volha,Víkendové návštěvnosti tuzemských kin vévodila již druhý týden česká komedie Tátova volha....,lidovky.cz,title
https://www.lidovky.cz/milostny-trojuhelnik-anny-polivkove-v-nove-ceske-komedii-je-prebytek-nevest-1wn-/kultura.aspx?c=A180319_105052_ln_kultura_jto,Milostný trojúhelník Anny Polívkové. V nové české komedii je přebytek nevěst,"Komedie Dvě nevěsty a jedna svatba režiséra Tomáše Svobody vypráví o tom, že stará láska nerezaví....",lidovky.cz,title
https://cestovani.lidovky.cz/nomadi-rodina-s-detmi-cestuje-po-evrope-s-karavanem-f8a-/aktuality.aspx?c=A180315_114133_aktuality_ape,NOMÁDI: Rodina s dětmi cestuje po Evropě s karavanem,"My rodiče, i naše děti máme něco odcestováno, takže by se dalo říct, že jsme taková podivná rodina z karavanu. Ale pro nás jsme pořád Víťa, Renata, Magdalénka a Viktorka Válkovi. Víťa pracuje jako User Interface designér na volné noze a mě cestování zaválo k profesi virtuální asistentky.",lidovky.cz,title
https://www.lidovky.cz/hawking-budoucim-pokolenim-zanechal-touhu-po-teorii-vseho-mini-astrofyzik-grygar-gju-/lide.aspx?c=A180318_005936_lide_prop,"Hawking budoucím pokolením zanechal touhu po Teorii všeho, míní astrofyzik Grygar",Stephen Hawking zvládl na jedničku roli vědce i celebrity. Zůstanou po něm nejen objevy z oblasti kosmologie a černých...,lidovky.cz,title
https://relax.lidovky.cz/kuvajtane-miluji-lanyze-prodejci-svadeji-tvrde-boje-o-mista-na-prodej-12v-/zajimavosti.aspx?c=A180318_171618_ln-zajimavosti_ele,"Kuvajťané milují lanýže, prodejci svádějí tvrdé boje o místa na prodej","Kuvajťané mají lanýže v mimořádné oblibě. Ne ty černé, známé z Evropy, ale bílé, které nacházejí v poušti. Prodejci...",lidovky.cz,title
https://relax.lidovky.cz/brnensky-veletrh-predstavil-kouzelneho-medvidka-pomuze-novorozencum-s-usinanim-gi4-/veda.aspx?c=A180318_174050_ln_veda_ele,Brněnský veletrh představil kouzelného medvídka. Pomůže novorozencům s usínáním,Jedním z trendů posledních let je pomáhat novorozeným dětem při...,lidovky.cz,title
https://relax.lidovky.cz/autobus-pro-male-ctenare-za-afganskymi-detmi-jezdi-pojizdna-knihovna-1j4-/zajimavosti.aspx?c=A180318_172845_ln-zajimavosti_ele,Autobus pro malé čtenáře. Za afgánskými dětmi jezdí pojízdná knihovna,"Kábulské děti milují modrý autobus - pokaždé, když zastaví v jejich ulici, se k němu dychtivě rozběhnou a oči jim září...",lidovky.cz,title
https://www.lidovky.cz/harry-s-meghan-nejradeji-sledovali-serial-o-alzbete-ii-pise-novinarka-v-knize-o-princove-soukromi-ime-/lide.aspx?c=A180317_154609_lide_ELE,"Harry s Meghan nejraději sledovali seriál o Alžbětě II., píše novinářka v knize o princově soukromí",Svatba britského prince Harryho a americké herečky Meghan Markleové...,lidovky.cz,title
https://cestovani.lidovky.cz/klastery-se-otviraji-nabizeji-turistum-pristresi-i-nahlednuti-do-zivota-uvnitr-gp6-/aktuality.aspx?c=A180317_205017_ln_domov_ele,Kláštery se otvírají. Nabízejí turistům přístřeší i nahlédnutí do života uvnitř,Historie sahá až do 14. století. V osmnáctém mu vnukli barokní podobu slavní architekti Kryštof a Kilián Ignác...,lidovky.cz,title
https://www.lidovky.cz/petracek-bez-opozice-k-putinovi-schazi-alternativ-fw0-/nazory.aspx?c=A180318_222419_ln_nazory_ele,,"Víte vůbec, že přímá volba ruského prezidenta je dvoukolová? Podobně jako ve Francii? Běžný člověk to ani vědět...",lidovky.cz,title
https://www.lidovky.cz/prochazkova-mobilizace-strachem-i-jisty-vysledek-si-putin-pojistuje-znejistovanim-volicu-ghu-/nazory.aspx?c=A180316_230210_ln_nazory_mpr,,Sázkové kanceláře by na letošních prezidentských volbách v Rusku nejspíš prodělaly kalhoty. Výsledek je tak jasný a...,lidovky.cz,title
https://www.lidovky.cz/machacek-americky-televizni-ekonom-u-vesla-a-jeho-hesla-pgg-/monitor-jana-machacka.aspx?c=A180316_133122_monitor-jana-machacka_sij,,Po odchodu Garyho Cohna se šéfem ekonomických poradců prezidenta Donalda Trumpa stane „televizní ekonom“ Larry Kudlow....,lidovky.cz,title
http://ceskapozice.lidovky.cz/dreveny-svycarsky-dum-uz-ve-spindlerove-mlyne-nikdo-neuvidi-p54-/tema.aspx?c=A180316_010729_pozice-tema_lube,Dřevěný Švýcarský dům už ve Špindlerově Mlýně nikdo neuvidí,"Tradiční dominanta Špindlerova Mlýna padla. Koncem loňského roku byla Švýcárna, jak domu Špindleromlýnští přezdívali, k...",lidovky.cz,title
http://ceskapozice.lidovky.cz/za-sesazenim-tillersona-muze-byt-spor-o-blizkovychodni-politiku-pyt-/tema.aspx?c=A180319_093333_pozice-tema_houd,Za sesazením Tillersona může být spor o blízkovýchodní politiku,"Když v úterý americký prezident Donald Trump na Twitteru oznámil, že právě sesadil svého ministra zahraničí Rexe...",lidovky.cz,title
http://ceskapozice.lidovky.cz/tuzemsky-export-nove-pod-jednou-strechou-ministerstva-financi-pwz-/tema.aspx?c=A180316_120412_pozice-tema_lube,Tuzemský export nově pod jednou střechou ministerstva financí,Na základě rozhodnutí vlády v demisi Andreje Babiše (ANO) by měly Exportní garanční a pojišťovací společnost (EGAP) a...,lidovky.cz,title
https://zpravy.idnes.cz/lide-ceska-koroner-stanislav-gutvirth-rozhovor-fty-/lide-ceska.aspx?c=A180220_160424_lide-ceska_mav,KORONER: Smrt je blbá. Zmařené životy mladých mi v hlavě leží dlouho,Žádné sledování televize ani bezcílné bloumání po lese. Jaroslav Gutvirth jezdí ve volném čase ohledávat mrtvoly jako koroner. Tuto práci má jako vedlejšák...,lidovky.cz,title
https://kultura.zpravy.idnes.cz/glosa-serial-dabing-street-d0d-/filmvideo.aspx?c=A180318_171555_filmvideo_spm,GLOSA: Konec legrácek. Ve finále nabere Dabing Street zmar i sílu,"Sex na povel řízený přes sklo přímo z režie, nový ministr zdravotnictví, disidentská sbírka pornofilmů či útok 11. září 2001. To vše a ještě mnohem více...",lidovky.cz,title
https://byznys.lidovky.cz/test-samoriditelneho-vozu-skoncil-v-arizone-tragicky-pri-nehode-zemrela-zena-1xr-/auto.aspx?c=A180319_180447_ln-auto_ele,"První oběť samořiditelného vozu. V Arizoně testovací vůz Uberu srazil ženu, nehodu nepřežila","Zkušební jízda samořiditelného vozidla Uber dopadla v Arizoně smrtelnou nehodou, při které zemřela jedna žena. Společnost uvedla, že přerušuje...",lidovky.cz,business
https://byznys.lidovky.cz/jedna-z-nejbohatsich-charit-ma-na-uctu-475-miliard-korun-odkazal-ji-to-zakladatel-ikea-ged-/firmy-trhy.aspx?c=A180319_150726_firmy-trhy_ele,"Jedna z nejbohatších charit má na účtu 475 miliard korun, odkázal jí je zakladatel IKEA","Zakladatel nábytkové velmoci IKEA, Ingvar Kamprad, odkázal švédské neziskové organizaci Kamprad Family Foundation sumu 475 miliard korun. Stejnou...",lidovky.cz,business
https://www.lidovky.cz/vyvoz-ceskeho-piva-do-ciny-loni-klesl-temer-o-polovinu-p12-/pivo.aspx?c=A180319_142834_ln-pivo_pkk,Vývoz českého piva do Číny loni klesl téměř o polovinu,Vývoz českého piva do Číny se loni snížil o 43 procent na 19 585 hektolitrů. Uvádějí to celní statistiky. Export tak klesal již druhým rokem za...,lidovky.cz,business
https://byznys.lidovky.cz/tok-chce-usetrit-750-milionu-pri-provozu-myta-vyzval-kapsch-k-jednani-1gq-/doprava.aspx?c=A180319_135301_ln-doprava_pkk,Ťok chce ušetřit 750 milionů při provozu mýta. Vyzval Kapsch k jednání,Ministr dopravy Dan Ťok vyzval vedení firmy Kapsch k jednání o úsporách v provozování stávajícího systému elektronického mýta. Za rok a půl do...,lidovky.cz,business
https://pr.lidovky.cz/neprehlednutelny-granite-093-/byz-sdeleni.aspx?c=A180308_151037_byz-sdeleni_jedli,Nepřehlédnutelný Granite,"Originální a jedinečné povrchy se staly nepostradatelnou součástí téměř každého designového residenčního či kancelářského projektu.   
					celý článek",lidovky.cz,business
https://byznys.lidovky.cz/pri-deleni-cez-musi-strategicke-veci-zustat-statu-uvedl-babis-puu-/firmy-trhy.aspx?c=A180319_125730_firmy-trhy_ele,"Při dělení ČEZ musí strategické věci zůstat státu, uvedl Babiš","Při případném dělení energetické společnosti ČEZ si vláda musí pohlídat, aby kromě výroby zůstaly státu také strategické věci typu obchodu nebo...",lidovky.cz,business
https://byznys.lidovky.cz/apple-vyviji-vlastni-obrazovku-microled-ma-byt-nastupcem-soucasnych-displeju-1ys-/firmy-trhy.aspx?c=A180319_102734_firmy-trhy_pkk,Apple vyvíjí vlastní obrazovku microLED. Má být nástupcem současných displejů,"Americká společnost Apple vyvíjí vlastní microLED obrazovky využívající elektroluminiscenční diody, které se mají stát nástupci současných OLED a LCD...",lidovky.cz,business
https://byznys.lidovky.cz/autosalon-v-zeneve-skoncil-k-videni-byla-i-letajici-auta-pj6-/auto.aspx?c=A180316_163340_ln-auto_pkk,Autosalon v Ženevě skončil. K vidění byla i létající auta,"88. ročník autosalonu v Ženevě je u konce. V neděli proběhl poslední den, kdy se mohli návštěvníci přijít podívat na zhruba 900 modelů vozů. Mezi...",lidovky.cz,business
https://www.lidovky.cz/novinar.aspx?idnov=3555,Miroslav Petr,"Takovou nabídku českých piv z minipivovarů má málokterá tuzemská hospoda. Tahle se ovšem nachází v Moskvě, jmenuje se Klub českých pivovarů a ležáky...",lidovky.cz,business
https://www.lidovky.cz/novinar.aspx?idnov=3926,Luděk Vokáč,"Kompaktní SUV Jaguar E-Pace má být v dnešní módní vlně vysokých aut pro britskou značku novým bestsellerem. Jenže při prvním seznámení působí krotce,...",lidovky.cz,business
https://www.lidovky.cz/novinar.aspx?idnov=3320,Michal Pavec,"Téměř 400 tisíc korun si u soudu nárokují správci české železnice. Jde o nájemné za rok a čtvrt, které jim měla zaplatit firma Grandi Stazioni za...",lidovky.cz,business
https://www.lidovky.cz/novinar.aspx?idnov=3555,Miroslav Petr,Ani Dieselgate či ekologická opatření některých evropských měst neodrazují Čechy od nákupů aut se vznětovými motory. Podle prodejců aut i pumpařů...,lidovky.cz,business
https://www.lidovky.cz/novinar.aspx?idnov=4102,Ondřej Patrovský,"Rozkopané pražské silnice, zavřené výlezy z metra a stojící tramvaje. Hlavní město trápí problémy s dopravou, spojené s četnými opravami v pražských...",lidovky.cz,business
https://byznys.lidovky.cz/vitkovicke-strojirny-v-insolvenci-navrh-podaly-samy-p0v-/firmy-trhy.aspx?c=A180316_174704_firmy-trhy_ele,Vítkovické strojírny na sebe podaly návrh na insolvenci. Zaměstnance čeká propouštění,"Vítkovické strojírny, které zaměstnávají zhruba 650 lidí, na sebe podaly návrh na insolvenci. Vyplývá to z informací, které byly v pátek zveřejněny v...",lidovky.cz,business
https://byznys.lidovky.cz/kdu-csl-chce-zakazat-reklamy-na-pohrebni-sluzby-u-nemocnic-povazuje-za-neeticke-gcl-/firmy-trhy.aspx?c=A180316_152430_firmy-trhy_ele,"‚To poslední, co chce člověk vidět u vchodu.‘ Lidovci chtějí zakázat reklamy na pohřební služby u nemocnic",Za neetické a necitlivé pokládají poslanci KDU-ČSL reklamy na pohřební služby v blízkosti nemocnic. Předkládají proto novelu zákona o regulaci...,lidovky.cz,business
https://byznys.lidovky.cz/forbes-miliardar-korecky-chysta-ve-s-mlyne-hotel-za-pul-miliardy-p89-/firmy-trhy.aspx?c=A180316_133915_firmy-trhy_ele,Miliardář Korecký chystá ve Špindlerově Mlýně hotel za půl miliardy,Miliardář a průmyslník Michal Korecký plánuje v největším krkonošském středisku Špindlerův Mlýn výstavbu pětihvězdičkového hotelu. Postavit by ho měl...,lidovky.cz,business
https://byznys.lidovky.cz/rekonstrukce-d1-se-protahne-do-roku-2021-kvuli-zdrzuji-souteze-na-firmy-12o-/doprava.aspx?c=A180316_101643_ln-doprava_sij,Rekonstrukce páteřní D1 se protáhne až do roku 2021. Zdržují soutěže na firmy,"Práce na rekonstrukci dálnice D1 mezi Prahou a Brnem se protáhnou do roku 2021. „My už víme, díky těm zdržením při soutěžích, že rok 2020...",lidovky.cz,business
https://byznys.lidovky.cz/google-ci-facebook-maji-platit-triprocentni-digitalni-dan-pmn-/firmy-trhy.aspx?c=A180316_100700_firmy-trhy_pkk,Google či Facebook mají platit tříprocentní digitální daň,Velké společnosti s významnými příjmy v digitální oblasti v Evropské unii by měly platit daň z obratu tři procenta. Uvedla to agentura Reuters s...,lidovky.cz,business
https://www.lidovky.cz/novinar.aspx?idnov=4092,Patrik Kozlík,"Když se před dvěma lety rozhodli Radek Hušek a Daniel Vach, že rozjedou byznys s tyčinkami, které obsahují cvrččí mouku, tak museli firmu Sens...",lidovky.cz,business
https://byznys.lidovky.cz/pet-milionu-novych-znamek-se-zemanem-vyjde-v-dubnu-fwe-/statni-pokladna.aspx?c=A180315_142814_statni-pokladna_pkk,Pět milionů nových známek se Zemanem vyjde v dubnu,"Nová známka s prezidentem Milošem Zemanem vyjde 18. dubna. Je podle stejné rytiny jako před pěti lety, ale v nových barvách. Česká pošta nechala...",lidovky.cz,business
https://byznys.lidovky.cz/ministerstvo-vnitra-vypsalo-konkurz-na-generalniho-reditele-ceske-posty-15m-/statni-pokladna.aspx?c=A180315_134330_statni-pokladna_pkk,Ministerstvo vnitra vypsalo konkurz na generálního ředitele České pošty,"Ministerstvo vnitra vypsalo výběrové řízení na nového generálního ředitele České pošty. Kandidáti na místo Martina Elkána, který ve funkci skončil ke...",lidovky.cz,business
https://byznys.lidovky.cz/albert-nemuze-prodavat-rozinky-obsahovaly-toxickou-latku-ochratoxin-1e8-/firmy-trhy.aspx?c=A180315_103115_firmy-trhy_pkk,"Albert nemůže prodávat své rozinky, obsahovaly toxickou látku ochratoxin","Státní zemědělská a potravinářská inspekce (SZPI) zakázala prodávat rozinky privátní značky Albert, které odebrala ve stejnojmenné prodejně....",lidovky.cz,business
https://byznys.lidovky.cz/cena-benzinu-a-nafty-je-nejnizsi-od-lonskeho-listopadu-ppw-/moje-penize.aspx?c=A180315_101546_moje-penize_pkk,Cena benzinu a nafty je nejnižší od loňského listopadu,Ceny pohonných hmot v Česku v uplynulém týdnu klesly na nejnižší úroveň od loňského listopadu. Nejprodávanější benzin Natural 95 zlevnil od minulé...,lidovky.cz,business
https://www.lidovky.cz/novinar.aspx?idnov=4092,Patrik Kozlík,"V Praze začnou od dubna jezdit taxíky určené výhradně pro ženy. Služba s názvem Taxita je první ženskou taxislužbou u nás. Kromě toho, že za volantem...",lidovky.cz,business
https://byznys.lidovky.cz/gazprom-a-naftogaz-budou-jednat-o-ukonceni-dodavek-plynu-pkw-/firmy-trhy.aspx?c=A180314_171807_firmy-trhy_pkk,Gazprom a Naftogaz budou jednat o ukončení dodávek plynu,Ruský dodavatel plynu Gazprom chce v příštích dnech zahájit jednání s ukrajinskou státní energetickou společností Naftogaz o ukončení smluv o...,lidovky.cz,business
https://byznys.lidovky.cz/ceska-ekonomika-se-prehriva-viditelne-to-je-i-na-trhu-prace-tvrdi-rusnok-1ny-/firmy-trhy.aspx?c=A180314_145810_firmy-trhy_pkk,"Česká ekonomika se přehřívá, viditelné to je i na trhu práce, tvrdí Rusnok","Česká ekonomika roste poměrně robustně na svoje možnosti a je nad takzvaným potenciálem. Do jisté míry se přehřívá, řekl ve středu guvernér České...",lidovky.cz,business
https://byznys.lidovky.cz/propojeni-arealu-svaty-petr-a-medvedin-vlekari-zadaji-eia-o-stavbu-lanovky-ve-spindlerove-mlyne-i2h-/firmy-trhy.aspx?c=A180314_143959_firmy-trhy_ele,Propojení areálů Svatý Petr a Medvědín. Vlekaři žádají EIA  o stavbu lanovky ve Špindlerově Mlýně,"Společnost Melida, která provozuje největší český skiareál ve Špindlerově Mlýně v Krkonoších, připravila dokumentaci pro posouzení vlivů na životní...",lidovky.cz,business
https://byznys.lidovky.cz/celnici-uzavreli-bar-v-pardubicich-obsluha-vystavovala-uctenky-sporadicky-16s-/firmy-trhy.aspx?c=A180314_112207_firmy-trhy_pkk,Celníci uzavřeli bar v Pardubicích. Obsluha vystavovala účtenky EET sporadicky,"Celníci kvůli chybám v elektronické evidenci tržeb (EET) uzavřeli bar v Pardubicích. Zjistili, že obsluha vystavovala účtenky za platby v hotovosti...",lidovky.cz,business
https://byznys.lidovky.cz/statni-ceska-exportni-banka-a-pojistovna-egap-by-mely-nove-spadat-pod-ministerstvo-financi-gxk-/statni-pokladna.aspx?c=A180314_104300_statni-pokladna_pkk,Státní Česká exportní banka a pojišťovna EGAP by měly nově spadat pod ministerstvo financí,Státní Česká exportní banka (ČEB) a Exportní garanční a pojišťovací společnost (EGAP) by nově měly spadat pouze pod ministerstvo financí. Vláda ve...,lidovky.cz,business
https://byznys.lidovky.cz/cast-letnich-last-minute-zajezdu-zdrazi-f09-/firmy-trhy.aspx?c=A180314_100303_firmy-trhy_pkk,Část letních last minute zájezdů zdraží,"Část zájezdů nabízených na poslední chvíli, tzv. last minute, v létě zdraží. Letecká společnost Travel Service, která zajišťuje přepravu pro většinu...",lidovky.cz,business
https://byznys.lidovky.cz/google-zakaze-reklamu-na-kryptomeny-d7b-/firmy-trhy.aspx?c=A180314_095222_firmy-trhy_pkk,Google zakáže reklamu na kryptoměny,Americká internetová společnost Google zakáže na svých webových stránkách reklamu na kryptoměny a další neregulované či spekulativní finanční...,lidovky.cz,business
https://byznys.lidovky.cz/pes-zemrel-behem-letu-united-airlines-kvuli-prehratemu-uloznemu-prostoru-1ts-/doprava.aspx?c=A180314_081453_domaci-mazlicci_ele,"Letuška trvala na tom, aby si cestují dala buldočka nad sebe. Pes v přehřátém úložném prostoru nepřežil","Pes zemřel během letu United Airlines, když letuška trvala na tom, aby byl umístěn do přehřátého úložného prostoru. Černý francouzský buldoček byl...",lidovky.cz,business
https://www.lidovky.cz/novinar.aspx?idnov=3905,Karolína Krupková,"Nejmladším miliardářkám na světě je pouhých 21 a 22 let. Alexandra a Katharina Andresenovy dohromady disponují bohatstvím v hodnotě 2,8 miliardy...",lidovky.cz,business
https://byznys.lidovky.cz/z-suv-od-lamborghini-je-prodejni-trhak-majitele-si-priplaceji-800-tisic-za-luxusni-verzi-gln-/firmy-trhy.aspx?c=A180313_134252_firmy-trhy_pkk,Ze superrychlého SUV od Lamborghini je prodejní trhák. Majitelé si připlácejí 800 tisíc za luxusní verzi,"Nové SUV od automobilky Lamborghini s názvem Urus se prodává lépe, než čekali samotní výrobci. Cena luxusního SUV začíná na částce 200 tisíc dolarů...",lidovky.cz,business
https://byznys.lidovky.cz/kofola-miri-do-bylinkoveho-byznysu-kupuje-vyrobce-caju-leros-pu6-/firmy-trhy.aspx?c=A180313_143237_firmy-trhy_pkk,Kofola míří do bylinkového byznysu. Kupuje výrobce čajů Leros,Nápojářská skupina Kofola kupuje českého výrobce bylinných čajů Leros. Převezme všechny jeho výrobní kapacity i zaměstnance. Kofola to v úterý...,lidovky.cz,business
