link,link_text,txt,site,area
https://www.lidovky.cz/recenze-dobyti-mesice-bez-velkych-gest-ryan-gosling-se-stal-neilem-armstrongem-196-/kultura.aspx?c=A180831_101811_ln_kultura_jto,RECENZE: Dobytí Měsíce bez velkých gest. Ryan Gosling se stal Neilem Armstrongem,"Benátský festival má za sebou slavnostní zahájení, na kterém se představil americký film o splnění velkého národního snu – dobytí Měsíce. Svůj film...",lidovky.cz,kultura
//www.lidovky.cz/novinar.aspx?idnov=3899,Jaroslav Totušek,Očekávaného pokračování snímku Top Gun s Tomem Cruisem v hlavní roli se diváci dočkají až v létě 2020. Podle dostupných informací studio film...,lidovky.cz,kultura
//www.lidovky.cz/novinar.aspx?idnov=2923,Judita Matyášová,"Galerie Egon Schiele Centrum letos slaví čtvrt století své existence a zároveň hledá cestu, jak připomenout výročí republiky. Kurátorka Hana...",lidovky.cz,kultura
//www.lidovky.cz/novinar.aspx?idnov=2324,Marcel Kabát,Australské akční sci-fi z blízké budoucnosti Upgrade nabízí s poměrně úspornými prostředky dostatek atrakcí a nějaký ten podnět k zamyšlení navrch.,lidovky.cz,kultura
https://www.lidovky.cz/novinar.aspx?idnov=493,Jana Machalická,Letní Letná opět nabízí kontrastní výběr z francouzských novocirkusových souborů. Vedle drastické akrobacie s drsným až surovým humorem souboru...,lidovky.cz,kultura
https://www.lidovky.cz/falesny-ucet-recke-ministryne-tvrdil-ze-zemrel-costa-gavras-nemistny-vtip-okomentoval-reziser-i2y-/kultura.aspx?c=A180830_163144_ln_kultura_Ceh,"Falešný účet řecké ministryně tvrdil, že zemřel Costa-Gavras. ‚Nemístný vtip‘, okomentoval režisér","Během několika minut obletěla ve čtvrtek odpoledne svět zpráva o smrti slavného francouzsko-řeckého režiséra Costy-Gavrase, která se ovšem...",lidovky.cz,kultura
https://www.lidovky.cz/den-neprectenych-knih-nejvice-lide-odkladaji-padesat-odstinu-nebo-harryho-pottera-gj1-/kultura.aspx?c=A180826_115814_ln_kultura_ssu,Den nepřečtených knih. Nejvíce lidé odkládají Padesát odstínů nebo Harryho Pottera,"Chcete knihy mít nebo číst? To je letošní slogan akce Dne nepřečtených knih, kterou již po sedmé vyhlásilo internetové knihkupectví Martinus. V...",lidovky.cz,kultura
https://www.lidovky.cz/recenze-rl-boyce-02n-/kultura.aspx?c=A180829_154616_ln_kultura_bez,RECENZE: R. L. Boyce a jeho krása se špínou za nehty,"Na světě existuje patrně jen jedno jediné místo, kde ještě žije bluesová muzika folklorním způsobem a předává se z otce na syna. Právě tam žije...",lidovky.cz,kultura
https://www.lidovky.cz/soutez-proc-lide-cestuji-vyhrajte-knihu-knihu-beguni-od-polske-autorky-1ne-/kultura.aspx?c=A180816_115802_ln_kultura_ape,SOUTĚŽ: Proč lidé cestují? Vyhrajte knihu knihu Běguni od polské autorky,"Proč lidé cestují? Jsme všichni nomády, pro které je překonávání prostoru smyslem života? Olga Tokarczuková se svou pověstnou důsledností a...",lidovky.cz,kultura
https://www.lidovky.cz/john-del-toro-richardson-08s-/kultura.aspx?c=A180829_153924_ln_kultura_bez,Americký debutant roku John Del Toro Richardson vyráží na české turné,Na krátké truné po České republice se vydává americký bluesový kytarista John Del Toro Richardson.,lidovky.cz,kultura
//www.lidovky.cz/novinar.aspx?idnov=3899,Jaroslav Totušek,"Historické drama Jan Palach skončilo po svém uvedení v kinech až na čtvrtém místě v žebříčku návštěvnosti. Snímek, který posbíral vesměs kladné...",lidovky.cz,kultura
//www.lidovky.cz/novinar.aspx?idnov=3899,Jaroslav Totušek,"Poslední srpnový týden míří do českých kin pět snímků. Technologicky opepřenou pomstu doplní sexuchtivá budova, neolitický lov bizonů, nelétavé ptáče...",lidovky.cz,kultura
//www.lidovky.cz/novinar.aspx?idnov=3899,Jaroslav Totušek,"Televize ABC zrušila pokračování sitcomu Roseanne poté, co Roseanne Barrová, představitelka hlavní role, sdílela rasistické a nenávistné příspěvky na...",lidovky.cz,kultura
https://www.lidovky.cz/a-oscara-ziska-kdo-na-filmovy-festival-v-benatkach-prijede-ryan-gosling-nebo-lady-gaga-gn6-/kultura.aspx?c=A180829_113256_ln_kultura_jto,A Oscara získá kdo? Na filmový festival v Benátkách přijede Ryan Gosling nebo Lady Gaga,"Právě dnes začíná v Benátkách jubilejní, 75. ročník jednoho z nejvýznamnějších světových filmových festivalů, který letos v soutěži uvede 21 filmů...",lidovky.cz,kultura
https://www.lidovky.cz/video-prava-a-priskok-martin-dejdar-pred-natacenim-ucitele-tance-nikdy-tancit-neumel-gmu-/kultura.aspx?c=A180828_104637_ln_kultura_jto,VIDEO: Pravá a přískok! Martin Dejdar před natáčením Učitele tance nikdy tančit neuměl,"Zvláštní příběh o lásce, tanci a neumírání se natáčel v dnešním Dětském centru v Praze. Jak na ně vzpomíná Martin Dejdar a primářka centra, která u...",lidovky.cz,kultura
https://cestovani.lidovky.cz/nomadi-skoda-100-na-cestach-pamir-highway-a-bod-obratu-fxp-/aktuality.aspx?c=A180904_090127_aktuality_ele,NOMÁDI: Škoda 100 na cestách. Pamir Highway a bod obratu,"Vážení čtenáři, minule jsme přestali vyprávět zrovna ve chvíli, kdy jsme večer ve tmě stáli před hlubokým brodem a místní na nás pokřikovali „davaj,...",lidovky.cz,cestovani
https://cestovani.lidovky.cz/mladi-lide-v-americe-resi-jak-zaplati-velke-dluhy-z-vysoke-rika-ceska-11b-/aktuality.aspx?c=A180824_151046_aktuality_ceh,"Mladí lidé v Americe řeší, jak zaplatí velké dluhy ze studií, říká Češka","Anna Sedláčková do Spojených států odešla v šestnácti letech. Z pražského gymnázia přestoupila na střední školu v Maine, posléze ve Spojených státech...",lidovky.cz,cestovani
https://cestovani.lidovky.cz/zivot-v-dodavce-je-obrovska-porce-svobody-zustanete-tam-kde-se-vam-libi-1mt-/aktuality.aspx?c=A180828_140728_aktuality_ape,"NOMÁDI: Život v dodávce je obrovská porce svobody. Zůstanete tam, kde se vám líbí","Pro zkušené nomády to není nijak šokující, pro ostatní však trochu ano. „Ty bydlíš ve vanu? Pořád? A proč to děláš?” Na to říkám s úsměvem jen: „A...",lidovky.cz,cestovani
//www.lidovky.cz/novinar.aspx?idnov=3560,Tomáš Málek,Česká expedice strávila další noc v Rupálské stěně jedné z nejméně vyzpytatelných himalájských osmitisícovek. V neděli se dvojice Marek Holeček a...,lidovky.cz,cestovani
https://cestovani.lidovky.cz/nomadi-skoda-100-na-cestach-z-kyrgyzstanu-k-hranicim-tadzikistanu-p8o-/aktuality.aspx?c=A180828_141700_aktuality_ape,NOMÁDI: Škoda 100 na cestách. Z Kyrgyzstánu k hranicím Tádžikistánu,"Vážení čtenáři, minule jsme skončili na začátku Kyrgyzstánu. Po našem ranním probuzení jsme zjistili, že táboříme pod velkou přehradou. Po sbalení...",lidovky.cz,cestovani
https://www.lidovky.cz/novinar.aspx?idnov=3560,Tomáš Málek,Jejich plán je na první pohled jednoduchý. Poznat co nejvíce balkánských zemí a obkroužit Černé moře. To vše ve Škodě Favorit ze začátku 90. let...,lidovky.cz,cestovani
//www.lidovky.cz/novinar.aspx?idnov=3560,Tomáš Málek,"Dvojici českých horolezců, která se pokouší zdolat himalájskou osmitisícovku Nanga Parbat, ukázalo počasí svou vlídnější tvář. Marek Holeček a Tomáš...",lidovky.cz,cestovani
https://cestovani.lidovky.cz/spicak-lanovkou-na-rozhlednu-do-bikeparku-i-na-naucne-stezky-prn-/aktuality.aspx?c=A180828_132849_aktuality_ape,"Špičák? Lanovkou na rozhlednu, do bikeparku i na naučné stezky",Špičák na Šumavě je v létě už notoricky známý skrze svůj velmi kvalitní bikepark patřící k nejlepším v republice. V posledních letech je tu ale...,lidovky.cz,cestovani
https://cestovani.lidovky.cz/expedice-nanga-parbat-cesi-vystoupali-do-7-100-metru-zdrzuje-je-mlha-p90-/aktuality.aspx?c=A180830_173405_aktuality_Ceh,"Expedice Nanga Parbat: Češi vystoupali do 7100 metrů, zdržuje je mlha","Čeští horolezci, kteří se pokoušejí zdolat himalájskou osmitisícovku Nanga Parbat, se posunuli blíže k vrcholu. Dvojici Marek Holeček a Tomáš...",lidovky.cz,cestovani
https://cestovani.lidovky.cz/aktualni-adresa-rajske-zahrady-seychelske-ostrovy-a-indicky-ocean-101-/aktuality.aspx?c=A180814_161136_aktuality_ape,Aktuální adresa rajské zahrady? Seychelské ostrovy a Indický oceán,"Kdysi jsem potkala jednoho velmi scestovalého muže. Prohlásil: „Navštívil jsem už víc než devadesát zemí světa včetně těch nejexotičtějších, hledal...",lidovky.cz,cestovani
https://cestovani.lidovky.cz/ceska-rodinna-riviera-vylet-na-lipno-a-po-okoli-fqx-/aktuality.aspx?c=A180823_132342_aktuality_ape,Česká rodinná riviéra. Výlet na Lipno a po okolí,"Letní areál Lipno je rájem nejen dětí, ale klidně i straších ročníků, protože aktivit je tu k mání skoro z každého soudku. Vypravit se můžete na...",lidovky.cz,cestovani
https://cestovani.lidovky.cz/nomadi-skoda-100-dorazila-k-bajkonuru-cele-mesto-ma-jen-par-bloku-a-stoji-vedle-elektrarny-g5z-/aktuality.aspx?c=A180828_151301_aktuality_ape,NOMÁDI: Škoda 100 dorazila k Bajkonuru. Celé město má jen pár bloků a stojí vedle elektrárny,"Článek píšeme v Kyrgyzstánu ve 20:33 hod. zdejšího času ve stanu, který jsme si postavili na pastvině ve výšce cca 2000 m nad mořem. Z okna stanu...",lidovky.cz,cestovani
https://cestovani.lidovky.cz/americani-si-radeji-zavolaji-uber-nez-zachranku-proste-na-ni-nemaji-rika-ceska-18u-/aktuality.aspx?c=A180815_153630_aktuality_ape,"Američani si raději zavolají Uber než záchranku, prostě na ni nemají, říká Češka","Adéla Schicker cestuje po celém světě už od patnácti let, kdy vyrazila poprvé jako modelka do Paříže a Londýna. Od té doby procestovala Ameriku,...",lidovky.cz,cestovani
https://cestovani.lidovky.cz/pojedu-kamkoli-kdyz-je-to-dopredu-jak-to-zacalo-aneb-koralky-z-maroka-1g4-/aktuality.aspx?c=A180821_125907_aktuality_ape,"NOMÁDI: Pojedu kamkoli, když je to dopředu: Jak to začalo aneb Korálky z Maroka",Od naší první cesty stopem do Řecka uplynulo 26 let. Za tu dobu se změnila spousta věcí - kromě jedné - touhy rozletět se někam do světa a alespoň na...,lidovky.cz,cestovani
//www.lidovky.cz/novinar.aspx?idnov=3961,Jiří Bigas,"Fenomén Marek Holeček vyrazil na další expedici. Pokouší se prvovýstupem zdolat pákistánskou osmitisícovku Nanga Parbat, jejíž vrchol se nachází 8125...",lidovky.cz,cestovani
https://cestovani.lidovky.cz/holecek-vyrazil-na-horu-zabijak-pakistanskou-osmitisicovku-nanga-parbat-1q9-/aktuality.aspx?c=A180824_184950_aktuality_vlh,"Holeček vyrazil na ‚horu zabiják‘, pákistánskou osmitisícovku Nanga Parbat","Mé oči přenesl dalekohled, až k jemným detailů pětikilometrového srázu. Opětovně prohlížím každý úsek, i když ho znám nazpaměť. Co kdybych něco...",lidovky.cz,cestovani
https://cestovani.lidovky.cz/vzpominka-na-nicive-zemetreseni-v-nepalu-jak-pomahali-cesti-zachranari-a-lekari-gc9-/aktuality.aspx?c=A180813_142127_aktuality_ape,Vzpomínka na ničivé zemětřesení v Nepálu. Jak pomáhali čeští záchranáři a lékaři?,"Možná si ještě vzpomínáte na ničivé zemětřesení v Nepálu v dubnu roku 2015. Událost, které zásadně ovlivnila chod této krásné země, určitě stojí za...",lidovky.cz,cestovani
https://cestovani.lidovky.cz/saalbach-hinterglemm-traily-a-tury-pro-kazdeho-fli-/aktuality.aspx?c=A180814_150434_aktuality_ape,Středisko Saalbach Hinterglemm? Traily a túry pro každého,Saalbach Hinterglemm patří do TOP 5 letních destinací Rakouska a díky rozsáhlé síti cyklotras a turistických tras láká do údolí širokou škálu...,lidovky.cz,cestovani
https://cestovani.lidovky.cz/nomadi-mongol-rally-pt-v-turkmenistan-dxr-/aktuality.aspx?c=A180822_162007_aktuality_ape,NOMÁDI: Mongol Rally Pt V. Turkmenistán,"Další zemí, a myslím, že nejzajímavější na naší cestě, je Turkmenistán. Našinec o ní moc informací nemá. Turkmeni sedí na obrovských ložiscích ropy a...",lidovky.cz,cestovani
https://cestovani.lidovky.cz/v-nemecku-narazim-se-svou-pravdomluvnosti-ale-to-vsude-na-svete-rika-dagmar-peckova-gzg-/aktuality.aspx?c=A180813_150317_aktuality_ape,"V Německu narážím se svou pravdomluvností, ale to všude na světě, říká Dagmar Pecková","Dagmar Pecková se do Německa odstěhovala už v roce 1985, do Česka se ale pravidelně vrací nejen koncertovat. „Nikdy jsem neodevzdala český pas. Jsem...",lidovky.cz,cestovani
https://cestovani.lidovky.cz/nomadi-mongol-rally-pt-iv-iran-chaoticky-provoz-bez-pravidel-a-benzin-za-2-koruny-litr-ga9-/aktuality.aspx?c=A180819_144845_aktuality_ele,NOMÁDI: Mongol Rally Pt IV. Írán. Chaotický provoz bez pravidel a benzín za dvě koruny na litr,"Na íránskou hranici přijíždíme ráno, jsme ten den první vozidlo. Celý proces je poměrně chaotický. Je potřeba projít kontrolou celní, pasovou,...",lidovky.cz,cestovani
//www.lidovky.cz/novinar.aspx?idnov=3961,Jiří Bigas,"Fenomén Marek Holeček se chystá na další expedici. Pokusí se prvovýstupem zdolat pákistánskou osmitisícovku Nanga Parbat, jejíž vrchol se nachází...",lidovky.cz,cestovani
https://cestovani.lidovky.cz/naucna-stezka-v-male-upe-v-krkonosich-pripomene-disidenty-p3o-/aktuality.aspx?c=A180814_134255_aktuality_ape,"Kde se scházeli Havel, Kubišová i Michnik. Naučná stezka v Malé Úpě připomene disidenty","Pohraniční obec Malá Úpa na Trutnovsku otevře 25. srpna Disidentskou stezku, která připomene setkávání disidentů z Česka a Polska v Krkonoších v...",lidovky.cz,cestovani
https://cestovani.lidovky.cz/dali-byste-si-indickou-placku-tady-jsou-recepty-na-tri-druhy-ple-/aktuality.aspx?c=A180815_141212_aktuality_ape,Dali byste si indickou placku? Tady jsou recepty na tři druhy,"„Pečivo“ se jí snad všude na světě. Někde má formu, chleba a rohlíků, jinde zase rozdílných placek a bochánků. V Indii mají placek požehnaně a jedí...",lidovky.cz,cestovani
https://cestovani.lidovky.cz/po-stopach-unesco-rovnikova-guinea-diktator-a-jeho-mesto-v-dzungli-1do-/po-stopach-unesco.aspx?c=A180807_131843_ln-po-stopach-unesco_ape,Po stopách UNESCO: Rovníková Guinea. Diktátor a jeho město v džungli,"Víza do Rovníkové Guinei jsme koupili již potřetí. Pokaždé, když jsme plánovali v rámci naší EXPEDITION ALL AFRICA návštěvu této země, vždy nás z...",lidovky.cz,cestovani
https://cestovani.lidovky.cz/holecek-z-nanga-parbat-cas-hnipani-dla-/aktuality.aspx?c=A180816_103401_aktuality_form,Holeček z Nanga Parbat: Čas hnípání,"Život v Base Campu je svým způsobem zatavení času. A vážně, nemůžete nikam. Ani nahoru, jelikož třeba počasí ukazuje svá záda, ani dolů, protože...",lidovky.cz,cestovani
https://cestovani.lidovky.cz/posazavi-pocitacovy-hit-leta-djm-/aktuality.aspx?c=A180813_112719_aktuality_ape,"Posázaví, počítačový hit léta. Velké části se proměnily v herní mapy","Trhákem letoška se stalo Posázaví, krajina, v níž se odehrává počítačová hra Kingdom Come: Deliverance. Její autoři vrátili Ratajím nad Sázavou,...",lidovky.cz,cestovani
https://cestovani.lidovky.cz/jezero-lago-di-garda-riviera-outdoorovych-sportu-f7o-/aktuality.aspx?c=A180806_135850_aktuality_ape,Jezero Lago di Garda. Riviéra outdoorových sportů,"Lago di Garda je ráj milovníků veškerých outdoorových aktivit od cyklistiky, přes pěší túry, ferraty, canyoningy až po windsurfing nebo paragliding....",lidovky.cz,cestovani
https://cestovani.lidovky.cz/nomadi-mongol-rally-pt-3-gruzie-a-armenie-fdi-/aktuality.aspx?c=A180814_114602_aktuality_ele,NOMÁDI: Mongol Rally Pt. 3 – Gruzie a Arménie,"Plavba trajektem byla v zásadě příjemným zážitkem. Relativně slušné kajuty, sprcha, poživatelné jídlo. Potkáváme bandu polských motorkářů, dva mladé...",lidovky.cz,cestovani
https://cestovani.lidovky.cz/sehnat-v-anglii-mlynek-na-orechy-nemozne-rika-ceska-f82-/aktuality.aspx?c=A180807_155922_aktuality_ape,"Sehnat v Anglii mlýnek na ořechy? Nemožné, říká Češka","Spisovatelka Lenka Požárová žije v Anglii již několik let a návrat do Česka zatím neplánuje. „Nemám pocit, že bych někoho svými zvyky vyloženě...",lidovky.cz,cestovani
https://cestovani.lidovky.cz/video-vzijte-se-do-kuze-marka-holecka-unikatni-vystup-na-osmitisicovku-z-pohledu-horolezce-gyk-/aktuality.aspx?c=A180812_204846_aktuality_pev,VIDEO: Výstup na osmitísícovku z pohledu horolezce. Vžijte se do kůže Marka Holečka,Světoznámý horolezec Marek Holeček pro server Lidovky.cz průběžně popisuje své dojmy ze své poslední expedice do Himálaje. Jeho cílem je společně s...,lidovky.cz,cestovani
https://cestovani.lidovky.cz/nomadi-od-bajkalu-pres-mongolsko-az-k-tichemu-oceanu-narocni-na-cestach-1zu-/aktuality.aspx?c=A180808_164945_aktuality_ceh,NOMÁDI: Od Bajkalu přes Mongolsko až k Tichému oceánu. NÁROČNÍ na cestách,"Naše cestovatelská skupina, která se jmenuje NÁROČNÍ, vznikla před 10 lety. Byli jsme studenti, lákalo nás objevovat svět a cestovat do neznáma....",lidovky.cz,cestovani
https://cestovani.lidovky.cz/holecek-o-nepalu-jedna-nula-pro-slecnu-blondynu-fre-/aktuality.aspx?c=A180810_214631_aktuality_form,Holeček z Nanga Parbat: Jedna nula pro slečnu blondýnu,Světoznámý horolezec Marek Holeček exkluzivně pro server Lidovky.cz popisuje své dojmy ze své poslední expedice do Himálaje. Jeho cílem je společně s...,lidovky.cz,cestovani
https://cestovani.lidovky.cz/nomadi-na-prisernejsi-ceste-jsme-dosud-nejeli-skoda-100-v-rusku-a-kazachstanu-16l-/aktuality.aspx?c=A180811_194706_aktuality_Ceh,NOMÁDI: ‚Na příšernější cestě jsme dosud nejeli.’ Škoda 100 v Rusku a Kazachstánu,"Vážení čtenáři, zdravíme z Ruska naším druhým článkem z cesty do Mongolska. Po přejetí hranic míříme nejkratší cestou do města Kursk a do přilehlé...",lidovky.cz,cestovani
https://cestovani.lidovky.cz/keswick-zdolavani-srdce-narodniho-parku-lake-district-v-anglii-pv0-/aktuality.aspx?c=A180801_133856_aktuality_ape,Keswick. Zdolávání srdce národního parku Lake District v Anglii,"Na severozápadě Anglie se nachází ráj pro všechny milovníky přírody, horské turisty a nadšené sportovce. Je plný hor, kopců a jezer, nazývá se Lake...",lidovky.cz,cestovani
https://cestovani.lidovky.cz/pesky-na-kole-i-kajaku-udoli-val-di-non-v-trentinu-fbp-/aktuality.aspx?c=A180801_131501_aktuality_ape,"Pěšky, na kole i kajaku. Údolí Val di Non v Trentinu","Val di Non je strategickým dovolenkovým místem Trentina, odkud máte na dosah singltraily po dolomitských hřebenovkách, horské túry v Dolomiti di...",lidovky.cz,cestovani
https://relax.lidovky.cz/v-praze-vzniklo-nove-centrum-pro-pacienty-s-alhzeimerovou-chorobou-nabizi-celkem-146-luzek-gss-/zdravi.aspx?c=A180904_161737_ln-zdravi_seb,V Praze vzniklo nové centrum pro pacienty s Alzheimerovou chorobou. Nabízí celkem 146 lůžek,"Společnost Alzheimer Home, kterou nedávno koupila skupina Penta Hospitals, v úterý otevřela v pražských Modřanech nové centrum pro seniory a nemocné...",lidovky.cz,relax
https://relax.lidovky.cz/z-piskotu-do-prestigek-treti-den-fashion-weeku-rozsvitil-rudolfinum-a-letenskou-plan-g4l-/moda.aspx?c=A180904_071531_ln-bydleni_Ceh,Z piškotů do prestigek. Třetí den fashion weeku rozsvítil Rudolfinum a Letenskou pláň,"Pondělí bylo nejkratším přehlídkovým dnem akce Mercedes-Benz Prague Fashion Week, během níž se představili pouze dva návrháři. Designérka...",lidovky.cz,relax
https://relax.lidovky.cz/sikana-ci-nezvladnute-ucivo-skolni-problemy-se-samy-nevytrati-p7l-/zdravi.aspx?c=A180830_154947_ln-zdravi_ape,Šikana či nezvládnuté učivo. Školní problémy se samy nevytratí,"Šikana, problémy v rodině, nezvládnuté učivo – to vše řeší se školáky odborníci. I ti nejmenší už cítí tlak a bojí se neúspěchu.",lidovky.cz,relax
https://relax.lidovky.cz/papez-dostal-skutr-vespa-vydrazi-ho-pro-dobrocinne-ucely-pzb-/zajimavosti.aspx?c=A180903_103620_ln-zajimavosti_ape,"Papež dostal skútr Vespa, vydraží ho pro dobročinné účely","Papež František je nyní vlastníkem skútru Vespa. Daroval mu ho italský klub majitelů těchto legendárních jednostopých vozidel, informovala agentura...",lidovky.cz,relax
https://relax.lidovky.cz/plzensti-straznici-zajisti-odchyty-toulavych-psu-ve-stenovicich-1c7-/domaci-mazlicci.aspx?c=A180903_112554_domaci-mazlicci_ape,Plzeňští strážníci zajistí odchyty toulavých psů ve Štěnovicích,"Plzeňští strážníci budou zajišťovat odchyt toulavých a opuštěných zvířat ve Štěnovicích na jihu Plzeňska. Službu už poskytují Chotíkovu, Třemošné,...",lidovky.cz,relax
https://relax.lidovky.cz/co-se-stane-kdyz-vykrocime-spatnou-nohou-fp3-/veda.aspx?c=A180903_110735_ln_veda_ape,"Co se stane, když vykročíme špatnou nohou?","Jestliže ráno vykročíme špatnou nohou, skutečně to zničí celý den. Když si myslíme, že den bude těžký a stresující, snižuje to totiž naše kognitivní...",lidovky.cz,relax
https://relax.lidovky.cz/porazil-strom-vyrobil-kolo-a-dokoulel-ho-z-lednice-do-sedesat-kilometru-vzdaleneho-brna-gtv-/zajimavosti.aspx?c=A180902_194640_ln-zajimavosti_Ceh,"Porazil strom, vyrobil kolo a dokoulel ho z Lednice do šedesát kilometrů vzdáleného Brna",Jednu z nejslavnějších brněnských pověstí si na vlastní kůži v neděli vyzkoušel herec Městského divadla Brno Dušan Vitázek. V noci na neděli pokácel...,lidovky.cz,relax
https://relax.lidovky.cz/ceska-veda-zazila-za-100-let-nekolik-velkych-ran-dusledky-nekterych-si-nese-dodnes-gde-/veda.aspx?c=A180902_170639_ln_veda_Ceh,Česká věda zažila za 100 let několik velkých ran. Důsledky některých si nese dodnes,,lidovky.cz,relax
https://relax.lidovky.cz/zacal-prazsky-tyden-mody-mola-se-zmocnili-japonci-nizozemci-a-slovaci-1ef-/moda.aspx?c=A180902_080829_moda_ele,"Začal pražský týden módy. Mola se zmocnili Japonci, Nizozemci a Slováci","Proč by měla móda dělat rozdíly mezi pohlavími? Proč by muži nemohli obléknout růžový přiléhavý svetřík? Proč jsou lidi tak zoufale přízemní, ptali...",lidovky.cz,relax
https://relax.lidovky.cz/vedci-otestovali-novy-system-mapovani-zamorene-krajiny-pkm-/veda.aspx?c=A180830_142522_ln_veda_ape,Vědci otestovali nový systém mapování zamořené krajiny,Vědci z Vysokého učení technického v Brně (VUT) ve spolupráci s armádou a hasiči otestovali nový systém mapování krajiny pomocí dronů a pozemních...,lidovky.cz,relax
https://relax.lidovky.cz/pokud-maji-manzele-rozdilny-pristup-k-alkoholu-jejich-vztah-je-nestastnejsi-ukazala-studie-g9p-/zajimavosti.aspx?c=A180901_205038_ln-zajimavosti_form,"Pokud mají manželé rozdílný přístup k alkoholu, jejich vztah je nešťastnější, ukázala studie","Starší manželé, kteří mají oba stejný vztah k alkoholu - ať už abstinují, nebo si dopřejí sklenku, mají šťastnější manželství než partneři, z nichž...",lidovky.cz,relax
https://relax.lidovky.cz/tekuta-cokolada-jako-postni-jidlo-caj-proti-unave-historik-popsal-dejiny-napoju-gd7-/zajimavosti.aspx?c=A180901_205658_ln-zajimavosti_form,"Tekutá čokoláda jako postní jídlo, čaj proti únavě. Historik popsal dějiny nápojů","Káva, čaj i čokoláda chutnaly v minulosti jinak, než jak je známe dnes. Historii těchto nápojů, jejich oblibu v novověku i účinky, které jim lidé...",lidovky.cz,relax
https://relax.lidovky.cz/fenka-v-praze-utekla-majiteli-sama-dojela-metrem-a-vlakem-az-do-pardubic-1me-/domaci-mazlicci.aspx?c=A180830_164543_domaci-mazlicci_Ceh,Fenka v Praze utekla majiteli. Sama dojela metrem a vlakem až do Pardubic,"Fenka kokršpaněla se sama vydala na dobrodružnou cestu. Z Prahy dojela až do Pardubic, cestou se svezla metrem i vlakem. Domů se vrátila díky tomu,...",lidovky.cz,relax
https://relax.lidovky.cz/zeptali-jsme-se-vedcu-jak-opiaty-a-jine-drogy-pusobi-na-zornicky-cloveka-1ai-/veda.aspx?c=A180828_155246_ln_veda_ape,Zeptali jsme se vědců: Jak opiáty a jiné drogy působí na zorničky člověka?,Za běžných okolností se velikost zornice mění podle osvětlení. Funguje to stejně jako automatická clona fotoaparátu. Na otázku odpověděl Prof. Dr....,lidovky.cz,relax
https://relax.lidovky.cz/britska-vlada-chce-zakazat-prodej-energetickych-napoju-detem-p55-/zdravi.aspx?c=A180830_142146_ln-zdravi_ape,Britská vláda chce zakázat prodej energetických nápojů dětem,"Britská vláda chystá zákaz prodeje takzvaných energetických nápojů s vysokým obsahem kofeinu. Vztahovat by se měl na děti a mladistvé, kteří by si...",lidovky.cz,relax
https://relax.lidovky.cz/jizni-korea-zakaze-prodej-kavy-na-zakladnich-a-strednich-skolach-p8q-/zajimavosti.aspx?c=A180830_141917_ln-zajimavosti_ape,Jižní Korea zakáže prodej kávy na základních a středních školách,"Jižní Korea zakáže prodej kávy na školách, vládní kampaň si klade za cíl prosadit u žáků i učitelů zdravější životní styl, napsal list The Guardian....",lidovky.cz,relax
https://relax.lidovky.cz/skolni-sok-pro-deti-na-zmenu-rezimu-si-deti-musi-zvykat-pomalu-pb6-/zdravi.aspx?c=A180830_100209_ln-zdravi_ape,Školní šok pro děti. Na změnu režimu si děti musí zvykat pomalu,"Strach z neznámého a vysoké požadavky rodičů mohou dětem školu znechutit, připomínají psychologové. I školáci potřebují mít čas pro sebe, porozumění...",lidovky.cz,relax
