link,link_text,txt,site,area
https://zlin.idnes.cz/tri-mrtvi-zlin-podhori-sebevrazda-d5f-/zlin-zpravy.aspx?c=A180829_104441_zlin-zpravy_ppr,Případ tří mrtvých ve Zlíně policie odložila jako trojnásobnou sebevraždu,"Kriminalisté ve Zlíně ukončili vyšetřování případu tří mrtvých členů rodiny, které objevili...",idnes.cz,krimi
https://plzen.idnes.cz/pole-masovice-domazlicko-seniorka-kombajn-kukurice-zraneni-pq7-/plzen-zpravy.aspx?c=A180829_100212_plzen-zpravy_vb,"Seniorka trhala kukuřici a neslyšela kombajn, ten jí vážně zranil ruku",Kombajn na poli u Mašovic na Domažlicku ráno vážně zranil třiaosmdesátiletou ženu. Seniorka trhala...,idnes.cz,krimi
https://plzen.idnes.cz/kyselina-plzen-restaurace-podnik-podminka-soud-f5o-/plzen-zpravy.aspx?c=A180829_423912_plzen-zpravy_vb,Recidivista dostal za vylití zapáchající kyseliny v restauraci podmínku,"Jiřímu Svobodovi, který se před dvěma roky podle obžaloby podílel na záškodnické akci proti...",idnes.cz,krimi
https://olomouc.idnes.cz/osek-nad-becvou-pozar-znicena-autodilna-hasici-fq3-/olomouc-zpravy.aspx?c=A180829_094011_olomouc-zpravy_stk,"VIDEO: Hasiči bojovali s požárem autodílny, oheň ji přesto zcela zničil",Hustý černý dým byl v úterý navečer vidět nad Osekem nad Bečvou na Přerovsku. V autodílně v tamní...,idnes.cz,krimi
https://plzen.idnes.cz/nemocnice-plzen-lochotin-policie-dopadla-utok-pacientka-pokus-znasilneni-seniorka-geg-/plzen-zpravy.aspx?c=A180828_174959_plzen-zpravy_pmk,Policie zadržela muže hledaného kvůli pokusu o znásilnění v nemocnici,"Policisté v úterý v Českém Krumlově zatkli muže, po kterém pátrali kvůli nedělnímu incidentu v...",idnes.cz,krimi
https://jihlava.idnes.cz/napadeni-marek-melenovsky-jihlava-neprizpusobivi-namesti-policie-obvineni-vazba-soud-vysoci-ipa-/jihlava-zpravy.aspx?c=A180828_135509_jihlava-zpravy_mv,Za zbití exhokejisty Melenovského hrozí obviněnému mladíkovi až deset let,"Policisté obvinili útočníka, který se v červnu na jihlavském náměstí největší mírou podílel na...",idnes.cz,krimi
https://hradec.idnes.cz/rozsudek-zneuziti-znasilneni-soud-hradec-kralove-fsl-/hradec-zpravy.aspx?c=A180828_164307_hradec-zpravy_the,"Za zneužití dívek dostal podmínku. Desetiletá měla sex se spolužáky, tvrdí",Za pohlavní zneužití a svádění k pohlavními styku dvou nezletilých dívek odešel Jan T. od Krajského...,idnes.cz,krimi
https://vary.idnes.cz/zakaz-rizeni-benzinka-cerpaci-stanice-ujel-bez-placeni-policie-pbh-/vary-zpravy.aspx?c=A180828_140157_vary-zpravy_ba,"VIDEO: Ujel od benzinky bez placení. Když porušil zákaz řízení, chytili ho","Muži z Chebu se vymstilo, že porušil uložený zákaz řízení. Při běžné silniční kontrole totiž...",idnes.cz,krimi
https://hradec.idnes.cz/patrani-pohresovany-muz-hroska-rychnovsko-fez-/hradec-zpravy.aspx?c=A180828_113706_hradec-zpravy_the,Mladíka našli na Rychnovsku mrtvého. Pátrali po něm potápěči i drony,"Policisté na Rychnovsku ukončili pátrání po 22letém pohřešovaném muži, našli ho mrtvého. Ztratil se...",idnes.cz,krimi
https://ostrava.idnes.cz/kramny-obnova-rizeni-soud-navrh-daf-/ostrava-zpravy.aspx?c=A180828_120210_ostrava-zpravy_woj,"Případ Kramný se vrátí v září k soudu, vrah ženy a dcery žádá nové řízení",Krajský soud v Ostravě se bude v září opět zabývat případem odsouzeného Petra Kramného. Za...,idnes.cz,krimi
https://brno.idnes.cz/patrani-muz-brno-podvod-oralni-sex-penize-policie-fvr-/brno-zpravy.aspx?c=A180828_115404_brno-zpravy_vh,"Podvodník slíbil ženě peníze za orální sex. Když si užil, tak ji okradl","Brněnští policisté pátrají po muži, který oslovoval ženy prostřednictvím internetu a nabízel jim...",idnes.cz,krimi
https://olomouc.idnes.cz/olomouc-tragicka-nehoda-wolkerova-alkohol-daniel-kunce-smrt-spolujezdkyne-odvolani-soud-verdikt-zrus-isc-/olomouc-zpravy.aspx?c=A180828_120355_olomouc-zpravy_mip,"Trest pro exhokejistu za smrt spolujezdkyně neplatí, soud vše projedná znovu","Krajský soud zrušil rozsudek, kterým okresní soud poslal do vězení na téměř čtyři roky bývalého...",idnes.cz,krimi
https://pardubice.idnes.cz/policie-chrudim-zabarikadovany-muz-hrozi-bombou-f6m-/pardubice-zpravy.aspx?c=A180828_123413_pardubice-zpravy_klu,"Muž se zabarikádoval před policisty a hrozil výbušninou, zadržela ho zásahovka","Před policisty se dopoledne v domě na okraji Chrudimi zabarikádoval muž, který jim hrozil použitím...",idnes.cz,krimi
https://olomouc.idnes.cz/prostejov-vrazda-bezdomovec-predina-blansko-obvineni-trestni-stihani-mladistvi-policie-kriminaliste-ivn-/olomouc-zpravy.aspx?c=A180828_113523_olomouc-zpravy_mip,"Z vraždy bezdomovce obvinili mladistvého, hrozí mu až devět let vězení","Policisté dopadli a obvinili mladíka, který podle nich v Prostějově zavraždil bezdomovce. Mrtvola...",idnes.cz,krimi
https://liberec.idnes.cz/sikana-vezeni-vezni-liberec-nasili-nechutne-praktiky-pdg-/liberec-zpravy.aspx?c=A180828_105617_liberec-zpravy_jape,"Vězně kopali a mučili vařící vodou, za šikanu zůstanou déle za mřížemi",Soud potrestal drsný případ šikany ve věznici. Dvěma násilníkům výrazně prodloužil pobyt za...,idnes.cz,krimi
https://vary.idnes.cz/vytrznictvi-ublizeni-na-zdravi-muz-napadl-zenu-kovovymi-hrabemi-policie-1l3-/vary-zpravy.aspx?c=A180828_093345_vary-zpravy_ba,"Muž se hádal s exmanželkou kvůli rozvodu, ženu zbil kovovými hráběmi",Surovým způsobem se rozhodl řešit spory s bývalou manželkou muž z Karlovarska. Na ženu si počkal v...,idnes.cz,krimi
https://hradec.idnes.cz/pozar-kone-staje-zemedelci-hasici-jivka-trutnovsko-fxy-/hradec-zpravy.aspx?c=A180828_095607_hradec-zpravy_the,"Požár zničil na Trutnovsku stáje, zemědělci koně včas vyvedli ven",Více než milionovou škodu způsobil v pondělí odpoledne požár stájí v Jívce na Trutnovsku. Oheň...,idnes.cz,krimi
https://budejovice.idnes.cz/nehoda-strakonice-ridic-cehnice-d3u-/budejovice-zpravy.aspx?c=A180828_105055_budejovice-zpravy_epkub,"Řidič vjel u Strakonic mimo silnici a narazil do stromu, na místě zemřel",Tragická dopravní nehoda blokovala v úterý dopoledne hlavní tah z Českých Budějovic na Strakonice....,idnes.cz,krimi
https://plzen.idnes.cz/dobrany-loupezne-prepadeni-odvolani-statni-zastupce-ukrajinec-cizinec-plzensko-utok-gqi-/plzen-zpravy.aspx?c=A180828_423669_plzen-zpravy_vb,"Mladistvý, který se podílel na násilné smrti cizince, vyvázl s podmínkou","Jeden ze dvou mladistvých, kteří se loni v září v Dobřanech na Plzeňsku podíleli na napadení a...",idnes.cz,krimi
https://olomouc.idnes.cz/hasic-zemrely-zahynul-jiri-ryznar-nehoda-hasicu-pohreb-zabreh-velitel-darce-krve-g1e-/olomouc-zpravy.aspx?c=A180828_084322_olomouc-zpravy_mip,"S kolegou, který zemřel při nehodě cisterny, se hasiči rozloučí v sobotu","Dlouholetý dárce krve, reprezentant v hasičském sportu a oblíbený kolega. Tak hasiči v Olomouckém...",idnes.cz,krimi
https://olomouc.idnes.cz/vacanovice-policie-patrani-ujeti-ridic-prejel-muze-na-silnici-puo-/olomouc-zpravy.aspx?c=A180827_172122_olomouc-zpravy_stk,"Řidič přejel muže ležícího na okraji silnice a ujel, hledá ho policie","Už více než dva týdny marně pátrají policisté z Olomoucka po řidiči, který u jedné ze zdejších...",idnes.cz,krimi
https://praha.idnes.cz/benesov-nehoda-jirovice-celni-stret-db4-/praha-zpravy.aspx?c=A180827_165938_praha-zpravy_nuc,"Na Benešovsku se čelně srazily dvě řidičky, silnice byla uzavřená",Dvě osobní auta se střetla na silnici I/3 u obce Jírovice na Benešovsku. Při nehodě se zranily dvě...,idnes.cz,krimi
https://praha.idnes.cz/policie-anonym-bomba-obchodni-centrum-smichov-evakuace-omezena-doprava-139-/praha-zpravy.aspx?c=A180827_155708_praha-zpravy_rsr,"Policie kvůli hrozbě vyklidila obchodní centrum na Smíchově, nic nenašla","Pražská policie odpoledne uzavřela část Smíchova před obchodním centrem. Anonym totiž oznámil, že...",idnes.cz,krimi
https://usti.idnes.cz/napadeni-ridicka-autobusu-teplice-pomoceny-muz-policie-patrani-ps9-/usti-zpravy.aspx?c=A180827_152145_usti-zpravy_vac2,"Pomočený muž zbil řidičku autobusu, hledá ho policie","Policie v Teplicích pátrá po neznámém muži, který v pátek večer ve čtvrti Nová Ves surově zaútočil...",idnes.cz,krimi
https://kultura.zpravy.idnes.cz/dvorakova-praha-2018-039-/hudba.aspx?c=A180829_160840_hudba_ts,Příběh svaté Ludmily zazní v rámci Dvořákovy Prahy i na náměstí,Téměř vyprodaná je většina koncertů festivalu Dvořákova Praha. Ten zahájí 7. září kantáta Svatební...,idnes.cz,kultura
https://kultura.zpravy.idnes.cz/james-bond-danny-boyle-06j-/filmvideo.aspx?c=A180829_174252_filmvideo_spm,Proč režisér Danny Boyle opustil bondovku? Prý odmítl agenta 007 zabít,"VIDEO
				
                V oficiální zprávě producentů stálo pouze tolik, že Danny Boyle v rozporu s původními plány nakonec...",idnes.cz,kultura
https://kultura.zpravy.idnes.cz/slaves-acts-of-fear-and-love-recenze-d6u-/hudba.aspx?c=A180827_174008_hudba_vha,RECENZE: Bouřliváci Slaves přišli se svou nejmuzikálnější deskou,Britští punkrockeři Slaves mají zjevně nějakou tajnou schránku nevyčerpatelné energie. Například...,idnes.cz,kultura
https://kultura.zpravy.idnes.cz/sylvia-plathova-pod-sklenenym-zvonem-argo-fj5-/literatura.aspx?c=A180828_105409_literatura_kiz,Ani svůj život neukočírovala. Osud básnířky připomíná jediná próza,Po dvou dekádách u nás vychází jediný román americké básnířky Sylvie Plathové Pod skleněným zvonem....,idnes.cz,kultura
https://kultura.zpravy.idnes.cz/duverny-nepritel-recenze-0ye-/filmvideo.aspx?c=A180828_131803_filmvideo_ts,RECENZE: Překombinovaný zmatek. Dům snů s Dykem straší bez smíchu,"VIDEO
				
                Jedna chybná úvaha na počátku může změnit výsledek od základu. Námět filmu Důvěrný nepřítel počítal...",idnes.cz,kultura
https://kultura.zpravy.idnes.cz/trailer-lars-von-trier-jack-stavi-dum-dwi-/filmvideo.aspx?c=A180828_172154_filmvideo_spm,VIDEO: Jen pro otrlé. Po Nymfomance uvádí von Trier sériového vraha,"VIDEO
				
                V Nymfomance šokoval názornou sexualitou, ve své novince Jack staví dům zase Lars von Trier...",idnes.cz,kultura
https://kultura.zpravy.idnes.cz/kviz-rychle-sipy-jaroslav-foglar-dqd-/literatura.aspx?c=A180814_150132_literatura_jan,"KVÍZ: Jak znáte Rychlé šípy a Jaroslava Foglara, plantážníci?","DoporučujemeMirek Dušín, Jarka Metelka, Jindra Hojer, Červenáček a Rychlonožka. Příběhy Rychlých šípů od Jaroslava...",idnes.cz,kultura
https://kultura.zpravy.idnes.cz/soundtrack-festival-2018-074-/hudba.aspx?c=A180829_094957_hudba_ts,Párky a langoše necháme jiným. Soundtrack láká na šapitó a vyšší úroveň,"Už ve čtvrtek začíná festival Soundtrack Poděbrady. Zazní na něm hudba z Pátého elementu,...",idnes.cz,kultura
https://kultura.zpravy.idnes.cz/ricky-martin-rozhovor-0b1-/hudba.aspx?c=A180828_133248_hudba_vha,"VIDEO: Musím trénovat jako atlet, říká Ricky Martin před koncertem","VIDEO
				
                Už 9. září se v pražské O2 areně představí hvězda latinopopu Ricky Martin. Šestačtyřicetiletý...",idnes.cz,kultura
https://kultura.zpravy.idnes.cz/trailer-temny-pripad-hbo-08h-/filmvideo.aspx?c=A180828_094155_filmvideo_spm,VIDEO: Do seriálu Temný případ vstupuje nositel Oscara za Moonlight,"VIDEO
				
                Oscarem oceněný herec Mahershala Ali se představuje v hlavní roli premiérové řady seriálu Temný...",idnes.cz,kultura
https://kultura.zpravy.idnes.cz/dum-umeleckeho-poltergeista-tomas-dianiska-divadlo-x10-dup39-pou-/divadlo.aspx?c=A180827_133108_divadlo_ts,Když se ztrácejí architekti v podzemí a autor to seká jak Viewegh vtipy,"Dům na Národní třídě, v jehož podzemí se ztrácejí umělci a architekti. To je základní zasazení...",idnes.cz,kultura
https://kultura.zpravy.idnes.cz/sting-shaggy-koncert-praha-forum-karlin-f03-/hudba.aspx?c=A180828_122533_hudba_vha,V listopadu přivezou Sting a Shaggy svou společnou jamajskou desku,Po úspěšném evropském letním a severoamerickém podzimním turné představí Sting a Shaggy své...,idnes.cz,kultura
https://kultura.zpravy.idnes.cz/kyle-pavone-neil-simon-smrt-komentar-dsm-/filmvideo.aspx?c=A180828_105932_hudba_ts,"KOMENTÁŘ: Smích může být chytrý, hořký, dokonce tesklivý. Ale ne hloupý",Ani smrt není spravedlivá. Osmadvacetiletý americký rockový zpěvák Kyle Pavone ještě nestačil...,idnes.cz,kultura
https://kultura.zpravy.idnes.cz/roseanne-zemre-novy-serial-connersovi-roseanne-barrova-p2n-/filmvideo.aspx?c=A180828_101738_filmvideo_ts,"Aby navazující sitkom mohl žít, musí populární postavu Roseanne zabít","Žena v domácnosti Roseanne, ústřední postava stejnojmenného populárního sitkomu, který slavil...",idnes.cz,kultura
https://kultura.zpravy.idnes.cz/1-dojmy-labyrint-iii-jiri-strach-d3s-/filmvideo.aspx?c=A180827_173324_filmvideo_spm,PRVNÍ DOJMY: Rozřízli ho pilou zaživa. Třetí Labyrint začne zostra,"VIDEO
				
                Už potřetí rozprostře krimi Labyrint na sedm pondělních večerů  jednu spletitou vražednou záhadu....",idnes.cz,kultura
https://kultura.zpravy.idnes.cz/thom-artway-all-i-know-rozhovor-dnz-/hudba.aspx?c=A180827_120537_hudba_vha,"Měsíc jsem dělal v Tesku, od té doby se živím hudbou, líčí Thom Artway","VIDEO
				
                Písničkář Thom Artway má za sebou úspěšné období. Loni získal s debutovým albem dvě Ceny Anděl,...",idnes.cz,kultura
https://kultura.zpravy.idnes.cz/video-ticho-pred-bouri-matthew-mcconaughey-anne-hathaway-pev-/filmvideo.aspx?c=A180827_112514_filmvideo_kiz,VIDEO: Zabije exmanžel manžela? Prozradí McConaughey v Tichu před bouří,"VIDEO
				
                Jak zareaguje exmanžel, když jej bývalá žena požádá, aby zabil jejího stávajícího partnera? Takovou...",idnes.cz,kultura
https://kultura.zpravy.idnes.cz/vzduchem-losers-cirque-company-recenze-fc7-/divadlo.aspx?c=A180827_122918_divadlo_ts,"RECENZE: Krásná akrobacie trvá, ale Vzduchem končí rozpačitě","I když jde opět o dechberoucí artistické výkony a zajímavou scénu, novinka Losers Cirque Company...",idnes.cz,kultura
https://kultura.zpravy.idnes.cz/kina-zebrik-jan-palach-0ua-/filmvideo.aspx?c=A180827_133853_filmvideo_spm,"Jan Palach skončil při startu až čtvrtý, zajímal 13 tisíc diváků","VIDEO
				
                Životopisný snímek Jan Palach, který měl slavnostní premiéru k padesátému výročí srpnové invaze a...",idnes.cz,kultura
https://kultura.zpravy.idnes.cz/iva-janzurova-sin-slavy-jan-burian-reditel-narodni-divadlo-pa8-/divadlo.aspx?c=A180827_112918_divadlo_ts,"Janžurová vstoupila do Síně slávy Národního, Burian bude ředitelem nadále","VIDEO
				
                U příležitosti zahájení 136. sezony Národního divadla uvedl ministr kultury Antonín Staněk herečku...",idnes.cz,kultura
https://kultura.zpravy.idnes.cz/upgrade-recenze-0iy-/filmvideo.aspx?c=A180827_095045_filmvideo_ts,RECENZE: Když mstitele řídí mikročip. Dobré moderní béčko má mozek i vtip,S českým Důvěrným nepřítelem jde do kin tematicky podobný australský příběh Upgrade. Také autor a...,idnes.cz,kultura
https://kultura.zpravy.idnes.cz/trailer-pad-jamie-dornan-gillian-andersonova-f35-/filmvideo.aspx?c=A180824_121331_filmvideo_spm,VIDEO: Agentka z hitu Akta X honí v seriálu hrdinu Padesáti odstínů,"VIDEO
				
                Lákavý herecký tandem nabízí britský seriál Pád, který uvede Prima Krimi od 1. září každou sobotu a...",idnes.cz,kultura
https://kultura.zpravy.idnes.cz/frantisek-kriegel-0mx-/literatura.aspx?c=A180824_422677_literatura_spm,RECENZE: František Kriegel znal rozdíl mezi kompromisy a zradou,"Právě vydaná kniha režiséra Ivana Fíly nazvaná Muž, který stál v cestě líčí věrohodně osud...",idnes.cz,kultura
https://kultura.zpravy.idnes.cz/zemrel-kyle-pavone-0ap-/hudba.aspx?c=A180826_155219_hudba_spm,V pouhých 28 letech zemřel americký rockový zpěvák Kyle Pavone,"Kyle Pavone, zpěvák americké skupiny We Came as Romans, zemřel ve věku 28 let. Příčina smrti nebyla...",idnes.cz,kultura
https://kultura.zpravy.idnes.cz/lenka-filipova-reportaz-z-nahravani-kytara-harga-album-keltska-hudba-folklor-1w0-/hudba.aspx?c=A180824_172200_hudba_vha,Harfa s kytarou k sobě krásně jdou. Filipová dokončuje „keltskou“ desku,"Skalní fanoušci překvapení nebudou, ty vlažnější možná zpěvačka a kytaristka Lenka Filipová...",idnes.cz,kultura
https://zpravy.idnes.cz/neil-simon-smrt-dramatik-scenarista-d7f-/zahranicni.aspx?c=A180826_192046_filmvideo_linv,Zemřel americký dramatik a scénárista Neil Simon. Bylo mu 91 let,"Ve věku 91 let v sobotu zemřel americký dramatik a scénárista Neil Simon, který za svůj život...",idnes.cz,kultura
https://kultura.zpravy.idnes.cz/hra-psi-dny-meetfactory-0s1-/divadlo.aspx?c=A180824_124825_divadlo_spm,Horké Psí dny přečkají herci z MeetFactory na staré lodi Altenburg,"Nejjižnější místo Evropy, kam kdysi zabloudil Odysseus, aby ho tu na sedm let uvěznila Kalypsó, a...",idnes.cz,kultura
https://kultura.zpravy.idnes.cz/televize-videoteky-miniserie-podzim-stream-online-fxf-/filmvideo.aspx?c=A180824_105446_filmvideo_spm,Co je televize budoucnosti? Minisérie místo seriálů a národní videotéky,"VIDEO
				
                Ve světě se od televizí žádá více žen i různorodých etnik či sexuálních menšin, u nás to na prudké...",idnes.cz,kultura
https://kultura.zpravy.idnes.cz/jaromir-hanzlik-leto-s-gentlemanem-dtw-/filmvideo.aspx?c=A180823_134756_filmvideo_kiz,OBRAZEM: Hanzlík dotočil Léto s gentlemanem. Na place panovalo horko,Režisér Jiří Adamec dotočil ve středočeských Zduchovicích film podle scénáře Jaromíra Hanzlíka Léto...,idnes.cz,kultura
https://kultura.zpravy.idnes.cz/matt-ridley-evoluce-vseho-09n-/literatura.aspx?c=A180823_132308_literatura_kiz,RECENZE: Všechno se mění nenápadně. A dokonce k lepšímu,"Vše, co používáme, od světové ekonomiky po laserovou tiskárnu, vzniká po drobných krůčcích, nikoli...",idnes.cz,kultura
https://kultura.zpravy.idnes.cz/karel-plihal-alba-a-bonusy-1984-az-1990-dl5-/hudba.aspx?c=A180824_180109_hudba_vha,Když Plíhal hrál Oldfielda. Vychází písničkářovy první desky s bonusy,Jeden z nejzajímavějších tuzemských písničkářů Karel Plíhal oslavil v uplynulém týdnu šedesáté...,idnes.cz,kultura
https://kultura.zpravy.idnes.cz/televizionar-paterson-07g-/filmvideo.aspx?c=A180824_104216_filmvideo_spm,TELEVIZIONÁŘ: Nic než něha. Neboť takový je prostě Paterson,"VIDEO
				
                Nežli vypukne seriálový kolovrátek bouřlivých rozvodů, podvodů, vražd a zrad, dá se s dnešní...",idnes.cz,kultura
https://kultura.zpravy.idnes.cz/trailer-keanu-reeves-winona-ryder-ten-pravy-ta-prava-pcc-/filmvideo.aspx?c=A180824_112754_filmvideo_spm,VIDEO: Keanu Reeves a Winona Ryderová se vracejí ve svatební komedii,"VIDEO
				
                Ve filmu Dracula předstírali Keanu Reeves a Winona Ryderová velkou lásku, dokonce jejich postavy...",idnes.cz,kultura
https://kultura.zpravy.idnes.cz/duverny-nepritel-vojtech-dyk-karel-janak-fpm-/filmvideo.aspx?c=A180824_422679_filmvideo_spm,Vojtěch Dyk v Důvěrném nepříteli řídí u počítače hororový dům,"VIDEO
				
                Specialista na pohádky či komedie přešel k hororu. Karel Janák, jehož režisérská dráha vede od...",idnes.cz,kultura
https://kultura.zpravy.idnes.cz/teorie-velkeho-tresku-sheldon-de2-/filmvideo.aspx?c=A180824_092930_filmvideo_spm,Může za to Sheldon? Hvězdy Teorie velkého třesku se loučí s fanoušky,"VIDEO
				
                Herec Jim Parsons, představitel Sheldona v kultovním seriálu Teorie velkého třesku, zveřejnil na...",idnes.cz,kultura
https://kultura.zpravy.idnes.cz/recenze-krystufek-robin-medvidek-pu-ewan-mcgregor-fsl-/filmvideo.aspx?c=A180823_422432_filmvideo_spm,"RECENZE: I když medvídek Pú řádí, Kryštůfek Robin je plný stesku","VIDEO
				
                Ač je premiérový film našich kin Kryštůfek Robin zabydlen důvěrně známými postavičkami dětských děl...",idnes.cz,kultura
https://kultura.zpravy.idnes.cz/jan-zizka-ben-foster-0qy-/filmvideo.aspx?c=A180823_135117_filmvideo_spm,"Jana Žižku bude hrát hollywoodská hvězda Ben Foster, známá i z X-Menů","VIDEO
				
                Krátce před začátkem natáčení odtajnil producent a režisér Petr Jákl jméno herce, který ztvární...",idnes.cz,kultura
https://ekonomika.idnes.cz/mcdonalds-cesko-rekordni-zisk-266-milionu-fdb-/ekonomika.aspx?c=A180829_201055_ekonomika_kafi,"McDonald’s v Česku loni vydělal nejvíc v historii, zisk činí 266 milionů","Fastfoodový gigant McDonald’s ČR loni zvýšil zisk na 266,2 milionu korun, o rok dřív vydělal téměř...",idnes.cz,ekonomika
https://ekonomika.idnes.cz/kfc-obleceni-kolekce-0qw-/ekoakcie.aspx?c=A180828_134429_ekoakcie_tanc,Australané si mohou ke kuřeti koupit nově i KFC slipy či surfovací prkno,Řetězec KFC začal v Austrálii k jídlu nabízet předměty ze své doplňkové kolekce. Zákazníci si tak...,idnes.cz,ekonomika
https://ekonomika.idnes.cz/jizni-severni-korea-infrastruktura-spoluprace-f53-/eko-zahranicni.aspx?c=A180824_164536_eko-zahranicni_svob,"Cesta ke smíru mezi Korejemi vede přes dálnice, dráty a kabely","VIDEO
				
                V posledních letech měla Severní Korea dva hlavní politické cíle – dosáhnout uznání své legitimity...",idnes.cz,ekonomika
https://ekonomika.idnes.cz/nelegalni-billboardy-dalnice-do-konce-roku-tok-f4u-/ekonomika.aspx?c=A180829_152807_ekonomika_svob,"Od dálnic zmizela polovina billboardů, zbylých 700 odstraní do konce roku","VIDEO
				
                Přibližně rok od zavedení zákazu billboardů v ochranném pásmu okolo dálnic jich zbývá odstranit...",idnes.cz,ekonomika
https://ekonomika.idnes.cz/oprava-d1-levnejsi-zpozdeni-df6-/ekonomika.aspx?c=A180829_423728_ekonomika_svob,"Sleva není zadarmo. Oprava D1 bude levnější, ale se zpožděním","Stát má šanci snížit cenu rekonstrukce dálnice D1, a to o mnohamilionové penále, které účtuje...",idnes.cz,ekonomika
https://hradec.idnes.cz/d11-dostavba-deti-zeme-dalnice-reditelstvi-silnic-a-dalnic-rsd-prr-/hradec-zpravy.aspx?c=A180829_155805_eko-doprava_rts,Stavbu D11 odblokoval slib ochrany ještěrek a rekultivace staveniště,"Budování dálnice D11 ze Smiřic do Hradce Králové odblokovalo devět podmínek, které Ředitelství...",idnes.cz,ekonomika
https://ekonomika.idnes.cz/rusko-bojovy-robot-igorek-kalasnikov-d8z-/eko-zahranicni.aspx?c=A180821_133837_zahranicni_aha,"Kalašnikov představil chodícího bojového robota, dal mu jméno Igorek",DoporučujemeKoncept pohyblivého antropomorfního robota představil na veletrhu Armija 2018 ruský koncern Kalašnikov....,idnes.cz,ekonomika
https://ekonomika.idnes.cz/dubai-square-nejvetsi-obchodni-centrum-sveta-faf-/eko-zahranicni.aspx?c=A180829_143237_eko-zahranicni_svob,"Obchody, divadlo i koncerty. V Dubaji staví největší obchodní centrum světa","VIDEO
				
                Dubajské Emaar Properties ve spolupráci s Dubai Holding odhalily plán na stavbu největšího...",idnes.cz,ekonomika
https://ekonomika.idnes.cz/volby-sazky-senat-maxi-tip-tipsport-fortuna-f3z-/ekonomika.aspx?c=A180829_130605_ekonomika_rts,Volby podle bookmakerů: do Senátu se dostanou Drahoš a Fischer. Rath ne,"VIDEO
				
                Neúspěšní prezidentští kandidáti Jiří Drahoš a Pavel Fischer mají podle bookmakerů sázkových...",idnes.cz,ekonomika
https://ekonomika.idnes.cz/wallmart-trika-sssr-stalin-komunismus-dikatura-prodej-pij-/eko-zahranicni.aspx?c=A180829_091524_eko-zahranicni_fih,"Walmart dal do prodeje trika se srpem a kladivem, teď čelí tvrdé kritice","Kontroverzi na sociálních sítích vyvolala akce amerického řetězce Walmart, který začal prodávat...",idnes.cz,ekonomika
https://ekonomika.idnes.cz/ovoce-sklizen-uroda-csu-0s4-/ekonomika.aspx?c=A180829_114929_ekonomika_fih,Úroda ovoce je nadprůměrná. Meruněk je dvakrát víc než loni,"Navzdory suchům převyšuje sklizeň meruněk, třešní a višní o desítky procent úrodu v posledních...",idnes.cz,ekonomika
https://ekonomika.idnes.cz/vanilkova-zmrzlina-srovnani-jak-chutna-test-f3o-/test.aspx?c=A180827_120852_test_jan,TEST DNES: Vanilkové zmrzliny z obchodu jsou plné cukru a umělé chuti,"Češi jsou konzervativní, a tak mají pořád nejraději vanilkovou zmrzlinu. Už ji ovšem nekupují jen v...",idnes.cz,ekonomika
https://ekonomika.idnes.cz/chaty-chalupy-penize-ceny-nemovitosti-dyf-/ekonomika.aspx?c=A180823_422408_ekonomika_rts,"Ceny chalup letí nahoru, v některých krajích za rok téměř o 40 procent",Neustálý nárůst cen domů a bytů zasáhl i rekreační objekty. Chaty a chalupy jsou ve srovnání s...,idnes.cz,ekonomika
https://praha.idnes.cz/praha-metro-d-dopravni-podnik-stavba-d7y-/praha-zpravy.aspx?c=A180829_103426_praha-zpravy_nuc,"První půlka metra D by se mohla začít stavět, rozhodl dopravní podnik","Dozorčí rada potvrdila rozhodnutí představenstva pražského dopravního podniku o tom, že by mohla...",idnes.cz,ekonomika
https://ekonomika.idnes.cz/turecko-nemecko-usa-menova-krize-dolar-lira-financni-pomoc-pag-/eko-zahranicni.aspx?c=A180828_172535_eko-zahranicni_tanc,"Německo jako lék na měnovou krizi? Ankara by pomoc nepřijala, tvrdí experti","VIDEO
				
                V případě potřeby by Německo mohlo podle některých hlasů nabídnout finanční pomoc Turecku, které se...",idnes.cz,ekonomika
