link,link_text,txt,site,area
https://vary.idnes.cz/obalka-penize-posta-seniorka-patrani-svedci-policie-video-p3o-/vary-zpravy.aspx?c=A180122_131007_vary-zpravy_ba,"VIDEO: Seniorka si na poště odložila obálku s penězi, někdo ji sebral","VIDEO
				
                O dvacet tisíc korun přišla devadesátiletá žena, která si na poště v Sokolově odložila obálku s...",idnes.cz,krimi
https://praha.idnes.cz/dodavka-cerveny-ujezd-policie-opilost-dhp-/praha-zpravy.aspx?c=A180122_110932_praha-zpravy_nuc,VIDEO: Opilého řidiče dodávky vystřídal ještě větší opilec a boural,"VIDEO
				
                Hned dva opilé řidiče ve stejném autě zastavili v neděli policisté v Červeném Újezdu na...",idnes.cz,krimi
https://zlin.idnes.cz/lopenik-rallye-uhersky-brod-smrt-nehoda-obvineni-organizatori-federace-1a2-/zlin-zpravy.aspx?c=A180122_377838_zlin-zpravy_ras,"Zvrat v kauze rallye Lopeník, policie stíhá i čtyři pořadatele závodu","VIDEO
				
                V případu smrti čtyř dívek, které v roce 2012 zahynuly při nehodě na závodech rallye v Lopeníku na...",idnes.cz,krimi
https://budejovice.idnes.cz/policie-obvinila-relaxacni-centrum-hluboka-nad-vltavou-jiri-trnka-10i-/budejovice-zpravy.aspx?c=A180122_085802_budejovice-zpravy_khr,Policie obvinila pět lidí z dotačního podvodu při stavbě centra v Hluboké,Policisté obvinili pět lidí z dotačního podvodu při stavbě Relaxačního a regeneračního centra v...,idnes.cz,krimi
https://praha.idnes.cz/pozar-naplavni-ulice-hotel-eurostars-david-fk6-/praha-zpravy.aspx?c=A180122_100812_praha-zpravy_nuc,Požár hotelu v Praze policie vyšetřuje jako obecné ohrožení z nedbalosti,"VIDEO
				
                Policie vyčíslila škodu, kterou způsobil sobotní požár v hotelu Eurostars David v pražské Náplavní...",idnes.cz,krimi
https://praha.idnes.cz/vysehrad-munice-policie-pyrotechnik-hledac-kovu-fux-/praha-zpravy.aspx?c=A180122_093108_praha-zpravy_nuc,Hledač kovů našel v řece pod Vyšehradem nevybuchlý granát,"VIDEO
				
                Z řeky Vltavy vytáhl v neděli odpoledne amatérský hledač kovů nevybuchlou munici. Policisté okolí...",idnes.cz,krimi
https://zpravy.idnes.cz/pozar-hotel-praha-0z7-/krimi.aspx?c=A180120_183044_krimi_pas,"Při požáru hotelu v centru Prahy zemřeli dva lidé, další jsou v nemocnicích","VIDEO
				
                V hotelu v pražské Náplavní ulici vypukl v sobotu po 18. hodině požár. Dva lidé zemřeli, několik...",idnes.cz,krimi
https://zpravy.idnes.cz/foto-snimky-hasici-pozar-hotel-eurostar-david-praha-hasici-umrti-dva-mrtvi-1ua-/krimi.aspx?c=A180121_092610_praha-zpravy_hell,"OBRAZEM: Plameny, kouř a lidé na římsách. Podívejte se na zásah v hotelu","VIDEO
				
                Hlášení o požáru v hotelu Eurostar David v pražské Náplavní ulici dostali operátoři v sobotu v...",idnes.cz,krimi
https://zpravy.idnes.cz/dopravni-nehoda-ceske-budejovice-zraneni-fpr-/krimi.aspx?c=A180120_172741_krimi_krb,"V Budějovicích se srazila dvě auta, jedno vjelo do dětí na přechodu","VIDEO
				
                V Českých Budějovicích se srazila dvě osobní auta. V tu chvíli poblíž stála skupinka dětí, do...",idnes.cz,krimi
https://zpravy.idnes.cz/kauza-losovacky-podvod-soud-verejne-zakazky-f3u-/krimi.aspx?c=A180119_155213_krimi_pmk,"Obžalovaní v kauze „losovaček“ znají tresty, zaplatí desítky milionů",Za zmanipulování elektronického losování veřejných zakázek rozdal soud čtrnácti obžalovaným tříleté...,idnes.cz,krimi
https://usti.idnes.cz/zachrana-psa-uzka-sachta-straznici-hasici-most-fl0-/usti-zpravy.aspx?c=A180119_142438_usti-zpravy_vac2,"Štěně se propadlo do úzké šachty, ven ho vytáhli strážníci a hasiči","VIDEO
				
                Strážníci a hasiči v Mostě zachraňovali psa, který spadl do úzké šachty hluboké zhruba tři metry....",idnes.cz,krimi
https://jihlava.idnes.cz/nehoda-policie-telc-prechod-zraneni-ridic-senior-vysocina-p3n-/jihlava-zpravy.aspx?c=A180119_150631_jihlava-zpravy_mv,Senior v Telči srazil na přechodu pro chodce ženu a čtyřleté dítě,Osmdesátiletý řidič osobního vozu ve čtvrtek v Telči na Jihlavsku srazil ženu a čtyřletého chlapce....,idnes.cz,krimi
https://plzen.idnes.cz/besip-dalnice-videokamera-jizdni-pruh-vystrazny-trojuhelnik-pug-/plzen-zpravy.aspx?c=A180119_123753_plzen-zpravy_vb,"V rychlém pruhu na D5 stálo auto, nebezpečnou situaci natočila záchranka","VIDEO
				
                Krajští záchranáři upozornili na nebezpečnou situaci, kterou zaznamenali dopoledne na dálnici D5 u...",idnes.cz,krimi
https://olomouc.idnes.cz/slatinice-vandal-poskozeni-nahrobku-hroby-vezeni-fvo-/olomouc-zpravy.aspx?c=A180119_140531_olomouc-zpravy_stk,"Vandal zdemoloval náhrobky na hřbitově, přitom už měl být ve vězení","Jen dva dny stačily policistům z Olomoucka na vypátrání vandala, který na jednom z tamních hřbitovů...",idnes.cz,krimi
https://liberec.idnes.cz/cizinec-ujizdel-bmw-letni-pneumatiky-auto-jizda-ft8-/liberec-zpravy.aspx?c=A180119_130831_liberec-zpravy_jape,"Zdrogovaný cizinec ujížděl na letních gumách, z auta vyskočil za jízdy","VIDEO
				
                Černé kradené BMW ujíždělo na letních pneumatikám policistům v Novém Městě pod Smrkem. Řidič...",idnes.cz,krimi
https://praha.idnes.cz/praha-cernolice-vrazda-senior-dkp-/praha-zpravy.aspx?c=A180119_140039_praha-zpravy_nuc,Muži obviněnému z vraždy v Černolicích u Prahy hrozí až výjimečný trest,"VIDEO
				
                Kriminalisté zahájili trestní stíhání muže, kterého zadrželi po úterní vraždě v Černolicích v...",idnes.cz,krimi
https://kultura.zpravy.idnes.cz/black-label-society-grimmest-hits-recenze-fgn-/hudba.aspx?c=A180123_104144_hudba_vha,RECENZE: Zakk Wylde s chutí míchá jižanský rock do heavy metalu,"Zakk Wylde je známý především jako kytarista, který dlouhodobě doprovázel Ozzyho Osbourna na jeho...",idnes.cz,kultura
https://kultura.zpravy.idnes.cz/nominace-oscar-2017-0et-/filmvideo.aspx?c=A180123_125422_filmvideo_spm,Šanci na Oscara mají Oldman i Streepová. Z filmů Dunkerk či Tvář vody,Americká filmová akademie oznámila nominace na své výroční ceny. Hlavní sošku Oscara pro nejlepší...,idnes.cz,kultura
https://kultura.zpravy.idnes.cz/manzelske-etudy-glosa-komentar-trestikova-fk0-/filmvideo.aspx?c=A180123_093148_filmvideo_ts,GLOSA: Celý můj život obnáší sto čtyři minut. Co přinesly Manželské etudy?,"Každý z nich je jedinečný. Nicméně ke konci cyklu Manželské etudy po 35 letech, kdy ve čtvrtek ČT2...",idnes.cz,kultura
https://kultura.zpravy.idnes.cz/festival-sziget-kendrick-lamar-liam-gallagher-madaesko-p1y-/hudba.aspx?c=A180123_113512_hudba_vha,Maďarský festival Sziget hlásí Kendricka Lamara či Liama Gallaghera,"Oblíbený festival Sziget, který se letos uskuteční od 8. do 15. srpna na budapešťském ostrově...",idnes.cz,kultura
https://kultura.zpravy.idnes.cz/neil-diamond-konci-s-koncertovanim-konec-koncert-parkinson-parkinsonova-choroba-nemoc-grz-/hudba.aspx?c=A180123_095034_hudba_vha,Autor hitů Neil Diamond končí kvůli Parkinsonově nemoci s koncertováním,Americký zpěvák a skladatel Neil Diamond se rozhodl ukončit koncertování kvůli Parkinsonově...,idnes.cz,kultura
https://kultura.zpravy.idnes.cz/led-zeppelin-padesatiny-page-plant-dtn-/hudba.aspx?c=A180122_140951_hudba_ts,"Led Zeppelin letos slaví padesátku. Page slibuje překvapení, Plant mlží","Blížící se padesátiny jedné z největších kapel rockové historie vzbuzují otázku, zda nevisí po více...",idnes.cz,kultura
https://kultura.zpravy.idnes.cz/video-lara-croft-alicia-vikanderova-tomb-raider-fr4-/filmvideo.aspx?c=A180122_162857_filmvideo_ts,VIDEO: Jméno? Lara Croft! Vikanderová zkusí překonat Angelinu Jolie,"Tomb Raider je zpět. Novou tváří slavné ztepilé amazonky, která v devadesátých letech učarovala...",idnes.cz,kultura
https://kultura.zpravy.idnes.cz/kina-zebrik-renc-zoufale-zeny-coco-d5j-/filmvideo.aspx?c=A180122_133420_filmvideo_spm,Domácí komedie Zoufalé ženy porazila všechny tři oscarové favority,"Romantická komedie Zoufalé ženy dělají zoufalé věci, kterou podle scénáře Haliny Pawlowské natočil...",idnes.cz,kultura
https://kultura.zpravy.idnes.cz/trailer-jan-zizka-petr-jakl-jiri-madl-ds1-/filmvideo.aspx?c=A180122_163101_filmvideo_spm,VIDEO: Na Jana Žižku láká osm bojovníků v čele s Jiřím Mádlem,"Jako svéráznou upoutávku k chystanému filmu Jan Žižka, o jehož obsazení právě jedná ve Spojených...",idnes.cz,kultura
https://kultura.zpravy.idnes.cz/mandrage-po-pulnoci-recenze-dpj-/hudba.aspx?c=A180122_101129_hudba_vha,RECENZE: Mandrage na desce Po půlnoci dozráli jako patnáctiletá whisky,Návrat k rockovým kořenům či více kytarová než předchozí nahrávky. Taková prohlášení provázela...,idnes.cz,kultura
https://kultura.zpravy.idnes.cz/zlata-malina-nejhorsi-film-transformers-pobrezni-hlidka-padesat-odstinu-temnoty-mumie-emoji-ve-filmu-ibq-/filmvideo.aspx?c=A180122_100250_filmvideo_spm,"Na nejhorší film roku aspirují Transformers, Mumie i Pobřežní hlídka",Tradičně v předvečer nominací na Oscara vyhlašuje nadace Zlatá malina uchazeče o anticeny pro...,idnes.cz,kultura
https://kultura.zpravy.idnes.cz/dukatova-cesta-recenze-07g-/filmvideo.aspx?c=A180122_091340_filmvideo_ts,RECENZE: Dětská pohádková telenovela marně vzhlíží k Ať žijí duchové,Okřídlená cesta do pekel dlážděná nejlepšími úmysly se zhmotnila v nové české pohádce o dětském...,idnes.cz,kultura
https://kultura.zpravy.idnes.cz/lenny-kravitz-koncert-praha-o2-arena-dbh-/hudba.aspx?c=A180122_105636_hudba_vha,"V červnu dorazí Lenny Kravitz, přivézt by měl i nové album","Lenny Kravitz oznámil termíny svého letního evropského turné, v rámci kterého vystoupí 2. června...",idnes.cz,kultura
https://kultura.zpravy.idnes.cz/s-laskou-vincent-recenze-film-van-gogh-dx4-/filmvideo.aspx?c=A180119_144137_filmvideo_ts,"RECENZE: Až se van Goghovy malby ve filmu omrzí, zbude detektivka",Animovaná detektivka S láskou Vincent je určitě unikát. Celovečerní film o Vincentovi van Goghovi...,idnes.cz,kultura
https://kultura.zpravy.idnes.cz/trailer-prostor-michail-barysnikov-dbt-/filmvideo.aspx?c=A180121_144702_filmvideo_spm,VIDEO: Našel se prostor pro Baryšnikova a jeho Prostor. Půlhodina,"Zdálo se, že si kina nebudou vědět rady, ale nakonec mile překvapila. Desítky sálů v Česku našly...",idnes.cz,kultura
https://jihlava.idnes.cz/zdenek-braunschlager-herec-trebic-umrti-semafor-fty-/jihlava-zpravy.aspx?c=A180122_133517_jihlava-zpravy_epsal,"Zemřel herec, který byl se Suchým, Horníčkem či Štědrým u zrodu Semaforu","Když mu na podzim roku 2015 udělili v Třebíči Cenu města, nemohl se již slavnosti zúčastnit ze...",idnes.cz,kultura
https://kultura.zpravy.idnes.cz/galerie-rudolfinum-vystava-obrazem-dbj-/vytvarne-umeni.aspx?c=A180119_100041_vytvarne-umeni_kiz,Otroci a uprchlíci obsadili Rudolfinum. Inspiroval i Kendrick Lamar,Odvážný krok ve své dramaturgii učinila pražská Galerie Rudolfinum. V rámci nové výstavy Domestic...,idnes.cz,kultura
https://kultura.zpravy.idnes.cz/pkf-prague-philharmonia-stvoreni-dq9-/hudba.aspx?c=A180121_122906_hudba_era,GLOSA: „Velký třesk“ v Dvořákově síni. Jak tenor s basem stvořili svět,"Orchestr PKF–Prague Philharmonia připravil na sobotní večer v Rudolfinu Haydnovo Stvoření, jedno z...",idnes.cz,kultura
https://kultura.zpravy.idnes.cz/helena-vondrackova-70-koncert-o2-arena-recenze-f3n-/hudba.aspx?c=A180121_000912_hudba_vha,RECENZE: Stepaři a záplava hostů udělali z oslavy Vondráčkové estrádu,Na téměř tříhodinovou cestou do historie své hudební dráhy vzala Helena Vondráčková v sobotu...,idnes.cz,kultura
https://kultura.zpravy.idnes.cz/uvod-do-prace-s-pocitacem-rekvalifikacni-kurz-umc-praha-9-divadlo-akropolis-petr-vanek-go5-/divadlo.aspx?c=A180119_132518_divadlo_ts,Počítačový rekvalifikační kurz přímo na jevišti připomene Michala Kolesu,"Úvod do práce s počítačem – Rekvalifikační kurz ÚMČ Praha 9. Název inscenace, kterou v pražské...",idnes.cz,kultura
https://kultura.zpravy.idnes.cz/prekladatele-jmeno-na-obalce-d1v-/literatura.aspx?c=A180119_124617_literatura_ts,Překladatelé chtějí svá jména na obálkách knih. O peníze jim nejde,"Neměli bychom bez nich Bradavice ani Zeměplochu, neznali Frodo Pytlíka. Přesto však zůstává...",idnes.cz,kultura
https://kultura.zpravy.idnes.cz/parov-stelar-the-burning-spider-koncert-rozhovor-fvk-/hudba.aspx?c=A180119_141513_hudba_vha,"Roztancovat lidi na blues? Vzal jsem to jako výzvu, tvrdí Parov Stelar","Do telefonu se hlásí jako Marcus, Marcus Füreder, jednoho z nejúspěšnějších rakouských hudebníků...",idnes.cz,kultura
https://kultura.zpravy.idnes.cz/titanic-divadlo-kalich-recenze-miroslav-vladyka-filip-blazek-p5s-/divadlo.aspx?c=A180119_111716_divadlo_ts,RECENZE: Když ledovec Vladyka smutní. Titanic je vydařená oddechovka,"Komedie Titanic, ve které se Filip Blažek a Miroslav Vladyka, pokusili divákům sehrát celou zkázu...",idnes.cz,kultura
https://kultura.zpravy.idnes.cz/mandrage-po-pulnoci-turne-forum-karlin-dy5-/hudba.aspx?c=A180119_103815_filmvideo_kiz,Mandrage vydávají novou desku. Zní jako melancholický rock z baru,Mandrage své nové album Po půlnoci oděli do černé kůže a barových neonů. Ve stejném duchu se ponese...,idnes.cz,kultura
https://kultura.zpravy.idnes.cz/jiri-naceradsky-piestany-vystava-cenzura-obrazy-akty-konec-vystavy-1ir-/vytvarne-umeni.aspx?c=A180120_094349_vytvarne-umeni_hell,Načeradského obrazy pobouřily ředitelku galerie. Výstava skončila,Ve slovenských Piešťanech předčasně skončila výstava českého výtvarníka Jiřího Načeradského....,idnes.cz,kultura
https://kultura.zpravy.idnes.cz/tom-petty-predavkovani-leky-koroner-kapela-heartbreakers-p36-/hudba.aspx?c=A180120_084713_domaci_hell,"Rocker Tom Petty se neúmyslně předávkoval léky, uvádí zpráva koronera",Příčinou loňského úmrtí amerického rockového hudebníka Toma Pettyho bylo neúmyslné předávkování...,idnes.cz,kultura
https://kultura.zpravy.idnes.cz/televizionar-kevin-spacey-d00-/filmvideo.aspx?c=A180119_122254_filmvideo_ts,"TELEVIZIONÁŘ: Toto je skutečný Kevin Spacey, ne ten odepsaný štvanec","Americká krása je krása nevídaná, tečka. Ne pro pět vyhraných Oscarů a stovku jiných cen ani proto,...",idnes.cz,kultura
https://kultura.zpravy.idnes.cz/billy-budd-narodni-divadlo-benjamin-britten-recenze-daniel-spinar-opera-1nu-/divadlo.aspx?c=A180119_125159_divadlo_era,"RECENZE: Může mít kapitán válečné lodi vlečku? Ale ano, může",Šéf činohry pražského Národního divadla Daniel Špinar před třemi lety způsobil zázrak v umělecky...,idnes.cz,kultura
https://kultura.zpravy.idnes.cz/recenze-nemilovani-zvjagincev-cannes-d81-/filmvideo.aspx?c=A180118_174635_filmvideo_spm,"RECENZE: Myslí víc na sebe než na dítě. Konzum, sex a Nemilovaní","Jakýsi chlapec, váhavě se vracející domů předměstskou krajinou u zamrzlého rybníka, se zastaví u...",idnes.cz,kultura
https://kultura.zpravy.idnes.cz/poutak-za-scenou-manzelske-etudy-helena-trestikova-marcela-haverlandova-1qq-/filmvideo.aspx?c=A180118_124758_filmvideo_spm,Se synem nejsem v kontaktu. Marcela z Manželských etud byla hostem Za scénou,"Rozvedla se po dvou letech, dceru Ivanu, kterou vychovala sama, zabil vlak a se synem Tomášem z...",idnes.cz,kultura
https://kultura.zpravy.idnes.cz/cena-jindricha-chalupeckeho-glosa-dl2-/vytvarne-umeni.aspx?c=A180118_173616_vytvarne-umeni_vha,GLOSA: Fluidní identita subjektů? Na to se jistě budou stát fronty,"Cena Jindřicha Chalupeckého dává prostor mladým umělcům, ukazuje směr současné tvorby a samozřejmě...",idnes.cz,kultura
https://kultura.zpravy.idnes.cz/miro-zbirka-abbey-road-spoluprace-robbie-mcintosh-hamish-stuart-p8n-/hudba.aspx?c=A180118_132643_hudba_ts,Žbirka točil se spoluhráči Paula McCartneyho. Musel se ovládat,Miro Žbirka je na slavné londýnské adrese u neméně proslulého přechodu už jako doma. Když zde před...,idnes.cz,kultura
https://kultura.zpravy.idnes.cz/porady-roku-2017-andel-pane-policie-modrava-cetnici-z-luhacovic-nejlepsi-pritel-18d-/filmvideo.aspx?c=A180118_143403_filmvideo_spm,Loni v televizi vyhrály tři pohádky v čele s Andělem Páně 2 a dvě krimi,"Nejsledovanějším pořadem roku 2017 zůstala štědrovečerní pohádka Anděl Páně 2, jediná nad třemi...",idnes.cz,kultura
https://kultura.zpravy.idnes.cz/lekarnik-z-osvetimi-vysetrovatel-obchodnici-s-lidmi-recenze-p5f-/literatura.aspx?c=A180117_132652_literatura_ts,RECENZE: Hon na démony balkánské války je napínavý jak detektivka,"Tři knihy z oblasti literatury faktu se zabývají válečnými zločiny. Vyznačují se napětím, ať se...",idnes.cz,kultura
https://kultura.zpravy.idnes.cz/trailer-operace-entebbe-rosamund-pike-daniel-bruhl-fw5-/filmvideo.aspx?c=A180117_161059_filmvideo_spm,VIDEO: Rosamund Pike a Daniel Brühl unesli letadlo. V Operaci Entebbe,"Operace Entebbe, která do našich kin přijde 29. března, slibuje politický thriller inspirovaný...",idnes.cz,kultura
https://kultura.zpravy.idnes.cz/cesky-lev-2018-nominace-komentar-deo-/filmvideo.aspx?c=A180118_102852_filmvideo_ts,"KOMENTÁŘ: Český lev se loni zapotil. Co týden, to film. A zjevení chybí","Českého lva pro nejlepší film roku 2017 dostane Bába z ledu, Kvarteto, Milada, Po strništi bos nebo...",idnes.cz,kultura
https://ekonomika.idnes.cz/carrefour-amazon-francie-maloobchod-d7i-/eko-zahranicni.aspx?c=A180123_160716_eko-zahranicni_mato,"Carrefour plánuje zásadní změny, oseká 2400 míst a investuje miliardy",Francouzský maloobchodní řetězec Carrefour odhalil v úterý svou vizi pro příští roky. Kromě...,idnes.cz,ekonomika
https://plzen.idnes.cz/vyrobci-vejce-cena-fipronilovy-skandal-obchodni-retezec-pkz-/plzen-zpravy.aspx?c=A180123_114554_plzen-zpravy_vb,Vejce jsou v obchodech stále drahá. Producenti přitom šli s cenou dolů,"VIDEO
				
                Po loňské aféře, kdy se ve vejcích objevila toxická látka, se jejich cena vyšplhala až k pěti...",idnes.cz,ekonomika
https://ekonomika.idnes.cz/stravenky-zruseni-ministerstvo-financi-ffw-/ekonomika.aspx?c=A180123_131614_ekonomika_fih,"Zvýhodnění stravenek zachováme, tvrdí ministerstvo financí",Zrušení daňového zvýhodnění stravenek není na pořadu dne. Tento benefit chtělo podle Unie...,idnes.cz,ekonomika
https://ekonomika.idnes.cz/vodne-stocne-zdrazeni-sovak-ceny-vody-dx4-/ekonomika.aspx?c=A180123_121436_ekonomika_fih,Také za vodu si Češi letos připlatí. Kubík zdraží až na 88 korun,Vlna zdražování letos nemine ani vodné a stočné. Podle odhadů Sdružení oboru vodovodů a kanalizací...,idnes.cz,ekonomika
https://ekonomika.idnes.cz/danove-raje-evropska-unie-cerna-listina-osm-zemi-ful-/eko-zahranicni.aspx?c=A180123_111042_eko-zahranicni_jn,"EU vyřadila z černé listiny daňových rájů osm zemí. Slíbily, že se polepší","Evropská unie ze svého černého seznamu daňových rájů odstranila osm zemí, kromě jiného třeba...",idnes.cz,ekonomika
https://ekonomika.idnes.cz/trump-cla-pracky-solarni-panely-usa-dbd-/eko-zahranicni.aspx?c=A180123_104319_eko-zahranicni_fih,Trump přivřel dveře dovozcům praček a solárních panelů. Schválil vysoká cla,Dovoz praček a solárních panelů do USA výrazně zdraží. Americký prezident Donald Trump schválil...,idnes.cz,ekonomika
https://ekonomika.idnes.cz/uctenkovka-eet-upravy-nevidomi-slepci-diebold-nixdorf-p1n-/ekonomika.aspx?c=A180123_093201_ekonomika_fih,Účtenkovka bude i pro nevidomé. A má být snadnější opravovat chyby,"VIDEO
				
                Společnost Diebold Nixdorf, která má na starosti systém „loterie“ Účtenkovka, by měla upravit hru...",idnes.cz,ekonomika
https://ekonomika.idnes.cz/niki-lauda-formule-aerolinky-niki-dl5-/eko-zahranicni.aspx?c=A180123_084051_eko-zahranicni_fih,"Legendární Lauda koupil aerolinky Niki, které kdysi založil",Bývalý závodník Formule 1 Niki Lauda znovu získá rakouskou nízkonákladovou leteckou společnost...,idnes.cz,ekonomika
https://ekonomika.idnes.cz/cena-nafta-male-firmy-stoupani-cen-drk-/ekonomika.aspx?c=A180122_210106_ekonomika_dtt,Nafta se vrátila na třicet korun za litr. Zdražení trápí hlavně malé firmy,Cena nafty se po půl roce opět vrátila na hranici třiceti korun. Zdražování přitom trápí hlavně...,idnes.cz,ekonomika
https://ekonomika.idnes.cz/test-internetovy-obchod-potraviny-zkusenost-srovnani-itesco-kosik-rohlik-1b5-/test.aspx?c=A180122_133108_test_jan,"Nákupy potravin na internetu: velké e-shopy jsou spolehlivé, malé jako loterie","Zaneprázdnění rodiče, maminky na mateřské, lidé starší i nemocní stále častěji využívají k nákupu...",idnes.cz,ekonomika
https://ekonomika.idnes.cz/soros-madarsko-orba-stop-sorosovi-d58-/eko-zahranicni.aspx?c=A180122_140317_eko-zahranicni_div,Orbán stupňuje tlak na neziskovky a Sorose. Plánuje zdanění i zákaz činnosti,"Miliardář George Soros má ve své rodné zemi problém. Maďarská vláda chce zdanit jeho nadace, které...",idnes.cz,ekonomika
https://ekonomika.idnes.cz/restaurace-konci-s-plastovymi-brcky-d7w-/eko-zahranicni.aspx?c=A180119_103531_eko-zahranicni_nio,Konec srkání plastovými brčky. Firmy reagují na kritiku umělých obalů,"Restaurace a kavárny se zbavují neekologického vybavení. Zatím posledním řetězcem, který se rozhodl...",idnes.cz,ekonomika
https://ekonomika.idnes.cz/statni-zemedelsky-intervencni-fond-regionalni-potraviny-klasa-znacka-podpora-dotace-ministerstvo-zem-iwa-/ekonomika.aspx?c=A180122_142150_ekonomika_rts,Stát vypsal soutěž na podporu kvalitních potravin. Babiš tendr kritizuje,Státní zemědělský intervenční fond (SZIF) vypsal soutěž na část tendru na tříletou podporu...,idnes.cz,ekonomika
https://ekonomika.idnes.cz/katalansko-spanelsko-hdp-referendum-dvg-/eko-zahranicni.aspx?c=A180122_154746_eko-zahranicni_div,"Katalánci chtěli svobodu, místo ní chudnou. Přišel první účet za referendum","Výzkum madridské banky BBVA poukazuje na to, jak nákladný je pro Katalánsko jeho boj za...",idnes.cz,ekonomika
https://ekonomika.idnes.cz/toaletni-papir-test-kvality-vrstvy-cesko-rakousko-fxm-/test.aspx?c=A180122_120541_ekonomika_tanc,"V Rakousku třívrstvý, v Česku slabší. Dvojí kvalitu má i toaletní papír","VIDEO
				
                Nejen u potravin se liší kvalita výrobků od stejných firem prodávaných v ČR od těch ze zahraničních...",idnes.cz,ekonomika
https://ekonomika.idnes.cz/oxfam-davos-world-economic-forum-rozdily-prijmy-chudoba-bohati-psz-/eko-zahranicni.aspx?c=A180122_111747_eko-zahranicni_rts,"Miliardáři vykořisťují chudé, burcuje neziskovka. Setkání elit začíná","Čtyři pětiny bohatství, vytvořeného loni ve světě, skončily u jednoho procenta nejbohatších lidí...",idnes.cz,ekonomika
https://ekonomika.idnes.cz/stavba-silnic-360-km-ministr-dopravy-dan-tok-fju-/ekonomika.aspx?c=A180121_145845_domaci_krb,"Česko, obří staveniště. Ťok chce letos stavět 360 kilometrů nových silnic","Ministr dopravy Dan Ťok slibuje, že promění Česko v obří staveniště. Během letošního roku by podle...",idnes.cz,ekonomika
https://ekonomika.idnes.cz/kfc-bitcoin-kybl-satoshi-nakamoto-dll-/eko-zahranicni.aspx?c=A180122_093505_eko-zahranicni_div,Plukovník Sanders nastoupil do kryptovlaku. KFC zavedlo kyblík za bitcoiny,"Kanadské KFC se přidalo ke společnostem, které se rozhodly využít bitcoinové horečky.  Začalo...",idnes.cz,ekonomika
https://ekonomika.idnes.cz/ropa-z-bridlic-vrchol-cena-ropy-nejvyssi-za-posledni-tri-roky-pue-/eko-zahranicni.aspx?c=A180121_164001_eko-zahranicni_map1,"ANALÝZA: USA se brzy stanou ropnou jedničkou, pomůže jim drahá ropa","Spojené státy přeskočí Saúdskou Arábii a Rusko a stanou se největším producentem ropy na světě,...",idnes.cz,ekonomika
https://ekonomika.idnes.cz/kmv-pepsico-akvizice-nakup-prevod-drq-/ekoakcie.aspx?c=A180122_140621_ekoakcie_rts,Karlovarské minerální vody koupí středoevropské pobočky PepsiCo,"Karlovarské minerální vody (KMV) koupí od nadnárodní společnosti PepsiCo její pobočky v Česku,...",idnes.cz,ekonomika
https://ekonomika.idnes.cz/silici-koruna-nakupy-v-zahranici-e-shopy-ffe-/ekonomika.aspx?c=A180122_103318_ekonomika_jn,"Koruna posiluje, Čechům se vyplácí nakupovat v zahraničních e-shopech",Sílící kurz koruny k dolaru či čínskému jüanu zlevňuje Čechům nákupy v zahraničí. V meziročním...,idnes.cz,ekonomika
https://hradec.idnes.cz/d11-hradec-kralove-napadeni-stavebni-povoleni-vlastnik-pudy-rozklad-1pf-/hradec-zpravy.aspx?c=A180122_377824_hradec-zpravy_tuu,"Vlastník půdy napadl stavební povolení D11, dálnici má za černou stavbu","VIDEO
				
                Vlastník půdy v trase dalšího úseku dálnice D11 se ohradil proti stavebnímu povolení. Podal...",idnes.cz,ekonomika
https://ekonomika.idnes.cz/podnikatel-roku-pribeh-anketa-dkg-/ekonomika.aspx?c=A180116_145615_ekonomika_ven,ANKETA: Vyberte podnikatelský příběh roku 2017,"Čtyři „ženské“ firmy, vedle nich čtyři „mužské“. A v jedné z nich se zrodil podnikatelský příběh...",idnes.cz,ekonomika
https://finance.idnes.cz/prace-podnikani-kuchar-jizni-tyrolsko-testoviny-byznys-pep-/podnikani.aspx?c=A180118_142235_podnikani_kho,"Miluje těstoviny, připravuje je na všechny způsoby a je slavný",Markus Holzer je jedním z nejslavnějších italských kuchařů současnosti. Jeho pořad La prova del...,idnes.cz,ekonomika
