link,link_text,txt,site,area
https://olomouc.idnes.cz/soud-priprava-vrazdy-ubit-palcat-narozny-fgc-/olomouc-zpravy.aspx?c=A171204_123227_olomouc-zpravy_lds,Soud potrestal podezřelého z otcovraždy 13 lety za přípravu vraždy tety,Třinácti lety vězení potrestal krajský soud Pavla Nárožného z Přerova za přípravu vraždy jeho tety....,idnes.cz,krimi
https://brno.idnes.cz/zlodej-ukradl-z-mrazaku-kachny-blucina-brno-fez-/brno-zpravy.aspx?c=A171204_093352_brno-zpravy_vh,"Nic cenného v domě zloděj nenašel, tak odnesl z mrazáku tři kachny","Hodnotnější lup si zřejmě představoval zloděj, který si o víkendu vyhlédl rodinný dům v Blučině na...",idnes.cz,krimi
https://jihlava.idnes.cz/youtuber-soud-jihlava-petr-jelinek-vulgarity-vysocina-video-ptz-/jihlava-zpravy.aspx?c=A171204_113442_jihlava-zpravy_mv,"Vulgarity youtubera nejsou trestným činem. Je to přestupek, řekl soud","Okresní soud v Jihlavě uzavřel kauzu youtubera Petra Jelínka. Ten čelil žalobě kvůli videu, v němž...",idnes.cz,krimi
https://vary.idnes.cz/zlodej-okradl-myslivce-zver-jelen-zajic-policie-fte-/vary-zpravy.aspx?c=A171204_104855_vary-zpravy_ba,"Hlídka zastavila v noci muže s jelenem přes rameno, ukradl ho myslivci",Kuriózní krádež řešili policisté v Chebu. Myslivci vlezl do zahrady zloděj a odnesl mu ulovenou...,idnes.cz,krimi
https://olomouc.idnes.cz/nehoda-tahl-na-lane-kruhovy-objezd-komenskeho-alkohol-prerov-p55-/olomouc-zpravy.aspx?c=A171204_093334_olomouc-zpravy_lds,"Řidička tažená na laně nevybrala zatáčku, druhý motorista nadýchal",Jízdu na vlečném laně nezvládla v neděli ráno v Přerově sedmadvacetiletá řidička osobního auta...,idnes.cz,krimi
https://hradec.idnes.cz/pozar-zhar-menik-hradecko-auta-de5-/hradec-zpravy.aspx?c=A171204_083741_hradec-zpravy_pos,"Žhář v noci na Hradecku zapálil dvě auta, škoda je 350 tisíc",V Měníku nedaleko Nového Bydžova na Hradecku v noci neznámý pachatel úmyslně zapálil dvě auta....,idnes.cz,krimi
https://zpravy.idnes.cz/umrzly-bezdomovec-clovek-bez-domova-centrum-socialnich-sluzeb-nocleharny-1tu-/krimi.aspx?c=A171203_110603_krimi_dtt,"V Praze umrzl další člověk, v noclehárnách jsou přitom volná místa",V neděli ráno byl v Praze nalezen mrtvý bezdomovec. Za víkend je to už druhá oběť mrazu. Lidé bez...,idnes.cz,krimi
https://zpravy.idnes.cz/lavka-pres-vltavu-zriceni-zraneni-zastavena-lodni-doprava-pa3-/domaci.aspx?c=A171202_134614_krimi_dtt,"V Troji se zřítila lávka přes Vltavu, zranili se čtyři lidé",Pěší lávka u Trojského zámku v Praze se zřítila do Vltavy. Čtyři lidé byli zraněni. Na místě...,idnes.cz,krimi
https://zpravy.idnes.cz/umrznuty-muz-lide-bez-domova-bezdomovci-bohnice-opatreni-pm8-/krimi.aspx?c=A171202_104656_krimi_dtt,"V pražských Bohnicích v noci umrzl muž, je šestou obětí mrazů",V pražských Bohnicích v noci z pátku na sobotu umrzl muž. Pravděpodobně jde o bezdomovce. Mezi...,idnes.cz,krimi
https://jihlava.idnes.cz/nehoda-policie-dodavka-sluzebni-rozjeti-samovolne-pelhrimov-vysocina-1z8-/jihlava-zpravy.aspx?c=A171201_173809_jihlava-zpravy_mv,"Policejní dodávka se sama rozjela, poničila dvě auta a přerazila sloup",Policejní dodávka se odpoledne stala hlavním aktérem netradiční nehody v centru Pelhřimova....,idnes.cz,krimi
https://kultura.zpravy.idnes.cz/metronome-festival-2018-john-cale-d3z-/hudba.aspx?c=A171205_131003_hudba_vha,"Na Metronomu zazní i Hallelujah, na festival dorazí John Cale","Hudebník, jehož kariéra pokrývá celé půlstoletí, debutoval jako člen kapel The Velvet Underground a...",idnes.cz,kultura
https://kultura.zpravy.idnes.cz/marie-terezie-film-televize-kotek-stivinova-fmh-/filmvideo.aspx?c=A171205_100208_filmvideo_ts,"Muž Marie Terezie byl Marťan ze současnosti, shrnuje roli Vojtěch Kotek",Dvoudílný koprodukční film Marie Terezie uvede ČT 1. a 2. ledna 2018. Manžela panovnice představuje...,idnes.cz,kultura
https://kultura.zpravy.idnes.cz/pripady-1-oddeleni-tv-televize-ct-krimiserial-serial-maxa-reitler-pye-/filmvideo.aspx?c=A171205_115808_filmvideo_spm,Vrátí se Případy 1. oddělení. Z dřívějších dob a s mladšími tvářemi,"Populární krimiseriál Případy 1. oddělení chystá pokračování. 
Ředitel vývoje pořadů a...",idnes.cz,kultura
https://kultura.zpravy.idnes.cz/miro-zbirka-video-za-scenou-porad-dqo-/hudba.aspx?c=A171204_102543_hudba_kiz,Gotta už by porazit nechtěl. Miro Žbirka byl hostem Za scénou,"Miro Žbirka už by Karla Gotta na místě zlatého slavíka vystřídat nechtěl, prozradil v pořadu Za...",idnes.cz,kultura
https://kultura.zpravy.idnes.cz/dum-z-karet-bude-kevin-spacey-ne-d3n-/filmvideo.aspx?c=A171205_104138_filmvideo_spm,"Finále Domu z karet se natočí, ale bez Spaceyho. Hvězdou bude Wrightová","O čem se spekulovalo, stalo se skutečností. Ted Sarandos ze společnosti Netflix oficiálně potvrdil,...",idnes.cz,kultura
https://kultura.zpravy.idnes.cz/jelen-vanocni-koncert-sono-centrum-brno-glosa-fos-/hudba.aspx?c=A171205_124047_hudba_vha,GLOSA: Jelen dokáže i Tichou noc odehrát dojemně a přitom bez kýče,Hned dva koncerty ve vřelém prostředí brněnského Sono Centra si dopřál Jelen na svém aktuálním...,idnes.cz,kultura
https://kultura.zpravy.idnes.cz/burt-young-rozhovor-rocky-d0a-/filmvideo.aspx?c=A171204_104027_filmvideo_ts,"Porazit Rockyho? To bych Stallonemu nemohl udělat, říkal Burt Young","Jako Paulie šestkrát na plátně provázel Rockyho čili Sylvestera Stallonea, za první film dostal...",idnes.cz,kultura
https://kultura.zpravy.idnes.cz/support-lesbiens-videoklip-movin-on-dva-/hudba.aspx?c=A171205_103114_hudba_vha,"VIDEO: Support Lesbiens chystají desku, tady je první ukázka",Zatímco nový singl Support Lesbiens Movin’ On bodoval v rádiových hitparádách a usadil se mezi...,idnes.cz,kultura
https://kultura.zpravy.idnes.cz/divadlo-aqualung-zabte-osklive-recenze-d9r-/divadlo.aspx?c=A171204_153551_divadlo_ts,RECENZE: Zabte ošklivé! Komiksový rek chce zastavit pokusy šíleného vědce,"Estetiku steampunku, tedy retrovizi budoucnosti plnou podivných parních strojů a trubic, přijalo za...",idnes.cz,kultura
https://brno.idnes.cz/film-o-osudu-vily-tugendhat-natoci-v-brne-fp4-/brno-zpravy.aspx?c=A171202_368236_brno-zpravy_vh,"V Brně zfilmují Skleněný pokoj o vile Tugendhat, s herečkou z Hry o trůny",Bestseller Simona Mawera Skleněný pokoj inspirovaný osudem vily Tugendhat přenesou filmaři na...,idnes.cz,kultura
https://kultura.zpravy.idnes.cz/kalendar-pro-pametniky-ales-cibulka-d6y-/filmvideo.aspx?c=A171203_154142_filmvideo_vha,"OBRAZEM: Cibulkův filmový kalendář se odvázal, slibuje i detektivku","Jubilejní, desátý pamětnický kalendář Aleše Cibulky přínáší i fotografii z Extase, jež vzbudila v...",idnes.cz,kultura
https://kultura.zpravy.idnes.cz/trailer-cernobily-po-strnisti-bos-d5g-/filmvideo.aspx?c=A171204_154436_filmvideo_spm,VIDEO: Takto vypadá Svěrákův film Po strništi bos v černobílé verzi,Jan Svěrák chtěl původně uvést do kin zároveň barevnou i černobílou podobu filmu Po strništi bos....,idnes.cz,kultura
https://kultura.zpravy.idnes.cz/kina-divaci-paddington-2-kvarteto-d45-/filmvideo.aspx?c=A171204_133442_filmvideo_spm,"Medvídek překonal Krobota, na film Paddington 2 přišlo 22 tisíc diváků",Domácí novinka Kvarteto se musela sklonit před britským maskotem. Obě premiéry měly o víkendu k...,idnes.cz,kultura
https://kultura.zpravy.idnes.cz/muj-zivot-cuketky-recenze-claude-barras-f0t-/filmvideo.aspx?c=A171204_095314_filmvideo_ts,RECENZE: Proč získal animovaný Můj život Cuketky jen evropského Oscara,"Je něžný a hravý, ale také posmutnělý. Většině animovaných filmů se vymyká, protože není určen...",idnes.cz,kultura
https://kultura.zpravy.idnes.cz/zrni-kdyz-se-ztracis-videoklip-akusticke-turne-f52-/hudba.aspx?c=A171204_100836_hudba_vha,VIDEO: Zrní proměnili výpadek elektřiny v přednost. Zahrají akusticky,Kapela Zrní přichází před Vánocemi s klipem k akustické verzi písničky Když se ztratíš. Intimní...,idnes.cz,kultura
https://kultura.zpravy.idnes.cz/tipy-na-darky-desky-alba-kolekce-vinyl-festival-koncert-pis-/hudba.aspx?c=A171201_151936_hudba_vha,"TIPY NA DÁRKY: Na vánoční notu s Gwen Stefani, do historie se Stouny","Cédéčka, vinyly nebo i vstupenky na koncerty a festivaly, tak lze zhmotnit pod stromečkem hudební...",idnes.cz,kultura
https://kultura.zpravy.idnes.cz/gipsy-cz-klip-patrik-banga-video-novy-dwf-/hudba.aspx?c=A171203_103306_hudba_kiz,VIDEO: Gipsy.cz mají nový singl. Banga zpívá o vlastní minulosti bez domova,"Nový videoklip, si pod režisérskou taktovku vzal opět Radek Banga. Uvidíte nejen temperament...",idnes.cz,kultura
https://kultura.zpravy.idnes.cz/televizionar-avatar-0lr-/filmvideo.aspx?c=A171130_154937_filmvideo_spm,TELEVIZIONÁŘ: S kým to doklepat do Vánoc? Klidně s líným Avatarem,Začátkem prosince platí pro všechny televize stejné pravidlo: hlavně už nic velkého nezačínat....,idnes.cz,kultura
https://kultura.zpravy.idnes.cz/tipy-na-darky-vanoce-knihy-literatura-d8w-/literatura.aspx?c=A171201_101829_literatura_kiz,TIPY NA DÁRKY: Proč nadělit komiksové naháče či Giganta Warhola,"Každý si z dětství pamatuje, že tvrdý dárek je dobrý dárek. Knihy do této kategorie patří. Jaké...",idnes.cz,kultura
https://kultura.zpravy.idnes.cz/trailer-sherlock-koumes-0wh-/filmvideo.aspx?c=A171130_115422_filmvideo_spm,"VIDEO: Přichází Sherlock Koumes, detektiv s hlasem Johnnyho Deppa",Pod názvem Sherlock Koumes vstoupí 29. března 2018 do našich kin animovaná komedie navazující na...,idnes.cz,kultura
https://kultura.zpravy.idnes.cz/nabarvene-ptace-obrazem-ukazky-film-vaclav-marhoul-harvey-keitel-py1-/filmvideo.aspx?c=A171201_104727_filmvideo_kiz,OBRAZEM: Marhoul je za polovinou. Dotočil s Harvey Keitelem,"Václav Marhoul má za sebou další, už čtvrtou fázi natáčení filmu Nabarvené ptáče podle...",idnes.cz,kultura
https://kultura.zpravy.idnes.cz/vanoce-darky-mluvene-slovo-spalovac-mrtvol-tomas-hanak-divadlo-sklep-12b-/divadlo.aspx?c=A171130_172919_divadlo_spm,TIPY NA DÁRKY: Na poslech je k mání Divadlo Sklep i Pohádky k neuvěření,"Ani krab ti nie je honosný, to je sen. Tiež kúpil jsem ti kostýmek, aký v Blave nemá niek, odoslala...",idnes.cz,kultura
https://kultura.zpravy.idnes.cz/trailer-mari-magdalena-0b1-/filmvideo.aspx?c=A171130_113114_filmvideo_spm,"VIDEO: Hříšnou Máří Magdalénou je Rooney Mara, Ježíše ztvární Phoenix","Od 22. března 2018 se v našich kinech objeví Máří Magdaléna, autentický portrét jedné z...",idnes.cz,kultura
https://kultura.zpravy.idnes.cz/vanoce-darky-dvd-mimoni-divka-na-kosteti-dunkerk-fue-/filmvideo.aspx?c=A171130_163526_filmvideo_spm,"TIPY NA DÁRKY: Mimoni na DVD zaručí radost, Dívka na koštěti nostalgii","Na letošního rekordmana vánočního videotrhu lze vsadit takřka s jistotou. Animovanou komedii Já,...",idnes.cz,kultura
https://kultura.zpravy.idnes.cz/chinaski-rozpad-vyhazov-08z-/hudba.aspx?c=A171130_112807_hudba_kiz,"Vyhazov z Chinaski byl šok, ztratil jsem kamarády i práci, zaznělo Za scénou",Frontman kapely Chinaski Michal Malátný a František Táborský se rozhodli pokračovat v koncertování...,idnes.cz,kultura
https://kultura.zpravy.idnes.cz/barbarella-recenze-0ny-/literatura.aspx?c=A171201_113134_literatura_kiz,RECENZE: Legendární komiks Barbarella nabízí lásku místo násilí,"Legendární komiksová Barbarella je konečně v Česku. Cesta jí sice trvala přes půlstoletí, ale...",idnes.cz,kultura
https://kultura.zpravy.idnes.cz/u2-songs-of-experience-rozhovor-bono-the-edge-f37-/hudba.aspx?c=A171201_141252_hudba_vha,"Ve tmě se můžete znovu najít, říká Bono k desce Songs of Experience",Album Songs of Experience měli U2 v podstatě hotové už před americkými prezidentskými volbami. Po...,idnes.cz,kultura
https://kultura.zpravy.idnes.cz/laco-deczi-rozhovor-0qd-/hudba.aspx?c=A171129_142044_hudba_vha,"Na mém hrobě porostou kytky jako divé svině, těší se Laco Déczi","„Václav Havel udělal největší kokotinu na světě, že nechal volně běhat komunisty. Dnes mají celý...",idnes.cz,kultura
https://kultura.zpravy.idnes.cz/konert-praha-pearl-jam-ringo-starr-live-nation-f48-/hudba.aspx?c=A171201_131146_hudba_vha,Další nálož koncertů. Do Prahy zamíří Pearl Jam i Ringo Starr,V roce 2018 se můžeme těšit na další porci světové muziky. Agentura Live Nation ohlásila návrat...,idnes.cz,kultura
https://kultura.zpravy.idnes.cz/vojtech-kotek-th-is-this-klip-dance-dte-/hudba.aspx?c=A171201_001543_hudba_vha,VIDEO: Děláme to postaru! Kotek s kapelou si do klipu pozvali Schmitzera,"Herec Vojtěch Kotek se spolužáky založil kapelu TH!S, která v pátek vydává první EP We Are TH!S a...",idnes.cz,kultura
https://kultura.zpravy.idnes.cz/recenze-paddington-2-hugh-grant-dz8-/filmvideo.aspx?c=A171130_367570_filmvideo_spm,RECENZE: Medvídek britštější než Bond baví podruhé dokonce ještě víc,"Konečně se našel vzácný úkaz, kdy je druhý díl ještě lepší než první, zdánlivě nepřekonatelný. Z...",idnes.cz,kultura
https://kultura.zpravy.idnes.cz/jan-burian-jihotaje-rozhovor-dj1-/hudba.aspx?c=A171130_113123_hudba_vha,"Před publikem seniorů si připadám jako Mick Jagger, říká Jan Burian","Písničkář Jan Burian vydává desku Jihotaje, na níž spolupracoval s uskupením Bizarre Band žánrově...",idnes.cz,kultura
https://kultura.zpravy.idnes.cz/divadlo-semafor-jiri-suchy-d0b-/divadlo.aspx?c=A171130_091644_divadlo_kiz,Jiřímu Suchému píše Jindřich VIII. Semafor znovu zahraje Šest žen,"Pražské Divadlo Semafor přichystalo novou verzi své klasiky Šest žen. Jiří Suchý upozorňuje, že...",idnes.cz,kultura
https://kultura.zpravy.idnes.cz/dominik-landsman-laputak-a-kapitan-adorabl-fji-/literatura.aspx?c=A171130_085712_literatura_kiz,RECENZE: Autor Deníčku moderního fotra dává dětem pratchettovský ráj,Když úspěšný bloger a autor deníčků moderního fotra a moderního páru Dominik Landsman napíše...,idnes.cz,kultura
https://kultura.zpravy.idnes.cz/do-kina-s-krobotem-0mv-/filmvideo.aspx?c=A171127_124705_filmvideo_spm,"DO KINA: V Kvartetu kraluje Bára Poláková, v 7 životech Noomi Rapace","Hned osm premiérových děl vstupuje do kin a řadě z nich vládnou známé herečky, od Krobotovy domácí...",idnes.cz,kultura
https://kultura.zpravy.idnes.cz/colours-of-ostrava-2018-george-ezra-slaves-fd9-/hudba.aspx?c=A171129_155108_hudba_vha,Na Colours zamíří nezaměnitelný zpěvák George Ezra i punkoví Slaves,"George Ezra, zpěvák s nezaměnitelným hlasem, který s písněmi Budapest, Listen to the Man, Barcelona...",idnes.cz,kultura
https://ekonomika.idnes.cz/nepal-evropska-komise-letectvi-dm9-/eko-zahranicni.aspx?c=A171205_170624_eko-zahranicni_mato,"Nepálská letadla nadále nesmí do Evropy. Zlepšily jsme se, tvrdí aerolinky",Nepálské letecké společnosti stále nemají přístup do evropského vzdušného prostoru. Navzdory...,idnes.cz,ekonomika
https://ekonomika.idnes.cz/evropska-unie-komise-dane-danove-raje-seznam-google-facebook-danove-uniky-1lv-/eko-zahranicni.aspx?c=A171205_154146_eko-zahranicni_rts,EU sepsala seznam daňových pirátů. Sedmnáctka zemí může přijít o dotace,Ministři financí členských zemí Evropské unie v úterý sestavili takzvanou černou listinu daňových...,idnes.cz,ekonomika
https://ekonomika.idnes.cz/modernizace-dalnice-d1-deti-zeme-d35-/eko-doprava.aspx?c=A171205_150705_eko-doprava_div,Rok navíc? Stát se hádá s hnutím Děti země o opravě dálnice D1,Hnutí Děti země do dnešního dne zpochybnilo osm stavebních povolení na opravy dálnice D1 ze...,idnes.cz,ekonomika
https://ekonomika.idnes.cz/danova-reforma-usa-reagan-trump-senat-kongres-fon-/eko-zahranicni.aspx?c=A171204_160949_eko-zahranicni_rts,Trump je krok od největší daňové reformy od dob Ronalda Reagana,"Americký kongres v těchto dnech ladí poslední detaily zásadní daňové reformy, která snižuje daně...",idnes.cz,ekonomika
https://ekonomika.idnes.cz/chipsy-cesko-nemecko-test-0y9-/ekonomika.aspx?c=A171205_112010_ekonomika_mato,"České chipsy jsou škodlivější než německé, ale chutnají lépe",Časopis dTest porovnal kvalitu českých chipsů s německými a skandinávskými stejné značky. Tuzemské...,idnes.cz,ekonomika
https://ekonomika.idnes.cz/benetton-moda-znacka-upadek-navrat-dtf-/ekoakcie.aspx?c=A171204_210446_ekoakcie_ksu,"Starý pan Benetton se v 82 letech vrací, aby zachránil upadající impérium","Luciano Benetton, zakladatel italského módního řetězce, si odpočinku moc neužil. Do roku 2008 se...",idnes.cz,ekonomika
https://ekonomika.idnes.cz/csob-pojistovna-ceska-posta-prepazky-dwh-/ekonomika.aspx?c=A171129_367330_ekonomika_rts,Invaze na poštovní přepážky: klienty tam začne oslovovat ČSOB Pojišťovna,Od ledna vystřídá Českou pojišťovnu na poštách ČSOB Pojišťovna. Bankovní služby i pojištění tak...,idnes.cz,ekonomika
https://ekonomika.idnes.cz/milenialove-bydleni-reality-hypoteky-dxi-/ekonomika.aspx?c=A171204_204244_ekonomika_ksu,Mileniálové chtějí žít v módních čtvrtích ve velkých městech,"Vyšší sebevědomí, vyšší nároky a touha po nezávislosti. Přesně tak by se dali popsat mileniálové...",idnes.cz,ekonomika
https://ekonomika.idnes.cz/euroskupina-eurogroup-euro-mario-centeno-fi4-/eko_euro.aspx?c=A171204_172601_eko_euro_rts,Novým pánem eura je Mário Centeno. Povede euroskupinu příští dva roky,Portugalský ministr financí Mário Centeno vystřídá od 13. ledna v čele euroskupiny jejího nynějšího...,idnes.cz,ekonomika
https://ekonomika.idnes.cz/komercni-banka-internetove-bankovnictvi-problemy-nefunguje-prh-/ekonomika.aspx?c=A171204_164123_ekonomika_rts,Internetové a mobilní bankovnictví Komerční banky nefunguje,Systémy Komerční banky zůstaly v pondělí odpoledne zcela odstavené a banka pracuje na opravení...,idnes.cz,ekonomika
https://ekonomika.idnes.cz/drazba-luxus-diamanty-kameny-luxus-sotheby-s-christie-s-p2y-/eko-zahranicni.aspx?c=A171204_150358_eko-zahranicni_rts,OBRAZEM: Miliony dolarů za sekundu. Kameny pro nejbohatší trhají rekordy,Aukční síni Sotheby’s se letos podařilo prodat největší drahokam světa ­– Růžovou hvězdu – za...,idnes.cz,ekonomika
https://ekonomika.idnes.cz/firmy-investuji-do-odpocinku-zamestnancu-fi1-/eko-zahranicni.aspx?c=A171204_090957_eko-zahranicni_nio,Šlofík v práci? Projev slabosti se mění v moderní přístup k zaměstnancům,"Jedním ze společných znaků úspěšných lidí bývá jejich schopnost málo spát, a přesto zůstat...",idnes.cz,ekonomika
https://ekonomika.idnes.cz/zdravotnicky-byznys-verejne-zakazky-promedica-ambulance-pmh-/ekonomika.aspx?c=A171204_368337_ekonomika_rts,"Špitály srážejí ceny, dodavatelé vybavení pro lékaře cítí zisk v ambulancích",Dodavatelé zdravotnického materiálu už dlouho řeší podnikatelské dilema. Mohou dodávat zdravotnický...,idnes.cz,ekonomika
https://ekonomika.idnes.cz/vetrani-rekuperace-byty-vystavba-developeri-zdrazeni-p1j-/ekonomika.aspx?c=A171204_368334_ekonomika_fih,Povinné větrání zdraží byty. Směrnice EU má však lidem ušetřit za vytápění,Nové byty v příštím roce neprodraží jen velká poptávka. Další náklady přinese nucené větrání a...,idnes.cz,ekonomika
https://ekonomika.idnes.cz/skoda-auto-lakovna-investice-mlada-boleslav-fzg-/ekonomika.aspx?c=A171204_122143_ekonomika_pas,"Škoda Auto investuje 5,5 miliardy do nové lakovny, vzniknou nová místa","Škoda Auto investuje 214,5 milionu eur (zhruba 5,5 miliardy korun) do nové lakovny v Mladé...",idnes.cz,ekonomika
https://ekonomika.idnes.cz/mzdy-prumerne-csu-statisticy-urad-platy-ff5-/ekonomika.aspx?c=A171204_093828_ekonomika_fih,Češi berou 29 tisíc. Bonusy ještě letos vyženou mzdy nad 30 tisíc,Ve strmém růstu pokračovaly mzdy i ve třetím čtvrtletí. Češi mají v průměru na své výplatnici více...,idnes.cz,ekonomika
https://ekonomika.idnes.cz/kebab-evropska-unie-brusel-eu-zakaz-d6f-/eko_euro.aspx?c=A171203_172551_eko_euro_rts,"Kebab čeká nejistý osud, do jeho složení začali mluvit europoslanci",Evropský parlament si posvítí na fosfáty používané při přípravě a skladování zmraženého masa....,idnes.cz,ekonomika
https://ekonomika.idnes.cz/venezuela-virtualni-mena-petro-d3l-/eko-zahranicni.aspx?c=A171204_065108_eko-zahranicni_lre,Zbídačené Venezuele má proti blokádě USA pomoct virtuální měna petro,"Venezuela zavede virtuální měnu, která zemi pomůže bojovat proti „finanční blokádě“ ze strany...",idnes.cz,ekonomika
https://ekonomika.idnes.cz/parky-sklady-pracovni-mista-logistika-robotizace-podnikani-uzemni-plan-1o2-/ekonomika.aspx?c=A171202_368084_ekonomika_rts,"Školka, zubař nebo veterina. Z obřích skladů se stávají města ve městě","Byty, školky, sportoviště, restaurace, veterina či lékařské ordinace. Řeč není o klasické městské...",idnes.cz,ekonomika
https://ekonomika.idnes.cz/aljaska-point-hope-internet-tani-ledovcu-spojeni-tokio-londyn-pbq-/eko-zahranicni.aspx?c=A171203_113858_eko-zahranicni_ert,"Tání ledovců otevírá nové možnosti internetu, dostanou ho i lovci velryb",Kvalitní připojení nemusí být pouze výsadou velkých a moderních měst. Globální oteplování a tání...,idnes.cz,ekonomika
https://ekonomika.idnes.cz/hodinky-audemars-piguet-0wr-/ekoakcie.aspx?c=A171201_205317_ekoakcie_pas,"Snobové jsou ostuda. Klienty si vybíráme, říká švýcarský hodinář","Olivier Audemars, spolumajitel luxusní švýcarské hodinářské značky Audemars Piguet, přijel do Česka...",idnes.cz,ekonomika
https://ekonomika.idnes.cz/jaderena-eletkrarna-adrej-babis-jizni-korea-vystavba-pce-/ekonomika.aspx?c=A171203_131048_ekonomika_ert,Babiš jednal s Jihokorejci o dostavbě jaderných bloků Temelína a Dukovan,O možnostech výstavby jaderných bloků v Česku a spolupráci v oblastech hospodářství a průmyslu...,idnes.cz,ekonomika
https://liberec.idnes.cz/nemecke-firmy-plat-cesti-zamestnanci-hranice-fn0-/liberec-zpravy.aspx?c=A171201_152713_liberec-zpravy_tm,Německé firmy lákají zaměstnance za hranice. Slibují plat až 40 tisíc,"Příhraničí bojuje o zaměstnance. Ať v Česku, Polsku nebo Německu, firmy se přetahují o lidi....",idnes.cz,ekonomika
https://ekonomika.idnes.cz/umrti-predsedkyne-ceskeho-statistickeho-uradu-iva-ritschelova-psv-/ekonomika.aspx?c=A171203_124402_ekonomika_ert,"Zemřela předsedkyně Českého statistického úřadu Iva Ritschelová, bylo jí 53 let",V sobotu večer zemřela po těžké nemoci ve věku 53 let předsedkyně Českého statistického úřadu Iva...,idnes.cz,ekonomika
https://plzen.idnes.cz/unicorm-elektricka-energie-analytik-kabel-podmorsky-more-projekt-nemo-britned-193-/plzen-zpravy.aspx?c=A171129_083859_plzen-zpravy_vb,Podmořský přenos elektrické energie mají pod palcem odborníci z Plzně,V Plzni vyvinuli systém pro řízení podmořského toku elektrické energie mezi Evropou a Anglií. Když...,idnes.cz,ekonomika
https://ekonomika.idnes.cz/nejstastnejsi-zeme-hdp-osn-zprava-stesti-f1v-/eko-zahranicni.aspx?c=A171129_134507_eko-zahranicni_div,"Recept na štěstí? Vysoké daně. Čím vyšší, tím lepší, ukázala zpráva OSN",Mnohé země po celém světě usilují o daňové škrty. To ale není ten správný recept na štěstí. Státy s...,idnes.cz,ekonomika
https://ekonomika.idnes.cz/jaroslav-sveceny-soudni-znalec-housle-houslovy-virtuos-mesias-pwr-/ekonomika.aspx?c=A171127_366807_ekonomika_hm1,"Na padělky nástrojů narážím často, říká znalec houslí a virtuos Svěcený","Nejvzácnější housle mohou stát statisíce či miliony korun. V případě Stradivariho i miliony eur,...",idnes.cz,ekonomika
https://ekonomika.idnes.cz/hongkong-kancelar-najem-cina-d1y-/eko-zahranicni.aspx?c=A171129_165740_eko-zahranicni_tanc,Brexit odvál ceny firemních nájmů. Žezlo nejdražší kanceláře drží Hongkong,"Nejdražší kanceláře jsou v Londýně. Toto letité klišé padlo, nově jsou totiž nejdražší korporátní...",idnes.cz,ekonomika
https://ekonomika.idnes.cz/cesko-seniori-duchodci-nezamestnanost-trh-prace-fuy-/ekonomika.aspx?c=A171201_367792_ekonomika_rts,"Nejsou lidi. Firmy lanaří důchodce, ale těm se moc nechce",České firmy mají více než 200 tisíc neobsazených míst. Kvůli nedostatku lidí musí odmítat zakázky....,idnes.cz,ekonomika
https://ekonomika.idnes.cz/hladolety-poplatky-aerolinky-prijmy-kufry-zavazadla-pdu-/eko-doprava.aspx?c=A171201_165926_eko-doprava_fih,Halíře dělají talíře. Poplatky za kufry přihrály aerolinkám 2 biliony,"Jídlo, poplatky za zavazadla či místenku v letadle. Aerolinky se čím dál víc spoléhají na příjmy z...",idnes.cz,ekonomika
https://ekonomika.idnes.cz/fond-stesti-dluhy-jizni-korea-d2v-/eko-zahranicni.aspx?c=A171130_172115_eko-zahranicni_hm1,"Velkorysý stát. Fond štěstí odpustí dluhy 1,6 milionu Jihokorejců",Jižní Korea plánuje odepsat dluhy statisícům svých obyvatel. Opatření má pomoct s finančním...,idnes.cz,ekonomika
https://ekonomika.idnes.cz/kr-real-mlyn-na-bio-ovesne-vlocky-biomlyn-biopotraviny-pgn-/ekoakcie.aspx?c=A171201_095822_ekoakcie_nio,Díky biomlýnu budou české ovesné vločky snídat v USA či Německu,"Bio je trend. Jenže aby nějaký výrobce mohl své produkty označit jako bio, musí splnit přísná...",idnes.cz,ekonomika
https://ekonomika.idnes.cz/rozpocet-hospodareni-statu-schodek-dba-/ekonomika.aspx?c=A171201_140720_ekonomika_hm1,"Rozpočet se přehoupl do minusu, v listopadu byl ve schodku 11,6 miliardy","Hospodaření státu se v listopadu dostalo do schodku 11,6 miliardy korun z říjnového přebytku 26,5...",idnes.cz,ekonomika
