link,link_text,txt,site,area
https://www.lidovky.cz/5-nej-bramborovych-salatu-podle-nasich-nejlepsich-sefkucharu-prw-/dobra-chut.aspx?c=A101206_143000_dobra-chut_glu,5 nejlepších bramborových salátů podle našich nejlepších šéfkuchařů,Štědrovečerní večeře se neobejde bez dobrého bramborového salátu. Každá rodina má svůj osvědčený recept. My vám přinášíme pět variací salátů podle...,lidovky.cz,chut
https://www.lidovky.cz/prazdroj-drazi-unikatni-pivni-lahve-k-stemu-vyroci-republiky-vytezek-pujde-pro-centrum-paraple-ief-/pivo.aspx?c=A181212_153401_ln-pivo_pkk,"Prazdroj draží unikátní pivní lahve k stému výročí republiky, výtěžek půjde pro Centrum Paraple","Plzeňský Prazdroj ve čtvrtek pořádá tradiční ojedinělou charitativní aukci designových lahví piva, které při příležitosti letošního stého výročí...",lidovky.cz,chut
https://www.lidovky.cz/nepecene-cukrovi-vyzkousejte-letos-ricottove-kulicky-s-kokosem-phe-/dobra-chut.aspx?c=A161212_134128_dobra-chut_ape,Nepečené cukroví. Vyzkoušejte letos ricottové kuličky s kokosem,"Obalené v kokosu, mletých oříšcích nebo kakau. Kuličky z riccoty mají tu výhodu, že máte hned několik možností, jak je připravit. Nechte se...",lidovky.cz,chut
https://www.lidovky.cz/jak-na-rozmarynovy-quiche-s-brynzou-parmezanem-a-spanelskou-sunkou-1g1-/dobra-chut.aspx?c=A181128_161002_dobra-chut_ape,"Jak na rozmarýnový quiche s brynzou, parmezánem a španělskou šunkou","Dopřejte své kuchyni nádech nových chutí. Přinášíme recept na rozmarýnový quiche s brynzou, parmezánem a španělskou šunkou Jamón Serrano.",lidovky.cz,chut
https://www.lidovky.cz/pavlik-ne-motivace-jako-sproste-slovo-dxj-/dobra-chut.aspx?c=A181129_111000_dobra-chut_ape,PAVLÍK: (Ne)motivace jako sprosté slovo,"Když se člověk kolikrát běžně prochází, třeba po parku a sleduje čas od času děti a jejích rodiče, v mnoha případech je to hodně silný impuls k...",lidovky.cz,chut
https://www.lidovky.cz/drazdanska-stola-a-slovinska-potica-co-pecou-na-vanoce-v-cizine-p7r-/dobra-chut.aspx?c=A121213_184052_dobra-chut_vsl,Drážďanská štola a slovinská potica. Co pečou na Vánoce v cizině?,"Co je pro Čechy Vánočka, je pro Francouze Buche de Noël a pro Němce Drážďanská štola. Prakticky každá země Evropy má svoji sladkou vánoční...",lidovky.cz,chut
https://www.lidovky.cz/videorecept-cokoladova-pena-s-kandovanym-pomerancem-podle-sefkuchare-1ku-/dobra-chut.aspx?c=A181126_150657_dobra-chut_ape,VIDEORECEPT: Čokoládová pěna s kandovaným pomerančem podle šéfkuchaře,"Máte rádi českou kuchyni, ale někdy se vám zdá těžká? Chtěli byste si doma připravit vynikající, ale lehký dezert? Díky receptu šéfkuchaře Igora...",lidovky.cz,chut
https://www.lidovky.cz/jednoduchy-recept-z-cukety-pripravte-si-doma-zoodles-p0s-/dobra-chut.aspx?c=A181123_150329_dobra-chut_ape,Jednoduchý recept z cukety? Připravte si doma zoodles,"Pakliže máte ještě cuketu a už nevíte, co s ní, přinášíme jednoduchý recept na zdravé cuketové nudle, kterým se také říká zoodles.",lidovky.cz,chut
https://www.lidovky.cz/home-by-unic-kuchyne-ktera-ma-potencial-a-styl-krupicovou-kasi-si-ale-nedavejte-1yv-/dobra-chut.aspx?c=A181122_153342_dobra-chut_ape,"Home by Unic: Kuchyně, která má potenciál a styl. Krupicovou kaši si ale nedávejte","Čtyřhvězdičkový Hotel UNIC Praha, navržený katalánskou architektkou Meritxell Cuartero, byl otevřen v červnu 2013. V přízemí se nachází restaurace,...",lidovky.cz,chut
https://www.lidovky.cz/krok-za-krokem-jak-na-francouzske-sladke-makronky-f7t-/dobra-chut.aspx?c=A181121_161105_dobra-chut_ape,Krok za krokem: jak na francouzské sladké makronky?,"Vydařená makronka je zaoblená, bez prasklin a nechybí jí „nožička“ – nafouknutá spodní část, která povyskočí během pečení. Server Lidovky ve...",lidovky.cz,chut
//www.lidovky.cz/novinar.aspx?idnov=4152,Zuzana Formánková,"Restaurace Field, ve které je Radek Kašpárek šéfkuchařem, si drží michelinskou hvězdu už tři roky. Inspiruje se Skandinávií a důraz klade na...",lidovky.cz,chut
https://www.lidovky.cz/polevka-z-hlivy-ustricne-podle-receptu-karoliny-kamberske-pat-/dobra-chut.aspx?c=A181121_153900_dobra-chut_ape,Polévka z hlívy ústřičné podle receptu Karolíny Kamberské,"Na dršťkové polévce mi od dětství vadí snad všechno – od názvu až po ty podivné bílé věci, co v ní plavou. Paradoxní přitom je, že mi opravdu chutná!...",lidovky.cz,chut
https://www.lidovky.cz/tak-trochu-asijske-cukrovi-pripravte-si-ananasove-dortiky-po0-/dobra-chut.aspx?c=A181127_215740_dobra-chut_ape,Tak trochu asijské cukroví. Připravte si ananasové dortíky,"Téměř celý život slavím Vánoce v britské podobě, obvykle s pečeným krocanem se všemi detaily, jako je nádivka, pečené brambory a spousta zeleniny....",lidovky.cz,chut
https://www.lidovky.cz/nova-krymska-pro-milovniky-jidla-i-piti-myslikova-ulice-se-stava-mistem-pro-gastronauty-i-experimen-i5q-/dobra-chut.aspx?c=A181121_114054_dobra-chut_ape,Nová Krymská pro milovníky jídla i pití? Myslíkova ulice se stává centrem gastronautů,"Možná je to ulice, kterou příliš často nechodíte, pokud máte ale rádi dobré jídlo a pití, měli byste na ni zaměřit pozornost. Kavárny, restaurace,...",lidovky.cz,chut
https://www.lidovky.cz/jak-na-darek-ve-sklenicce-08m-/dobra-chut.aspx?c=A181126_143716_dobra-chut_ape,Jak na dárek ve skleničce. Pálivá omáčka se pod stromeček hodí,"Rozsviťte přátelům Vánoce domácím jablečným čatní s rozinkami, ostrou chili omáčkou, balíčkem vlastních preclíků či sucharů a nebo třeba léčivou...",lidovky.cz,chut
https://www.lidovky.cz/novinari/martin-zverina.N669,Martin Zvěřina,Národní úřad pro kybernetickou bezpečnost varoval před softwarem i hardwarem firem Huawei a ZTE. Vláda celou věc vzala v pondělí na vědomí a nyní by...,lidovky.cz,nazory
https://www.lidovky.cz/novinari/jan-klesla.N3535,Jan Klesla,"Otcové zakladatelé evropské integrace měli jednu věc společnou – byli to nejen politici, ale rozuměli i byznysu.",lidovky.cz,nazory
https://www.lidovky.cz/novinari/jan-klesla.N3535,Jan Klesla,"Technologický gigant Huawei je podivuhodná firma. V jihočínském Šen-čenu si postavila obří sídlo, které opulentně vítá návštěvy v prázdných budovách....",lidovky.cz,nazory
https://www.lidovky.cz/novinari/petr-kambersky.N1768,Petr Kamberský,"Česká společnost má velký strach z terorismu i islámu. 81 procentům lidí by vadilo, kdyby jejich dítě mělo vztah s muslimem. Pochopitelné obavy...",lidovky.cz,nazory
https://www.lidovky.cz/novinari/zbynek-petracek.N817,Zbyněk Petráček,"Před lety kolovala po webu informace, že v jistém městě Německa přivedli do školy krávu. Aby žáci viděli, jak vypadá. Že není fialová, jak by se jim...",lidovky.cz,nazory
https://www.lidovky.cz/novinar.aspx?idnov=3535,Jan Klesla,"Každý ví, jak vypadá tisícikoruna, někdo viděl i milion, představit si miliardu je už nemožné a bilion je tak abstraktní číslo, že se obvykle...",lidovky.cz,nazory
https://www.lidovky.cz/novinari/petr-kambersky.N1768,Petr Kamberský,"Relativně klidná reakce Andreje Babiše na vzkaz eurokomisaře Günthera Oettingera ukazuje, že bere svůj problém vážně a bude jej řešit (tedy za...",lidovky.cz,nazory
https://www.lidovky.cz/novinari/petr-zidek.N712,Petr Zídek,Rektor Univerzity Karlovy Tomáš Zima se minulý týden odmítl vyjádřit k obvinění svého zástupce Martina Kováře z plagiátorství těmito slovy:...,lidovky.cz,nazory
https://www.lidovky.cz/novinari/zbynek-petracek.N817,Zbyněk Petráček,"Těžko najít běžného čtenáře novin, který by miloval analýzy vývoje obyvatelstva. Český statistický úřad je zveřejňuje čtyřikrát ročně a nepřinášejí...",lidovky.cz,nazory
https://www.lidovky.cz/nazory/vrato-starostove-zima-sport-zimni-sporty.A181212_194435_ln_nazory_jhe,"Hledáme aktivity, které nezávisí na sněhu a mrazu","Hned úvodem musím konstatovat, že Vráto se svojí nadmořskou výškou přibližně 400 metrů nad mořem má v posledních letech nadílku sněhu a ledu hodně...",lidovky.cz,nazory
https://www.lidovky.cz/nazory/starostove-zima-hlucin-snih-sport.A181212_193911_ln_nazory_jhe,Novoroční předsevzetí „více pohybu“ budou mít Hlučínští kde plnit,"V Hlučíně si v zimě nezalyžujete, jedině tak v létě na vodních lyžích na Hlučínském jezeře. Pro zimní sjezdové lyžování tu žádný kopec s vlekem...",lidovky.cz,nazory
https://www.lidovky.cz/nazory/starostove-vysoka-nad-labem-zima-sport.A181212_193236_ln_nazory_jhe,Máme nejníže položenou sjezdovku v ČR,"Trvalejší sněhová pokrývka u nás naposledy ležela v roce 2010, tehdy byly okolní lesy rájem běžkařů a děti s chutí sjížděly kdejaký kopeček. V...",lidovky.cz,nazory
https://www.lidovky.cz/nazory/starostove-nachod-zima-zimni-sporty.A181212_191642_ln_nazory_jhe,V Náchodě se sportuje i v zimě,"Naše město nabízí bohaté sportovní vyžití, a to během celého roku. K zimním sportovním aktivitám slouží stadion Na Strži s ledovou plochou od...",lidovky.cz,nazory
https://www.lidovky.cz/nazory/starostove-kolar-praha-6-zima-zimni-sporty.A181212_190350_ln_nazory_jhe,Běžkařský ovál loni zlákal třicet tisíc lidí,"I když zatím můžeme zimu leda tušit z kalendáře, Praha 6 je na ni připravena.",lidovky.cz,nazory
https://www.lidovky.cz/nazory/starostove-zima-zimni-sporty-radovanky-borsov.A181212_184520_ln_nazory_jhe,Sportovat lze i 400 m nad mořem,"Název tohoto článku je tak trochu provokace, sníh ani led do obce nedovážíme, ono při dnešních zimách by nebylo ani odkud, i když vzdušnou čarou jsme...",lidovky.cz,nazory
https://www.lidovky.cz/novinar.aspx?idnov=817,Zbyněk Petráček,"Jsou situace, kdy se státník nezavděčí. Ani když ustoupí tlaku řvoucí ulice (pak má cejch slabocha), ani když kraválistům neuhne a pevně trvá na svém...",lidovky.cz,nazory
https://www.lidovky.cz/novinari/zbynek-petracek.N817,Zbyněk Petráček,"Veřejnou zprávu vydává kontrarozvědka BIS každý rok, ale ta letošní společensky rezonuje víc než ty minulé. Důvod je jasný: prezident Zeman ji použil...",lidovky.cz,nazory
https://www.lidovky.cz/nazory/ketz-fakta-ne-famy-neberte-nam-autorska-prava.A181210_153755_ln_nazory_pev,"KETZ: Fakta, ne fámy. Neberte nám autorská práva","Před necelými třemi měsíci odhlasoval Evropský parlament velkou většinou navrhovanou směrnici, která dává tisku a tiskovým agenturám naději, že jim...",lidovky.cz,nazory
https://www.lidovky.cz/novinari/jan-klesla.N3535,Jan Klesla,"Lamentovat nad tím, že jsou Vánoce dnes hlavně svátky konzumu, už prakticky nemá smysl. Žijeme v konzumní době a mimochodem náš blahobyt je do určité...",lidovky.cz,nazory
https://www.lidovky.cz/novinari/zbynek-petracek.N817,Zbyněk Petráček,"Vážené čtenářky a vážení čtenáři, novinářky a novináři z Lidových novin (lépe Novin žen, mužů a ostatních genderů) pro vás něco připravili. Zprávu o...",lidovky.cz,nazory
https://www.lidovky.cz/novinar.aspx?idnov=817,Zbyněk Petráček,"Zasít nedůvěru ke zpravodajským službám své země není složité. Tedy za předpokladu, že jste buď defektorem, jenž pro ty služby pracoval a pak utekl s...",lidovky.cz,nazory
https://www.lidovky.cz/novinari/martin-zverina.N669,Martin Zvěřina,"Spojování politických stran se stalo hitem posledních dnů. Zvláště po zveřejnění průzkumů, které přisuzují hnutí ANO výrazný zisk popularity, a to i...",lidovky.cz,nazory
https://www.lidovky.cz/novinari/zbynek-petracek.N817,Zbyněk Petráček,"Tak jako často, i k poslední schůzce ministrů zahraničí NATO lze říci: Přinesla dvě zprávy, dobrou a špatnou. Kterou chcete první? Většinou tu...",lidovky.cz,nazory
https://www.lidovky.cz/novinari/zbynek-petracek.N817,Zbyněk Petráček,O „břemenu bílého muže“ se raději nemluví. Připomíná Kiplinga a západní kolonialismus. Navrhne-li někdo – jako zmocněnec německé vlády Günter Nooke –...,lidovky.cz,nazory
https://www.lidovky.cz/novinari/jan-klesla.N3535,Jan Klesla,"Snaha nejrůzněji regulovat obchody a obchodníky, hlavně co, kde a za kolik prodávají, není nic nového. První podobné zákony se objevily už ve...",lidovky.cz,nazory
https://www.lidovky.cz/novinar.aspx?idnov=817,Zbyněk Petráček,"Vyrazí-li Francouzi do ulic dělat kravál, nemusí to ještě signalizovat revoluci. Ve Francii je to tradice. Přesto jsou akce „žlutých vest“ na...",lidovky.cz,nazory
https://www.lidovky.cz/novinari/zbynek-petracek.N817,Zbyněk Petráček,"Když včera odešel do civilu generál Petr Pavel, tak trochu to působí, jako když v reprezentaci skončil Jaromír Jágr. Oba jsou špičkami ve svých...",lidovky.cz,nazory
https://www.lidovky.cz/novinari/martin-zverina.N669,Martin Zvěřina,"Máme strach z uprchlíků, kteří tu nejsou, zní obvyklá výtka na adresu naší neochoty k migraci z jihu. Jenže naléhavější výtka zní: nevšímáme si těch...",lidovky.cz,nazory
https://www.lidovky.cz/novinari/petr-kambersky.N1768,Petr Kamberský,Dění okolo Energetického regulačního úřadu (ERÚ) nám přináší hned několik poučení.,lidovky.cz,nazory
https://www.lidovky.cz/nazory/betlem-oziva-na-bozi-hod.A181128_194755_ln_nazory_ele,Betlém ožívá na Boží Hod,"Tradiční české Vánoce jsou svátky klidu, míru a spříznění. Hrotovické Vánoce jsou ještě o něčem víc. Příprava na ně - Advent - na Vás dýchne v našem...",lidovky.cz,nazory
https://www.lidovky.cz/nazory/hura-na-trhy-do-mistni-skoly.A181128_193935_ln_nazory_ele,Hurá na trhy do místní školy,"Město Opočno nepořádá klasické vánoční trhy, ale i přes to je zde živo! Pořádá vyhlášenou kulturní akci Mikuláš v Opočně. Snaží se tak potěšit...",lidovky.cz,nazory
https://www.lidovky.cz/nazory/decin-ma-hned-nekolik-vanocnich-stromu.A181128_191308_ln_nazory_ele,Děčín má hned několik vánočních stromů,"Děčín již dvanáct let pořádá vánoční akci na největším, Masarykově náměstí. Rozsvěcení vánočního stromu začíná o prvním adventním víkendu, tedy 1....",lidovky.cz,nazory
https://www.lidovky.cz/novinari/martin-zverina.N669,Martin Zvěřina,"Zásluhou veřejnoprávního rozhlasu si můžeme udělat představu o tom, jak obyvatelstvo hodnotí aféru rozpoutanou výletem novinářů za Andrejem Babišem...",lidovky.cz,nazory
https://www.lidovky.cz/novinari/jan-machacek.N3438,Jan Macháček,"V posledních měsících leckdo věští, že svět čeká nějaká další velká krize. Jenže příčiny minulé velké krize, která vypukla v roce 2008, nebyly...",lidovky.cz,nazory
https://www.lidovky.cz/novinari/jan-machacek.N3438,Jan Macháček,"Podle dnešního komentáře Gideona Rachmana musí vzít Peking v úvahu, že v USA došlo k silnému nadstranickému posunu v názoru na Čínu.",lidovky.cz,nazory
https://www.lidovky.cz/novinar.aspx?idnov=3438,Jan Macháček,"Na serveru Eurointelligence.com se pozastavují nad zprávou listu Sunday Times o tom, že v Downing Street číslo 10, tedy v sídle britské premiérky...",lidovky.cz,nazory
https://www.lidovky.cz/svet/osobnosti-roku-listu-financial-times-se-stal-george-soros-diky-hodnotam-ktere-reprezentuje.A181219_103518_lide_blv,"Osobností roku listu Financial Times se stal George Soros. Díky ‚hodnotám, které reprezentuje‘",Americký finančník maďarského původu George Soros je podle výběru britského listu Financial Times (FT) osobností letošního roku. Prestižní noviny jej...,lidovky.cz,lide
https://www.lidovky.cz/lide/asi-jatka-ne-myty-o-vietnamcich.A181217_124757_lide_ape,ASI.JATKA: Jak to mají s rýží? (Ne)Mýty o Vietnamcích,Nejvíc inspirace na články mi chodí o půlnoci a většinou také tejden před odevzdáním bakalářky.,lidovky.cz,lide
https://www.lidovky.cz/lide/brett-jak-se-do-ostravy-plizil-advent.A181211_113949_lide_ape,BRETT: Jak se do Ostravy plíží advent. Stres,Vždycky se těším na advent. Ticho. Mír. Nejlépe světový. Hektolitry punče. Přátelé. Radost. Brzké stmívání. Svíčky. Koledy. Klid. Klid. Klid. Bohužel...,lidovky.cz,lide
https://www.lidovky.cz/lide/zemrel-spolutvurce-vine-a-hq-trivia-colin-kroll-bylo-mu-pouhych-34-let.A181217_093059_lide_ele,"Zemřel spolutvůrce Vine a HQ Trivia Colin Kroll, bylo mu pouhých 34 let",Ve 34 letech zemřel spolutvůrce platformy Vine na sdílení krátkých videí a populární herní aplikace HQ Trivia Colin Kroll. Policie v neděli našla...,lidovky.cz,lide
https://www.lidovky.cz/lide/novou-miss-universe-se-stala-soutezici-z-filipin-letosniho-rocniku-se-poprve-zucastnily-i-transgenderove-modelky.A181217_073425_lide_ele/foto,OBRAZEM: První Miss Universe s transgenderovými modelkami. Královnou krásy se stala Filipínka,Titul Miss Universe roku 2018 získala 24letá Catriona Elisa Grayová z Filipín. Při vyvrcholení každoroční soutěže v pondělí v thajském Bangkoku...,lidovky.cz,lide
https://www.lidovky.cz/novinar.aspx?idnov=3899,Jaroslav Totušek,Finálový večer taneční soutěže StarDance znovu a naposledy přinesl oslnivé róby i gentlemanské obleky. Který z tanečních párů ozářil nejen tancem a...,lidovky.cz,lide
https://www.lidovky.cz/lide/miss-universe-se-poprve-ucastni-transgender-modelky-favoritkou-je-spanelka-ktera-se-narodila-jako-muz.A181216_083629_lide_ele,"Miss Universe se poprvé účastní transgender modelky. Favoritkou je Španělka, která se narodila jako muž",Více než devět desítek krásek bude v neděli večer v Thajsku soutěžit o titul Miss Universe 2018. Jednou z favoritek je podle některých médií i...,lidovky.cz,lide
https://www.lidovky.cz/lide/hlasatel-alexandr-hemala-propaguje-legendarni-strilecku-doom.A160514_105952_ln-video_ELE,VIDEO: Hlasatel Alexandr Hemala propaguje legendární střílečku DOOM,Bývalý televizní hlasatel Alexandr Hemala se objevuje v nové reklamě na počítačovou hru DOOM. Populární střílečka přichází s novou verzí. Hemala...,lidovky.cz,lide
https://www.lidovky.cz/lide/asi-jatka-a-oregano-mate.A181211_142238_lide_ape,ASI.JATKA: A oregáno máte?,"Pátek dopoledne. Polorozespalá a s hlavou v oblacích si jdu do jedné vinohradské večerky koupit banán, ale nepořídím. Krajané vlastně sakra neberou...",lidovky.cz,lide
https://www.lidovky.cz/lide/dockalova-chtela-jsem-mluvit-o-dabingu.A181210_111128_lide_ape,DOČKALOVÁ: Chtěla jsem mluvit o dabingu,"Čauko, zdravím z překvapivě teplé prosincové neděle. Ano, ještě stále máme ten luxus, že tím můžeme být lehce pomateně překvapováni, když si chceme...",lidovky.cz,lide
https://www.lidovky.cz/lide/viewegh-jak-se-mi-vratila-averze-vuci-literarni-kritikum.A181206_183832_ln_nazory_form,VIEWEGH: Jak se mi vrátila averze vůči literární kritikům,"Mou ublíženou averzi vůči literárním kritikům naštěstí už před šesti lety, kdy mi prasklá aorta zcela změnila život, vystřídala téměř absolutní, byť...",lidovky.cz,lide
https://www.lidovky.cz/lide/odesla-legenda-sovetskeho-disentu-ve-veku-91-let-zemrela-obhajkyne-lidskych-prav-alexejevova.A181209_122415_lide_ele,Odešla legenda sovětského disentu. Ve věku 91 let zemřela obhájkyně lidských práv Alexejevová,"Ve věku 91 let v neděli v moskevské nemocnici zemřela ruská obhájkyně lidských práv Ljudmila Alexejevová, legenda sovětského disentu. Informovala o...",lidovky.cz,lide
https://www.lidovky.cz/lide/tango-proti-sambe-komu-v-semifinalovem-kole-stardance-nejvice-sluselo.A181209_072218_lide_ape,Tango proti sambě. Komu v semifinálovém kole StarDance nejvíce slušelo?,Semifinálový večer taneční soutěže StarDance opět přinesl zajímavé módní kreace a postavilo proti sobě sambu a tango. Kterému páru to na parketu...,lidovky.cz,lide
https://www.lidovky.cz/lide/hranice-mezi-mnou-a-ronem-mizela-rika-rupert-grint.A181208_204040_lide_ele,"Hranice mezi mnou a Ronem s každým filmem mizela, říká Rupert Grint",Britský herec Rupert Grint se možná už nikdy nevymaní ze spojení s Ronem Weasleym - postavou z filmového zpracování příběhů Harryho Pottera podle...,lidovky.cz,lide
https://www.lidovky.cz/lide/netradicni-publikace-predstavuje-wericha-jako-milovnika-jidla.A181204_120059_lide_ape,Netradiční publikace představuje Wericha jako milovníka jídla,Dvacet receptů napsaných spolu se vzpomínkami na druhé straně fotografií nabízí netradiční publikace Jan Werich - Moje oblíbené recepty. Čtenář se...,lidovky.cz,lide
https://www.lidovky.cz/lide/novou-miss-world-se-stala-mexicanka-ceska-ani-nepostoupila-do-finale.A181208_183339_lide_ele/foto,"Novou Miss World se stala Mexičanka, Česka ani nepostoupila do finále",Novou Miss World se dnes v čínském městě San-ja stala 26letá Mexičanka Vanessa Ponceová de Leonová. Informovala o tom agentura DPA. Zástupkyně České...,lidovky.cz,lide
https://www.lidovky.cz/lide/investice-do-uberu-zachranily-mou-rodinu-rika-armstrong.A181207_080003_lide_ssu,"Investice do Uberu zachránily mou rodinu, říká Armstrong","Poté, co cyklista Lance Armstrong upadl v nemilost a po přiznání k dopingu utrpěl velké finanční ztráty, nad vodou ho drželo jediné: investice do...",lidovky.cz,lide
https://www.lidovky.cz/lide/byt-vegetarianem-aneb-propichnuteho-prstu-bolest.A181203_124521_lide_ape,ASI.JATKA: Propíchnutého prstu bolest aneb Být vegetariánem má své bezpečnostní důvody,"Mám teorii. Vycházející ale z osobní praxe, takže to může být totální bullshit.",lidovky.cz,lide
https://www.lidovky.cz/lide/stipkova-proc-tady-stojime.A181203_103021_lide_ape,ŠTÍPKOVÁ: Proč tady stojíme?,To je otázka spojená s mou existencí na různých jevištích a zkušebnách v posledních pár týdnech. Tato otázka sice padla ve vlaku z Českého Těšína do...,lidovky.cz,lide
https://www.lidovky.cz/lide/paso-doble-proti-quickstepu-komu-to-na-tanecnim-parketu-nejvice-sluselo.A181202_113830_lide_jto,Paso doble proti quickstepu. Komu to na tanečním parketu nejvíce slušelo?,Osmý večer taneční soutěže StarDance znovu přinesl oslnivé módní kreace. Tentokrát. Který z tanečních párů ozářil nejen tancem a kdo na sebe měl vzít...,lidovky.cz,lide
https://www.lidovky.cz/lide/egyptska-herecka-pujde-pred-soud-kvuli-prusvitnym-satum-muze-byt-odsouzena-az-na-pet-let-vezeni.A181201_211522_lide_ele,Egyptská herečka půjde před soud kvůli průsvitným šatům. Může být odsouzena až na pět let vězení,"Egyptská herečka, která tento týden přišla na slavnostní zakončení filmového festivalu v Káhiře v průsvitných šatech, bude u soudu čelit obžalobě z...",lidovky.cz,lide
https://www.lidovky.cz/svet/zemrel-byvaly-prezident-spojenych-statu-george-bush-starsi.A181201_073301_ln_zahranici_ele,Zemřel bývalý prezident Spojených států George Bush starší. Bylo mu 94 let,"Ve věku 94 let zemřel bývalý americký prezident George Bush starší. Oznámil to mluvčí jeho rodiny, podle něhož 41. prezident USA zemřel v pátek...",lidovky.cz,lide
https://www.lidovky.cz/lide/potrebovali-jsme-se-svobodne-nadechnout-rika-umelecka-reditelka-divadla-na-zabradli.A181107_155606_lide_ape,"Potřebovali jsme se svobodně nadechnout, říká umělecká ředitelka Divadla Na zábradlí","Když jsem odcházela z představení Hamleti, které je sondou do hereckého života, dozvěděla jsem se od jedné divačky, že nemůžu mít vyšší IQ než...",lidovky.cz,lide
https://www.lidovky.cz/lide/urad-jako-narodni-obet-emil-hacha-se-stal-prezidentem-pred-80-lety.A181130_152541_lide_krku,"Muž, který si zničil dobré jméno pro Československo. Před 80 lety se stal prezidentem Emil Hácha","Třicátého listopadu 1938 se Praha probudila do mlhavého podzimního dne. Počasí jako by obráželo soumračnou politickou realitu, v níž se již řadu...",lidovky.cz,lide
https://www.lidovky.cz/lide/cesti-strelci-zbrane-evropska-unie-zakazova-smernice-eu-lex.A181010_133941_ln_domov_tpc/foto,"Čeští střelci. Kdo jsou lidé, kteří propadli střelnému prachu","Středoškolský pedagog, vedoucí v supermarketu nebo strojní mechanik. Lidé nejrůznějšího věku i povolání spojuje jedno: láska ke zbraním. „Jen o nás...",lidovky.cz,lide
https://www.lidovky.cz/lide/jak-se-zije-cechovietnamce-v-arabske-zemi.A181126_143102_lide_ape,ASI.JATKA: V Česku jsem se necítila. Čechovietnamka dělá kariéru v Dubaji,"Ngoc Anh – Helene (27) měla v Česku slibnou kariéru, ale protože je povahou dobrodruh s velkými životními cíli, rozhodla se přestěhovat do Spojených...",lidovky.cz,lide
https://www.lidovky.cz/lide/francouzsky-plavec-vzdal-pokus-o-preplavani-ticheho-oceanu.A181127_144747_lide_ele,Francouzský plavec vzdal pokus o přeplavání Tichého oceánu,"Francouzský dálkový plavec Benoît Lecomte musel vzdát svůj pokus přeplavat jako první člověk Tichý oceán poté, co jeho doprovodný člun zničila bouře....",lidovky.cz,lide
https://www.lidovky.cz/lide/posledni-tango-v-parizi-osirelo-zemrel-italsky-reziser-a-scenarista-bernardo-bertolucci.A181126_094948_lide_jto,Poslední tango v Paříži osiřelo. Zemřel italský režisér a scenárista Bernardo Bertolucci,Ve věku 77 let zemřel v Římě pod dlouhé nemoci italský režisér a scenárista Bernardo Bertolucci. Oscarový Bertolucci měl na svém kontě i jeden z...,lidovky.cz,lide
