link,link_text,txt,site,area
https://www.lidovky.cz/vanoce-na-severu-svedske-stoly-kacer-donald-a-hromady-pizzy-na-bozi-hod-1me-/dobra-chut.aspx?c=A171216_121357_dobra-chut_ele,"Vánoce na severu: švédské stoly, Kačer Donald a hromady pizzy na Boží hod","Základ švédské kuchyně tvoří maso, ryby, brambory a kořenová zelenina. Ideálně podávané formou švédského stolu. „Na Vánoce by na něm mělo být dokonce...",lidovky.cz,chut
https://www.lidovky.cz/vanocni-sladkosti-zkuste-kokosove-tycinky-v-cokolade-pp0-/dobra-chut.aspx?c=A171211_143444_dobra-chut_ape,Vánoční sladkosti? Zkuste kokosové tyčinky v čokoládě,Máte rádi kokos a tradiční kokosové koule vás omrzeli? Zkuste letos trochu experimentovat a připravte si kokosové tyčinky v čokoládě.,lidovky.cz,chut
https://www.lidovky.cz/mali-rostaci-linecke-cukrovi-ze-spaldove-mouky-plnene-rumovymi-povidly-1oi-/dobra-chut.aspx?c=A171215_090643_dobra-chut_ape,Malí rošťáci. Linecké cukroví ze špaldové mouky plněné rumovými povidly,"Linecké cukroví má mnoho variant, přesto to klasické s rybízovou marmeládou zůstává stálicí mezi všemi druhy vánočního cukroví. Můžete ho připravit...",lidovky.cz,chut
https://www.lidovky.cz/kazdy-region-spanelska-ma-trochu-jine-vanocni-menu-fwr-/dobra-chut.aspx?c=A171214_111439_dobra-chut_ape,Iberská šunka a plody moře. Každý region Španělska má trochu jiné vánoční menu,"Každá země má svá typická jídla, která se servírují o Vánocích. Ve většině regionů Španělska nesmí na vánočním stole chybět sýry, olivy, mořské plody...",lidovky.cz,chut
https://www.lidovky.cz/tak-trochu-jina-vanocni-polevka-zkuste-smetanovou-s-rasami-p4e-/dobra-chut.aspx?c=A171214_151241_dobra-chut_ape,Tak trochu jiná vánoční polévka. Zkuste smetanovou s řasami,"Na slavnostním stole nesmí chybět polévka. Musí být jemná a nepříliš sytá. Čeká nás ještě druhý chod a pak třeba něco sladkého, proto nemusí být...",lidovky.cz,chut
https://www.lidovky.cz/obed-kancelarskych-krys-kam-v-praze-na-nejlepsi-polevky-pi9-/dobra-chut.aspx?c=A171212_145927_dobra-chut_ape,Oběd kancelářských krys: Kam v Praze na nejlepší polévky?,"Chcete se naobědvat za dvě stravenky, ale nevíte, která restaurace či bistro stojí ve vaší čtvrti za návštěvu? Nezoufejte. Server Lidovky.cz přináší...",lidovky.cz,chut
https://www.lidovky.cz/trcka-spokojeny-cisnik-je-zaklad-muze-rozdavat-pohodu-dal-p3i-/dobra-chut.aspx?c=A171212_115307_dobra-chut_ape,"TRČKA: Spokojený číšník je základ, může rozdávat pohodu dál","Před časem jsme s manažery našich restaurací udělali krátkou anketu. Jedna z otázek byla: Co je pro vás důležité, abyste byli spokojeni v práci? Víte...",lidovky.cz,chut
https://www.lidovky.cz/vanocni-peceni-jak-na-celozrnnou-vanocku-ff8-/dobra-chut.aspx?c=A171211_132136_dobra-chut_ape,Vánoční pečení: Jak na celozrnnou vánočku?,Bez vánočky by Vánoce ani nebyly Vánocemi. Česká klasika nechybí snad v žádné rodině. Zkuste si ale letos nachystat trochu zdravější celozrnnou...,lidovky.cz,chut
https://www.lidovky.cz/co-pripravit-na-novy-rok-k-obedu-prinasime-tri-recepty-z-cocky-p64-/dobra-chut.aspx?c=A131230_141539_dobra-chut_ape,Co připravit na Nový rok k obědu? Přinášíme tři recepty z čočky,"Na Nový rok by se měla jíst čočka, aby se nás držely peníze. Navíc má i blahodárné účinky na naše zdraví. Připravit ji můžete klasicky s uzeným, nebo...",lidovky.cz,chut
https://www.lidovky.cz/plzensti-japonci-opustili-smichov-duf-/pivo.aspx?c=A171221_212642_ln_domov_ele,‚Plzeňští‘ Japonci opustili Smíchov. Staropramen bude místo piva Asahi vařit americký Miller,Pivovary Staropramen ukončily licenční výrobu prémiové značky japonského koncernu Asahi. Nahradilo ji americké pivo Miller. Smíchovský pivovar...,lidovky.cz,chut
https://www.lidovky.cz/lakadlo-pro-deti-a-bez-kosti-zkuste-letos-kapri-hranolky-pk0-/dobra-chut.aspx?c=A171204_145246_dobra-chut_ape,Lákadlo pro děti a bez kostí. Zkuste letos kapří hranolky,"Vánoce bez kapra? To by nebylo ono. Záleží jen na vás, jakému způsobu přípravy dáváte přednost. Vůně smažených rybích hranolků je lákadlem hlavně pro...",lidovky.cz,chut
https://www.lidovky.cz/5-nej-bramborovych-salatu-podle-nasich-nejlepsich-sefkucharu-prw-/dobra-chut.aspx?c=A101206_143000_dobra-chut_glu,5 nejlepších bramborových salátů podle našich nejlepších šéfkuchařů,Štědrovečerní večeře se neobejde bez dobrého bramborového salátu. Každá rodina má svůj osvědčený recept. My vám přinášíme pět variací salátů podle...,lidovky.cz,chut
https://www.lidovky.cz/vanocni-menu-jinak-myslim-ze-delit-se-o-jidlo-je-zaklad-rika-sefkuchar-1jt-/dobra-chut.aspx?c=A171206_140716_dobra-chut_ape,"Vánoční menu jinak. Myslím, že dělit se o jídlo je základ, říká šéfkuchař",Příprava vánoční večeře pro velkou rodinu může být docela stresující a pracná a mnoho lidí si v dnešní době čím dál tím více přeje strávit Štědrý...,lidovky.cz,chut
https://www.lidovky.cz/vanilkove-rohlicky-s-vlasskymi-orechy-rakousko-uherske-dedictvi-pretrvava-17b-/dobra-chut.aspx?c=A171208_155022_dobra-chut_ape,Vanilkové rohlíčky s vlašskými ořechy. Rakousko-uherské dědictví přetrvává,Dovede si představit Vánoce bez vanilkových rohlíčků? Já upřímně tedy ne. Vanilkové rohlíčky jsou stálicí v sortimentu našeho vánočního cukroví...,lidovky.cz,chut
https://www.lidovky.cz/neotrele-vanocni-cukrovi-zkuste-susenkove-stromecky-pf7-/dobra-chut.aspx?c=A171207_131047_dobra-chut_ape,Neotřelé vánoční cukroví? Zkuste sušenkové stromečky,"V jednoduchosti je krása. Tyhle voňavé sušenky můžete chodit ujídat jen tak samostatně nebo z nich, pomocí krému, udělat vánoční stromeček. Ať se...",lidovky.cz,chut
https://www.lidovky.cz/novinar.aspx?idnov=2431,Alena Pecháčková,"Kuře v hlavní roli, dostupné suroviny a jednoduché recepty. Taková je nová kuchařka Kuře - Jednoduše & dokonale šéfa Pražského kulinářského institutu...",lidovky.cz,chut
https://www.lidovky.cz/smichov-bez-masa-02n-/dobra-chut.aspx?c=A171205_151340_dobra-chut_ape,Oběd kancelářských krys: Smíchov bez masa. Kde si pochutnáte?,"Chcete se naobědvat za dvě stravenky, ale nevíte, která restaurace či bistro stojí ve vaší čtvrti za návštěvu? Nezoufejte. Server Lidovky.cz přináší...",lidovky.cz,chut
https://www.lidovky.cz/novinar.aspx?idnov=669,Martin Zvěřina,"K oslavě Silvestra patří bublinky, přesněji řečeno většina z nás si připije na Nový rok nějakým alkoholem, ve kterém bude kysličník uhličitý. Ať už...",lidovky.cz,nazory
https://www.lidovky.cz/mlejnek-zeman-je-jasnym-favoritem-prezidentskych-voleb-maji-ale-i-sve-cerne-kone-gd9-/nazory.aspx?c=A171229_145351_ln_nazory_ele,"MLEJNEK: Zeman, muž roku 2017. Nad osmičkou jeho vyzyvatelů se vznáší prezidentův stín","Prezidentská volba spěje do finiše, leč v jedné věci je už jasno. Za muže roku 2017 lze nesporně vyhlásit Miloše Zemana. Alespoň v politice se vše...",lidovky.cz,nazory
https://www.lidovky.cz/novinar.aspx?idnov=3535,Jan Klesla,"Právo na informace dává občanům možnost zjistit, co jejich vláda dělá. Stručná věta na webu ministerstva spravedlnosti USA pěkně po americku...",lidovky.cz,nazory
https://www.lidovky.cz/novinar.aspx?idnov=669,Martin Zvěřina,"Hrozil prezident Zeman občanům, nebo jen politikům? Smí prezident hrozit pěstí během svého vánočního poselství? Tyhle otázky se vynořily po...",lidovky.cz,nazory
https://www.lidovky.cz/novinar.aspx?idnov=3535,Jan Klesla,"Biblická legenda o Pilátovi Pontském, který si „umyl ruce“ nad osudem Ježíše z Nazaretu, je odvěkým symbolem alibismu. Podobně to zatím vypadá, že si...",lidovky.cz,nazory
https://www.lidovky.cz/novinar.aspx?idnov=669,Martin Zvěřina,"Vánoční svátky přinášejí vždy největší dávku pohádek, zejména filmových. Hádky zpravidla bývají o to, která je nejlepší. Naštěstí dnes máme spoustu...",lidovky.cz,nazory
https://www.lidovky.cz/novinar.aspx?idnov=2897,István Léko,"V běžném právním státě je samozřejmostí nejenom to, že platí klasická zásada „v pochybnostech ve prospěch obžalovaného“, ale i to, že jsou důsledně...",lidovky.cz,nazory
https://www.lidovky.cz/novinar.aspx?idnov=817,Zbyněk Petráček,"Kdybychom chtěli za každou cenu provokovat, napsali bychom, že Carles Puigdemont si může připadat jako T. G. Masaryk před 99 lety. Masaryk odešel do...",lidovky.cz,nazory
https://www.lidovky.cz/praha-1-starostove-konec-roku-prani-bilance-f2t-/nazory.aspx?c=A171219_174735_ln_nazory_jhe,Praha 1: od Národní třídy k národnímu výročí,"Bilancování končícího roku je mne coby starostu „srdce republiky“ vždycky trochu ošemetné, jelikož událostí, projektů i emocionálně zbarvených vjemů...",lidovky.cz,nazory
https://www.lidovky.cz/starostove-nachod-novy-rok-dfi-/nazory.aspx?c=A171218_220302_ln_nazory_jhe,Do Malých lázní v Bělovsi potečou Jan a Běla,"Když se v závěru roku 2017 ohlédnu zpátky a spočítám, co všechno jsme v Náchodě udělali a odpracovali, jsem na Náchoďáky opravdu pyšný....",lidovky.cz,nazory
https://www.lidovky.cz/zanechme-obec-bohatsi-nez-jsme-ji-prebirali-f2w-/nazory.aspx?c=A171218_214736_ln_nazory_jhe,"Zanechme obec bohatší, než jsme ji přebírali","Nejsem velký řečník a poselství je zbytečně vznešené slovo. Dovolte mi proto spíše malé zamyšlení nad tím, kam směřujeme a proč. Před necelými čtyřmi...",lidovky.cz,nazory
https://www.lidovky.cz/novy-rok-starostove-prani-praha-15-dlv-/nazory.aspx?c=A171218_204350_ln_nazory_jhe,"Lid je takový, jaké si volí vůdce","Rád abych všem popřál do nového roku 2018 pevné zdraví, které je základem veškerého života, mnoho štěstí, bez něhož se také neobejdeme, mnoho úspěchů...",lidovky.cz,nazory
https://www.lidovky.cz/novinar.aspx?idnov=817,Zbyněk Petráček,Polsko platí daň za svou solitérnost v rámci EU. Každé fungující společenství má svou „zbraň posledního soudu“. NATO ji ukrývá v článku 5...,lidovky.cz,nazory
https://www.lidovky.cz/novinar.aspx?idnov=817,Zbyněk Petráček,"Patříte-li k fajnšmekrům zkoumajícím neudálosti, jednu přineslo úterý. Poslanec Zdeněk Ondráček (KSČM) byl zvolen šéfem komise pro kontrolu Generální...",lidovky.cz,nazory
https://www.lidovky.cz/surmanova-zamestnanec-je-min-podle-soudcu-jsou-svobodni-jen-podnikatele-14e-/nazory.aspx?c=A171219_211624_ln_nazory_ele,SURMANOVÁ: Zaměstnanec je míň. Podle soudců jsou svobodní jen podnikatelé,"Pět ústavních soudců se minulý týden při posuzování EET zastalo podnikatelů – nemají lehký život, nepotřebují další překážky. Jistě by se ale tyto...",lidovky.cz,nazory
https://www.lidovky.cz/novinar.aspx?idnov=669,Martin Zvěřina,"Hnutí ANO nemá lidi, a tak recykluje staré kádry. Jak jinak vysvětlit angažmá Cyrila Svobody u premiéra a ­Jeronýma Tejce u ministra spravedlnosti...",lidovky.cz,nazory
https://www.lidovky.cz/novinar.aspx?idnov=3535,Jan Klesla,"Některá rána si člověk zapamatuje na celý život. Večer jde spát s myšlenkou, že se nic špatného nemůže stát, a ­než se ráno stihne nasnídat a oholit,...",lidovky.cz,nazory
https://www.lidovky.cz/novinar.aspx?idnov=817,Zbyněk Petráček,"Civilizace se vyvíjí. Je to znát i na vztahu k dětem. Když přišla první průmyslová revoluce, začal bujet problém dětské práce v prvních továrnách....",lidovky.cz,nazory
https://www.lidovky.cz/novinar.aspx?idnov=817,Zbyněk Petráček,"Když jsem jel kdysi do Francie, autobus zastavili celníci. Když viděli v batohu dva kartony cigaret, byli na koni – to množství překračuje předpisy....",lidovky.cz,nazory
https://www.lidovky.cz/novinar.aspx?idnov=2328,Martin C. Putna,"Stalo se před pár dny v Ostravě, že jakýsi muž napadl v tramvaji skupinu studentů za to, že mluvili anglicky. Tloukl je a křičel, že toto město je...",lidovky.cz,nazory
https://www.lidovky.cz/v-zaveru-roku-se-utkaji-zenati-se-svobodnymi-f3h-/nazory.aspx?c=A171210_211341_ln_nazory_jhe,V závěru roku se utkají ženatí se svobodnými,"Advent a doba vánoční patří mezi nejkrásnější období každého roku. Zvláště pak pro děti. V naší obci k tomuto období patří hned několik akcí a nevím,...",lidovky.cz,nazory
https://www.lidovky.cz/nachod-starostove-vanoce-0h5-/nazory.aspx?c=A171210_210424_ln_nazory_jhe,Zvonkohra změnila noty a hraje koledy,"Konec roku se nám pomalu blíží a spolu s ním přišly také nejoblíbenější svátky v roce, Vánoce. Je to jen pár dní, co jsme u nás v Náchodě rozsvítili...",lidovky.cz,nazory
https://www.lidovky.cz/okrisky-starostove-vanoce-dd0-/nazory.aspx?c=A171210_205500_ln_nazory_jhe,Spokojení občané jsou dárkem pro každého starostu,"Adventní čas by se měl nést v duchu klidu a pohody, jenže dnešní doba je jiná. Ve firmách i na úřadech je s blížícím se koncem roku největší...",lidovky.cz,nazory
https://www.lidovky.cz/starostove-praha-1-vanoce-0hq-/nazory.aspx?c=A171210_204014_ln_nazory_jhe,O svařené víno nepřijdete,"Kdybych chtěl být trochu sarkastický, řekl bych, že Vánoce v Praze 1 se dělí na ty magistrátní a naše, ryze lokální, pro obyvatele naší městské...",lidovky.cz,nazory
https://www.lidovky.cz/vyzdobu-vyrobily-nase-deti-dfj-/nazory.aspx?c=A171210_203358_ln_nazory_jhe,Výzdobu vyrobily naše děti,"Adventní čas jsme zahájili rozsvícením vánočního stromu na náměstí a podáváním svařáku a čaje, včetně malého občerstvení.",lidovky.cz,nazory
https://www.lidovky.cz/telnice-starostove-vanoce-dch-/nazory.aspx?c=A171210_202421_ln_nazory_jhe,Chceme naplnit smysl narození Nemluvněte,Adventní dobu zahajujeme v naší obci nejdříve mší svatou o první adventní neděli ve farním kostele. Odpoledne se pak sejdou školáci a rodiče na...,lidovky.cz,nazory
https://www.lidovky.cz/starostove-vanoce-borsov-0yx-/nazory.aspx?c=A171210_201029_ln_nazory_jhe,"Ať máme víc snů, než kolik jich dokáže zničit realita","V naší obci děláme vcelku běžné věci – rozsvícený stromeček, adventní punčování na návsi s živou hudbou, koncert v kostele, setkání s penzisty,...",lidovky.cz,nazory
https://www.lidovky.cz/novinar.aspx?idnov=817,Zbyněk Petráček,"Vladimiru Putinovi nelze upřít, že má smysl pro stylizaci a režii událostí. Poznal to už filmař Oliver Stone. To on režíroval dokument o Putinovi,...",lidovky.cz,nazory
https://www.lidovky.cz/novinar.aspx?idnov=3438,Jan Macháček,"1. Na prvním místě v řadě dobrých zpráv stojí Francie. Hrozilo, že by se francouzskou prezidentkou mohla stát představitelka pravicového extremismu,...",lidovky.cz,nazory
https://www.lidovky.cz/novinar.aspx?idnov=3438,Jan Macháček,Evropská komise se ve středu poprvé po šedesáti letech své existence rozhodla obžalovat členský stát z porušování demokratických hodnot a vlády...,lidovky.cz,nazory
https://www.lidovky.cz/novinar.aspx?idnov=3438,Jan Macháček,"V anglosaském tisku, resp. v jeho podstatné části, bývá německý názor na ekonomii či hospodářskou politiku často vysmíván. Němci se dívají na dluh...",lidovky.cz,nazory
https://www.lidovky.cz/novinar.aspx?idnov=3438,Jan Macháček,"V nálezu Ústavního soudu ČR ke kauze EET najdeme v závěru i disentní stanovisko pěti soudců Šimíčka, Jirsy, Lichovníka, Šimáčkové a Uhlíře.",lidovky.cz,nazory
https://www.lidovky.cz/novinar.aspx?idnov=3438,Jan Macháček,Minulý rok podle komentátora Financial Times Wolfganga Münchaua definovaly velké politické šoky v podobě referenda o brexitu či zvolení Donalda...,lidovky.cz,nazory
https://www.lidovky.cz/novinar.aspx?idnov=817,Zbyněk Petráček,"Kdo si říkal, že na summitu EU bude téma migrace, azylu a stálých distribučních kvót prioritou jen pro „východniary“, mýlil se. I západní média...",lidovky.cz,nazory
https://www.lidovky.cz/novinar.aspx?idnov=3438,Jan Macháček,"Polsko má nového premiéra Mateusze Morawieckého, který je v českém tisku prezentován jako bývalý bankéř a technokrat. Každopádně už je několik let...",lidovky.cz,nazory
https://www.lidovky.cz/novinar.aspx?idnov=3438,Jan Macháček,"Myšlenka předsedy německé sociální demokracie Martina Schulze, že mají do roku 2025 vzniknout Spojené státy evropské a že komu se to nelíbí a...",lidovky.cz,nazory
https://www.lidovky.cz/novinar.aspx?idnov=4057,Pavel Pechoušek,"Zástupce velitele čety 43. výsadkového praporu v Chrudimi Daniel Hlaváč je vynikající voják, vedle toho ale také skvěle fotí. Válečné snímky z jeho...",lidovky.cz,lide
https://www.lidovky.cz/novinar.aspx?idnov=705,Alena Plavcová,U příležitosti dvacetiletého výročí magazínu Pátek Lidových novin výjimečně odemykáme rozhovory s významnými českými osobnostmi. Loni v únoru jsme...,lidovky.cz,lide
https://www.lidovky.cz/trump-oslavi-silvestra-tradicne-na-floride-jako-prezident-zdrazil-listky-15r-/lide.aspx?c=A171231_190527_lide_rsa,Trump přivítá Nový rok tradičně na Floridě. Jako prezident zdražil na party lístky,Americký prezident Donald Trump oslaví příchod nového roku ve své soukromé rezidenci Mar-a-Lago na Floridě. Už téměř dvě desítky let tu na Silvestra...,lidovky.cz,lide
https://www.lidovky.cz/autor-gangnam-style-jihokorejec-psy-slavi-ctyricetiny-pgt-/lide.aspx?c=A171230_102946_lide_ele,"Autor Gangnam style, Jihokorejec PSY slaví čtyřicetiny","Jihokorejský rapper PSY, který 31. prosince oslaví 40. narozeniny, se stal mezinárodní senzací před pěti lety. Nazpíval tehdy píseň Gangnam Style,...",lidovky.cz,lide
https://www.lidovky.cz/novinar.aspx?idnov=705,Alena Plavcová,U příležitosti dvacetiletého výročí magazínu Pátek Lidových novin výjimečně odemykáme rozhovory s významnými českými osobnostmi. Bylo mu...,lidovky.cz,lide
https://www.lidovky.cz/pavel-kolar-stara-se-o-tela-nejuspesnejsich-sportovcu-a-narovnava-zada-politikum-gg3-/lide.aspx?c=A171112_171115_lide_ele,"Stará se o těla slavných sportovců a narovnává záda politikům. Musím znát pacientův příběh, říká Kolář",U příležitosti dvacetiletého výročí magazínu Pátek Lidových novin výjimečně odemykáme rozhovory s významnými českými osobnostmi. Léčí se u něj ti...,lidovky.cz,lide
https://www.lidovky.cz/konecne-patek-nikam-na-vecirek-nepujdu-mam-ho-skoro-petkrat-tydne-py0-/lide.aspx?c=A171228_184644_lide_ele,"MELZER: Konečně pátek? Nikam na večírek nepůjdu, mám ho skoro pětkrát týdně","Konečně pátek! Naposledy jsem si tohle s velkou radostí řekl někdy ve škole. Od svých šestnácti, kdy jsem začal o víkendech pracovat, se můj běžný...",lidovky.cz,lide
https://www.lidovky.cz/mam-rada-britske-serialy-nenajdete-tam-plastove-lidi-f9z-/lide.aspx?c=A171228_190546_lide_ele,"Chýlková: Mám ráda britské seriály, nenajdete tam plastové lidi",Olga Hakuděková v Díky za každé nové ráno i alter ego Evy Kantůrkové v Přítelkyni z domu smutku. Díky plejádě naprosto rozdílných rolí patří Ivana...,lidovky.cz,lide
https://www.lidovky.cz/nesvacilova-cekani-na-vanoce-dgm-/lide.aspx?c=A171227_101345_lide_ape,NESVAČILOVÁ: Čekání na Vánoce,"Jsem přejedená ze všech krůt, bramborových salátů a kaprů. Čekám na sníh. Jsme tu celá rodina, ten můj „balkán“ na jihu Čech. Moje neteř mi právě na...",lidovky.cz,lide
https://www.lidovky.cz/ze-se-chovam-povysene-rodinna-anamneza-by-tomu-mohla-nasvedcovat-tvrdil-zeman-v-roce-2000-grq-/lide.aspx?c=A171112_160212_lide_ele,"Že se chovám povýšeně? Rodinná anamnéza by tomu mohla nasvědčovat, tvrdil Zeman v roce 2000",U příležitosti dvacetiletého výročí magazínu Pátek Lidových novin výjimečně odemykáme rozhovory s významnými českými osobnostmi. Současný český...,lidovky.cz,lide
https://www.lidovky.cz/pred-deseti-lety-zemrel-ve-veku-64-let-popularni-zpevak-karel-cernoch-1ge-/lide.aspx?c=A171226_105520_lide_barp,Před deseti lety zemřel ve věku 64 let populární zpěvák Karel Černoch,"Zpěvák Karel Černoch, který zemřel 27. prosince 2007 ve věku 64 let, patřil dlouhá léta mezi stálice české populární hudby. Za svoji kariéru...",lidovky.cz,lide
https://www.lidovky.cz/the-sun-britska-vlada-naleha-na-harryho-aby-nepozval-obamu-na-svatbu-1p9-/lide.aspx?c=A171226_162652_lide_ele,"Nezvěte na svatbu Obamu, naléhá prý vláda na prince Harryho. Kvůli Trumpově očekávané reakci","Britská vláda naléhá na prince Harryho, aby nepozval bývalého amerického prezidenta Baracka Obamu s manželkou na svou svatbu. Napsal to britský...",lidovky.cz,lide
https://www.lidovky.cz/novinar.aspx?idnov=705,Alena Plavcová,U příležitosti dvacetiletého výročí magazínu Pátek Lidových novin výjimečně odemykáme rozhovory s významnými českými osobnostmi. Rozhovor s Aňou...,lidovky.cz,lide
https://www.lidovky.cz/kazdy-mic-byl-pro-me-zazrak-tenhle-rok-pro-me-byl-vsim-rika-petra-kvitova-1op-/lide.aspx?c=A171222_154122_lide_ele,"Každý míč byl pro mě zázrak, tenhle rok pro mě byl vším, říká Petra Kvitová","Před rokem to vypadalo, že si už možná nezahraje. Po loňském prosincovém incidentu s lupičem, který ji přepadl na tom nejzranitelnějším místě, v...",lidovky.cz,lide
https://www.lidovky.cz/nepremyslim-kalkulackou-vydavat-knihy-me-bavi-rika-nakladatel-joachim-dvorak-184-/lide.aspx?c=A171214_104158_lide_ape,"Nepřemýšlím kalkulačkou. Vydávat knihy mě baví, říká nakladatel Joachim Dvořák","„Někdo vydává knížky, aby vydělal, někdo zas, aby byl slavný, a jiný proto, že ho to baví. Mě to baví, “ říká majitel nakladatelství Labyrint Joachim...",lidovky.cz,lide
https://www.lidovky.cz/mimoradna-linka-chodov-hollywood-kritiku-snasim-spatne-rika-herecka-vagnerova-19m-/lide.aspx?c=A171214_105226_lide_ape,"Mimořádná linka Chodov Hollywood. Kritiku snáším špatně, říká herečka Vagnerová","„Člověk nikdy ničeho nového nedosáhne a nic nezmění, když bude jen slepě opakovat to, co už udělal někdo před ním, “ říká herečka Hana Vagnerová...",lidovky.cz,lide
https://www.lidovky.cz/jak-si-pred-temer-20-lety-zakladatel-seznam-cz-predstavoval-ze-jednou-budou-vypadat-pocitace-ghc-/lide.aspx?c=A171112_154057_lide_ele,"Jako Bill Gates? To je trochu nelichotivé, říkal zakladatel Seznamu.cz před 20 lety",U příležitosti dvacetiletého výročí magazínu Pátek Lidových novin výjimečně odemykáme rozhovory s významnými českými osobnostmi. Tenkrát mu bylo...,lidovky.cz,lide
https://www.lidovky.cz/reziser-jiri-menzel-se-probral-z-umeleho-spanku-v-listopadu-podstoupil-narocnou-operaci-hlavy-ii5-/lide.aspx?c=A171224_120153_lide_prop,Režisér Jiří Menzel se probral z umělého spánku. V listopadu podstoupil náročnou operaci hlavy,Devětasedmdesátiletý oscarový režisér Jiří Menzel se v Ústřední vojenské nemocnice ve Střešovicích probral z umělého spánku. Jeho žena Olga...,lidovky.cz,lide
https://www.lidovky.cz/novinar.aspx?idnov=705,Alena Plavcová,U příležitosti dvacetiletého výročí magazínu Pátek Lidových novin výjimečně odemykáme rozhovory s významnými českými osobnostmi. Devětaosmdesátiletý...,lidovky.cz,lide
https://www.lidovky.cz/nejhorsi-je-kdyz-jsou-lide-lhostejne-rika-herecka-ester-geislerova-1d5-/lide.aspx?c=A171214_121557_lide_ape,"Nejhorší je, když jsou lidé lhostejní, říká herečka Ester Geislerová","Herečka a vizuální umělkyně Ester Geislerová (33) vypráví, jak se po rozvodu postavila na nohy, a vysvětluje, proč je důležité hovořit o tom, co je v...",lidovky.cz,lide
https://www.lidovky.cz/novinar.aspx?idnov=3560,Tomáš Málek,"Na skříni v kanceláři má motorkářskou helmu. Vášeň pro jízdu ve dvou i jedné stopě neskrývá. Vojenský kaplan Petr Fiala, který po absolvování vojny s...",lidovky.cz,lide
https://www.lidovky.cz/novinar.aspx?idnov=705,Alena Plavcová,U příležitosti dvacetiletého výročí magazínu Pátek Lidových novin výjimečně odemykáme rozhovory s významnými českými osobnostmi. Roky každé pondělí...,lidovky.cz,lide
https://www.lidovky.cz/ajtak-je-prototypem-mimone-stejne-jako-ja-rika-lukas-pavlasek-pt8-/lide.aspx?c=A171218_124658_lide_ape,"Ajťák je prototypem mimoně, stejně jako já, říká Lukáš Pavlásek","Do povědomí veřejnosti se Lukáš Pavlásek dostal před deseti lety díky televiznímu pořadu Na Stojáka, stand-upovým vystoupením se stále věnuje. Píše...",lidovky.cz,lide
https://www.lidovky.cz/rozhovor-o-sexu-a-vire-s-dlouholetou-hlavou-katolicke-cirkve-v-cechach-miloslavem-vlkem-guj-/lide.aspx?c=A171112_124515_lide_ele,"Sex a víra? Do člověka je možné vstoupit i jinak, říkal kardinál Vlk v 90. letech",U příležitosti dvacetiletého výročí magazínu Pátek Lidových novin výjimečně odemykáme rozhovory s významnými českými osobnostmi. Co všechno zmůže náš...,lidovky.cz,lide
https://www.lidovky.cz/proc-by-me-melo-zmenit-ze-me-videl-milion-lidi-na-platne-pta-se-anna-ctvrtnickova-g0z-/lide.aspx?c=A171221_210658_ln_noviny_ele,"Proč by mě mělo změnit, že mě viděl milion lidí na plátně, ptá se Anna Čtvrtníčková","Tahle deváťačka z Prahy bude patřit k hlavním hvězdám letošních českých televizních Vánoc. Pohádku Anděl Páně 2, kde hraje jednou z hlavních postav,...",lidovky.cz,lide
