link,link_text,txt,site,area
https://praha.idnes.cz/vysehrad-vltava-nevybuchla-munice-d5y-/praha-zpravy.aspx?c=A180305_110816_praha-zpravy_nuc,"Potápěči našli na dně Vltavy puškový granát, zřejmě patřil wehrmachtu",Až do středy budou policisté ve Vltavě pod Vyšehradskou skálou pátrat po nevybuchlé munici. Chtějí...,idnes.cz,krimi
https://usti.idnes.cz/pozar-dum-ctineves-u-roudnice-nad-labem-mrtvy-muz-hasici-p2y-/usti-zpravy.aspx?c=A180305_102029_usti-zpravy_vac2,"Při požáru domu na Roudnicku zemřel muž, nejspíš kouřil na gauči","Padesátiletý muž zemřel při požáru, který v neděli ráno propukl v rodinném domku v obci Ctiněves u...",idnes.cz,krimi
https://jihlava.idnes.cz/nehoda-umrti-stritez-dobronin-snih-namraza-pocasi-zima-vysocina-policie-14t-/jihlava-zpravy.aspx?c=A180305_101009_jihlava-zpravy_mv,Na Vysočině namrzají silnice. Při střetu auta a dodávky zemřela žena,Osobní auto a dodávka se ráno srazily nedaleko Stříteže. Při nehodě zemřela spolujezdkyně z...,idnes.cz,krimi
https://vary.idnes.cz/horska-sluzba-patrani-snowboardista-klinovec-krusne-hory-pnv-/vary-zpravy.aspx?c=A180305_083226_vary-zpravy_ba,"Záchranáři pátrali po snowboardistovi, pět hodin bloudil okolo Klínovce","Po německém snowboardistovi, který sjel mimo sjezdové tratě na Klínovci, pátrali v neděli večer...",idnes.cz,krimi
https://zpravy.idnes.cz/led-nehoda-smrt-utonuti-zima-dgv-/krimi.aspx?c=A180303_202000_krimi_linv,"Potápěči neúspěšně hledali v Orlíku bruslaře, který zmizel pod ledem",Během sobotního odpoledne se prolomil led se třemi bruslaři na Orlické přehradě. Dva z nich se...,idnes.cz,krimi
https://plzen.idnes.cz/pozar-vyrobni-hala-klenci-pod-cerchovem-ohen-zavada-kotel-komin-psz-/plzen-zpravy.aspx?c=A180302_154022_plzen-zpravy_vb,"Oheň způsobil v hale milionovou škodu, příčinou byla závada na kotli",Oheň napáchal škodu ve výši milion korun v Klenčí pod Čerchovem na Domažlicku. Ve výrobní hale...,idnes.cz,krimi
https://zpravy.idnes.cz/autobus-chodec-zraneni-srazka-nehoda-dsj-/krimi.aspx?c=A180303_193904_praha-zpravy_linv,"Autobus v Praze srazil chodce. Muže museli oživovat, je v nemocnici","Vážné zranění utrpěl čtyřiadvacetiletý muž, kterého v sobotu večer v Českobrodské ulici v Praze...",idnes.cz,krimi
https://hradec.idnes.cz/ledni-jachta-nehoda-led-rybnik-chlumec-nad-cidlinou-fwr-/hradec-zpravy.aspx?c=A180302_163448_hradec-zpravy_the,"Pod ledním jachtařem se na rybníku propadl led, hasiči ho vytáhli na laně",Pod mužem jedoucím na lední jachtě po zamrzlém Starochlumeckém rybníku v Chlumci nad Cidlinou na...,idnes.cz,krimi
https://ostrava.idnes.cz/padelani-maturitni-vysvedceni-falzifikat-fij-/ostrava-zpravy.aspx?c=A180302_153554_ostrava-zpravy_woj,Žena padělala maturitní vysvědčení své kamarádky. Díky tomu získala práci,"Sedmadvacetiletá žena z Bruntálu padělala maturitní vysvědčení své kamarádky, aby získala vysněnou...",idnes.cz,krimi
https://zlin.idnes.cz/pozar-dolni-becva-rodinny-dum-hasic-zraneni-vrtulnik-p03-/zlin-zpravy.aspx?c=A180302_152213_zlin-zpravy_ras,"Při požáru rodinného domu se zranil hasič, letěl pro něj vrtulník",Hasiči v pátek dopoledne likvidovali rozsáhlý požár rodinného domu v obci Dolní Bečva na Vsetínsku....,idnes.cz,krimi
https://kultura.zpravy.idnes.cz/marpo-dead-man-walking-recenze-dk7-/hudba.aspx?c=A180306_121053_hudba_vha,RECENZE: Raper Marpo se odvážně vydal mimo žánrové škatulky,Marpo na novou desku Dead Man Walking přizval kolegy rapery Ironkapa nebo Kaliho a v závěrečné...,idnes.cz,kultura
https://kultura.zpravy.idnes.cz/too-many-zooz-zahraji-v-praze-roxy-dte-/hudba.aspx?c=A180306_135106_hudba_kiz,"Objevili je v metru, pak hráli s Beyoncé. Too Many Zooz budou v Praze","Zatímco to v Česku jde s pouličním hraním, tzv. buskingem od desíti k pěti, newyorská kapela Too...",idnes.cz,kultura
https://kultura.zpravy.idnes.cz/oscar-2018-ukradena-soska-nejlepsi-nejhorsi-momenty-fse-/filmvideo.aspx?c=A180306_095028_filmvideo_ts,Oscar je jen začátek. Pak ukradli sošku a napadli Stone i Oldmana,"Téměř čtyřhodinový ceremoniál 90. Oscarů se obešel bez incidentů, ale následující noc si to...",idnes.cz,kultura
https://kultura.zpravy.idnes.cz/febiofest-deneuve-0m6-/filmvideo.aspx?c=A180306_124949_filmvideo_spm,Francouzská herečka Catherine Deneuveová převezme cenu Febiofestu,"Královna francouzského filmu Catherine Deneuveová, herecká hvězda Afričana, Krásky dne či...",idnes.cz,kultura
https://kultura.zpravy.idnes.cz/petra-soukupova-02n-/literatura.aspx?c=A180306_110501_literatura_kiz,Soukupová má dvě nominace na ceny Magnesia Litera. Nejvíce šancí má Host,Spisovatelka Petra Soukupová letos posbírala dvě nominace na výroční knižní ceny Magnesia Litera....,idnes.cz,kultura
https://kultura.zpravy.idnes.cz/recenze-nikdys-nebyl-0r7-/filmvideo.aspx?c=A180305_386980_filmvideo_spm,"RECENZE: Dříve hrál Johnnyho Cashe, teď s kladivem honí pedofily",Za roli Johnnyho Cashe ve filmu Walk the Line má herec Joaquin Phoenix Zlatý glóbus. Loni k němu na...,idnes.cz,kultura
https://kultura.zpravy.idnes.cz/trailer-mary-poppins-se-vraci-d28-/filmvideo.aspx?c=A180305_145910_filmvideo_spm,VIDEO: Emily Bluntová se snese z oblak. Mary Poppins se vrací,"Klasický rodinný muzikál Mary Poppins, ve kterém si titulní roli kouzelné chůvy zahrála Julie...",idnes.cz,kultura
https://kultura.zpravy.idnes.cz/oscary-2018-obrazem-ceny-americke-filmove-akademie-oscar-ppn-/filmvideo.aspx?c=A180305_084433_filmvideo_ts,"OBRAZEM: Muži to zvorali, ženy randí s rybami. Projděte si znovu Oscary",Devadesáté předávání Oscarů je minulostí. Mezi největší okamžiky letošního nejsledovanějšího...,idnes.cz,kultura
https://kultura.zpravy.idnes.cz/zebrik-kin-ruda-volavka-oscar-djy-/filmvideo.aspx?c=A180305_134126_filmvideo_spm,Černý komiks a rudá špionka poslaly oscarovou kolekci ke dnu,"Víkendový žebříček českých kin názorně dokládá, jak oscarové kandidáty divák obchází. Vítězná Tvář...",idnes.cz,kultura
https://kultura.zpravy.idnes.cz/americka-filmova-akademie-oscar-za-scenou-mirka-spacilova-pmg-/filmvideo.aspx?c=A180305_112433_filmvideo_kiz,"Příští Oscary mohou řešit asijské herce, řekla Mirka Spáčilová Za scénou",Oscar za nejlepší film pro romanci Tvář vody byl pro filmovou kritičku MF DNES Mirku Spáčilovou...,idnes.cz,kultura
https://kultura.zpravy.idnes.cz/support-lesbiens-klip-brighter-day-duu-/hudba.aspx?c=A180305_102913_hudba_vha,VIDEO: Support Lesbiens přejí fanouškům v klipu jasnější den,"Po úspěšném singlu Movin’ On, který dodnes figuruje na nejvyšších místech rádiových hitparád a...",idnes.cz,kultura
https://kultura.zpravy.idnes.cz/karel-gott-koncert-o2-arena-praha-do0-/hudba.aspx?c=A180305_115347_hudba_vha,"Gott se vrací do O2 areny, v červnu tu absolvuje samostatný koncert",Legendární zpěvák Karel Gott vystoupí 12. června za doprovodu Boom!Bandu Jiřího Dvořáka na...,idnes.cz,kultura
https://kultura.zpravy.idnes.cz/kobe-bryant-oscar-drahy-basketbale-d5u-/filmvideo.aspx?c=A180305_071059_filmvideo_ts,Máme jen držet zobák a driblovat? Kobe Bryant s Oscarem vzbudil rozpaky,"Mikrofon musel vyjet hodně nahoru, aby byl bezmála dvoumetrový obr vůbec slyšet. Jeden z nejlepších...",idnes.cz,kultura
https://kultura.zpravy.idnes.cz/cassian-elwes-produkce-petr-jakl-jan-zizka-film-producent-pm7-/filmvideo.aspx?c=A180305_110535_filmvideo_ts,Petr Jákl získal na film Jan Žižka hollywoodského producenta,"Produkoval snímky Královna pouště, Elvis & Nixon, Komorník nebo drama se čtyřmi oscarovými...",idnes.cz,kultura
https://kultura.zpravy.idnes.cz/oscar-2018-glosa-tvar-vody-metoo-dky-/filmvideo.aspx?c=A180305_061337_filmvideo_spm,"GLOSA: Oscary dostaly rozum, vyhrál film, ne hnutí. A také Praha","Vítězka Oscarů Tvář vody je nádherná, ale zdálo se, že to v době ženského boje proti sexuálnímu...",idnes.cz,kultura
https://kultura.zpravy.idnes.cz/oscar-2018-tvar-vody-utec-tri-billboardy-oldman-fns-/filmvideo.aspx?c=A180304_132759_filmvideo_spm,"Oscary vyhrála Tvář vody, z herců má sošku Oldman a McDormandová",Oscara za film roku vyhrála fantaskní romance Tvář vody. Herecké trofeje 90. ročníku cen Americké...,idnes.cz,kultura
https://brno.idnes.cz/zemrel-fotograf-jef-kratochvil-umrti-mestske-divadlo-brno-pnx-/brno-zpravy.aspx?c=A180305_082937_brno-zpravy_vh,"Zemřel Jef Kratochvil, dvorní fotograf brněnského městského divadla","Ve věku nedožitých 75 let zemřel fotograf Jef Kratochvil, bez kterého by neexistovala zásadní...",idnes.cz,kultura
https://kultura.zpravy.idnes.cz/trailer-souboj-pohlavi-079-/filmvideo.aspx?c=A180302_131745_filmvideo_spm,VIDEO: Komedie Souboj pohlaví pošle na kurt šovinistu proti feministce,"On je pro ni „sexistické prase“, ona v jeho očích “feministka s chlupatýma nohama“, i když mu...",idnes.cz,kultura
https://kultura.zpravy.idnes.cz/bernard-minier-noc-recenze-dcy-/literatura.aspx?c=A180302_125703_literatura_spm,RECENZE: Minierova tíživá Noc mísí bílý sníh s temnou pomstou,"Francouzský kriminalista Martin Servaz se probral z kómatu, do něhož upadl po zranění způsobeném...",idnes.cz,kultura
https://kultura.zpravy.idnes.cz/neco-za-neco-divadlo-pod-palmovkou-jan-klata-recenze-fhv-/divadlo.aspx?c=A180227_120023_divadlo_ts,RECENZE: Sex a kříže. Na Palmovce se ukřičené polské režie opravdu nebáli,"Temná scéna, hutná a silně nabasovaná hudba. Od úvodních minut je jasné, že nastudování...",idnes.cz,kultura
https://kultura.zpravy.idnes.cz/david-ogden-stiers-mash-serial-zemrel-dws-/filmvideo.aspx?c=A180304_082533_filmvideo_kiz,Zemřel představitel majora Winchestera ze seriálu M.A.S.H. Bylo mu 75 let,Po boji s rakovinou močového měchýře zemřel ve věku 75 let americký herec David Ogden Stiers....,idnes.cz,kultura
https://kultura.zpravy.idnes.cz/oscary-tipy-metoo-0mw-/filmvideo.aspx?c=A180301_173724_filmvideo_spm,Kdepak film. Výročního Oscara získává každá žena oblečená v černé,Oskarka se říkávalo černé telecí kůži. Možná by její jméno měla převzít filmová cena Oscar. Jednak...,idnes.cz,kultura
https://kultura.zpravy.idnes.cz/rozhovor-priscilla-presley-d1f-/hudba.aspx?c=A180302_111639_hudba_kiz,"Když napodobují Elvise, je to pro mě zvláštní, říká Priscilla Presley","Exkluzivně
                Do Elvise Presleyho se zamilovala, když jí bylo čtrnáct let. O osm let později si jej vzala a...",idnes.cz,kultura
https://kultura.zpravy.idnes.cz/zemrel-ota-filip-spisovatel-bavorsko-exilova-literatura-pzu-/literatura.aspx?c=A180303_151642_literatura_fer,"Zemřel spisovatel Ota Filip. Z ČSSR ho vyhnali, v Německu zažil úspěch i tragédii","Ve věku nedožitých 88 let zemřel v Bavorsku spisovatel Ota Filip. Od 70. let žil v Německu, patřil...",idnes.cz,kultura
https://kultura.zpravy.idnes.cz/rag-n-bone-man-recenze-koncert-praha-forum-karlin-f60-/hudba.aspx?c=A180303_110535_hudba_kiz,"RECENZE: Méně stesku, více naléhavosti. Rag'n'Bone Man hrál poprvé v Praze",O svém uměleckém jméně měl jasno už v pěti letech. Za další čtvrtstoletí s ním ovládl díky singlu...,idnes.cz,kultura
https://kultura.zpravy.idnes.cz/trailer-serial-barry-hbo-08l-/filmvideo.aspx?c=A180302_121735_filmvideo_spm,VIDEO: Už mi to došlo! Bill Hader se jako zabiják Barry vrhne na umění,"Nový komediální seriál Barry, který na HBO odstartuje 26. března, se v osmi dílech točí kolem...",idnes.cz,kultura
https://kultura.zpravy.idnes.cz/zlata-malina-emoji-tom-cruise-djw-/filmvideo.aspx?c=A180303_091531_filmvideo_spm,"Nejhorším snímkem roku je Emoji ve filmu, anticenu má i Tom Cruise",Nejhorším snímkem roku je poprvé za 38 let udílení anticen Zlatá malina animovaná pohádka. A to...,idnes.cz,kultura
https://kultura.zpravy.idnes.cz/televizionar-robin-williams-dif-/filmvideo.aspx?c=A180301_172224_filmvideo_spm,"TELEVIZIONÁŘ: Dobré ráno, Robine Williamsi. Po třiceti letech","V lednu 1988 vstoupila do amerických kin neobvyklá komedie s názvem Dobré ráno, Vietname, za niž si...",idnes.cz,kultura
https://kultura.zpravy.idnes.cz/marta-kubisova-pribeh-hudby-100-let-ceskoslovenska-f7n-/hudba.aspx?c=A180302_173343_hudba_vha,"Marta Kubišová znovu zazpívá, v Obecním domě oslaví vznik Československa","Zpěvačka Marta Kubišová sice loni v prosinci ukončila svou kariéru, výjimečně se však na pódium...",idnes.cz,kultura
https://kultura.zpravy.idnes.cz/video-tatova-volha-eliska-balzerova-dbu-/filmvideo.aspx?c=A180302_135249_filmvideo_spm,"VIDEO: Smějete se, a tečou vám slzy. Balzerová zve na Tátovu volhu",Eliška Balzerová coby vdova jede ve filmu Tátova volha se svou filmovou dcerou Tatianou Vilhelmovou...,idnes.cz,kultura
https://kultura.zpravy.idnes.cz/philip-norman-paul-mccartney-biografie-recenze-fri-/literatura.aspx?c=A180302_131737_literatura_vha,RECENZE: Sex na turné se nepočítá. McCartneyho životopis jde do hloubky,Dva roky po anglickém originálu vychází i v češtině obsáhlá biografie Paula McCartneyho z pera...,idnes.cz,kultura
https://kultura.zpravy.idnes.cz/recenze-nocni-hra-rachel-mcadams-dap-/filmvideo.aspx?c=A180302_104614_filmvideo_kiz,RECENZE: Noční hra je oddechovka na jedno použití. Hodí se na Prima Cool,Za pár let se bude nynější novinka našich kin Noční hra výtečně vyjímat na programu stanic typu...,idnes.cz,kultura
https://kultura.zpravy.idnes.cz/serial-prvni-republika-iii-vyoralek-majer-fii-/filmvideo.aspx?c=A180302_386470_filmvideo_spm,"Třetí řada seriálu První republika přidá swing, box a olympiádu","S podzimem roku 1930 narůstají stíny hospodářské krize i stále silnějších Němců, ale rodina...",idnes.cz,kultura
https://kultura.zpravy.idnes.cz/trailer-blade-runner-2049-triky-upp-dqw-/filmvideo.aspx?c=A180301_162036_filmvideo_spm,VIDEO: Blade Runner 2049 má oscarovou nominaci i za triky z Vršovic,"Sci-fi Blade Runner 2049 se odehrává v Los Angeles budoucnosti, ale točila se v Budapešti a...",idnes.cz,kultura
https://kultura.zpravy.idnes.cz/sazky-oscar-coco-gary-oldman-dg1-/filmvideo.aspx?c=A180301_386237_filmvideo_spm,Sázkaři už dali na oscarovou výhru filmu Coco čtvrt milionu korun,Zhruba půldruhého milionu korun se u Tipsportu podle odhadů české sázkové kanceláře vsadí na...,idnes.cz,kultura
https://kultura.zpravy.idnes.cz/ceska-filharmonie-semjon-byckov-daf-/hudba.aspx?c=A180301_121715_hudba_era,"GLOSA: Nový šéf, nové přátelství. Filharmonie si s Byčkovem rozumí",Na přelom letošního února a března naplánovala Česká filharmonie už před nějakou dobou koncerty se...,idnes.cz,kultura
https://ekonomika.idnes.cz/miliardari-nejbohatsi-lidi-sveta-cesi-forebes-amazon-jeff-bezos-petr-kellner-andrej-babis-g74-/eko-zahranicni.aspx?c=A180306_141509_eko-zahranicni_hm1,"Nejbohatším člověkem světa je Bezos, mezi dolarovými miliardáři je 6 Čechů",Nejbohatším člověkem na světě je podle časopisu Forbesu šéf internetového obchodu Amazon Jeff Bezos...,idnes.cz,ekonomika
https://ekonomika.idnes.cz/amazon-milenialove-kreditni-karty-bezhotovostni-bankovnictvi-psg-/eko-zahranicni.aspx?c=A180306_124842_eko-zahranicni_div,Amazon fušuje do bankovnictví. Cílí na lidi bez kreditní karty,"Amazon se zaměřil na poslední část trhu, kterou ještě neovládl - na zákazníky bez kreditních karet...",idnes.cz,ekonomika
https://ekonomika.idnes.cz/vejce-fipronil-toxicka-likvidace-veterinari-f30-/test.aspx?c=A180306_142343_test_rts,"Veterináři zabavili 26 tun výrobků z toxických vajec, řeší jejich likvidaci","VIDEO
				
                Jihočeští veterináři řeší, jak zlikvidovat 26 tun vaječných výrobků, které obsahují látku fipronil....",idnes.cz,ekonomika
https://praha.idnes.cz/azos-app-nymburk-soud-krajsky-zapach-stredocesky-kraj-soudni-spor-1dn-/praha-zpravy.aspx?c=A180306_140549_praha-zpravy_nuc,"Nástupce Azos může v Nymburku vyrábět, podle soudu zápachem neobtěžuje","Nymburk prohrál soudní spor s lakovnou a zinkovnou Azos, respektive její nástupnickou společností...",idnes.cz,ekonomika
https://ekonomika.idnes.cz/dalnicni-kupon-novela-zakona-ministerstvo-dopravy-fx4-/eko-doprava.aspx?c=A180306_112931_eko-doprava_tanc,Na dálnici bez nalepovací známky. Papírové kupony zmizí do dvou let,"Papírové kupony, které při jízdě po českých dálnicích musejí používat auta do 3,5 tun, po roce 2020...",idnes.cz,ekonomika
https://ekonomika.idnes.cz/zeleznice-flixbus-nemecko-flixtrain-leo-express-f6s-/eko-doprava.aspx?c=A180306_101913_eko-doprava_cfr,"Flixbus začne v Německu jezdit i s vlaky, bude spolupracovat s Leo Express","Flixbus v Německu startuje provoz vlaků, zelené vlaky zahájí provoz 24. března nejprve na trase...",idnes.cz,ekonomika
https://ekonomika.idnes.cz/soud-kartel-stavebni-firmy-ohl-zs-strabag-fgj-/ekonomika.aspx?c=A180306_103813_ekonomika_hm1,Soud zrušil pokuty za 300 milionů pro stavební firmy za kartel,"Krajský soud v Brně zrušil pokuty 300,7 milionů korun za kartel stavebních firem. Případ se vrací...",idnes.cz,ekonomika
https://ekonomika.idnes.cz/skoda-transportation-zos-trnava-zssk-konsorcium-fv1-/eko-doprava.aspx?c=A180306_085256_eko-doprava_tanc,Škoda Transportation získala miliardovou zakázku. Dodá vlaky na Slovensko,Konsorcium firem Škoda Transportation a slovenské ŽOS Trnava dodá státnímu slovenskému železničnímu...,idnes.cz,ekonomika
https://ekonomika.idnes.cz/flixbus-regiojet-jancura-ceny-soud-du1-/ekonomika.aspx?c=A180305_232608_domaci_pmk,Jančura versus Flixbus. Autobusová válka může zvednout cenu jízdenek,"Upravte ceny, nebo se sejdeme u soudu, vzkázal konkurenčnímu Flixbusu majitel české dopravní...",idnes.cz,ekonomika
https://ekonomika.idnes.cz/nakup-online-potraviny-rohlik-kosik-zisk-fg0-/ekonomika.aspx?c=A180305_230823_ekonomika_pmk,Potraviny až ke dveřím se v Česku uchytily. Zatím ale příliš nevynáší,Hlavní hráči v prodeji potravin online letos zažívají přelomový rok. Jednička na trhu – Rohlík.cz –...,idnes.cz,ekonomika
https://praha.idnes.cz/praha-veolia-voda-prazske-vodovody-a-kanalizace-pvk-magistrat-p64-/praha-zpravy.aspx?c=A180306_387407_praha-zpravy_nuc,"Praha koupí podíl ve Veolii, chce mít pod kontrolou distribuci vody",Vedení magistrátu upustilo od záměru vypovědět nevýhodnou smlouvu společnosti Pražské vodovody a...,idnes.cz,ekonomika
https://ekonomika.idnes.cz/trumo-cla-obchodni-valka-usa-eu-tarify-ocel-hlinik-fv1-/eko-zahranicni.aspx?c=A180305_386973_eko-zahranicni_rts,Motorky proti oceli. Schyluje se mezi EU a Washingtonem k obchodní válce?,"Amerika především. Volební heslo Donalda Trumpa dostalo velmi konkrétní obrysy, když šéf Bílého...",idnes.cz,ekonomika
https://ekonomika.idnes.cz/jizni-korea-pracovni-tyden-ddj-/eko-zahranicni.aspx?c=A180305_100021_eko-zahranicni_div,V Jižní Koreji už 13 hodin denně pracovat nechtějí. Vláda zkrátila pracovní týden,Pracovní týden v Jižní Koreji je jedním z nejdelších na světě. Kvůli pracovnímu nasazení...,idnes.cz,ekonomika
https://ekonomika.idnes.cz/skoda-auto-alternativni-auta-vision-x-dx1-/eko-doprava.aspx?c=A180305_151409_eko-doprava_div,Škodovka vloží dvě miliardy eur do rozvoje elektromobilů,Během příštích pěti let Škoda Auto investuje zhruba dvě miliardy eur do alternativních pohonů a...,idnes.cz,ekonomika
https://ekonomika.idnes.cz/bernhard-maier-skoda-auto-vyroba-tovarna-automobilka-p0v-/ekoakcie.aspx?c=A180305_113741_automoto_fdv,"Škoda chce zvýšit výrobní kapacity, odbory však pracovní soboty odmítají","VIDEO
				
                Automobilka Škoda Auto hledá možnosti jak navýšit roční výrobní kapacitu. Nelze vyloučit ani...",idnes.cz,ekonomika
https://ekonomika.idnes.cz/pauza-na-koureni-placene-volno-nekuraci-fc9-/eko-zahranicni.aspx?c=A180302_132929_eko-zahranicni_are,"Kolegové chodí kouřit, my chceme volno navíc, žádají dotázaní v průzkumu",Ročně mohou pauzy na cigaretu ubrat z pracovní doby kuřáků průměrně až 6 dní. To podle průzkumu...,idnes.cz,ekonomika
https://ekonomika.idnes.cz/kartel-okenarske-firmy-pokuta-ouhs-zakazka-liberecky-kraj-podvod-p9p-/ekonomika.aspx?c=A180305_100939_ekonomika_hm1,"Tři okenářské firmy se domlouvaly na zakázce, dostaly pokutu 20 milionů",Tři okenářské firmy dostaly pokutu za kartel. Domlouvaly se mezi sebou na jedné veřejné zakázce pro...,idnes.cz,ekonomika
https://ekonomika.idnes.cz/padelky-cnb-pocet-statistika-penize-dbs-/ekonomika.aspx?c=A180305_103221_ekonomika_hm1,Falšuje se méně? ČNB odhalila nejméně padělků od roku 1990,V Česku loni zadrželi o pětinu padělaných a pozměněných bankovek a mincí všech měn. Je to nejméně...,idnes.cz,ekonomika
https://ekonomika.idnes.cz/vlastnictvi-ekonomika-rejstrik-dak-/ekonomika.aspx?c=A180304_212415_ekonomika_linv,Dva zbrusu nové rejstříky mají jedno společné: jsou téměř prázdné,Temno. Tak by se dala aktuálně popsat situace ohledně dvou zbrusu nových rejstříků – jeden má...,idnes.cz,ekonomika
https://ekonomika.idnes.cz/czexit-komentar-evropska-unie-referendum-ekonomika-fyr-/ekonomika.aspx?c=A180226_385414_ekonomika_rts,KOMENTÁŘ: Czexit? To se střelíme do nohy a nic za to nedostaneme,Češi si euro nepřejí a mnozí mluví i o odchodu z EU. Jenže zatímco uchovávání koruny ekonomice...,idnes.cz,ekonomika
https://ekonomika.idnes.cz/sporeni-na-penze-podpora-statu-treti-pilir-duchodovy-system-p55-/ekonomika.aspx?c=A180304_142416_ekonomika_fer,"Na důchod si loni spořilo 4,47 milionu lidí, fondům se nedařilo","VIDEO
				
                Až 4,47 milionu lidí si v roce 2017 spořilo na penze se státním příspěvkem v takzvaném třetím...",idnes.cz,ekonomika
https://ekonomika.idnes.cz/neomezena-dovolena-it-firma-artin-dlr-/eko-zahranicni.aspx?c=A180304_115704_eko-zahranicni_fer,Firmě se osvědčila neomezená dovolená. Lidé odpočívají a plní všechnu práci,Brněnské IT firmě Artin se osvědčila neomezená dovolená. Zaměstnanci si ji mohou vybrat kdykoliv po...,idnes.cz,ekonomika
https://ekonomika.idnes.cz/bublina-tulipanova-horecka-nizozemsko-dyy-/eko-zahranicni.aspx?c=A180228_173652_eko-zahranicni_mato,Sebevraždy kvůli tulipánům? Britka vyvrací mýty o první ekonomické bublině,Aktuální bitcoinová horečka připomněla příběh zřejmě úplně první ekonomické bubliny. V Nizozemsku...,idnes.cz,ekonomika
https://ekonomika.idnes.cz/velka-britanie-boure-emma-bestie-z-vychodu-snih-boure-doprava-zrusene-lety-pocasi-gij-/eko-zahranicni.aspx?c=A180304_081100_eko-zahranicni_fer,Velká Británie přišla kvůli extrémní zimě o miliardu liber denně,"VIDEO
				
                Týden extrémního počasí zastavil ve Velké Británii ekonomické a společenské aktivity. Podle...",idnes.cz,ekonomika
https://ekonomika.idnes.cz/matej-hosek-autista-mapy-kresleni-znacky-adidas-moda-f9s-/ekonomika.aspx?c=A180302_203929_ekonomika_pmk,S mapou MHD na triku. Kresby chlapce s autismem uchvátily módní ikony,"Světoznámé značky jako Adidas, Marco Polo, možná Converse, Happy Socks a­ mnohé další mohou mít...",idnes.cz,ekonomika
https://ekonomika.idnes.cz/gdpr-cena-priprava-0np-/ekonomika.aspx?c=A180302_141908_ekonomika_jj,"Ochrana údajů vyjde až na miliony, pětinu firem zatím GDPR nevzrušuje",Už jen necelý čtvrtrok zbývá do začátku platnosti nařízení EU o ochraně osobních údajů zvaného...,idnes.cz,ekonomika
https://ekonomika.idnes.cz/google-youtube-rasa-diskriminace-cernosi-hispanci-asiati-belosi-pxi-/ekoakcie.aspx?c=A180302_170726_ekoakcie_tanc,"Tmavší mají přednost, nařkl bývalý zaměstnanec Google z diskriminace",Společnost Google čelí nařčení z rasové diskriminace. Podle bývalého zaměstnance měla...,idnes.cz,ekonomika
https://ekonomika.idnes.cz/ukrajina-dodavky-plynu-rusko-petro-porosenko-krizi-jsme-zvladli-kriticka-situace-g25-/eko-zahranicni.aspx?c=A180303_104510_eko-zahranicni_fer,"Časy ruského vydírání plynem pominuly, prohlásil Porošenko. Pomohla EU","Ukrajinský prezident Petr Porošenko ujistil, že kritická situace v zemi kvůli zastavení dodávek...",idnes.cz,ekonomika
https://ekonomika.idnes.cz/bankovky-roku-platidla-ve-svete-mena-penize-libra-dolar-rubl-rupie-10a-/eko-zahranicni.aspx?c=A180220_150657_eko-zahranicni_jan,"Volí se bankovky roku. Zdobí je ragbisté, kosmodrom i most z Harryho Pottera",Mezinárodní společnost pro bankovky opět volí nejpozoruhodnější platidlo vydané v uplynulém roce....,idnes.cz,ekonomika
https://ekonomika.idnes.cz/leo-express-vlaky-nemecko-polsko-flixbus-f14-/eko-doprava.aspx?c=A180302_201315_ekonomika_pmk,"Leo Express míří do Německa, linkou chce propojit Prahu s Berlínem",Expanze Leo Expressu se v letošním roce obrátí směrem k západním sousedům. Společnost založená...,idnes.cz,ekonomika
https://ekonomika.idnes.cz/amazon-kritika-walmart-zbrane-dk7-/eko-zahranicni.aspx?c=A180302_124444_eko-zahranicni_fih,"Zloduchem kapitalismu byl Walmart, štafetu přebírá Amazon, píše list","VIDEO
				
                Internetový gigant Amazon přebírá roli největšího zloducha kapitalismu. Pomyslný titul agresivního...",idnes.cz,ekonomika
https://ekonomika.idnes.cz/mince-velka-britanie-symbol-caj-james-bond-loch-ness-fhp-/eko-zahranicni.aspx?c=A180302_145308_eko-zahranicni_tanc,"Konzervativní Britové překvapili, na mince vybrali Bonda nebo zmrzlinu","Zatímco české mince vyobrazují jen důstojné historické symboly, Britové se nebojí ani Jamese Bonda...",idnes.cz,ekonomika
