link,link_text,txt,site,area
https://www.lidovky.cz/relax/dobra-chut/varte-rychle-a-zdrave-gwyneth-paltrow-sepsala-knihu-receptu-pro-ty-kdo-nestihaji.A181030_131745_dobra-chut_ape,"Rychle a zdravě. Gwyneth Paltrowová vydala kuchařku pro ty, kteří nestíhají","Recepty na jednoduchá a zdravá jídla, která dají tělu maximum výživy i energie a jejichž příprava nezabere víc než třicet minut? To už dávno není jen...",lidovky.cz,chut
https://www.lidovky.cz/relax/dobra-chut/vegansky-hot-dog-oslavte-svetovy-den-rostlinne-stravy-stylove.A181031_143326_dobra-chut_ape,Veganský hot dog. Oslavte světový den rostlinné stravy stylově,"Nadšenci rostlinné stravy oslavují svůj světový den.Ve společnosti se na toto téma vedou již dlouhou dobu rozsáhlé diskuse. Pravdou však je, že...",lidovky.cz,chut
https://www.lidovky.cz/relax/dobra-chut/mate-chut-na-posledni-jidlo-japonska-restaurace-nabizi-menu-veznu-odsouzenych-k-smrti.A181030_155817_dobra-chut_ape,Poslední jídlo vrahů. Japonská restaurace nabízela menu vězňů odsouzených k smrti,Tokijská restaurace Ningen nabízela v rámci speciálního menu poměrně morbidní jídla. Název restaurace znamená v překladu „lidská restaurace“....,lidovky.cz,chut
https://www.lidovky.cz/relax/dobra-chut/sada-oranzove-boubelky.A181015_112935_dobra-chut_ape,ŠÁDA: Halloweenské boubelky. Co všechno vykouzlíte z dýní?,"Plnoštíhlost nebývá u dam žádoucí, ale tyhle krásky kyprých tvarů přímo září a svou přítomností prozrazují, že nastal podzim a je třeba naplnit...",lidovky.cz,chut
https://www.lidovky.cz/relax/dobra-chut/jak-na-masarykovy-knedliky.A181029_105132_dobra-chut_ape,První československý prezident miloval střídmost. Jak na Masarykovy knedlíky?,"První československý prezident byl člověk střídmý v jídle i pití. Mezi jeho nejoblíbenější pokrmy patřila jednoduchá jídla, hlavně ta z bramborového...",lidovky.cz,chut
https://www.lidovky.cz/relax/dobra-chut/jak-na-lahodne-dynove-pyre.A181026_173410_dobra-chut_ape,Malý poklad v kuchyni. Jak na lahodné dýňové pyré?,"Dýňové pyré je malý poklad, který můžete skladovat v mrazáku měsíce. Pak jen rozmrazíte a můžete vykouzlit sladkou kaši se skořicí a přepuštěným...",lidovky.cz,chut
https://www.lidovky.cz/relax/dobra-chut/vanilla-mousse-s-jahodami.A181022_120817_dobra-chut_ape,Jahody s vanilkou. Vyzkoušejte recept na dort od cukrářky,Jahody a vanilka spolu dokonale ladí. Zkuste si doma připravit grandiózní dort vanilla mousse s jahodami od cukrářky Dominiky Tesařové z cukrárny...,lidovky.cz,chut
https://www.lidovky.cz/relax/dobra-chut/klobaskovy-pruvodce.A181022_155036_dobra-chut_ape,Klobáskový průvodce. Jak se z nich stal fenomén nejen českého národa?,"Neobejde se bez ní pořádná vesnická zábava ani fotbalový zápas, provází posezení ve vinných sklepech, je základem rychlého občerstvení. Klobásy...",lidovky.cz,chut
https://www.lidovky.cz/relax/dobra-chut/svatomartinska-husa-s-hruskou-a-pastinakem-jak-na-ni-poradi-sefkuchar.A171030_155637_dobra-chut_ape,"Svatomartinská husa s hruškou a pastinákem. Jak na ni, poradí šéfkuchař","Ke svatomartinským hodům, které jsou právě v plném proudu, neodmyslitelně patří pečená husa, kaldoun a svatomartinské víno. Jak si husu co nejlépe a...",lidovky.cz,chut
https://www.lidovky.cz/relax/dobra-chut/svatomartinska-husa.A131104_161002_dobra-chut_ape,Svatomartinská husa. Jak ji připravit a jaké knedlíky vybrat?,"Staré české pořekadlo o Martinovi na bílém koni, na jehož svátek končí období polních prací a přichází zima, zná asi každý. Existuje ale také ještě...",lidovky.cz,chut
https://www.lidovky.cz/relax/dobra-chut/svatomartinska-husa-podle-sefkucharu-prinasime-tri-recepty.A141110_105340_dobra-chut_ape,Svatomartinská husa podle šéfkuchařů. Přinášíme tři recepty,"Svatomartinské hody jsou v plném proudu, neodmyslitelně k nim patří pečená husa, kaldoun a svatomartinské víno. Česká tradice, která zapadá do...",lidovky.cz,chut
https://www.lidovky.cz/relax/pivo-a-pivovary/maier-prazdroj-neni-matuska-spoluprace-mini-a-velkych-pivovaru-ale-oziva.A181031_185436_ln-pivo_mpt,Maier: Prazdroj není Matuška. Spolupráce mini a velkých pivovarů ale ožívá,"Plzeňský Prazdroj v rámci svého konceptu Volba sládků uvařil s minipivovarem Matuška pivo podle stejné receptury, nazvané „První“. Při porovnání...",lidovky.cz,chut
https://www.lidovky.cz/relax/dobra-chut/podzim-se-blizi-prinasime-pet-jednoduchych-receptu-z-dyne.A140828_115056_dobra-chut_ape,Podzim se blíží. Přinášíme pět jednoduchých receptů z dýně,"Podzim se blíží a s ním přichází čas dýní. Zelenina, která je hlavním symbolem amerického Halloweenu, se skvěle hodí pro podzimní sychravé dny. Navíc...",lidovky.cz,chut
https://www.lidovky.cz/novinari/alena-pechackova.N2431,Alena Pecháčková,"Češi přicházejí ústřicím, mušlím, šnekům a čerstvým rybám stále více na chuť. Do pražské belgické restaurace Bruxx se doveze každý měsíc tři tuny...",lidovky.cz,chut
https://www.lidovky.cz/relax/dobra-chut/francouzska-delikatesa-jak-na-pohankove-galettes.A181015_151214_dobra-chut_ape,Francouzská delikatesa. Jak na pohankové galettes?,Tenounké placky z pohankové mouky se tradičně dělají hned v několika částech Francie: nejslavnější jsou ty bretaňské a normandské. Nejznámější je pak...,lidovky.cz,chut
https://www.lidovky.cz/relax/dobra-chut/pavlik-dusevni-vyvoj-aneb-jaky-je-to-byt-starsi-a-kucharsky-chytrejsi.A181022_112313_dobra-chut_ape,PAVLÍK: Duševní vývoj aneb Jaký je to být starší a kuchařsky chytřejší?,"Gastronomie je obor, který patří ke každodennímu životu. Když chce někdo klasiku nebo vyšší kulinářský zážitek, je mnoho možností. Tahle země nabízí...",lidovky.cz,chut
https://www.lidovky.cz/relax/dobra-chut/nevite-co-s-cuketou-pripravte-z-ni-treba-chleba.A181023_125917_dobra-chut_ape,"Nevíte, co s cuketou? Připravte z ní třeba chleba","Možná to bude znít netradičně, ale i z cukety se dá upéct chleba. Pokud nevěříte, vyzkoušejte tento recept.",lidovky.cz,chut
https://www.lidovky.cz/relax/dobra-chut/videorecept-stary-chleb-nevyhazujte-udelejte-z-nej-jablecny-kolac-radi-sefkuchar.A181022_142348_dobra-chut_ape,"VIDEORECEPT: Starý chléb nevyhazujte. Udělejte z něj jablečný koláč, radí šéfkuchař","Máte rádi českou kuchyni, ale někdy se vám zdá těžká? A jak často se vám stává, že vyhazujete starý chleba? Díky receptu šéfkuchaře Igora Chramce z...",lidovky.cz,chut
https://www.lidovky.cz/relax/dobra-chut/jsem-vegetarian-ale-maso-si-dam.A181015_144926_dobra-chut_ape,"Vegetariáni, kteří jí maso. Kdo jsou flexitariáni a kde se vzali?","Vegetariáni se jim smějí, že jsou stejní jako oni, jen tak trochu podvádějí. Jako o pokrytcích o nich mluví ti, kdo jedí maso běžně. Flexitariáni...",lidovky.cz,chut
https://www.lidovky.cz/relax/dobra-chut/skvele-k-masu-ale-i-k-pancette-jak-na-kapusticky-s-kastany.A181009_155401_dobra-chut_ape,"Skvělé k masu, ale i k pancettě. Jak na kapustičky s kaštany?",Jedlé kaštany rozhodně nepatří jen do sladkého nebo do nádivek. Jsou skvělé i k masu nebo třeba v zemité podzimní trojkombinaci se šťavnatými...,lidovky.cz,chut
https://www.lidovky.cz/novinari/zbynek-petracek.N817,Zbyněk Petráček,"Řeší-li se problém, vždy je to lepší s dohodou než bez dohody. To platí pro rozvody manželství, federací (Československo) i pro odchody z Evropské...",lidovky.cz,nazory
https://www.lidovky.cz/novinari/petr-kambersky.N1768,Petr Kamberský,"Únos premiérova syna. Premiér nechal unést svého syna. Nechce do krimu, skončí na Krymu. Veřejný prostor zaplavily titulky a komentáře kvůli jedné...",lidovky.cz,nazory
https://www.lidovky.cz/novinari/zbynek-petracek.N817,Zbyněk Petráček,Migrace je pojem starý jako lidstvo. Všechny kontinenty kromě Afriky – naší jediné kolébky – vděčí za osídlení pouze migraci. Z Afriky přišli...,lidovky.cz,nazory
https://www.lidovky.cz/nazory/opocno-starostove-priroda-zelen.A181114_162633_ln_nazory_jhe,Vydejte se poznat přírodu Opočenska,"Město Opočno je malebné městečko v podhůří Orlických hor, jehož historické centrum obklopuje zámecký park a na něj navazující lesní komplex zámecké...",lidovky.cz,nazory
https://pr.lidovky.cz/v-projektu-modransky-haj-si-ze-siroke-nabidky-bytu-domu-vybere-kazdy-1iu-/komercni-sdeleni.aspx?c=A181105_103037_komercni-sdeleni_jedli,"V projektu Modřanský Háj si ze široké nabídky bytů, domů vybere každý","Do poslední stavební fáze vstupující Modřanský Háj je developerským projektem společnosti Avestus Real Estate. Zájemcům nabízí propojení urbánního stylu s...  
					celý článek",lidovky.cz,nazory
https://www.lidovky.cz/nazory/starostove-priroda-zelen-nachod.A181114_162154_ln_nazory_jhe,Náchodští si mohou koupit „svého“ kapříka,"Mým hlavním cílem vždy byl Náchod jako příjemné město pro život. K tomu neodmyslitelně patří nejen městská zeleň, ale i větší plochy, které slouží...",lidovky.cz,nazory
https://www.lidovky.cz/nazory/starostove-vrato-priroda-zelen.A181114_161350_ln_nazory_jhe,Úklid obce připomíná údržbu paluby zaoceánské lodi,"Péči o přírodu jsme zařadili mezi hlavní úkoly zastupitelstva obce již před čtyřmi lety a věřím, že i současné, nově zvolené zastupitelstvo obce bude...",lidovky.cz,nazory
https://www.lidovky.cz/nazory/decin-starostove-zelen.A181114_160519_ln_nazory_jhe,Aplikace pomáhá odstraňovat černé skládky,"Druhé nejzelenější město v republice, Děčín, leží na soutoku řeky Labe a Ploučnice a navíc je bránou do národního parku České Švýcarsko.",lidovky.cz,nazory
https://www.lidovky.cz/nazory/zelen-starostove-albrechtice.A181114_155049_ln_nazory_jhe,"Zeleň je něčím, co nás přežije",Naše obec má krásnou polohu – směrem na východ ji obtéká řeka Vltavou a ze tří stran je obklopená nádhernými lesy. Příroda je vedle našeho kostelíka...,lidovky.cz,nazory
https://www.lidovky.cz/novinari/martin-zverina.N669,Martin Zvěřina,"Rodinná farma Čapí hnízdo se ukazuje jako zásadní problém Andreje Babiše. A to bez ohledu na to, jaká obvinění na jeho hlavu budou přidávat amatérští...",lidovky.cz,nazory
https://www.lidovky.cz/novinari/zbynek-petracek.N817,Zbyněk Petráček,Kdo je největší žijící český spisovatel? Který český spisovatel má šanci na Nobelovu cenu za literaturu? Na tyto otázky bývá odpověď jasná: je to...,lidovky.cz,nazory
https://www.lidovky.cz/novinar.aspx?idnov=669,Martin Zvěřina,"Snaha vyloučit z našeho života jedy i veškerá rizika musela narazit na své limity. Kostička s krtkem vyrobená v Číně je nebezpečná, jak příznačné....",lidovky.cz,nazory
https://www.lidovky.cz/novinari/martin-zverina.N669,Martin Zvěřina,Komunistický funkcionář a exponent posrpnové normalizace Vasil Biľak měl prý ve svém krejčovském výučním listu poznámku „nepúšťať na saká“. Nějaké...,lidovky.cz,nazory
https://www.lidovky.cz/novinari/jan-klesla.N3535,Jan Klesla,"Myslím, že byste mě měl nechat řídit zemi a sám řídit CNN, obořil se Donald Trump svým typickým stylem na reportéra zpravodajské televize na první...",lidovky.cz,nazory
https://www.lidovky.cz/novinari/jan-klesla.N3535,Jan Klesla,"Ekonomové jen málokdy dělají lidem radost, a když už to přece jen vypadá s hospodářstvím dobře, dokážou ji ještě pořádně zkazit. Když se zlevňuje,...",lidovky.cz,nazory
https://www.lidovky.cz/novinari/martin-zverina.N669,Martin Zvěřina,"Patří k folkloru naší republiky, že pořadatelé motocyklových závodů v Brně spoustu roků pravidelně pláčou: že dostali malou dotaci od státu, že...",lidovky.cz,nazory
https://www.lidovky.cz/novinar.aspx?idnov=669,Martin Zvěřina,"Ve středu v půl druhé se na pražském magistrátu představila nová koalice Pirátů, Prahy sobě a Spojených sil pro Prahu. Některé jejich plány již...",lidovky.cz,nazory
https://www.lidovky.cz/novinari/petr-kambersky.N1768,Petr Kamberský,"Nutnost výslovného opakování otázky po smyslu bití je očividná, protože na rozdíl od otázky po smyslu bytí neupadá dnes v zapomnění. A naše odpovědi...",lidovky.cz,nazory
https://www.lidovky.cz/novinari/marcel-kabat.N2324,Marcel Kabát,"Před čtyřiceti lety, 5. listopadu 1978, došlo k dosud nepřekonané (a pravděpodobně nepřekonatelné) události v dějinách českého televizního vysílání....",lidovky.cz,nazory
https://www.lidovky.cz/novinari/jan-klesla.N3535,Jan Klesla,"Průměrný český zaměstnanec má povětšinou jen velmi omezené vzdělání v ekonomii, nerozumí a ani nechce rozumět makroekonomickým ukazatelům nebo...",lidovky.cz,nazory
https://www.lidovky.cz/novinari/jan-klesla.N3535,Jan Klesla,"Takových transakcí, jako když banky posílají peníze, děláme denně miliardy, jsou stejně zabezpečené, říkáme tomu e-mail, jenom nechceme za každý...",lidovky.cz,nazory
https://www.lidovky.cz/novinar.aspx?idnov=817,Zbyněk Petráček,"Spojené státy umožní požádat o azyl jen těm cizincům, kteří se zaregistrují při vstupu do země. Vidíte v tom stanovisku diagnózu xenofobie a...",lidovky.cz,nazory
https://www.lidovky.cz/novinari/petr-kambersky.N1768,Petr Kamberský,"Sledujeme velkou při o svobodu slova a úkol armády. Jak to bývá, spouštěč důležité debaty je krajně nešťastný. Po opakovaných útocích na české vojáky...",lidovky.cz,nazory
https://www.lidovky.cz/nazory/halik-klaus-haji-neobhajitelne.A181101_123352_ln-sport-nazory_ssu,"HALÍK: Klaus hájí neobhajitelné, vystřílel do mne celý zásobník svých ‚nepěkných slovíček‘","V době infekčního populismu jsem zvyklý čelit záplavě zlobných reakcí, které se rády vydávají za většinový hlas lidu. Po mé reakci na Piťhovu...",lidovky.cz,nazory
https://www.lidovky.cz/nazory/klaus-pithovo-kazani-bylo-polemikou-s-propagatory-zhoubne-genderove-teorie.A181101_122031_ln_nazory_ssu,KLAUS: Piťhovo kázání bylo polemikou s propagátory zhoubné genderové teorie,"Letošní svatováclavské kázání prof. Piťhy sice vyvolalo řadu ostrých reakcí a nepřátelských komentářů, ty však nepřicházely od špiček katolické...",lidovky.cz,nazory
https://www.lidovky.cz/novinari/petr-kambersky.N1768,Petr Kamberský,"Psáti cokoli o sňatcích osob stejného pohlaví je riskantní a svým způsobem zbytečné. Nejen proto, že většina z nás má názor za ta léta debat už...",lidovky.cz,nazory
https://www.lidovky.cz/nazory/nachod-dusicky-hroby-starostove-hrbitov.A181031_145452_ln_nazory_jhe,Na větší návštěvnost musíme být připraveni,"Na Památku zesnulých neboli Dušičky se každoročně na náchodských hřbitovech scházejí stovky lidí. Vzpomínají na svoje blízké, rozsvítí svíčku, položí...",lidovky.cz,nazory
https://www.lidovky.cz/nazory/jesenice-dusicky-hroby-hrbitov.A181031_145106_ln_nazory_jhe,Rozšíření hřbitova brání chyba z minulosti,"Jesenice je mladé město plné mladých lidí, průměrný věk obyvatel je 35 let. Zdálo by se, že problematika hřbitova by se nás nemusela týkat. Opak je...",lidovky.cz,nazory
https://www.lidovky.cz/nazory/hlucin-dusicky-starostove-hroby-hrbitovy.A181031_144618_ln_nazory_jhe,Na hřbitově vítají návštěvníky dva opravené kříže,"V převážně ateistickém Česku je Hlučínsko se svou silnou křesťanskou vírou bílou vránou. U nás je stále normální, že se v neděli dopoledne naplní...",lidovky.cz,nazory
https://www.lidovky.cz/nazory/sudice-starostove-dusicky-hrbitovy-hroby.A181031_144137_ln_nazory_jhe,"Vandal musel zaplatit, co zničil","V naší obci jsou dva kostely, dva hřbitovy a chodí zde do kostelů zastánci hned tří církví. Římskokatolické s velkým kostelem svatého Jana Křtitele...",lidovky.cz,nazory
https://www.lidovky.cz/novinari/martin-zverina.N669,Martin Zvěřina,"Hnutí ANO Andreje Babiše, které se zhusta honosí tím, že není tradiční politickou stranou a především netrpí typickými neduhy těchto subjektů,...",lidovky.cz,nazory
https://www.lidovky.cz/novinar.aspx?idnov=669,Martin Zvěřina,"Nejprogresivnější politická strana složená z technologických pionýrů se v Brně domlouvá o koalici. Piráti dostali nabídku od ODS, KDU-ČSL a ČSSD a...",lidovky.cz,nazory
https://www.lidovky.cz/novinari/zbynek-petracek.N817,Zbyněk Petráček,"Němečtí konzervativci jdou od nevítězství k nevítězství. V důležitých zemských volbách sice formálně vítězí (CSU v Bavorsku, CDU v Hesensku), ale...",lidovky.cz,nazory
https://www.lidovky.cz/novinari/jana-machalicka.N493,Jana Machalická,"Seznam těch, které k letošnímu 28. říjnu ocenil prezident Zeman, je v podstatě takové tragikomické čtení. Vedle vojáků, kteří položili život ve...",lidovky.cz,nazory
https://www.lidovky.cz/novinari/jan-klesla.N3535,Jan Klesla,"Jednou ze základních zásad republiky, jejíž velké výročí dnes slavíme, je úcta k svobodě slova a její ochrana. To ale neznamená, že by člověk nemohl...",lidovky.cz,nazory
https://www.lidovky.cz/novinari/zbynek-petracek.N817,Zbyněk Petráček,"Některé věci nejsou samozřejmostí, i když tak na první pohled vypadají. Třeba přátelské česko-slovenské vztahy. Je užitečné zdůraznit, že dva...",lidovky.cz,nazory
https://www.lidovky.cz/novinar.aspx?idnov=3535,Jan Klesla,"„Když sleduji vynalézavost moderních vědců, představuji si někdy i mnohem větší vynález, než je film. Takový, který umožní vidět a slyšet na dálku...",lidovky.cz,nazory
https://www.lidovky.cz/bill-nighy-v-praze-uvedl-beneficni-promitani-lasky-nebeske-ve-filmu-pry-splnil-roli-rockoveho-idiot-il1-/lide.aspx?c=A181116_125408_lide_form,Bill Nighy v Praze uvedl benefiční promítání Lásky nebeské. Ve filmu prý splnil roli rockového idiota,"Jedním z důvodů, proč anglický herec Bill Nighy získal roli ve filmu Láska nebeská, byla prý skutečnost, že tvůrci nehledali rockového boha, ale...",lidovky.cz,lide
https://www.lidovky.cz/ve-veku-87-let-zemrel-nemecky-herec-rolf-hoppe-kral-z-tri-orisku-pro-popelku-1tq-/lide.aspx?c=A181115_214750_lide_ele,"Ve věku 87 let zemřel německý herec Rolf Hoppe, král z Tří oříšků pro Popelku",Ve věku 87 let zemřel ve čtvrtek v Drážďanech německý filmový a divadelní herec Rolf Hoppe. S odvoláním na jeho rodinu o tom ve čtvrtek informoval...,lidovky.cz,lide
https://www.lidovky.cz/herecku-lucii-zednickovou-proslavily-filmy-kour-ci-saturnin-pto-/lide.aspx?c=A181114_120924_lide_ape,Herečku Lucii Zedníčkovou proslavily filmy Kouř či Saturnin,"Herečka Lucie Zedníčková, která ve čtvrtek slaví padesátiny, je známá z filmů Kouř (1991), Helimadoe (1993) nebo Saturnin (1994). Objevila se také v...",lidovky.cz,lide
https://www.lidovky.cz/drobky-vietnamskeho-stravnika-dz9-/lide.aspx?c=A181113_102124_lide_ape,"ASI.JATKA: Drobky vietnamského strávníka. Na zemi jíme, protože je nás hodně","Odložím si tu dnes několik drobných gastrorychlomyšlenek, gastrotázek a gastropřání.",lidovky.cz,lide
https://pr.lidovky.cz/v-projektu-modransky-haj-si-ze-siroke-nabidky-bytu-domu-vybere-kazdy-1iu-/komercni-sdeleni.aspx?c=A181105_103037_komercni-sdeleni_jedli,"V projektu Modřanský Háj si ze široké nabídky bytů, domů vybere každý","Do poslední stavební fáze vstupující Modřanský Háj je developerským projektem společnosti Avestus Real Estate. Zájemcům nabízí propojení urbánního stylu s...  
					celý článek",lidovky.cz,lide
https://www.lidovky.cz/zivot-je-pro-me-peklem-prohlasil-reziser-lars-von-trier-znicilo-ho-uzivani-leku-g0h-/lide.aspx?c=A181112_115613_ln_kultura_jto,"Život je pro mě peklem, prohlásil režisér Lars von Trier. Zničilo ho užívání léků","Dánský režisér Lars von Trier (62) je podle vlastních slov poznamenán mnohaletým užíváním léků. „Užívám psychofarmaka už v tak vysokých dávkách, že...",lidovky.cz,lide
https://www.lidovky.cz/dianiska-tohle-neni-negrolog-az-vyrostu-chci-byt-jako-marian-geisberg-12l-/lide.aspx?c=A181112_123227_lide_ape,"DIANIŠKA: Tohle není negrolog. Ale až vyrostu, chci být jako Marián Geišberg","Jako předškolák, jsem vzhlížel ke školákům. Uměli už číst a psát a takový ty věci. Pak jsem se stal jedním z nich a už to nebylo tak cool. Najednou...",lidovky.cz,lide
https://www.lidovky.cz/zemrel-prerovsky-bata-paul-rausnitz-valecny-veteran-a-majitel-meopty-1ec-/lide.aspx?c=A181112_114822_firmy-trhy_pkk,"Zemřel ,přerovský Baťa’ Paul Rausnitz, válečný veterán a majitel Meopty",Ve věku 90 let zemřel v neděli majitel přerovského podniku Meopta-optika a válečný veterán Paul Rausnitz. Informace se objevila na internetových...,lidovky.cz,lide
https://www.lidovky.cz/vasniva-rumba-ci-rychlejsi-quick-step-komu-to-ve-stardance-nejvice-sluselo-1ui-/lide.aspx?c=A181111_083652_lide_ape,Vášnivá rumba či rychlejší quick step. Komu to ve StarDance nejvíce slušelo?,"Pomalá rumba, nebo rychlejší quick step? Pátý a díky výběru hudby „mezinárodní“ díl taneční soutěže StarDance si pro diváky na poli kostýmu připravil...",lidovky.cz,lide
https://www.lidovky.cz/jak-se-zije-lidem-bez-sluchu-vypravi-programator-jakub-perina-pum-/lide.aspx?c=A181106_105044_lide_ape,"Jak se žije lidem bez sluchu? Na úřadech potřebujete tlumočníka, říká mladý programátor","Skoro třicetiletý programátor Jakuba Peřina studoval na Masarykově univerzitě v Brně a na Gallaudet University v USA. Rád dělá své vlastní projekty,...",lidovky.cz,lide
https://www.lidovky.cz/jean-marais-si-sedl-s-romantickymi-hrdiny-nadan-byl-i-vytvarne-p6q-/lide.aspx?c=A181108_112752_lide_ape,"Herec Jean Marais si sedl s romantickými hrdiny, nadán byl i výtvarně",Hereckou kariéru začal Jean Marais už jako dvacetiletý mladík v divadle. Mezinárodní hvězdu z tohoto francouzského umělce ale udělali až čestní a...,lidovky.cz,lide
https://www.lidovky.cz/zemrel-novinar-jan-petranek-psal-i-do-samizdatovych-lidovych-novin-1f9-/lide.aspx?c=A181111_004013_lide_gib,"Zemřel novinář Jan Petránek, psal i do samizdatových Lidových novin","Český novinář, komentátor a disident Jan Petránek působil před rokem 1968 v Československém rozhlase. Vysílal i během okupace 21. srpna. Podepsal...",lidovky.cz,lide
https://www.lidovky.cz/v-cem-je-rumba-nejtezsi-a-jak-si-kroky-pocita-veronika-arichteva-pvy-/lide.aspx?c=A181109_113907_lide_ape,V čem je rumba nejtěžší. A jak si kroky počítá Veronika Arichteva?,"Nejpomalejší latinskoamerický tanec, u kterého tanečníci vynechávají první dobu. V sobotu si rumbu zatančí herečka Veronika Arichteva a tanečník...",lidovky.cz,lide
https://www.lidovky.cz/ohrozil-bezpecnost-moji-rodiny-michelle-obamova-ve-svych-memoarech-kritizuje-trumpa-go3-/lide.aspx?c=A181109_201045_lide_ceh,‚Ohrozil bezpečnost mojí rodiny.‘ Michelle Obamová ve svých memoárech kritizuje Trumpa,"Donald Trump ohrozil před lety svým zpochybňováním místa narození Baracka Obamy rodinu tehdejšího prezidenta, což Trumpovi Michelle Obamová nikdy...",lidovky.cz,lide
https://www.lidovky.cz/horky-kolac-ze-serialu-hra-o-truny-pece-slavne-chleby-ve-tvaru-zlovlka-i-v-realu-prodava-je-ve-svem-i3k-/lide.aspx?c=A181105_121515_lide_ele,"Horký koláč ze seriálu Hra o trůny peče slavné chleby ve tvaru zlovlka, prodává je ve svém obchodu","Fanoušci seriálu Hra o trůny se dočkali senzace v podobě proslulých „chlebíků“ ve tvaru zlovlka, které v seriálu upekl Horký koláč Arye Stark. Herec...",lidovky.cz,lide
https://www.lidovky.cz/nebavi-me-slozita-a-draha-jidla-rika-cesky-foodbloger-cuketka-pro-/lide.aspx?c=A181108_210558_lide_mber,"Nebaví mě složitá a drahá jídla, říká český foodbloger Cuketka","Nejpopulárnější český foodbloger Martin Kuciel alias Cuketka nedávno spustil projekt Skromná kuchyně, kterým se snaží do českých domácností vrátit...",lidovky.cz,lide
https://www.lidovky.cz/zasluzna-prace-herecka-gwyneth-paltrowova-meni-pohled-spolecnosti-na-menopauzu-gpj-/lide.aspx?c=A181106_104104_lide_ape,Záslužná práce? Herečka Gwyneth Paltrowová mění pohled společnosti na menopauzu,"Říkejte si o herečce Gwyneth Paltrowové co chcete, jedno ji ale upřít nemůžete. Rozhodně se jí daří otevírat nová a nová témata ohledně ženského...",lidovky.cz,lide
https://www.lidovky.cz/asi-jatka-racek-bez-racka-a-mobilu-d4m-/lide.aspx?c=A181106_102936_lide_ape,ASI.JATKA: Racek bez racka. A víkend bez mobilu,"Mám slabost pro nerozvážné racky, kteří létají kolem jezer v zemích mluvících germánskými nebo románskými jazyky.",lidovky.cz,lide
https://www.lidovky.cz/matka-me-naucila-nechodit-do-hotelu-s-cizimi-muzi-andersonova-kritizovala-hnuti-metoo-gq1-/lide.aspx?c=A181106_141347_ln_zahranici_mha,‚Matka mě naučila nechodit do hotelu s cizími muži.‘ Andersonová kritizovala hnutí MeToo,"Hvězda seriálu Pobřežní hlídka Pamela Andersonová v rozhovoru pro australskou televizi ostře kritizovala hnutí MeToo. Herečky prý moc dobře věděly,...",lidovky.cz,lide
https://www.lidovky.cz/zasnoubeny-rytmus-nastval-expritelkyni-daru-rolins-p0a-/lide.aspx?c=A181106_134550_lide_jei,Zasnoubený zpěvák Rytmus. Naštval expřítelkyni Daru Rolins?,"Známý slovenský raper Rytmus je pár měsíců po rozpadu sedmiletého vztahu se zpěvačkou Darou Rolins zasnoubený. Na sociálních sítích zveřejnil, že...",lidovky.cz,lide
