link,link_text,txt,site,area
https://www.lidovky.cz/deset-let-blogu-a-vosudovy-vosmicky-dbw-/lide.aspx?c=A180319_125440_lide_ape,ASI.JATKA: Deset let blogu a vosudový vosmičky,"Když jsem 15. 3. 2008 několik minut před druhou hodinou odpolední vypustila svůj první článek na blogovací platformě iDnesu, nikdy by mě nenapadlo,...",lidovky.cz,lide
https://www.lidovky.cz/stepanek-a-vaidisova-cekaji-miminko-byvalym-tenistum-se-ma-narodit-v-cervenci-1xd-/lide.aspx?c=A180320_215713_lide_vlh,Na podzim se dali potřetí dohromady. Štěpánek a Vaidišová teď čekají miminko,Bývalí tenisté Radek Štěpánek a Nicole Vaidišová budou rodiči. Dvojnásobný vítěz Davis Cupu to oznámil na sociální síti Facebook.,lidovky.cz,lide
https://www.lidovky.cz/popel-zesnuleho-fyzika-hawkinga-bude-ulozen-ve-westminsteru-vedle-darwina-ci-newtona-g46-/lide.aspx?c=A180320_192248_lide_ele,Popel zesnulého fyzika Hawkinga bude uložen ve Westminsteru. Vedle Darwina či Newtona,"Popel britského fyzika Stephena Hawkinga, který zemřel 14. března, bude uložen ve Westminsterském opatství v Londýně. Pohřbeni jsou tam kromě jiných...",lidovky.cz,lide
https://www.lidovky.cz/sir-ringo-britsky-princ-william-povysil-bubenika-beatles-do-slechtickeho-stavu-g0w-/lide.aspx?c=A180320_160023_lide_ele,Sir Ringo. Britský princ William povýšil bubeníka Beatles do šlechtického stavu,Britský princ William v úterý povýšil do šlechtického stavu bubeníka slavné kapely Beatles Ringo Starra. Jeho kolegovi z kapely Paulovi McCartneymu...,lidovky.cz,lide
https://www.lidovky.cz/hvezda-sexu-ve-meste-potvrdila-kandidaturu-na-guvernerku-new-yorku-11a-/lide.aspx?c=A180319_192532_lide_ele,Hvězda Sexu ve městě kandiduje na guvernérku New Yorku. Nixonová by mohla nahradit nepopulárního Cuoma,Hvězda seriálu a filmů Sex ve městě Cynthia Nixonová v pondělí oznámila kandidaturu na post guvernérky New Yorku. Svou kampaní se postaví proti...,lidovky.cz,lide
https://www.lidovky.cz/ledeckou-nadchla-gratulace-od-jeji-platonicke-lasky-bryana-adamse-pyi-/lide.aspx?c=A180319_130004_lide_sij,Ledeckou nadchla gratulace od její platonické lásky Bryana Adamse,"Dvojnásobné olympijské vítězce Ester Ledecké prostřednictvím videovzkazu pogratuloval kanadský zpěvák Bryan Adams, který je její platonickou láskou....",lidovky.cz,lide
https://www.lidovky.cz/novinar.aspx?idnov=3914,Pavlína Procházková,"Stephen Hawking zvládl na jedničku roli vědce i celebrity. Zůstanou po něm nejen objevy z oblasti kosmologie a černých děr, ale především také dosud...",lidovky.cz,lide
https://www.lidovky.cz/ve-veku-89-let-zemrel-spisovatel-a-scenarista-zdenek-mahler-pnq-/lide.aspx?c=A180318_082046_lide_ele,Ve věku 89 let zemřel spisovatel a scenárista Zdeněk Mahler,"V 89 letech zemřel v sobotu v pražské Ústřední vojenské nemocnici spisovatel a scenárista Zdeněk Mahler, v neděli to oznámila jeho rodina. Mahler je...",lidovky.cz,lide
https://www.lidovky.cz/novinar.aspx?idnov=4051,Tereza Dorňáková,Svatba britského prince Harryho a americké herečky Meghan Markleové se uskuteční 19. května. V polovině března vyšla nová kniha expertky na britskou...,lidovky.cz,lide
https://www.lidovky.cz/koenigsmarkova-konecne-patek-zustanu-v-praze-a-casto-nevystrcim-nos-1ix-/lide.aspx?c=A180315_172417_lide_ele,KOENIGSMARKOVÁ: Konečně pátek? Zůstanu v Praze a často nevystrčím nos,"Konečně pátek… Nejsem první, kdo si říká: „Už pátek?“ Nevím, čím to je, nebo možná vím, ale akce, požadavky, korespondence, návštěvy… Stran vím proč:...",lidovky.cz,lide
https://www.lidovky.cz/nvotova-delam-filmy-o-tematech-se-kterymi-ma-spolecnost-problem-pw7-/lide.aspx?c=A180315_192159_ln_zahranici_ele,"Režisérka Mečiara Nvotová: Dělám filmy o tématech, se kterými má společnost problém","Vzhled gymnaziálního děvčátka v kombinaci s přesně formulovanými názory a nízko posazeným chraplavým hlasem je to první, co vás na Tereze Nvotové...",lidovky.cz,lide
https://www.lidovky.cz/vyrobte-si-doma-pravou-thajskou-zmrzlinu-se-sezamem-pce-/dobra-chut.aspx?c=A180319_125702_dobra-chut_ape,VIDEORECEPT: Vyrobte si doma pravou thajskou zmrzlinu se sezamem,"Jak na thajské kari, jarní závitky či ostrý salát? Naučte se připravit ty nejlepší asijské pokrmy s jedním z nejlepších českých šéfkuchařů. Server...",lidovky.cz,video
https://www.lidovky.cz/video-lanovka-v-gruzii-se-rozjela-pozpatku-a-zrychlila-lyzare-odhazovala-do-okoli-gjm-/zpravy-svet.aspx?c=A180316_155947_ln_zahranici_ele,VIDEO: Lanovka v Gruzii se rozjela pozpátku a zrychlila. Lyžaře odhazovala do okolí,V pátek došlo v jednom z největších lyžařských středisek na východu Gruzie k poruše sedačkové lanovky. Incident si vyžádal osm zraněných. Informovalo...,lidovky.cz,video
https://www.lidovky.cz/gingerhead-maji-nove-video-dc4-/kultura.aspx?c=A180315_182125_ln_kultura_bez,VIDEO: Gingerhead natočili singl v češtině a hrají akusticky s Wohnout,Česká kapela Gingerhead připravila nový videoklip ke své první česky zpívané písničce Spojený nádoby. Nejen tuto píseň naživo zahraje v rámci...,lidovky.cz,video
https://www.lidovky.cz/novinar.aspx?idnov=3961,Jiří Bigas,Stephen Hawking se stal celebritou mezi vědci. Většina lidí ho znala díky televizi a filmu spíš než pro jeho vědeckou práci. Zahrál si sám sebe v...,lidovky.cz,video
https://sport.lidovky.cz/silenec-s-nozem-ohrozoval-hokejisty-kladna-vnikl-na-led-a-hrace-vyzyval-k-bitce-191-/hokej.aspx?c=A180315_153049_ln-sport-hokej_vlh,VIDEO: Šílenec s nožem ohrožoval hokejisty Kladna. Vnikl na led a hráče vyzýval k bitce,"Čtvrteční trénink hokejistů prvoligového Kladna, kteří se chystají na domácí odvety semifinále play off o místo v baráži proti Českým Budějovicím,...",lidovky.cz,video
https://www.lidovky.cz/video-mlok-scamander-se-opet-postavi-grindelwaldovi-jude-law-se-predstavi-jako-brumbal-gly-/kultura.aspx?c=A180313_182134_ln_kultura_ELE,VIDEO: Další Fantastická zvířata. Jude Law se představí jako Brumbál,"Záběr na Bradavice a přemístění několika kouzelníků. Tak vypadá úvodní scéna traileru k novému snímku Fantastických zvířat, který slibuje nejen...",lidovky.cz,video
https://www.lidovky.cz/videorecept-terijaki-udon-jak-na-na-japonske-nudle-poradi-sefkuchar-1pi-/dobra-chut.aspx?c=A180312_103115_dobra-chut_ape,"VIDEORECEPT: Terijaki Udon. Jak na japonské nudle, poradí šéfkuchař","Jak na thajské kari, jarní závitky či ostrý salát? Naučte se připravit ty nejlepší asijské pokrmy s jedním z nejlepších českých šéfkuchařů. Server...",lidovky.cz,video
https://www.lidovky.cz/novinar.aspx?idnov=2368,Šárka Kabátová,Ještě nedokončili střední školu a už v terezínském Centru studií genocid představili vrstevníkům i široké veřejnosti expozici o holocaustu. Na...,lidovky.cz,video
https://www.lidovky.cz/novinar.aspx?idnov=3961,Jiří Bigas,"V sobotu uplynulo přesně 40 let od chvíle, kdy se první československý kosmonaut Vladimír Remek vrátil ze své skoro osmidenní vesmírné mise....",lidovky.cz,video
https://www.lidovky.cz/novinar.aspx?idnov=2368,Šárka Kabátová,Třetí nádvoří Pražského hradu zaplnili ve čtvrtek odpoledne převážně zastánci Miloše Zemana. Inaugurační projev staronové hlavy státu sice skrze...,lidovky.cz,video
https://www.lidovky.cz/novinar.aspx?idnov=2368,Šárka Kabátová,Čtvrteční inaugurace staronové hlavy státu se nesla ve znamení dehonestace novinářů a médií. Nejprve ji demonstroval prezident Miloš Zeman během...,lidovky.cz,video
https://www.lidovky.cz/zeman-znovu-prezident-slozil-slib-a-zahajil-druhe-petilete-funkcni-obdobi-15r-/zpravy-domov.aspx?c=A180308_141026_ln_domov_gib,VIDEO: Zeman složil prezidentskou přísahu a svým projevem opět budil vášně,Miloš Zeman složil odpoledne prezidentský slib a zahájil tím druhé pětileté funkční období. Slavnostního ceremoniálu ve Vladislavském sále Pražského...,lidovky.cz,video
https://www.lidovky.cz/videorecept-jak-doma-na-thajske-pikantni-nudle-s-hovezim-masem-pbd-/dobra-chut.aspx?c=A180305_120027_dobra-chut_ape,VIDEORECEPT: Jak doma na thajské pikantní nudle s hovězím masem,"Jak na thajské kari, jarní závitky či ostrý salát? Naučte se připravit ty nejlepší asijské pokrmy s jedním z nejlepším českých šéfkuchařů. Server...",lidovky.cz,video
https://www.lidovky.cz/video-neoficialne-bych-se-s-dalajlamou-setkal-i-bez-dohody-s-vladou-rika-jiri-drahos-gkf-/video.aspx?c=A180125_170256_ln-video_jbs,"VIDEO: Neoficiálně bych se s dalajlámou setkal i bez dohody s vládou, říká Jiří Drahoš",Setkal by se Jiří Drahoš s dalajlámou? Na co se chce zeptat Miloše Zemana v dnešním duelu České televize? Koho by si vzal s sebou na Hrad? Může být...,lidovky.cz,video
https://www.lidovky.cz/novinar.aspx?idnov=3961,Jiří Bigas,"Osmadvacetiletý Číňan přemaloval dopravní značení na vytížené křižovatce v naději, že tak učiní provoz plynulejší. Frustrovalo ho, že se v tomto...",lidovky.cz,video
https://www.lidovky.cz/novinar.aspx?idnov=3961,Jiří Bigas,Seznamte se s budoucí vévodkyní ze Sussexu. Tento titul pravděpodobně připadne herečce Meghan Merkleové po svatbě s britským princem Harrym. Věděli...,lidovky.cz,video
https://www.lidovky.cz/kozel-z-vanocnich-trhu-zabehl-az-do-luxusni-parizske-ulice-pal-/video.aspx?c=A171127_224755_ln-video_ELE,Kozel z vánočních trhů zaběhl až do luxusní Pařížské ulice,V pátek utekl z ohrady na vánočních trzích na Staroměstském náměstí kozel. Pobíhal Pařížskou ulicí s luxusními obchody a pokračoval až do ulice...,lidovky.cz,video
https://www.lidovky.cz/video-erupce-sopky-na-bali-chrlila-dym-az-do-vysky-1500-metru-pnj-/video.aspx?c=A171126_223125_ln-video_ELE,Erupce sopky na Bali. Chrlila dým až do výšky 1500 metrů,"Po sobotní erupci sopky Agung na indonéském ostrově Bali úřady vyhlásily pro letecké společnosti nejvyšší, červený stupeň varování. Sloupec dýmu nad...",lidovky.cz,video
https://www.lidovky.cz/novinar.aspx?idnov=3961,Jiří Bigas,Slzy zklamání i štěstí Jany Novotné. Připomeňte si její wimbledonský příběh. Triumfu v All-England Clubu předcházela dvě prohraná finále v singlu. Až...,lidovky.cz,video
https://www.lidovky.cz/novinar.aspx?idnov=3961,Jiří Bigas,Připomeňte si jeden z největších hitů Karla Štědrého. Duet s Waldemarem Matuškou nazvaný Mám malý stan zpíval celý život. Přichystali jsme pro vás...,lidovky.cz,video
https://www.lidovky.cz/novinar.aspx?idnov=3961,Jiří Bigas,Burger King si utahuje z McDonaldu a využívá k tomu aktuální popularity hororu To. Při příležitosti Halloweenu bude ve vybraných amerických...,lidovky.cz,video
https://www.lidovky.cz/novinar.aspx?idnov=3961,Jiří Bigas,"Piloti z 22. základny vrtulníkového letectva u Náměšti nad Oslavou se 17. října zúčastnili cvičení, při kterém nechyběly ani kamery. Podívat se tak...",lidovky.cz,video
https://www.lidovky.cz/novinar.aspx?idnov=3961,Jiří Bigas,Britský dobrodruh se inspiroval animovaným filmem Vzhůru do oblak od Pixaru z roku 2009 a s pomocí stovky heliem naplněných balónků podnikl...,lidovky.cz,video
https://www.lidovky.cz/novinar.aspx?idnov=3961,Jiří Bigas,"Fotbalové utkání mezi thajskými týmy Bangkok Sports Club a Satri Angthong by zřejmě nebylo pro většinu sportovních fanoušků ničím zajímavé, pokud by...",lidovky.cz,video
https://www.lidovky.cz/video-posledni-sobhem-umirajici-simpanzice-objimala-sveho-davneho-pritele-1ug-/video.aspx?c=A171020_143621_ln-video_mha,VIDEO: Poslední sbohem. Umírající šimpanzice objímala svého dávného přítele,"Bylo jí 59 let. Šimpanzice Mama měla týden před smrtí, když ji navštívil profesor Jan van Hooff z univerzity v Utrechtu. Znali se od roku 1972. Mama...",lidovky.cz,video
https://www.lidovky.cz/novinar.aspx?idnov=3961,Jiří Bigas,"Abyste se mohli začíst do speciální edice románu 451 stupňů Fahrenheita, musíte nejprve “spálit” jeho stránky. Sci-fi klasika Raye Bradburyho z roku...",lidovky.cz,video
https://www.lidovky.cz/video-chovatele-po-celem-svete-vydesil-preslechteny-kun-vypada-jako-z-animaku-1xu-/video.aspx?c=A171019_133840_ln-video_mha,VIDEO: Chovatele po celém světě vyděsil přešlechtěný kůň. Vypadá jako z animáku,Americká šlechtitelská farma Orrion se dlouhodobě zaměřuje na chov koní. Nově vyšlechtené hříbě El Rey Magnum však vyvolalo značnou nevoli mezi...,lidovky.cz,video
https://www.lidovky.cz/motorkar-branil-sanitce-v-projeti-dr3-/video.aspx?c=A171019_111134_ln-video_ele,VIDEO: Motocyklista nenechal projet sanitku. Případ projednají správní orgány,"Devětapadesátiletý řidič motocyklu v obci Knapovec neumožnil sanitce jedoucí s výstražným a zvukovým zařízením, aby projela a dostala se k pacientovi...",lidovky.cz,video
https://www.lidovky.cz/novinar.aspx?idnov=3961,Jiří Bigas,"O kultovní logické hře Tetris se často říká, že si ji lze zahrát v podstatě na každém myslitelném počítačovém systému. Důkazem této okřídlené fráze...",lidovky.cz,video
https://www.lidovky.cz/novinar.aspx?idnov=3961,Jiří Bigas,"Jde o promyšlený, ale děsivý trik, za nějž si provozovatel vysloužil značnou kritiku. Ale současně obdiv. Skleněná lávka umístěná vysoko v čínských...",lidovky.cz,video
https://www.lidovky.cz/byl-obeti-xenofobie-dnes-je-vudcem-ultrapravice-pise-bloomberg-o-okamurovi-1us-/video.aspx?c=A171014_082544_ln-video_ele,"Byl obětí xenofobie, dnes je vůdcem ultrapravice, píše Bloomberg o Okamurovi","Americká společnost Bloomberg se v jednom z novějších příspěvků věnuje politikovi Tomiu Okamurovi. Přestože jeho původ je „tak multikulturní, jak jen...",lidovky.cz,video
https://www.lidovky.cz/novinar.aspx?idnov=3961,Jiří Bigas,Každý týden vychází na serveru Lidovky.cz seriál ASI.JATKA. Vždy ve středu se můžete začíst do nového příspěvku od blogerky Do Thu Trang. Co když ale...,lidovky.cz,video
https://www.lidovky.cz/novinar.aspx?idnov=3961,Jiří Bigas,Fenka bernardýna z Jižní Dakoty se zapsala do Guinnessovy knihy rekordů. Pyšní se aktuálně nejdelším psím jazykem na světě. Mochi má jazyk dlouhý...,lidovky.cz,video
https://www.lidovky.cz/novinar.aspx?idnov=3961,Jiří Bigas,V těsné blízkosti nového mostu i husté zástavby demoliční experti s chirurgickou přesností poslali k zemi dosluhující Kosciuszko Bridge v New Yorku...,lidovky.cz,video
https://www.lidovky.cz/novinar.aspx?idnov=3961,Jiří Bigas,Na pláži u španělské obce Calella se objevila ohromná mořská želva. Zvíře bohužel uhynulo a s jeho odstraněním musela pomoci těžká technika. Kožatka...,lidovky.cz,video
https://www.lidovky.cz/video-britsky-princ-harry-byl-okraden-v-primem-prenosu-o-popcorn-phq-/video.aspx?c=A170929_143321_ln-zajimavosti_ele,VIDEO: Princ Harry byl ‚okraden‘ v přímém přenosu. O popcorn,"Malá holčička „kradla“ princi Harrymu popcorn během Invictus Games, her v paralympijském stylu, které vytvořil on sám pro veterány a vojáky. Princ s...",lidovky.cz,video
https://www.lidovky.cz/zeman.aspx,"Zeman vede permanentní kampaň. Server Lidovky.cz zmapoval všechna místa, kam se vypravil","Z nejvyššího úřadu v zemi má prezident Miloš Zeman k lidem nejblíž ze všech ústavních činitelů. Stvořil si vlastní styl komunikace, vede permanentní...",lidovky.cz,specialy
https://www.lidovky.cz/novinar.aspx?idnov=3851,Martin Hampejs,"13 krajů, 75 okresů a 302 měst a vesnic navštívil prezident Miloš Zeman během svého volebního období. Novináři serveru Lidovky.cz detailně...",lidovky.cz,specialy
https://www.lidovky.cz/novinar.aspx?idnov=3851,Martin Hampejs,"Jsou celkem čtyři. Český Krumlov, Mělník, Mladá Boleslav a Nový Jičín. To jsou okresní města, ve kterých se prezident Miloš Zeman ke 30. červnu 2017...",lidovky.cz,specialy
https://www.lidovky.cz/novinar.aspx?idnov=3851,Martin Hampejs,"Bojí se Miloš Zeman Pražanů? Praha je totiž jediný krajský celek, který prezident během svého volebního období nenavštívil. Mezitím stihl objet...",lidovky.cz,specialy
https://www.lidovky.cz/novinar.aspx?idnov=3890,Jan Horák,"Ve vztahu prezidenta Miloše Zemana s občany se kombinují tři veličiny. V první řadě je to osobnostní ustrojení prezidenta, jež z něj činí...",lidovky.cz,specialy
https://www.lidovky.cz/novinar.aspx?idnov=3851,Martin Hampejs,Každý výlet něco stojí. Prezidentovy cesty do regionů hradí již od doby prezidenta Havla krajské úřady a dodnes se na tom i přes protesty hejtmanů...,lidovky.cz,specialy
https://www.lidovky.cz/novinar.aspx?idnov=3926,Luděk Vokáč,"Po stopách vozu, který změnil dějiny českého autoprůmyslu. 1700 kilometrů, 7 dnů, 24 hodin za volantem Škody Favorit.",lidovky.cz,specialy
https://www.lidovky.cz/novinar.aspx?idnov=3833,Marcel Šulek,Přesně před 75 lety obklíčili němečtí vojáci pravoslavných chrám v Resslově ulici v Praze. Uvnitř svatostánku se skrývala sedmička československých...,lidovky.cz,specialy
https://www.lidovky.cz/novinar.aspx?idnov=3556,Ondřej Vyhnanovský,"Reportér LN si jako pracovník u pásu vyzkoušel na vlastní kůži, jak se pracuje v dobrovízském velkoskladu Amazonu.",lidovky.cz,specialy
https://www.lidovky.cz/novinar.aspx?idnov=3833,Marcel Šulek,"Uživatelé Facebooku žijí v zajetí svých sociálních bublin. Sdílí články ze stále stejných zdrojů, a to hlavně takových, které potvrzují jejich vidění...",lidovky.cz,specialy
https://www.lidovky.cz/novinar.aspx?idnov=3833,Marcel Šulek,"Češi žijí v sociálních bublinách, v nichž se navíc navzájem utvrzují o správnosti vidění svého světa. Ukázal to unikátní projekt serveru Lidovky.cz....",lidovky.cz,specialy
https://www.lidovky.cz/novinar.aspx?idnov=2593,Jakub Zelenka,"„V sociálních bublinách jsme žili už dříve, ale moc jsme o tom nevěděli,“ tvrdí odborník na analýzu dat Josef Šlerka. Unikátní výsledky projektu...",lidovky.cz,specialy
https://www.lidovky.cz/novinar.aspx?idnov=3833,Marcel Šulek,"Češi žijí v sociálních bublinách, v nichž se navíc navzájem utvrzují o správnosti vidění svého světa. Ukázal to unikátní projekt serveru Lidovky.cz....",lidovky.cz,specialy
https://www.lidovky.cz/novinar.aspx?idnov=2593,Jakub Zelenka,"Novináři serveru Lidovky.cz prošli 2606 tweetů Jiřího Ovčáčka, které publikoval na účtu @PREZIDENTmluvci do 31. října 2016. Vybrali všechny...",lidovky.cz,specialy
//www.lidovky.cz/havel80.aspx,80 vzpomínek na Václava Havla,"České i zahraniční osobnosti vzpomínají, co pro ně Václav Havel znamenal.",lidovky.cz,specialy
//www.lidovky.cz/pieta-za-padle-vojaky.aspx,Pieta za padlé vojáky,"Vzpomínková stránka na české vojáky, 
kteří zemřeli při nasazení na zahraničních misích",lidovky.cz,specialy
https://zpravy.idnes.cz/peter-pellegrini-byt-afera-financovani-smer-slovensko-roberto-fico-vlada-stret-zajmu-korupce-ip0-/zahranicni.aspx?c=A180404_113857_zahranicni_elka,"Slováci se ptají, kde vzal jejich nový premiér peníze na byt",Nový slovenský premiér Peter Pellegrini ze strany Směr – Sociální demokracie není ve funkci ještě ani dva týdny a už se ve spojitosti s jeho jménem vynořila aféra. Má podobný problém jako bývalý...,idnes.cz,title
https://technet.idnes.cz/sluzba-spoluzaci-cz-konci-2018-dga-/sw_internet.aspx?c=A180404_125301_sw_internet_pka,Končí Spolužáci.cz. V době sociálních sítí a GDPR služba nemohla přežít,"Česká společnost Seznam.cz oznámila, že po 14 letech ukončuje provoz služby Spolužáci.cz. Jako...",idnes.cz,title
https://zpravy.idnes.cz/strelba-utok-youtube-nasim-aghdamova-varovani-policie-p1n-/zahranicni.aspx?c=A180404_093321_zahranicni_linv,"Moje dcera YouTube nenáviděla, policii jsem varoval, řekl otec střelkyně","Jedni utekli, druzí se zabarikádovali. Někteří ani nevěděli, že se něco děje. Při střelbě v...",idnes.cz,title
https://zpravy.idnes.cz/umele-srdce-ikem-lekari-mechanicke-srdecni-podpory-fwt-/domaci.aspx?c=A180404_115416_domaci_jumi,"Byla to moje jediná možnost, říká muž, jenž žije měsíce s umělým srdcem","Už přes čtyři měsíce žije osmašedesátiletý Karel s umělým srdcem. Jediná omezení, která pro...",idnes.cz,title
https://technet.idnes.cz/afrika-rift-propadlina-0bv-/kratke-zpravy.aspx?c=A180404_113304_tec-kratke-zpravy_hege,"Afrika se láme na dvě části, v Keni se propadla dálnice",Africký rift o sobě dává znovu vědět. V Keni protla hlavní silniční tepnu několikametrová...,idnes.cz,title
https://auto.idnes.cz/video-skoda-hluk-operka-hlavy-d2c-/automoto.aspx?c=A180404_133343_automoto_fdv,"Aprílový fór Škody není nereálný, protihlukovou stěnu auta mít mohou","Britské zastoupení Škody vypustilo do světa aprílový žert, který odhalil díru na trhu. Někteří...",idnes.cz,title
https://sport.idnes.cz/radek-stepanek-konec-trener-novak-djokovic-f2l-/tenis.aspx?c=A180404_134649_tenis_rou,Štěpánek už není v týmu Djokoviče. Spolupráce končí po čtyřech měsících,Trenérské angažmá bývalého českého tenisty Radka Štěpánka u srbské hvězdy Novaka Djokoviče...,idnes.cz,title
https://ostrava.idnes.cz/virus-vyzkum-objev-ostravska-univerzita-fgm-/ostrava-zpravy.aspx?c=A180404_135015_ostrava-zpravy_woj,"Ostravští vědci objevili nový virus, byl v parazitovi v těle ploštice","Nečekaný objev učinili vědci z ostravské univerzity při výzkumu leishmaniózy, což je smrtelná...",idnes.cz,title
https://hokej.idnes.cz/hokej-extraliga-vysilani-o2-nova-smlouva-kindernay-f8o-/hokej.aspx?c=A180404_115727_hokej_cig,"Hokej bude od příští sezony i na O2. Dáme mu nový impulz, říká Kindernay",Už nejen na České televizi. Hokejová extraliga bude od příští sezony k vidění i na soukromé O2...,idnes.cz,title
https://revue.idnes.cz/shannen-doherty-testy-rakovina-markery-zvysene-nemoc-ppk-/lidicky.aspx?c=A180404_112301_lidicky_zar,Shannen Doherty má po roce špatné výsledky testů rakoviny,Herečka Shannen Doherty (46) se z remise rakoviny prsu radovala zřejmě předčasně. Loni touto...,idnes.cz,title
https://zpravy.idnes.cz/cestina-pereme-se-s-cestinou-pravopis-diktat-test-cizi-slova-p5m-/domaci.aspx?c=A171230_175414_domaci_mbb,PEREME SE S ČEŠTINOU: Psaní slov přejatých,"Český pravopis je obtížný, ale není nenaučitelný. Připravili jsme pro vás proto seriál,...",idnes.cz,title
https://hobby.idnes.cz/chovatel-hadu-karel-zavadil-veseli-nad-moravou-jedovaty-had-skrtic-1df-/hobby-mazlicci.aspx?c=A180403_114112_hobby-mazlicci_mce,"Čtyřmetrová krajta mě spolkla až po rameno, vypráví chovatel hadů",Jedovaté hady i škrtiče chová Karel Zavadil třicet čtyři let a jen tak s tím nepřestane. Vilku ve Veselí nad Moravou s ním už sdílely...,idnes.cz,title
https://zpravy.idnes.cz/politika-pruzkum-milos-zeman-prezident-spokojenost-obcanu-dustojnost-uradu-cvvm-g2w-/domaci.aspx?c=A180404_115923_domaci_jkk,"Občané si cení, že se s nimi Zeman setkává. Vadí jim, jak reprezentuje",,idnes.cz,title
https://zpravy.idnes.cz/petr-kolar-rozstrel-diplomat-jevgenij-nikulin-hacker-vydani-usa-rusko-diplomaticke-vazby-cesko-iks-/domaci.aspx?c=A180403_131603_domaci_ekl,"Spojenci vnímají Zemana jako popleteného exota, řekl v Rozstřelu Kolář",,idnes.cz,title
https://hokej.idnes.cz/daniel-sedin-henrik-sedin-konec-kariery-d9s-/nhl.aspx?c=A180403_201100_nhl_ald,"Sbohem, dvojčata! Město smutní, loučí se Sedinové. Ceny lístků letí vzhůru",,idnes.cz,title
https://fotbal.idnes.cz/juventus-turin-real-madrid-cristiano-ronaldo-chilena-pdm-/fot_pohary.aspx?c=A180404_121535_fot_pohary_min,"Ronaldo v úžasu. Nejhezčí gól i moment, který v kariéře nezažil",,idnes.cz,title
https://hradec.idnes.cz/lukas-necesany-vrchni-soud-vraceno-duk-/hradec-zpravy.aspx?c=A180404_124631_hradec-zpravy_the,Případ Lukáše Nečesaného se vrátí do Hradce Králové k novému projednání,,idnes.cz,title
https://usti.idnes.cz/zastreleni-roma-v-dodavce-chomutov-soud-usti-obzalovany-vrazda-pw7-/usti-zpravy.aspx?c=A180404_100141_usti-zpravy_vac2,"Jen jsem chránil lidi, hájí se obžalovaný z vraždy Roma v Chomutově",,idnes.cz,title
https://ekonomika.idnes.cz/ministerstvo-financi-alena-schillerova-poplatky-ubytovani-pq9-/ekonomika.aspx?c=A180404_131430_ekonomika_tanc,"Ministerstvo financí chce sloučit poplatky za ubytování, i kvůli Airbnb",,idnes.cz,title
https://ekonomika.idnes.cz/flixbus-autobusy-doprava-spoje-d39-/eko-doprava.aspx?c=A180404_131500_eko-zahranicni_mato,"FlixBus chystá obří expanzi, ještě letos nabídne 100 tisíc nových spojů",,idnes.cz,title
https://kultura.zpravy.idnes.cz/recenze-souboj-pohlavi-emma-stone-steve-carell-fln-/filmvideo.aspx?c=A180404_393102_filmvideo_spm,RECENZE: Ze Souboje pohlaví jedno z nich zmizelo. Zbyl lesbický románek,,idnes.cz,title
https://kultura.zpravy.idnes.cz/ceska-filharmonie-sezona-2018-2019-dkr-/hudba.aspx?c=A180403_120358_hudba_era,Filharmonie odhalila sezonu. Uvítá i Simona Rattlea a Magdalenu Koženou,,idnes.cz,title
https://ona.idnes.cz/trenckot-jarni-kabat-jak-ho-nosit-d4h-/modni-trendy.aspx?c=A180403_133918_modni-trendy_kace,"Pět způsobů, jak nosit trenčkot. Ukážeme vám, jak být za hvězdu",,idnes.cz,title
https://ona.idnes.cz/on-line-rozhovor-a-nemoci-zubu-a-dutiny-ustni-fag-/zdravi.aspx?c=A180403_094049_zdravi_pet,"Lékař: Dědičnost u kazů nehraje žádnou roli, za vše může jen špatná péče",,idnes.cz,title
