link,link_text,txt,site,area
https://usti.idnes.cz/opily-ridic-dalnice-d8-porouchane-auto-policie-ohrozeni-pod-vlivem-navykove-latky-gi4-/usti-zpravy.aspx?c=A181114_154909_usti-zpravy_vac2,"Řidiče na D8 zradilo auto, když přijeli policisté, nadýchal tři promile","Říká se, že opilci mají štěstí. O tom, že to neplatí vždycky, se přesvědčil řidič, který musel...",idnes.cz,krimi
https://pardubice.idnes.cz/nehoda-honicka-linhartice-moravska-trebova-drogy-alkohol-pzx-/pardubice-zpravy.aspx?c=A181114_145237_pardubice-zpravy_elv,"VIDEO: Po zběsilé honičce s policií řidič naboural, byl pod vlivem drog",Ve zběsilou honičku s policií se proměnila jízda dvou mužů na Svitavsku. Řidič za volantem neměl co...,idnes.cz,krimi
https://usti.idnes.cz/psi-tyrani-byt-usti-nad-labem-majitelka-dluznice-majitelka-dluznice-stehovani-straznici-utulek-i2y-/usti-zpravy.aspx?c=A181114_140508_usti-zpravy_vac2,"Dlužnice se odstěhovala z bytu, nechala v něm živořit psy a králíka","Žena, která se kvůli dluhům na nájmu musela vystěhovat z ústeckého bytu, v něm nechala živořit své...",idnes.cz,krimi
https://praha.idnes.cz/museum-kampa-pozar-vytah-hasici-uhasili-f0u-/praha-zpravy.aspx?c=A181114_130449_praha-zpravy_rsr,"V Museu Kampa hořela výtahová šachta, galerií se valil dým",Pražští hasiči zasahovali po poledni u požáru výtahové šachty v Museu Kampa na Malé Straně. Dým...,idnes.cz,krimi
https://praha.idnes.cz/praha-chatar-motyka-anton-gal-rozbil-hlavu-vrchni-soud-p1c-/praha-zpravy.aspx?c=A181114_122111_praha-zpravy_nuc,"Chatař rozbil muži hlavu motykou, za pokus o vraždu dostal deset let",Motykou ťal do hlavy šestapadesátiletý Slovák Anton Gál o čtyřiadvacet let mladšího muže loni v...,idnes.cz,krimi
https://zlin.idnes.cz/lev-cyklista-zdechov-nehoda-policie-urad-ffa-/zlin-zpravy.aspx?c=A181114_113621_zlin-zpravy_ras,"Střet lvice a cyklisty nebyl trestným činem, nehodu policie předala úřadu","Policisté ukončili vyšetřování červnového incidentu, při kterém cyklista na Vsetínsku narazil do...",idnes.cz,krimi
https://olomouc.idnes.cz/kauza-vidkun-ukonceni-vysetrovani-policie-karel-kadlec-ivan-kysely-jiri-rozboril-gjk-/olomouc-zpravy.aspx?c=A181114_439505_olomouc-zpravy_stk,Policie ukončila po třech letech vyšetřování kauzy Vidkun,Detektivové z ostravské expozitury Národní centrály proti organizovanému zločinu uzavřeli po třech...,idnes.cz,krimi
https://praha.idnes.cz/praha-kymr-lumir-zneuzivani-zaku-studentu-soud-ftz-/praha-zpravy.aspx?c=A181114_110229_praha-zpravy_nuc,"S žáky spal nahý a masturboval s nimi, soud řediteli potvrdil tříletý trest",Bývalý ředitel pražské Střední školy elektrotechniky a strojírenství Lumír Kymr si odpyká tři roky...,idnes.cz,krimi
https://olomouc.idnes.cz/prostejov-d46-nehoda-srazka-kamionu-dodavka-vysypany-naklad-uzavirka-1jq-/olomouc-zpravy.aspx?c=A181114_092948_olomouc-zpravy_stk,"Po srážce na D46 hořely dva kamiony, hasiče zaměstnalo překládání kvasnic",Na dálnici D46 v Prostějově v noci naboural jeden kamion zezadu do druhého a oba začaly hořet. Do...,idnes.cz,krimi
https://plzen.idnes.cz/pozar-plzen-ubytovna-kollarova-ulice-hasici-f30-/plzen-zpravy.aspx?c=A181102_437059_plzen-zpravy_vb,"Požár z chodby ubytovny přeskočil do bytu, hasiči vyvedli tři muže a psa",V bytovém domě v plzeňské Kollárově ulici v úterý večer vypukl požár. Ten vznikl na schodišti a...,idnes.cz,krimi
https://zlin.idnes.cz/recidivista-vezeni-nastup-vyhybani-drogy-pervitin-zlinsko-pqv-/zlin-zpravy.aspx?c=A181114_095144_zlin-zpravy_ras,"Muž nenastoupil trest za výrobu drog. Když pro něj přišli, vařil pervitin","Přímo při vaření pervitinu dopadli policisté muže ze Zlínska, který se vyhýbal nástupu do vězení....",idnes.cz,krimi
https://praha.idnes.cz/praha-zlodej-kradez-policie-vyhrozoval-nozem-fo0-/praha-zpravy.aspx?c=A181114_093854_praha-zpravy_nuc,VIDEO: Zloděj vzal na prodavače nůž a ukradl telefon za třicet tisíc,Neznámý muž v obchodním centru v Praze na Pankráci s nožem v ruce ukradl telefon za několik desítek...,idnes.cz,krimi
https://budejovice.idnes.cz/obvineni-lety-pamatnik-romove-napis-policie-fmn-/budejovice-zpravy.aspx?c=A181113_171948_budejovice-zpravy_pp,Kvůli urážlivým nápisům u památníku v Letech stíhá policie dva muže,"Policie obvinila dva muže, kteří letos na jaře v areálu památníku v Letech u Písku umístili tabule...",idnes.cz,krimi
https://liberec.idnes.cz/vrazda-bezdomovce-trest-soud-28-let-dtp-/liberec-zpravy.aspx?c=A181113_151420_liberec-zpravy_tm,Za dvě výjimečně brutální vraždy dostal bezdomovec 28 let vězení,Za dvě vraždy lidí bez domova v České Lípě dnes potrestal soud v Liberci třiadvacetiletého...,idnes.cz,krimi
https://plzen.idnes.cz/nehoda-cyklista-plzensko-srazil-auto-autobus-fol-/plzen-zpravy.aspx?c=A181113_133500_plzen-zpravy_vb,"Cyklistu srazilo auto a odhodilo ho na autobus, muž v nemocnici zemřel","Nehoda s tragickými následky se stala v pondělí večer u Spáleného Poříčí na Plzeňsku. Do cyklisty,...",idnes.cz,krimi
https://praha.idnes.cz/praha-falesny-prukaz-policie-vyber-penez-zahranici-fx3-/praha-zpravy.aspx?c=A181113_142530_praha-zpravy_nuc,Muž vybral v cizině na falešnou občanku statisíce z účtu pražské firmy,Neznámý muž díky padělanému občanskému průkazu vybral v několika bankách v zahraničí přes půl...,idnes.cz,krimi
https://jihlava.idnes.cz/nehoda-policie-vyzva-svedci-vlcatin-trebic-silnice-vybrzdeni-sanita-vysocina-1xw-/jihlava-zpravy.aspx?c=A181113_141912_jihlava-zpravy_mv,"Sanitka zezadu narazila do auta, policie zjišťuje, zda kvůli vybržďování","Okolnosti nehody, která se stala v pondělí ráno u Vlčatína na Třebíčsku, zjišťuje policie. Na...",idnes.cz,krimi
https://kultura.zpravy.idnes.cz/michael-buble-love-turne-2019-ddg-/hudba.aspx?c=A181116_123102_hudba_vha,Po pěti letech se příští rok v září vrátí kanadský zpěvák Michael Bublé,"Michael Bublé vydal aktuálně novou desku nazvanou Love, ale označovanou pouze červeným srdíčkem....",idnes.cz,kultura
https://kultura.zpravy.idnes.cz/lucie-evolucie-recenze-071-/hudba.aspx?c=A181116_111942_hudba_vha,RECENZE: EvoLucie noci upije. Návrat Lucie není na jeden poslech,"Konečně jsme se dočkali. Album EvoLucie vydala kapela, která si stále drží status jedné z...",idnes.cz,kultura
https://kultura.zpravy.idnes.cz/jan-zizka-film-michael-caine-dp3-/filmvideo.aspx?c=A181116_091853_filmvideo_ts,"Jak to, že jsou Češi tak vysocí? divil se Michael Caine při natáčení Žižky",Oscarový herec Michael Caine si už odehrál svůj part ve snímku Jan Žižka. V chystaném filmu Petra...,idnes.cz,kultura
https://kultura.zpravy.idnes.cz/lety-mimo-civilizacni-klip-dd0-/hudba.aspx?c=A181116_004547_hudba_vha,"VIDEO: Lety Mimo představují Civilizační, ochutnávku z chystané desky","Kapela Lety Mimo před prázdninami oznámila, že nahrává nové studiové album. Bude se jmenovat...",idnes.cz,kultura
https://kultura.zpravy.idnes.cz/balon-film-recenze-038-/filmvideo.aspx?c=A181115_151541_filmvideo_ts,"RECENZE: Maminko, nebudou střílet? Za svobodou je nese Balón","Příběh, který vypráví novinka kin Balón, se skutečně stal. V roce 1979 se dvě východoněmecké rodiny...",idnes.cz,kultura
https://kultura.zpravy.idnes.cz/hudebni-ceny-idnes-cz-2018-0sg-/hudba.aspx?c=A181115_111946_hudba_vha,"Hudební ceny iDNES.cz: vyberte nejoblíbenější zpěvačku, zpěváka a kapelu","Anketa popularity Český slavík se letos neuskuteční. I nadále však chceme vědět, kdo se těší přízni...",idnes.cz,kultura
https://kultura.zpravy.idnes.cz/czech-press-photo-2018-nominace-djb-/vytvarne-umeni.aspx?c=A181017_095821_vytvarne-umeni_vha,Prohlédněte si snímky nominované v prestižní soutěži Czech Press Photo,"DoporučujemeDvacátý čtvrtý ročník soutěže Czech Press Photo už zná fotografie, které nejvíce zaujaly mezinárodní...",idnes.cz,kultura
https://olomouc.idnes.cz/beatles-balet-olomouc-moravske-divadlo-robert-balogh-prava-osa-londyn-jesus-christ-superstar-karel-ild-/olomouc-zpravy.aspx?c=A181116_439974_olomouc-zpravy_mip,"Help! Balet o Beatles se po premiéře ruší, olomoucké divadlo shání práva",Už třikrát za posledních deset let zrušilo Moravské divadlo Olomouc představení kvůli nevyjasněným...,idnes.cz,kultura
https://kultura.zpravy.idnes.cz/rolf-hoppe-tri-orisky-pro-popelku-herec-fcy-/filmvideo.aspx?c=A181115_210951_filmvideo_hm1,"V 87 letech zemřel herec Rolf Hoppe, král z Tří oříšků pro Popelku",Ve věku 87 let zemřel německý filmový a divadelní herec Rolf Hoppe. Divákům v Česku je znám díky...,idnes.cz,kultura
https://kultura.zpravy.idnes.cz/recenze-monkey-business-bad-time-for-gentlemen-fld-/hudba.aspx?c=A181115_105104_hudba_ts,"RECENZE: Hudba je lepší než sex, zpívají stále silní Monkey Business","Albová novinka kapely Monkey Business nabízí trumfy jako vždy – náročnější, ale přitom chytlavou...",idnes.cz,kultura
https://kultura.zpravy.idnes.cz/trailer-asterix-a-tajemstvi-kouzelneho-lektvaru-fbq-/filmvideo.aspx?c=A181115_151114_filmvideo_spm,VIDEO: Do vánočních kin míří Asterix a tajemství kouzelného lektvaru,Čtyři roky po snímku Asterix: Sídliště bohů přicházejí stejní tvůrci s pokračováním komiksové série...,idnes.cz,kultura
https://kultura.zpravy.idnes.cz/lukas-pavlasek-za-scenou-0xf-/filmvideo.aspx?c=A181114_120102_filmvideo_kiz,Jak se Lukáš Pavlásek dostal na policejní stanici? Odpoví Za scénou,"Lukáš Pavlásek vydal sbírku básní Racek a moře, kterou navíc doprovodil vlastními fotografiemi z...",idnes.cz,kultura
https://kultura.zpravy.idnes.cz/beatles-hudebni-skupina-kviz-zajimavosti-fgj-/hudba.aspx?c=A181022_144715_hudba_jan,KVÍZ: Jak znáte hudební skupinu Beatles?,"V těchto dnech uplynulo půl století od vydání legendárního Bílého alba od Beatles. Vyzkoušejte si,...",idnes.cz,kultura
https://kultura.zpravy.idnes.cz/do-kina-fantasticka-zvirata-berlusconi-d9e-/filmvideo.aspx?c=A181112_163153_filmvideo_spm,DO KINA: Proti Fantastickým zvířatům stojí fantastický Berlusconi,Z osmi novinek se jedna těší na plné sály dětí a jedna na ctitele filmového umění. V prvním případě...,idnes.cz,kultura
https://kultura.zpravy.idnes.cz/kvety-ym-garaz-klip-0ow-/hudba.aspx?c=A181115_004815_hudba_vha,VIDEO: Květy představují netradiční country píseň o opuštěných garážích,Členové kapely Květy natočili pod hlavičkou projektu YM tři sólové desky tří různých žánrů. Country...,idnes.cz,kultura
https://kultura.zpravy.idnes.cz/petr-soukup-basne-aforismy-sbirka-nova-instagram-antidepresiva-p8g-/literatura.aspx?c=A181114_131517_literatura_kiz,O lásce už píše bez antidepresiv. Soukup předvede Erekci srdce,"Tu aforismus, tu báseň. Petr Soukup svou literární tvorbu proslavil na Instagramu. Nová sbírka...",idnes.cz,kultura
https://kultura.zpravy.idnes.cz/masaryk-v-americe-prague-shakespeare-company-karel-hermanek-pqh-/divadlo.aspx?c=A181114_142334_divadlo_ts,VIDEO: Karel Heřmánek jako Karel Čapek provede Masaryka nejen po Americe,Ku příležitosti stého výročí založení ČSR připravil anglickojazyčný soubor Prague Shakespeare...,idnes.cz,kultura
https://kultura.zpravy.idnes.cz/fantasticka-zvirata-2-grindelwaldovy-zlociny-recenze-pdh-/filmvideo.aspx?c=A181114_102817_filmvideo_ts,"RECENZE: Gestapák je Deppova satisfakce, Fantastických zvířat ale ubývá","Méně zvířat a humoru, zato více postav i plamenů a místo bitvy, jež se odkládá na příště,...",idnes.cz,kultura
https://kultura.zpravy.idnes.cz/galerie-tancici-dum-vanoce-za-sociku-retro-fib-/vytvarne-umeni.aspx?c=A181113_162920_vytvarne-umeni_kiz,OBRAZEM: Vánoce za socialismu. Znovu se hlásí céčka i papírové řetězy,Trend retro výstav pokračuje. Galerie Tančící dům od středy zve návštěvníky na výlet do vánočního...,idnes.cz,kultura
https://kultura.zpravy.idnes.cz/benatska-s-impulsem-2019-karel-gott-dqf-/hudba.aspx?c=A181114_152742_hudba_vha,Karel Gott zahájí příští rok v červenci festival Benátská! s Impulsem,Úvodní den přehlídky Benátská! s Impulsem bude patřit oslavě osmdesátých narozenin Karla Gotta....,idnes.cz,kultura
https://kultura.zpravy.idnes.cz/trailer-doktor-martin-06p-/filmvideo.aspx?c=A181114_102940_filmvideo_spm,VIDEO: Stoletá vražda. Do kin jde Doktor Martin: Záhada v Beskydech,"Hodně staré kosti, vypadá to na stoletou vraždu, zazní v úvodu snímku Doktor Martin: Záhada v...",idnes.cz,kultura
https://kultura.zpravy.idnes.cz/gin-game-vrsovicke-divadlo-mana-zuzana-kronerova-fbi-/divadlo.aspx?c=A181114_093805_divadlo_ts,"Gin Game mladým naznačí, že i oni zestárnou, věří Zuzana Kronerová",Jedno neobvyklé setkání v domově důchodců a vášeň nejen pro karetní hru nabízí novinka Vršovického...,idnes.cz,kultura
https://kultura.zpravy.idnes.cz/lucie-turne-evolucie-ostrava-recenze-dwo-/hudba.aspx?c=A181114_011032_hudba_vha,"RECENZE: Sázka na přímočarost vyšla, turné kapely Lucie je zážitek",Kapela Lucie v úterý v Ostravar Aréně odstartovala koncertní šňůru ke své aktuální comebackové...,idnes.cz,kultura
https://budejovice.idnes.cz/husitska-epopej-vondruska-pisek-dou-/budejovice-zpravy.aspx?c=A181114_439438_budejovice-zpravy_epkub,V Písku zněl husitský chorál. Vondruška představil poslední díl epopeje,Za zvuku středověké hudby vstoupil v úterý do života poslední díl Husitské epopeje Vlastimila...,idnes.cz,kultura
https://kultura.zpravy.idnes.cz/prazske-jaro-2019-program-0sc-/hudba.aspx?c=A181113_152313_hudba_era,"Pražské jaro zahájí orchestr, který po válce utvořili vysídlení Němci",Pražské jaro 2019 otevřou Bamberští symfonikové se svým českým šéfem Jakubem Hrůšou. Jejich...,idnes.cz,kultura
https://kultura.zpravy.idnes.cz/prazsky-festival-nemeckeho-jazyka-dtf-/divadlo.aspx?c=A181113_135408_divadlo_ts,Opravdu konec legrace? Zbytek listopadu ovládnou festivaly všech žánrů,"Německé divadlo, blues, vážná hudba i outdoorové filmy. Druhou polovinu listopadu si tradičně...",idnes.cz,kultura
https://kultura.zpravy.idnes.cz/vanoce-ct-popelka-kouzelnik-zito-d4b-/filmvideo.aspx?c=A181113_131204_filmvideo_spm,O Vánocích se k Popelce přidá premiérová pohádka Kouzelník Žito,"Česká televize odvysílá o Vánocích novou pohádku s Jiřinou Bohdalovou Kouzelník Žito, klasické Tři...",idnes.cz,kultura
https://kultura.zpravy.idnes.cz/o2-arena-koncert-trend-ceske-kapely-muzikanti-fnt-/hudba.aspx?c=A181113_125347_hudba_ts,Dobudeme tu obří O2 arenu! Velký sen má stále více zdejších muzikantů,"Kabát, Lucie, Kryštof, Gott nebo Vondráčková. Největší hokejová hala dosud lákala ke koncertům...",idnes.cz,kultura
https://kultura.zpravy.idnes.cz/lucie-evolucie-zacatek-turne-reportaz-dhq-/hudba.aspx?c=A181113_103716_hudba_ts,"Nejlepší, kterou znám? Kapela Lucie stojí znovu na startu",Kapela Lucie je před startem svého turné v úterý večer v ostravské Ostravar Aréně v dobré náladě....,idnes.cz,kultura
https://kultura.zpravy.idnes.cz/trailer-toy-story-4-pribeh-hracek-d44-/filmvideo.aspx?c=A181113_090754_filmvideo_spm,VIDEO: Jsou zpět. Svět baví první ukázka Toy Story 4: Příběh hraček,"Animovaný snímek Toy Story 4: Příběh hraček, který do našich kin přijde 8. srpna 2019, zveřejnil...",idnes.cz,kultura
https://kultura.zpravy.idnes.cz/husitska-epopej-vlastimil-vondruska-dsh-/literatura.aspx?c=A181109_121242_literatura_ts,Vondruška mezi husity posedmé. Tím krásně neideologická sága končí,Kéž Kristus chrání navěky tuto krásnou zem a její statečný lid! Tak ukončil Vlastimil Vondruška...,idnes.cz,kultura
https://kultura.zpravy.idnes.cz/svedkove-putinovi-recenze-d0l-/filmvideo.aspx?c=A181112_151852_filmvideo_ts,RECENZE: Spíš o Jelcinovi. Nač Svědkové Putinovi čekali skoro dvacet let?,"Film Svědkové Putinovi má tři vady: je podjatý, je starý a v rozporu s názvem více než o Vladimiru...",idnes.cz,kultura
https://kultura.zpravy.idnes.cz/zemrel-stan-lee-marvel-06y-/filmvideo.aspx?c=A181112_201642_filmvideo_spm,"Zemřel Stan Lee, spolutvůrce komiksového světa značky Marvel","Ve věku 95 let zemřela legenda komiksu Stan Lee, který byl spolutvůrcem proslulé značky Marvel. O...",idnes.cz,kultura
https://kultura.zpravy.idnes.cz/michal-david-open-air-recenze-dir-/hudba.aspx?c=A181109_133001_hudba_vha,"RECENZE: Michal David vydal letní živák, příliš v něm tlačí na sílu",Ocenění Michala Davida medailí Za zásluhy vyvolalo reakce od pozdvižených obočí po nevybíravé...,idnes.cz,kultura
https://kultura.zpravy.idnes.cz/zpevacka-dido-koncert-forum-karlin-dtb-/hudba.aspx?c=A181112_145630_hudba_ts,Vrací se Dido. Slavná zpěvačka nultých let zahraje poprvé v Česku,"Britská zpěvačka Dido po patnácti letech vyjíždí na světové turné, které poprvé v její kariéře...",idnes.cz,kultura
https://kultura.zpravy.idnes.cz/zebrik-kin-mercury-polednakova-d3c-/filmvideo.aspx?c=A181112_140837_filmvideo_spm,Stotisícový Freddie Mercury porazil v kinech i vánoční Poledňákovou,Příběh Freddieho Mercuryho a kapely Queen nazvaný Bohemian Rhapsody vyhrál i druhý víkend v našich...,idnes.cz,kultura
https://kultura.zpravy.idnes.cz/michael-kluch-freddie-mercury-queen-za-scenou-far-/divadlo.aspx?c=A181108_142949_divadlo_ts,"Revival je show s obtloustlým chlapíkem, řekl představitel Mercuryho Za scénou","Freddie Mercury je asi má životní role, řekl v pořadu Za scénou herec a zpěvák Michael Kluch, který...",idnes.cz,kultura
https://ekonomika.idnes.cz/agrofert-mafra-bauer-media-casopis-vydavaelstvi-fud-/ekonomika.aspx?c=A181116_125728_ekonomika_mato,Antimonopolní úřad povolil Agrofertu koupit vydavatelství Bauer Media,Holding Agrofert může prostřednictvím své mediální společnosti Mafra koupit vydavatelství...,idnes.cz,ekonomika
https://ekonomika.idnes.cz/plyn-zapach-cr-topeni-0tg-/ekonomika.aspx?c=A181116_121906_ekonomika_mato,V Česku bude víc cítit plyn. Řízená akce má odhalit úniky,"V Česku bude příští týden více zapáchat zemní plyn, aby odběratelé mohli snadněji na začátku topné...",idnes.cz,ekonomika
https://ekonomika.idnes.cz/poldi-hut-krach-drazba-06g-/ekonomika.aspx?c=A181116_102200_ekonomika_mato,"Dražba kladenské Poldi se neuskuteční, žádný zájemce nesložil jistotu","Dražba zkrachovalé kladenské společnosti Poldi se dnes neuskuteční, žádný zájemce nesložil jistotu...",idnes.cz,ekonomika
https://ekonomika.idnes.cz/doprava-prejezd-zeleznice-vystavba-dbg-/eko-doprava.aspx?c=A181115_191522_eko-doprava_mato,"Obce brání rušení vlakových přejezdů, ministerstvo jim chce vystavit stopku",Resortu dopravy došla trpělivost při vyjednávání s obcemi o rušení železničních přejezdů. Těch je v...,idnes.cz,ekonomika
https://ekonomika.idnes.cz/slevomat-zanzo-cestovni-kancelar-exotika-vstup-na-trh-p1o-/ekonomika.aspx?c=A181115_182505_ekonomika_fih,"Slevomat rozjel cestovku do exotiky, do tří let chce utržit miliardu","Portál Slevomat založil vlastní cestovní kancelář CK Zanzo, která od listopadu prodává zájezdy do...",idnes.cz,ekonomika
https://ekonomika.idnes.cz/facebook-diskreditace-soros-konkurence-pr-agentura-rusko-p30-/ekoakcie.aspx?c=A181115_161934_ekoakcie_svob,"Facebook si údajně objednal nenávistné články, měl tak odvádět pozornost","Sociální síť Facebook si podle deníku The New York Times najala PR firmu, která měla za úkol pomocí...",idnes.cz,ekonomika
https://wiki.idnes.cz/oteviraci-doba-o-svatcich-0hx-/byznys.aspx?klic=456717,Otevírací doba obchodů na svátek 17. listopadu a o Vánocích,"DoporučujemeZákon o prodejní době v maloobchodě a velkoobchodě nařizuje, že obchody s plochou nad 200 m² musí mít...",idnes.cz,ekonomika
https://ekonomika.idnes.cz/jist-mene-masa-a-zivocisnych-vyrobku-se-vyplati-ftk-/eko-zahranicni.aspx?c=A181112_112611_eko-zahranicni_nio,Vyplatí se vyměnit steak za fazole? Ušetří jednotlivec i celý systém,"Různé studie tvrdí, že z pohledu nákladů na výrobu potravin je vegetariánství a veganství...",idnes.cz,ekonomika
https://ekonomika.idnes.cz/hotel-sanghaj-cina-lom-luxus-dg1-/eko-zahranicni.aspx?c=A181115_161506_eko-zahranicni_mato,"U Šanghaje otevírají unikátní hotel, postavili ho v zatopeném lomu",Nedaleko čínské finanční metropole Šanghaje ve čtvrtek slavnostně otevřeli pětihvězdičkový hotel....,idnes.cz,ekonomika
https://ekonomika.idnes.cz/zeleznicni-doprava-eu-evropsky-parlament-fgy-/eko-doprava.aspx?c=A181115_161106_eko-doprava_tanc,EU mění pravidla v železniční dopravě. Uleví zdravotně znevýhodněným,Nová pravidla pro cestování na železnici schválili ve čtvrtek ve Štrasburku poslanci a poslankyně...,idnes.cz,ekonomika
https://ekonomika.idnes.cz/export-koruna-asociace-exporteru-dlv-/ekonomika.aspx?c=A181115_140512_ekonomika_tanc,Český export letos rekordně vzroste. Pomohla mu slabší koruna,"Vývoz zboží z České republiky letos vzroste o dvě procenta na nový rekord 4,3 bilionu korun. A to i...",idnes.cz,ekonomika
https://ekonomika.idnes.cz/beaujolais-nouveau-svatomartinske-vino-francie-fud-/eko-zahranicni.aspx?c=A181115_122914_eko-zahranicni_tanc,Svatomartinské po francouzsku. V Lyonu narazili sudy Beaujolais Nouveau,Svatomartinským vínem listopadové oslavy nekončí. Čtvrtkem totiž započal prodej známého...,idnes.cz,ekonomika
https://ekonomika.idnes.cz/med-falesny-farma-vcelarstvi-thomayer-natu-fk2-/ekonomika.aspx?c=A181115_124508_ekonomika_fih,"Med z biofarmy měl být z EU, rozbor ukázal na zámoří",Inspektoři Státní zemědělské a potravinářské inspekce nařídili stáhnout z regálů med od rodinné...,idnes.cz,ekonomika
https://plzen.idnes.cz/zeleznicni-tunel-plzen-ejpovice-vlak-zprovozneni-tubus-kysice-pw3-/plzen-zpravy.aspx?c=A181115_145124_plzen-zpravy_vb,"Nový tunel u Plzně otestoval nákladní vlak, v pátek jím projedou i cestující","Nákladní vlak projel v půl páté odpoledne jako první novým železničním tunelem u Plzně, který je...",idnes.cz,ekonomika
https://ekonomika.idnes.cz/black-friday-vanocni-sleva-cerny-patek-odbornik-f5g-/ekonomika.aspx?c=A181115_103558_ekonomika_svob,"Obchody si akcemi Black Friday utahují smyčku kolem krku, říká odborník",Od pondělí 19. listopadu začnou u některých obchodníků výprodeje na tzv. Černý pátek. Řada e-shopů...,idnes.cz,ekonomika
https://brno.idnes.cz/dotace-sibenicni-termin-zemedelci-sucho-voda-zavlaha-jizni-morava-1ci-/brno-zpravy.aspx?c=A181115_439685_brno-zpravy_mos1,Dotace na závlahy jsou k ničemu. Zemědělci by se utopili v papírech,"Ministerstvo chce rozdat miliony na závlahy, aby měli zemědělci zajištěnou vodu na polích během...",idnes.cz,ekonomika
https://ekonomika.idnes.cz/kunert-unicrefit-odchazi-0ht-/ekoakcie.aspx?c=A181115_110900_ekoakcie_fih,Nestor českého bankovnictví odchází. Kunert šéfuje UniCredit 30 let,"Z čela banky UniCredit odchází Jiří Kunert, jeden z nejznámějších manažerů, kteří formovali...",idnes.cz,ekonomika
https://ekonomika.idnes.cz/nigerie-ohlasovani-zmetku-hotline-linka-fdy-/ekonomika.aspx?c=A181115_092626_ekonomika_fih,"Nigérie zavedla linku na ohlašování zmetků, vyvolalo to posměch",Nigerijci mohou nově telefonicky nahlásit kontrolnímu úřadu SON produkty nevalné kvality. Jenomže...,idnes.cz,ekonomika
https://ekonomika.idnes.cz/uber-vysledky-ipo-burza-ztrata-dmu-/ekoakcie.aspx?c=A181115_083258_ekoakcie_fih,"Uber se před vstupem na burzu potřebuje ukázat, prodělal však miliardu","Globální technologická společnost Uber, známá ve světě svou taxi aplikací, ve třetím čtvrtletí...",idnes.cz,ekonomika
https://ostrava.idnes.cz/spor-o-miliardovy-dluh-okd-bude-pokracovat-v-breznu-fh1-/ostrava-zpravy.aspx?c=A181115_439729_ostrava-zpravy_jog,Soudní spor o miliardový dluh OKD bude pokračovat v březnu,"Právníci společností OKD, NWR a Citibank už znají datum pokračování soudního jednání o pravosti...",idnes.cz,ekonomika
https://ekonomika.idnes.cz/drazba-sotheby-s-klenoty-marie-antoinetta-fi4-/eko-zahranicni.aspx?c=A181114_113643_eko-zahranicni_fih,Šperky Marie Antoinetty prošly dražbou. Prodaly se za rekordní částku,"Přívěsek s velkou perlou, který kdysi patřil francouzské královně Marii Antoinettě, byl vydražen v...",idnes.cz,ekonomika
https://ekonomika.idnes.cz/ministerstvo-prace-marksova-tendr-it-system-davky-f8q-/ekonomika.aspx?c=A181114_200059_ekonomika_mato,"Předražené IT systémy ministerstva práce, „sleva“ nakonec nebyla zadarmo",Za ministryně práce Michaely Marksové proběhly tendry na systémy na výplatu dávek za stovky...,idnes.cz,ekonomika
https://ekonomika.idnes.cz/analyza-firmy-roboti-it-automatizace-dwq-/ekonomika.aspx?c=A181114_202500_ekonomika_mato,ANALÝZA: Firmy se připravují na horší časy. Zvyšují investice do robotů,"Statistici ve středu zveřejnili čerstvé údaje, jak se ve třetím čtvrtletí dařilo ekonomice v...",idnes.cz,ekonomika
https://hradec.idnes.cz/vysetrovani-policie-mesto-pec-pod-snezkou-trestni-oznameni-dotace-parkovaci-dum-velka-upa-propojeni-iu5-/hradec-zpravy.aspx?c=A181115_125353_hradec-zpravy_tuu,Firma couvá od stavby lanovek kvůli vyšetřování a nejistým dotacím v Peci,Společnost Mega Plus se vzdala chystaného projektu na lyžařské propojení Velké Úpy a Pece pod...,idnes.cz,ekonomika
