link,link_text,txt,site,area
https://www.lidovky.cz/hra-o-truny-nebo-hra-o-svatby-jon-snih-se-zasnoubil-s-ygritte-pre-/lide.aspx?c=A170929_094420_lide_jto,Hra o trůny nebo Hra o svatbu? ‚Jon Sníh‘ se v reálném životě zasnoubil s ‚Ygritte‘,Herci Kit Harington a Rose Leslieová se zasnoubili. K oznámení došlo stylově v deníku The Times of London.  V populárním seriálu Hra o trůny také...,lidovky.cz,lide
https://www.lidovky.cz/stulik-konecne-patek-o-vikendu-jsem-jak-utrzeny-ze-retezu-p3i-/lide.aspx?c=A170927_125750_lide_ape,ŠTULÍK: Konečně pátek? O víkendu jsem jak utržený ze řetězu,"Mám typické cirkadiální a cirkatýdenní rytmy. Z toho, co mě baví mimo medicínu, nestihnu přes týden prakticky nic, protože vstávám brzy, většinou...",lidovky.cz,lide
http://www.lidovky.cz/novinar.aspx?idnov=3849,Marie Frajtová,"Šéfkuchař pražské michelinské restaurace La Degustation Bohême Bourgeoise Oldřich Sahajdák o vrcholovém sportu v kuchyni, o tom, jak se dá...",lidovky.cz,lide
https://www.lidovky.cz/zemrel-hugh-hefner-zakladatel-casopisu-playboy-bylo-mu-91-let-prz-/lide.aspx?c=A170928_070406_lide_ELE,"Zemřel Hugh Hefner, zakladatel časopisu Playboy. Bylo mu 91 let",Zakladatel legendárního amerického pánského magazínu Playboy Hugh Hefner ve středu ve věku 91 let zemřel. Oznámila to společnost Playboy Enterprises...,lidovky.cz,lide
http://www.lidovky.cz/novinar.aspx?idnov=705,Alena Plavcová,Redaktorka magazínu Pátek LN Alena Plavcová vzpomíná na svá setkání a poslední rozhovor s hercem Janem Třískou. Čím jej dokázala rozčílit a proč...,lidovky.cz,lide
https://www.lidovky.cz/zemrela-ocenovana-cembalistka-zuzana-ruzickova-bylo-ji-90-let-p5r-/lide.aspx?c=A170927_154137_lide_ELE,Zemřela oceňovaná cembalistka Zuzana Růžičková. Bylo jí 90 let,"Ve věku 90 let ve středu zemřela v nemocnici v Praze po krátké vážné nemoci oceňovaná cembalistka a hudební pedagožka Zuzana Růžičková, jak oznámil...",lidovky.cz,lide
https://www.lidovky.cz/asi-jatka-perlidicky-holka-co-se-jmenuje-jak-nebe-a-bylo-ji-prano-pv4-/lide.aspx?c=A170921_145613_lide_ape,"ASI.JATKA: Perlidičky - Holka, co se jmenuje jak nebe a bylo jí přáno","Hai Van. Když vyslovíte její jméno, zní to jako Heaven. Nebe. Tak jí tak občas i říkáme. Kdysi jsme si říkali i Datel Woody, protože má velmi...",lidovky.cz,lide
http://www.lidovky.cz/novinar.aspx?idnov=2431,Alena Pecháčková,"Posledních devět let spolu trávili skoro všechen volný čas, naposledy se viděli před jedenácti dny, kdy se stav Květy Failové začal zhoršovat. „Už...",lidovky.cz,lide
https://www.lidovky.cz/princ-harry-se-na-verejnosti-poprve-oficialne-predstavil-s-pritelkyni-meghan-markleovou-g76-/lide.aspx?c=A170925_204242_lide_ELE,Princ Harry se na veřejnosti poprvé oficiálně představil s přítelkyní Meghan Markleovou,"Britský princ Harry se poprvé na veřejnosti představil se svou přítelkyní, americkou herečkou Meghan Markleovou. Server BBC inforomoval o tom, že je...",lidovky.cz,lide
http://www.lidovky.cz/novinar.aspx?idnov=493,Jana Machalická,"Oduševnělá krása Květu Fialovou předurčila k rolím žen vznešených, osudových a nedostupných. Měla přímo patent na šlechtičny a nebyla to jen kněžna z...",lidovky.cz,lide
https://www.lidovky.cz/zivot-si-predstavuji-jako-vlnu-na-mori-rikavala-kveta-fialova-pu9-/lide.aspx?c=A170926_094012_lide_mber,"Fialová nežehrala na osud, vše přijímala s pokorou a s otevřenou náručí","Jejím krédem bylo nežehrat na osud a vše přijímat s pokorou a s otevřenou náručí, i trápení a překážky, protože to člověka posiluje. Herečku Květu...",lidovky.cz,lide
http://www.lidovky.cz/novinar.aspx?idnov=705,Alena Plavcová,"V úterý 26. září zemřela po dlouhé nemoci herečka Květa Fialová, bylo jí 88 let. Server Lidovky.cz přináší velký rozhovor, který Fialová poskytla...",lidovky.cz,lide
https://www.lidovky.cz/zemrela-herecka-kveta-fialova-bylo-ji-osmdesat-osm-let-ppd-/lide.aspx?c=A170926_083315_lide_mber,Zemřela herečka Květa Fialová. Bylo jí osmdesát osm let,Ve věku 88 let v úterý ráno po dlouhé nemoci zemřela herečka Květa Fialová. Sdělil herecký kolega a přítel zesnulé Josef Kubáník. Fialová má za sebou...,lidovky.cz,lide
https://www.lidovky.cz/mladi-a-neklidni-lisky-v-pousti-neopoustim-f25-/lide.aspx?c=A170925_095432_lide_ape,MLADÍ A NEKLIDNÍ: Lišky v poušti neopouštím,"Někdy si říkám, jak je život jednoduchý, hned potom mě napadne, jak je těžký a pak zase jednoduchý. Závidím lidem, kteří to tak nemají, ale prý to...",lidovky.cz,lide
http://www.lidovky.cz/novinar.aspx?idnov=3961,Jiří Bigas,Fenka bernardýna z Jižní Dakoty se zapsala do Guinnessovy knihy rekordů. Pyšní se aktuálně nejdelším psím jazykem na světě. Mochi má jazyk dlouhý...,lidovky.cz,video
http://www.lidovky.cz/novinar.aspx?idnov=3961,Jiří Bigas,V těsné blízkosti nového mostu i husté zástavby demoliční experti s chirurgickou přesností poslali k zemi dosluhující Kosciuszko Bridge v New Yorku...,lidovky.cz,video
http://www.lidovky.cz/novinar.aspx?idnov=3961,Jiří Bigas,Na pláži u španělské obce Calella se objevila ohromná mořská želva. Zvíře bohužel uhynulo a s jeho odstraněním musela pomoci těžká technika. Kožatka...,lidovky.cz,video
https://www.lidovky.cz/video-britsky-princ-harry-byl-okraden-v-primem-prenosu-o-popcorn-phq-/video.aspx?c=A170929_143321_ln-zajimavosti_ele,VIDEO: Princ Harry byl ‚okraden‘ v přímém přenosu. O popcorn,"Malá holčička „kradla“ princi Harrymu popcorn během Invictus Games, her v paralympijském stylu, které vytvořil on sám pro veterány a vojáky. Princ s...",lidovky.cz,video
http://www.lidovky.cz/novinar.aspx?idnov=3961,Jiří Bigas,"Květa Fialová byla okouzlující i vtipná, ať už hrála osudové ženy, anebo starostlivé maminky a babičky. Vybrali jsme pro vás jen pár filmů, které...",lidovky.cz,video
http://www.lidovky.cz/novinar.aspx?idnov=3961,Jiří Bigas,"Jan Tříska se od roku 1964 blýskl v desítkách filmů, televizních inscenací, seriálů i divadelních her. Po emigraci se mu podařilo jako jednomu z mála...",lidovky.cz,video
http://www.lidovky.cz/novinar.aspx?idnov=3961,Jiří Bigas,"Učitelé, spolužáci i rodiče několik hodin marně odrazovali čínskou studentku od záměru spáchat sebevraždu. Neúspěšní byli i policisté a hasiči....",lidovky.cz,video
http://www.lidovky.cz/novinar.aspx?idnov=3961,Jiří Bigas,Při výstavbě nové přehrady s vodní elektrárnou v Laosu došlo k nehodě. Přehrada na řece Nam Ao se protrhla a obrovský proud vody okamžitě zaplavil...,lidovky.cz,video
https://www.lidovky.cz/dny-nato-prilakaly-desetitisice-lidi-i-pres-spatne-pocasi-pmr-/video.aspx?c=A170916_215518_ln-video_ELE,"Dny NATO přilákaly desetitisíce lidí, i přes špatné počasí",I přes nepříznivé počasí v sobotu navštívilo Dny NATO a Dny Vzdušných sil Armády ČR na letišti v Mošnově nedaleko Ostravy přes 65 000 lidí. Počasí...,lidovky.cz,video
http://www.lidovky.cz/novinar.aspx?idnov=3961,Jiří Bigas,Kutil Matt Denton postavil společně se svým synovcem obří verzi motokáry z lega. Stavebnici z roku 1985 zvětšil kousek po kousku za pomoci 3D...,lidovky.cz,video
https://www.lidovky.cz/v-hatich-maji-nejvetsi-muzeum-jukeboxu-na-svete-nektere-jsou-i-pres-sto-let-stare-g1o-/video.aspx?c=A170911_225605_ln-video_ELE,V Hatích mají největší muzeum jukeboxů na světě. Některé jsou i přes sto let staré,"V Hatích u Chvalovic je největší muzeum jukeboxů na světě. 
Ve výstavních prostorech, které mají přes osm tisíc metrů čtverečních, jsou jukeboxy ze...",lidovky.cz,video
https://www.lidovky.cz/autobus-uvizl-na-zeleznicnim-prejezdu-ve-smrzovce-vyprostili-jej-az-hasici-1vk-/video.aspx?c=A170909_213741_ln-video_ELE,Autobus uvízl na železničním přejezdu ve Smržovce. Vyprostili jej až hasiči,V sobotu dopoledne uvázl na železničním přejezdu ve Smržovce autobus. Naštěstí v tu chvíli žádný vlak přes Smržovku nejel a provoz na železnici se...,lidovky.cz,video
https://www.lidovky.cz/video-vousaci-z-celeho-sveta-se-sjeli-na-mistrovstvi-vousu-do-texasu-1jo-/video.aspx?c=A170908_203636_ln-video_ELE,VIDEO: Vousáči z celého světa se sjeli na mistrovství vousů do Texasu,V Texasu se před několika dny konalo mistrovství světa vousů a knírů. Sjeli se na něj vousáči ze všech kontinentů. Organizátoři se letos rozhodli...,lidovky.cz,video
http://www.lidovky.cz/novinar.aspx?idnov=3978,Benedikt Vítek,"Prahu a část Čech ve středu večer zaplavil ohnivý západ slunce. Lidé se mohli pokochat kombinací rudých a oranžových barev, která zlákala k...",lidovky.cz,video
http://www.lidovky.cz/novinar.aspx?idnov=3961,Jiří Bigas,"Patnáctiletý Patrick Ponce překonal světový rekord. Rubikovu kostku složil za 4,69 sekundy a sám byl zaskočený tím, co právě dokázal. Raději...",lidovky.cz,video
https://www.lidovky.cz/video-kroksy-a-outdoor-ne-jinak-muzete-cokoliv-navrhar-jan-cerny-se-inspiroval-na-letisti-gv9-/video.aspx?c=A170905_201557_ln-video_ELE,"VIDEO: ‚Kroksy a outdoor ne, jinak můžete cokoliv.‘ Návrhář Jan Černý se inspiroval na letišti","„Přehlídku jsem si snad poprvé užil a doufám že to bylo znát i na mole. Móda je pro mě identifikace sebe sama, odlišení se. Nebo sebeidentifikace...",lidovky.cz,video
https://www.lidovky.cz/neplanovany-pad-pri-nataceni-filmu-shodila-komparzistu-hlaven-obrnence-1ai-/video.aspx?c=A170904_072833_ln-video_ELE,Neplánovaný pád: při natáčení filmu shodila komparzistu hlaveň obrněnce,"Točit film s vojenskou technikou není vždy úplně bezpečné. O tom se přesvědčil i jeden z komparzistů, který byl při natáčení snímku Jan Palach v...",lidovky.cz,video
https://www.lidovky.cz/blaznivi-surfari-se-projizdeli-v-zatopenych-ulicich-texaskeho-mesta-galvestonu-gpe-/video.aspx?c=A170901_224614_ln-video_ele,Blázniví surfaři se projížděli v zatopených ulicích texaského města Galvestonu,"Hurikán Harvey napáchal hrozné škody. Americkému státu Texas potrvá po úderu hurikánu Harvey roky, než odstraní následky. Přesto se Američan Patrick...",lidovky.cz,video
https://www.lidovky.cz/hra-na-zapomenuty-nastroj-ktery-proslavili-zebraci-vrchlabi-hostilo-hrace-na-nineru-gne-/video.aspx?c=A170831_223520_ln-video_ELE,Hra na zapomenutý nástroj proslavený žebráky. Vrchlabí hostilo hráče na niněru,"Hudební nástroj, který se jmenuje niněra, je dnes téměř zapomenutý. Kombinuje v sobě prvky dud, houslí, kláves a flašinetu. Jejich zvuk se však ještě...",lidovky.cz,video
https://www.lidovky.cz/na-lodi-z-pet-lahvi-dopluli-z-brna-az-do-afriky-fat-/video.aspx?c=A170829_224456_ln-video_ELE,VIDEO: Na lodi z PET lahví dopluli z Brna až do Afriky,Po sedmi letech a pěti lodích postavených z PET lahví konečně dopluli dva brněnští dobrodruzi ke břehům Afriky. Petr Hašek a Albert Fikáček vypluli z...,lidovky.cz,video
https://www.lidovky.cz/brnensti-lvi-se-poprve-ukazali-lidem-dvw-/video.aspx?c=A170828_104321_ln-video_ELE,VIDEO: Brněnští lvi se poprvé ukázali lidem,"Nová expozice se lvy v Brněnské zoo byla otevřena v sobotu a lvi se tam tak vrátili po 14 letech. Poslední brněnský lev byl samec Bali, který odešel...",lidovky.cz,video
http://www.lidovky.cz/novinar.aspx?idnov=3961,Jiří Bigas,"Podívejte se, jaký fantastický kousek se podařil s malým letadlem na Aljašce. Pilot přistál se svým strojem jako s helikoptérou. Není to přitom první...",lidovky.cz,video
http://www.lidovky.cz/novinar.aspx?idnov=3961,Jiří Bigas,"Na dálnici v texaském Houston došlo k děsivé nehodě, která jen zázrakem neskončila řetězovou srážkou. Řidič nákladního vozu se zvednutou korbou...",lidovky.cz,video
https://www.lidovky.cz/hororova-jizda-tramvaji-po-praze-ocima-ridice-fo0-/video.aspx?c=A170824_223340_ln-video_ELE,VIDEO: Hororová jízda tramvají po Praze očima řidiče,"Na videu, které natočila jedna z řidiček pražských tramvají, jsou zaznamenány desítky nebezpečných situací z posledních týdnů. Kdyby řidiči a řidičky...",lidovky.cz,video
http://www.lidovky.cz/novinar.aspx?idnov=3961,Jiří Bigas,"Katar představil nový stadion pro mistrovství světa ve fotbale, které bude hostit v roce 2022. Svým vnějším skeletem záměrně připomíná místní...",lidovky.cz,video
https://www.lidovky.cz/opily-ridic-ujizdel-policii-kradenym-mercedesem-fue-/video.aspx?c=A170822_231215_ln-video_ELE,Opilý řidič ujížděl policii ukradeným mercedesem,U Hradce Králové ujížděl v úterý po poledni po dálnici D11 opilý řidič kradeným mercedesem německé poznávací značky. Ručička jeho tachometru...,lidovky.cz,video
https://www.lidovky.cz/silny-vitr-na-sumave-zpusobil-velke-skody-vyvratil-tisice-stromu-10i-/video.aspx?c=A170821_220951_ln-video_ELE,"Silný vítr na Šumavě způsobil velké škody, vyvrátil tisíce stromů","Některé turistické trasy v jižní části Národního parku Šumava zůstávají, po bouřce a silném větru nepřístupné. Bouřka a silný vítr na Šumavě...",lidovky.cz,video
http://www.lidovky.cz/novinar.aspx?idnov=3961,Jiří Bigas,"Zatímco si během řízení hrál s mobilem, propadla se před ním vozovka. Toho si ale čínský řidič vůbec nevšiml a nerušeně pokračoval v jízdě vstříc...",lidovky.cz,video
http://www.lidovky.cz/novinar.aspx?idnov=3961,Jiří Bigas,"Tým japonských vědců naučil šimpanze pravidlům hry Kámen, nůžky, papír. Ukázalo se, že lidoopi dokáží porozumět systému na úrovni čtyřletých dětí....",lidovky.cz,video
https://www.lidovky.cz/svedek-natocil-zasah-policie-po-utoku-v-barcelone-f7z-/video.aspx?c=A170817_232452_ln-video_ele,Svědek natočil zásah policie po útoku v Barceloně,"V Barceloně najela poblíž obchodního střediska na Las Ramblas v centru města bílá dodávka do davu lidí, zřejmě turistů. Podle zpráv tamního rádia...",lidovky.cz,video
http://www.lidovky.cz/novinar.aspx?idnov=3961,Jiří Bigas,"Třicet let od premiéry původního seriálů se vrací nové Kačeří příběhy. Ve Spojených státech už byla uvedena první epizoda, která je na internetu...",lidovky.cz,video
https://www.lidovky.cz/majitele-aut-z-doby-socialismu-se-potkali-v-plzni-fby-/video.aspx?c=A170813_202101_ln-video_ELE,Majitelé aut z doby socialismu se potkali v Plzni,"V sobotu se na Plzeňsku uskutečnila již čtvrtá retro jízda, kterou pořádal Veterran Car Club Plzeň. Šlo o veteránský sraz automobilů a motocyklů, se...",lidovky.cz,video
https://www.lidovky.cz/v-ulicich-prahy-obcane-mohou-narazit-na-prvni-ceskou-popelarku-p7r-/video.aspx?c=A170811_212050_ln-video_ELE,V ulicích Prahy občané mohou narazit na první českou popelářku,"V Praze se mezi popeláře poprvé přidala žena. Lenka Stodolová s odpadem přímo nemanipuluje, řídí ale popelářský vůz. „Vyhovuje mi to pracovní dobou i...",lidovky.cz,video
https://www.lidovky.cz/prahou-prosel-v-sobotu-barevny-pruvod-prague-pride-fxs-/video.aspx?c=A170812_225854_ln-video_ELE,"Prahou prošel v sobotu ,barevný’ průvod Prague Pride","Centrem Prahy prošel v sobotu odpoledne průvod hrdosti gayů, leseb, bisexuálů a translidí (LGBT) Prague Pride. Podle pořadatelů na cestu vyrazilo a...",lidovky.cz,video
https://www.lidovky.cz/nemecti-policiste-na-hranicich-objevili-migranty-kteri-cestovali-pod-vlakem-1v5-/video.aspx?c=A170809_214237_ln-video_ELE,"Němečtí policisté objevili migranty, kteří cestovali ukrytí pod vlakem","Němečtí policisté v hraničním městě Rosenheim objevili migranty, kteří cestovali ukrytí pod vlakem. Nalezli je díky termokamerám. Uprchlíci byli...",lidovky.cz,video
https://www.lidovky.cz/dva-zraloci-napadli-potapece-musel-se-branit-nozem-fwc-/video.aspx?c=A170807_211143_ln-video_ELE,"Dva žraloci napadli potápěče, musel se bránit nožem","Chtěl lovit tuňáka, našli ho žraloci. Potápěč na Novém Zélandu jen o vlásek unikl, když ho napadli dva mořští predátoři. Bránit se musel malým nožem.",lidovky.cz,video
https://www.lidovky.cz/zeman.aspx,"Zeman vede permanentní kampaň. Server Lidovky.cz zmapoval všechna místa, kam se vypravil","Z nejvyššího úřadu v zemi má prezident Miloš Zeman k lidem nejblíž ze všech ústavních činitelů. Stvořil si vlastní styl komunikace, vede permanentní...",lidovky.cz,specialy
http://www.lidovky.cz/novinar.aspx?idnov=3851,Martin Hampejs,"13 krajů, 75 okresů a 302 měst a vesnic navštívil prezident Miloš Zeman během svého volebního období. Novináři serveru Lidovky.cz detailně...",lidovky.cz,specialy
http://www.lidovky.cz/novinar.aspx?idnov=3851,Martin Hampejs,"Jsou celkem čtyři. Český Krumlov, Mělník, Mladá Boleslav a Nový Jičín. To jsou okresní města, ve kterých se prezident Miloš Zeman ke 30. červnu 2017...",lidovky.cz,specialy
http://www.lidovky.cz/novinar.aspx?idnov=3851,Martin Hampejs,"Bojí se Miloš Zeman Pražanů? Praha je totiž jediný krajský celek, který prezident během svého volebního období nenavštívil. Mezitím stihl objet...",lidovky.cz,specialy
http://www.lidovky.cz/novinar.aspx?idnov=3890,Jan Horák,"Ve vztahu prezidenta Miloše Zemana s občany se kombinují tři veličiny. V první řadě je to osobnostní ustrojení prezidenta, jež z něj činí...",lidovky.cz,specialy
http://www.lidovky.cz/novinar.aspx?idnov=3851,Martin Hampejs,Každý výlet něco stojí. Prezidentovy cesty do regionů hradí již od doby prezidenta Havla krajské úřady a dodnes se na tom i přes protesty hejtmanů...,lidovky.cz,specialy
http://www.lidovky.cz/novinar.aspx?idnov=3926,Luděk Vokáč,"Po stopách vozu, který změnil dějiny českého autoprůmyslu. 1700 kilometrů, 7 dnů, 24 hodin za volantem Škody Favorit.",lidovky.cz,specialy
http://www.lidovky.cz/novinar.aspx?idnov=3833,Marcel Šulek,Přesně před 75 lety obklíčili němečtí vojáci pravoslavných chrám v Resslově ulici v Praze. Uvnitř svatostánku se skrývala sedmička československých...,lidovky.cz,specialy
http://www.lidovky.cz/novinar.aspx?idnov=1090,Vojtěch Gibiš,"Nový seriál serveru Lidovky.cz o nejslavnějších vrazích světa: Rostovský řezník, Vrah od Zelené řeky i český sériový vrah Roman Postl.",lidovky.cz,specialy
http://www.lidovky.cz/novinar.aspx?idnov=3556,Ondřej Vyhnanovský,"Reportér LN si jako pracovník u pásu vyzkoušel na vlastní kůži, jak se pracuje v dobrovízském velkoskladu Amazonu.",lidovky.cz,specialy
http://www.lidovky.cz/novinar.aspx?idnov=3833,Marcel Šulek,"Češi žijí v sociálních bublinách, v nichž se navíc navzájem utvrzují o správnosti vidění svého světa. Ukázal to unikátní projekt serveru Lidovky.cz....",lidovky.cz,specialy
http://www.lidovky.cz/novinar.aspx?idnov=2593,Jakub Zelenka,"„V sociálních bublinách jsme žili už dříve, ale moc jsme o tom nevěděli,“ tvrdí odborník na analýzu dat Josef Šlerka. Unikátní výsledky projektu...",lidovky.cz,specialy
http://www.lidovky.cz/novinar.aspx?idnov=3833,Marcel Šulek,"Češi žijí v sociálních bublinách, v nichž se navíc navzájem utvrzují o správnosti vidění svého světa. Ukázal to unikátní projekt serveru Lidovky.cz....",lidovky.cz,specialy
http://www.lidovky.cz/novinar.aspx?idnov=2593,Jakub Zelenka,"Novináři serveru Lidovky.cz prošli 2606 tweetů Jiřího Ovčáčka, které publikoval na účtu @PREZIDENTmluvci do 31. října 2016. Vybrali všechny...",lidovky.cz,specialy
//www.lidovky.cz/havel80.aspx,80 vzpomínek na Václava Havla,"České i zahraniční osobnosti vzpomínají, co pro ně Václav Havel znamenal.",lidovky.cz,specialy
//www.lidovky.cz/pieta-za-padle-vojaky.aspx,Pieta za padlé vojáky,"Vzpomínková stránka na české vojáky, 
kteří zemřeli při nasazení na zahraničních misích",lidovky.cz,specialy
https://ostrava.idnes.cz/attila-fabian-valecny-veteran-irak-aorta-fd7-/ostrava-zpravy.aspx?c=A171006_100555_ostrava-zpravy_woj,Válečnému veteránovi po misích v Iráku praskla aorta. Stát ukázal dvě tváře,"Každý krok je pro něj náročnou úlohou, slova těžce cedí mezi zuby. Dovednosti, které ještě před pěti lety válečný veterán zvládal s lehkostí zdravého člověka, jsou po prodělané mozkové příhodě pro...",idnes.cz,title
http://zpravy.idnes.cz/uprchlici-tehotne-zeny-handicapovane-deti-zdravotnictvi-penize-doctors-of-the-world-goc-/zahranicni.aspx?c=A171004_181619_zahranicni_kha,"Lékaři: Péče o těhotné migrantky se zanedbává, ohrožuje to budoucí Evropany","Lékaři z organizace Doctors of the World vyzývají evropské politiky, aby věnovali větší...",idnes.cz,title
https://ekonomika.idnes.cz/rozhovor-hame-martin-strupl-pastiky-masove-vyrobky-f9w-/ekoakcie.aspx?c=A171005_134306_ekoakcie_fih,"Stát nemá co mluvit do marží a dvojí kvality, říká šéf Hamé","Výši přirážek a problém dvojí kvality má vyřešit trh a ne vláda, říká v rozhovoru pro iDNES.cz...",idnes.cz,title
http://zpravy.idnes.cz/usa-new-york-zari-teroristicky-zmareny-utok-plan-fbi-agent-poz-/zahranicni.aspx?c=A171007_145644_zahranicni_fka,FBI zmařila „další 11. září“. V New Yorku chtěli útočit tři džihádisté,"Skupina islamistů loni plánovala teroristický útok v New Yorku na rušném bulváru Times Square,...",idnes.cz,title
http://zpravy.idnes.cz/moreplavkyne-isabelle-autissier-prvni-zena-obeplula-svet-lod-p6m-/zahranicni.aspx?c=A171005_133345_zahranicni_ale,"Dvakrát jsem během plavby kolem světa ztroskotala, říká mořeplavkyně","Jako malá si umínila, že až vyroste, bude se plavit po moři. O necelých třicet let později...",idnes.cz,title
https://ekonomika.idnes.cz/banany-cena-struktura-0uv-/ekonomika.aspx?c=A171002_161526_ekonomika_fih,"Velké banánové dělení: supermarket si ukousne 41 procenty ceny, farmář 13","Citróny zdražily za pět let o 17 korun, ale banány inflaci skvěle odolávají. Zdražily o...",idnes.cz,title
http://zpravy.idnes.cz/londyn-vuz-naraz-do-lidi-muzeum-d39-/zahranicni.aspx?c=A171007_160747_zahranicni_fka,"Řidič najel do lidí u muzea v Londýně, policie případ řeší jako nehodu","Jedenáct lidí v sobotu odpoledne zranil muž, který vjel autem na chodník před Přírodopisným...",idnes.cz,title
https://ona.idnes.cz/male-lasky-porod-milan-epilepsie-rodice-z-detskeho-domova-pmg-/deti.aspx?c=A171005_215652_deti_haa,"Čekali jsme to krásné a přišly takové nervy, popisuje matka po porodu","Narození miminka je krásná událost, ale ne vždy je všechno po porodu bez problémů. V tu chvíli...",idnes.cz,title
https://mobil.idnes.cz/test-leagoo-mix-0ic-/telefony.aspx?c=A171006_123755_telefony_oma,Vyzkoušeli jsme bezrámečkový mobil za pár korun. Kompromisy jsou znát,Kombinaci designu s maximálně zredukovanými rámečky nad a po stranách displeje společně s...,idnes.cz,title
https://hokej.idnes.cz/chicago-jan-rutta-0ey-/nhl.aspx?c=A171007_155151_nhl_elv,"Neprojdeš! Rutta už válí v NHL, i díky Pánu prstenů a posilovně",Demolice šampionů. Těžko se hledá výstižnější popis pro debut českého beka Jana Rutty v NHL...,idnes.cz,title
http://zpravy.idnes.cz/volebni-debata-idnes-cz-zaoralek-cssd-babis-ano-dolejs-kscm-zenisek-top-09-skopecek-ods-jurec-gxm-/domaci.aspx?c=A171005_103658_domaci_jav,Babiš vs. Zaorálek a dalších 10 lídrů se utkají v superdebatě na iDNES.cz,"Do letošních voleb zbývají dva týdny. Velká část voličů, podle některých průzkumů...",idnes.cz,title
https://revue.idnes.cz/tereza-kostkova-vanda-hybnerova-lucie-vondrackova-ewa-farna-psi-charita-1oc-/lidicky.aspx?c=A171006_153000_lidicky_jfk,"Vondráčková, Farna i Eben se kvůli charitě ocitli v pohádkovém světě","Známé tváře se rozhodly podpořit dobrou věc a nafotily kalendář na pomoc čtyřnohým miláčkům. Na fotkách, které jakoby zobrazovaly...",idnes.cz,title
http://zpravy.idnes.cz/che-guevara-vyroci-smrt-0sm-/zahranicni.aspx?c=A171007_094616_zahranicni_jj,"Před 50 lety popravili Che Guevaru, snílka s astmatem a rukama od krve",,idnes.cz,title
http://zpravy.idnes.cz/bypass-infarkt-ikem-operace-setkani-pacienti-fnp-/domaci.aspx?c=A170926_184709_domaci_ale,Jaký je život po bypassu? IKEM chystá unikátní studii u svých pacientů,,idnes.cz,title
https://fotbal.idnes.cz/kvalifikace-ms-cesko-trener-karel-jarolim-fgd-/fot_reprez.aspx?c=A171006_212412_fot_reprez_rou,"Trenére, a dál? Na trenérské rošády není prostor ani vhodný čas",,idnes.cz,title
https://hokej.idnes.cz/prvni-hokejova-liga-10-kolo-09w-/hok_1liga.aspx?c=A171007_142859_hok_1liga_tof,"První liga: Kladno zdolalo Slavii, Budějovice padly. Vary spasily nájezdy",,idnes.cz,title
https://praha.idnes.cz/zvon-kutna-hora-kostel-jakuba-d2t-/praha-zpravy.aspx?c=A171006_135415_praha-zpravy_rsr,VIDEO: Zvon vystoupal do zvonice v Kutné Hoře středověkou metodou,,idnes.cz,title
https://vary.idnes.cz/novy-rybnik-slavkovsky-les-chranene-uzemi-vazka-f63-/vary-zpravy.aspx?c=A170930_354950_vary-zpravy_ba,Ráj vážek u Horního Slavkova je nově i chráněnou oblastí,,idnes.cz,title
https://ekonomika.idnes.cz/mzda-plat-prijem-penize-kolik-bere-kdo-bere-nejvic-nejmene-korun-kc-vyplata-1t8-/ekonomika.aspx?c=A171006_100010_ekonomika_jan,"Berete jako primář, nebo prodavačka? A kde mají mzdu 160 tisíc korun?",,idnes.cz,title
https://ekonomika.idnes.cz/mcdonald-s-cheeseburger-zdrazeni-ceny-hamburger-ftw-/test.aspx?c=A171006_145746_test_rts,"Za cheeseburger u McDonald’s si připlatíte, zdražil poprvé od roku 2013",,idnes.cz,title
