link,link_text,txt,site,area
https://praha.idnes.cz/soud-vrazda-pacientka-vezeni-mlada-boleslav-fz2-/praha-zpravy.aspx?c=A180403_142103_praha-zpravy_nuc,Za pokus o vraždu vzduchem do žíly dostala ošetřovatelka čtyři roky,Za pokus o vraždu pacientky dostala ošetřovatelka z mladoboleslavské nemocnice čtyři roky vězení....,idnes.cz,krimi
https://vary.idnes.cz/vytrznictvi-vytrznik-alkohol-ohrozeni-policie-as-f8c-/vary-zpravy.aspx?c=A180403_132915_vary-zpravy_ba,"Opilec v Aši skočil řidiči do cesty. Když šofér zastavil, dostal pěstí","Policie stíhá muže z Chebska, který v opilosti tropil výtržnosti na ulici. Skočil do cesty...",idnes.cz,krimi
https://hradec.idnes.cz/soud-hradec-kralove-jan-t-znasilneni-nezletile-divky-hradecko-p6f-/hradec-zpravy.aspx?c=A180403_125955_hradec-zpravy_the,"Za sex platil nezletilým dívkám sladkostmi i oblečením, tvrdí obžaloba",S obžalobou ze znásilnění a svádění k pohlavnímu styku stanul u Krajského soudu v Hradci Králové...,idnes.cz,krimi
https://praha.idnes.cz/rakovnicko-kamion-auto-nehoda-tezke-zraneni-doprava-f9p-/praha-zpravy.aspx?c=A180403_135924_praha-zpravy_nuc,"Na Rakovnicku se čelně srazil kamion s autem, zranila se jedna žena","Na silnici číslo 6, která spojuje Karlovarský kraj a Prahu, se odpoledne mezi Hořovičkami a...",idnes.cz,krimi
https://praha.idnes.cz/cerny-most-kryt-bunkr-protiatomovy-hasici-praha-14-fsq-/praha-zpravy.aspx?c=A180403_124137_praha-zpravy_nuc,"Pozemek u školy se nepropadl do krytu, upřesnila radnice. Stavbu nezná",Pondělní propad na pozemku školy na Černém Mostě nebyl zapříčiněný kolapsem stropu protiatomového...,idnes.cz,krimi
https://brno.idnes.cz/nehoda-trolejbus-sloup-policie-trestni-stihani-ridic-pdu-/brno-zpravy.aspx?c=A180403_085731_brno-zpravy_krut,Za náraz trolejbusu do sloupu čelí řidič obvinění z ublížení na zdraví,"Za lednový náraz trolejbusu brněnské hromadné dopravy do sloupu, při němž se zranili čtyři lidé,...",idnes.cz,krimi
https://plzen.idnes.cz/dopravni-nehoda-bocni-stret-peugeot-citroen-prikop-vozidlo-vseruby-1gr-/plzen-zpravy.aspx?c=A180403_112932_plzen-zpravy_vb,"Po nehodě na Plzeňsku zůstal jeden vůz na střeše, zranili se dva lidé",Osmnáctiletý řidič osobního auta v pondělí odpoledne způsobil dopravní nehodu na Plzeňsku. Na...,idnes.cz,krimi
https://praha.idnes.cz/rus-praha-prejeti-cizinka-kolumbie-praha-2-soud-fq8-/praha-zpravy.aspx?c=A180403_120743_praha-zpravy_nuc,"Odjel do Ruska, řekl advokát cizince obviněného z přejetí turistky v Praze","Soud dnes vydá příkaz k zatčení ruského řidiče, který na Silvestra v centru Prahy usmrtil turistku...",idnes.cz,krimi
https://brno.idnes.cz/muz-vyhodil-psa-z-devateho-patra-brno-dwr-/brno-zpravy.aspx?c=A180403_102801_brno-zpravy_krut,Muž v Brně po hádce vyhodil svého psa z devátého patra paneláku,Krutou smrt připravil svému psu muž v brněnské Bystrci. Zvíře podle svědků v záchvatu vzteku vzal a...,idnes.cz,krimi
https://praha.idnes.cz/vrazda-soud-cizinka-lotyska-nuz-dao-/praha-zpravy.aspx?c=A180403_115453_praha-zpravy_nuc,"Možná je to osud, vypověděla cizinka obžalovaná z ubodání již třetího muže","Třiašedesátiletá Lotyška Jevgenija Stepanová u pražského městského soudu připustila, že loni zřejmě...",idnes.cz,krimi
https://ostrava.idnes.cz/krajsky-soud-ostrava-robert-tancer-vrazda-ubytovna-vitkovice-pb6-/ostrava-zpravy.aspx?c=A180403_103349_ostrava-zpravy_jog,"Chytl jsem amok, přiznal muž souzený za to, že ubodal a podřízl známého","Krajský soud v Ostravě začal projednávat případ Roberta Tancera, který je obžalovaný, že loni v...",idnes.cz,krimi
https://olomouc.idnes.cz/olomouc-holice-nehoda-policie-obvinila-ridice-vazba-zemrele-deti-pxm-/olomouc-zpravy.aspx?c=A180403_101825_olomouc-zpravy_stk,"Muž obviněný z usmrcení dvou dětí u Olomouce řídil opilý, řekla policie","Za čtvrteční střet čtyř automobilů, při němž na okraji Olomouce zemřely dvě děti a další tři lidé...",idnes.cz,krimi
https://zpravy.idnes.cz/velikonoce-mrtvi-na-silnicich-nehody-obeti-f2b-/krimi.aspx?c=A180403_103357_domaci_dtt,"O Velikonocích zemřeli na silnicích čtyři lidé, o dva méně než loni","O prodlouženém velikonočním víkendu zemřeli na českých silnicích dosud čtyři lidé, což je o dvě...",idnes.cz,krimi
https://brno.idnes.cz/uzavreni-zeleznice-znojmo-satov-sebevrah-most-frp-/brno-zpravy.aspx?c=A180403_101223_brno-zpravy_krut,"Muž hrozil skokem z železničního mostu, rozmluvil mu to vyjednavač",Policie ráno na více než hodinu zastavila vlakovou dopravu na trati mezi Šatovem a Znojmem kvůli...,idnes.cz,krimi
https://praha.idnes.cz/praha-hromadne-znasilneni-turistka-hotel-bar-pokoj-apartman-prj-/praha-zpravy.aspx?c=A180403_092737_praha-zpravy_nuc,"Mladík si odvedl turistku z baru na pokoj, pak ji s kamarády znásilnil",Pražští policisté vyšetřují napadení ženy v jednom z hotelů v centru Prahy. Šest cizinců je...,idnes.cz,krimi
https://kultura.zpravy.idnes.cz/ceska-filharmonie-sezona-2018-2019-dkr-/hudba.aspx?c=A180403_120358_hudba_era,Filharmonie odhalila sezonu. Uvítá i Simona Rattlea a Magdalenu Koženou,První sezonu s novým šéfdirigentem Semjonem Byčkovem má před sebou Česká filharmonie. V jejím...,idnes.cz,kultura
https://kultura.zpravy.idnes.cz/recenze-souboj-pohlavi-emma-stone-steve-carell-fln-/filmvideo.aspx?c=A180404_393102_filmvideo_spm,RECENZE: Ze Souboje pohlaví jedno z nich zmizelo. Zbyl lesbický románek,"VIDEO
				
                Legendární tenisový zápas Billie Jean Kingové s Robertem Riggsem se dočkal rekonstrukce ve filmu...",idnes.cz,kultura
https://kultura.zpravy.idnes.cz/trojky-iq-klip-premiera-0s4-/hudba.aspx?c=A180403_172952_hudba_vha,VIDEO: Kapela Trojky věnuje klip všem instagramovým královnám,"Duo Trojky tvoří zpěvačka Veronika Kratochvílová a Aleš Zenkl, známý jako doprovodný muzikant od...",idnes.cz,kultura
https://kultura.zpravy.idnes.cz/barbora-polakova-rozhovor-d0d-/hudba.aspx?c=A180403_143323_hudba_ts,"Jsem z 99 procent máma, říká Poláková. Víko nad ní zaklapne jen na hodinu","Barbora Poláková vydala desku ZE.MĚ. Ač posluchači mohou postrádat prvoplánový hit typu Nafrněné,...",idnes.cz,kultura
https://kultura.zpravy.idnes.cz/batalives-batovske-zivoty-recenze-dtq-/filmvideo.aspx?c=A180403_135001_filmvideo_ts,RECENZE: Vypadnout z té díry. Baťova města dnes žijí z melancholie,"I mezinárodní vnitropodnikovou romanci našel dokument Batalives: Baťovské životy, s nímž vstupuje...",idnes.cz,kultura
https://kultura.zpravy.idnes.cz/jozin-z-bazin-ivan-mladek-metallica-du3-/hudba.aspx?c=A180403_162736_hudba_vha,"Velké výdělky z Jožina na koncertu Metalliky nečekám, tvrdí Mládek","VIDEO
				
                Byl to trochu šok, když baskytarista Robert Trujillo na koncertu americké heavymetalové kapely...",idnes.cz,kultura
https://budejovice.idnes.cz/cesky-krumlov-egon-schiele-art-centrum-dyx-/budejovice-zpravy.aspx?c=A180403_392934_budejovice-zpravy_epkub,Démoni i biblické výjevy. Schiele Centrum v Krumlově ukazuje pohled žen,Českokrumlovské Egon Schiele Art Centrum zahájilo letošní výstavní sezonu pod názvem Pohled ženy....,idnes.cz,kultura
https://kultura.zpravy.idnes.cz/per-gessle-roxette-koncert-ddt-/hudba.aspx?c=A180403_125629_hudba_vha,"V říjnu dorazí Per Gessle, polovina populárních švédských Roxette",S dobrou zprávou přichází švédské duo Roxette. Její frontman a skladatel Per Gessle se na podzim...,idnes.cz,kultura
https://kultura.zpravy.idnes.cz/zebricek-kin-spielberg-ready-player-one-hra-zacina-vejdelek-pow-/filmvideo.aspx?c=A180403_120953_filmvideo_spm,Na Spielbergovu hráčskou novinku přišlo o víkendu 68 tisíc diváků,"VIDEO
				
                Premiérový snímek Ready Player One: Hra začíná, který spojuje dění v počítačové hře a v budoucí...",idnes.cz,kultura
https://kultura.zpravy.idnes.cz/metallica-worldwired-tour-koncert-praha-o2-arena-recenze-jozin-z-bazin-1eb-/hudba.aspx?c=A180403_090000_hudba_vha,RECENZE: Metallica předvedla koncert snů. Pobavila i Mládkovým Jožinem,"VIDEO
				
                Zkazky a britské recenze nelhaly. Také pondělní pražský koncert heavymetalové legendy jménem...",idnes.cz,kultura
https://kultura.zpravy.idnes.cz/igor-rattaj-aerodrome-festival-za-scenou-video-porad-pca-/hudba.aspx?c=A180402_181650_hudba_kiz,"Eminemovi se na Aerodrome nechtělo, řekl miliardář Rattaj Za scénou","VIDEO
				
                Miliardář Igor Rattaj se po velkých investicích do českých ski areálů rozhodl proměnit svět...",idnes.cz,kultura
https://kultura.zpravy.idnes.cz/divadlo-broadway-na-dotek-anna-stropnicka-fgp-/divadlo.aspx?c=A180403_093500_divadlo_ts,Klidně si zapálí v nemocnici či galerii. Stropnická hraje holku z ulice,Hravě a lehce napsané. Tak charakterizuje Anna Stropnická činoherní novinku pražského Divadla...,idnes.cz,kultura
https://kultura.zpravy.idnes.cz/trailer-mesic-jupitera-07q-/filmvideo.aspx?c=A180402_150641_filmvideo_spm,"VIDEO: Podívejte se, jak Měsíc Jupitera naučil herce létat bez triků","VIDEO
				
                Thriller Měsíc Jupitera se odehrává v blízké budoucnosti a líčí příběh uprchlíka, který po zásahu...",idnes.cz,kultura
https://kultura.zpravy.idnes.cz/trailer-dve-nevesty-a-jedna-svatba-anna-polivkova-a-ester-geislerova-1g6-/filmvideo.aspx?c=A180402_145015_filmvideo_spm,VIDEO: Legrace v kadibudce. Blíží se Dvě nevěsty a jedna svatba,"VIDEO
				
                Komedie Dvě nevěsty a jedna svatba, která do kin vstoupí 26. dubna, zveřejnila novou ukázku....",idnes.cz,kultura
https://kultura.zpravy.idnes.cz/lisa-mcinerneyova-mcinerney-prdel-irska-nadherna-kacirstvi-pql-/literatura.aspx?c=A180329_140606_literatura_ts,"Každý Ir zná drogového dealera, prohlašuje autorka Prdele Irska",Proslavila se jako autorka sarkastického blogu Prdel Irska. Teď u nás Lise McInerneyové vychází...,idnes.cz,kultura
https://kultura.zpravy.idnes.cz/video-vrazda-v-orient-expresu-dvd-dl3-/filmvideo.aspx?c=A180329_162649_filmvideo_spm,VIDEO: Než jde Hercule Poirot spát. Co Vražda v Orient expresu tajila,"VIDEO
				
                Zábavný pohled na geniálního detektiva Hercula Poirota při jeho rituálu, než se uloží ke spánku,...",idnes.cz,kultura
https://kultura.zpravy.idnes.cz/genialni-pritelkyne-elena-ferrante-recenze-pribeh-ztracene-holcicky-1iw-/literatura.aspx?c=A180329_125419_literatura_ts,RECENZE: Rudé brigády i vášeň. Geniální přítelkyně je velká italská sága,"Italská literární obec si nadále láme hlavu, zda se za jménem Elena Ferrante skrývá žena, muž či...",idnes.cz,kultura
https://kultura.zpravy.idnes.cz/ztratili-jsme-stalina-komedie-dku-/filmvideo.aspx?c=A180329_121519_filmvideo_ts,"Umřel Stalin, co teď? Při černé komedii, kterou v Rusku zakázali, tuhne úsměv","VIDEO
				
                Stalin a smích, to nejde moc dohromady. Nicméně Britové právě o krutém diktátorovi, respektive o...",idnes.cz,kultura
https://kultura.zpravy.idnes.cz/cosi-fan-tutte-metropolitni-opera-plachetka-fmm-/hudba.aspx?c=A180401_130914_hudba_era,RECENZE: Ztraceni v newyorském lunaparku. I s Adamem Plachetkou,Kinopřenos Mozartovy opery Cosi fan tutte z Metropolitní opery byl přitažlivý účastí Adama...,idnes.cz,kultura
https://kultura.zpravy.idnes.cz/prima-krimi-policie-v-akci-09m-/filmvideo.aspx?c=A180323_102513_filmvideo_spm,VIDEO: Série Policie v akci zažila pravou krev. Zastřelili kameramana,"VIDEO
				
                Nový kanál Prima Krimi, který startuje 2. dubna, nasadí vedle známých titulů jako Odpadlík, Closer...",idnes.cz,kultura
https://kultura.zpravy.idnes.cz/jack-white-boarding-house-reach-recenze-d9r-/hudba.aspx?c=A180329_122636_hudba_vha,RECENZE: Jack White nahrál zatraceně chytlavý experiment,"Zapomeňte na chvíli na White Stripes, jakkoliv byla tvorba tohoto dua vždycky vzrušující i ceněná....",idnes.cz,kultura
https://kultura.zpravy.idnes.cz/kaceri-pribehy-disney-dulik-bubik-a-kulik-fpa-/filmvideo.aspx?c=A180329_131031_filmvideo_kiz,Kačeří příběhy se vrací. Tvůrci si pomáhali whisky i původními komiksy,"Exkluzivně
Los Angeles (od zpravodajky iDNES.cz)
                Dulík, Bubík a Kulík řádí. Strýček Skrblík skáče do kopy zlata. Rampa McKvák startuje aeroplán....",idnes.cz,kultura
https://kultura.zpravy.idnes.cz/poledne-divadlo-continuo-gorbanevska-recenze-fo1-/divadlo.aspx?c=A180329_092938_divadlo_ts,RECENZE: Tanec se sklenkami. O tíži sovětské totality lze vyprávět lehce,"Jako by tě ksichtem přetáhli po asfaltu a nezůstaly ti na něm žádné charakteristické rysy, jako by...",idnes.cz,kultura
https://kultura.zpravy.idnes.cz/ag-flek-podnohama-zem-0rs-/hudba.aspx?c=A180329_145731_hudba_vha,"AG Flek se vrací po osmnácti letech, natočil své nejpestřejší album",Dlouho očekávané album Podnohama zem je od vzniku skupiny AG Flek v roce 1977 její teprve třetí...,idnes.cz,kultura
https://kultura.zpravy.idnes.cz/kensington-zpevak-casper-starreveld-dse-/hudba.aspx?c=A180329_143106_hudba_kiz,"Rivalitu mezi Brnem a Prahou máme i v Holandsku, říká zpěvák Kensington","Po vydání první desky to vypadalo, že budou muset skončit. Touha uspět však byla silnější, říká...",idnes.cz,kultura
https://kultura.zpravy.idnes.cz/video-na-kratko-0go-/filmvideo.aspx?c=A180329_130227_filmvideo_spm,VIDEO: Všichni mu lhali. Představuje se rodinný příběh Na krátko,"VIDEO
				
                Filmu Na krátko, který natočil Jakub Šmíd podle scénáře Petry Soukupové, bude v kinech od 24....",idnes.cz,kultura
https://kultura.zpravy.idnes.cz/televizionar-velikonoce-prima-krimi-dsc-/filmvideo.aspx?c=A180329_103450_filmvideo_ts,TELEVIZIONÁŘ: K pomlázce se vedle Biblických příběhů přidá kanál Krimi,"Velikonoční svátky sice symbolizují zmrtvýchvstání, ale televize se drží spíše předcházející...",idnes.cz,kultura
https://kultura.zpravy.idnes.cz/marpo-troublegang-koncert-denoche-hradec-kralove-fb5-/hudba.aspx?c=A180330_183930_hudba_vha,"OBRAZEM: Kytary, bubny, vyprodáno. Naposledy před „marpoarenou“","Ota Petřina, alias Marpo, se svým TroubleGangem v královéhradeckém klubu Denoche odehrál poslední...",idnes.cz,kultura
https://kultura.zpravy.idnes.cz/tracyho-tygr-ilustrace-argo-d1r-/literatura.aspx?c=A180329_150033_literatura_kiz,"Tracyho tygr zase učí, jak se stát mužem. Tentokrát s novými ilustracemi",Americký spisovatel William Saroyan napsal za svůj život desítky knih. Jen jedné z nich se však...,idnes.cz,kultura
https://kultura.zpravy.idnes.cz/kralicek-petr-video-literarni-predloha-d9g-/filmvideo.aspx?c=A180329_151021_filmvideo_kiz,"VIDEO: S Králíčkem Petrem vyrostlo každé britské dítě, říká jeho hlas Corden","VIDEO
				
                Animovaný film Králíček Petr slaví úspěchy v kinech po celém světě, u dětí i dospělých. Především...",idnes.cz,kultura
https://kultura.zpravy.idnes.cz/trailer-temne-sily-0ap-/filmvideo.aspx?c=A180329_103527_filmvideo_spm,"VIDEO: Náctiletí se zase perou s vládou, zahánějí Temné síly","VIDEO
				
                Zhoubná nákaza zabila naprostou většinu amerických dětí. U těch, které přežily, se však vyvinuly...",idnes.cz,kultura
https://kultura.zpravy.idnes.cz/v-i-p-vrazdy-2-recenze-0rt-/filmvideo.aspx?c=A180329_112600_filmvideo_ts,"RECENZE: Útlá lýtka Norisové, policejní cedule. V.I.P. vraždy zlevnily",Po dvou letech od první řady se v sobotu vrátí na Primu premiérové V.I.P. vraždy. Staří známí sice...,idnes.cz,kultura
https://kultura.zpravy.idnes.cz/thom-artway-festival-sziget-dgc-/hudba.aspx?c=A180329_135906_hudba_vha,Jediným Čechem na maďarském festivalu Sziget bude Thom Artway,"Festival na největším ostrově v Budapešti pravidelně uvádí i tuzemské hudebníky, na letošním...",idnes.cz,kultura
https://kultura.zpravy.idnes.cz/koncerty-ceska-filharmonie-collegium-1704-f0w-/hudba.aspx?c=A180329_121330_hudba_era,GLOSÁŘ: Barokní hity versus moderní experimenty. A jeden smírčí soudce,"Dva hudební svátky těsně před Velikonocemi: Soubor Collegium 1704 uvedl Händelova Mesiáše, Česká...",idnes.cz,kultura
https://kultura.zpravy.idnes.cz/prvni-dojmy-serial-the-terror-dkk-/filmvideo.aspx?c=A180328_173613_filmvideo_spm,PRVNÍ DOJMY: Mrazivý teror na lodi Terror. Tak má vypadat žánr,"VIDEO
				
                Mrazivý hororový seriál The Terror, který začíná vysílat AMC, asi nebude pro každého, třebaže jméno...",idnes.cz,kultura
https://kultura.zpravy.idnes.cz/hon-prahou-jagd-durch-prag-americka-veznice-v-praze-fwx-/filmvideo.aspx?c=A180329_101126_filmvideo_ts,Tajná věznice USA na severočeském letišti? Filmová diplomatka pátrá u nás,"Německá velvyslankyně v Praze pátrá v České republice po údajné tajné americké věznici, v níž...",idnes.cz,kultura
https://ekonomika.idnes.cz/hyundai-reklama-kampan-air-bank-dmz-/ekonomika.aspx?c=A180404_112008_ekonomika_fih,Hyundai útočí na konkurenci okopírovanou reklamou se zlým bankéřem,"Reklamy Air Bank se „zlým“ a „hodným“ bankéřem zná asi každý, na obrazovkách se drží už roky....",idnes.cz,ekonomika
https://ekonomika.idnes.cz/ministerstvo-financi-alena-schillerova-poplatky-ubytovani-pq9-/ekonomika.aspx?c=A180404_131430_ekonomika_tanc,"Ministerstvo financí chce sloučit poplatky za ubytování, i kvůli Airbnb",Ministerstvo financí navrhuje sloučení poplatku z ubytovacích kapacit a rekreačního a lázeňského...,idnes.cz,ekonomika
https://ekonomika.idnes.cz/flixbus-autobusy-doprava-spoje-d39-/eko-doprava.aspx?c=A180404_131500_eko-zahranicni_mato,"FlixBus chystá obří expanzi, ještě letos nabídne 100 tisíc nových spojů",Německý operátor autobusové dopravy FlixBus chce během letošního roku nabídnout přes 100 000 nových...,idnes.cz,ekonomika
https://ekonomika.idnes.cz/okd-doly-stat-prisko-tezba-karvina-d5y-/ekoakcie.aspx?c=A180404_132941_ekonomika_mato,"OKD je znovu státní firmou, akcie převzal podnik Prisko","Akcie těžební společnosti OKD v Karviné převzali zástupci státního podniku Prisko, stát za ně...",idnes.cz,ekonomika
https://ekonomika.idnes.cz/usa-cina-clo-trump-03g-/eko-zahranicni.aspx?c=A180404_112540_eko-zahranicni_mato,Konec levné elektroniky? USA chtějí clo na 1 300 čínských výrobků,"Administrativa Spojených států zveřejnila v úterý seznam 1 300 čínských exportních produktů, na...",idnes.cz,ekonomika
https://ekonomika.idnes.cz/francie-pariz-stavka-vlaky-reforma-macron-fgh-/eko-doprava.aspx?c=A180404_114304_eko-doprava_tanc,"Většina vlaků ve Francii stále nejezdí, těží z toho autobusy a spolujízdy","Až 86 procent vlaků ve středu nejezdí ve Francii, kde druhým dnem pokračuje rozsáhlá stávka...",idnes.cz,ekonomika
https://ekonomika.idnes.cz/cestovni-ruch-cesky-statisticky-urad-turista-cesko-miliardy-ptz-/ekonomika.aspx?c=A180404_103919_ekonomika_tanc,Počet turistů roste a Česko na své oblíbenosti stále víc vydělává,Celkový zisk České republiky z cestovního ruchu v roce 2016 stoupl o devět procent na 272 miliard...,idnes.cz,ekonomika
https://ekonomika.idnes.cz/pojistovna-ceske-sporitelny-soud-neplatna-smlouva-flexi-pm1-/ekonomika.aspx?c=A180402_173123_ekonomika_nio,Smlouva neplatí. V kauze životních pojistek uvázla už třetí pojišťovna,"Pojišťovna České spořitelny řeší problém s platností svých smluv. Soudu se nelíbilo, jak...",idnes.cz,ekonomika
https://ekonomika.idnes.cz/wall-street-odmeny-bankeri-krize-d4m-/eko-zahranicni.aspx?c=A180403_132631_eko-zahranicni_fih,"Bankéři z Wall Street opět bohatnou, mají milionové bonusy jako před krizí",Americký symbol světa peněz Wall Street se vrací na vrchol své slávy. Odměny bankéřů v New Yorku se...,idnes.cz,ekonomika
https://ekonomika.idnes.cz/skoda-platy-mzdy-kolektivni-vyjednavani-odbory-fta-/ekoakcie.aspx?c=A180404_090609_ekoakcie_fih,Boj o mzdy ve Škodě vrcholí. Odbory vypověděly páteční noční směny,Kolektivní jednání v automobilce Škoda Auto v Mladé Boleslavi vstoupila do ostřejší fáze. Odbory...,idnes.cz,ekonomika
https://ekonomika.idnes.cz/alza-hall-office-centrala-200-milionu-duv-/ekoakcie.aspx?c=A180404_101600_ekoakcie_fih,Alza.cz za 200 milionů zmodernizuje a zvětší pražskou centrálu,E-shop Alza.cz za 200 milionů korun zrekonstruuje kancelářskou budovu v Holešovicích Hall Office...,idnes.cz,ekonomika
https://ekonomika.idnes.cz/alzheimer-necas-hrlidcka-byznys-demence-stat-fne-/ekonomika.aspx?c=A180403_392817_ekonomika_rts,Byznys s demencí čekají dobré časy. Všimli si toho lobbisté i expolitici,V Česku žije na 160 tisíc lidí se stařeckou demencí. Do dvaceti let se počet zdvojnásobí. Z péče o...,idnes.cz,ekonomika
https://ekonomika.idnes.cz/verejne-finance-prebytek-0xx-/ekonomika.aspx?c=A180404_091908_ekonomika_jn,"Veřejné finance skončily podruhé za sebou v přebytku, tentokrát 80 miliard","Veřejné finance skončily loni v přebytku 1,59 procenta hrubého domácího produktu (HDP) a přebytek...",idnes.cz,ekonomika
https://ekonomika.idnes.cz/kone-emirates-dostihy-dubai-dpl-/eko-zahranicni.aspx?c=A180403_184500_eko-zahranicni_mato,Stáj v oblacích. Emirates přepravily čtyřnohé hvězdy na dubajské dostihy,Neobvyklé pasažéry přepravila minulý týden společnost Emirates SkyCargo. Nákladní divize aerolinek...,idnes.cz,ekonomika
https://ekonomika.idnes.cz/stavebni-povoleni-urady-stavby-d3y-/ekonomika.aspx?c=A180403_392827_ekonomika_mato,"Úředníci jsou zavaleni lejstry, stavební povolení nestíhají vyřizovat","Tři měsíce po novele stavebního zákona lidé stále nemohou stavět, úřady prostě množství podaných...",idnes.cz,ekonomika
https://ekonomika.idnes.cz/spotify-wall-street-burza-new-york-vstup-f1h-/eko-zahranicni.aspx?c=A180403_180005_eko-zahranicni_mato,Spotify na Wall Street. Firma volí pro vstup na burzu netradiční postup,"Švédská společnost Spotify, která provozuje stejnojmennou službu pro streamování hudby, vstupuje na...",idnes.cz,ekonomika
https://ekonomika.idnes.cz/amazon-trump-nasdaq-akcie-0yn-/eko-zahranicni.aspx?c=A180403_134142_eko-zahranicni_mato,"Trump dál útočí na Amazon, obvinil ho ze zneužití služeb americké pošty","Americký prezident Donald Trump v pondělí znovu zkritizoval společnost Amazon, zejména její...",idnes.cz,ekonomika
https://ekonomika.idnes.cz/d1-usekove-mereni-reditelstvi-silnic-a-dalnic-fnf-/eko-doprava.aspx?c=A180403_133745_eko-doprava_cfr,Ředitelství silnic a dálnic vzdalo soutěž na radary úsekového měření,"Správce dálnic vzdal veřejnou soutěž na nákup pěti zařízení pro úseková měření, kterými chtěl...",idnes.cz,ekonomika
https://ekonomika.idnes.cz/hartenberg-astratex-akvizice-spodni-pradlo-babis-f7g-/ekoakcie.aspx?c=A180403_122559_ekoakcie_rts,Firma z Babišova fondu kupuje prodejce spodního prádla Astratex,"Fond Hartenberg, který patří do svěřenského fondu premiéra v demisi Andreje Babiše, kupuje...",idnes.cz,ekonomika
https://ekonomika.idnes.cz/air-france-vlaky-021-/eko-zahranicni.aspx?c=A180403_102434_eko-zahranicni_fih,Ve Francii začal dopravní chaos. Kvůli stávce nejezdí část vlaků i letadel,Francouzskou železnicí otřásá jedna z největších stávek posledních let. Do práce nenastoupila asi...,idnes.cz,ekonomika
https://ekonomika.idnes.cz/cefc-investice-dluh-cina-0wn-/eko-zahranicni.aspx?c=A180403_083854_eko-zahranicni_fih,"Podržte zadluženou čínskou CEFC, přesvědčuje věřitele čínská banka",Čínská rozvojová banka (CDB) v úterý jedná s věřiteli a držiteli dluhopisů o narůstajícím dluhu...,idnes.cz,ekonomika
https://ekonomika.idnes.cz/praha-penta-masarykovo-nadrazi-rekonstrukce-csad-florenc-p3c-/eko-zahranicni.aspx?c=A180402_122907_eko-zahranicni_rts,Obchody a kanceláře za 10 miliard. Projekt Masarykova nádraží vyjde na víc,"Ambiciozní developerský projekt Central Business District skupiny Penta, který změní okolí...",idnes.cz,ekonomika
https://ekonomika.idnes.cz/ekonomika-hdp-cesko-rust-platy-spotreba-f0h-/ekonomika.aspx?c=A180403_103355_ekonomika_rts,"Statistici zpřesnili čísla, česká ekonomika loni posílila o 4,6 procenta","Česká ekonomika v loňském čtvrtém čtvrtletí rostla rychleji, než byl dosavadní odhad statistiků....",idnes.cz,ekonomika
https://ekonomika.idnes.cz/cina-peking-clo-zavedeni-cel-produkty-z-usa-f2b-/eko-zahranicni.aspx?c=A180403_071142_eko-zahranicni_ekl,"Čína se nikdy nepoddá, komentují počínající obchodní válku s USA média",Čína s pondělní platností zavedla cla ve výši až 25 procent na 128 výrobků ze Spojených států....,idnes.cz,ekonomika
https://ekonomika.idnes.cz/mala-kina-vs-multiplexy-prezila-a-zacinaji-rust-investice-p3b-/ekonomika.aspx?c=A180402_204846_ekonomika_lre,Jednosálová kina se dokázala prosadit. Musela však investovat do techniky,"Když v Česku otvíralo první multiplexové kino, prorokovali mnozí tradičním jednosálovým a...",idnes.cz,ekonomika
https://ostrava.idnes.cz/okd-prevedla-tezbu-na-dcerinou-firmu-na-rade-je-stat-fx3-/ostrava-zpravy.aspx?c=A180401_194157_ostrava-zpravy_dar,"OKD převedla těžbu na dceřinou firmu, na řadě je stát",Z někdejší obří těžební společnosti OKD už je jen je skořápka. Firma k 1. dubnu převedla...,idnes.cz,ekonomika
https://ekonomika.idnes.cz/cetin-petr-slovacek-rozhovor-internet-cesko-f3q-/ekonomika.aspx?c=A180326_391608_ekonomika_rts,"S modernizací sítí jsme začali pozdě. Ale má to výhody, říká šéf CETIN","Na ministerstvu průmyslu a obchodu leží 11,5 miliardy korun z evropských fondů, které Evropská...",idnes.cz,ekonomika
