link,link_text,txt,site,area
https://www.lidovky.cz/nejvyssi-kontrolni-urad-zjistil-nedostatky-pri-vyuziti-penez-na-spolupraci-obci-gjp-/zpravy-domov.aspx?c=A171204_081249_ln_domov_ele,"Kontroloři kritizují využití stamilionů pro obce. Nic jim nepřinesly, tvrdí",Nejvyšší kontrolní úřad (NKÚ) zjistil nedostatky při schvalování projektů za 619 milionů korun na rozvoj vzájemné spolupráce obcí a místních...,lidovky.cz,domov
https://www.lidovky.cz/cesko-zasahlo-snezeni-ridici-musi-byt-opatrni-f4p-/zpravy-domov.aspx?c=A171204_072521_ln_domov_ele,"Sníh komplikoval dopravu, padat by měl i během dne","V Česku připadlo v noci na pondělí několik centimetrů sněhu, podle předpovědi by mělo sněžit i přes den. Silnice jsou ve většině krajů sjízdné se...",lidovky.cz,domov
https://www.lidovky.cz/novinar.aspx?idnov=3890,Jan Horák,"Býval to jeden z nejvyšších důstojníků české armády. Generál Vladimír Halenka podle zjištění serveru Lidovky.cz však české ozbrojené síly opustil,...",lidovky.cz,domov
https://www.lidovky.cz/novinar.aspx?idnov=3065,Kateřina Menzelová,"Nebývá zvykem najmout si advokáta proto, aby u soudu zvrátil výsledek již jednou vyhraného sporu. Státní pozemkový úřad tak v případě restituční...",lidovky.cz,domov
https://www.lidovky.cz/ministrem-skolstvi-v-babisove-vlade-ma-byt-namestek-ministerstva-pro-vysoke-skoly-plaga-g7j-/zpravy-domov.aspx?c=A171203_203446_ln_domov_ele,Ministrem školství v Babišově vládě má být náměstek ministerstva pro vysoké školy Plaga,Ministrem školství ve vládě Andreje Babiše (ANO) má být náměstek ministerstva zodpovědný za vysoké školy Robert Plaga (ANO). Babiš to v neděli řekl v...,lidovky.cz,domov
https://www.lidovky.cz/reditel-ct-se-se-zemanem-nesejde-prezident-pritom-tvrdil-ze-o-schuzku-pozadal-dvorak-gni-/zpravy-domov.aspx?c=A171203_180347_ln_domov_ele,"Ředitel ČT se se Zemanem nesejde. Prezident tvrdil, že o schůzku požádal sám Dvořák","Generální ředitel České televize Petr Dvořák se s prezidentem Milošem Zemanem nesejde. Informaci, kterou Zeman řekl serveru Parlamentní listy,...",lidovky.cz,domov
https://www.lidovky.cz/kontrolor-lavky-haji-zvolenou-metodu-pad-byl-podle-nej-anomalie-pwb-/zpravy-domov.aspx?c=A171203_154455_ln_domov_ele,"Kontrolor lávky hájí zvolenou metodu, pád byl podle něj anomálie","Monitoring, který na Trojské lávce prováděla firma Pontex, byl podle jejího ředitele Václava Hvízdala dostatečný pro kontrolu stavu mostu. V...",lidovky.cz,domov
/foto.aspx?c=A171205_135050_ln-sport-fotbal_lar,Bude ruská kráska pykat za ostatní? Curlerka Sidorovová by mohla na hrách chybět,Ruské servery před rozhodnutím Mezinárodního olympijského výboru o účasti tamních sportovců na nadcházejících zimních olympiádě mocně spekulují....,lidovky.cz,sport
https://www.lidovky.cz/novinar.aspx?idnov=466,Tomáš Macek,"Zažili nejhorší vstup do sezony za posledních šest let. Z Östersundu vytěžili čeští biatlonisté 7. a 8. místo Puskarčíkové a Vítkové, zatímco z mužů...",lidovky.cz,sport
https://sport.lidovky.cz/zahynul-dvojnasobny-vitez-velke-maskul-vydelal-pres-sedm-milionu-10c-/ostatni-sporty.aspx?c=A171205_142854_ln-sport-ostatni_lar,Zahynul dvojnásobný vítěz Velké Maskul. Vydělal přes sedm milionů,"V závěru minulého týdne zemřel dvojnásobný vítěz Velké pardubické Maskul. Úspěšnému překážkovému koni, který na dostihových drahách vydělal přes sedm...",lidovky.cz,sport
https://sport.lidovky.cz/chci-kolektivni-vinu-rusu-emoce-na-stupnich-vitezu-totiz-chybeji-tvrdi-koukalova-gi9-/ostatni-sporty.aspx?c=A171205_121626_ln-sport-ostatni_lar,"Chci kolektivní vinu Rusů. Emoce na stupních vítězů totiž chybějí, tvrdí Koukalová","Gabriela Koukalová patří k dlouholetým kritikům ruských sportovců a tamních sportovních funkcionářů. Kvůli tomu, že bylo během poslední zimní...",lidovky.cz,sport
https://sport.lidovky.cz/sagan-citi-zadostiucineni-cyklisticka-unie-uznala-ze-on-cavendishuv-pad-nezavinil-g28-/ostatni-sporty.aspx?c=A171205_111239_ln-sport-ostatni_lar,"Sagan cítí zadostiučinění. Cyklistická unie uznala, že Cavendishův pád byl neúmyslný",Trojnásobný mistr světa Peter Sagan a Mezinárodní cyklistická unie UCI urovnali těsně před slyšením před sportovním arbitrážním soudem CAS svůj spor...,lidovky.cz,sport
https://sport.lidovky.cz/uterni-verdikt-mov-je-uz-pry-znam-rusove-nebudou-moci-zavodit-pod-svou-vlajkou-gc4-/fotbal.aspx?c=A171205_102956_ln-sport-fotbal_lar,"Ruští hokejisté zřejmě nebudou na olympiádě, týmy nesmí závodit pod neutrální vlajkou","Web sport-express.ru uvedl, že olympijský start Rusů pod neutrální vlajkou automaticky znamená neúčast hokejistů, curlingových týmů, štafet a dalších...",lidovky.cz,sport
https://www.lidovky.cz/novinar.aspx?idnov=1572,Antonín Vavrda,Po desetiměsíční zdravotní pauze se legendární americký golfista Tiger Woods vrátil na greeny devátým místem z bahamského turnaje Hero World...,lidovky.cz,sport
https://www.lidovky.cz/novinar.aspx?idnov=1572,Antonín Vavrda,Na světovém šampionátu ve vzpírání se bouří někteří funkcionáři i závodníci proti startu Laurel Hubbartové z Nového Zélandu v nejtěžší váhové...,lidovky.cz,sport
https://sport.lidovky.cz/voracek-tremi-body-ukoncil-desetizapasovou-serii-proher-flyers-p8y-/hokej.aspx?c=A171205_071706_ln-sport-hokej_ele,NHL: Voráček třemi body ukončil desetizápasovou sérii proher Flyers,Hokejový útočník Jakub Voráček třemi asistencemi pomohl ukončit desetizápasovou sérii proher Philadelphie. Flyers zvítězili na ledě Calgary 5:2....,lidovky.cz,sport
https://www.lidovky.cz/novinar.aspx?idnov=3451,Tomáš Kubánek,"Mezinárodní olympijský výbor na dvoudenním zasedání, které dnes začíná, rozhodne o účasti ruských sportovců na zimní olympiádě 2018 v Pchjongčchangu.",lidovky.cz,sport
https://www.lidovky.cz/novinar.aspx?idnov=521,Miroslav Němý,I pravděpodobně nejznámějším novinám planety už stála za velký profilový text. Ester Ledecká v kanadském Lake Louise jen potvrdila své možnosti na...,lidovky.cz,sport
https://www.lidovky.cz/novinar.aspx?idnov=1572,Antonín Vavrda,"Zajímavým směrem se vydali autoři článku na britském webu DailyMail po losu blížícího se světového šampionátu ve fotbale, který bude v příštím roce...",lidovky.cz,sport
https://sport.lidovky.cz/vzperacky-se-bouri-kvuli-transgenderove-souperce-byla-muzem-ma-vyhodu-tvrdi-1w9-/ostatni-sporty.aspx?c=A171204_164218_ln-sport-ostatni_atv,"Vzperačky se bouří kvůli transgenderové soupeřce. ‚Byla mužem, má výhodu,‘ tvrdí","K adeptkám na medaili v nejtěžší váhové kategorii na mistrovství světa ve vzpírání patří i Laurel Hubbardová z Nového Zélandu, která v minulosti...",lidovky.cz,sport
https://www.lidovky.cz/novinar.aspx?idnov=1572,Antonín Vavrda,"Na parádní vlně se veze český hokejový útočník Radek Faksa. Urostlý centr minulé úterý vstřelil svůj první hattrick v zámořské NHL, od té doby...",lidovky.cz,sport
https://sport.lidovky.cz/video-hrdina-outsidera-brankar-beneventa-nechci-byt-utocnikem-neumim-behat-1u8-/fotbal.aspx?c=A171204_201551_ln-sport-fotbal_atv,"VIDEO: Hrdina outsidera, brankář Beneventa: Nechci být útočníkem, neumím běhat","Brankář Beneventa Alberto Brignoli, jenž v nedělním ligovém utkání hlavičkou v nastavení senzačně rozhodl o remíze svého celku 2:2 s AC Milán,...",lidovky.cz,sport
https://www.lidovky.cz/novinar.aspx?idnov=466,Tomáš Macek,"Gabriela Koukalová volným tempem absolvuje v Östersundu trénink, fotografuje se s týmem. Jenže místo závodů jen postává u trati, i s náhradní hůlkou,...",lidovky.cz,sport
https://sport.lidovky.cz/snadna-prace-ceske-florbalistky-smetly-norky-8-0-a-jsou-ve-ctvrtfinale-ms-1a4-/ostatni-sporty.aspx?c=A171204_200731_ln-sport-ostatni_atv,Snadná práce. České florbalistky smetly Norky 8:0 a jsou ve čtvrtfinále MS,České florbalistky porazily v závěrečném utkání ve skupině A na mistrovství světa v Bratislavě tým Norska jednoznačně 8:0 a zajistily si z druhé...,lidovky.cz,sport
https://sport.lidovky.cz/rusko-v-pripade-trestu-nebude-bojkotovat-hry-v-pchjongcchangu-putin-boj-s-mov-nechce-gni-/ostatni-sporty.aspx?c=A171204_142441_ln-sport-ostatni_atv,Rusko v případě trestu nebude bojkotovat hry v Pchjongčchangu. Putin boj s MOV nechce,"Rusko nebude bojkotovat zimní olympijské hry, pokud Mezinárodní olympijský výbor rozhodne, že ruští sportovci musejí v Pchjongčchangu startovat pod...",lidovky.cz,sport
https://sport.lidovky.cz/stramaccioni-prekvapilo-me-jak-je-liga-tezka-na-ligu-mistru-mame-ale-jen-4-body-ztratu-g3p-/fotbal.aspx?c=A171203_220832_ln-sport-ostatni_lar,"Stramaccioni: Překvapilo mě, jak je liga těžká. Na Ligu mistrů máme ale jen 4 body ztrátu","Italský trenér fotbalistů Sparty Andrea Stramaccioni po nepovedené podzimní části první ligy neřeší, jestli u týmu zůstane. V zimní přestávce chce...",lidovky.cz,sport
https://www.lidovky.cz/novinar.aspx?idnov=3709,Jaroslav Šindelář,"Český hokejový svaz se zalekl toho, že by čeští hokejisté z ruské Kontinentální ligy nemuseli hrát na olympiádě v Pchjongčchangu a tak napsali...",lidovky.cz,sport
https://sport.lidovky.cz/iransky-herkules-prekonal-dva-svetove-rekordy-chtel-jsem-jen-soupere-zaskocit-tvrdi-gaq-/ostatni-sporty.aspx?c=A171204_104030_ln-sport-ostatni_atv,"Íránský Herkules překonal dva světové rekordy. ‚Chtěl jsem jen soupeře zaskočit,‘ tvrdí",Dva světové rekordy zlepšil na mistrovství světa vzpěračů v Anaheimu Íránec Sohráb Moradí. Olympijský vítěz z Ria de Janeiro ovládl v neděli dvojboj...,lidovky.cz,sport
https://sport.lidovky.cz/bolt-ma-na-jamajce-bronzovou-sochu-jsem-v-soku-jak-je-tohle-mozne-divil-se-147-/ostatni-sporty.aspx?c=A171204_113741_ln-sport-ostatni_atv,"Bolt má na Jamajce bronzovou sochu. ‚Jsem v šoku, jak je tohle možné?‘ divil se",Atletické legendě Usainu Boltovi odhalili na rodné Jamajce sochu v nadživotní velikosti. Dva a půl metru vysoká bronzová skulptura zobrazuje...,lidovky.cz,sport
https://sport.lidovky.cz/nhl-faksa-bodoval-poctvrte-v-rade-dela-nas-lepsim-tymem-chvali-jej-seguin-1o5-/hokej.aspx?c=A171204_072002_ln-sport-hokej_ele,"NHL: Faksa bodoval počtvrté v řadě. ‚Dělá nás lepším týmem,‘ chválí jej Seguin","Hokejový útočník Radek Faksa bodoval v nedělním utkání NHL počtvrté v řadě, když asistencí podpořil vysoké vítězství Dallasu 7:2 v Coloradu....",lidovky.cz,sport
https://sport.lidovky.cz/ledecka-je-po-padu-v-poradku-jen-jsem-se-pomazlila-se-siti-vtipkovala-1gm-/ostatni-sporty.aspx?c=A171203_221010_ln-sport-ostatni_lar,"Ledecká je po pádu v pořádku. Jen jsem se pomazlila se sítí, vtipkovala","Ester Ledecká spadla při superobřím slalomu lyžařek v Lake Louise. Nešlo ovšem o nic vážného, česká olympijská naděje žádná zranění neutrpěla. Závod...",lidovky.cz,sport
https://sport.lidovky.cz/videorozhodci-hned-pri-premiere-potvrdil-gol-sparty-ta-porazila-boleslav-3-0-17i-/fotbal.aspx?c=A171203_195206_ln-sport-fotbal_lar,"Videorozhodčí hned při premiéře potvrdil gól Sparty, ta porazila Boleslav 3:0","Videorozhodčí hned při premiéře v první fotbalové lize pomohl potvrdit úvodní gól zápasu mezi Spartou a Mladou Boleslaví (3:0), jelikož nebylo jasné,...",lidovky.cz,sport
https://sport.lidovky.cz/kometa-prohrala-v-hradci-0-1-na-najezdy-sparta-udolala-jihlavu-6-5-v-prodlouzeni-1s7-/hokej.aspx?c=A171203_191027_ln-sport-hokej_lar,"Kometa prohrála v Hradci 0:1 na nájezdy, Sparta udolala Jihlavu 6:5 v prodloužení",Hokejisté Hradce Králové ve šlágru 28. kola extraligy porazili na svém ledě Kometu Brno 1:0 po samostatných nájezdech. Ty rozhodl bekhendovou střelou...,lidovky.cz,sport
https://sport.lidovky.cz/ceska-fantazie-hazenkarky-otocily-temer-prohrany-zapas-s-polskem-a-jsou-blizko-postupu-gui-/ostatni-sporty.aspx?c=A171203_153040_ln-sport-ostatni_lar,Česká fantazie. Házenkářky otočily téměř prohraný zápas s Polskem a jsou blízko postupu,"České házenkářky zvládly i druhý zápas na mistrovství světa, když překvapivě porazily favorizované Polsko 29:25. Přitom ještě ve 37. minutě Češky...",lidovky.cz,sport
https://sport.lidovky.cz/gattusa-o-prvni-vyhru-na-lavicce-ac-milan-pripravil-strilejici-golman-outsidera-gds-/fotbal.aspx?c=A171203_172536_ln-sport-fotbal_lar,Gattusa o první výhru na lavičce AC Milán připravil střílející gólman outsidera,Fotbalisté Beneventa získali první bod v italské lize. O remíze 2:2 v utkání 15. kola s AC Milán rozhodl gólem hlavou v páté minutě nastavení brankář...,lidovky.cz,sport
https://sport.lidovky.cz/cesky-ustup-z-pozic-pokracuje-nejlepsi-z-biatlonistu-byla-ve-stihacce-dvacata-vitkova-gqh-/ostatni-sporty.aspx?c=A171203_164658_ln-sport-ostatni_lar,Český ústup z pozic pokračuje. Nejlepší z biatlonistů byla ve stíhačce dvacátá Vítková,Němka Denise Herrmannová po pátečním sprintu ovládla na Světovém poháru biatlonistek ve švédském Östersundu i stíhací závod. Navzdory dvěma...,lidovky.cz,sport
https://sport.lidovky.cz/vrba-se-zastal-kolegy-silhaveho-slavia-nehraje-tak-spatne-jen-nemela-stesti-167-/fotbal.aspx?c=A171203_131135_ln-sport-fotbal_lar,"Vrba se zastal kolegy Šilhavého. Slavia nehraje tak špatně, jen neměla štěstí","I trenéra Pavla Vrbu překvapilo, jak dominantní podzim s fotbalisty Plzně prožívá. Sice čekal dobré výkony, ale nemyslel si, že to povede k náskoku...",lidovky.cz,sport
https://sport.lidovky.cz/fanousek-vyhrozuje-rozhodcim-smrti-tyhle-vanoce-pro-vas-budou-posledni-1ou-/fotbal.aspx?c=A171203_124848_ln-sport-fotbal_lar,Fanoušek vyhrožuje rozhodčím smrtí. Tyhle vánoce pro vás budou poslední,Kvůli verdiktům v zápasech Rapidu Vídeň čelí v Rakousku dva fotbaloví rozhodčí výhrůžkám smrtí. Dieter Muckenhammer a Manuel Schüttengruber obdrželi...,lidovky.cz,sport
https://sport.lidovky.cz/cesti-drahovi-cykliste-ziskali-na-sp-v-kanade-bronz-v-tymovem-sprintu-1k7-/ostatni-sporty.aspx?c=A171203_124336_ln-sport-ostatni_lar,Čeští dráhoví cyklisté získali na SP v Kanadě bronz v týmovém sprintu,"Dráhoví cyklisté Pavel Kelemen, David Sojka a Martin Čechman získali na Světovém poháru v kanadském Miltonu bronzové medaile v týmovém sprintu. V...",lidovky.cz,sport
https://sport.lidovky.cz/krpalek-ziskal-v-tokiu-stribro-klammertovi-unikl-bronz-pjx-/ostatni-sporty.aspx?c=A171203_112106_ln-sport-ostatni_lar,"Krpálek získal v Tokiu stříbro, Klammertovi unikl bronz",Judista Lukáš Krpálek se po pětiměsíční pauze zaviněné zraněním vrátil ve velkém stylu a na Grand Slamu v Tokiu získal stříbro ve váhové kategorii...,lidovky.cz,sport
/foto.aspx?c=A171202_191643_ln-sport-ostatni_lar,"Česká tenisová sexbomba strmě stoupá žebříčkem. Když se líčím, cítím se lépe","Je krásná, mladá a začíná být úspěšná. Monika Kilnarová už není jen hvězdou Instagramu kvůli svým modelkovským pózám tak jako Eugenie Bouchardová....",lidovky.cz,sport
https://sport.lidovky.cz/vorackovi-flyers-prohrali-podesate-v-rade-velkou-zasluhu-na-tom-ma-pastrnak-1vc-/hokej.aspx?c=A171202_220949_ln-sport-hokej_lar,"Voráčkovi Flyers prohráli podesáté v řadě, velkou zásluhu na tom má Pastrňák",Souboj nejproduktivnějších českých hokejistů v této sezoně NHL vyzněl jasně pro Davida Pastrňáka. Útočník Bostonu se podepsal gólem a asistencí pod...,lidovky.cz,sport
https://sport.lidovky.cz/slavny-horolezec-messner-se-oprel-do-ondry-a-spol-kazda-opice-je-nahore-rychleji-gdz-/ostatni-sporty.aspx?c=A171202_174835_ln-sport-ostatni_lar,Slavný horolezec Messner se opřel do Ondry a spol. Každá opice je nahoře rychleji,"Horolezecké legendě Reinholdu Messnerovi se nezamlouvá budoucí olympijská disciplína sportovní lezení, které bude mít premiéru v Tokiu v roce 2020....",lidovky.cz,sport
https://www.lidovky.cz/novinar.aspx?idnov=3899,Jaroslav Totušek,Příští rok uplyne rovných sto let od narození významného švédského režiséra Ingmara Bergmana. Hned několik českých institucí spojí síly a během...,lidovky.cz,kultura
https://www.lidovky.cz/festival-soundtrack-podebrady-oznamil-prvni-jmena-mezi-nimi-i-skladatele-erica-serru-gax-/kultura.aspx?c=A171205_154538_ln_kultura_jto,Festival Soundtrack Poděbrady oznámil první jména. Mezi nimi i skladatele Erica Serru,"Druhý ročník mezinárodního festivalu filmové hudby a multimédií Soundtrack Poděbrady 2018, který proběhne 30.8. – 2.9.2018 právě v Poděbradech,...",lidovky.cz,kultura
https://www.lidovky.cz/novinar.aspx?idnov=3961,Jiří Bigas,Podle důvěryhodných zdrojů magazínu Deadline by se Quentin Tarantino mohl ujmout režie dalšího Star Treku. O svůj námět pro příští film už se údajně...,lidovky.cz,kultura
https://www.lidovky.cz/novinar.aspx?idnov=2324,Marcel Kabát,"Kouzlo dystopického thrilleru 7 životů spočívá především v hereckém výkonu hlavní představitelky, která dokázala přesvědčivě odstínit sedmero různých...",lidovky.cz,kultura
https://www.lidovky.cz/novinar.aspx?idnov=4060,Pavel Tylšar,Americká online videotéka Netflix se s herci seriálu Dům z karet (v originálu House of Cards) po několika týdnech přerušeného natáčení dohodla na...,lidovky.cz,kultura
https://www.lidovky.cz/novinar.aspx?idnov=3899,Jaroslav Totušek,"Seriál Vikingové z produkce televize History Channel dospěl ke své páté sérii. Ačkoliv ukázky slibovaly velkolepou akční podívanou, v prvních dílech...",lidovky.cz,kultura
https://www.lidovky.cz/novinar.aspx?idnov=3899,Jaroslav Totušek,"Scenárista a spisovatel Jan Míka, který se narodil 4. prosince 1947, se proslavil zejména jako autor televizních seriálů. Zaujal hned svým prvním...",lidovky.cz,kultura
https://www.lidovky.cz/novinar.aspx?idnov=3899,Jaroslav Totušek,"Snímek po strništi bos vidělo v českých kinech více než 400 tisíc diváků. Jan Svěrák teď v kinech uvede jeho alternativní verzi. Ta je černobílá, s...",lidovky.cz,kultura
https://www.lidovky.cz/novinar.aspx?idnov=3784,Ondřej Bezr,Koncem loňského roku vydala skupina Jablkoň zatím poslední řadové album Vykolejená a následně letos v dubnu oslavila velkým koncertem v Divadle Archa...,lidovky.cz,kultura
https://www.lidovky.cz/recenze-marysa-nektera-ucinena-rozhodnuti-prinaseji-jenom-zkazu-pyn-/kultura.aspx?c=A171201_101344_ln_kultura_jto,RECENZE: Maryša. Některá učiněná rozhodnutí přinášejí jenom zkázu,Pražské Národní divadlo představilo novou inscenaci Maryši bratří Mrštíků v režii Jana Mikuláška,lidovky.cz,kultura
https://www.lidovky.cz/recenze-biografie-davida-kollera-kubisticky-portret-docela-normalniho-chlapa-1xg-/kultura.aspx?c=A171201_103420_ln_kultura_jto,RECENZE: Biografie Davida Kollera. Kubistický portrét docela normálního chlapa,"„Prostě dobrej chlap,“ odpovídá Vladimír Mišík na otázku, kdo že je to David Koller. Podobných odpovědí, stejně lakonických i rozkošatělých, najde...",lidovky.cz,kultura
https://www.lidovky.cz/slavny-dirigent-james-levine-celi-obvineni-z-obtezovani-nezletileho-chlapce-1s2-/kultura.aspx?c=A171203_075818_ln_kultura_ELE,Slavný dirigent James Levine čelí obvinění z obtěžování nezletilého chlapce,"Newyorská Metropolitní opera prošetří obvinění, podle nichž její dlouholetý dirigent a hudební ředitel James Levine v 80. letech sexuálně zneužíval...",lidovky.cz,kultura
https://www.lidovky.cz/recenze-ztracena-cest-kateriny-blumove-politicke-drama-jak-ma-byt-p9g-/kultura.aspx?c=A171201_105436_ln_kultura_jto,"RECENZE: Ztracená čest Kateřiny Blumové. Politické drama, jak má být","Švandovo divadlo uvedlo novou hru Ztracená čest Kateřiny Blumové, reflektující dění okolo Frakce Rudé armády i „feministické“ téma odpudivých mužů.",lidovky.cz,kultura
https://www.lidovky.cz/ceske-knihy-poznam-po-hmatu-rika-americky-ilustrator-p0b-/kultura.aspx?c=A171201_094529_ln_kultura_jto,"České knihy poznám po hmatu, říká americký ilustrátor","Steven Guarnaccia (* 1953) je americký ilustrátor a vysokoškolský profesor. Obrazový svět pojímá se zápalem – když přiletěl do Česka, už cestou z ...",lidovky.cz,kultura
https://www.lidovky.cz/hlavni-hvezdou-masters-of-rock-ve-vizovicich-bude-helloween-ple-/kultura.aspx?c=A171202_153809_ln_kultura_ele,Hlavní hvězdou festivalu Masters of Rock bude v létě skupina Helloween,"Hlavní hvězdou příštího ročníku metalového festivalu Masters of Rock, který se uskuteční 12. až 15 července příštího roku ve Vizovicích, bude německá...",lidovky.cz,kultura
https://www.lidovky.cz/recenze-krasavice-alkohol-a-mladi-takovy-pekny-par-mapuje-zivot-f-s-fitzgeralda-gcz-/kultura.aspx?c=A171201_104236_ln_kultura_jto,"RECENZE: Krasavice, alkohol a mládí. Takový pěkný pár mapuje život F. S. Fitzgeralda",Americký spisovatel Francis Scott Fitzgerald je všeobecně známý hlavně jako autor Velkého Gatsbyho a dalších románů. Blízký přítel Ernesta Hemingwaye...,lidovky.cz,kultura
https://www.lidovky.cz/recenze-nadech-pro-lasku-hrdinove-oslavuji-zivot-osudu-navzdory-pyd-/kultura.aspx?c=A171201_095201_ln_kultura_jto,RECENZE: Nádech pro lásku. Hrdinové oslavují život osudu navzdory,Režijní debut Andyho Serkise Nádech pro lásku s citem a optimismem oslavuje životní elán ochrnutého Angličana Robina Cavendishe a jeho okolí v podobě...,lidovky.cz,kultura
https://www.lidovky.cz/novinar.aspx?idnov=3899,Jaroslav Totušek,"Umělecká instalace nahých lidí se poprvé objevila v roce 2015 na výstavě ve Varšavě. Na veřejnost se dostala nová informace o tom, že video se...",lidovky.cz,kultura
https://www.lidovky.cz/chyt-me-jestli-na-to-mas-uspesny-broadwaysky-muzikal-miri-do-cech-ph7-/kultura.aspx?c=A171201_130358_ln_kultura_jto,"Chyť mě, jestli na to máš. Úspěšný broadwayský muzikál míří do Čech","Jako první v Česku se v sobotu plzeňské Divadlo J. K. Tyla na své Nové scéně představí premiérou broadwayského muzikálu Chyť mě, jestli na to máš...",lidovky.cz,kultura
https://www.lidovky.cz/novinar.aspx?idnov=3899,Jaroslav Totušek,Snímek Avengers: Infinity War den po svém uvedení na internetu překonal rekord pro nejsledovanější filmovou ukázku v historii. Spojení snad všech...,lidovky.cz,kultura
https://www.lidovky.cz/novinar.aspx?idnov=3899,Jaroslav Totušek,Rolando Villazón a Ildar Abdrazakov zahájili v Praze turné ke svému novému CD s operními duety pro tenor a basbaryton. Collegium Marianum oslavilo...,lidovky.cz,kultura
https://www.lidovky.cz/novinar.aspx?idnov=3784,Ondřej Bezr,"Jedna z nejaktivnějších osobností vzešlých ze šedesátých let, kanadský rockový písničkář Neil Young, přichází právě dnes s novým albem The Visitor....",lidovky.cz,kultura
https://www.lidovky.cz/poctivy-rock-kapela-pearl-jam-zavita-na-svem-evropskem-turne-i-do-prahy-1m8-/kultura.aspx?c=A171201_110328_ln_kultura_jto,Poctivý rock. Kapela Pearl Jam zavítá na svém evropském turné i do Prahy,"Americká rocková skupina Pearl Jam vystoupí 1. července v rámci svého evropského turné v pražské O2 areně. V metropoli se kapela, která za svoji...",lidovky.cz,kultura
https://www.lidovky.cz/muzikanti-zavzpominaji-v-mistech-kde-jeste-zadna-zapadni-kapela-nehrala-1ax-/kultura.aspx?c=A171129_173937_ln_kultura_bez,"Muzikanti zavzpomínají na Sennewalda. V místech, kde ještě žádná západní kapela nehrála",V sobotu 9. prosince se uskuteční v klubu Mondfisch v drážďanském centru kulturního a společenského života čtvrti Neustadt vzpomínkový večer na...,lidovky.cz,kultura
https://www.lidovky.cz/hutka-hladik-nebesti-maliri-dfb-/kultura.aspx?c=A171129_171237_ln_kultura_bez,"Jaroslav Hutka vydává nové album, natočené s Radimem Hladíkem",Hned dvě významné události čekají nestora českých písničkářů Jaroslava Hutku ve čtvrtek 7. prosince. V pražském Divadle U Hasičů oslaví koncertem...,lidovky.cz,kultura
https://www.lidovky.cz/divadelni-okenko-palmovka-prozrazuje-jak-vypada-rvacka-ze-zakulisi-1ph-/kultura.aspx?c=A171129_090334_ln_veda_ape,DIVADELNÍ OKÉNKO: Palmovka prozrazuje. Jak vypadá rvačka ze zákulisí?,"V rámci nového seriálu Palmovka prozrazuje se můžete nyní podívat do zákulisí Divadla pod Palmovkou. Jak vypadá rvačka, kterou v zákulisí nevidíte?...",lidovky.cz,kultura
https://www.lidovky.cz/novinar.aspx?idnov=2324,Marcel Kabát,"Renomovaný divadelník, vyhledávaný herec a v poslední době také filmový režisér Miroslav Krobot (* 1951) představuje svůj druhý snímek Kvarteto.",lidovky.cz,kultura
https://www.lidovky.cz/novinar.aspx?idnov=3784,Ondřej Bezr,"Deváté řadové, už tradičně jednoslovně pojmenované album Utopia vydala islandská zpěvačka Björk. Její domovský ostrov je pro ně možná důležitější než...",lidovky.cz,kultura
https://www.lidovky.cz/colours-of-ostrava-george-ezra-dzu-/kultura.aspx?c=A171129_162311_ln_kultura_bez,George Ezra na Colours of Ostrava zazpívá o Budapešti i o Barceloně,Colours of Ostrava zveřejňují jméno další hvězdy ročníku 2018. Je jí čtyřiadvacetiletý britský zpěvák s nezaměnitelným hlasem George Ezra. S písněmi...,lidovky.cz,kultura
https://www.lidovky.cz/novinar.aspx?idnov=3899,Jaroslav Totušek,Televize BBC oznámila plány na převedení románů spisovatele Charlese Dickense do seriálové podoby. První na řadě bude Vánoční koleda. Hlavním...,lidovky.cz,kultura
