link,link_text,txt,site,area
https://www.lidovky.cz/v-krkonosich-na-sjezdovce-portasky-ve-velke-upe-v-nedeli-zemrel-lyzar-1k4-/zpravy-domov.aspx?c=A180304_124436_ln_domov_ele,"V Krkonoších v neděli zemřel lyžař, v Beskydech se další vážně zranil","Na sjezdovce Portášky ve Velké Úpě, která je městskou částí Pece pod Sněžkou, v neděli dopoledne zemřel šestačtyřicetiletý lyžař. Mluvčí SkiResortu...",lidovky.cz,domov
https://www.lidovky.cz/sef-kscm-nechape-demonstrace-proti-novemu-sefovi-komise-pro-gibs-ph1-/zpravy-domov.aspx?c=A180304_121334_ln_domov_ele,Filip o účasti Ondráčka na zásazích proti demonstrantům v lednu 1989: Nevnímám to jako symbol něčeho špatného,"Předseda KSČM Vojtěch Filip nechápe důvody demonstrací proti zvolení expolicisty Zdeňka Ondráčka (KSČM), který před listopadem 1989 zasahoval proti...",lidovky.cz,domov
https://www.lidovky.cz/britsky-chlapec-jenz-se-lecil-v-cesku-se-zrejme-rakoviny-zbavil-podstoupil-tu-protonovou-lecbu-i2d-/zpravy-domov.aspx?c=A180304_113936_ln_domov_ele,"Britský chlapec, jenž se léčil v Česku, se zřejmě rakoviny zbavil. Podstoupil tu protonovou léčbu","Britský chlapec Ashya King, který se v roce 2014 v Česku podrobil protonové léčbě mozkového nádoru, je zřejmě zcela vyléčen. Lékaři se podle...",lidovky.cz,domov
https://www.lidovky.cz/novinar.aspx?idnov=2368,Šárka Kabátová,Čtyřiačtyřicetiletá onkologicky nemocná pacientka Hana Dvořáková začala další pomyslnou válku s VZP. Protože jí finančně nákladná biologická léčba na...,lidovky.cz,domov
https://www.lidovky.cz/novinar.aspx?idnov=2368,Šárka Kabátová,"Padesát tisíc podpisů pod peticí má posloužit jako vzkaz poslancům, že gayové a lesby chtějí mít v Česku možnost sňatku se svým partnerem....",lidovky.cz,domov
https://www.lidovky.cz/novinar.aspx?idnov=3890,Jan Horák,Český svaz bojovníků za svobodu si ve středu 7. března připomene výročí narození Tomáš Garrigua Masaryka. Z řečnického pultíku se k odkazu prvního...,lidovky.cz,domov
https://www.lidovky.cz/novinar.aspx?idnov=4066,Alena Bílková,Jan Čižinský chce s iniciativou Praha Sobě nahradit Adrianu Krnáčovou (ANO) na postu primátora. Iniciativa je podle něj nezbytná kvůli sběru podpisů...,lidovky.cz,domov
https://www.lidovky.cz/korupcni-kauzy-v-niz-si-lekar-udajne-rekl-o-uplatky-obzalovany-vladimir-dbaly-by-se-mel-vratit-pre-inj-/zpravy-domov.aspx?c=A180304_112642_ln_domov_ele,"Korupční kauzy, v níž si lékař údajně řekl o úplatky. Obžalovaný Vladimír Dbalý by se měl vrátit před soud",Pražský městský soud by v příštím týdnu mohl pokračovat v hlavním líčení s bývalým ředitelem Nemocnice Na Homolce Vladimírem Dbalým. Projednávání...,lidovky.cz,domov
https://www.lidovky.cz/novinar.aspx?idnov=3709,Jaroslav Šindelář,"Přestože byl ve Spartě nováčkem, vzal si v 88. minutě duelu osmifinálové skupiny Ligy mistrů s Barcelonou míč a rozhodl se, že to bude za stavu 1:1...",lidovky.cz,sport
https://sport.lidovky.cz/rusti-atleti-maji-smulu-jejich-trest-za-organizovany-doping-dal-plati-1eo-/ostatni-sporty.aspx?c=A180306_163019_ln-sport-ostatni_lar,Ruští atleti mají smůlu. Jejich trest za organizovaný doping dál platí,"Mezinárodní federace IAAF ponechala v platnosti zákaz startu ruských atletů v mezinárodních soutěžích, který kvůli státem podporovanému dopingu platí...",lidovky.cz,sport
https://www.lidovky.cz/novinar.aspx?idnov=466,Tomáš Macek,"Bylo to zatím nejvíce vzrušujících, ale i nejvíce vyčerpávajících 40 dnů v kariéře jedenadvacetileté biatlonistky Markéty Davidové. Na jejich konci...",lidovky.cz,sport
https://sport.lidovky.cz/sparta-propustila-stramaccioniho-jednani-o-novem-kouci-stale-probihaji-1aa-/fotbal.aspx?c=A180306_110047_ln-sport-fotbal_lar,Sparta propustila Stramaccioniho. Místo něj ji povede Hapal. Podepsal smlouvu do roku 2020,Vedení fotbalové Sparty v úterý dopoledne po dvoudenním jednání odvolalo z pozice hlavního trenéra Itala Andreu Stramaccioniho. Novým koučem se stal...,lidovky.cz,sport
https://sport.lidovky.cz/hodil-plastovou-lahvi-po-rozhodcim-trener-liberce-musi-zaplatit-mastnou-pokutu-gfw-/hokej.aspx?c=A180306_150028_ln-sport-hokej_lar,Hodil plastovou láhví po rozhodčím. Trenér Liberce musí zaplatit mastnou pokutu,"Trenér hokejového Liberce Filip Pešán dostal od disciplinární komise extraligy pokutu 50 tisíc korun za to, že v nedělním zápase 52. kola ve...",lidovky.cz,sport
https://www.lidovky.cz/novinar.aspx?idnov=3709,Jaroslav Šindelář,"Pravidla jsou od toho, aby se dodržovala. Na druhou stranu je velkou chybou lpět na jejich dodržování za každou cenu, když jejich drobné porušení...",lidovky.cz,sport
https://sport.lidovky.cz/kdybych-byl-vrah-byl-bych-na-tom-lepe-rozciluje-wiggins-ktery-je-narceny-z-dopingu-giz-/ostatni-sporty.aspx?c=A180306_113308_ln-sport-ostatni_lar,"Kdybych byl vrah, byl bych na tom lépe, rozčiluje Wiggins, který je nařčený z dopingu","Bývalý cyklista Bradley Wiggins tvrdí, že nikdy během kariéry nepodváděl a je obětí honu na čarodějnice. V rozhovoru pro BBC uvedl, že by na tom byl...",lidovky.cz,sport
https://sport.lidovky.cz/nhl-michael-frolik-opet-bodoval-na-vyhru-calgary-to-ale-nestacilo-phm-/hokej.aspx?c=A180306_075513_ln-sport-hokej_ele,NHL: Michael Frolík opět bodoval. Na výhru Calgary to ale nestačilo,"Útočník Michael Frolík díky asistenci v pondělním zápase Calgary na ledě Pittsburghu bodoval ve čtvrtém z posledních pěti utkání NHL, jeho tým ale...",lidovky.cz,sport
https://sport.lidovky.cz/stramaccioni-ma-dnes-skoncit-na-lavicce-sparty-o-jeho-nastupci-se-jedna-1mi-/fotbal.aspx?c=A180305_140744_ln-sport-fotbal_lar,Stramaccioni má dostat výpověď až v úterý. Jeho nástupcem se má stát Hapal,"Vedení fotbalové Sparty nadále řeší situaci kolem trenéra Andrey Stramaccioniho. Podle italských médií byl kouč odvolán, letenský klub to však...",lidovky.cz,sport
https://sport.lidovky.cz/schumacher-lide-by-si-meli-pomahat-kazdy-uprchlik-prece-neni-terorista-1zq-/fotbal.aspx?c=A180305_161847_ln-sport-fotbal_lar,Schumacher: Lidé by si měli pomáhat. Každý uprchlík přece není terorista,"Kterak se někdejší mládežnický kapitán fotbalové Borussie Dortmund, jenž trénoval i pod slavným koučem Jürgenem Kloppem a byl na soupisce týmu pro...",lidovky.cz,sport
https://sport.lidovky.cz/ziskala-dve-medaile-z-ms-pak-ale-musela-britska-atletka-jet-na-jatka-105-/ostatni-sporty.aspx?c=A180305_121538_ln-sport-ostatni_lar,"Získala dvě medaile z MS, pak ale musela britská atletka jet na jatka","Britská atletka Laura Muirová zamířila z halového mistrovství světa v Birminghamu, kde získala dvě medaile, rovnou na jatka.",lidovky.cz,sport
https://sport.lidovky.cz/dalsi-rana-pro-cyklisticky-svet-wiggins-zneuzil-pred-viteznou-tour-terapeutickou-vyjimku-gh9-/ostatni-sporty.aspx?c=A180305_120521_ln-sport-ostatni_lar,Další rána pro cyklistický svět. Wiggins prý zneužil před vítěznou Tour terapeutickou výjimku,"Britská parlamentní komise ve zprávě o dopingu ve sportu uvedla, že cyklistický tým Sky a jeho bývalá hvězda Bradley Wiggins překročili „etickou...",lidovky.cz,sport
https://sport.lidovky.cz/legendarni-kobe-bryant-ziskal-oscara-zfilmoval-basen-o-sve-lasce-k-basketu-150-/ostatni-sporty.aspx?c=A180305_134938_ln-sport-ostatni_effe,"Legendární Kobe Bryant získal Oscara, zfilmoval báseň o své lásce k basketu","Bývalý slavný basketbalista Kobe Bryant získal dva roky po konci kariéry další trofej. Za zfilmovanou báseň „Drahý basketbale“, kterou napsal právě...",lidovky.cz,sport
https://www.lidovky.cz/novinar.aspx?idnov=3451,Tomáš Kubánek,Během dosavadních tří jarních ligových kol zažilo premiéru v nových klubech hned sedm trenérů. A někteří z nich jsou nečekaně velmi úspěšní.,lidovky.cz,sport
https://www.lidovky.cz/novinar.aspx?idnov=119,Robert Sára,"Nová sezona odstartuje až za tři týdny, ale už teď se piloti formule 1 „děsí“ té, která přijde za rok. Ač se totiž vždy shodovali, že maximem je 20...",lidovky.cz,sport
https://www.lidovky.cz/novinar.aspx?idnov=110,Jan Palička,"Kdy, když ne letos? Vždyť už loni bylo pozdě. Nejspíš i předloni. „Trenér Wenger býval skvělý vůdce, jenže prováhal možnost, jak odejít se vztyčenou...",lidovky.cz,sport
https://sport.lidovky.cz/spartanska-krize-klub-bude-resit-co-dal-odvola-stramaccioniho-pu9-/fotbal.aspx?c=A180304_225129_ln-sport-fotbal_effe,"Sparťanská krize. Klub bude řešit, co dál. Odvolá Stramaccioniho?",Představenstvo fotbalové Sparty Praha se bude v pondělí zabývat nepovedeným vstupem týmu do jarní části první ligy. Letenští ztrácejí po nedělní...,lidovky.cz,sport
https://sport.lidovky.cz/gulas-suverenne-vyhral-produktivitu-hlavni-je-ale-uspech-v-play-off-rika-1qc-/hokej.aspx?c=A180304_205045_ln-sport-hokej_vlh,"Gulaš suverénně vyhrál produktivitu. ‚Hlavní je ale úspěch v play off,‘ říká","Hokejový útočník Milan Gulaš z Plzně sice vynechal ze zdravotních důvodů poslední tři utkání základní části extraligy, přesto suverénně vyhrál...",lidovky.cz,sport
https://sport.lidovky.cz/trapeni-sparty-pokracuje-remizovala-i-s-brnem-ktere-hralo-20-minut-v-oslabeni-1va-/fotbal.aspx?c=A180304_195605_ln-sport-fotbal_vlh,"Trápení Sparty pokračuje. Remizovala i s Brnem, které hrálo 20 minut v oslabení",Fotbalisté Sparty v 19. kole první ligy remizovali 1:1 s Brnem a promarnili možnost posunout se na čtvrté místo. Zbrojovka na Letné vedla díky brance...,lidovky.cz,sport
https://sport.lidovky.cz/polska-senzace-stafeta-predcila-americany-ve-svetovem-rekordu-cesi-byli-pati-1wo-/ostatni-sporty.aspx?c=A180304_191644_ln-sport-ostatni_vlh,Polská senzace: štafeta předčila Američany ve světovém rekordu. Češi byli pátí,"Štafeta českých čtvrtkařů skončila na halovém mistrovství světa v Birminghamu pátá. Michal Desenský, Patrik Šorm, Filip Šnejdr a trojnásobný světový...",lidovky.cz,sport
https://www.lidovky.cz/novinar.aspx?idnov=115,Jaroslav Tomas,"Hokejisté Pardubic jsou posledními přímými účastníky čtvrtfinále play off, přestože v posledním kole základní části prohráli v domácím prostředí s...",lidovky.cz,sport
https://sport.lidovky.cz/biatlonovy-prislib-davidova-se-stala-juniorskou-mistryni-sveta-ve-stihacce-1vq-/ostatni-sporty.aspx?c=A180304_140825_ln-sport-ostatni_vlh,Biatlonový příslib. Davidová se stala juniorskou mistryní světa ve stíhačce,Biatlonistka Markéta Davidová je juniorskou mistryní světa ve stíhacím závodu. Jednadvacetiletá olympionička dnes v Estonsku vrátila Polce Kamile...,lidovky.cz,sport
https://sport.lidovky.cz/nekonecne-cekani-na-200-nulu-cech-znovu-chyboval-a-arsenal-prohral-p81-/fotbal.aspx?c=A180304_165451_ln-sport-fotbal_vlh,Nekonečné čekání na 200. nulu. Čech znovu chyboval a Arsenal prohrál,Fotbalisté Manchesteru City porazili v šlágru 29. kola anglické ligy obhájce titulu Chelsea 1:0 a mají v čele tabulky náskok 18 bodů před...,lidovky.cz,sport
https://sport.lidovky.cz/italsky-fotbal-zasahla-tragedie-zemrel-kapitan-fiorentiny-pa7-/fotbal.aspx?c=A180304_122339_ln-sport-fotbal_vlh,"Italský fotbal zasáhla tragédie. V hotelu našli mrtvého kapitána Fiorentiny, reprezentanta Astoriho",Kapitán Fiorentiny Davide Astori zemřel ve spánku před nedělním zápasem italské ligy v Udine. Fotbalový reprezentant byl nad ránem nalezen mrtev v...,lidovky.cz,sport
https://sport.lidovky.cz/nejlepsi-judo-v-praze-krpalek-ziskal-bronz-klammert-prozil-stribrny-debut-1ul-/ostatni-sporty.aspx?c=A180304_172214_ln-sport-ostatni_vlh,"Nejlepší Judo v Praze: Krpálek získal bronz, Klammert prožil stříbrný debut",Judista David Klammert získal na turnaji European Open v Praze poprvé v kariéře mezi seniory stříbrnou medaili v kategorii do 90 kilogramů. Zastínil...,lidovky.cz,sport
https://sport.lidovky.cz/video-nagano-tapes-strhujici-podivana-pri-ktere-ceske-fanousky-zahreje-i-mrazi-191-/hokej.aspx?c=A180302_211145_ln-sport-hokej_lar,"VIDEO: Nagano Tapes. Strhující podívaná, při které české fanoušky zahřeje i mrazí",Oficiální kanál olympijských her se rozhodl začít produkovat filmy a hned jako první si vybral zřejmě největší úspěch v dějinách českého novodobého...,lidovky.cz,sport
https://sport.lidovky.cz/slavny-vasuv-beh-dokoncila-smutna-na-tretim-miste-rezac-dojel-sedmy-11f-/ostatni-sporty.aspx?c=A180304_155343_ln-sport-ostatni_vlh,"Slavný Vasův běh dokončila Smutná na třetím místě, Řezáč dojel sedmý",Kateřina Smutná doběhla třetí ve slavném Vasově běhu a podruhé se v cílovém městě Mora prosadila na pódium. Před dvěma lety se zapsala do historie...,lidovky.cz,sport
https://sport.lidovky.cz/sampion-wilder-vstal-z-mrtvych-zapas-s-ortizem-zvladl-i-pres-tezkou-krizi-1tf-/ostatni-sporty.aspx?c=A180304_124120_ln-sport-ostatni_vlh,Šampion Wilder ‚vstal z mrtvých‘. Zápas s Ortizem zvládl i přes těžkou krizi,Americký boxer Deontay Wilder obhájil titul profesionálního mistra světa těžké váhy organizace WBC. V New Yorku knokautoval v desátém kole Kubánce...,lidovky.cz,sport
https://sport.lidovky.cz/fenomenalni-hirscher-znovu-kraloval-posedme-v-rade-vyhral-svetovy-pohar-1qt-/ostatni-sporty.aspx?c=A180304_140134_ln-sport-ostatni_vlh,Fenomenální Hirscher znovu kraloval. Posedmé v řadě vyhrál Světový pohár,Rakušan Marcel Hirscher vyhrál jako první v historii posedmé za sebou celkové hodnocení Světového poháru alpských lyžařů. V Kranjské Goře si zajistil...,lidovky.cz,sport
https://sport.lidovky.cz/vrana-skoroval-v-utkani-pod-sirym-nebem-voracek-ani-mrazek-neodvratili-prohru-1h8-/hokej.aspx?c=A180304_075313_ln-sport-hokej_ele,NHL: Vrána skóroval v utkání pod širým nebem. Voráček ani Mrázek neodvrátili prohru,"Hokejový útočník Jakub Vrána skóroval v utkání NHL, které se hrálo pod širým nebem, a jedenáctou trefou sezony přispěl k výhře Washingtonu 5:2 nad...",lidovky.cz,sport
https://sport.lidovky.cz/maslak-o-necekanem-zlatu-jsem-zaskoceny-emoce-mam-bronzove-paq-/ostatni-sporty.aspx?c=A180304_004535_ln-sport-ostatni_effe,"Maslák o nečekaném zlatu:’Jsem zaskočený, emoce mám bronzové'",Zrovna rozdával rozhovory. Reportérům před kamerami popisoval bronzové emoce. V tom se náhle na světelné tabuli v mixzóně objevilo jméno Pavla...,lidovky.cz,sport
https://sport.lidovky.cz/ronaldo-pokoril-dalsi-milnik-proti-getafe-nacal-ctvrtou-stovku-golu-ve-spanelske-lize-gl0-/fotbal.aspx?c=A180303_224958_ln-sport-fotbal_effe,"Ronaldo pokořil další milník, proti Getafe načal čtvrtou stovku gólů ve španělské lize",Cristiano Ronaldo oslavil jubilejní 300. branku ve španělské fotbalové lize a při výhře Realu Madrid 3:1 nad Getafe zároveň otevřel čtvrtou stovku...,lidovky.cz,sport
https://sport.lidovky.cz/olympijska-fenomenka-ledecka-dojela-v-kayseri-druha-a-ma-jisty-maly-kristalovy-globus-g4e-/ostatni-sporty.aspx?c=A180303_142432_ln-sport-ostatni_effe,Olympijská fenoménka Ledecká dojela v Kayseri druhá a má jistý malý křišťálový glóbus,Snowboardistka Ester Ledecká skončila týden po olympijském zlatu druhá v paralelním obřím slalomu na Světovém poháru v tureckém Kayseri. Podruhé v...,lidovky.cz,sport
https://sport.lidovky.cz/zlaty-zvrat-maslak-dobehl-treti-ale-diskvalifikace-souperu-ho-opet-vynesla-na-trun-gk9-/ostatni-sporty.aspx?c=A180303_213035_ln-sport-ostatni_effe,"Zlatý zvrat. Maslák doběhl třetí, ale diskvalifikace soupeřů ho opět vynesla na trůn",Čtvrtkař Pavel Maslák se stal potřetí za sebou halovým mistrem světa. Na šampionátu v Birminghamu sice doběhl třetí za Španělem Óscarem Husillosem a...,lidovky.cz,sport
https://sport.lidovky.cz/slavia-vyhrala-v-mlade-boleslavi-tvrdak-petrzela-pri-zlinske-premiere-schytal-vyprask-gru-/fotbal.aspx?c=A180303_170133_ln-sport-fotbal_effe,"Slavia vyhrála v Mladé Boleslavi, tvrďák Petržela při zlínské premiéře schytal výprask","V boji o pohárové příčky v 19. kole české fotbalové ligy zvítězily týmy Slavie a Olomouce, zatímco Liberec byl rád za bod, když doma s Karvinou...",lidovky.cz,sport
https://sport.lidovky.cz/cekala-jsem-ze-me-dojedou-ale-porad-nedojizdely-samkova-po-olympijskem-bronzu-vyhrala-v-la-moli-iij-/ostatni-sporty.aspx?c=A180303_123211_ln-sport-ostatni_effe,"‚Čekala jsem, že mě dojedou, ale pořád nedojížděly.‘ Samková po olympijském bronzu vyhrála v La Molině",Eva Samková vyhrála první závod Světového poháru ve snowboardcrossu po zisku bronzové medaile na olympijských hrách v Pchjongčchangu. V La Molině si...,lidovky.cz,sport
https://www.lidovky.cz/velky-knizni-ctvrtek-prazske-vzpominky-oscaroveho-umelce-i-pribeh-akce-kamen-1x3-/kultura.aspx?c=A180306_103729_ln_kultura_jto,VELKÝ KNIŽNÍ ČTVRTEK: pražské vzpomínky oscarového umělce i příběh akce Kámen,"Americký umělec Gene Deitch vypráví o svém desetidenním výletu do Prahy, který se protáhl na více než padesát let. Václava Jandečková zase poutavým...",lidovky.cz,kultura
https://www.lidovky.cz/ceny-magnesia-litera-zaznamenaly-rekordnich-382-prihlasenych-knih-phs-/kultura.aspx?c=A180306_132955_ln_kultura_ele,Ceny Magnesia Litera zaznamenaly rekordních 382 přihlášených knih,Ocenění v rámci 17. ročníku knižních cen Magnesia Litera může stejně jako loni získat 27 knih a šest blogů. Pořadatelé cen letos zaznamenali...,lidovky.cz,kultura
https://www.lidovky.cz/novinar.aspx?idnov=493,Jana Machalická,"Studio Hrdinů uvedlo divadelní adaptaci Kafkovy povídky Zpráva pro jistou akademii. Režisérka Katharina Schmittová opět prokázala, že má cit pro...",lidovky.cz,kultura
https://www.lidovky.cz/zlodej-ukradl-herecce-mcdormandove-oscara-policie-muze-zadrzela-p8h-/kultura.aspx?c=A180306_101559_ln_kultura_jto,Zloděj ukradl herečce McDormandové Oscara. Policie muže zadržela,"Americká policie zadržela muže, který údajně ukradl sošku Oscara herečce Francis McDormandové krátce po nedělním předáváním filmových cen v Los...",lidovky.cz,kultura
https://www.lidovky.cz/premiera-videoklip-agu-07p-/kultura.aspx?c=A180306_094413_ln_kultura_bez,VIDEO: Písničkářka Agu v osobní novince reflektuje vlastní dospívání,"Muzikantka a písničkářka polského původu Agu, zpívající česky, polsky i anglicky, a slučující ve své tvorbě prvky indie folku, post rocku a ambientu,...",lidovky.cz,kultura
https://www.lidovky.cz/novinar.aspx?idnov=3899,Jaroslav Totušek,"„Tohle je jen začátek,“ pronáší nová americká prezidentka Claire Underwoodová (Robin Wrightová) přímo do kamery. Populární seriál Dům z karet (House...",lidovky.cz,kultura
https://www.lidovky.cz/festival-jeden-svet-ocenil-vietnamskou-blogerku-ktera-usiluje-o-demokratickou-zmenu-ve-sve-zemi-izm-/kultura.aspx?c=A180305_203517_ln_kultura_ele,"Festival Jeden svět ocenil vietnamskou blogerku, která usiluje o demokratickou změnu ve své zemi","Předáním ceny za lidská práva Homo Homini a projekcí prvního filmu začal v pondělí večer v Praze 20. ročník festivalu Jeden svět. Cenu, kterou udílí...",lidovky.cz,kultura
https://www.lidovky.cz/novinar.aspx?idnov=3899,Jaroslav Totušek,"V neděli odpoledne se v losangelském Dolby Theathre předávaly již devadesáté ceny Americké filmové akademie. Ačkoliv se tentokrát obálky nepomíchaly,...",lidovky.cz,kultura
https://www.lidovky.cz/lepsi-spolecnost-je-akorat-banda-snobu-divadlo-na-zabradli-uvede-bernhardovo-myceni-gzl-/kultura.aspx?c=A180305_151129_ln_kultura_jto,Lepší společnost je akorát banda snobů. Divadlo Na zábradlí uvede Bernhardovo Mýcení,"Návštěva u lepší společnosti je v Bernhardově je v podání Thomase Bernharda sžíravá satira o snobství, nafoukanosti a špatně skrývaných antipatiích....",lidovky.cz,kultura
https://www.lidovky.cz/novinar.aspx?idnov=3899,Jaroslav Totušek,Slavnostní jubilejní galavečer 90. ročníku cen Akademie filmového umění se obešel navzdory očekávání bez výrazných projevů na podporu hnutí #metoo....,lidovky.cz,kultura
https://www.lidovky.cz/novinar.aspx?idnov=4066,Alena Bílková,"Rag’n’Bone Man přijel do Prahy na vrcholu své kariéry. Špicí jeho show měl být hit, který loni zboural hitparády. Human. Píseň o tom, že se máme víc...",lidovky.cz,kultura
https://www.lidovky.cz/recenze-hori-v-sade-rodnem-kvet-kabaret-o-ceske-statnosti-zkouma-narodni-identitu-gid-/kultura.aspx?c=A180302_112104_ln_kultura_jto,RECENZE: Hoří v sadě rodném květ. Kabaret o české státnosti zkoumá národní identitu,Letošní sté výročí založení republiky svérázně zpracovala pětice režisérů v inscenaci brněnského Národního divadla Hoří v sadě rodném květ.,lidovky.cz,kultura
https://www.lidovky.cz/rusko-a-zapad-si-nerozumeji-rika-rusky-reziser-alexej-german-mladsi-11k-/kultura.aspx?c=A180302_112842_ln_kultura_jto,"Rusko a Západ si nerozumějí, říká ruský režisér Alexej German mladší","Na právě skončeném filmovém festivalu v Berlíně měl v hlavní soutěži premiéru ruský film Dovlatov režiséra Alexeje Germana mladšího, který se rozhodl...",lidovky.cz,kultura
https://www.lidovky.cz/v-los-angeles-vrcholi-pripravy-na-devadesate-udileni-oscaru-pqv-/kultura.aspx?c=A180304_115038_ln_kultura_ele,V Los Angeles vrcholí přípravy na devadesáté udílení Oscarů,"Už za několik hodin se filmoví fanoušci na celém světě dozvědí, kdo letos obdrží prestižní ocenění americké filmové akademie Oscar. Jasného favorita...",lidovky.cz,kultura
https://www.lidovky.cz/novinar.aspx?idnov=493,Jana Machalická,Bláznivý mumraj divokých devadesátých let ožívá na Palmovce. Tomáš Dianiška ve svém novém kusu Pusťte Donnu k maturitě! ke zvýšení surreálnosti děje...,lidovky.cz,kultura
https://www.lidovky.cz/kniha-novinare-wolffa-kritizujici-trumpa-vychazi-v-cestine-pod-nazvem-ohen-a-hnev-gi4-/kultura.aspx?c=A180303_131638_ln_kultura_ele,Kniha novináře Wolffa kritizující Trumpa vychází v češtině pod názvem Oheň a hněv,Česky pod názvem Oheň a hněv vychází v těchto dnech kniha novináře Michaela Wolffa nevybíravě kritizující amerického prezidenta Donalda Trumpa. V USA...,lidovky.cz,kultura
https://www.lidovky.cz/rok-filmu-ve-znameni-toxickeho-nedostatku-originality-anticena-zlata-malina-ma-sve-viteze-g8d-/kultura.aspx?c=A180303_103445_ln_kultura_ele,Rok filmu ve znamení ‚toxického nedostatku originality‘. Anticena Zlatá malina má své vítěze,"Komedie Emoji ve filmu si vysloužila anticenu za nejhorší film loňského roku. Agentura AP připomíná, že za 38 let, co se Zlaté maliny udělují, je to...",lidovky.cz,kultura
https://www.lidovky.cz/novinar.aspx?idnov=2923,Judita Matyášová,"Třicet variací na abstraktní umění představuje ostravský Dům umění. Kupka, Foltýn, ale také Moholy-Nagy nebo Mondrian byli součástí mezinárodní...",lidovky.cz,kultura
https://www.lidovky.cz/velky-knizni-ctvrtek-serie-vrazd-na-sibiri-i-patalie-ruskeho-aristokrata-1ln-/kultura.aspx?c=A180302_121956_ln_kultura_jto,VELKÝ KNIŽNÍ ČTVRTEK: série vražd na Sibiři i patálie ruského aristokrata,"Mrazivá detektivka Tomáše Boukala zavede čtenáře do centra Sibiře. O příhodách ruského hraběte zase píše Amor Towles. Kniha Dívka, která upíjela...",lidovky.cz,kultura
https://www.lidovky.cz/recenze-ja-tonya-filmova-krasojizda-zostuzene-bruslarky-za-vlastnim-znicenim-19p-/kultura.aspx?c=A180302_110222_ln_kultura_jto,"RECENZE: Já, Tonya. Filmová krasojízda zostuzené bruslařky za vlastním zničením","Margot Robbieová září v  novince Já, Tonya, temperamentní černé komedii o smutném osudu americké krasobruslařky Tonyi Hardingové, jejíž talent...",lidovky.cz,kultura
https://www.lidovky.cz/novinar.aspx?idnov=2324,Marcel Kabát,"Na pět Oscarů nominovaný režijní debut čtyřiatřicetileté herečky a scenáristky Grety Gerwigové Lady Bird se s úsměvem ohlíží za tím, co milujeme,...",lidovky.cz,kultura
https://www.lidovky.cz/novinar.aspx?idnov=3899,Jaroslav Totušek,"Web Deadline přišel s informací, že se kultovní Zeměplocha spisovatele Terryho Pratchetta dočká seriálového zpracování od BBC Studios.",lidovky.cz,kultura
https://www.lidovky.cz/hastrman-romanticky-thriller-ondreje-havelky-se-predstavuje-dlouhou-ukazkou-1ha-/kultura.aspx?c=A180302_113628_ln_kultura_jto,Hastrman. Romantický thriller Ondřeje Havelky se představuje dlouhou ukázkou,Pořádně temný romantický thriller.Touto zajímavou směsicí žánrů by měla být novinka Hastrman od režiséra Ondřeje Havelky. Film se nyní dočkal své...,lidovky.cz,kultura
https://www.lidovky.cz/hollywoodem-potece-krev-v-tarantinove-novince-si-zahraji-dicaprio-i-pitt-1li-/kultura.aspx?c=A180302_092518_ln_kultura_jto,Hollywoodem poteče krev. V Tarantinově novince si zahrají DiCaprio i Pitt,"V novém snímku režiséra Quentina Tarantina nazvaném Once Upon a Time in Hollywood (Kdysi dávno v Hollywoodu), který vypráví o hlavním městě filmového...",lidovky.cz,kultura
https://www.lidovky.cz/novinar.aspx?idnov=3784,Ondřej Bezr,"Ve své hudební kariéře toho má za sebou v různých žánrech za tři. Na své první album, kde je leaderem jazzové kapely, si ale klavírista a skladatel...",lidovky.cz,kultura
https://www.lidovky.cz/novinar.aspx?idnov=3784,Ondřej Bezr,V srpnu roku 2016 oslavil v Los Angeles jeden z nejvýznamnějších hráčů na elektrickou kytaru všech dob Jeff Beck výročí půlstoletí působení na...,lidovky.cz,kultura
