link,link_text,txt,site,area
https://www.lidovky.cz/svycarsky-soud-v-hlavnich-bodech-potvrdil-verdikt-v-kauze-mus-pbp-/zpravy-domov.aspx?c=A171229_124553_ln_domov_sij,Švýcarský soud potvrdil verdikt pro Koláčka a Krause v kauze MUS,Švýcarská nejvyšší soudní instance v hlavních bodech odmítla odvolání pěti odsouzených v kauze Mostecké uhelné společnosti (MUS). Švýcarský Spolkový...,lidovky.cz,domov
https://www.lidovky.cz/pocasi-na-prelomu-roku-teplomery-ukazou-az-11-stupnu-obloha-bude-zatazena-1q4-/zpravy-domov.aspx?c=A171229_110048_ln_domov_ele,"Počasí na přelomu roku: teploměry ukážou až 11 stupňů, obloha bude zatažená","Poslední dny roku 2017 a první dny roku 2018 budou ve znamení převážně zatažené oblohy, deštivých a sněhových přeháněk. Největší výkyv přijde v...",lidovky.cz,domov
https://www.lidovky.cz/novinar.aspx?idnov=2368,Šárka Kabátová,Na začátku nového roku se ve studiu televize Barrandov sejdou vybraní kandidáti na post prezidenta republiky. Televize se přesto brání označit pořad...,lidovky.cz,domov
https://www.lidovky.cz/novinar.aspx?idnov=3560,Tomáš Málek,Půl hodiny po poledni 28. prosince 1941 se na britské letecké základně Tangmere rozdrnčel telefon. Akce může začít. Přesně ve 22.00 tamního času se...,lidovky.cz,domov
https://www.lidovky.cz/novinar.aspx?idnov=1890,Michaela Kabátová,Letošek se v českém prostředí nesl hlavně v duchu sněmovních voleb. A jeden výraz byl pro ně klíčovým. Ujal se jako postoj jedné skupiny voličů proti...,lidovky.cz,domov
https://www.lidovky.cz/novinar.aspx?idnov=3808,Robert Sattler,"Nebývalý počet obětí ve Vysokých Tatrách během dvou dnů, kdy mezi čtyřmi mrtvými byli hned tři Češi, přiměl slovenskou horskou službu k vydání...",lidovky.cz,domov
https://www.lidovky.cz/novinar.aspx?idnov=3890,Jan Horák,"Pokud chcete znát výši odměn zaměstnanců veřejné sféry, v první řadě musíte zdůvodnit váš motiv. Jinými slovy úřady při vyřizování žádostí podle...",lidovky.cz,domov
https://www.lidovky.cz/policie-vytahuje-ze-dna-vapenky-na-teplicku-kradena-auta-pkf-/zpravy-domov.aspx?c=A171228_171507_ln_domov_ele,Policie vytahovala ze dna vápenky na Teplicku kradená auta,"Kradená auta vyprošťovala ve čtvrtek policie s pomocí potápěčů a hasičů z vápenky v Lahošti na Teplicku. Pod vodou skončily čtyři vozy, řekl mluvčí...",lidovky.cz,domov
https://sport.lidovky.cz/trinecky-irgl-bude-hrat-mesic-v-olomouci-opacnym-smerem-miri-vlach-103-/hokej.aspx?c=A180101_202717_ln-sport-hokej_rsa,Třinecký Irgl bude hrát měsíc v Olomouci. Opačným směrem míří Vlach,Hokejový útočník Zbyněk Irgl bude měsíc hostovat z Třince v Olomouci a opačným směrem zamířil forvard Roman Vlach. Sedmatřicetiletý Irgl působí v...,lidovky.cz,sport
https://sport.lidovky.cz/shiffrinova-v-oslu-vyhrala-paralelni-slalom-a-upevnila-si-vedeni-ve-svetovem-poharu-gm9-/ostatni-sporty.aspx?c=A180101_192325_ln-sport-ostatni_rsa,Shiffrinová v Oslu vyhrála paralelní slalom. Upevnila si vedení ve světovém poháru,Američanka Mikaela Shiffrinová a Švéd André Myhrer vyhráli novoroční paralelní slalom Světového poháru alpských lyžařů v Oslu. Shiffrinová potvrdila...,lidovky.cz,sport
https://sport.lidovky.cz/vydra-si-v-anglii-pripsal-jiz-14-ligovou-branku-v-sezone-na-vyhru-to-nestacilo-1sv-/fotbal.aspx?c=A180101_191558_ln-sport-fotbal_rsa,Vydra si v Anglii připsal již 14. ligovou branku v sezóně. Na výhru to nestačilo,"Fotbalista Matěj Vydra si ve druhé anglické lize přenesl střeleckou formu i do nového roku, jeho trefa však Derby vítězství nepřinesla. Český...",lidovky.cz,sport
https://sport.lidovky.cz/liverpool-golem-v-nastaveni-porazil-burnley-a-neprohral-jiz-16-zapas-v-rade-159-/fotbal.aspx?c=A180101_191046_ln-sport-fotbal_rsa,Liverpool gólem v nastavení porazil Burnley a neprohrál již 16. zápas v řadě,Ve čtvrté minutě nastavení vybojovali fotbalisté Liverpoolu vítězství 2:1 na hřišti Burnley a prozatím se bodově dotáhli na třetí Manchester United....,lidovky.cz,sport
https://www.lidovky.cz/novinar.aspx?idnov=3808,Robert Sattler,"Nejtěžší motoristický podnik světa pětkrát vyhrál, jeho cílem však naposledy projel v roce 2009. Loni skončil po těžkém pádu a s Dakarem se už...",lidovky.cz,sport
https://sport.lidovky.cz/dahlmeierova-je-opet-nemocna-nejspis-prijde-o-svetovy-pohar-v-oberhofu-1mt-/ostatni-sporty.aspx?c=A180101_171405_ln-sport-ostatni_rsa,Dahlmeierová je opět nemocná. Nejspíš přijde o světový pohár v Oberhofu,Obhájkyně velkého křišťálového glóbu Laura Dahlmeierová znovu bojuje se zdravotními problémy a možná vynechá čtvrtou zastávku Světového poháru v...,lidovky.cz,sport
https://sport.lidovky.cz/stoch-vyhral-dalsi-zavodu-turne-ctyr-mustku-a-miri-za-obhajobou-cesi-skoncili-v-1-kole-gaw-/ostatni-sporty.aspx?c=A180101_170005_ln-sport-ostatni_rsa,Stoch vyhrál další závodu Turné a míří za obhajobou. Češi skončili v 1. kole,Polský skokan na lyžích Kamil Stoch vyhrál i druhý závod Turné čtyř můstků v Garmisch-Partenkirchenu. Obhájce titulu porazil stejně jako v úvodním...,lidovky.cz,sport
https://sport.lidovky.cz/druhy-nejlepsi-vykon-kariery-lyzarka-novakova-dojela-v-lenzerheide-devata-1u4-/ostatni-sporty.aspx?c=A180101_134131_ln-sport-ostatni_rsa,Druhý nejlepší výkon kariéry. Lyžařka Nováková dojela v Lenzerheide devátá,Běžkyně na lyžích Petra Nováková skončila v Lenzerheide devátá ve stíhacím závodu volnou technikou na deset kilometrů a ve třetí etapě Tour de Ski...,lidovky.cz,sport
https://sport.lidovky.cz/nhl-faksa-trikrat-nahraval-a-stal-se-hvezdou-vecera-jagr-posedme-v-rade-nebodoval-gf1-/hokej.aspx?c=A180101_115556_ln-sport-hokej_rsa,NHL: Faksa třikrát nahrával a stal se hvězdou večera. Jágr posedmé v řadě nebodoval,Hokejový útočník Radek Faksa v nedělním zápase NHL prožil druhý tříbodový večer v sezoně. Třemi asistencemi pomohl k výhře Dallasu 6:0 nad San Jose a...,lidovky.cz,sport
https://www.lidovky.cz/novinar.aspx?idnov=1572,Antonín Vavrda,"Ke konci roku patří glosování a ohlížení se za uplynulými měsíci. V následujícím článku, kterým otevíráme na našem webu sportovní rok 2018, se budeme...",lidovky.cz,sport
https://sport.lidovky.cz/cesti-hokejovi-mladici-porazily-svycary-ze-skupiny-postoupi-nejhure-ze-treti-pricky-g4j-/hokej.aspx?c=A171231_211614_ln-sport-hokej_rsa,Čeští hokejoví mladíci porazili Švýcary. Ze skupiny postoupí nejhůře ze třetí příčky,Čeští junioři porazili ve svém závěrečném vystoupení v základní skupině B mistrovství světa v Buffalu Švýcarsko 6:3. Do čtvrtfinále play off tak...,lidovky.cz,sport
https://sport.lidovky.cz/nevzdavam-se-na-letne-chci-jeste-chytat-rika-nejlepsi-spartan-silvestrovskeho-derby-bicik-gwj-/fotbal.aspx?c=A171231_184347_ln-sport-fotbal_rsa,"Nevzdávám se, na Letné chci ještě chytat, říká nejlepší sparťan silvestrovského derby Bičík",Stále aktivní ligový fotbalista pražské Sparty brankář David Bičík byl jedním z pěti nováčků v dresu letenského týmu v Silvestrovském derby...,lidovky.cz,sport
https://sport.lidovky.cz/silhavy-z-odchodu-ze-slavie-je-mi-smutno-veril-jsem-ze-zustanu-do-konce-sezony-1h4-/fotbal.aspx?c=A171231_141641_ln-sport-fotbal_rsa,"Šilhavý: Z odchodu ze Slavie je mi smutno. Věřil jsem, že zůstanu do konce sezóny","Trenér Jaroslav Šilhavý věřil, že na lavičce slávistických fotbalistů zůstane minimálně do konce sezony. Cítil, že obhájci ligového titulu má stále...",lidovky.cz,sport
https://sport.lidovky.cz/manchester-city-nedal-crystal-palace-branku-skoncila-jeho-rekordni-snura-vyher-gca-/fotbal.aspx?c=A171231_153632_ln-sport-fotbal_rsa,Čech přišel v závěru o 200. čisté konto v lize. Vítězná šňůra Citizens skončila,Chybělo jen pár minut a brankář Petr Čech mohl v neděli s příchodem nového roku slavit i jubilejní 200. zápas s čistým kontem v anglické fotbalové...,lidovky.cz,sport
https://sport.lidovky.cz/silvestrovske-derby-opanovala-sparta-slavii-nadelila-devet-branek-1d9-/fotbal.aspx?c=A171231_130431_ln-sport-fotbal_rsa,Silvestrovské derby opanovala Sparta. Slavii nadělila devět branek,Fotbaloví internacionálové Sparty v Silvestrovském derby rozdrtili pražského rivala Slavii 9:4. Letenští dosáhli v tradiční exhibici na závěr roku...,lidovky.cz,sport
https://sport.lidovky.cz/video-bizar-nebo-regulerni-sport-svet-objevuje-kouzlo-behani-s-konskou-hlavou-1yn-/ostatni-sporty.aspx?c=A171230_183113_ln-sport-ostatni_lar,VIDEO: Bizár nebo regulérní sport? Svět objevuje kouzlo běhání s koňskou hlavou,"Co to jako má být? To je nějaká sranda? Kdepak! Hobby Horse, tedy běhání s dřevěnou koňskou hlavou přes překážky, jsou regulérní závody, v nichž se...",lidovky.cz,sport
https://sport.lidovky.cz/cologna-vyhral-druhy-zavod-tour-de-ski-nejlepsi-cech-jaks-skoncil-tesne-bez-bodu-gdp-/ostatni-sporty.aspx?c=A171231_120832_ln-sport-ostatni_rsa,Nováková doběhla v druhém závodě Tour de Ski čtrnáctá. Jakš skončil těsně bez bodů,Petra Nováková doběhla čtrnáctá v druhé etapě Tour de Ski na 10 km klasicky v Lenzerheide a stejné místo jí patří v průběžném pořadí. Zvítězila...,lidovky.cz,sport
https://sport.lidovky.cz/svetovemu-sportu-kraluji-teniste-federer-a-williamsova-ovladli-novinarskou-anketu-g3e-/ostatni-sporty.aspx?c=A171231_140725_ln-sport-ostatni_rsa,Světovému sportu kralují tenisté. Federer a Williamsová ovládli novinářskou anketu,Anketu Mezinárodní asociace sportovních novinářů (AIPS) o nejlepšího světového sportovce končícího roku ovládli tenisté. Mužskou kategorii vyhrál v...,lidovky.cz,sport
https://sport.lidovky.cz/kanada-slavi-potreti-v-rade-triumf-na-spengler-cupu-ve-finale-porazila-svycarsko-gp1-/hokej.aspx?c=A171231_144153_ln-sport-hokej_rsa,Kanada slaví potřetí v řadě triumf na Spengler Cupu. Ve finále porazila Švýcarsko,Hokejisté Kanady vyhráli potřetí za sebou Spenglerův pohár a celkovým patnáctým triumfem se v historické tabulce dotáhli na pořádající Davos....,lidovky.cz,sport
https://sport.lidovky.cz/nhl-hvezda-utkani-krejci-oslavil-navrat-do-sestavy-bostonu-golem-a-asistenci-1wg-/hokej.aspx?c=A171231_072109_ln-sport-hokej_ELE,NHL: Hvězda utkání. Krejčí oslavil návrat do sestavy Bostonu gólem a asistencí,"Hokejový útočník David Krejčí v sobotním zápase NHL oslavil návrat do sestavy Bostonu po šestizápasové absenci gólem a asistencí, jimiž přispěl k...",lidovky.cz,sport
https://sport.lidovky.cz/cesti-hokejovi-mladici-zvladli-prestrelku-s-belorusy-a-slavi-postup-do-ctvrtfinale-gm0-/hokej.aspx?c=A171230_204620_ln-sport-hokej_rsa,Čeští hokejoví mladíci zvládli přestřelku s Bělorusy a slaví postup do čtvrtfinále,Česká hokejová dvacítka zvítězila na mistrovství světa v Buffalu nad Běloruskem 6:5 a po druhé výhře ze tří vystoupení na turnaji si zajistila postup...,lidovky.cz,sport
https://sport.lidovky.cz/kometa-vyhrala-1-0-ve-vitkovicich-a-ukoncila-jejich-serii-deviti-vyher-v-rade-1uy-/hokej.aspx?c=A171230_182417_ln-sport-hokej_lar,Kometa vyhrála 1:0 ve Vítkovicích a ukončila jejich sérii devíti výher v řadě,Hokejisté Komety Brno zvítězili v utkání 35. kola extraligy ve Vítkovicích 1:0 a ukončili tak sérii devíti výher domácích. Utkání rozhodl v 54....,lidovky.cz,sport
https://sport.lidovky.cz/chelsea-deklasovala-stoke-peti-goly-liverpool-otocil-duel-s-leicesterem-1o4-/fotbal.aspx?c=A171230_181842_ln-sport-fotbal_lar,"Chelsea deklasovala Stoke pěti góly, Liverpool otočil duel s Leicesterem",Fotbalisté Chelsea v 21. kole anglické ligy deklasovali Stoke 5:0 a poskočili na druhé místo neúplné tabulky. Čtvrtý Liverpool rovněž doma otočil...,lidovky.cz,sport
https://sport.lidovky.cz/uvodni-zavod-turne-vyhral-v-oberstdorfu-stoch-koudelka-ma-bod-p6l-/ostatni-sporty.aspx?c=A171230_185546_ln-sport-ostatni_lar,"Úvodní závod Turné vyhrál v Oberstdorfu Stoch, Koudelka má bod","Úvodní závod Turné čtyř můstků v německém Oberstdorfu vyhrál polský skokan na lyžích Kamil Stoch, jenž v prestižním seriálu obhajuje celkové...",lidovky.cz,sport
https://sport.lidovky.cz/hradec-si-finale-spengler-cupu-nezahraje-i-podruhe-podlehl-kanade-pho-/hokej.aspx?c=A171230_181042_ln-sport-hokej_lar,Hradec si finále Spengler Cupu nezahraje. I podruhé podlehl Kanadě,Hokejisté Hradce Králové podlehli v semifinále Spenglerova poháru Kanadě 2:5 a nedokázali jí oplatit prohry z loňského čtvrtfinále (1:5) i z úterního...,lidovky.cz,sport
https://sport.lidovky.cz/serena-williamsova-se-vratila-po-porodu-na-kurt-vitezce-french-open-vsak-podlehla-gie-/ostatni-sporty.aspx?c=A171230_155109_ln-sport-ostatni_lar,Serena Williamsová se vrátila po porodu na kurt. Vítězce French Open však podlehla,"Serena Williamsová v prvním utkání po porodu prohrála na exhibici v Abú Zabí s lotyšskou tenistkou Jelenou Ostapenkovou 2:6, 6:3, 5:10.",lidovky.cz,sport
https://sport.lidovky.cz/americane-a-kanadane-se-brodili-ve-snehu-z-ledu-jej-museli-odstranit-lopatami-1vu-/hokej.aspx?c=A171230_133336_ln-sport-hokej_lar,Američané a Kanaďané se brodili ve sněhu. Z ledu jej museli odstranit lopatami,Hokejisté domácích Spojených států amerických i Kanady si páteční premiérový zápas mistrovství světa dvacítek pod širým nebem vychutnali.,lidovky.cz,sport
https://sport.lidovky.cz/sparta-ziskala-dalsiho-reprezentanta-do-obrany-prichazi-slovak-daloga-1md-/hokej.aspx?c=A171230_132310_ln-sport-ostatni_lar,Sparta získala dalšího reprezentanta. Do obrany přichází Slovák Ďaloga,"Do hokejové Sparty míří podle agentury RIA Novosti slovenský reprezentační obránce Marek Ďaloga, který rozvázal smlouvu s čínským účastníkem...",lidovky.cz,sport
https://sport.lidovky.cz/federer-zacal-sezonu-na-hopmanove-poharu-vitezstvim-pct-/ostatni-sporty.aspx?c=A171230_131639_ln-sport-ostatni_lar,Federer začal sezonu na Hopmanově poháru vítězstvím,Švýcar Roger Federer zahájil novou tenisovou sezonu vítězstvím. Na Hopmanově poháru v australském Perthu bývalý první hráč světa porazil Japonce...,lidovky.cz,sport
https://www.lidovky.cz/novinar.aspx?idnov=1572,Antonín Vavrda,Už více než 37 milionů diváků navštívilo od roku 1930 všechny zápasy fotbalového mistrovství světa. S ohledem na kapacitu jedenácti hostitelských...,lidovky.cz,sport
https://sport.lidovky.cz/nhl-voracek-pomohl-k-vyhre-flyers-polak-nezabranil-prohre-toronta-10z-/hokej.aspx?c=A171230_065842_ln-sport-hokej_ele,"NHL: Voráček pomohl k výhře Flyers, Polák nezabránil prohře Toronta",Nejproduktivnější český hráč v NHL Jakub Voráček pomohl dvěma nahrávkami k výhře hokejistů Philadelphie 5:3 na ledě nejlepšího týmu soutěže Tampy...,lidovky.cz,sport
https://www.lidovky.cz/novinar.aspx?idnov=3709,Jaroslav Šindelář,"Devět medailí, z toho dvě zlaté – to je rekordní počet cenných kovů ze zimních olympijských her, které čeští sportovci získali před čtyřmi lety v...",lidovky.cz,sport
https://sport.lidovky.cz/hradec-si-ve-ctvrtfinale-spengler-cupu-poradil-s-rigou-o-finale-se-utka-s-kanadou-gds-/hokej.aspx?c=A171229_173859_ln-sport-hokej_lar,Hradec si ve čtvrtfinále Spengler Cupu poradil s Rigou. O finále se utká s Kanadou,Hokejisté Hradce Králové porazili ve čtvrtfinále Spenglerova poháru v Davosu účastníka Kontinentální ligy Dinamo Riga 4:1 a v sobotu se od 15:10...,lidovky.cz,sport
https://sport.lidovky.cz/stepanek-si-na-trenersky-debut-musi-pockat-djokovic-si-obnovil-zraneni-13m-/ostatni-sporty.aspx?c=A171229_172626_ln-sport-fotbal_lar,Štěpánek si na trenérský debut musí počkat. Djokovič si obnovil zranění,Novak Djokovič musel odložit páteční návrat k tenisu a debut pod trenérským vedením Radka Štěpánka na exhibici v Abú Zabí.,lidovky.cz,sport
https://sport.lidovky.cz/ibrahimovic-je-v-bowlingu-horsi-i-nez-rooneyho-manzelka-pjn-/fotbal.aspx?c=A171229_171912_ln-sport-fotbal_lar,Ibrahimovic je v bowlingu horší i než Rooneyho manželka,Bowlingovým uměním se švédský fotbalista Zlatan Ibrahimovic rozhodně chlubit nebude.,lidovky.cz,sport
https://sport.lidovky.cz/ustupek-rusum-na-jejich-dome-v-pchjongcchangu-bude-viset-statni-vlajka-1mj-/ostatni-sporty.aspx?c=A171229_145438_ln-sport-ostatni_lar,Ústupek Rusům. Na jejich domě v Pchjongčchangu bude viset státní vlajka,Ruský dům na olympijských hrách v Pchjongčchangu může být vyzdoben státní vlajkou i znakem. Sportovci i funkcionáři budou v Koreji vystupovat jako...,lidovky.cz,sport
https://www.lidovky.cz/rok-2018-sezona-vytvarneho-umeni-bude-probihat-ve-znameni-osmicek-pw5-/kultura.aspx?c=A171229_111909_ln_kultura_jto,ROK 2018: Sezóna výtvarného umění bude probíhat ve znamení osmiček,"Co se výtvarného umění týče, bude příští sezona nabitá od začátku do konce.",lidovky.cz,kultura
https://www.lidovky.cz/novinar.aspx?idnov=2324,Marcel Kabát,Do kin budou v roce 2018 lákat pokračování úspěšných ság i novinky oblíbených režisérů,lidovky.cz,kultura
https://www.lidovky.cz/novinar.aspx?idnov=3899,Jaroslav Totušek,Letošní rok nejvíce poznamenala sebevražda dvou hudebníků a kamarádů Chrise Cornella a Chestera Bennigtona. Připomeňte si se serverem Lidovky.cz osm...,lidovky.cz,kultura
https://www.lidovky.cz/novinar.aspx?idnov=3899,Jaroslav Totušek,Silvestr není jen o vtipných televizních estrádách. Na své si v programové nabídce přijde každý. Server Lidovky.cz vám přináší několik tipů z...,lidovky.cz,kultura
https://www.lidovky.cz/s-reholniky-jsme-hrali-kulecnik-i-ping-pong-rika-jiri-suchy-pau-/kultura.aspx?c=A171229_105435_ln_kultura_jto,"S řeholníky jsme hráli kulečník i ping-pong, říká Jiří Suchý","Knihou Klaun si povídá s Bohem pozval Jiří Suchý diváky, posluchače a čtenáře do další z komnat své umělecké duše. Třebaže neopouští svůj typický...",lidovky.cz,kultura
https://www.lidovky.cz/nove-album-a-osm-koncertu-skupina-mandrage-v-unoru-zahaji-celorepublikove-turne-gfm-/kultura.aspx?c=A171230_115053_ln_kultura_ele,Nové album a osm koncertů. Skupina Mandrage v únoru zahájí celorepublikové turné,"Singlem a videoklipem Motýli avizuje skupina Mandrage vydání nového alba, které by se pod názvem Po půlnoci mělo objevit 19. ledna. Poté 2. února...",lidovky.cz,kultura
https://www.lidovky.cz/novinar.aspx?idnov=493,Jana Machalická,Novou inscenaci Dejvického divadla Vražda krále Gonzaga v režii Jiřího Havelky tvoří dvě v zásadě odlišné části. Myšlenkové propojení jim nelze...,lidovky.cz,kultura
https://www.lidovky.cz/nejvic-vtipu-se-rikalo-o-husakovi-rika-spisovatel-a-novinar-jan-nejedly-1nm-/kultura.aspx?c=A171229_110033_ln_kultura_jto,"Nejvíc vtipů se říkalo o Husákovi, říká spisovatel a novinář Jan Nejedlý",Po prvním díle lexikonu lidové tvořivosti z dob socialismu nazvaném Po práci legraci přichází Jan Nejedlý s dalším dílem.,lidovky.cz,kultura
https://www.lidovky.cz/novinar.aspx?idnov=3899,Jaroslav Totušek,Dodávka punkové kapely Plexis cestou ze štědrovečerního koncertu havarovala. Členové skončili s vážnými poraněními v nemocnici. Nehodu nepřežila...,lidovky.cz,kultura
https://www.lidovky.cz/novinar.aspx?idnov=2324,Marcel Kabát,"Muzikál Největší showman nominovaný na tři Zlaté glóby představuje zakladatele slavného cirkusu v době, kdy provozoval panoptikum s trpaslíky a...",lidovky.cz,kultura
https://www.lidovky.cz/novinar.aspx?idnov=3899,Jaroslav Totušek,"Snímek Vetřelec: Covenant režiséra Ridleyho Scotta si v kinech nevedl nejlépe. Z plánovaného pokračování, na kterém se údajně nejpozději začátkem...",lidovky.cz,kultura
https://www.lidovky.cz/novinar.aspx?idnov=493,Jana Machalická,Vánoce se zřejmě pro nezanedbatelnou část obyvatelstva naší země smrskly na konzumaci jídla a televize. Výrazem degradace Vánoc a duchovního života...,lidovky.cz,kultura
https://www.lidovky.cz/novinar.aspx?idnov=3899,Jaroslav Totušek,"Ačkoliv kritiku Poslední z Jediů oslovil, tak někteří z fanoušků ságy Star Wars z filmu nadšení nejsou. Z rozhořčení touto epizodou pak přicházejí s...",lidovky.cz,kultura
https://www.lidovky.cz/kinterovy-nervous-trees-pritahly-do-rudolfina-pres-160-tisic-lidi-pho-/kultura.aspx?c=A171227_191844_ln_kultura_ele,Kinterovy Nervous Trees přitáhly do Rudolfina přes 160 tisíc lidí,"Výstavu Krištofa Kintery nazvanou Nervous Trees od začátku září navštívilo 161 824 lidí. Jen ve středu, v závěrečný den výstavy, si ji do pražské...",lidovky.cz,kultura
https://www.lidovky.cz/novinar.aspx?idnov=3899,Jaroslav Totušek,Poslední prosincový týden míří do kin tři snímky. Životopisný film na motivy osudů největšího cirkusového principála doplní novodobý trosečník v...,lidovky.cz,kultura
https://www.lidovky.cz/novinar.aspx?idnov=3899,Jaroslav Totušek,"Fantasy snímek Bright je se svým rozpočtem 90 milionů dolarů (některé zdroje dokonce uvádějí 117 milionů) prvním velkým 
původním filmem společnosti...",lidovky.cz,kultura
https://www.lidovky.cz/novinar.aspx?idnov=3899,Jaroslav Totušek,"Jeden den někdy stačí na to, aby se divák stačil ponořit do seriálového světa a zároveň se z něj pln dojmů na konci i vynořit. Server Lidovky.cz vám...",lidovky.cz,kultura
https://www.lidovky.cz/recenze-obrazy-kamila-lhotaka-ztvarnuji-basnivost-periferie-a-fascinaci-technikou-gks-/kultura.aspx?c=A171222_101015_ln_kultura_jto,RECENZE: Obrazy Kamila Lhotáka ztvárňují básnivost periferie a fascinaci technikou,"Vyšla výpravná publikace, která vyčerpávajícím způsobem mapuje malby Kamila Lhotáka, slavného člena Skupiny 42",lidovky.cz,kultura
https://www.lidovky.cz/novinar.aspx?idnov=3899,Jaroslav Totušek,"Popelka je oblíbený lidový příběh, který se dočkal řady zpracování. Pohádková postava ale měla poměrně krvavé začátky a první film o ní vznikl ještě...",lidovky.cz,kultura
https://www.lidovky.cz/predpoved-objektu-malirky-z-makrace-se-predstavuji-kazda-trochu-jinak-1ex-/kultura.aspx?c=A171222_100408_ln_kultura_jto,"Předpověď objektu. Malířky z Makráče se představují, každá trochu jinak","Ve středověku se jim říkalo „hic sunt leones“, dnes „mám to z ruky“. Přesto jde o místa, která je dobré alespoň jednou za čas navštívit. Jedním z...",lidovky.cz,kultura
https://www.lidovky.cz/andel-pane-2-jednicka-stedreho-vecera-i-nejsledovanejsi-pohadka-poslednich-15-let-19x-/kultura.aspx?c=A171225_123826_ln_kultura_barp,Nejsledovanější pohádka za 15 let. Anděl páně 2 viděly na Štědrý večer tři miliony diváků,Štědrovečerní film Anděl Páně 2 se stal s více než třemi miliony diváků nejsledovanější pohádkou posledních patnácti let. Na prvním programu České...,lidovky.cz,kultura
https://www.lidovky.cz/novinar.aspx?idnov=3899,Jaroslav Totušek,"Ačkoliv má série Sám doma hned pět dílů, tak za kultovní jsou považovány první dva. V nich se Kevin McCallister (Macaulay Culkin) postaví dvojici...",lidovky.cz,kultura
https://www.lidovky.cz/recenze-udoli-to-takhle-vejdou-steinbeck-hrabal-a-hirsal-do-baru-psa-/kultura.aspx?c=A171222_101610_ln_kultura_jto,"RECENZE: Údolí. To takhle vejdou Steinbeck, Hrabal a Hiršal do baru...","Michal Šanda (* 1965) patří k nejzábavnějším spisovatelům, kterými se může česká literatura po roce 1989 pochlubit.",lidovky.cz,kultura
https://www.lidovky.cz/stedry-den-v-televiznich-obrazovkach-na-co-se-divaci-mohou-tesit-p8l-/kultura.aspx?c=A171223_222303_ln_kultura_jto,"Štědrý den na televizních obrazovkách. Tipy, na co se diváci mohou těšit","Televizní stanice se jako každý rok na Vánoce předhánějí v tom, kdo nabídne lepší zábavu. Čím lákají letos? Server Lidovky.cz vám přináší deset tipů...",lidovky.cz,kultura
https://www.lidovky.cz/recenze-danska-obcanska-valka-vymirani-lidi-kteri-ztratili-duveru-103-/kultura.aspx?c=A171222_094134_ln_kultura_jto,"RECENZE: Dánská občanská válka. Vymírání lidí, kteří ztratili důvěru",Nová premiéra Divadla Na zábradlí – první v rekonstruované budově – má podle programu hned tři autory.,lidovky.cz,kultura
https://www.lidovky.cz/andelem-pane-jsem-priblizoval-lidem-nabozenstvi-rika-reziser-jiri-strach-1lr-/kultura.aspx?c=A171222_105515_ln_kultura_jto,"Andělem páně jsem přibližoval lidem náboženství, říká režisér Jiří Strach",Snímek Anděl Páně 2 se stal nejvýdělečnějším českým filmem v kinech všech dob. Film odvysílá ČT1 v televizní premiéře na Štědrý večer. Server...,lidovky.cz,kultura
https://www.lidovky.cz/plakaty-obvinovaly-streepovou-ze-vedela-o-weinsteinove-chovani-odveta-za-trumpa-priznal-umelec-ieh-/kultura.aspx?c=A171223_101955_ln_kultura_prop,"Plakáty obviňovaly Streepovou, že věděla o Weinsteinově chování","Americká oscarová herečka Meryl Streepová čelí plakátové kampani, ve které je obviňována, že věděla o násilném sexuálním chování hollywoodského...",lidovky.cz,kultura
https://www.lidovky.cz/jedna-z-umeleckych-vystav-roku-raffael-santi-se-vratil-do-vidne-pv5-/kultura.aspx?c=A171222_091518_ln_kultura_jto,Jedna z uměleckých výstav roku. Raffael Santi se vrátil do Vídně,Po osmnácti letech se vrací Vídeň k Raffaelovi. Opět v Albertině a v podstatně větším rozsahu. Zatímco minulá výstava měla tendenci srovnávat mistra...,lidovky.cz,kultura
