link,link_text,txt,site,area
https://www.lidovky.cz/domov/zemedelci-propadaji-zoufalstvi-cesko-celi-extremnimu-suchu-neroste-ani-trava.A190423_163652_ln_domov_krku,"Zemědělci propadají zoufalství. Česko čelí extrémnímu suchu, neroste ani tráva","Zemědělci, kteří jsou zároveň reportéry vědeckého projektu InterSucho, začínají být ve svých krátkých zprávách velmi pesimističtí a někteří až...",lidovky.cz,domov
https://www.lidovky.cz/domov/ustavni-soud-se-vyjadril-k-razii-v-growshopech-policie-zabirala-veci-v-neprimerenem-rozsahu.A190423_143817_ln_domov_ele,Ústavní soud se vyjádřil k razii v growshopech. Policie zabírala věci v ‚nepřiměřeném rozsahu‘,"Justice při zabrání zboží porušila práva firem, které provozovaly takzvané growshopy, tedy obchody s pomůckami pro pěstitele konopí i dalších...",lidovky.cz,domov
https://www.lidovky.cz/domov/senat-asi-odmitne-narodni-sportovni-agenturu-rozhodne-snemovna.A190423_133822_ln_domov_ele,Senát zřejmě odmítne Národní sportovní agenturu. Kvůli obavám z nárůstu administrativy,"Senát by měl odmítnout vznik Národní sportovní agentury, která má převzít od ministerstva školství sportovní agendu včetně dotací. Horní komoře to v...",lidovky.cz,domov
https://www.lidovky.cz/domov/cvvm-nejvetsi-podporu-mezi-stranami-si-drzi-ano-za-nim-je-ods.A190423_135404_ln_domov_ele,"Průzkum: volby do sněmovny by v dubnu vyhrálo ANO, volila by ho téměř třetina lidí. Polepšili si komunisti","Největší podporu mezi politickými stranami si udržuje ANO, podle volebního modelu Centra pro výzkum veřejného mínění (CVVM) by ho v dubnu při volbách...",lidovky.cz,domov
https://www.lidovky.cz/domov/klause-ml-ve-snemovnim-skolskem-vyboru-docasne-nahradi-rais-z-hnuti-ano.A190423_132852_ln_domov_ele,Klause ml. ve sněmovním školském výboru dočasně nahradí Rais z hnutí ANO,"Sněmovní školský výbor dočasně povede místopředseda Karel Rais (ANO), rozhodli v úterý jeho členové. Nového předsedu by měli volit v polovině května....",lidovky.cz,domov
https://www.lidovky.cz/domov/tiskovy-mluvci-mpo-milan-repka-byla-moje-chyba-rekla-novakova.A190423_123357_ln_domov_ele,"Končící ministryně Nováková označila za chybu výběr mluvčího. Chtěla jsem mít vedle sebe muže, vysvětluje","Končící ministryně průmyslu a obchodu Marta Nováková (za ANO) považuje za chybu, že si za tiskového mluvčího úřadu vybrala Milana Řepku. Řekla to na...",lidovky.cz,domov
https://www.lidovky.cz/domov/kdu-csl-vyzve-vladu-aby-kvuli-vymene-ministru-pozadala-o-duveru.A190423_122137_ln_domov_ele,"Lidovci chtějí, aby vláda kvůli výměně ministrů znovu požádala o důvěru. Babiš to odmítl","Opoziční KDU-ČSL chce po vládě ANO a ČSSD, aby znovu požádala Poslaneckou sněmovnu o důvěru. Důvodem je obměna ministrů. Pokud tak kabinet neučiní,...",lidovky.cz,domov
https://www.lidovky.cz/domov/dvorak-z-dpp-zduraznil-ze-nikdy-nezasahoval-do-vyberovych-rizeni.A190423_104608_ln_domov_ele,"Exšéf dopravního podniku Dvořák u soudu uvedl, že nezasahoval do výběrových řízení. Hrozí mu deset let","Obžalovaný bývalý šéf pražského dopravního podniku (DPP) Martin Dvořák v úterní závěrečné řeči u soudu zdůraznil, že ve své funkci nikdy nezasahoval...",lidovky.cz,domov
https://www.lidovky.cz/domov/babis-predstavil-detaily-vesnice-pro-syrske-sirotky-projekt-za-65-milionu-se-do-syrie-prepravi-v-ko.A190423_102542_ln_domov_ele,Babiš představil detaily vesnice pro syrské sirotky. Projekt za 65 milionů má do Sýrie přijet v kontejnerech,"Centrum pro syrské sirotky by podle premiéra Andreje Babiše (ANO) mělo stát zhruba 65 milionů. Projekt už je domyšlený do detailu včetně vybavení,...",lidovky.cz,domov
https://www.lidovky.cz/domov/mfd-soudce-porizek-chce-od-statu-odskodneni-1-5-milionu-korun.A190423_094732_ln_domov_ele,"Nevinný soudce Pořízek chce odškodnění 1,5 milionu korun za 10 let trvající kauzu","Brněnský soudce Jaromír Pořízek, který byl loni v lednu definitivně zproštěn obžaloby v souvislosti s předraženou stavbou brněnského justičního...",lidovky.cz,domov
https://www.lidovky.cz/domov/hlasovani-o-konci-sefzalobce-zemana-by-byl-pro-cssd-duvod-k-odchodu-z-vlady-naznacuje-hamacek.A190423_095820_ln_domov_ele,"Hlasování o konci šéfžalobce Zemana by byl pro ČSSD důvod k odchodu z vlády, naznačuje Hamáček",Případné hlasování o konci nejvyššího státního zástupce Pavla Zemana ve funkci by bylo posledním hlasováním současné vlády ANO a ČSSD. Novinářům to...,lidovky.cz,domov
https://www.lidovky.cz/domov/o-velikonocich-zemrelo-na-silnicich-6-lidi-dvakrat-vic-nez-loni.A190423_075851_ln_domov_ele,Během svátků zemřelo na silnicích 6 lidí. To je dvakrát víc než loni,Při dopravních nehodách v Česku za čtyři dny od Velkého pátku do Velikonočního pondělí zemřelo šest lidí. Předběžná čísla oznámil ředitel dopravní...,lidovky.cz,domov
https://www.lidovky.cz/sport/fotbal/fanousci-sparty-volejte-slava-a-sto-dni-se-radujte-scasny-uz-neni-trenerem.A190425_100717_ln-sport-fotbal_lar,Fanoušci Sparty si mohou konečně oddechnout. Ščasný už není trenérem,Zdeněk Ščasný už není trenérem fotbalistů Sparty. Vedení klubu ho ve čtvrtek kvůli špatným výsledkům odvolalo. Tým v sobotním závěrečném utkání...,lidovky.cz,sport
https://www.lidovky.cz/sport/hokej/neskutecne-konci-i-obhajce-titulu-z-washingtonu-34-zakroky-se-o-to-postaral-mrazek.A190425_111438_ln-sport-hokej_lar,"Neskutečné. Končí i obhájce titulu z Washingtonu, 34 zákroky se o to postaral Mrázek","Hokejisté Caroliny s Petrem Mrázkem v brance vyřadili obhájce Stanleyova poháru, když v rozhodujícím utkání vyhráli ve Washingtonu 4:3 ve druhém...",lidovky.cz,sport
https://www.lidovky.cz/novinari/jan-krejcar.N4197,Jan Krejcar,Pozoruhodné rozhodnutí vynesl anglický fotbalový svaz. Ve finále Ligového poháru se při oslavách na hřišti bude smět pít a stříkat jen nealkoholické...,lidovky.cz,sport
https://www.lidovky.cz/novinari/jan-krejcar.N4197,Jan Krejcar,"To už tu dlouho nebylo. Za patnáct dnů startuje hokejové mistrovství světa na Slovensku, na které se letos chystá celá řada opravdu velkých hvězd ze...",lidovky.cz,sport
https://www.lidovky.cz/sport/fotbal/slavia-proti-sparte-semifinale-poharu-do-finale-uz-postoupil-banik.A190424_190435_ln-sport-fotbal_rkj,"Slavia dominovala nad Spartou, zvítězila 3:0. Video odvolalo červenou kartu pro Frýdka","Domácí fotbalový pohár MOL Cup zná finalisty. V prvním semifinále zdolala Ostrava 1:0 Bohemians 1905, ve druhém Slavia přehrála Spartu a zvítězila...",lidovky.cz,sport
https://www.lidovky.cz/novinar.aspx?idnov=4197,Jan Krejcar,Hokejová NHL přináší ve svém play-off řadu zajímavých příběhů. O jeden z nich se postaralo poměrně netradiční duo. Jedním z aktérů byl útočník...,lidovky.cz,sport
https://www.lidovky.cz/sport/fotbal/razie-policie-v-elitnim-belgickem-klubu-i-narodnim-svazu-mely-se-tam-prat-penize.A190424_163231_ln-sport-fotbal_rkj,Razie policie v elitním belgickém klubu i národním svazu. Měly se tam prát peníze,"Policie ve středu prohledala kanceláře Anderlechtu a ústředí belgického fotbalového svazu. Kriminalisté vyšetřují podezření, že se při hráčských...",lidovky.cz,sport
https://www.lidovky.cz/novinari/jan-krejcar.N4197,Jan Krejcar,"Útočník Manchesteru City Raheem Sterling už nevydržel marný boj s rasismem ve fotbale. Nebývá obvyklé, aby fotbalista měl sloupek v prestižním deníku...",lidovky.cz,sport
https://www.lidovky.cz/novinari/jan-krejcar.N4197,Jan Krejcar,"Násilníci a zločinci v Brazílii by se měli mít na pozoru. Často totiž útočí na něžné pohlaví, ale vzhledem k popularitě bojových sportů mezi něžným...",lidovky.cz,sport
https://www.lidovky.cz/sport/hokej/neuveritelny-zaver-zapasu-nhl-behem-deseti-minut-padlo-pet-branek.A190424_091722_ln-sport-hokej_rkj,VIDEO: Neuvěřitelný závěr zápasu NHL. Během deseti minut padlo pět branek,Hokejový útočník Tomáš Hertl se podílel v rozhodujícím utkání série s Vegas gólem a přihrávkou na výhře San Jose 5:4 v prodloužení. Do čtvrtfinále...,lidovky.cz,sport
https://www.lidovky.cz/novinar.aspx?idnov=3709,Jaroslav Šindelář,Dvakrát přivedl národní tým k titulu mistrů světa. Po konci trenérské kariéry energicky poukazoval na nevábnou situaci v současném českém hokeji. To...,lidovky.cz,sport
https://www.lidovky.cz/novinari/jakub-eichler.N4120,Jakub Eichler,"Jedinému Čechovi v NBA, Tomáši Satoranskému, začala letní pauza. Během ní bude řešit svůj nový kontrakt i přípravu na mistrovství světa.",lidovky.cz,sport
https://www.lidovky.cz/sport/hokej/liberec-diky-golu-v-prodlouzeni-vyrovnal-stav-finale-na-2-2.A190423_202945_ln-sport-hokej_lar,Liberec díky gólu v prodloužení vyrovnal stav finále na 2:2,Hokejisté Liberce vyhráli čtvrté finále play off extraligy v Třinci 2:1 v prodloužení a vyrovnali stav série na 2:2. Dramatické utkání rozhodl v 75....,lidovky.cz,sport
https://www.lidovky.cz/sport/fotbal/video-exkluzivni-oslava-fanynka-chelsea-si-strcila-higuainuv-oblicej-mezi-sve-poprsi.A190423_111155_ln-sport-fotbal_lar,VIDEO: Exkluzivní oslava. Fanynka Chelsea si strčila Higuaínův obličej mezi své poprsí,"Poslední dobou neprožívá právě ideální období. Kvůli velké kritice na svou osobu ukončil Gonzalo Higuaín reprezentační kariéru, po svém lednovém...",lidovky.cz,sport
https://www.lidovky.cz/sport/hokej/cesky-tym-hlasi-pro-ms-tri-hvezdy-k-tymu-se-pripoji-palat-frolik-a-simon.A190423_190842_ln-sport-hokej_lar,"Český tým hlásí pro MS tři hvězdy. K týmu se připojí Palát, Frolík a Simon","Hokejovou reprezentaci posílí před květnovým mistrovstvím světa na Slovensku trio útočníků z NHL. Do přípravy se zapojí Michael Frolík z Calgary,...",lidovky.cz,sport
https://www.lidovky.cz/sport/fotbal/vsechno-je-jinak-kretinsky-je-az-teprve-nyni-vetsinovym-vlastnikem-sparty.A190423_120535_ln-sport-fotbal_lar,Všechno je jinak. Křetínský je až teprve nyní většinovým vlastníkem Sparty,"Daniel Křetínský je dlouho považován za majitele fotbalové Sparty, ale podle slovenského webu hnonline.sk teprve teď získá v klubu většinu. Tu dosud...",lidovky.cz,sport
https://www.lidovky.cz/sport/hokej/patnact-mesicu-s-jaromirem-jagrem-extraligovou-misi-legenda-splnila.A190422_185924_ln-sport-hokej_rkj,Patnáct měsíců s Jaromírem Jágrem. Extraligovou misi legenda splnila,"Na konci ledna 2018 už o něj v NHL nebyl zájem. Po Jaromíru Jágrovi místo toho prahlo mnoho zájemců z Evropy, hokejová legenda se ale nakonec podle...",lidovky.cz,sport
https://www.lidovky.cz/novinari/jan-krejcar.N4197,Jan Krejcar,"Nedělní duely 29. kola první ligy přinesly řadu nečekaných výsledků. Že by se ale ostuda Sparty a Slavie mezi sázkaři očekávala, to se dle vsazených...",lidovky.cz,sport
https://www.lidovky.cz/sport/hokej/trinec-prvni-domaci-utkani-ve-finale-extraligy-zvladl-liberec-porazil-4-1.A190422_194128_ln-sport-hokej_rkj,"Třinec první domácí utkání ve finále extraligy zvládl, Liberec porazil 4:1",Hokejisté Třince porazili ve finále play off extraligy Liberec 4:1 a v sérii vedou 2:1. Bílí Tygři sice ve vyprodané Werk Areně po gólu Marka Kvapila...,lidovky.cz,sport
https://www.lidovky.cz/sport/hokej/predehnaly-nas-staty-kde-umi-se-svobodou-lepe-zachazet-rikal-bukac-letos-by-mu-bylo-84-let.A190422_173716_ln-sport-hokej_rkj,"Předehnaly nás státy, kde umí se svobodou lépe zacházet, říkal Bukač. Letos by mu bylo 84 let","Co s českým hokejem? Rady mu v posledním rozhovoru pro LN a Lidovky.cz dával bývalý trenér Luděk Bukač, přičemž hovor s ním probíhal v únoru loňského...",lidovky.cz,sport
https://www.lidovky.cz/novinar.aspx?idnov=4197,Jan Krejcar,"Řecký fotbalový klub PAOK Soluň na svůj titul čekal hodně dlouho. Ani letos se to změnit nemělo, obzvláště když tým z pobřeží Egejského moře už před...",lidovky.cz,sport
https://www.lidovky.cz/sport/ostatni-sporty/jezdkyni-v-pardubicich-zavalil-kun-vaznemu-urazu-bohuzel-podlehla.A190422_142605_ln-sport-ostatni_rkj,Tragédie na pardubickém závodišti. Jezdkyni zavalil kůň a zemřela,Na následky úrazu při jezdeckých závodech v neděli v Pardubicích zemřela jezdkyně. Neštěstí se podle prohlášení pardubického Dostihového spolku stalo...,lidovky.cz,sport
https://www.idnes.cz/novinari/miloslav-novak.N89,Miloslav Novák,Ta podoba... Před třinácti lety v závěru ligy s předposlední Plzní senzačně vyhrál na Spartě 3:1. Stejný výsledek tam fotbalový trenér František...,lidovky.cz,sport
https://www.lidovky.cz/sport/ostatni-sporty/berdych-se-opet-propadl-po-patnacti-letech-je-mimo-elitni-stovku.A190422_114902_ln-sport-ostatni_rkj,"Berdych se v žebříčku opět propadl, po patnácti letech je mimo elitní stovku",Tomáš Berdych po 15 letech opustil první stovku světového žebříčku ATP. Třiatřicetiletý tenista kvůli vleklým problémům se zády a po absenci v...,lidovky.cz,sport
https://www.lidovky.cz/novinari/tomas-kubanek.N3451,Tomáš Kubánek,"Ján Starší patří k legendám Slovanu Bratislava, jako trenér národního týmu vedl s Karlem Gutem slavnou generaci v 70. letech. Československý hokej...",lidovky.cz,sport
https://www.lidovky.cz/sport/hokej/hertl-rozhodl-prodlouzeni-pastrnak-si-pripsal-dve-prihravky.A190422_074917_ln-sport-hokej_ceh,"Hertl rozhodl play off v prodloužení, Pastrňák si v NHL připsal dvě přihrávky",Útočník Tomáš Hertl zařídil v úvodním kole play off NHL gólem v oslabení v čase 91:17 výhru San Jose ve Vegas 2:1 v prodloužení a vyrovnání série na...,lidovky.cz,sport
https://www.idnes.cz/novinari/david-cermak.N2051,David Čermák,"Zatímco odpovídal novinářům, z karvinské kabiny zněl vítězný řev. Costa Nhamoinesu, kapitán fotbalové Sparty, naopak mluvil tiše. Nečekaná porážka...",lidovky.cz,sport
https://www.lidovky.cz/sport/fotbal/sparta-vybouchla-doma-s-karvinou-nedarilo-se-ani-slavii-ve-zline.A190421_185841_ln-sport-fotbal_rkj,"Sparta vybouchla doma s Karvinou, nedařilo se ani Slavii ve Zlíně","Fotbalisté Sparty překvapivě podlehli Karviné 1:3 a jejich ztráta na druhou Plzeň vzrostla na 11 bodů. Mohlo to být ještě o dva body více, jenže...",lidovky.cz,sport
https://www.lidovky.cz/novinari/jan-krejcar.N4197,Jan Krejcar,Velmi zdatnou fotbalistku má ve svém „kádru“ maďarská vláda. V kabinetu premiéra Viktora Orbána je ministryní pro vztahy s Evropskou unií Judit...,lidovky.cz,sport
https://www.lidovky.cz/novinari/jan-krejcar.N4197,Jan Krejcar,Portugalský fotbalista Cristiano Ronaldo přestoupil do italského Turína během loňského léta. V dresu „Staré dámy“ sice nedosáhl na výhru v Lize...,lidovky.cz,sport
https://www.lidovky.cz/sport/ostatni-sporty/ceske-tenistky-neponechaly-nic-nahode-ve-fed-cupu-porazily-kanadu.A190421_132057_ln-sport-ostatni_rkj,"České tenistky porazily Kanadu 4:0, Šafářová se rozloučila s reprezentačním dresem vítězně",České tenistky mají jistotu udržení mezi fedcupovou elitou i pro příští sezonu. Svěřenkyně kapitána Petra Pály porazily v baráži Kanadu 4:0 na...,lidovky.cz,sport
https://www.lidovky.cz/sport/ostatni-sporty/kellnerova-se-s-prague-lions-hodne-zlepsila-v-miami-skoncili-pati.A190421_120629_ln-sport-ostatni_rkj,"Kellnerová se v dresu Prague Lions zlepšila, tým v Miami vybojoval páté místo",Tým Prague Lions s Annou Kellnerovou vybojoval při třetí zastávce parkurové soutěže Global Champions League v Miami páté místo a zaznamenal nejlepší...,lidovky.cz,sport
https://www.lidovky.cz/sport/fotbal/united-by-se-meli-odprostit-od-rukopisu-alexe-fergusona-kritizuje-byvaly-zaloznik-anglie.A190420_185754_ln-sport-fotbal_lar,"United by se měli odprostit od rukopisu Alexe Fergusona, kritizuje bývalý záložník Anglie",Forma Manchesteru United povážlivě klesá. Z posledních sedmi utkání dokázali svěřenci Ole Gunnara Solskjaera zvítězit pouze dvakrát a hned se...,lidovky.cz,sport
https://www.lidovky.cz/sport/ostatni-sporty/pred-utkanim-jsem-se-trepala-priznala-muchova-po-premiere-ve-fed-cupu-pak-souperce-nadelila-kanara.A190420_165630_ln-sport-ostatni_lar,"Před utkáním jsem se třepala, přiznala Muchová po premiéře ve Fed Cupu. Pak soupeřce nadělila kanára",Až při fedcupovém utkání si tenistka Karolína Muchová poprvé vyslechla před zápasem českou hymnu. V mládežnických kategoriích se olomoucké rodačce...,lidovky.cz,sport
https://www.lidovky.cz/sport/fotbal/juventus-si-napravil-chut-z-neuspechu-v-lize-mistru-ziskal-osmy-titul-v-rade.A190420_200406_ln-sport-fotbal_lar,Juventus si napravil chuť z neúspěchu v Lize mistrů. Získal osmý titul v řadě,Fotbalisté Juventusu Turín porazili v 33. kole italské ligy Fiorentinu 2:1 a zajistili si osmý mistrovský titul v řadě a 35. celkově. V tabulce mají...,lidovky.cz,sport
https://www.lidovky.cz/sport/fotbal/city-oplatili-tottenhamu-vyrazeni-z-ligy-mistru-a-dostali-se-na-prvni-misto.A190420_154235_ln-sport-fotbal_lar,City oplatili Tottenhamu vyřazení z Ligy Mistrů. West Ham vydřel výhru v nastavení,Fotbalisté Manchesteru City porazili v 35. kole anglické ligy Tottenham 1:0 a vrátili se na první místo tabulky o bod před Liverpool. Mužstvo City...,lidovky.cz,sport
https://www.lidovky.cz/novinari/marcel-kabat.N2324,Marcel Kabát,Před rokem v první části závěrečného příběhu Avengers: Infinity War čaroděj dr. Strange navštívil celkem 14­ 000 605 alternativních dimenzí...,lidovky.cz,kultura
https://www.lidovky.cz/novinari/jaroslav-totusek.N3899,Jaroslav Totušek,"Čtvrtý dubnový týden míří do kin šest filmů. Velkolepý závěr komiksové ságy doplní poutavé sci-fi o životě, drama o zasněném umělci, přátelství dívky...",lidovky.cz,kultura
https://www.lidovky.cz/novinari/jana-machalicka.N493,Jana Machalická,"Případ Jiří Fajt vlastně až nic moc nového nepřinesl. Že jsou v Česku ředitelé lovnou zvěří, je bohužel fakt, který se za třicet let nezměnil....",lidovky.cz,kultura
https://www.lidovky.cz/novinari/jaroslav-totusek.N3899,Jaroslav Totušek,Nejznámější superhrdinský tým na světě již 25. dubna svede v kinosálech bitvu s Thanosem o osudu všeho života ve vesmíru. Vyzkoušejte si se serverem...,lidovky.cz,kultura
https://www.lidovky.cz/novinari/ondrej-bezr.N3784,Ondřej Bezr,Velký koncert s názvem Nechte zpívat Mišíky se uskuteční ve čtvrtek 25. dubna v pražském Divadle Hybernia. Na pódiu zazpívá celá rodina rockové...,lidovky.cz,kultura
https://www.lidovky.cz/novinar.aspx?idnov=3899,Jaroslav Totušek,Americký sen pro čínské dělníky končí otrockou prací ve fabrikách nebo členstvím v jednom z opiových gangů. Právě do jednoho takového se dostává i...,lidovky.cz,kultura
https://www.lidovky.cz/novinari/marcel-kabat.N2324,Marcel Kabát,"Těžko si v současné době, kdy je katolická církev sužována sexuálními skandály, rozkoly a často povrchními odsudky, představit přesvědčivější...",lidovky.cz,kultura
https://www.lidovky.cz/kultura/new-order-zahraji-v-praze.A190423_153440_ln_kultura_bez,Stylotvorní New Order zahrají v říjnu vůbec poprvé v Praze,Jedna z nejuznávanějších a nejvlivnějších kapel osmdesátých let New Order vystoupí 3. října ve velkém sále Lucerny. V České republice zahrají vůbec...,lidovky.cz,kultura
https://www.lidovky.cz/novinari/jaroslav-totusek.N3899,Jaroslav Totušek,"První reakce na nový film Avengers vychvalují vyrovnaný mix akce a emotivních momentů. Diváci se vesměs shodují na tom, že v kinosále dali alespoň...",lidovky.cz,kultura
https://www.lidovky.cz/novinari/jaroslav-totusek.N3899,Jaroslav Totušek,Kdo získá letos trofej pro nejvíce kladnou postavu? Podívejte se se serverem Lidovky.cz na zlomové momenty příprav na závěrečný boj v druhé epizodě....,lidovky.cz,kultura
https://www.lidovky.cz/kultura/tize-a-odlehcenost-umelecka-spoluprace-socharu-alese-hnizdila-a-jiriho-kacera.A190416_091634_ln_kultura_jto,Tíže a odlehčenost. Umělecká spolupráce sochařů Aleše Hnízdila a Jiřího Kačera,Na zámku Troja se sešli sochaři Aleš Hnízdil s Jiřím Kačerem. Mezi jejich díly vzniká zvláštní napětí.,lidovky.cz,kultura
https://www.lidovky.cz/kultura/soutez-cech-ktery-vyrostl-v-americe-vyhrajte-knihu-daleko-v-srdci.A190402_113114_ln_kultura_ape,"SOUTĚŽ: Čech, který vyrostl v Americe. Vyhrajte knihu Daleko v srdci","Ve své vzpomínkové próze skládá Mark Slouka, syn českých rodičů, kteří po únorovém puči odešli do Spojených států, spletitou a často pochmurnou...",lidovky.cz,kultura
https://www.lidovky.cz/kultura/komedialni-klasika-z-hor-i-chlapecke-skoly-na-co-se-v-televizi-podivat-v-pondeli.A190417_112252_ln_kultura_jto,Komediální klasika z hor i chlapecké školy. Na co se v televizi podívat v pondělí?,"Na co se vyplatí dívat 22.dubna v televizi? Server Lidovky.cz nabízí několik tipů a poví Vám, proč se vyplatí je sledovat.",lidovky.cz,kultura
https://www.lidovky.cz/kultura/pisnickar-cass-mccombs-vysoupi-poprve-v-meetfactory.A190418_145552_ln_kultura_ape,Písničkář Cass McCombs vysoupí poprvé v MeetFactory,"Jeho pouť nese jistý punc tajemství, což svým aktuálním albem kalifornský bard Cass McCombs podtrhuje. Spíš než aby mluvil o sobě, upřednostňuje...",lidovky.cz,kultura
https://www.lidovky.cz/kultura/sberatelka-by-po-odvolani-fajta-nejradsi-stahla-z-narodni-galerie-vystavu-moznosti-dialogu.A190421_124156_ln_kultura_ele,Sběratelka by po odvolání Fajta nejradši stáhla z Národní galerie výstavu Možnosti dialogu,"Národní galerie v Praze po odvolání svého dosavadního ředitele Jiřího Fajta možná přijde o expozici Možnosti dialogu, která v Salmovském paláci na...",lidovky.cz,kultura
https://www.lidovky.cz/kultura/v-cervnu-zacina-prazske-quadriennale-privita-800-umelcu-z-celeho-sveta.A190416_102610_ln_kultura_ape,V červnu začíná Pražské Quadriennale. Přivítá 800 umělců z celého světa,Čtrnáctý ročník největší mezinárodní přehlídky divadla a scénografie se odehraje od 6. do 16. června 2019 v prostorách pražského Výstaviště. Během 11...,lidovky.cz,kultura
https://www.lidovky.cz/kultura/osudovost-arivismu-v-inscenaci-neviditelny-vede-karierismus-ke-katastrofe.A190415_093812_ln_kultura_jto,Osudovost arivismu. V inscenaci Neviditelný vede kariérismus ke katastrofě,Martin Františák nastudoval na scéně Rokoka Městských divadel pražských divadelní adaptaci prózy Jaroslava Havlíčka Neviditelný z roku 1937. Titul je...,lidovky.cz,kultura
https://www.lidovky.cz/kultura/pohadkova-naloz-a-klasicky-western-na-co-se-v-televizi-podivat-v-nedeli.A190416_114454_ln_kultura_jto,Pohádková nálož a klasický western. Na co se v televizi podívat v neděli?,"Na co se vyplatí dívat 21.dubna v televizi? Server Lidovky.cz nabízí několik tipů a poví Vám, proč se vyplatí je sledovat.",lidovky.cz,kultura
https://www.lidovky.cz/novinari/jaroslav-totusek.N3899,Jaroslav Totušek,K velikonočním filmům nesporně patří biblické motivy i ušatí a roztomilí savci. Je toho ale více. Server Lidovky.cz Vám nabízí několik tipů na...,lidovky.cz,kultura
https://www.lidovky.cz/novinari/jaroslav-totusek.N3899,Jaroslav Totušek,Co zajímavého dávají v sobotu v televizi? Server Lidovky.cz přináší tipy pro velikonoční diváky.,lidovky.cz,kultura
https://www.lidovky.cz/novinar.aspx?idnov=3899,Jaroslav Totušek,Volno o svátcích je kromě času stráveného s rodinou ideální pro sledování seriálů. Které si však pustit? Lidovky.cz vám nabízí několik tipů. Všechny...,lidovky.cz,kultura
https://www.lidovky.cz/novinari/jaroslav-totusek.N3899,Jaroslav Totušek,Na co se vyplatí dívat 19.dubna v televizi? Podívejte se na tipy serveru Lidovky.cz.,lidovky.cz,kultura
https://www.lidovky.cz/novinari/jana-machalicka.N493,Jana Machalická,Režisér Jiří Pokorný nastudoval v Dejvickém divadle hru norského dramatika Henrika Ibsena Přízraky. Znalce svých her i režijního stylu překvapil...,lidovky.cz,kultura
https://www.lidovky.cz/kultura/barcode-circus-company-uvede-svetovou-premieru-v-praze-predvedou-velmi-nebezpecne-kousky.A190416_133802_ln_kultura_ape,Barcode Circus Company uvede světovou premiéru v Praze. Předvedou velmi nebezpečné kousky,"Jatka78 dvakrát ročně vypisují rezidenční program, jak pro domácí, tak zahraniční soubory. Od dubna na Jatkách78 pilně zkouší Barcode Circus Company....",lidovky.cz,kultura
https://www.lidovky.cz/novinari/jaroslav-totusek.N3899,Jaroslav Totušek,"Zaklínač Geralt z Rivie (Henry Cavill), známý také jako Řezník z Blavikenu nebo Bílý vlk, se své seriálové podoby dočká ještě letos na podzim nebo v...",lidovky.cz,kultura
https://www.lidovky.cz/kultura/vsichni-moji-synove-drama-ktere-proslavilo-arthura-millera-se-predstavi-v-kine.A190415_141816_ln_kultura_ape,"Všichni moji synové. Drama, které proslavilo Arthura Millera, se představí v kině","Oscarová herečka Sally Fieldová (Forrest Gump, Amazing Spider-Man) a její americký kolega Bill Pullman (Den nezávislosti, Lost Highway) si zahrají...",lidovky.cz,kultura
https://www.lidovky.cz/novinari/jaroslav-totusek.N3899,Jaroslav Totušek,"Třetí dubnový týden míří do českých kin pětice snímků. Atmosferický horor doplní ruský válečný film, kouzelně animované putování za bájnou příšerou,...",lidovky.cz,kultura
