link,link_text,txt,site,area
https://www.lidovky.cz/ze-sexualniho-obtezovani-byl-narcen-oscarovy-herec-dustin-hoffman-1d3-/lide.aspx?c=A171101_184434_lide_ele,"Otevřeně vykládal, jaký s ní chce sex. Dustin Hoffman byl obviněn z obtěžování","Seznam hollywoodských veličin obviněných ze sexuálních útoků proti ženám se dál prodlužuje, v americkém tisku se objevily nelichotivé informace o...",lidovky.cz,lide
https://www.lidovky.cz/asi-jatka-kratkorozhovor-o-dvou-otazkach-s-nasima-fvq-/lide.aspx?c=A171030_145940_lide_ape,ASI.JATKA: Krátkorozhovor o dvou otázkách s našima,"Udělala jsem našim malou francouzskou bagetku se salámem (který jsme dostali od našich českých známých, vždycky něco přivezou, když mají cestu kolem)...",lidovky.cz,lide
https://www.lidovky.cz/kdyz-se-modlim-nekdy-usnu-priznal-papez-frantisek-fsm-/lide.aspx?c=A171031_202641_lide_ele,"‚Když se modlím, někdy usnu,‘ přiznal papež František","Papež František přiznal, že při modlení občas usne. Zároveň ale ujistil, že jde o jeden z mnoha dalších způsobů, jak „světit boží jméno“. Hlava...",lidovky.cz,lide
https://www.lidovky.cz/hollywoodska-hvezda-spacey-nedostane-kvuli-obvineni-zvlastni-oceneni-zakladatelu-emmy-gur-/lide.aspx?c=A171031_183058_lide_ele,Hollywoodská hvězda Spacey nedostane kvůli obvinění zvláštní ocenění zakladatelů Emmy,Mezinárodní akademie televizních umění a věd se rozhodla neudělit hollywoodské hvězdě Kevinu Spaceymu zvláštní ocenění zakladatelů mezinárodních...,lidovky.cz,lide
https://www.lidovky.cz/jak-se-mladi-herci-z-brna-na-role-princu-chystali-ftg-/lide.aspx?c=A171030_130753_lide_ape,MLADÍ A NEKLIDNÍ: Jak se mladí herci z Brna na role princů chystali,"Můj spolužák Martin (Nazdar, Krausi!) má koně. Živého. Ne jednoho. Desítky. Na jejich farmu na Orlíku se jela družit naše třída ještě o prázdninách...",lidovky.cz,lide
http://www.lidovky.cz/novinar.aspx?idnov=1090,Vojtěch Gibiš,V 70. letech minulého století to byla v Londýně zámožná čtvrť. V oblasti Chelsea ale začalo docházet k velkému množství krádeží a loupežných...,lidovky.cz,lide
https://www.lidovky.cz/kevin-spacey-celi-obvineni-ze-pred-lety-sexualne-obtezoval-herce-rappa-1md-/lide.aspx?c=A171030_121848_lide_ape,"Kevin Spacey čelí obvinění, že sexuálně obtěžoval 14letého herce","Aféra známého amerického producenta Harveyho Weinsteina, kterého ze znásilnění obvinilo několik žen, přiměla řadu obětí sexuálního zneužívání svěřit...",lidovky.cz,lide
https://www.lidovky.cz/machovcova-konecne-patek-dopoledne-dermatoalergologie-odpoledne-seminar-s-kolegy-gje-/lide.aspx?c=A171026_192954_lide_ele,"MACHOVCOVÁ: Konečně pátek? Dopoledne dermatoalergologie, odpoledne seminář s kolegy","Pátky mám ráda, ať jsem kdekoliv. Těším se, že si konečně odpočinu a budu dělat věci jiné než v pracovní dny. Pokud jsem v práci, páteční program...",lidovky.cz,lide
https://www.lidovky.cz/pavel-tigrid-by-se-dozil-100-let-byl-to-dobrodruh-vzpomina-pithart-px1-/lide.aspx?c=A171026_191657_lide_ele,"Pavel Tigrid by se dožil 100 let. Byl to dobrodruh, vzpomíná Pithart","V pátek 27. října uplynulo sto let od narození Pavla Tigrida. Petr Pithart píše, v čem mu Tigrid nejvíce imponoval a proč se k němu na počátku 70....",lidovky.cz,lide
http://www.lidovky.cz/novinar.aspx?idnov=3926,Luděk Vokáč,I po více než 16 letech od konce své kariéry ve formuli 1 patří Mika Häkkinen k nejpopulárnějším osobnostem tohoto motoristického sportu. A jeho...,lidovky.cz,lide
https://www.lidovky.cz/herecky-obvinily-bushe-starsiho-ze-sexualniho-obtezovani-komunikacni-problemy-haji-exprezidenta-ml-iu4-/lide.aspx?c=A171026_165245_lide_ele,Herečky obvinily Bushe staršího ze sexuálního obtěžování,"Bývalý prezident USA George Bush starší se prostřednictvím svého mluvčího omluvil americké herečce za incident při fotografování v roce 2014, který...",lidovky.cz,lide
https://www.lidovky.cz/zemrel-byvaly-tenista-a-trener-jan-bedan-fd1-/lide.aspx?c=A171025_202530_lide_ele,Zemřel bývalý tenista a trenér Jan Bedáň. Bylo mu 66 let,Bývalý tenisový reprezentant a po skončení kariéry úspěšný trenér Jan Bedáň náhle zemřel v pondělí 23. října v Brně ve věku 66 let. Informaci přinesl...,lidovky.cz,lide
https://www.lidovky.cz/zemrela-legenda-rokenrolu-fats-domino-dal-jmeno-zanru-bigbit-prh-/lide.aspx?c=A171025_164142_lide_ele,"Zemřela legenda rokenrolu Fats Domino. Dal jméno žánru bigbít, proslavil hit Blueberry Hill","Ve věku 89 let zemřel americký pianista a zpěvák Fats Domino. Věnoval se především R&B; a rock and rollu, podle jeho písně The Big Beat dostal jméno...",lidovky.cz,lide
https://www.lidovky.cz/pozadal-jsem-o-rozvod-potvrdil-klaus-vztah-pry-nezvladl-jednu-informaci-143-/lide.aspx?c=A171025_102502_ln_domov_ele,"Požádal jsem o rozvod, potvrdil Klaus ml. Vztah prý nezvládl ‚jednu informaci‘","Václav Klaus mladší před několika dny požádal o rozvod. Sám to potvrdil bulvárnímu listu Blesk. K rozhodnutí prý došel „ze dne na den“ 12. června,...",lidovky.cz,lide
http://www.lidovky.cz/novinar.aspx?idnov=3961,Jiří Bigas,Připomeňte si jeden z největších hitů Karla Štědrého. Duet s Waldemarem Matuškou nazvaný Mám malý stan zpíval celý život. Přichystali jsme pro vás...,lidovky.cz,video
http://www.lidovky.cz/novinar.aspx?idnov=3961,Jiří Bigas,Burger King si utahuje z McDonaldu a využívá k tomu aktuální popularity hororu To. Při příležitosti Halloweenu bude ve vybraných amerických...,lidovky.cz,video
http://www.lidovky.cz/novinar.aspx?idnov=3961,Jiří Bigas,"Piloti z 22. základny vrtulníkového letectva u Náměšti nad Oslavou se 17. října zúčastnili cvičení, při kterém nechyběly ani kamery. Podívat se tak...",lidovky.cz,video
http://www.lidovky.cz/novinar.aspx?idnov=3961,Jiří Bigas,Britský dobrodruh se inspiroval animovaným filmem Vzhůru do oblak od Pixaru z roku 2009 a s pomocí stovky heliem naplněných balónků podnikl...,lidovky.cz,video
http://www.lidovky.cz/novinar.aspx?idnov=3961,Jiří Bigas,"Fotbalové utkání mezi thajskými týmy Bangkok Sports Club a Satri Angthong by zřejmě nebylo pro většinu sportovních fanoušků ničím zajímavé, pokud by...",lidovky.cz,video
https://www.lidovky.cz/video-posledni-sobhem-umirajici-simpanzice-objimala-sveho-davneho-pritele-1ug-/video.aspx?c=A171020_143621_ln-video_mha,VIDEO: Poslední sbohem. Umírající šimpanzice objímala svého dávného přítele,"Bylo jí 59 let. Šimpanzice Mama měla týden před smrtí, když ji navštívil profesor Jan van Hooff z univerzity v Utrechtu. Znali se od roku 1972. Mama...",lidovky.cz,video
http://www.lidovky.cz/novinar.aspx?idnov=3961,Jiří Bigas,"Abyste se mohli začíst do speciální edice románu 451 stupňů Fahrenheita, musíte nejprve “spálit” jeho stránky. Sci-fi klasika Raye Bradburyho z roku...",lidovky.cz,video
https://www.lidovky.cz/motorkar-branil-sanitce-v-projeti-dr3-/video.aspx?c=A171019_111134_ln-video_ele,VIDEO: Motocyklista nenechal projet sanitku. Případ projednají správní orgány,"Devětapadesátiletý řidič motocyklu v obci Knapovec neumožnil sanitce jedoucí s výstražným a zvukovým zařízením, aby projela a dostala se k pacientovi...",lidovky.cz,video
https://www.lidovky.cz/video-chovatele-po-celem-svete-vydesil-preslechteny-kun-vypada-jako-z-animaku-1xu-/video.aspx?c=A171019_133840_ln-video_mha,VIDEO: Chovatele po celém světě vyděsil přešlechtěný kůň. Vypadá jako z animáku,Americká šlechtitelská farma Orrion se dlouhodobě zaměřuje na chov koní. Nově vyšlechtené hříbě El Rey Magnum však vyvolalo značnou nevoli mezi...,lidovky.cz,video
http://www.lidovky.cz/novinar.aspx?idnov=3961,Jiří Bigas,"O kultovní logické hře Tetris se často říká, že si ji lze zahrát v podstatě na každém myslitelném počítačovém systému. Důkazem této okřídlené fráze...",lidovky.cz,video
http://www.lidovky.cz/novinar.aspx?idnov=3961,Jiří Bigas,"Jde o promyšlený, ale děsivý trik, za nějž si provozovatel vysloužil značnou kritiku. Ale současně obdiv. Skleněná lávka umístěná vysoko v čínských...",lidovky.cz,video
https://www.lidovky.cz/byl-obeti-xenofobie-dnes-je-vudcem-ultrapravice-pise-bloomberg-o-okamurovi-1us-/video.aspx?c=A171014_082544_ln-video_ele,"Byl obětí xenofobie, dnes je vůdcem ultrapravice, píše Bloomberg o Okamurovi","Americká společnost Bloomberg se v jednom z novějších příspěvků věnuje politikovi Tomiu Okamurovi. Přestože jeho původ je „tak multikulturní, jak jen...",lidovky.cz,video
http://www.lidovky.cz/novinar.aspx?idnov=3961,Jiří Bigas,Každý týden vychází na serveru Lidovky.cz seriál ASI.JATKA. Vždy ve středu se můžete začíst do nového příspěvku od blogerky Do Thu Trang. Co když ale...,lidovky.cz,video
http://www.lidovky.cz/novinar.aspx?idnov=3961,Jiří Bigas,Fenka bernardýna z Jižní Dakoty se zapsala do Guinnessovy knihy rekordů. Pyšní se aktuálně nejdelším psím jazykem na světě. Mochi má jazyk dlouhý...,lidovky.cz,video
http://www.lidovky.cz/novinar.aspx?idnov=3961,Jiří Bigas,V těsné blízkosti nového mostu i husté zástavby demoliční experti s chirurgickou přesností poslali k zemi dosluhující Kosciuszko Bridge v New Yorku...,lidovky.cz,video
http://www.lidovky.cz/novinar.aspx?idnov=3961,Jiří Bigas,Na pláži u španělské obce Calella se objevila ohromná mořská želva. Zvíře bohužel uhynulo a s jeho odstraněním musela pomoci těžká technika. Kožatka...,lidovky.cz,video
https://www.lidovky.cz/video-britsky-princ-harry-byl-okraden-v-primem-prenosu-o-popcorn-phq-/video.aspx?c=A170929_143321_ln-zajimavosti_ele,VIDEO: Princ Harry byl ‚okraden‘ v přímém přenosu. O popcorn,"Malá holčička „kradla“ princi Harrymu popcorn během Invictus Games, her v paralympijském stylu, které vytvořil on sám pro veterány a vojáky. Princ s...",lidovky.cz,video
http://www.lidovky.cz/novinar.aspx?idnov=3961,Jiří Bigas,"Květa Fialová byla okouzlující i vtipná, ať už hrála osudové ženy, anebo starostlivé maminky a babičky. Vybrali jsme pro vás jen pár filmů, které...",lidovky.cz,video
http://www.lidovky.cz/novinar.aspx?idnov=3961,Jiří Bigas,"Jan Tříska se od roku 1964 blýskl v desítkách filmů, televizních inscenací, seriálů i divadelních her. Po emigraci se mu podařilo jako jednomu z mála...",lidovky.cz,video
http://www.lidovky.cz/novinar.aspx?idnov=3961,Jiří Bigas,"Učitelé, spolužáci i rodiče několik hodin marně odrazovali čínskou studentku od záměru spáchat sebevraždu. Neúspěšní byli i policisté a hasiči....",lidovky.cz,video
http://www.lidovky.cz/novinar.aspx?idnov=3961,Jiří Bigas,Při výstavbě nové přehrady s vodní elektrárnou v Laosu došlo k nehodě. Přehrada na řece Nam Ao se protrhla a obrovský proud vody okamžitě zaplavil...,lidovky.cz,video
https://www.lidovky.cz/dny-nato-prilakaly-desetitisice-lidi-i-pres-spatne-pocasi-pmr-/video.aspx?c=A170916_215518_ln-video_ELE,"Dny NATO přilákaly desetitisíce lidí, i přes špatné počasí",I přes nepříznivé počasí v sobotu navštívilo Dny NATO a Dny Vzdušných sil Armády ČR na letišti v Mošnově nedaleko Ostravy přes 65 000 lidí. Počasí...,lidovky.cz,video
http://www.lidovky.cz/novinar.aspx?idnov=3961,Jiří Bigas,Kutil Matt Denton postavil společně se svým synovcem obří verzi motokáry z lega. Stavebnici z roku 1985 zvětšil kousek po kousku za pomoci 3D...,lidovky.cz,video
https://www.lidovky.cz/v-hatich-maji-nejvetsi-muzeum-jukeboxu-na-svete-nektere-jsou-i-pres-sto-let-stare-g1o-/video.aspx?c=A170911_225605_ln-video_ELE,V Hatích mají největší muzeum jukeboxů na světě. Některé jsou i přes sto let staré,"V Hatích u Chvalovic je největší muzeum jukeboxů na světě. 
Ve výstavních prostorech, které mají přes osm tisíc metrů čtverečních, jsou jukeboxy ze...",lidovky.cz,video
https://www.lidovky.cz/autobus-uvizl-na-zeleznicnim-prejezdu-ve-smrzovce-vyprostili-jej-az-hasici-1vk-/video.aspx?c=A170909_213741_ln-video_ELE,Autobus uvízl na železničním přejezdu ve Smržovce. Vyprostili jej až hasiči,V sobotu dopoledne uvázl na železničním přejezdu ve Smržovce autobus. Naštěstí v tu chvíli žádný vlak přes Smržovku nejel a provoz na železnici se...,lidovky.cz,video
https://www.lidovky.cz/video-vousaci-z-celeho-sveta-se-sjeli-na-mistrovstvi-vousu-do-texasu-1jo-/video.aspx?c=A170908_203636_ln-video_ELE,VIDEO: Vousáči z celého světa se sjeli na mistrovství vousů do Texasu,V Texasu se před několika dny konalo mistrovství světa vousů a knírů. Sjeli se na něj vousáči ze všech kontinentů. Organizátoři se letos rozhodli...,lidovky.cz,video
http://www.lidovky.cz/novinar.aspx?idnov=3978,Benedikt Vítek,"Prahu a část Čech ve středu večer zaplavil ohnivý západ slunce. Lidé se mohli pokochat kombinací rudých a oranžových barev, která zlákala k...",lidovky.cz,video
http://www.lidovky.cz/novinar.aspx?idnov=3961,Jiří Bigas,"Patnáctiletý Patrick Ponce překonal světový rekord. Rubikovu kostku složil za 4,69 sekundy a sám byl zaskočený tím, co právě dokázal. Raději...",lidovky.cz,video
https://www.lidovky.cz/video-kroksy-a-outdoor-ne-jinak-muzete-cokoliv-navrhar-jan-cerny-se-inspiroval-na-letisti-gv9-/video.aspx?c=A170905_201557_ln-video_ELE,"VIDEO: ‚Kroksy a outdoor ne, jinak můžete cokoliv.‘ Návrhář Jan Černý se inspiroval na letišti","„Přehlídku jsem si snad poprvé užil a doufám že to bylo znát i na mole. Móda je pro mě identifikace sebe sama, odlišení se. Nebo sebeidentifikace...",lidovky.cz,video
https://www.lidovky.cz/neplanovany-pad-pri-nataceni-filmu-shodila-komparzistu-hlaven-obrnence-1ai-/video.aspx?c=A170904_072833_ln-video_ELE,Neplánovaný pád: při natáčení filmu shodila komparzistu hlaveň obrněnce,"Točit film s vojenskou technikou není vždy úplně bezpečné. O tom se přesvědčil i jeden z komparzistů, který byl při natáčení snímku Jan Palach v...",lidovky.cz,video
https://www.lidovky.cz/blaznivi-surfari-se-projizdeli-v-zatopenych-ulicich-texaskeho-mesta-galvestonu-gpe-/video.aspx?c=A170901_224614_ln-video_ele,Blázniví surfaři se projížděli v zatopených ulicích texaského města Galvestonu,"Hurikán Harvey napáchal hrozné škody. Americkému státu Texas potrvá po úderu hurikánu Harvey roky, než odstraní následky. Přesto se Američan Patrick...",lidovky.cz,video
https://www.lidovky.cz/hra-na-zapomenuty-nastroj-ktery-proslavili-zebraci-vrchlabi-hostilo-hrace-na-nineru-gne-/video.aspx?c=A170831_223520_ln-video_ELE,Hra na zapomenutý nástroj proslavený žebráky. Vrchlabí hostilo hráče na niněru,"Hudební nástroj, který se jmenuje niněra, je dnes téměř zapomenutý. Kombinuje v sobě prvky dud, houslí, kláves a flašinetu. Jejich zvuk se však ještě...",lidovky.cz,video
https://www.lidovky.cz/na-lodi-z-pet-lahvi-dopluli-z-brna-az-do-afriky-fat-/video.aspx?c=A170829_224456_ln-video_ELE,VIDEO: Na lodi z PET lahví dopluli z Brna až do Afriky,Po sedmi letech a pěti lodích postavených z PET lahví konečně dopluli dva brněnští dobrodruzi ke břehům Afriky. Petr Hašek a Albert Fikáček vypluli z...,lidovky.cz,video
https://www.lidovky.cz/brnensti-lvi-se-poprve-ukazali-lidem-dvw-/video.aspx?c=A170828_104321_ln-video_ELE,VIDEO: Brněnští lvi se poprvé ukázali lidem,"Nová expozice se lvy v Brněnské zoo byla otevřena v sobotu a lvi se tam tak vrátili po 14 letech. Poslední brněnský lev byl samec Bali, který odešel...",lidovky.cz,video
http://www.lidovky.cz/novinar.aspx?idnov=3961,Jiří Bigas,"Podívejte se, jaký fantastický kousek se podařil s malým letadlem na Aljašce. Pilot přistál se svým strojem jako s helikoptérou. Není to přitom první...",lidovky.cz,video
http://www.lidovky.cz/novinar.aspx?idnov=3961,Jiří Bigas,"Na dálnici v texaském Houston došlo k děsivé nehodě, která jen zázrakem neskončila řetězovou srážkou. Řidič nákladního vozu se zvednutou korbou...",lidovky.cz,video
https://www.lidovky.cz/zeman.aspx,"Zeman vede permanentní kampaň. Server Lidovky.cz zmapoval všechna místa, kam se vypravil","Z nejvyššího úřadu v zemi má prezident Miloš Zeman k lidem nejblíž ze všech ústavních činitelů. Stvořil si vlastní styl komunikace, vede permanentní...",lidovky.cz,specialy
http://www.lidovky.cz/novinar.aspx?idnov=3851,Martin Hampejs,"13 krajů, 75 okresů a 302 měst a vesnic navštívil prezident Miloš Zeman během svého volebního období. Novináři serveru Lidovky.cz detailně...",lidovky.cz,specialy
http://www.lidovky.cz/novinar.aspx?idnov=3851,Martin Hampejs,"Jsou celkem čtyři. Český Krumlov, Mělník, Mladá Boleslav a Nový Jičín. To jsou okresní města, ve kterých se prezident Miloš Zeman ke 30. červnu 2017...",lidovky.cz,specialy
http://www.lidovky.cz/novinar.aspx?idnov=3851,Martin Hampejs,"Bojí se Miloš Zeman Pražanů? Praha je totiž jediný krajský celek, který prezident během svého volebního období nenavštívil. Mezitím stihl objet...",lidovky.cz,specialy
http://www.lidovky.cz/novinar.aspx?idnov=3890,Jan Horák,"Ve vztahu prezidenta Miloše Zemana s občany se kombinují tři veličiny. V první řadě je to osobnostní ustrojení prezidenta, jež z něj činí...",lidovky.cz,specialy
http://www.lidovky.cz/novinar.aspx?idnov=3851,Martin Hampejs,Každý výlet něco stojí. Prezidentovy cesty do regionů hradí již od doby prezidenta Havla krajské úřady a dodnes se na tom i přes protesty hejtmanů...,lidovky.cz,specialy
http://www.lidovky.cz/novinar.aspx?idnov=3926,Luděk Vokáč,"Po stopách vozu, který změnil dějiny českého autoprůmyslu. 1700 kilometrů, 7 dnů, 24 hodin za volantem Škody Favorit.",lidovky.cz,specialy
http://www.lidovky.cz/novinar.aspx?idnov=3833,Marcel Šulek,Přesně před 75 lety obklíčili němečtí vojáci pravoslavných chrám v Resslově ulici v Praze. Uvnitř svatostánku se skrývala sedmička československých...,lidovky.cz,specialy
http://www.lidovky.cz/novinar.aspx?idnov=1090,Vojtěch Gibiš,"Nový seriál serveru Lidovky.cz o nejslavnějších vrazích světa: Rostovský řezník, Vrah od Zelené řeky i český sériový vrah Roman Postl.",lidovky.cz,specialy
http://www.lidovky.cz/novinar.aspx?idnov=3833,Marcel Šulek,"Uživatelé Facebooku žijí v zajetí svých sociálních bublin. Sdílí články ze stále stejných zdrojů, a to hlavně takových, které potvrzují jejich vidění...",lidovky.cz,specialy
http://www.lidovky.cz/novinar.aspx?idnov=3833,Marcel Šulek,"Češi žijí v sociálních bublinách, v nichž se navíc navzájem utvrzují o správnosti vidění svého světa. Ukázal to unikátní projekt serveru Lidovky.cz....",lidovky.cz,specialy
http://www.lidovky.cz/novinar.aspx?idnov=2593,Jakub Zelenka,"„V sociálních bublinách jsme žili už dříve, ale moc jsme o tom nevěděli,“ tvrdí odborník na analýzu dat Josef Šlerka. Unikátní výsledky projektu...",lidovky.cz,specialy
http://www.lidovky.cz/novinar.aspx?idnov=3833,Marcel Šulek,"Češi žijí v sociálních bublinách, v nichž se navíc navzájem utvrzují o správnosti vidění svého světa. Ukázal to unikátní projekt serveru Lidovky.cz....",lidovky.cz,specialy
http://www.lidovky.cz/novinar.aspx?idnov=2593,Jakub Zelenka,"Novináři serveru Lidovky.cz prošli 2606 tweetů Jiřího Ovčáčka, které publikoval na účtu @PREZIDENTmluvci do 31. října 2016. Vybrali všechny...",lidovky.cz,specialy
//www.lidovky.cz/havel80.aspx,80 vzpomínek na Václava Havla,"České i zahraniční osobnosti vzpomínají, co pro ně Václav Havel znamenal.",lidovky.cz,specialy
//www.lidovky.cz/pieta-za-padle-vojaky.aspx,Pieta za padlé vojáky,"Vzpomínková stránka na české vojáky, 
kteří zemřeli při nasazení na zahraničních misích",lidovky.cz,specialy
https://zpravy.idnes.cz/advokati-hnilicovi-promlceni-soud-d5u-/krimi.aspx?c=A171115_100830_krimi_jkk,Právníci přechytračili soud. Vyhýbali se mu až do promlčení činu,"Manželský pár advokátů Hnilicových názorně demonstroval, jak je v Česku možné se vyhnout trestu od soudu. Byť jde o závažný případ útisku nájemníků, kterých se zastane i Nejvyšší soud. Stačí se...",idnes.cz,title
https://zpravy.idnes.cz/kalousek-top-09-prezident-zeman-lany-db1-/domaci.aspx?c=A171115_153647_domaci_kop,"Zeman nechce 101 podpisů, aby nemohl být Babiš vydírán, řekl Kalouskovi","Prezident Zeman zástupcům TOP 09 v Lánech řekl, že po šéfovi ANO Andreji Babišovi nechce 101...",idnes.cz,title
https://zpravy.idnes.cz/jaroslav-mevald-veteran-smrt-zemrel-zivot-fj8-/domaci.aspx?c=A171115_105953_domaci_hell,Znovu bojovat mu zakázali. Válečný hrdina Mevald opustil svět předčasně,Zesnulý veterán Jaroslav Mevald působil v české armádě od svých dvaadvaceti let. Jeho jednotka...,idnes.cz,title
https://ekonomika.idnes.cz/uctenkovka-uctenkova-loterie-d2y-/ekonomika.aspx?c=A171115_124648_ekonomika_fih,"Nový ford i milion. Stát vybral šťastlivce, kteří sbírali účtenky",Dnes stát poprvé rozdá výhry v účtenkové loterii. O vítězích odpoledne rozhodlo losování...,idnes.cz,title
https://kultura.zpravy.idnes.cz/zemrel-herec-smid-0zk-/filmvideo.aspx?c=A171115_164039_filmvideo_spm,"Zemřel herec Jaroslav Šmíd, hrdina komedie Doktor od jezera hrochů","Ve věku 47 let zemřel herec Jaroslav Šmíd, známý z titulní role komedie Zdeňka Trošky Doktor...",idnes.cz,title
https://zpravy.idnes.cz/donald-trump-severni-korea-kldr-kim-cong-un-usa-fl3-/zahranicni.aspx?c=A171115_124955_zahranicni_linv,"Trump označil Kima za malého a tlustého, KLDR ho „odsoudila k smrti“",Severokorejský státní tisk se ostře opřel do amerického prezidenta Donalda Trumpa. Za jeho...,idnes.cz,title
https://hokej.idnes.cz/extraliga-21-kolo-02z-/hokej.aspx?c=A171115_140340_hokej_elv,"ON-LINE: Hradec a Litvínov vedou, Sparta rychle inkasuje v Liberci",Po včerejší předehrávce je dnes na programu zbylých šest utkání 21. kola hokejové extraligy....,idnes.cz,title
https://auto.idnes.cz/hyundai-i30-fastback-0oa-/automoto.aspx?c=A171114_154812_automoto_fdv,V Nošovicích startuje výroba nového auta. Ladného fastbacku Hyundai,Právě dnes startuje výroba dalšího auta z Česka. Ladný Hyundai i30 Fastback doplňuje nabídku...,idnes.cz,title
https://praha.idnes.cz/gumove-bodaky-zabrany-v-kolejisti-drr-/praha-zpravy.aspx?c=A171115_153729_praha-zpravy_rsr,"Bodáky proti přebíhačům z kolejiště zmizí, magistrát ukončil testování","Testování gumových bodáků, které díky svému tvaru měly odradit lidi od přebíhání přes koleje,...",idnes.cz,title
https://praha.idnes.cz/tricet-let-vrazda-otisk-prstu-kriminaliste-policie-objasnena-p6g-/praha-zpravy.aspx?c=A171115_132401_praha-zpravy_nuc,"Policie po 33 letech objasnila vraždu, pachatel vyvázne bez trestu","Pražští policisté po třiatřiceti letech objasnili vraždu 46letého muže, kterého útočník...",idnes.cz,title
https://xman.idnes.cz/kalendar-pirelli-2018-naomi-campbell-alenka-v-rici-divu-tim-walker-pvy-/xman-styl.aspx?c=A171110_192328_xman-styl_fro,Kalendář Pirelli 2018 se představil: zbavuje Alenku v říši divů nevinnosti,"Je průkopnický, excentrický, magický. Kalendář Pirelli pro rok 2018 nabídne příběh...",idnes.cz,title
https://finance.idnes.cz/prace-zamestnani-prodej-a-vyroba-peciva-cukrarna-f6q-/podnikani.aspx?c=A171114_102713_podnikani_kho,"Naše práce je dřina, uchazeče to odrazuje, říká pekař","Je brzy ráno, stojím v pekárně čakovického hypermarketu Globus a vypadám jak šmoula. Na sobě mám bílý ochranný hábit a na hlavě...",idnes.cz,title
https://zpravy.idnes.cz/david-rath-advokat-michal-pacovsky-zaloba-soud-fq4-/krimi.aspx?c=A171115_112040_krimi_jkk,Advokát Pacovský se musí omluvit Rathovi za nepravdivá tvrzení,,idnes.cz,title
https://zpravy.idnes.cz/recko-lijaky-vichrice-obeti-dfx-/zahranicni.aspx?c=A171115_143450_zahranicni_ert,"Řecko zasáhly silné lijáky a vichřice, zemřelo nejméně třináct lidí",,idnes.cz,title
https://fotbal.idnes.cz/fotbal-katar-mistrovstvi-sveta-2022-dr7-/fot_reprez.aspx?c=A171112_210729_fot_reprez_ten,"Fotbal v poušti. V Kataru je doma hvězdný Xavi, ale lístky tu rozdávají",,idnes.cz,title
https://sport.idnes.cz/radek-stepanek-kariery-konec-bilance-dvj-/tenis.aspx?c=A171114_215133_tenis_rou,"Božský komediant Štěpánek. Loučí se šampion, mistr hlášek a lovec žen",,idnes.cz,title
https://praha.idnes.cz/za-vrazdu-byvale-pritelkyne-babovak-pet-let-fzc-/praha-zpravy.aspx?c=A171115_161242_praha-zpravy_rsr,"Expřítelkyni mučil paralyzérem, na vodku už nedošlo. Muž dostal pět let",,idnes.cz,title
https://hradec.idnes.cz/nehoda-zaseknuty-kamion-pod-mostem-hradec-kralove-fsg-/hradec-zpravy.aspx?c=A171115_143849_hradec-zpravy_the,"Řidič náklaďáku hledal bránu, přehlédl podjezd a zasekl se pod mostem",,idnes.cz,title
https://ekonomika.idnes.cz/dovolena-zajezdy-cestovky-turistika-trzby-trend-turecko-egypt-pw8-/ekonomika.aspx?c=A171114_211601_ekonomika_dtt,"Kam napřesrok k moři? Hitem bude Turecko a Egypt, hlásí cestovky",,idnes.cz,title
https://ekonomika.idnes.cz/barbie-mattel-hidzab-panenka-d1v-/eko-zahranicni.aspx?c=A171114_174932_eko-zahranicni_fih,Mattel poprvé zahalil panenku Barbie muslimským šátkem,,idnes.cz,title
https://kultura.zpravy.idnes.cz/karel-stedry-posledni-rozlouceni-dl5-/hudba.aspx?c=A171115_094010_hudba_ts,"Stál jsi vždy při mně, Karle, řekla Bohdalová na rozloučení se Štědrým",,idnes.cz,title
