link,link_text,txt,site,area
https://www.lidovky.cz/soud-zprostil-obzaloby-sefa-strazniku-z-prahy-1-stejskala-ktery-mel-predloni-konflikt-s-ridicem-ikg-/zpravy-domov.aspx?c=A181115_115222_ln_domov_ele,"Soud zprostil obžaloby šéfa strážníků z Prahy 1 Stejskala, který vytrhl řidiči telefon z ruky","Obvodní soud pro Prahu 1 ve čtvrtek zprostil obžaloby ze zneužití pravomoci úřední osoby ředitele Městské policie Praha 1 Miroslava Stejskala, který...",lidovky.cz,domov
https://www.lidovky.cz/bookmakeri-otocili-babis-podle-nich-soucasnou-situaci-ustoji-pug-/zpravy-domov.aspx?c=A181115_112447_ln_domov_ele,"Bookmakeři otočili, Babiš podle nich současnou situaci ustojí","Premiér Andrej Babiš (ANO) současnou situaci vyvolanou zprávou o údajném únosu svého syna podle bookmakerů s velkou pravděpodobností ustojí. Na to,...",lidovky.cz,domov
https://www.lidovky.cz/soud-v-tabore-potvrdil-podminku-pro-sexuologa-weisse-za-vaznou-nehodu-dostal-2-5-roku-gnu-/zpravy-domov.aspx?c=A181115_111856_ln_domov_ele,"Podmínka pro sexuologa Weisse za smrtelnou dopravní nehodu platí, potvrdil soud","Odvolací soud v Táboře potvrdil podmíněný trest sexuologovi Petru Weissovi za to, že před dvěma lety způsobil dopravní nehodu. Na její následky...",lidovky.cz,domov
https://www.lidovky.cz/ministru-zahranici-petrickovi-vadi-ze-byl-babisuv-syn-s-vedomim-premiera-na-krymu-gjm-/zpravy-domov.aspx?c=A181115_110817_ln_domov_ele,"Petříček chce řešit cestu Babiše ml. na Krym. Není českým občanem, kontruje Hamáček","Ministru zahraničí Tomáši Petříčkovi (ČSSD) vadí, že byl syn premiéra Andreje Babiše (ANO) s vědomím otce na ukrajinském Krymu okupovaném Ruskem....",lidovky.cz,domov
https://www.lidovky.cz/hamacek-ve-ctvrtek-s-babisem-jednat-nebude-sejde-se-s-opozici-a-zemanem-1k2-/zpravy-domov.aspx?c=A181115_104134_ln_domov_ele,"Hamáček ve čtvrtek s Babišem jednat nebude, sejde se s Zemanem",Předseda sociálních demokratů Jan Hamáček (ČSSD) ve čtvrtek kvůli nabitému programu premiéra s předsedou vlády Andrejem Babišem (ANO) o pochybnostech...,lidovky.cz,domov
https://www.lidovky.cz/poslanci-schvalili-pomalejsi-rust-platu-vrcholnych-politiku-porostou-zrejme-o-devet-procent-i1q-/zpravy-domov.aspx?c=A181115_102445_ln_domov_ele,Poslanci schválili pomalejší růst platů vrcholných politiků. Porostou zřejmě o devět procent,"Platy vrcholných politiků vzrostou příští rok zřejmě zhruba o devět procent, nikoli razantněji o pětinu. Pomalejší růst Sněmovna ve vládní platové...",lidovky.cz,domov
https://www.lidovky.cz/babis-mladsi-byl-jako-muj-nevlastni-bratr-cesta-na-krym-nebyl-unos-rika-protopopov-premier-mu-pod-imp-/zpravy-domov.aspx?c=A181115_074250_ln_domov_ele,"Babiš ml. byl jako můj nevlastní bratr, na Krym jsem ho neunesl, říká Protopopov. Premiér mu poděkoval za péči","Petr Protopopov odmítá, že by unesl syna premiéra Andreje Babiše (ANO) na Krym. Deníku Právo řekl, že byl jeho asistentem a do Ruska a na Krym odjeli...",lidovky.cz,domov
https://www.lidovky.cz/skiresort-cerna-hora-pec-zastavi-investice-i-kvuli-zasahu-policie-1cl-/zpravy-domov.aspx?c=A181115_071349_ln_domov_ele,"SkiResort Černá hora - Pec zastaví investice, i kvůli nedávnému zásahu policie","Vlastník SkiResortu Černá hora - Pec, firma Mega Plus, zastavuje veškeré investice. Vyplynulo to z vyjádření většinového majitele Mega Plus Richarda...",lidovky.cz,domov
https://www.lidovky.cz/video-agresivni-vybrzdovac-byl-obvinen-za-zablokovani-jizdniho-pruhu-smykem-mu-hrozi-8-let-vezen-imt-/zpravy-domov.aspx?c=A181114_145529_ln_domov_rsa,VIDEO: Agresivní ‚vybržďovač‘ byl obviněn. Za zablokování jízdního pruhu smykem mu hrozí 8 let vězení,"Svým agresivním stylem jízdy, během níž soustavně vybržďoval jiného řidiče, ohrozil několik účastníků provozu. Nebezpečnému šoférovi, který koncem...",lidovky.cz,domov
//www.lidovky.cz/novinar.aspx?idnov=3890,Jan Horák,"Několik hodin strávil malíř Jan Merta na policejní stanici kvůli nápisu, jenž mířil na premiéra Andreje Babiše. Umělec pomaloval chodník na pražském...",lidovky.cz,domov
//www.lidovky.cz/novinar.aspx?idnov=2368,Šárka Kabátová,"Stejná podobizna kněze a oběti komunistického režimu Josefa Toufara, jaká zdobí bývalé sanatorium v pražské Legerově ulici, se nově objevila i na...",lidovky.cz,domov
https://www.lidovky.cz/vetsina-cechu-veri-ze-babis-brani-svym-detem-vypovidat-vychazi-z-pruzkumu-1tf-/zpravy-domov.aspx?c=A181114_194829_ln_domov_form,"57 procent Čechů věří, že Babiš brání svým dětem vypovídat v kauze Čapí hnízdo, vychází z průzkumu","Většina Čechů věří, že premiér Andrej Babiš (ANO) se snaží, aby jeho blízcí nevypovídali v kauze Čapí hnízdo. Téměř polovina lidí to zároveň považuje...",lidovky.cz,domov
https://www.lidovky.cz/manzelstvi-pro-homosexualy-poslanci-debatovali-o-ustavni-novele-p93-/zpravy-domov.aspx?c=A181114_191011_ln_domov_form,"Poslanci řeší manželství pro homosexuály. ‚Je to zásadní pro stejnopohlavní páry, pro jejich děti‘",Poslanecké návrhy na uzákonění manželství jako svazku muže a ženy i na uzákonění možnosti manželství pro stejnopohlavní páry budou čelit snahám o...,lidovky.cz,domov
//www.lidovky.cz/novinar.aspx?idnov=89,Miloslav Novák,"Je největší, nejslavnější, nejúspěšnější. Má nejvíc fanoušků, obdivovatelů, ale i těch, kteří ji nesnáší. V Česku je málokomu lhostejná. AC Sparta...",lidovky.cz,sport
//www.lidovky.cz/novinar.aspx?idnov=1572,Antonín Vavrda,Drsné souboje až do krve. Tisíce diváků v hledišti. Téměř antické drama. Smíšená bojová umění (MMA) zažívají v Česku i ve světě nebývalý boom. Proč...,lidovky.cz,sport
https://sport.lidovky.cz/byla-tam-spousta-nedostatku-prohlasuje-trener-silhavy-zaroven-ale-i-chvalil-1s5-/fotbal.aspx?c=A181115_225857_ln-sport-fotbal_rkj,"Byla tam spousta nedostatků, prohlašuje trenér Šilhavý. Zároveň ale i chválil",Podle trenéra Jaroslava Šilhavého se čeští fotbalisté i ve třetím utkání pod jeho vedením herně posunuli. Výhru 1:0 v přípravném zápase v Polsku...,lidovky.cz,sport
//www.lidovky.cz/novinar.aspx?idnov=110,Jan Palička,Fotbalová Sparta slaví 125. narozeniny. Kdo patří mezi její ikony? Kdy bylo Spartě nejhůř? Odpovědi nabízí klubový archivář Václav Boreček.,lidovky.cz,sport
//www.lidovky.cz/novinar.aspx?idnov=1572,Antonín Vavrda,"Je to měsíc, co odcestoval Tomáš Deák za velkou louži. Jeden z nejlepších slovenských bojovníků MMA (smíšená bojová umění) strávil dva týdny v kempu...",lidovky.cz,sport
https://www.lidovky.cz/novinar.aspx?idnov=4197,Jan Krejcar,"Výhry týmů majících v kádru také přistěhovalce přispívají k otupení rasismu ve společnosti. Tvrdí to i Lilian Thuram, bývalý skvělý francouzský...",lidovky.cz,sport
//www.lidovky.cz/novinar.aspx?idnov=3686,Vojtěch Povejšil,"Druhým reprezentačním gólem si spravil chuť, bere ho jako dobrou psychickou vzpruhu v nepříjemných časech. Fotbalový záložník Jakub Jankto trefil...",lidovky.cz,sport
https://sport.lidovky.cz/do-tretice-vseho-dobreho-chorvate-v-lize-narodu-konecne-zvitezili-1c6-/fotbal.aspx?c=A181115_224938_ln-sport-fotbal_rkj,Do třetice všeho dobrého. Chorvaté v Lize národů konečně zvítězili,Fotbaloví vicemistři světa Chorvaté v Lize národů na třetí pokus vyhráli a po vítězství 3:2 nad Španělskem udrželi šanci na postup do play off.,lidovky.cz,sport
https://sport.lidovky.cz/polsti-strelci-v-reprezentaci-uvadaji-probudi-se-proti-cechum-pbl-/fotbal.aspx?c=A181114_161526_ln-sport-fotbal_rkj,Češi zdolali polského soupeře 1:0. Jedinou branku vsítil Jankto,"Nebyl čas na přehnané zkoušení. Čeští fotbalisté ve čtvrtek odehráli předposlední reprezentační utkání tohoto roku, a byli v něm úspěšní, Polsko...",lidovky.cz,sport
https://sport.lidovky.cz/olomoucti-fotbaliste-jsou-ctvrtfinalisty-mol-cupu-stejne-tak-i-liberec-1a3-/fotbal.aspx?c=A181115_210352_ln-sport-fotbal_rkj,"Olomoučtí fotbalisté jsou čtvrtfinalisty MOL Cupu, stejně tak i Liberec",Fotbalisté Liberce a Olomouce se stali dalšími čtvrtfinalisty domácího poháru MOL Cupu. Severočeši zdolali Slovácko s debutujícím trenérem Martinem...,lidovky.cz,sport
https://sport.lidovky.cz/cesnekove-divky-zaluji-na-trenery-a-svaz-meli-jim-upirat-lidska-prava-12z-/ostatni-sporty.aspx?c=A181115_111226_ln-sport-ostatni_rkj,'Česnekové dívky' žalují na trenéry a svaz. Měla jim být upírána lidská práva,Před osmi měsíci způsobily prvotřídní senzaci. Na olympijských hrách v Pchjongčchangu se výprava jihokorejských curlerek překvapivě dostala až do...,lidovky.cz,sport
https://sport.lidovky.cz/federer-to-zvladl-ze-zamotane-skupiny-postupuje-spolu-s-andersonem-11s-/ostatni-sporty.aspx?c=A181115_170017_ln-sport-ostatni_rkj,Federer to zvládl. Ze zamotané skupiny postupuje spolu s Andersonem,Jihoafrický tenista Kevin Anderson a Švýcar Roger Federer se stali dalšími semifinalisty Turnaje mistrů v Londýně. Anderson měl po dvou vítězstvích...,lidovky.cz,sport
https://sport.lidovky.cz/facka-novinari-byla-spatna-ribery-se-omluvil-za-napadeni-pkc-/fotbal.aspx?c=A181115_151321_ln-sport-fotbal_rkj,Facka novináři byla špatná. Ribéry se omluvil za napadení,"Francouzský fotbalista Bayenu Mnichov Franck Ribéry se omluvil novináři, s nímž měl fyzický konflikt po sobotní porážce 2:3 v bundesligovém šlágru s...",lidovky.cz,sport
https://sport.lidovky.cz/video-durica-sestrelil-soupere-nyni-dostal-trest-na-tri-zapasy-psp-/fotbal.aspx?c=A181115_154736_ln-sport-fotbal_rkj,"VIDEO: Ďurica sestřelil soupeře, nyní dostal trest na tři zápasy",Obránce pražské Dukly Ján Ďurica dostal od disciplinární komise Ligové fotbalové asociace dodatečně trest zákazu startu na tři soutěžní zápasy za...,lidovky.cz,sport
https://sport.lidovky.cz/musime-udelat-dalsi-krok-dopredu-burcuje-hamilton-soupere-vidi-v-red-bullu-1ud-/ostatni-sporty.aspx?c=A181115_091850_ln-sport-ostatni_rkj,"Musíme udělat další krok dopředu, burcuje Hamilton. Soupeře vidí v Red Bullu","Závodník formule 1 Lewis Hamilton prohlásil, že se svých rivalů nebude bát ani příští rok. V případě titulu v dalším ročníku by si připsal už šestou...",lidovky.cz,sport
https://sport.lidovky.cz/eden-arena-sinobo-stadium-hriste-slavie-bude-menit-nazev-pk1-/fotbal.aspx?c=A181115_102512_ln-sport-fotbal_rkj,"Z Eden areny bude Sinobo Stadium. Všechno se včas dozvíte, mlží Slavia","Až vyrazíte na domácí zápas fotbalistů Slavie, už nepůjdete do Eden areny. Klub mění název stadionu, oficiálně se bude jmenovat podle čínské...",lidovky.cz,sport
https://sport.lidovky.cz/satoransky-pomohl-washingtonu-osmi-body-k-treti-vyhre-za-sebou-ps9-/ostatni-sporty.aspx?c=A181115_080048_ln-sport-ostatni_ele,Satoranský pomohl Washingtonu osmi body k třetí výhře za sebou,Basketbalisté Washingtonu porazili v NBA na domácí palubovce 119:95 Cleveland a připsali si třetí vítězství za sebou. Přispěl k tomu i český...,lidovky.cz,sport
https://sport.lidovky.cz/plekance-kontaktovaly-tymy-z-extraligy-on-chce-nejprve-nabrat-kondici-1zr-/hokej.aspx?c=A181114_222125_ln-sport-hokej_rkj,"Plekance kontaktovaly týmy z extraligy, on chce nejprve nabrat kondici","Už v úterý večer po příletu se sklouzl po kladenském ledě, ve středu dopoledne si zatrénoval i s celým týmem včetně Jaromíra Jágra. Útočník Tomáš...",lidovky.cz,sport
https://sport.lidovky.cz/pastrnak-se-v-nhl-trefil-potreti-v-rade-skoroval-i-vrana-pjl-/hokej.aspx?c=A181115_073113_ln-sport-hokej_ele,"VIDEO: Pastrňák se v NHL trefil potřetí v řadě, skóroval i Vrána",Útočník David Pastrňák nezabránil ve středečním utkání NHL gólem a nahrávkou porážce hokejistů Bostonu 3:6 na ledě Colorada. Havířovský rodák se...,lidovky.cz,sport
//www.lidovky.cz/novinar.aspx?idnov=110,Jan Palička,"Čeští fotbalisté se ve čtvrtek večer postaví v přípravě v Gdaňsku Polsku, které vede jeden z nejlepších útočníků světa Robert Lewandovski.",lidovky.cz,sport
https://sport.lidovky.cz/liberec-obratil-stav-utkani-se-zlinem-sparta-prekvapive-podlehla-boleslavi-1ba-/hokej.aspx?c=A181114_213731_ln-sport-hokej_rkj,"Liberec obrátil stav utkání se Zlínem, Sparta překvapivě podlehla Boleslavi","Hráči Liberce si nakonec poradili se Zlínem, se kterým ještě ve 42. minutě prohrávali 1:3. V Litvínově si domácí hokejisté konečně dopřáli spoustu...",lidovky.cz,sport
//www.lidovky.cz/novinar.aspx?idnov=3850,Tomáš Zatloukal,"Všichni tenisté jsou si rovni, jen někteří jsou si rovnější? Třaskavou debatu rozpoutal francouzský deblista Julien Benneteau, když se v rozhovoru...",lidovky.cz,sport
//www.lidovky.cz/novinar.aspx?idnov=3686,Vojtěch Povejšil,"Uvědomují si, že by k dobrým výkonům z minulých zápasů měli v Polsku ještě něco přidat. „Chceme se soustředit na co nejvíc gólů. A nejlíp i na čisté...",lidovky.cz,sport
https://sport.lidovky.cz/mourinho-je-lepsi-trener-nez-guardiola-mysli-si-legendarni-maradona-115-/fotbal.aspx?c=A181114_114650_ln-sport-fotbal_rkj,"Mourinho je lepší trenér než Guardiola, myslí si legendární Maradona","Zatímco tým trenéra Pepa Guardioly Manchester City vládne fotbalové Premier League, jejich městský rival United s Mourinhem v čele se potácí zhruba...",lidovky.cz,sport
https://sport.lidovky.cz/plekanec-trenoval-s-kladnem-jistotu-dalsiho-angazma-ale-nema-prg-/hokej.aspx?c=A181114_131542_ln-sport-hokej_rkj,"Tomáš Plekanec trénoval s Kladnem, jistotu dalšího angažmá ale nemá","Hokejový útočník Tomáš Plekanec po úterním návratu z Montrealu ve středu trénoval s prvoligovým Kladnem. S Rytíři se bude připravovat i nadále, o...",lidovky.cz,sport
https://sport.lidovky.cz/konec-ikonickeho-kvetaku-fellaini-se-rozloucil-se-svymi-vlasy-pbb-/fotbal.aspx?c=A181114_125254_ln-sport-fotbal_rkj,Konec ikonického ‚květáku‘. Fellaini se rozloučil se svými vlasy,"Fotbalista Manchesteru United Marouane Fellaini působil na evropských trávnících jako přírodní úkaz. Svým účesem na hlavě rozděloval fanoušky, jedni...",lidovky.cz,sport
https://sport.lidovky.cz/caster-semenyaova-o-konci-neuvazuji-chci-zavodit-jeste-10-let-pr1-/ostatni-sporty.aspx?c=A181114_105811_ln-sport-ostatni_rkj,"Případ Semenyaová: O konci neuvažuje, chce závodit ještě 10 let","Dvojnásobná olympijská vítězka a trojnásobná mistryně světa Caster Semenyaová o konci kariéry neuvažuje. Jihoafrická běžkyně, která na své hlavní...",lidovky.cz,sport
https://sport.lidovky.cz/suspendace-za-kamen-nuzky-papir-anglicky-sudi-si-nezapiska-tri-tydny-1jw-/fotbal.aspx?c=A181114_100437_ln-sport-fotbal_rkj,"Suspendace za kámen, nůžky, papír. Anglický sudí si nezapíská tři týdny","Anglický rozhodčí David McNamara byl potrestán za to, že před říjnovým ligovým utkáním mezi fotbalistkami Manchesteru City a Readingu místo hodu...",lidovky.cz,sport
//www.lidovky.cz/novinar.aspx?idnov=466,Tomáš Macek,Ve Vancouveru se před osmi lety zviditelnil zdařilým debutem na olympiádě. Začátkem prosince se Michal Březina do tohoto kanadského města vrátí....,lidovky.cz,sport
https://sport.lidovky.cz/nhl-voracek-skoroval-new-jersey-si-vytahlo-zachu-z-farmy-pei-/hokej.aspx?c=A181114_072658_ln-sport-hokej_form,VIDEO: Voráček vstřelil jedinou branku týmu. New Jersey si vytáhlo Zachu z farmy,"Útočník Jakub Voráček vstřelil v úterním utkání NHL jediný gól Philadelphie, která podlehla doma Floridě 1:2, a byl vyhlášen třetí hvězdou zápasu. V...",lidovky.cz,sport
https://www.lidovky.cz/novinar.aspx?idnov=3709,Jaroslav Šindelář,"Sezona v americké Major League Soccer mu skončila a teď přemýšlí, kam dál. Cena Bořka Dočkala je však 150 milionů korun, což kluby odrazuje od toho,...",lidovky.cz,sport
https://sport.lidovky.cz/nemecky-kouc-sparty-ohromil-cele-cesko-nyni-by-mel-krupp-trenovat-reprezentaci-g02-/hokej.aspx?c=A181113_112313_ln-sport-hokej_lar,Německý kouč Sparty ohromil celé Česko. Nyní by měl Krupp trénovat reprezentaci,"Úspěšný německý trenér Uwe Krupp, který přivedl hokejovou Spartu k aktuálnímu vedení v Tipsport extralize, by měl stejně jako v letech 2005-11...",lidovky.cz,sport
https://sport.lidovky.cz/prisel-jsem-o-sanci-vyhrat-tour-a-je-to-vase-chyba-odskodnete-me-vzkazuje-nibali-poradatelum-gys-/ostatni-sporty.aspx?c=A181113_191952_ln-sport-ostatni_lar,"Přišel jsem o šanci vyhrát Tour a je to vaše chyba. Odškodněte mě, vzkazuje Nibali pořadatelům","Toužil po dalším žlutém trikotu, patřil mezi favority Tour de France. Byl průběžně čtvrtý. Jenže slavný červencový závod skončil pro Vincenza...",lidovky.cz,sport
https://sport.lidovky.cz/zatahl-souperi-za-brzdu-a-malem-ho-zabil-kontroverzni-ital-se-vsak-vrati-za-riditka-gk6-/ostatni-sporty.aspx?c=A181113_144436_ln-sport-ostatni_lar,Zatáhl soupeři za brzdu a málem ho zabil. Kontroverzní Ital se však vrátí za řidítka,"Italský závodník Romano Fenati se zřejmě příští rok vrátí do mistrovství světa silničních motocyklů. Oficiální web šampionátu uvedl, že kontroverzní...",lidovky.cz,sport
https://sport.lidovky.cz/stane-se-z-nej-druhy-jaromir-jagr-vesti-pastrnakovi-velkou-budoucnost-legendarni-klima-g58-/hokej.aspx?c=A181113_184556_ln-sport-hokej_lar,"Stane se z něj druhý Jaromír Jágr, věští Pastrňákovi velkou budoucnost legendární Klíma","Panečku, to byl víkend! V sobotu se český kanonýr ve službách Bostonu zaskvěl proti Torontu už druhým hattrickem této sezony, oden později přidal v...",lidovky.cz,sport
https://www.lidovky.cz/novinar.aspx?idnov=110,Jan Palička,"Dlouhé roky to býval mezník. Patnácté kolo, půlka sezony. Teď je to poprvé událost především na papíře, protože fotbalová liga změnila scénář. V...",lidovky.cz,sport
https://www.lidovky.cz/kultura/blues-alive-cena-keeping-the-blues-award.A181114_181204_ln_kultura_bez,Český festival Blues Alive získal nejprestižnější americké žánrové ocenění,"Jako vůbec první český držitel získal mezinárodní hudební festival Blues Alive, jehož dvacátý třetí ročník včera začal v Šumperku, nejprestižnější...",lidovky.cz,kultura
https://www.lidovky.cz/kultura/zlaty-podraz-ve-fotografii-a-v-knize-kritik-ocenuje-osobu-autora-i-dilo.A181115_204514_ln_kultura_rkj,Zlatý podraz ve fotografii a v knize. Kritici oceňují osobu autora i dílo,Ještě do nadcházejícího pondělí je možné v pražském Paláci YMCA navštívit výstavu Zlatý podraz ve fotografii. Expozice snímků Patrika Nguyena...,lidovky.cz,kultura
https://www.lidovky.cz/novinari/marcel-kabat.N2324,Marcel Kabát,Nejúspěšnější současný italský režisér Paolo Sorrentino přichází s portrétem nejdéle sloužícího italského premiéra v poválečné historii Silvia...,lidovky.cz,kultura
https://www.lidovky.cz/novinari/marcel-kabat.N2324,Marcel Kabát,"Předvánoční čas je tu as ním v kinech nové zpracování klasiky dr. Seusse o zeleném tvorovi jménem Grinch, který ukradl lidem Vánoce. Theodor Seuss...",lidovky.cz,kultura
https://www.lidovky.cz/kultura/americkou-narodni-knizni-cenu-ziskal-roman-sigrid-nunezove-za-roman-pritel.A181115_121720_ln_kultura_krku,Americkou Národní knižní cenu získala Sigrid Nunezová za román Přítel,"Americkou národní knižní cenu za beletrii získal letos román Sigrid Nunezové The Friend (Přítel), který agentura AP charakterizovala jako meditativní...",lidovky.cz,kultura
https://www.lidovky.cz/novinar.aspx?idnov=493,Jana Machalická,Daniel Špinar uvedl v Národním divadle vlastní dramatizaci románu Stefana Zweiga Netrpělivost srdce. Jediný dokončený román rakouského prozaika je...,lidovky.cz,kultura
https://www.lidovky.cz/novinari/jana-machalicka.N493,Jana Machalická,Rozsáhlý a vrstevnatý román Kateřiny Tučkové Žítkovské bohyně se dočkal další dramatizace a jevištního uvedení – v Divadle pod Palmovkou. Michal Lang...,lidovky.cz,kultura
https://www.lidovky.cz/kultura/udelali-jsme-maximum-mozneho-rika-reditel-narodni-galerie-fajt.A181114_161735_ln_kultura_jei,"Udělali jsme maximum možného, říká ředitel Národní galerie Fajt","Se zástupci francouzského Centre Pompidou jsme se dohodli na spolupráci, říká ředitel Národní galerie Jiří Fajt. Další, konkrétnější schůzka se bude...",lidovky.cz,kultura
https://www.lidovky.cz/novinari/jaroslav-totusek.N3899,Jaroslav Totušek,"Třetí listopadový týden míří do českých kin osm snímků. Očekávané pokračování Fantastických zvířat doplní historický příběh z Budapešti, životopisný...",lidovky.cz,kultura
https://www.lidovky.cz/kultura/da-se-vmestnat-sto-let-historie-do-jednoho-vecera-pokusi-se-o-to-studenti-arts-managementu.A181114_150931_ln_kultura_jto,Dá se vměstnat sto let historie do jednoho večera? Pokusí se o to studenti Arts Managementu,V pražském multikulturním prostoru DriveHouse v proběhne na konci listopadu nadějný kulturní event Kultury Proměny: 100. Cestu časem doprovodí široká...,lidovky.cz,kultura
https://www.lidovky.cz/kultura/divadelni-okenko-touha-po-moci-a-zlo-variace-na-shakespearova-macbetha.A181108_134930_ln_kultura_ape,DIVADELNÍ OKÉNKO: Touha po moci a zlo. Variace na Shakespearova Macbetha,"Zlo se nerodí v temném kotli, ale vyrůstá z neochoty přiznat sobě i okolí to, co nás uspokojuje. A tam, kde nemůže být ukojena přirozená touha po...",lidovky.cz,kultura
https://www.lidovky.cz/kultura/soutez-roman-o-hledani-a-ztraceni-vyhrajte-knihu-besa.A181114_114125_ln_kultura_ape,SOUTĚŽ: Román o hledání a ztrácení. Vyhrajte knihu Běsa,Znepokojivý román o hledání a ztrácení těch nejbližších. Běla a Sabina vyrůstaly jako dokonale na sebe napojená jednovaječná dvojčata — dokud jejich...,lidovky.cz,kultura
https://www.lidovky.cz/novinari/marcel-kabat.N2324,Marcel Kabát,"Jedenačtyřicetiletý maďarský režisér László Nemes, držitel Oscara za drama Saulův syn, tentokrát nabízí divákům horečnatou noční můru ze sklonku...",lidovky.cz,kultura
https://www.lidovky.cz/kultura/herecky-koncert-jude-lawa-do-rytmu-techna-pet-duvodu-proc-sledovat-mladeho-papeze.A181113_104427_ln_kultura_jto,"Herecký koncert Jude Lawa do rytmu techna. Pět důvodů, proč sledovat Mladého papeže",Mladý papež pije dietní kolu a rád si zakouří. Minisérie Paola Sorrentina za dva roky neztratila nic na své působivosti. Nyní ji navíc každé úterý ve...,lidovky.cz,kultura
https://www.lidovky.cz/kultura/kviz-mocni-hrdinove-i-nemravne-stripterky-jak-dobre-znate-stana-leeho-a-marvel.A181113_130911_ln_kultura_jto,KVÍZ: Mocní hrdinové i nemravné striptérky. Jak dobře znáte Stana Leeho a Marvel?,"V pondělí 12. listopadu zemřela komiksová legenda Stan Lee. Stopa člověka, který dal dnešnímu komiksu jeho tvář, je dnes díky oblíbenosti...",lidovky.cz,kultura
https://www.lidovky.cz/novinar.aspx?idnov=3899,Jaroslav Totušek,Site-specific umělecká výstava Pokoje 2018 představí práce čtyřiceti studentů vysokých uměleckých škol. Ti v prostorách Kampusu Hybernská vyzdobili...,lidovky.cz,kultura
https://www.lidovky.cz/svet/zemrel-stan-lee-tvurce-slavnych-komiksu-spider-man-ci-x-man-bylo-mu-95-let.A181112_200436_ln_zahranici_pev,Zemřel legendární tvůrce Spider-mana či Iron Mana. ‚Otec‘ superhrdinů Stan Lee se dožil 95 let,"Ve věku 95 let zemřel americký tvůrce slavných komiksů se superhrdiny, jako je Spider-man, Iron Man či X-man, Stan Lee. Médiím to sdělila jeho dcera,...",lidovky.cz,kultura
https://www.lidovky.cz/novinari/ondrej-bezr.N3784,Ondřej Bezr,"Minulý čtvrtek v Praze vůbec poprvé koncertoval poslední stále aktivní pamětník vzniku a rozkvětu chicagského blues, kytarista Buddy Guy (82)....",lidovky.cz,kultura
https://www.lidovky.cz/novinari/jaroslav-totusek.N3899,Jaroslav Totušek,"Německá mutace časopisu Playboy zveřejnila rozhovor se  Enniem Morriconem, ve kterém označil režiséra Quentina Tarantina, se kterým spolupracoval na...",lidovky.cz,kultura
https://www.lidovky.cz/novinari/jaroslav-totusek.N3899,Jaroslav Totušek,Tohle může vymyslet opravdu jen Deadpool! K Vánocům vznikne dětem přístupná verze letošního komiksového hitu Deadpool 2. Deadpool (Ryan Reynolds)...,lidovky.cz,kultura
https://www.lidovky.cz/novinar.aspx?idnov=3899,Jaroslav Totušek,"Komediální seriál Kominského metoda (The Kominsky Method) vypráví o málo známém herci, který si v Hollywoodu otevře hereckou školu. Seriál má...",lidovky.cz,kultura
https://www.lidovky.cz/kultura/kde-lezi-hranice-vkusu-odpoved-se-snazi-najit-vystava-bez-stanika.A181112_123536_ln_kultura_jto,Kde leží hranice vkusu? Odpověď se snaží najít výstava Bez Stanika,Šestice autorů z Česka a Polska se snaží v ostravské galerii Fiducia přinést humorný náhled na dnešní svět. Jedním z hlavních motivů výstavy je práce...,lidovky.cz,kultura
https://www.lidovky.cz/kultura/tomas-kaco-john-patitucci.A181112_150629_ln_kultura_bez,"Klavírista Tomáš Kačo představí album, na kterém hostuje John Patitucci",V rámci koncertního cyklu Hybatelé rezonance bude dnes a zítra v pražském Anežském klášteře pokřtěno debutové album klavíristy Tomáše Kača My Home....,lidovky.cz,kultura
