link,link_text,txt,site,area
https://www.lidovky.cz/polovina-ultraortodoxnich-zidu-v-izraeli-pracuje-v-mode-ci-vyvoji-mobilnich-aplikaci-g4d-/lide.aspx?c=A180401_120646_lide_ele,Polovina ultraortodoxních Židů v Izraeli pracuje v módě či vývoji mobilních aplikací,"Pod pojmem ultraortodoxní Žid si většina lidí vybaví hluboce věřícího člověka s kloboukem, bílou košilí a černými kalhotami. Málokoho napadne, že by...",lidovky.cz,lide
https://www.lidovky.cz/novinar.aspx?idnov=2431,Alena Pecháčková,Tomáš Studeník pořádá už potřetí největší hackaton CEE Hacks v Česku. Letos do Prahy na začátek dubna pozval programovat i děti. Na rozdíl od...,lidovky.cz,lide
https://www.lidovky.cz/jsem-jeste-maly-kure-rika-o-sobe-herecka-anna-fialova-fya-/lide.aspx?c=A180327_135754_lide_ape,"Jsem ještě malý kuře, říká o sobě herečka Anna Fialová","Herečka Anna Fialová o tom, čím ji okouzlil styl 90. let, proč miluje módu a o čem nejraději mluví se svým slavným dědou Karlem Fialou.",lidovky.cz,lide
https://www.lidovky.cz/na-hawkingove-pohrbu-se-seslo-pet-set-lidi-jeho-popel-bude-ulozen-vedle-newtona-nebo-darwina-gyj-/lide.aspx?c=A180331_161042_lide_ele,Na Hawkingově pohřbu se sešlo 500 lidí. Zvon cambridgského kostela odbil šestasedmdesátkrát,"Pět stovek pozvaných smutečních hostů se v sobotu sešlo v kostele Panny Marie v Cambridge na pohřbu britského fyzika Stephena Hawkinga, který zemřel...",lidovky.cz,lide
https://www.lidovky.cz/arnold-schwarzenegger-podstoupil-akutni-operaci-srdce-jeho-stav-by-mel-byt-stabilni-g3u-/lide.aspx?c=A180330_184749_lide_mber,Arnold Schwarzenegger podstoupil akutní operaci srdce. Jeho stav by měl být stabilní,"Rakousko-americký herec, sportovec a politik Arnold Schwarzenegger podstoupil ve čtvrtek několikahodinovou akutní operaci na otevřeném srdci....",lidovky.cz,lide
https://www.lidovky.cz/novinar.aspx?idnov=3143,Pavel Matocha,"Bývalý vydavatel Večerníku-Praha, autor živnostenského zákona a bonviván Fidelis Schlée (69) v noci na pátek po dlouhé těžké nemoci zemřel, několik...",lidovky.cz,lide
https://www.lidovky.cz/zemrel-vaclav-mezricky-byvaly-generalni-sekretar-ustavniho-soudu-i-clen-komise-ropak-roku-gx4-/lide.aspx?c=A180329_093015_lide_krku,"Zemřel Václav Mezřický, bývalý generální sekretář Ústavního soudu i člen komise Ropáka roku",V pondělí zemřel ve věku 83 let bývalý generální sekretář Ústavního soudu Václav Mezřický. Působil také v Ústavu státu a práva Československé...,lidovky.cz,lide
https://www.lidovky.cz/novinar.aspx?idnov=1090,Vojtěch Gibiš,"John Wayne Gacy, alias přátelský klaun Pogo, znásilnil, mučil a zavraždil nejméně 33 chlapců. „Byl jsem soudcem, porotou a katem v případě velkého...",lidovky.cz,lide
https://www.lidovky.cz/zpevacka-dara-rolins-a-rapper-rytmus-se-rozchazi-konec-vztahu-oznamili-soucasne-gpi-/lide.aspx?c=A180328_214018_lide_ele,Zpěvačka Dara Rolins a rapper Rytmus se rozchází. Konec vztahu oznámili současně,Stylový pár českého showbyznysu oznámil konec vztahu. Zpěvačka Dara Rolins a slovenský rapper Rytmus (Patrik Vrbovský) spolu byli sedm let. Během té...,lidovky.cz,lide
https://www.lidovky.cz/vyrobte-si-doma-pravou-thajskou-zmrzlinu-se-sezamem-pce-/dobra-chut.aspx?c=A180319_125702_dobra-chut_ape,VIDEORECEPT: Vyrobte si doma pravou thajskou zmrzlinu se sezamem,"Jak na thajské kari, jarní závitky či ostrý salát? Naučte se připravit ty nejlepší asijské pokrmy s jedním z nejlepších českých šéfkuchařů. Server...",lidovky.cz,video
https://www.lidovky.cz/video-lanovka-v-gruzii-se-rozjela-pozpatku-a-zrychlila-lyzare-odhazovala-do-okoli-gjm-/zpravy-svet.aspx?c=A180316_155947_ln_zahranici_ele,VIDEO: Lanovka v Gruzii se rozjela pozpátku a zrychlila. Lyžaře odhazovala do okolí,V pátek došlo v jednom z největších lyžařských středisek na východu Gruzie k poruše sedačkové lanovky. Incident si vyžádal osm zraněných. Informovalo...,lidovky.cz,video
https://www.lidovky.cz/gingerhead-maji-nove-video-dc4-/kultura.aspx?c=A180315_182125_ln_kultura_bez,VIDEO: Gingerhead natočili singl v češtině a hrají akusticky s Wohnout,Česká kapela Gingerhead připravila nový videoklip ke své první česky zpívané písničce Spojený nádoby. Nejen tuto píseň naživo zahraje v rámci...,lidovky.cz,video
https://www.lidovky.cz/novinar.aspx?idnov=3961,Jiří Bigas,Stephen Hawking se stal celebritou mezi vědci. Většina lidí ho znala díky televizi a filmu spíš než pro jeho vědeckou práci. Zahrál si sám sebe v...,lidovky.cz,video
https://sport.lidovky.cz/silenec-s-nozem-ohrozoval-hokejisty-kladna-vnikl-na-led-a-hrace-vyzyval-k-bitce-191-/hokej.aspx?c=A180315_153049_ln-sport-hokej_vlh,VIDEO: Šílenec s nožem ohrožoval hokejisty Kladna. Vnikl na led a hráče vyzýval k bitce,"Čtvrteční trénink hokejistů prvoligového Kladna, kteří se chystají na domácí odvety semifinále play off o místo v baráži proti Českým Budějovicím,...",lidovky.cz,video
https://www.lidovky.cz/video-mlok-scamander-se-opet-postavi-grindelwaldovi-jude-law-se-predstavi-jako-brumbal-gly-/kultura.aspx?c=A180313_182134_ln_kultura_ELE,VIDEO: Další Fantastická zvířata. Jude Law se představí jako Brumbál,"Záběr na Bradavice a přemístění několika kouzelníků. Tak vypadá úvodní scéna traileru k novému snímku Fantastických zvířat, který slibuje nejen...",lidovky.cz,video
https://www.lidovky.cz/videorecept-terijaki-udon-jak-na-na-japonske-nudle-poradi-sefkuchar-1pi-/dobra-chut.aspx?c=A180312_103115_dobra-chut_ape,"VIDEORECEPT: Terijaki Udon. Jak na japonské nudle, poradí šéfkuchař","Jak na thajské kari, jarní závitky či ostrý salát? Naučte se připravit ty nejlepší asijské pokrmy s jedním z nejlepších českých šéfkuchařů. Server...",lidovky.cz,video
https://www.lidovky.cz/novinar.aspx?idnov=2368,Šárka Kabátová,Ještě nedokončili střední školu a už v terezínském Centru studií genocid představili vrstevníkům i široké veřejnosti expozici o holocaustu. Na...,lidovky.cz,video
https://www.lidovky.cz/novinar.aspx?idnov=3961,Jiří Bigas,"V sobotu uplynulo přesně 40 let od chvíle, kdy se první československý kosmonaut Vladimír Remek vrátil ze své skoro osmidenní vesmírné mise....",lidovky.cz,video
https://www.lidovky.cz/novinar.aspx?idnov=2368,Šárka Kabátová,Třetí nádvoří Pražského hradu zaplnili ve čtvrtek odpoledne převážně zastánci Miloše Zemana. Inaugurační projev staronové hlavy státu sice skrze...,lidovky.cz,video
https://www.lidovky.cz/novinar.aspx?idnov=2368,Šárka Kabátová,Čtvrteční inaugurace staronové hlavy státu se nesla ve znamení dehonestace novinářů a médií. Nejprve ji demonstroval prezident Miloš Zeman během...,lidovky.cz,video
https://www.lidovky.cz/zeman-znovu-prezident-slozil-slib-a-zahajil-druhe-petilete-funkcni-obdobi-15r-/zpravy-domov.aspx?c=A180308_141026_ln_domov_gib,VIDEO: Zeman složil prezidentskou přísahu a svým projevem opět budil vášně,Miloš Zeman složil odpoledne prezidentský slib a zahájil tím druhé pětileté funkční období. Slavnostního ceremoniálu ve Vladislavském sále Pražského...,lidovky.cz,video
https://www.lidovky.cz/videorecept-jak-doma-na-thajske-pikantni-nudle-s-hovezim-masem-pbd-/dobra-chut.aspx?c=A180305_120027_dobra-chut_ape,VIDEORECEPT: Jak doma na thajské pikantní nudle s hovězím masem,"Jak na thajské kari, jarní závitky či ostrý salát? Naučte se připravit ty nejlepší asijské pokrmy s jedním z nejlepším českých šéfkuchařů. Server...",lidovky.cz,video
https://www.lidovky.cz/video-neoficialne-bych-se-s-dalajlamou-setkal-i-bez-dohody-s-vladou-rika-jiri-drahos-gkf-/video.aspx?c=A180125_170256_ln-video_jbs,"VIDEO: Neoficiálně bych se s dalajlámou setkal i bez dohody s vládou, říká Jiří Drahoš",Setkal by se Jiří Drahoš s dalajlámou? Na co se chce zeptat Miloše Zemana v dnešním duelu České televize? Koho by si vzal s sebou na Hrad? Může být...,lidovky.cz,video
https://www.lidovky.cz/novinar.aspx?idnov=3961,Jiří Bigas,"Osmadvacetiletý Číňan přemaloval dopravní značení na vytížené křižovatce v naději, že tak učiní provoz plynulejší. Frustrovalo ho, že se v tomto...",lidovky.cz,video
https://www.lidovky.cz/novinar.aspx?idnov=3961,Jiří Bigas,Seznamte se s budoucí vévodkyní ze Sussexu. Tento titul pravděpodobně připadne herečce Meghan Merkleové po svatbě s britským princem Harrym. Věděli...,lidovky.cz,video
https://www.lidovky.cz/kozel-z-vanocnich-trhu-zabehl-az-do-luxusni-parizske-ulice-pal-/video.aspx?c=A171127_224755_ln-video_ELE,Kozel z vánočních trhů zaběhl až do luxusní Pařížské ulice,V pátek utekl z ohrady na vánočních trzích na Staroměstském náměstí kozel. Pobíhal Pařížskou ulicí s luxusními obchody a pokračoval až do ulice...,lidovky.cz,video
https://www.lidovky.cz/video-erupce-sopky-na-bali-chrlila-dym-az-do-vysky-1500-metru-pnj-/video.aspx?c=A171126_223125_ln-video_ELE,Erupce sopky na Bali. Chrlila dým až do výšky 1500 metrů,"Po sobotní erupci sopky Agung na indonéském ostrově Bali úřady vyhlásily pro letecké společnosti nejvyšší, červený stupeň varování. Sloupec dýmu nad...",lidovky.cz,video
https://www.lidovky.cz/novinar.aspx?idnov=3961,Jiří Bigas,Slzy zklamání i štěstí Jany Novotné. Připomeňte si její wimbledonský příběh. Triumfu v All-England Clubu předcházela dvě prohraná finále v singlu. Až...,lidovky.cz,video
https://www.lidovky.cz/novinar.aspx?idnov=3961,Jiří Bigas,Připomeňte si jeden z největších hitů Karla Štědrého. Duet s Waldemarem Matuškou nazvaný Mám malý stan zpíval celý život. Přichystali jsme pro vás...,lidovky.cz,video
https://www.lidovky.cz/novinar.aspx?idnov=3961,Jiří Bigas,Burger King si utahuje z McDonaldu a využívá k tomu aktuální popularity hororu To. Při příležitosti Halloweenu bude ve vybraných amerických...,lidovky.cz,video
https://www.lidovky.cz/novinar.aspx?idnov=3961,Jiří Bigas,"Piloti z 22. základny vrtulníkového letectva u Náměšti nad Oslavou se 17. října zúčastnili cvičení, při kterém nechyběly ani kamery. Podívat se tak...",lidovky.cz,video
https://www.lidovky.cz/novinar.aspx?idnov=3961,Jiří Bigas,Britský dobrodruh se inspiroval animovaným filmem Vzhůru do oblak od Pixaru z roku 2009 a s pomocí stovky heliem naplněných balónků podnikl...,lidovky.cz,video
https://www.lidovky.cz/novinar.aspx?idnov=3961,Jiří Bigas,"Fotbalové utkání mezi thajskými týmy Bangkok Sports Club a Satri Angthong by zřejmě nebylo pro většinu sportovních fanoušků ničím zajímavé, pokud by...",lidovky.cz,video
https://www.lidovky.cz/video-posledni-sobhem-umirajici-simpanzice-objimala-sveho-davneho-pritele-1ug-/video.aspx?c=A171020_143621_ln-video_mha,VIDEO: Poslední sbohem. Umírající šimpanzice objímala svého dávného přítele,"Bylo jí 59 let. Šimpanzice Mama měla týden před smrtí, když ji navštívil profesor Jan van Hooff z univerzity v Utrechtu. Znali se od roku 1972. Mama...",lidovky.cz,video
https://www.lidovky.cz/novinar.aspx?idnov=3961,Jiří Bigas,"Abyste se mohli začíst do speciální edice románu 451 stupňů Fahrenheita, musíte nejprve “spálit” jeho stránky. Sci-fi klasika Raye Bradburyho z roku...",lidovky.cz,video
https://www.lidovky.cz/video-chovatele-po-celem-svete-vydesil-preslechteny-kun-vypada-jako-z-animaku-1xu-/video.aspx?c=A171019_133840_ln-video_mha,VIDEO: Chovatele po celém světě vyděsil přešlechtěný kůň. Vypadá jako z animáku,Americká šlechtitelská farma Orrion se dlouhodobě zaměřuje na chov koní. Nově vyšlechtené hříbě El Rey Magnum však vyvolalo značnou nevoli mezi...,lidovky.cz,video
https://www.lidovky.cz/motorkar-branil-sanitce-v-projeti-dr3-/video.aspx?c=A171019_111134_ln-video_ele,VIDEO: Motocyklista nenechal projet sanitku. Případ projednají správní orgány,"Devětapadesátiletý řidič motocyklu v obci Knapovec neumožnil sanitce jedoucí s výstražným a zvukovým zařízením, aby projela a dostala se k pacientovi...",lidovky.cz,video
https://www.lidovky.cz/novinar.aspx?idnov=3961,Jiří Bigas,"O kultovní logické hře Tetris se často říká, že si ji lze zahrát v podstatě na každém myslitelném počítačovém systému. Důkazem této okřídlené fráze...",lidovky.cz,video
https://www.lidovky.cz/novinar.aspx?idnov=3961,Jiří Bigas,"Jde o promyšlený, ale děsivý trik, za nějž si provozovatel vysloužil značnou kritiku. Ale současně obdiv. Skleněná lávka umístěná vysoko v čínských...",lidovky.cz,video
https://www.lidovky.cz/byl-obeti-xenofobie-dnes-je-vudcem-ultrapravice-pise-bloomberg-o-okamurovi-1us-/video.aspx?c=A171014_082544_ln-video_ele,"Byl obětí xenofobie, dnes je vůdcem ultrapravice, píše Bloomberg o Okamurovi","Americká společnost Bloomberg se v jednom z novějších příspěvků věnuje politikovi Tomiu Okamurovi. Přestože jeho původ je „tak multikulturní, jak jen...",lidovky.cz,video
https://www.lidovky.cz/novinar.aspx?idnov=3961,Jiří Bigas,Každý týden vychází na serveru Lidovky.cz seriál ASI.JATKA. Vždy ve středu se můžete začíst do nového příspěvku od blogerky Do Thu Trang. Co když ale...,lidovky.cz,video
https://www.lidovky.cz/novinar.aspx?idnov=3961,Jiří Bigas,Fenka bernardýna z Jižní Dakoty se zapsala do Guinnessovy knihy rekordů. Pyšní se aktuálně nejdelším psím jazykem na světě. Mochi má jazyk dlouhý...,lidovky.cz,video
https://www.lidovky.cz/novinar.aspx?idnov=3961,Jiří Bigas,V těsné blízkosti nového mostu i husté zástavby demoliční experti s chirurgickou přesností poslali k zemi dosluhující Kosciuszko Bridge v New Yorku...,lidovky.cz,video
https://www.lidovky.cz/novinar.aspx?idnov=3961,Jiří Bigas,Na pláži u španělské obce Calella se objevila ohromná mořská želva. Zvíře bohužel uhynulo a s jeho odstraněním musela pomoci těžká technika. Kožatka...,lidovky.cz,video
https://www.lidovky.cz/video-britsky-princ-harry-byl-okraden-v-primem-prenosu-o-popcorn-phq-/video.aspx?c=A170929_143321_ln-zajimavosti_ele,VIDEO: Princ Harry byl ‚okraden‘ v přímém přenosu. O popcorn,"Malá holčička „kradla“ princi Harrymu popcorn během Invictus Games, her v paralympijském stylu, které vytvořil on sám pro veterány a vojáky. Princ s...",lidovky.cz,video
https://www.lidovky.cz/zeman.aspx,"Zeman vede permanentní kampaň. Server Lidovky.cz zmapoval všechna místa, kam se vypravil","Z nejvyššího úřadu v zemi má prezident Miloš Zeman k lidem nejblíž ze všech ústavních činitelů. Stvořil si vlastní styl komunikace, vede permanentní...",lidovky.cz,specialy
https://www.lidovky.cz/novinar.aspx?idnov=3851,Martin Hampejs,"13 krajů, 75 okresů a 302 měst a vesnic navštívil prezident Miloš Zeman během svého volebního období. Novináři serveru Lidovky.cz detailně...",lidovky.cz,specialy
https://www.lidovky.cz/novinar.aspx?idnov=3851,Martin Hampejs,"Jsou celkem čtyři. Český Krumlov, Mělník, Mladá Boleslav a Nový Jičín. To jsou okresní města, ve kterých se prezident Miloš Zeman ke 30. červnu 2017...",lidovky.cz,specialy
https://www.lidovky.cz/novinar.aspx?idnov=3851,Martin Hampejs,"Bojí se Miloš Zeman Pražanů? Praha je totiž jediný krajský celek, který prezident během svého volebního období nenavštívil. Mezitím stihl objet...",lidovky.cz,specialy
https://www.lidovky.cz/novinar.aspx?idnov=3890,Jan Horák,"Ve vztahu prezidenta Miloše Zemana s občany se kombinují tři veličiny. V první řadě je to osobnostní ustrojení prezidenta, jež z něj činí...",lidovky.cz,specialy
https://www.lidovky.cz/novinar.aspx?idnov=3851,Martin Hampejs,Každý výlet něco stojí. Prezidentovy cesty do regionů hradí již od doby prezidenta Havla krajské úřady a dodnes se na tom i přes protesty hejtmanů...,lidovky.cz,specialy
https://www.lidovky.cz/novinar.aspx?idnov=3926,Luděk Vokáč,"Po stopách vozu, který změnil dějiny českého autoprůmyslu. 1700 kilometrů, 7 dnů, 24 hodin za volantem Škody Favorit.",lidovky.cz,specialy
https://www.lidovky.cz/novinar.aspx?idnov=3833,Marcel Šulek,Přesně před 75 lety obklíčili němečtí vojáci pravoslavných chrám v Resslově ulici v Praze. Uvnitř svatostánku se skrývala sedmička československých...,lidovky.cz,specialy
https://www.lidovky.cz/novinar.aspx?idnov=3556,Ondřej Vyhnanovský,"Reportér LN si jako pracovník u pásu vyzkoušel na vlastní kůži, jak se pracuje v dobrovízském velkoskladu Amazonu.",lidovky.cz,specialy
https://www.lidovky.cz/novinar.aspx?idnov=3833,Marcel Šulek,"Uživatelé Facebooku žijí v zajetí svých sociálních bublin. Sdílí články ze stále stejných zdrojů, a to hlavně takových, které potvrzují jejich vidění...",lidovky.cz,specialy
https://www.lidovky.cz/novinar.aspx?idnov=3833,Marcel Šulek,"Češi žijí v sociálních bublinách, v nichž se navíc navzájem utvrzují o správnosti vidění svého světa. Ukázal to unikátní projekt serveru Lidovky.cz....",lidovky.cz,specialy
https://www.lidovky.cz/novinar.aspx?idnov=2593,Jakub Zelenka,"„V sociálních bublinách jsme žili už dříve, ale moc jsme o tom nevěděli,“ tvrdí odborník na analýzu dat Josef Šlerka. Unikátní výsledky projektu...",lidovky.cz,specialy
https://www.lidovky.cz/novinar.aspx?idnov=3833,Marcel Šulek,"Češi žijí v sociálních bublinách, v nichž se navíc navzájem utvrzují o správnosti vidění svého světa. Ukázal to unikátní projekt serveru Lidovky.cz....",lidovky.cz,specialy
https://www.lidovky.cz/novinar.aspx?idnov=2593,Jakub Zelenka,"Novináři serveru Lidovky.cz prošli 2606 tweetů Jiřího Ovčáčka, které publikoval na účtu @PREZIDENTmluvci do 31. října 2016. Vybrali všechny...",lidovky.cz,specialy
//www.lidovky.cz/havel80.aspx,80 vzpomínek na Václava Havla,"České i zahraniční osobnosti vzpomínají, co pro ně Václav Havel znamenal.",lidovky.cz,specialy
//www.lidovky.cz/pieta-za-padle-vojaky.aspx,Pieta za padlé vojáky,"Vzpomínková stránka na české vojáky, 
kteří zemřeli při nasazení na zahraničních misích",lidovky.cz,specialy
https://kultura.zpravy.idnes.cz/jiri-strach-o-formanovi-milos-forman-dvu-/filmvideo.aspx?c=A180416_141549_filmvideo_ts,"Formana už pochovali. Všichni jsme jeho děti, míní režisér Jiří Strach","Poslední rozloučení s režisérem Milošem Formanem se konalo v neděli na místním hřbitově v americkém městě Warren, kde žil. Obřad se podle vdovy Martiny Formanové konal „přesně podle Milošova přání v...",idnes.cz,title
https://zpravy.idnes.cz/jednani-ano-cssd-druhy-pokus-dge-/domaci.aspx?c=A180416_164337_domaci_kop,"ANO jde za ČSSD, té nebude stačit pro oba přijatelný nestraník na vnitru","Sociální demokracii nebude stačit, když za ní šéf ANO Andrej Babiš přijde při druhém pokusu o...",idnes.cz,title
https://ekonomika.idnes.cz/dovolena-all-inclusive-recko-din-/ekonomika.aspx?c=A180416_111857_ekonomika_div,Češi si stále více dopřávají all inclusive i sedmihvězdičkové hotely,Čeští turisté si rok od roku dopřávají lepší a kvalitnější dovolenou. Nebojí se investovat do...,idnes.cz,title
https://sport.idnes.cz/anders-besseberg-uplatky-rusko-d32-/biatlon.aspx?c=A180416_142417_biatlon_ten,Prostitutky a hony. Šéf světového biatlonu si užíval přízeň Ruska,Rusko prý předsedu Mezinárodní biatlonové federace Anderse Besseberga uplácelo za přehlížení...,idnes.cz,title
https://ekonomika.idnes.cz/kapitol-fincentrum-pokuta-cnb-investicni-zivotni-pojisteni-prh-/ekonomika.aspx?c=A180416_122242_ekonomika_nio,Finanční poradci dostali od ČNB opět přes prsty za nekalé obchodní praktiky,Centrální banka opět rozdává pokuty finančním poradcům. Společnost Kapitol patřící Kooperativě...,idnes.cz,title
https://praha.idnes.cz/silnicari-kamion-nehoda-rsd-dfs-/praha-zpravy.aspx?c=A180416_152601_praha-zpravy_rsr,"VIDEO: Řidič kamionu přehlédl ceduli, na dálnici vjel do auta silničářů","Silničáři při práci na dálnicích denně uhýbají před nepozornými řidiči, kteří si nevšímají...",idnes.cz,title
https://zpravy.idnes.cz/david-rath-odskodneni-soud-vlaceni-v-poutech-f3f-/krimi.aspx?c=A180416_121637_krimi_jkk,"Vedli mě jako kravku na pastvu, stěžoval si Rath na „vláčení“ v poutech","Škodolibost a hra na to nejhorší, co je v nás. Tak popsal bývalý politik David Rath svoje...",idnes.cz,title
https://zpravy.idnes.cz/nemecko-rujana-stribrny-poklad-dm7-/zahranicni.aspx?c=A180416_152524_zahranicni_aha,"Němci našli poklad z doby krále, který dal jméno technologii Bluetooth",Archeologové našli na německém ostrově Rujana v Baltském moři stovky více než 1000 let starých...,idnes.cz,title
https://mobil.idnes.cz/essential-phone-sleva-a-amazon-de6-/telefony.aspx?c=A180416_120054_telefony_oma,"Berte, dokud je. Mobil pro fajnšmekry po neúspěchu drasticky zlevnil","Keramické tělo, jeden z nejmodernějších procesorů, 128 GB vnitřní paměti a velký displej s...",idnes.cz,title
https://zlin.idnes.cz/pes-smrt-zlin-soused-senior-policie-db6-/zlin-zpravy.aspx?c=A180416_140725_zlin-zpravy_ras,"Muž ve Zlíně ubil sousedova jorkšíra smetákem. Pořád to hulákalo, říká","Čtyřicetiletý muž ve Zlíně ubil sousedovi psa smetákem. Policii se přiznal a řekl, že mu došla...",idnes.cz,title
https://revue.idnes.cz/satiricky-porad-socky-dominik-vrsansky-socialni-site-pfl-/lidicky.aspx?c=A180413_101356_lidicky_jan,SOCKY: Desátý díl slavíme krabičákem. Konkurence kontruje vtipy o rakovině,Fanoušci satirického pořadu Socky zaplnili u příležitosti jubilejního dílu Václavské...,idnes.cz,title
https://revue.idnes.cz/kaley-cuoco-exmanzel-ryan-sweeting-rozvod-manzelstvi-zmena-plt-/lidicky.aspx?c=A180412_134129_lidicky_zar,"Nebyl tím člověkem, kterého jsem potkala, říká o exmanželovi Cuoco","Americká herečka Kaley Cuoco (32), známá hlavně rolí Penny v seriálu Teorie velkého třesku, se rozpovídala o svém vztahu s bývalým...",idnes.cz,title
https://zpravy.idnes.cz/zima-usa-snehova-boure-blizard-dzp-/zahranicni.aspx?c=A180416_174728_zahranicni_aha,"VIDEO: Zima vyskočila z jarního hrobu, sever USA zasypala sněhová bouře",,idnes.cz,title
https://zpravy.idnes.cz/fialova-cssd-mistopredsedkyne-vlada-vnitro-bohuminske-usneseni-pxs-/domaci.aspx?c=A180416_143930_domaci_kop,"Vnitro je klíčové a KSČM není zakázaná, říká místopředsedkyně ČSSD Fialová",,idnes.cz,title
https://sport.idnes.cz/roman-kreuziger-amstel-gold-race-druhe-misto-klasiky-pcx-/cyklistika.aspx?c=A180416_123848_cyklistika_dm,"Skvělá Kreuzigerova forma v Ardenách. Teď můžu být klidný, řekl",,idnes.cz,title
https://hokej.idnes.cz/david-pastrnak-boston-3-3-0wc-/nhl.aspx?c=A180415_221641_nhl_ald,"Prostě Pasta! Kluk z Havířova v NHL kouzlí, když je ve svém živlu",,idnes.cz,title
https://hradec.idnes.cz/stavba-dalnice-d11-hradec-jaromer-trutnov-obchvat-pozemky-pey-/hradec-zpravy.aspx?c=A180416_395561_hradec-zpravy_pos,"Na obchvatu Jaroměře závisí D11, zatím však nemá povolení ani pozemky",,idnes.cz,title
https://vary.idnes.cz/zeleznicni-trat-sesuv-vlak-dalovice-hajek-zeleznice-doprava-vyluka-cheb-1o5-/vary-zpravy.aspx?c=A180416_134914_vary-zpravy_ba,Železničáři začali zpevňovat sesunutý svah pod tratí u Dalovic,,idnes.cz,title
https://ekonomika.idnes.cz/cesko-hypoteky-bydleni-ceska-narodni-banka-f2d-/ekonomika.aspx?c=A180416_144329_ekonomika_rts,"Hypotéky jsou v Česku stále v kurzu, jejich četnost navíc dále roste",,idnes.cz,title
https://ekonomika.idnes.cz/karlovarsky-festival-sponzori-kretinsky-mall-flg-/ekonomika.aspx?c=A180416_123304_ekonomika_jj,Karlovarský festival bude místo ČEZ sponzorovat Křetínský,,idnes.cz,title
https://kultura.zpravy.idnes.cz/milos-forman-danny-devito-vzpominky-slavnych-f40-/filmvideo.aspx?c=A180416_395507_filmvideo_spm,"Doutník, sklenku a třikrát ho...o, vyzval DeVito k vzpomínce na Formana",,idnes.cz,title
https://kultura.zpravy.idnes.cz/zebrik-kin-fakju-pane-uciteli-3-pepa-du0-/filmvideo.aspx?c=A180416_133725_filmvideo_spm,Německá komedie Fakjů pane učiteli 3 porazila českého Pepu na hlavu,,idnes.cz,title
https://ona.idnes.cz/rozstrel-rozhovor-s-psychiatrem-a-pacientkou-s-anorexii-pzj-/zdravi.aspx?c=A180412_114047_zdravi_pet,"Jak poznat poruchu příjmu potravy, řekne v Rozstřelu pacientka i odbornice",,idnes.cz,title
https://ona.idnes.cz/sociolozka-dana-hamplova-prace-pracujici-matka-materska-p2z-/spolecnost.aspx?c=A180322_162514_spolecnost_jup,"Pracující matky nemusí být vždy šťastnější, říká socioložka",,idnes.cz,title
https://bydleni.idnes.cz/palac-princu-knihovna-rekonstrukce-zachrana-zamek-karlovy-vary-p8g-/rekonstrukce.aspx?c=A180410_141810_rekonstrukce_web,Barokní Palác princů v Ostrově je po rekonstrukci jako z pohádky,,idnes.cz,title
https://bydleni.idnes.cz/drevostavba-radovka-stavebni-dozor-stavba-rodinneho-domu-dobry-remeslnik-1td-/dum_osobnosti.aspx?c=A180410_153841_dum_osobnosti_web,Jiří dozoroval stavbu řadovky sám. Bylo to jeho nejlepší rozhodnutí,,idnes.cz,title
https://finance.idnes.cz/kviz-test-hypoteky-0ol-/viteze.aspx?c=A180413_084033_viteze_frp,"Kvíz: Vyznáte se v hypotékách a v tom, co s nimi souvisí?",,idnes.cz,title
https://finance.idnes.cz/tajemstvi-slavnych-rodin-podnikani-raymannovi-textil-spodni-pradlo-1ih-/podnikani.aspx?c=A180413_101608_podnikani_kho,"Raymannové byli perníkáři, kteří ovládli textilní průmysl v celé Evropě",,idnes.cz,title
