link,link_text,txt,site,area
https://www.lidovky.cz/smichov-bez-masa-02n-/dobra-chut.aspx?c=A171205_151340_dobra-chut_ape,Oběd kancelářských krys: Smíchov bez masa. Kde si pochutnáte?,"Chcete se naobědvat za dvě stravenky, ale nevíte, která restaurace či bistro stojí ve vaší čtvrti za návštěvu? Nezoufejte. Server Lidovky.cz přináší...",lidovky.cz,chut
https://www.lidovky.cz/sada-cesta-kakaoveho-bobu-do-cokolady-dsm-/dobra-chut.aspx?c=A171205_140952_dobra-chut_ape,ŠÁDA: Cesta kakaového bobu do čokolády,"Věděli jste, že ne jen Švýcarsko, ale i Československo bývalo čokoládová velmoc? Na začátku 20. století a mezi válkami se k nám dovážely kakaové boby...",lidovky.cz,chut
https://www.lidovky.cz/sefkuchar-zdenek-krizek-odchazi-z-restaurace-spices-fyy-/dobra-chut.aspx?c=A171204_093230_dobra-chut_ape,"Šéfkuchař Zdeněk Křížek odchází z Mandarinu, šéfovat bude síti hotelových restaurací","Po jedenácti letech odchází z restaurace Spices, která se specializuje na asijskou kuchyni v malostranském hotelu Mandarin Oriental, šéfkuchař Zdeněk...",lidovky.cz,chut
https://www.lidovky.cz/mrkvova-s-avokadem-ci-lucina-s-kruti-sunkou-jak-na-zdravou-svacinu-100-/dobra-chut.aspx?c=A171127_144412_dobra-chut_ape,Mrkvová s avokádem či lučina s krůtí šunkou. Jak na zdravou svačinu?,"Úderem září začal většině rodičů klasický ranní kolotoč: vzbudit děti, vytáhnout je z postele, donutit je k ranní hygieně, během snídaně je znovu...",lidovky.cz,chut
https://www.lidovky.cz/baci-di-dama-damske-pusinky-italske-vanocni-orechove-cukrovi-pro-/dobra-chut.aspx?c=A171201_092941_dobra-chut_ape,Baci di dama - dámské pusinky. Italské vánoční ořechové cukroví,"Když jsem poprvé viděla v Anglii před Vánocemi obrovskou sklenici plnou slepovaného ořechového cukroví, neodolala jsem a koupila ji jako neobvyklý...",lidovky.cz,chut
https://www.lidovky.cz/plzensti-japonci-opustili-smichov-duf-/pivo.aspx?c=A171221_212642_ln_domov_ele,‚Plzeňští‘ Japonci opustili Smíchov. Staropramen bude místo piva Asahi vařit americký Miller,Pivovary Staropramen ukončily licenční výrobu prémiové značky japonského koncernu Asahi. Nahradilo ji americké pivo Miller. Smíchovský pivovar...,lidovky.cz,chut
https://www.lidovky.cz/5-nej-bramborovych-salatu-podle-nasich-nejlepsich-sefkucharu-prw-/dobra-chut.aspx?c=A101206_143000_dobra-chut_glu,5 nejlepších bramborových salátů podle našich nejlepších šéfkuchařů,Štědrovečerní večeře se neobejde bez dobrého bramborového salátu. Každá rodina má svůj osvědčený recept. My vám přinášíme pět variací salátů podle...,lidovky.cz,chut
https://www.lidovky.cz/novinar.aspx?idnov=2431,Alena Pecháčková,"Velké sklenice plné čočky, fazolí, mouky, ale i ořechů. Nově také drogistický sortiment. V Praze funguje od října již druhý „bezobalový“ obchod....",lidovky.cz,chut
https://www.lidovky.cz/soutez-jak-na-bylinky-vyhrajte-kucharku-bylinky-na-mem-stole-p5s-/dobra-chut.aspx?c=A171128_153359_dobra-chut_ape,SOUTĚŽ: Jak na bylinky? Vyhrajte kuchařku Bylinky na mém stole,"Kniha Bylinky na mém stole obsahuje 140 úžasných receptů, více jak 200 barevných fotografií. Seznámí vás s bylinkami, jak je používat při vaření a...",lidovky.cz,chut
https://www.lidovky.cz/vinohradske-burgerarny-0sr-/dobra-chut.aspx?c=A171129_082007_dobra-chut_ape,Oběd kancelářských krys: Kde si dát na Vinohradech nejlepší burgery?,"Chcete se naobědvat za dvě stravenky, ale nevíte, která restaurace či bistro stojí ve vaší čtvrti za návštěvu? Nezoufejte. Server Lidovky.cz přináší...",lidovky.cz,chut
https://www.lidovky.cz/sada-prichazi-doba-kastanova-co-z-nich-muzete-pripravit-piq-/dobra-chut.aspx?c=A171128_134406_dobra-chut_ape,ŠÁDA: Přichází doba kaštanová. Co z nich můžete připravit?,"Švýcaři, Italové či Francouzi je dobře znají, říkají jim marroni nebo marrons a v kuchyni je bohatě využívají, zejména během podzimu a zimy. Také u...",lidovky.cz,chut
https://www.lidovky.cz/videorecept-pripravte-si-indonesky-bakmi-goreng-f6i-/dobra-chut.aspx?c=A171127_155157_dobra-chut_ape,VIDEORECEPT: Připravte si indonéský bakmi goreng,"V posledním dílu kulinářského seriálu serveru Lidovky.cz připravuje Zdeněk Křížek, šéfkuchař restaurace Spices, která se specializuje na asijskou...",lidovky.cz,chut
https://www.lidovky.cz/vanocni-cukrovi-se-letos-prevleka-do-zelene-se-smesi-z-caje-matcha-p9p-/dobra-chut.aspx?c=A171123_164026_dobra-chut_ape,Vánoční cukroví se letos převléká do zelené. Se směsí z čaje matcha,"Kdo by si před nedávnem pomyslel, že cukroví může mít i odlišné barevné tóny a také úplně jiné chuťové dimenze než tradiční kousky, které běžně na...",lidovky.cz,chut
https://www.lidovky.cz/novinar.aspx?idnov=2431,Alena Pecháčková,"Vaření je jeho velkou vášní, má rád klasickou, poctivou kuchyni a v současné době vaří v restauraci Ateliér Kalina. „Přál bych si, aby veřejnost...",lidovky.cz,chut
https://www.lidovky.cz/bylinky-nad-zlato-moderni-kuchyne-se-bez-nich-neobejde-rika-hertova-1f3-/dobra-chut.aspx?c=A171123_085931_dobra-chut_ape,"Bylinky nad zlato. Moderní kuchyně se bez nich neobejde, říká Heřtová","Polévka z řeckého jogurtu, hummus s ředkvičkami, ale i vietnamský salát ze zelené papáji. Recepty ze všech koutů světa, ale i českou klasiku ovoněnou...",lidovky.cz,chut
https://www.lidovky.cz/novinar.aspx?idnov=817,Zbyněk Petráček,Polsko platí daň za svou solitérnost v rámci EU. Každé fungující společenství má svou „zbraň posledního soudu“. NATO ji ukrývá v článku 5...,lidovky.cz,nazory
https://www.lidovky.cz/novinar.aspx?idnov=817,Zbyněk Petráček,"Patříte-li k fajnšmekrům zkoumajícím neudálosti, jednu přineslo úterý. Poslanec Zdeněk Ondráček (KSČM) byl zvolen šéfem komise pro kontrolu Generální...",lidovky.cz,nazory
https://www.lidovky.cz/surmanova-zamestnanec-je-min-podle-soudcu-jsou-svobodni-jen-podnikatele-14e-/nazory.aspx?c=A171219_211624_ln_nazory_ele,SURMANOVÁ: Zaměstnanec je míň. Podle soudců jsou svobodní jen podnikatelé,"Pět ústavních soudců se minulý týden při posuzování EET zastalo podnikatelů – nemají lehký život, nepotřebují další překážky. Jistě by se ale tyto...",lidovky.cz,nazory
https://www.lidovky.cz/novinar.aspx?idnov=669,Martin Zvěřina,"Hnutí ANO nemá lidi, a tak recykluje staré kádry. Jak jinak vysvětlit angažmá Cyrila Svobody u premiéra a ­Jeronýma Tejce u ministra spravedlnosti...",lidovky.cz,nazory
https://www.lidovky.cz/novinar.aspx?idnov=3535,Jan Klesla,"Některá rána si člověk zapamatuje na celý život. Večer jde spát s myšlenkou, že se nic špatného nemůže stát, a ­než se ráno stihne nasnídat a oholit,...",lidovky.cz,nazory
https://www.lidovky.cz/novinar.aspx?idnov=817,Zbyněk Petráček,"Kdo si říkal, že na summitu EU bude téma migrace, azylu a stálých distribučních kvót prioritou jen pro „východniary“, mýlil se. I západní média...",lidovky.cz,nazory
https://www.lidovky.cz/novinar.aspx?idnov=817,Zbyněk Petráček,"Civilizace se vyvíjí. Je to znát i na vztahu k dětem. Když přišla první průmyslová revoluce, začal bujet problém dětské práce v prvních továrnách....",lidovky.cz,nazory
https://www.lidovky.cz/novinar.aspx?idnov=817,Zbyněk Petráček,"Když jsem jel kdysi do Francie, autobus zastavili celníci. Když viděli v batohu dva kartony cigaret, byli na koni – to množství překračuje předpisy....",lidovky.cz,nazory
https://www.lidovky.cz/novinar.aspx?idnov=2328,Martin C. Putna,"Stalo se před pár dny v Ostravě, že jakýsi muž napadl v tramvaji skupinu studentů za to, že mluvili anglicky. Tloukl je a křičel, že toto město je...",lidovky.cz,nazory
https://www.lidovky.cz/v-zaveru-roku-se-utkaji-zenati-se-svobodnymi-f3h-/nazory.aspx?c=A171210_211341_ln_nazory_jhe,V závěru roku se utkají ženatí se svobodnými,"Advent a doba vánoční patří mezi nejkrásnější období každého roku. Zvláště pak pro děti. V naší obci k tomuto období patří hned několik akcí a nevím,...",lidovky.cz,nazory
https://www.lidovky.cz/nachod-starostove-vanoce-0h5-/nazory.aspx?c=A171210_210424_ln_nazory_jhe,Zvonkohra změnila noty a hraje koledy,"Konec roku se nám pomalu blíží a spolu s ním přišly také nejoblíbenější svátky v roce, Vánoce. Je to jen pár dní, co jsme u nás v Náchodě rozsvítili...",lidovky.cz,nazory
https://www.lidovky.cz/novinar.aspx?idnov=3709,Jaroslav Šindelář,"Zatímco volba šéfa českého fotbalu skončila na řádné valné hromadě v červnu patem, úterní mimořádný sjezd v Nymburce zažil absolutní vítězství Romana...",lidovky.cz,nazory
https://www.lidovky.cz/okrisky-starostove-vanoce-dd0-/nazory.aspx?c=A171210_205500_ln_nazory_jhe,Spokojení občané jsou dárkem pro každého starostu,"Adventní čas by se měl nést v duchu klidu a pohody, jenže dnešní doba je jiná. Ve firmách i na úřadech je s blížícím se koncem roku největší...",lidovky.cz,nazory
https://www.lidovky.cz/starostove-praha-1-vanoce-0hq-/nazory.aspx?c=A171210_204014_ln_nazory_jhe,O svařené víno nepřijdete,"Kdybych chtěl být trochu sarkastický, řekl bych, že Vánoce v Praze 1 se dělí na ty magistrátní a naše, ryze lokální, pro obyvatele naší městské...",lidovky.cz,nazory
https://www.lidovky.cz/vyzdobu-vyrobily-nase-deti-dfj-/nazory.aspx?c=A171210_203358_ln_nazory_jhe,Výzdobu vyrobily naše děti,"Adventní čas jsme zahájili rozsvícením vánočního stromu na náměstí a podáváním svařáku a čaje, včetně malého občerstvení.",lidovky.cz,nazory
https://www.lidovky.cz/telnice-starostove-vanoce-dch-/nazory.aspx?c=A171210_202421_ln_nazory_jhe,Chceme naplnit smysl narození Nemluvněte,Adventní dobu zahajujeme v naší obci nejdříve mší svatou o první adventní neděli ve farním kostele. Odpoledne se pak sejdou školáci a rodiče na...,lidovky.cz,nazory
https://www.lidovky.cz/starostove-vanoce-borsov-0yx-/nazory.aspx?c=A171210_201029_ln_nazory_jhe,"Ať máme víc snů, než kolik jich dokáže zničit realita","V naší obci děláme vcelku běžné věci – rozsvícený stromeček, adventní punčování na návsi s živou hudbou, koncert v kostele, setkání s penzisty,...",lidovky.cz,nazory
https://www.lidovky.cz/novinar.aspx?idnov=817,Zbyněk Petráček,"Vladimiru Putinovi nelze upřít, že má smysl pro stylizaci a režii událostí. Poznal to už filmař Oliver Stone. To on režíroval dokument o Putinovi,...",lidovky.cz,nazory
https://www.lidovky.cz/novinar.aspx?idnov=817,Zbyněk Petráček,"Kdo chce vědět, jak důležitá je i v míru aliance NATO, měl teď příležitost. Recep Tayyip Erdogan navštívil Řecko jako první turecký prezident od roku...",lidovky.cz,nazory
https://www.lidovky.cz/novinar.aspx?idnov=669,Martin Zvěřina,"Senioři jsou stále rostoucím a významnějším segmentem zákazníků. Není proto divu, že se pro ně nabízejí nové služby. Mění se též rodiny, děti zhusta...",lidovky.cz,nazory
https://www.lidovky.cz/novinar.aspx?idnov=669,Martin Zvěřina,"Nikdo za nic nemůže. Osm mrtvých, desítky zraněných a doživotně poznamenaných železniční nehodou ve Studénce v srpnu 2008, ti všichni si za svůj osud...",lidovky.cz,nazory
https://www.lidovky.cz/novinar.aspx?idnov=817,Zbyněk Petráček,"Rusko bylo vyloučeno ze zimních her v Pchjongčchangu. Moc na tom nemění fakt, že ti ruští olympionici, kteří nedopovali, na hry jet smí. Ano, ale ne...",lidovky.cz,nazory
https://www.lidovky.cz/novinar.aspx?idnov=3906,Kateřina Kolářová,Policii věří nejvíce lidí od vzniku samostatné České republiky. Podle agentury STEM je to poprvé po roce 1993 rekordních 65 procent Čechů. Neznamená...,lidovky.cz,nazory
https://www.lidovky.cz/novinar.aspx?idnov=3535,Jan Klesla,"Nejslavnější hacker historie Kevin Mitnick měl jednoduchý recept, jak se nabourat i do toho nejzabezpečenějšího systému. Namísto prolamování...",lidovky.cz,nazory
https://www.lidovky.cz/novinar.aspx?idnov=1768,Petr Kamberský,"Agentura Kantar TNS přišla s prvním povolebním průzkumem, který v číslech popisuje to, co si laický pozorovatel může zkusit uhádnout sám: Andrej...",lidovky.cz,nazory
https://www.lidovky.cz/novinar.aspx?idnov=3021,Jan Schneider,"Kandidát na funkci prezidenta republiky, profesor Jiří Drahoš, projevil veřejně obavu o demokratičnost nadcházejících prezidentských voleb, neboť se...",lidovky.cz,nazory
https://www.lidovky.cz/novinar.aspx?idnov=817,Zbyněk Petráček,"Před 50 lety, 3. prosince 1967, provedl chirurg Christiaan Barnard v Kapském Městě první transplantaci srdce. Zdařila se, ač pacient po třech týdnech...",lidovky.cz,nazory
https://www.lidovky.cz/novinar.aspx?idnov=669,Martin Zvěřina,"Stěrače stírají, ostřikovače stříkají. Průpovídkou z filmu Vrchní, prchni!, která zesměšňuje pečlivého motoristu, jenž zapomněl na zdravý rozum, nám...",lidovky.cz,nazory
https://www.lidovky.cz/novinar.aspx?idnov=669,Martin Zvěřina,"Do Poslanecké sněmovny by mělo v nejbližších dnech dorazit komando sestávající z psychologů, sociálních pracovníků a speciálních pedagogů. Jejich...",lidovky.cz,nazory
https://www.lidovky.cz/novinar.aspx?idnov=3438,Jan Macháček,"1. Na prvním místě v řadě dobrých zpráv stojí Francie. Hrozilo, že by se francouzskou prezidentkou mohla stát představitelka pravicového extremismu,...",lidovky.cz,nazory
https://www.lidovky.cz/novinar.aspx?idnov=3438,Jan Macháček,Evropská komise se ve středu poprvé po šedesáti letech své existence rozhodla obžalovat členský stát z porušování demokratických hodnot a vlády...,lidovky.cz,nazory
https://www.lidovky.cz/novinar.aspx?idnov=3438,Jan Macháček,"V anglosaském tisku, resp. v jeho podstatné části, bývá německý názor na ekonomii či hospodářskou politiku často vysmíván. Němci se dívají na dluh...",lidovky.cz,nazory
https://www.lidovky.cz/novinar.aspx?idnov=3438,Jan Macháček,"V nálezu Ústavního soudu ČR ke kauze EET najdeme v závěru i disentní stanovisko pěti soudců Šimíčka, Jirsy, Lichovníka, Šimáčkové a Uhlíře.",lidovky.cz,nazory
https://www.lidovky.cz/novinar.aspx?idnov=3438,Jan Macháček,Minulý rok podle komentátora Financial Times Wolfganga Münchaua definovaly velké politické šoky v podobě referenda o brexitu či zvolení Donalda...,lidovky.cz,nazory
https://www.lidovky.cz/novinar.aspx?idnov=3438,Jan Macháček,"Polsko má nového premiéra Mateusze Morawieckého, který je v českém tisku prezentován jako bývalý bankéř a technokrat. Každopádně už je několik let...",lidovky.cz,nazory
https://www.lidovky.cz/novinar.aspx?idnov=3438,Jan Macháček,"Myšlenka předsedy německé sociální demokracie Martina Schulze, že mají do roku 2025 vzniknout Spojené státy evropské a že komu se to nelíbí a...",lidovky.cz,nazory
https://www.lidovky.cz/rozhovor-o-sexu-a-vire-s-dlouholetou-hlavou-katolicke-cirkve-v-cechach-miloslavem-vlkem-guj-/lide.aspx?c=A171112_124515_lide_ele,"Sex a víra? Do člověka je možné vstoupit i jinak, říkal kardinál Vlk v 90. letech",U příležitosti dvacetiletého výročí magazínu Pátek Lidových novin výjimečně odemykáme rozhovory s významnými českými osobnostmi. Co všechno zmůže náš...,lidovky.cz,lide
https://www.lidovky.cz/proc-by-me-melo-zmenit-ze-me-videl-milion-lidi-na-platne-pta-se-anna-ctvrtnickova-g0z-/lide.aspx?c=A171221_210658_ln_noviny_ele,"Proč by mě mělo změnit, že mě viděl milion lidí na plátně, ptá se Anna Čtvrtníčková","Tahle deváťačka z Prahy bude patřit k hlavním hvězdám letošních českých televizních Vánoc. Pohádku Anděl Páně 2, kde hraje jednou z hlavních postav,...",lidovky.cz,lide
https://www.lidovky.cz/kostymu-je-dulezity-pomaha-vzit-se-do-role-rika-herec-igor-orozovic-1p7-/lide.aspx?c=A171214_123253_lide_ape,"Kostým je důležitý, pomáhá vžít se do role, říká herec Igor Orozovič","Hraje Švandu dudáka, podivínského Soleného ve Třech sestrách, entomologa i milence Boženy Němcové. Má rád činohru i muzikál.”Jsem kostýmní herec,...",lidovky.cz,lide
https://www.lidovky.cz/novinar.aspx?idnov=4057,Pavel Pechoušek,Major Ivo Zelinka z 43. praporu chrudimských výsadkářů patří i v 36 letech mezi naše nejzkušenější a nejnadanější mladé důstojníky. Absolvoval pět...,lidovky.cz,lide
https://pr.lidovky.cz/vykonny-kancelarsky-pomocnik-ktery-vyhral-dtest-f7o-/komercni-sdeleni.aspx?c=A171218_131606_komercni-sdeleni_jedli,"Výkonný kancelářský pomocník, který vyhrál dTest","Zorientovat se v množství kancelářských zařízení, která spolehlivě zvládnou barevný tisk, kopírování a skenování, je náročné. Běžný uživatel či podnikatel...  
					celý článek",lidovky.cz,lide
https://www.lidovky.cz/heryan-konecne-patek-na-patek-jsem-se-tesil-jako-mlady-dneska-vyhrava-nedele-16x-/lide.aspx?c=A171221_202158_lide_ele,"HERYÁN: Konečně pátek? Těšil jsem se na něj jako mladý, dneska vyhrává neděle","Konečně pátek? Ten pocit zpravidla u mě nenastává. Od pondělka do pátku se živím jako učitel a přitom ve „volném čase“ dělám kněze, kdy za mnou chodí...",lidovky.cz,lide
https://www.lidovky.cz/kdybych-se-tak-umel-polepsit-rika-nekdejsi-premier-a-prezident-v-rozhovoru-o-zenach-a-moudrosti-i2g-/lide.aspx?c=A171112_101044_lide_ele,"Ženy už si své vybojovaly, mladí muži by měli být hájený druh, tvrdil Václav Klaus",U příležitosti dvacetiletého výročí magazínu Pátek Lidových novin výjimečně odemykáme rozhovory s významnými českými osobnostmi. V roce 2000 byl...,lidovky.cz,lide
https://www.lidovky.cz/ve-veku-92-let-zemrel-propagator-zdrave-vyzivy-rajko-dolecek-pl0-/lide.aspx?c=A171220_220224_lide_ele,Ve věku 92 let zemřel propagátor zdravé výživy Rajko Doleček,Ve věku 92 let ve středu zemřel propagátor zdravé výživy Rajko Doleček. Oznámil to Dolečkův syn Branko. Doleček zemřel po krátké vážné nemoci ve...,lidovky.cz,lide
https://www.lidovky.cz/aljochinovou-z-pussy-riot-v-moskve-zadrzela-policie-pcd-/zpravy-svet.aspx?c=A171220_154101_lide_ele,"Všechno nejlepší k narozeninám popravčí, zněl transparent v Moskvě zatčené Aljochinové z Pussy Riot",V Moskvě ve středu před budovou ruské tajné služby (FSB) zadrželi členku punkové kapely Pussy Riot Mariju Aljochinovou. Aktivistka za lidská práva se...,lidovky.cz,lide
https://www.lidovky.cz/zemrel-byvaly-fotbalovy-reprezentant-jiri-sloup-f7o-/lide.aspx?c=A171220_140353_lide_ele,Zemřel bývalý fotbalový reprezentant Jiří Sloup,"Bývalý fotbalový reprezentant Jiří Sloup ve věku 64 let podlehl rakovině. O úmrtí bývalého hráče Plzně a Bohemians Praha, s nimiž v roce 1983 slavil...",lidovky.cz,lide
https://www.lidovky.cz/asi-jatka-prijit-o-jmeni-nebo-o-cloveka-dxv-/lide.aspx?c=A171219_101621_lide_ape,"ASI.JATKA: Přijít o jmění, nebo o člověka?","„Já Vám to ale hlídat určitě nebudu”, pronesla rázně starší paní s ondulovanými vlasy za pultem. Jako by tu těžkou nákupní tašku se dvěma čouhujícími...",lidovky.cz,lide
https://www.lidovky.cz/novinar.aspx?idnov=705,Alena Plavcová,U příležitosti dvacetiletého výročí magazínu Pátek Lidových novin výjimečně odemykáme rozhovory s významnými českými osobnostmi. V dubnu 2004 to byl...,lidovky.cz,lide
https://www.lidovky.cz/brett-nase-slovenska-strela-eda-i-d4y-/lide.aspx?c=A171218_111142_lide_ape,BRETT: Jak jsme si pořídili psa aneb Naše Slovenská strela Eda I.,"Eda. První. Eda První. Číslovka nepoukazuje na šlechtický původ našeho nového přírůstku, ale na první díl povídání o něm. Nevím, kdy navážu druhým,...",lidovky.cz,lide
https://www.lidovky.cz/novinar.aspx?idnov=705,Alena Plavcová,U příležitosti dvacetiletého výročí magazínu Pátek Lidových novin výjimečně odemykáme rozhovory s významnými českými osobnostmi. Se Zdeňkem Svěrákem...,lidovky.cz,lide
https://www.lidovky.cz/britska-princezna-charlotte-zacne-v-lednu-chodit-do-skolky-pa8-/lide.aspx?c=A171218_145549_lide_ele,Britská princezna Charlotte začne v lednu chodit do školky,Britská princezna Charlotte začne v lednu navštěvovat mateřskou školu. Princ William a jeho žena Kate pro svou dvouletou dceru vybrali Willcocks...,lidovky.cz,lide
https://www.lidovky.cz/novinar.aspx?idnov=3849,Marie Frajtová,"U příležitosti dvacetiletého výročí magazínu Pátek Lidových novin výjimečně odemykáme rozhovory s významnými českými osobnostmi. Herečka, jež byla...",lidovky.cz,lide
https://www.lidovky.cz/novinar.aspx?idnov=3562,Tomáš Tománek,"Na první dojem je rázný, často a rád se směje. Nadrotmistr David Masopust hledal cestu do armády dvakrát. Po účasti na misi UNPROFOR, mírové operaci...",lidovky.cz,lide
https://www.lidovky.cz/zemrel-odbojar-frantisek-zahradka-za-totality-prevedl-11-lidi-za-hranice-1nc-/lide.aspx?c=A171217_132714_lide_ele,Zemřel odbojář František Zahrádka. Za totality převedl 11 lidí za hranice,Zemřel člen protikomunistického odboje František Zahrádka. Bylo mu 87 let. Za totality převedl 11 lidí přes hranice. Byl nositelem státního Řádu...,lidovky.cz,lide
https://www.lidovky.cz/slavny-sefkuchar-ktery-cechum-ukazal-ze-i-obycejne-jidlo-se-da-udelat-dobre-to-malem-ucil-v-cizin-ij8-/lide.aspx?c=A171111_151716_lide_ele,"Nesouhlasím se šíleným kultem dítěte, mně nikdo nic nedal, říkal Pohlreich",U příležitosti dvacetiletého výročí magazínu Pátek Lidových novin výjimečně odemykáme rozhovory s významnými českými osobnostmi. Letos v dubnu...,lidovky.cz,lide
https://www.lidovky.cz/novinar.aspx?idnov=493,Jana Machalická,U příležitosti dvacetiletého výročí magazínu Pátek Lidových novin výjimečně odemykáme rozhovory s významnými českými osobnostmi. Bojím se o tento...,lidovky.cz,lide
https://www.lidovky.cz/kralovska-svatba-ma-termin-princ-harry-a-herecka-markleova-se-budou-brat-19-kvetna-gfh-/lide.aspx?c=A171215_142712_lide_ele,Královská svatba má termín. Princ Harry a herečka Markleová se budou brát 19. května,"Britský princ Harry a americká herečka Meghan Markleová se vezmou 19. května, oznámil v pátek Kensingtonský palác. O zasnoubení vnuka královny...",lidovky.cz,lide
https://www.lidovky.cz/valek-konecne-patek-prepinam-z-rezimu-dirigent-do-rezimu-farmar-amater-1mc-/lide.aspx?c=A171214_194956_lide_ele,VÁLEK: Konečně pátek? Přepínám z režimu dirigent do režimu farmář amatér,"Bach s Mozartem mi jistě prominou. Händel, Cavalieri, Richter, Czech Ensemble Baroque a týdenní mozaika starostí, jak budeme hrát a zpívat, o čem,...",lidovky.cz,lide
https://www.lidovky.cz/kazdy-mic-pro-me-predstavoval-zazrak-lici-petra-kvitova-po-navratu-na-kurt-1tx-/lide.aspx?c=A171214_193618_ln_noviny_ele,"Jaký byl návrat na kurt po přepadení? Každý míč pro mě představoval zázrak, líčí Kvitová","Před rokem to vypadalo, že si už možná nezahraje. Po loňském prosincovém incidentu s lupičem, který ji přepadl na tom nejzranitelnějším místě, v...",lidovky.cz,lide
https://www.lidovky.cz/havel-mel-ve-vezeni-pohodli-dnes-vladnou-byvali-komuniste-tvrdil-pred-lety-masin-gph-/lide.aspx?c=A171111_133009_lide_ele,"Havel měl ve vězení pohodlí, dnes vládnou bývalí komunisté, tvrdil před lety Josef Mašín",U příležitosti dvacetiletého výročí magazínu Pátek Lidových novin výjimečně odemykáme rozhovory s významnými českými osobnostmi. V padesátých letech...,lidovky.cz,lide
https://www.lidovky.cz/novinar.aspx?idnov=2898,Ondřej Koutník,U příležitosti dvacetiletého výročí magazínu Pátek Lidových novin výjimečně odemykáme rozhovory s významnými českými osobnostmi. Nejslavnější český...,lidovky.cz,lide
https://www.lidovky.cz/novinar.aspx?idnov=3560,Tomáš Málek,"Když mluví o tom, jaké to je jezdit v tanku na místě velitele, nadšení nemůže předstírat. V Ondřeji Váchovi je pořád velký kus tankisty.",lidovky.cz,lide
https://www.lidovky.cz/novinar.aspx?idnov=705,Alena Plavcová,U příležitosti dvacetiletého výročí magazínu Pátek Lidových novin výjimečně odemykáme rozhovory s významnými českými osobnostmi. Věra Chytilová...,lidovky.cz,lide
https://www.lidovky.cz/muj-maly-multikulti-sok-0wz-/lide.aspx?c=A171211_164731_lide_ape,ASI.JATKA: Můj malý multikulti šok,"Pan Vesmír ví, že jsem už pěkně dlouho nenapsala nějaký absurdní článek, proto mi servíruje příběhy psané samotným životem přímo pod nos, na čínském...",lidovky.cz,lide
https://www.lidovky.cz/novinar.aspx?idnov=3899,Jaroslav Totušek,"V říjnu americký časopis The New Yorker publikoval investigativní zprávu o případech sexuálního obtěžování, jehož se měl dopouštět vlivný...",lidovky.cz,lide
https://www.lidovky.cz/dianiska-harry-jdu-do-baraku-d1f-/lide.aspx?c=A171211_135830_lide_ape,DIANIŠKA: Harry jdu do baráku!,"Ó můj bože. Nemám doma internet. Znáte to? Horší je snad už jen... ne nic není horší. Nemám rádio, televizi ani noviny. Cedéčka jsem vyhodil, přijdou...",lidovky.cz,lide
https://www.lidovky.cz/americane-jsou-detinsti-ale-smat-bychom-se-jim-nemeli-rikal-havel-v-roce-2006-1r0-/lide.aspx?c=A171111_110241_lide_ele,"Američané jsou dětinští, ale smát bychom se jim neměli, říkal Havel v roce 2006",U příležitosti dvacetiletého výročí magazínu Pátek Lidových novin výjimečně odemykáme rozhovory s významnými českými osobnostmi. 22. prosince 2006...,lidovky.cz,lide
