link,link_text,txt,site,area
https://www.lidovky.cz/recenze-krimithriller-wind-river-je-napinava-kovbojka-bez-kompromisu-1ez-/kultura.aspx?c=A171002_103345_ln_kultura_jto,RECENZE: Krimithriller Wind River je napínavá kovbojka bez kompromisů,"Do českých kin vstoupil film Wind River, vítěz divácké ceny z karlovarského festivalu. Atmosférický krimithriller sleduje několik cílů zároveň. Ne...",lidovky.cz,kultura
http://www.lidovky.cz/novinar.aspx?idnov=3899,Jaroslav Totušek,Pokračování kultovního filmu Blade Runner (1982) se odehrává rovných třicet let po konci prvního dílu. Harrison Ford se tentokrát replikantům postaví...,lidovky.cz,kultura
http://www.lidovky.cz/novinar.aspx?idnov=3899,Jaroslav Totušek,"Na veřejnost unikla informace o tom, že studio Disney před časem požádalo o povolení natáčet v parku Great Winsdor nedaleko Londýna. Ten vlastní...",lidovky.cz,kultura
http://www.lidovky.cz/novinar.aspx?idnov=3784,Ondřej Bezr,"O takzvaném úředním šimlovi, který důležitě poskakoval po vlastech českých už za starého Rakouska a dodnes nevymřel, si nedělám iluze. Ani o jeho...",lidovky.cz,kultura
https://www.lidovky.cz/chci-prekladat-pro-ctenare-jichz-si-vazim-rika-slovinska-prekladatelka-a-bohemistka-gzi-/kultura.aspx?c=A170929_104121_ln_kultura_jto,"Chci překládat pro čtenáře, jichž si vážím, říká slovinská překladatelka a bohemistka","Slovinská překladatelka a bohemistka Tatjana Jamniková (* 1976) přeložila z češtiny například knihy Alexandry Berkové, Radky Denemarkové, Jakuby...",lidovky.cz,kultura
https://www.lidovky.cz/recenze-tori-amos-na-novem-albu-radi-jak-se-postavit-katastrofam-p8k-/kultura.aspx?c=A170929_105435_ln_kultura_jto,"RECENZE: Tori Amos na novém albu radí, jak se postavit katastrofám","Americká písničkářka Tori Amos natočila sugestivní album Native Invader o kořistnické povaze člověka, přírodě, o pohromách globálních i přísně...",lidovky.cz,kultura
https://www.lidovky.cz/recenze-kafe-cigarko-na-streamu-trikrat-louhovany-turek-a-vajglik-v-popelniku-1hd-/kultura.aspx?c=A170929_123419_ln_kultura_jto,RECENZE: Kafe & Cigárko na Streamu? Třikrát louhovaný turek a vajglík v popelníku,"Marie Doležalová je dnes všude, kam se podíváš. Chápu, že potřeba vytěžit z aktuální popularity co nejvíc, je nezbytností herecké profese, ale čeho...",lidovky.cz,kultura
https://www.lidovky.cz/obdobi-improvizace-skoncilo-ceska-filharmonie-ohlasila-zmeny-p6g-/kultura.aspx?c=A170929_110201_ln_kultura_jto,Období improvizace skončilo. Česká filharmonie ohlásila změny,"Po smrti svého šéfdirigenta byla Česká filharmonie nucena improvizovat v angažmá dirigentů pro koncerty, jež měl vést Jiří Bělohlávek; jméno nového...",lidovky.cz,kultura
http://www.lidovky.cz/novinar.aspx?idnov=3899,Jaroslav Totušek,"Nejtemnější hodina (Darkest Hour), nový film režiséra Joea Wrighta (Pokání, Anna Karenina), se dočkal nového traileru i filmového plakátu. V dramatu...",lidovky.cz,kultura
https://cestovani.lidovky.cz/objevte-to-nejlepsi-z-keni-safari-horsky-treking-i-starodavna-mesta-s-jedinecnym-geniem-loci-g96-/aktuality.aspx?c=A171003_120830_aktuality_ape,"Objevte to nejlepší z Keni: safari, horský treking i města s jedinečným geniem loci","Pokud byste se rádi vydali do oblasti „černé“ Afriky, je Keňa ideální zemí. Zapůsobí na vás především díky své rozmanitosti. Kromě několika safari...",lidovky.cz,cestovani
http://www.lidovky.cz/novinar.aspx?idnov=698,Martin Prachař,"Poslední zářijový víkend jsme vyrazili na dvoudenní putování Českým Švýcarskem. První den patří soutěskám a ikonické Pravčické bráně, druhý zase...",lidovky.cz,cestovani
https://cestovani.lidovky.cz/zoologicka-zahrada-ci-skanzen-na-vlacky-do-usti-nad-labem-pk4-/aktuality.aspx?c=A171003_161255_aktuality_ape,Zoologická zahrada či skanzen. Na vláčky do Ústí nad Labem,"Možná se vám nezdá, že by právě Ústí nad Labem a jeho okolí byly rájem milovníků železnic a vláčků všech velikostí. Už na první zastávce, na zámku v...",lidovky.cz,cestovani
https://cestovani.lidovky.cz/jak-se-uklizi-haitane-odpadky-patri-za-zed-fgk-/aktuality.aspx?c=A171003_130438_aktuality_ape,HEJTY Z HAITI: Jak uklízí Haiťané? Odpadky patří za zeď,"Již dříve jsem si všiml, že Haiťané rádi vyhazují všechno možné všude možně. Populární je zejména vyhazování předmětů z jedoucího autobusu či...",lidovky.cz,cestovani
https://cestovani.lidovky.cz/mexicka-snidane-vypada-jako-nase-vecere-rika-cech-fuh-/aktuality.aspx?c=A171002_112541_aktuality_ape,"Tortilly i nudle s masem. Mexická snídaně vypadá jako naše večeře, říká Čech",Albert Štěrba se do hlavního města Mexika přestěhoval kvůli stáži v rámci výměnného programu mezinárodní organizace IFMSA. „Mexičané jsou daleko více...,lidovky.cz,cestovani
https://cestovani.lidovky.cz/nomadi-5-holek-v-tuktuku-skrz-jizni-ameriku-f29-/aktuality.aspx?c=A170926_123635_aktuality_ape,NOMÁDI: ‚Nejhorší nápad na světě!‘ 5 holek v tuktuku na cestě skrz Jižní Ameriku,"Možná jste s ním už jednou v životě jeli. Malý, smradlavý, nesmírně hlučný a nepohodlný. Ideální jako taxík, ale pro delší trasy naprosto nevhodný. V...",lidovky.cz,cestovani
https://cestovani.lidovky.cz/z-ceska-do-raje-aneb-jak-se-vyhodne-dostat-na-maledivy-f99-/aktuality.aspx?c=A170926_121840_aktuality_ape,Z Česka do ráje aneb jak se výhodně dostat na Maledivy?,"Plánujete exotickou dovolenou? Potom vzhůru na Maledivy! A to doslova, jinak než letecky se tam samozřejmě nedostanete!",lidovky.cz,cestovani
https://cestovani.lidovky.cz/sanghaj-sibir-i-mexiko-na-vylet-za-par-desitek-minut-a-bez-pasu-p6d-/aktuality.aspx?c=A170927_101932_aktuality_ape,"Šanghaj, Sibiř i Mexiko. Na výlet za pár desítek minut a bez pasu","Ameriku a Mexiko obejdete za pouhých pár desítek minut. Na výlet do Londýna, Nového Yorku, Paříže nebo do Bosny budete potřebovat pár hodin. Na Sibiř...",lidovky.cz,cestovani
https://cestovani.lidovky.cz/tyrolsky-seefeld-udolim-na-kole-po-hrebenech-pesky-fwv-/aktuality.aspx?c=A170926_115535_aktuality_ape,"Tyrolský Seefeld? Údolím na kole, po hřebenech pěšky",Tyrolský Seefeld hostil v letech 1964 a 1976 soutěže zimních Olympiád v severských disciplínách a i díky tomu patří toto místo v zimě k významným...,lidovky.cz,cestovani
https://cestovani.lidovky.cz/kastanovy-kyjev-vyrazte-do-ukrajinske-metropole-na-kostely-majdan-ci-povalovani-u-dnepru-gwf-/aktuality.aspx?c=A170917_222809_aktuality_ELE,"Kaštanový Kyjev. Vyrazte do ukrajinské metropole na kostely, Majdan či povalování u Dněpru","Do Kyjeva je údajně nejlepší vyrazit na jaře, kdy kvetou kaštany, které jsou v „matce ruských měst” rozesety v každém koutu. Příjemnou návštěvu ale...",lidovky.cz,cestovani
https://cestovani.lidovky.cz/v-cesku-se-prodavaji-drahe-a-nekvalitni-syry-rika-svycarka-pne-/aktuality.aspx?c=A170925_123030_aktuality_ape,"V Česku se prodávají drahé a ne tak kvalitní sýry, říká Švýcarka","Stéphanie N’Duhirahe se přestěhovala do Česka, aby se zde mohla věnovat tomu, co miluje nejvíce. Akrobacii.",lidovky.cz,cestovani
https://cestovani.lidovky.cz/nomadi-iran-ma-spatnou-povest-nezaslouzene-svou-vyjimecnosti-nam-vyrazil-dech-gc8-/aktuality.aspx?c=A170920_154456_aktuality_ape,NOMÁDI: Írán má špatnou pověst nezaslouženě. Svou výjimečností nám vyrazil dech,"S jídlem roste chuť. Tak by se dal popsat cestovatelský příběh dvojice, která si říká Po vlastní ose. Začínali s vozem, kterému pravověrní...",lidovky.cz,cestovani
https://cestovani.lidovky.cz/zakavkazska-odysea-trekovani-v-gruzii-armenii-a-azerbajdzanu-pu6-/aktuality.aspx?c=A170905_143045_aktuality_ape,"Zakavkazská odysea: Trekování v Gruzii, Arménii a Azerbajdžánu","Hory Gruzie, Arménie a Ázerbájdžánu lákají dobrodruhy a milovníky divočiny od nepaměti. Region Zakavkazska ukrývá zelené travnaté svahy v podhůří,...",lidovky.cz,cestovani
https://cestovani.lidovky.cz/zlate-ceske-rucicky-prijdte-se-podivat-na-obytna-auta-postavena-doma-v-garazi-1wl-/aktuality.aspx?c=A170921_105950_aktuality_ape,Zlaté české ručičky. Přijďte se podívat na obytná auta postavená doma v garáži,"Cestování obytným autem je pro mnoho lidí záležitostí životního stylu. V sobotu se jeho vyznavači sjedou do kempu Stříbrný rybník v Hradci Králové,...",lidovky.cz,cestovani
https://cestovani.lidovky.cz/vysneny-svet-s-lovci-zazitku-velke-cestovatelske-promitani-s-ck-sen-1io-/aktuality.aspx?c=A170921_161231_aktuality_ELE,Vysněný svět s lovci zážitků: v kině Atlas bude velké cestovatelské promítání,"Thajsko, Malajsie, Čína a Tibet, perly Indočíny, příroda USA či Jihoafrická republika – to vše lze procestovat za jediný večer během promítání a...",lidovky.cz,cestovani
https://cestovani.lidovky.cz/severoitalske-mestecko-arabba-uzijte-si-dolomity-na-kolech-p4d-/aktuality.aspx?c=A170920_114327_aktuality_ape,Severoitalské městečko Arabba. Užijte si Dolomity na kolech,Arabbu znáte možná spíše ze zimy jako součást věhlasného lyžařského komplexu Dolomiti Superski. Nicméně ani v létě není toto severoitalské městečko...,lidovky.cz,cestovani
http://www.lidovky.cz/novinar.aspx?idnov=3616,Šarlota Šudrychová,"„Pivo, pirožky, maliny,” rozhléhalo se po téměř celém nástupišti na jedné ze zastávek mezi Kyjevem a doněckou Mariupolí. Bábušky i poněkud mladší...",lidovky.cz,cestovani
https://cestovani.lidovky.cz/navstivte-jablecnou-slavnost-v-hostetine-okouzlila-i-prince-charlese-1ew-/aktuality.aspx?c=A170918_115108_aktuality_ele,Navštivte Jablečnou slavnost v Hostětíně. Okouzlila i prince Charlese,"Hostětín je maličká vesnice pod hřebenem Bílých Karpat, kterou proslavily ekologické projekty, dřevěné sochy, návštěva britského prince Charlese a...",lidovky.cz,cestovani
https://cestovani.lidovky.cz/nomadi-na-15-let-stare-motorce-kolem-sveta-par-ujel-70-tisic-kilometru-1pc-/aktuality.aspx?c=A170831_103301_aktuality_ape,NOMÁDI: Na 15 let staré motorce kolem světa. Český pár ujel 70 tisíc kilometrů,Za cestovatelským duem WayAway se skrývají jména František Nykl a Kateřina Kadlusová. Již šestnáctým měsícem tenhle pár objíždí svět na 15 let staré...,lidovky.cz,cestovani
https://cestovani.lidovky.cz/objevte-slovinsko-5-tajnych-tipu-na-krasna-mista-bez-turistu-pr7-/aktuality.aspx?c=A170915_173641_aktuality_ele,Objevte Slovinsko: 5 tajných tipů na krásná místa bez turistů,"Slovinsko je v létě českými turisty stále častěji navštěvovanou zemí, a to zejména díky panenské přírodě. My si slovinské hory zkusili na kole a...",lidovky.cz,cestovani
https://cestovani.lidovky.cz/v-mnichove-zacne-v-sobotu-oktoberfest-pivo-opet-zdrazi-pgh-/aktuality.aspx?c=A170915_104050_aktuality_ele,"V Mnichově začne tradiční Oktoberfest. Pivo opět zdraží, až na 286 korun","S vyššími cenami piva i dalším zpřísněním bezpečnostních opatření musejí počítat návštěvníci letošního Oktoberfestu, který v Mnichově začne v sobotu....",lidovky.cz,cestovani
https://cestovani.lidovky.cz/nejkratsi-lanovka-v-cr-v-prazske-zoo-byla-otevrena-pred-40-lety-p60-/aktuality.aspx?c=A170913_092054_aktuality_ele,V pražské ZOO je nejkratší lanovka v Česku. Poprvé vyjela před 40 lety,"Nejkratší lanová dráha v ČR, kterou se první cestující svezli 14. září 1977, se nachází v Zoologické zahradě v Praze. Postavit ji nebylo snadné, ale...",lidovky.cz,cestovani
https://cestovani.lidovky.cz/krnap-prestavi-krkonosske-muzeum-ve-vrchlabi-chysta-novou-interaktivni-expozici-g20-/aktuality.aspx?c=A170912_142411_aktuality_ele,KRNAP přestaví Krkonošské muzeum ve Vrchlabí. Chystá novou interaktivní expozici,Správa Krkonošského národního parku (KRNAP) nákladem přibližně 140 milionů korun opraví a přebuduje Krkonošské muzeum v bývalém augustiniánském...,lidovky.cz,cestovani
https://cestovani.lidovky.cz/stredocesky-kraj-chce-pristi-rok-zavest-turistickou-kartu-pox-/aktuality.aspx?c=A170912_150004_aktuality_ele,Středočeský kraj chce příští rok zavést turistickou kartu,"Středočeský kraj chce příští rok zavést turistickou kartu, která by zvýhodňovala návštěvníky památek a muzeí na území regionu. Věrnostní program by...",lidovky.cz,cestovani
https://cestovani.lidovky.cz/jeskyne-v-pohori-svabska-alba-po-stopach-lviho-muze-fxl-/aktuality.aspx?c=A170911_121954_aktuality_ele,Švábská Alba. Jeskyně z doby ledové a návštěva u Lvího muže,"Pohoří Švábská Alba se nachází na jihu Německa, ve spolkové zemi Bádensko-Würtembersko. V jeho údolích leží jeskyně staré 40 tisíc let, kde byly...",lidovky.cz,cestovani
https://cestovani.lidovky.cz/nomadi-veteranem-do-sveta-aneb-cesta-do-mongolska-a-dal-pfh-/aktuality.aspx?c=A170907_104724_aktuality_ape,NOMÁDI: Veteránem do světa aneb Cesta do Mongolska a dál,Začátek léta pro nás znamená začátek něčeho zcela nového. Opouštíme svá zaměstnání a vrháme se vstříc našemu projektu Veteránem do světa.,lidovky.cz,cestovani
https://cestovani.lidovky.cz/v-petrohradu-vodi-pruvodci-turisty-na-strechy-palacu-pds-/aktuality.aspx?c=A170910_213034_aktuality_ELE,V Petrohradu vodí průvodci turisty na střechy paláců,"Sochy na průčelí Ermitáže téměř ožívají v záři zapadajícího slunce nad Petrohradem. „Chtěli jsme vidět něco mimořádného a podařilo se to,“ raduje se...",lidovky.cz,cestovani
https://cestovani.lidovky.cz/vino-a-adrenalin-v-podzemi-zajedte-si-na-vylet-do-znojma-pil-/aktuality.aspx?c=A170829_150245_aktuality_ape,Víno a adrenalin v podzemí. Zajeďte si na výlet do Znojma,"Text písničky Ivana Mládka Znojmo, vidím tě dvojmo je sice trochu laciný, ale u téhle jihomoravské vinařské lahůdky se prostě nabízí sám. Navíc se...",lidovky.cz,cestovani
https://cestovani.lidovky.cz/val-di-fiemm-pesky-i-na-kole-za-vyhledem-a-pak-po-hlave-do-reky-plq-/aktuality.aspx?c=A170905_103857_aktuality_ape,Val di Fiemme. Pěšky i na kole za výhledem a pak po hlavě do řeky,"V zimě se Fiemme honosí kilometry širokých sjezdovek, v létě zas kilometry cyklotras a turistických pěšinek. Tentokrát jsme se tu vydali za horským...",lidovky.cz,cestovani
https://cestovani.lidovky.cz/v-korunach-stromu-ci-na-plazi-jak-si-v-lete-uzit-lipno-p03-/aktuality.aspx?c=A170822_123846_aktuality_ape,V korunách stromů či na pláži. Jak si v létě užít Lipno,"Ať už cestujete s dětmi, rybářským prutem, pohorkami, s kolem nebo bruslemi, na Lipně vám bude fajn – tedy nepatříte-li k zarputilým běžkařům a...",lidovky.cz,cestovani
https://cestovani.lidovky.cz/netridit-ve-svycarsku-odpad-to-se-chape-jako-poruseni-pravidel-rika-ceska-1lj-/aktuality.aspx?c=A170905_101012_aktuality_ape,"Netřídit ve Švýcarsku odpad? Porušení pravidel, musíte používat i speciální pytle, říká Češka","Denisa Juna žila nejdříve v Londýně, potom se s manželem přestěhovali do Švýcarska, kde tráví více času v přírodě. „Švýcarsko absolutně změnilo můj...",lidovky.cz,cestovani
https://cestovani.lidovky.cz/sedmdesatilety-polsky-kajakar-potreti-sam-preplul-atlantik-prf-/aktuality.aspx?c=A170904_222924_aktuality_ELE,Sedmdesátiletý kajakář přeplul potřetí Atlantik. Překonal vzdálenost 6680 kilometrů,"Sedmdesátiletý polský kajakář potřetí sám přeplul Atlantik. Vzdálenost 6680 kilometrů z USA na francouzské pobřeží překonal za 111 dní, v neděli se...",lidovky.cz,cestovani
https://cestovani.lidovky.cz/nomadi-cesta-favoritem-do-norska-fjordy-vyhlidky-i-troli-stezka-p8f-/aktuality.aspx?c=A170731_150719_aktuality_ape,NOMÁDI: Cesta Favoritem do Norska? Jen s kartonem a Chemoprénem na opravy,"V roce 1990 můj otec koupil novou Škodu Favorit 135L, na kterou byly pořadníky, po nějaké době ji měl můj děda a ten s ní jezdil mezi garáží a...",lidovky.cz,cestovani
https://cestovani.lidovky.cz/7-narodnich-parku-asie-ktere-stoji-za-navstevu-foh-/aktuality.aspx?c=A170828_114553_aktuality_ape,"7 národních parků Asie, které stojí za návštěvu","Tipy jsme sestavili ve spolupráci s průvodci CK Alvarez, kteří procestovali a prozkoumali snad každý zajímavý kout světa.",lidovky.cz,cestovani
https://cestovani.lidovky.cz/italsti-mladici-si-ulevovali-do-more-dostali-pokutu-86-tisic-korun-p9b-/aktuality.aspx?c=A170901_075930_aktuality_ELE,Italští mladíci si ulevovali do moře. Dostali pokutu 86 tisíc korun,"Dva mladí Italové dostali pokutu 3300 eur (86 tisíc korun) za to, že si v malebném městečku Monterosso na pobřeží severoitalské Ligurie ulevovali do...",lidovky.cz,cestovani
https://cestovani.lidovky.cz/st-anton-na-kole-pesky-i-na-e-motorkach-dxi-/aktuality.aspx?c=A170830_123453_aktuality_ape,"Rakouský St. Anton si užijete na kole, pěšky i na e-motorkách",Největší lyžařská aréna Rakouska St. Anton nabízí bohatý program i v létě a její široké možnosti jsou zcela úměrné její neskromné velikosti....,lidovky.cz,cestovani
https://relax.lidovky.cz/ceska-posta-vyda-znamku-k-jubileu-cimrmanologu-fl7-/zajimavosti.aspx?c=A171003_145205_ln-zajimavosti_ape,Česká pošta vydá známku k jubileu cimrmanologů,"„Česká pošta oslovila otce a syna Jaroslava a Michala Weigelovy, aby vytvořili ještě jednu cimrmanovskou známku, nyní k padesátiletému jubileu...",lidovky.cz,relax
https://relax.lidovky.cz/clovek-nebyl-stvoren-k-dlouhemu-sezeni-rika-odbornik-p03-/zdravi.aspx?c=A170927_154944_ln-zdravi_ape,"Člověk nebyl stvořen k dlouhému sezení, říká odborník","Průběh přetěžování těla bývá zrádný, po dlouhou dobu se nemusí projevit podstatné příznaky. A pak jsou lidé najednou zaskočeni, říká Michal Kusyn,...",lidovky.cz,relax
https://relax.lidovky.cz/zeptali-jsme-se-vedcu-z-jakych-zdroju-se-v-polarnich-oblastech-ziskava-vitamin-c-gd3-/veda.aspx?c=A171002_132007_ln_veda_ape,Zeptali jsme se vědců: Z jakých zdrojů se v polárních oblastech získává vitamin C?,Severské oblasti poskytují pouze limitované množství rostlinné potravy. Přesto u obyvatel subarktických a arktických oblastí nepozorujeme zvýšený...,lidovky.cz,relax
https://relax.lidovky.cz/v-bavorsku-utekli-z-obory-vlci-oblast-u-ceskych-hranic-prohledavaji-desitky-lidi-gp3-/zajimavosti.aspx?c=A171006_174740_ln-zajimavosti_ele,V Bavorsku utekli z obory vlci. Oblast u českých hranic prohledávají desítky lidí,"Z obory v Bavorském lese nedaleko českých hranic uteklo ve čtvrtek večer šest vlků, po nichž se nyní intenzivně pátrá. Jedno zvíře přejel a usmrtil...",lidovky.cz,relax
https://relax.lidovky.cz/vytrvalost-prijata-od-rodicu-d2d-/veda.aspx?c=A170927_155329_ln_veda_ape,Vytrvalost přijatá od rodičů. Ochotu poprat se s problémy se učí už roční děti,"Nová psychologická studie dokazuje, že ochotu poprat se s problémy a vynaložit při jejich řešení zvýšené úsilí se učí už roční děti pozorováním svého...",lidovky.cz,relax
https://relax.lidovky.cz/parizsti-postaci-pestuji-ovoce-a-zeleninu-chovaji-kurata-pml-/zajimavosti.aspx?c=A171004_123331_ln-zajimavosti_ape,"Pařížští pošťáci pěstují ovoce a zeleninu, chovají kuřata","Poštovní úředníci v Paříži pěstují na střeše budovy úřadu v severní části města ovoce a zeleninu, včetně salátu, lilků a rajčat, a chovají zde také...",lidovky.cz,relax
https://relax.lidovky.cz/houpacky-i-tunely-v-liberci-se-uskutecni-mistrovstvi-sveta-v-agility-1k3-/domaci-mazlicci.aspx?c=A171004_141819_domaci-mazlicci_ape,Houpačky i tunely. V Liberci se uskuteční mistrovství světa v agility,"V Liberci se příští týden uskuteční mistrovství světa v agility (FCI Agility World Championship). Jde o atraktivní sport, při němž psi pod vedením...",lidovky.cz,relax
https://relax.lidovky.cz/dejte-si-odpoledne-dvacet-je-to-zdrave-d85-/zdravi.aspx?c=A171005_121415_ln-zdravi_ape,Churchill zalezl odpoledne do postele. Vědci zkoumali přínos šlofíka na octomilkách,"Oddával se mu Winston Churchill, v Japonsku pro něj mají zvláštní slovo a španělská odpolední siesta je zdrojem závisti po celém světě. Co však...",lidovky.cz,relax
https://relax.lidovky.cz/tropicka-vedra-zasahnou-australii-uz-v-roce-2040-bude-az-50-stupnu-uvadi-studie-17k-/zajimavosti.aspx?c=A171005_082734_ln-zajimavosti_ele,"Padesát stupňů ve stínu? Rekordní vedra zasáhnou Austrálii už v roce 2040, varuje studie","Největší australská města Sydney a Melbourne mohou už v létě 2040 zažít rekordní teploty, které budou dosahovat více než 50 stupňů Celsia. Vyplývá to...",lidovky.cz,relax
https://relax.lidovky.cz/to-by-se-deti-nemely-dozvedet-archeologove-pry-nasli-ostatky-svateho-mikulase-1yf-/zajimavosti.aspx?c=A171005_080846_ln-zajimavosti_ele,To by se děti neměly dozvědět: archeologové prý našli ostatky svatého Mikuláše,"Tuto zprávu by se děti asi neměly dozvědět: turečtí archeologové se domnívají, že našli hrob svatého Mikuláše, který legendární štědrostí posloužil i...",lidovky.cz,relax
https://relax.lidovky.cz/za-legendami-o-upirech-stoji-mozna-nemoc-krve-fnl-/veda.aspx?c=A171003_144648_ln_veda_ape,Za legendami o upírech stojí možná nemoc krve,"Potřebuje ke svému životu lidskou krev, vychází pouze v noci a střeží se světla: to jsou některé znaky vampýra čili upíra. Podle vědců však tyto...",lidovky.cz,relax
https://relax.lidovky.cz/flaska-jako-statusovy-symbol-jak-se-stal-z-vody-modni-doplnek-puc-/cekstajl.aspx?c=A170926_144434_ln-cekstajl_ape,"Lahev na vodu dělá člověka. Stal se z ní módní doplněk, ale musí mít styl",Voda je základem vlhkosti a vlhkost základem krásy. V reklamě s tímto sloganem vystupoval hlavní aktér trochu (možná víc než trochu) hloupoučkého...,lidovky.cz,relax
https://relax.lidovky.cz/kubanci-i-turiste-si-znovu-oblibili-jizdni-kola-f52-/zajimavosti.aspx?c=A171004_103537_ln-zajimavosti_ape,Kubánci i turisté si znovu oblíbili jízdní kola,"Jízdní kolo, symbol krizových let, se na Kubě znovu vrací do módy. Oblíbili si ho turisté, ale i pro Kubánce je vzhledem k problémům ve veřejné...",lidovky.cz,relax
https://relax.lidovky.cz/na-madagaskaru-kvuli-plicnimu-moru-zakazali-velke-seslosti-p49-/zdravi.aspx?c=A171004_103330_ln-zdravi_ape,Na Madagaskaru kvůli plicnímu moru zakázali velké sešlosti,"Madagaskar se snaží zabránit šíření plicního moru, který si za poslední dva měsíce na tomto ostrově vyžádal více než dvacet obětí na životech....",lidovky.cz,relax
https://relax.lidovky.cz/uvedli-biochemii-do-nove-ery-nobelovu-cenu-za-chemii-ziskala-trojice-vedcu-155-/veda.aspx?c=A171004_115850_ln_veda_ele,Nobelovku za chemii získali tři vědci za vývoj kryoelektronové mikroskopie,"Letošní Nobelovu cenu za chemii získali Švýcar Jacques Dubochet, Američan narozený v Německu Joachim Frank a Brit Richard Henderson za vývoj...",lidovky.cz,relax
https://relax.lidovky.cz/cilena-biologicka-lecba-zbavi-kuzi-lupenky-fjv-/zdravi.aspx?c=A171004_102723_ln-zdravi_ape,Cílená biologická léčba zbaví kůži lupénky,"Za jednatřicet let soužití s lupénkou poznal desítky nemocničních pokojů, intimní karamboly, neatraktivní zaměstnání a nakonec zhroucení. Ačkoli...",lidovky.cz,relax
https://relax.lidovky.cz/nejstastnejsi-manzelstvi-maji-bohati-muzi-s-extremnimi-politickymi-nazory-1vk-/vztahy.aspx?c=A171004_115736_moje-penize_kopp,Nejšťastnější manželství mají bohatí muži s extrémními politickými názory,"Kvalita amerických manželství v posledních desetiletích klesá. Zatímco v sedmdesátých letech své manželství považovalo za šťastné 68 procent lidí,...",lidovky.cz,relax
https://relax.lidovky.cz/nehledte-jen-na-monitor-oci-si-musi-behem-dne-zacvicit-pd0-/zdravi.aspx?c=A170927_154232_ln-zdravi_ape,"Nehleďte jen na monitor, během práce si zacvičte","U počítače jsou oči nejzranitelnější. Proto lékaři radí, abychom to se sezením u monitoru nepřeháněli. Dlouhodobý strnulý pohled na stejnou...",lidovky.cz,relax
https://relax.lidovky.cz/diky-ocenenym-vedcum-je-chronobiologie-uznavany-obor-rika-neurolozka-1em-/veda.aspx?c=A171003_103238_ln_veda_ape,"Díky oceněným vědcům je chronobiologie uznávaný obor, říká neuroložka","Díky poznatkům tří amerických vědců, kterým byla udělena Nobelova cena za lékařství a fyziologii, je podle české odbornice Aleny Sumové z...",lidovky.cz,relax
http://www.lidovky.cz/novinar.aspx?idnov=3564,Vladan Šír,"Říká se mu krém na opalování, ale jeho úlohou není učinit pleť o pár tónů tmavší, nýbrž zabránit jejímu spálení. Už ve starověku lidé věděli, že...",lidovky.cz,relax
https://relax.lidovky.cz/prvni-pomoc-pri-zraneni-zvirete-co-delat-s-poranenou-packou-pqt-/domaci-mazlicci.aspx?c=A170926_124525_domaci-mazlicci_ape,První pomoc při zranění zvířete. Co dělat s poraněnou packou?,"Při procházkách v přírodě nebo na dovolené si váš zvířecí mazlíček může přivodit zranění na končetinách nebo tlapkách, případně úraz na hrudníku nebo...",lidovky.cz,relax
https://relax.lidovky.cz/narodni-knihovna-vydrazila-v-londyne-rukopisne-bohemikum-pn3-/veda.aspx?c=A171003_132653_ln_veda_ele,Národní knihovna vydražila v Londýně český rukopis z roku 1655,"Národní knihovna vydražila na aukci v Londýně modlitební knihu z roku 1655. Za vzácný rukopis, který sloužil také jako památník, zaplatila 148.000...",lidovky.cz,relax
