link,link_text,txt,site,area
https://brno.idnes.cz/nehoda-d1-tri-kamiony-dodavka-zraneni-zavreny-smer-fsg-/brno-zpravy.aspx?c=A180413_111121_brno-zpravy_krut,"Na D1 se srazily čtyři kamiony a dodávka, zraněného mladíka odvezl vrtulník",Hromadná nehoda čtyř kamionů a dodávky uzavřela na zhruba tři a půl hodiny dálnici D1 na 178....,idnes.cz,krimi
https://zpravy.idnes.cz/vezen-smrt-bory-plzen-herecka-napadeni-dyz-/krimi.aspx?c=A180413_103121_krimi_jkk,"V plzeňské věznici zemřel muž, který napadl herečku půllitrem","VIDEO
				
                Waldemar Malík, který si v Plzni na Borech odpykával osmiletý trest za pokus o vraždu, zemřel ve...",idnes.cz,krimi
https://brno.idnes.cz/lupic-kabelka-brno-kolemjdouci-dzq-/brno-zpravy.aspx?c=A180413_092026_brno-zpravy_krut,"Lupič smýkal ženou po silnici, zachránili ji dva kolemjdoucí muži","Dva náhodní kolemjdoucí zachránili v Brně ženu ze spárů lupiče, který jí chtěl sebrat kabelku. Tu...",idnes.cz,krimi
https://praha.idnes.cz/nehoda-jizni-spojka-04k-/praha-zpravy.aspx?c=A180413_092607_praha-zpravy_rsr,"Nehoda tří aut omezila dopravu na Jižní spojce, tvořily se dlouhé kolony","VIDEO
				
                Hromadná nehoda dvou nákladních aut a jednoho osobního omezila na půl dne provoz na Jižní spojce u...",idnes.cz,krimi
https://plzen.idnes.cz/miminko-novorozenec-porod-koupelna-smrtelna-zraneni-soud-verdikt-rozsudek-1vz-/plzen-zpravy.aspx?c=A180412_151959_plzen-zpravy_vb,Za vraždu miminka dostala žena 17 let. Podle soudu mu zmáčkla hlavu,"VIDEO
				
                Sedmnáct let za mřížemi si má za vraždu svého nechtěného chlapečka odpykat třicetiletá Jana F....",idnes.cz,krimi
https://pardubice.idnes.cz/alzheimerova-nemoc-ridic-mestska-policie-pardubice-senior-hledal-auto-zapomnel-kde-parkuje-ghi-/pardubice-zpravy.aspx?c=A180412_132856_pardubice-zpravy_skn,"Senior zapomněl, kde zaparkoval. V autě zůstala nemocná manželka","Do svízelné situace se dostal v Pardubicích senior, který zapomněl, kde zaparkoval. V autě zůstala...",idnes.cz,krimi
https://praha.idnes.cz/kapsarka-kovacsova-penezenky-kocarek-kavarny-fos-/praha-zpravy.aspx?c=A180412_164134_praha-zpravy_iri,Protřelou kapsářku poslal soud za mříže. Kradla i těhotná a s kočárkem,"VIDEO
				
                Jednu z nejvýkonnějších pražských kapsářek Marcelu Kovácsovou poslal ve čtvrtek Obvodní soud pro...",idnes.cz,krimi
https://jihlava.idnes.cz/soud-most-vilemov-pad-zriceni-tragedie-znalec-bezpecnost-prace-obecne-ohrozeni-havlickuv-b-gh0-/jihlava-zpravy.aspx?c=A180412_155006_jihlava-zpravy_mv,"Nemohla poznat, že se most ve Vilémově zřítí, zastal se znalec obžalované","VIDEO
				
                Soud ohledně pádu vilémovského mostu v září 2014 se pomalu blíží do finále. Soudkyně...",idnes.cz,krimi
https://plzen.idnes.cz/exekutor-strileni-obusek-soud-plynova-pistole-vykonavatel-uredni-osoba-vytrznictvi-gqn-/plzen-zpravy.aspx?c=A180412_105447_plzen-zpravy_vb,"Mysleli jsme, že jsou falešní, hájí se muži souzení za útok na exekutory","VIDEO
				
                Okresní soud Plzeň-město začal projednávat případ tří mužů, kteří jsou obžalovaní, že loni v září v...",idnes.cz,krimi
https://hradec.idnes.cz/lukas-necesany-vrchni-soud-vraceni-zduvodneni-fq7-/hradec-zpravy.aspx?c=A180412_151134_hradec-zpravy_tuu,"Senát v Hradci rozhodl příliš opatrně, vyložil soud vrácení kauzy Nečesaný","VIDEO
				
                Vrchní soud zrušil zprošťující rozsudek nad Lukášem Nečesaným kvůli způsobu, jakým hradecký soudce...",idnes.cz,krimi
https://kultura.zpravy.idnes.cz/nove-serialy-westworld-2-pribeh-sluzebnice-f25-/filmvideo.aspx?c=A180416_132008_filmvideo_ts,"Zombie i roboti. Kult seriálů, o kterých ctitelé Ordinace nemají tušení",Fanoušci zahraničních seriálů mají v dubnu žně. Startují nové tituly i premiérové řady jejich...,idnes.cz,kultura
https://kultura.zpravy.idnes.cz/jiri-strach-o-formanovi-milos-forman-dvu-/filmvideo.aspx?c=A180416_141549_filmvideo_ts,"Formana už pochovali. Všichni jsme jeho děti, míní režisér Jiří Strach","VIDEO
				
                Poslední rozloučení s režisérem Milošem Formanem se konalo v neděli na místním hřbitově v americkém...",idnes.cz,kultura
https://kultura.zpravy.idnes.cz/zebrik-kin-fakju-pane-uciteli-3-pepa-du0-/filmvideo.aspx?c=A180416_133725_filmvideo_spm,Německá komedie Fakjů pane učiteli 3 porazila českého Pepu na hlavu,"VIDEO
				
                Souboj dvou premiérových komedií v našich víkendových kinech skončil pro domácí barvy potupnou...",idnes.cz,kultura
https://kultura.zpravy.idnes.cz/milos-forman-portret-055-/filmvideo.aspx?c=A180416_100403_filmvideo_ts,"PORTRÉT: Talent, řemeslo, vůle, humor. To je tajemství filmaře Formana","VIDEO
				
                Splnil si americký sen, aniž musel slevit z vlastních představ, a celý filmový svět mu za to vzdává...",idnes.cz,kultura
https://sdeleni.idnes.cz/finale-plzen-jediny-festival-domaci-audiovizualni-tvorby-p3q-/kultura-sdeleni.aspx?c=A180327_120608_kultura-sdeleni_rest,Finále Plzeň: jediný festival domácí audiovizuální tvorby,"Filmová přehlídka Finále Plzeň oslaví na jaře své jednatřicáté narozeniny. Od 19. do 24. dubna 2018 nabídne to nejlepší z české a slovenské filmové, televizní...  
                    celý článek",idnes.cz,kultura
https://kultura.zpravy.idnes.cz/rybicky-18-american-z-polican-klip-d4v-/hudba.aspx?c=A180416_111743_hudba_vha,VIDEO: Rybičky 48 vyučují čenglištinu a rekapitulují cestu do Ameriky,"Kapela Rybičky 48 se po půlroční koncertní pauze vrací na pódia a těší se na nabité léto, během...",idnes.cz,kultura
https://kultura.zpravy.idnes.cz/bob-dylan-koncert-brno-recenze-deq-/hudba.aspx?c=A180416_010500_hudba_vha,RECENZE: Bez kytary a beze slova. Zato úsměvy Bob Dylan nešetřil,Všech folkařů král u nás takřka pravidelně střídá povedené a unavené koncerty. Byla-li poslední...,idnes.cz,kultura
https://kultura.zpravy.idnes.cz/milos-forman-danny-devito-vzpominky-slavnych-f40-/filmvideo.aspx?c=A180416_395507_filmvideo_spm,"Doutník, sklenku a třikrát ho...o, vyzval DeVito k vzpomínce na Formana","VIDEO
				
                Edward Norton, Danny DeVito, Jim Carrey i Antonio Banderas. Největší osobnosti Hollywoodu vyjádřily...",idnes.cz,kultura
https://kultura.zpravy.idnes.cz/trailer-nez-prisla-boure-0xz-/filmvideo.aspx?c=A180413_160851_filmvideo_spm,"VIDEO: On, ona a hurikán. Film Než přišla bouře vznikl podle skutečnosti","VIDEO
				
                Ze skutečných událostí vychází snímek Než přišla bouře, jenž spojuje romantický žánr s...",idnes.cz,kultura
https://kultura.zpravy.idnes.cz/kylie-minogue-golden-recenze-din-/hudba.aspx?c=A180413_135339_hudba_ts,RECENZE: Sympatická drzost. Kylie Minogue zpívá pro kamioňáky,"Nová deska australské zpěvačky Kylie Minogue nazvaná Golden vznikala zčásti v Los Angeles, zčásti v...",idnes.cz,kultura
https://kultura.zpravy.idnes.cz/hastrman-ondrej-havelka-karel-dobry-simona-zmrzla-milos-urban-p68-/filmvideo.aspx?c=A180413_131448_filmvideo_ts,"Ekoterorista, romantik. Čili Hastrman. Takový žánr tu prý už léta nebyl","VIDEO
				
                Ani zábavný sběratel hrníčků s dušičkami v komedii Jak utopit dr. Mráčka, ani pan Rybář v zeleném...",idnes.cz,kultura
https://kultura.zpravy.idnes.cz/misery-zlata-adamovska-recenze-studio-dva-fim-/divadlo.aspx?c=A180413_134111_divadlo_ts,"RECENZE: Šílená Adamovská, cákanec krve. U naší Misery smích povolen",Skvěle se s náročnou rolí šílené fanynky vyrovnala Zlata Adamovská. Divadelní adaptace Kingova...,idnes.cz,kultura
https://kultura.zpravy.idnes.cz/tony-parsons-smrt-vsem-prasatum-detektivka-nme-f5s-/literatura.aspx?c=A180413_140623_literatura_kiz,"Lekl se, že lidé čtou Padesát odstínů šedi, tak napsal detektivku","Dříve se toulal Tony Parsons po nocích s Brucem Springsteenem, teď ve svých knihách vysílá za...",idnes.cz,kultura
https://kultura.zpravy.idnes.cz/noel-gallagher-high-flying-birds-praha-lucerna-oasis-fyt-/hudba.aspx?c=A180415_114644_hudba_kiz,RECENZE: Noel Gallagher zase míří k výšinám. Bratra už nepotřebuje,Obavy o další hudební směřování bývalého člena kapely Oasis Noela Gallaghera mohou jít definitivně...,idnes.cz,kultura
https://kultura.zpravy.idnes.cz/nekrolog-milos-forman-zemrel-86-let-d5x-/filmvideo.aspx?c=A171207_160108_filmvideo_spm,"Zemřel režisér Miloš Forman, tvůrce oscarového Amadea","VIDEO
				
                Filmový režisér Miloš Forman, držitel dvou Oscarů za nejlepší režii a také otec dvou párů...",idnes.cz,kultura
https://kultura.zpravy.idnes.cz/vladimir-pucholt-rozhovor-d09-/divadlo.aspx?c=A180413_161846_divadlo_ts,"VIDEO: Jako plíseň. Pucholt vzpomíná, proč si nechtěl zadat s režimem","VIDEO
				
                Herecká hvězda Starců na chmelu a Formanových raných filmů Vladimír Pucholt u nás nebývá často. Z...",idnes.cz,kultura
https://kultura.zpravy.idnes.cz/metropolitni-opera-luisa-millerova-db4-/hudba.aspx?c=A180415_115318_hudba_era,RECENZE: Domingo stále dokáže zpívat. Ale má to zapotřebí?,Po čase bylo možno v kinopřenosu z Metropolitní opery opět vidět na jevišti Plácida Dominga. Navíc...,idnes.cz,kultura
https://kultura.zpravy.idnes.cz/david-ondricek-milos-forman-dpd-/filmvideo.aspx?c=A180414_093452_filmvideo_kiz,"Strážný anděl i vzor. Na Formana vzpomíná Bartoška, Bohdalová a další","„Budu na něj vzpomínat něžně a s láskou, přesně tak, jak se ke mně choval celý život,“ řekla pro...",idnes.cz,kultura
https://zpravy.idnes.cz/kondolence.aspx,Čtenáři se rozloučili s režisérem Milošem Formanem v kondolenční knize,Miloš Forman zemřel ve věku 86 let. Čtenáři iDNES.cz vyjádřili soustrast a zanechali svou vzpomínku...,idnes.cz,kultura
https://kultura.zpravy.idnes.cz/trailer-mas-ji-jeremy-renner-dgg-/filmvideo.aspx?c=A180413_143816_filmvideo_spm,VIDEO: Jeremy Renner přešel do komedie. Ve filmu Máš ji! hraje na babu,"VIDEO
				
                Loňský host karlovarského festivalu Jeremy Renner, známý spíše z akčních rolí od Mission:...",idnes.cz,kultura
https://kultura.zpravy.idnes.cz/queens-of-the-stone-age-praha-20-cervna-dsw-/hudba.aspx?c=A180413_132714_hudba_kiz,Hrajeme i pro vyvrhele. Queens of the Stone Age se vrátí do Prahy,Rockovou scénu bourá kapela Queens of the Stone Age už přes dvacet let. Do Prahy se pětice...,idnes.cz,kultura
https://kultura.zpravy.idnes.cz/milos-forman-obrazem-jim-carrey-film-dvf-/filmvideo.aspx?c=A180414_090603_filmvideo_kiz,OBRAZEM: Oscar za Amadea i trápení s Carreym. Připomeňte si Miloše Formana,"„Trápilo ho, že místo s Jimem Carreym se i po natočení záběru na place musel setkávat s Andy...",idnes.cz,kultura
https://kultura.zpravy.idnes.cz/dum-v-jablonich-recenze-pomezi-imerzivni-divadlo-winternitzova-vila-1j7-/divadlo.aspx?c=A180413_123547_divadlo_ts,RECENZE: Kdo odcizil Dům v jabloních? Diváci pátrají ve Winternitzově vile,Ocitnout se v době první republiky a navíc v kouzelném prostředí Winternitzovy vily nabízí divákům...,idnes.cz,kultura
https://brno.idnes.cz/bob-dylan-koncert-brno-hala-dd0-/brno-zpravy.aspx?c=A180413_163208_brno-zpravy_krut,"Hledání haly pro Dylana byl oříšek, hokejisté si všude věřili na finále","Nestává se moc často, aby se světová hudební legenda na svém turné zastavila i v Brně. A už vůbec...",idnes.cz,kultura
https://kultura.zpravy.idnes.cz/noel-gallagher-koncert-who-built-the-moon-f1k-/hudba.aspx?c=A180413_133105_hudba_ts,"Sólo pro Noela Gallaghera. Ač přijíždí jen půlka Oasis, Wonderwall zazní","Noel Gallagher míří na svůj první sólový koncert do Česka s výtečným albem Who Built the Moon?, jež...",idnes.cz,kultura
https://kultura.zpravy.idnes.cz/chaozz-ale-uz-tour-glosa-081-/hudba.aspx?c=A180414_084103_hudba_vha,"GLOSA: Chaozz přivezl do Brna hity, živou kapelu a „velkej bordel“","VIDEO
				
                Tuzemská hiphopová legenda v pátek v brněnském Sono Centru odstartovala své vzpomínkové turné Ale...",idnes.cz,kultura
https://kultura.zpravy.idnes.cz/televizionar-odpocivejte-v-pokoji-pani-columbova-fvu-/filmvideo.aspx?c=A180413_122539_filmvideo_ts,"TELEVIZIONÁŘ: Jak pochovali paní Columbovou, legendu bez tváře","Mnozí ji považují za vůbec nejlepší z novějších epizod seriálu Columbo, který letos oslavuje...",idnes.cz,kultura
https://kultura.zpravy.idnes.cz/vlasy-divadlo-kalich-simon-caban-dab-/divadlo.aspx?c=A180413_142518_divadlo_ts,KvětiNOVÉ děti. Muzikál Vlasy se obejde bez chlupáčů a džínoviny,"Muzikál Vlasy, který proslavil snímek Miloše Formana, se vrací na česká pódia. Nejnovější adaptaci...",idnes.cz,kultura
https://kultura.zpravy.idnes.cz/kensington-recenze-klub-roxy-djx-/hudba.aspx?c=A180413_114243_hudba_kiz,RECENZE: Jak vecpat stadion do klubu? Kapela Kensington našla recept,V Nizozemsku umí kapela Kensington vyprodat stadion během několika hodin. Čtvrteční koncert v...,idnes.cz,kultura
https://kultura.zpravy.idnes.cz/troji-zivot-recenze-0q7-/filmvideo.aspx?c=A180413_103145_filmvideo_ts,RECENZE: Víc sektu než sexu. Trojí život ukáže bigamistovy veselé trable,"Televizní komedii je třeba chránit jako ohrožený druh, jemuž zejména na státotvorně zatěžkané...",idnes.cz,kultura
https://kultura.zpravy.idnes.cz/trailer-uzasnakovi-2-0lt-/filmvideo.aspx?c=A180413_141112_filmvideo_spm,VIDEO: Úžasňákovi 2 zařídili Pixaru už před premiérou divácký rekord,"VIDEO
				
                Ve filmu Úžasňákovi 2 se od 2. srpna vrátí do kin rodina superhrdinů, do níž zasáhla emancipace....",idnes.cz,kultura
https://kultura.zpravy.idnes.cz/za-scenou-ondrej-havelka-hastrman-saturnin-fk3-/filmvideo.aspx?c=A180412_154047_filmvideo_kiz,"Pokračování Saturnina by bylo beze mě, řekl Ondřej Havelka Za scénou","VIDEO
				
                Příští čtvrtek do kin vstoupí první celovečerní režisérský debut Ondřeje Havelky Hastrman. Hraje v...",idnes.cz,kultura
https://kultura.zpravy.idnes.cz/brouk-v-hlave-studio-dva-blazek-schneiderova-f3f-/divadlo.aspx?c=A180412_152623_divadlo_ts,V létě se na Vyšehradě vrátí Brouk v hlavě. S Blažkem a Schneiderovou,"Divadlo Studio DVA zahájilo letní předprodej. Přehlídku na Letní scéně Vyšehrad, která trvá od 21....",idnes.cz,kultura
https://kultura.zpravy.idnes.cz/fakju-pane-uciteli-3-recenze-dfu-/filmvideo.aspx?c=A180412_132023_filmvideo_ts,"RECENZE: Fakjů, pane učiteli, potřetí už nemáte co hrát","VIDEO
				
                Ze všech tří dílů populární německé série Fakjů pane učiteli je nejnovější snímek zároveň tím...",idnes.cz,kultura
https://kultura.zpravy.idnes.cz/cena-jiriho-ortena-2018-0rx-/literatura.aspx?c=A180413_091120_literatura_kiz,Vyznání lásky babičce i básně o moderním světě. To je Cena Jiřího Ortena,"Cenu Jiřího Ortena letos mohou získat dílo Ondřeje Macla Miluji svou babičku víc než mladé dívky,...",idnes.cz,kultura
https://kultura.zpravy.idnes.cz/world-press-photo-2018-0lw-/vytvarne-umeni.aspx?c=A180412_140820_vytvarne-umeni_kiz,World Press Photo vyhrál snímek Venezuelana hořícího po výbuchu motocyklu,Fotografie Venezuelská krize zachycující hořícího demonstranta během nepokojů namířených proti...,idnes.cz,kultura
https://kultura.zpravy.idnes.cz/metronome-festival-sexy-dancers-superorganism-f51-/hudba.aspx?c=A180412_133539_hudba_vha,Dara Rolins si zazpívá s Bártou. Na pódium se vrátí kultovní Sexy Dancers,"Metronome Festival, který se na pražském Výstavišti uskuteční 22. a 23. června, odhalil poslední...",idnes.cz,kultura
https://ekonomika.idnes.cz/kapitol-fincentrum-pokuta-cnb-investicni-zivotni-pojisteni-prh-/ekonomika.aspx?c=A180416_122242_ekonomika_nio,Finanční poradci dostali od ČNB opět přes prsty za nekalé obchodní praktiky,Centrální banka opět rozdává pokuty finančním poradcům. Společnost Kapitol patřící Kooperativě a...,idnes.cz,ekonomika
https://ekonomika.idnes.cz/letiste-praha-ruzyne-zakaz-koureni-d63-/ekonomika.aspx?c=A180416_135550_ekonomika_jj,"Děkujeme, že nekouříte. Letiště Václava Havla vykáže ven milovníky cigaret",V prostorách Letiště Václava Havla v Praze nebude od prvního května možné kouřit. Zákaz se týká...,idnes.cz,ekonomika
https://ekonomika.idnes.cz/cesko-hypoteky-bydleni-ceska-narodni-banka-f2d-/ekonomika.aspx?c=A180416_144329_ekonomika_rts,"Hypotéky jsou v Česku stále v kurzu, jejich četnost navíc dále roste","Podíl bytů, které lidé financují hypotékou, u většiny developerů v Česku v poslední době rostl a...",idnes.cz,ekonomika
https://ekonomika.idnes.cz/karlovarsky-festival-sponzori-kretinsky-mall-flg-/ekonomika.aspx?c=A180416_123304_ekonomika_jj,Karlovarský festival bude místo ČEZ sponzorovat Křetínský,Hlavním sponzorem Mezinárodního filmového festivalu Karlovy Vary po odchodu společnosti ČEZ bude EP...,idnes.cz,ekonomika
https://sdeleni.idnes.cz/keramika-soukup-rodinne-imperium-zrozene-z-vize-a-houzevnatosti-py6-/eko-sdeleni.aspx?c=A180322_094304_eko-sdeleni_rest,Keramika Soukup: rodinné impérium zrozené z vize a houževnatosti,"Příběh Keramiky Soukup připomíná „americký sen“. Jejímu majiteli se podařilo vybudovat prosperující podnik navzdory nepříznivým výchozím podmínkám. Dnes je...  
                    celý článek",idnes.cz,ekonomika
https://ekonomika.idnes.cz/heinz-majocup-0dn-/eko-zahranicni.aspx?c=A180416_100237_eko-zahranicni_div,"Heinz namíchal „majočup“. Objevuje Ameriku, zlobí se Hispánci","Potravinářská společnost Heinz uvedla na trh „majočup“, který je kombinací majonézy a kečupu....",idnes.cz,ekonomika
https://ekonomika.idnes.cz/dalnice-d6-dokonceni-2026-063-/eko-doprava.aspx?c=A180416_095052_eko-doprava_jj,Dálnice z Karlových Varů do Prahy bude hotová nejdřív za osm let,Dálnice D6 nebude podle ministra dopravy Dana Ťoka dokončena před rokem 2026. Přípravu zbývajících...,idnes.cz,ekonomika
https://olomouc.idnes.cz/prostejov-hellas-nejen-recko-cestovni-kancelar-insolvence-veritele-dluhy-15w-/olomouc-zpravy.aspx?c=A180416_142600_olomouc-zpravy_stk,"Zkrachovalá cestovka dluží dva miliony, na většinu věřitelů zbylo 11 tisíc",Jen zcela nepatrný zlomek peněz dostane až na výjimky většina věřitelů zkrachovalé cestovní...,idnes.cz,ekonomika
https://ekonomika.idnes.cz/novy-cukr-nestle-orion-kde-vsude-se-objevi-fih-/ekonomika.aspx?c=A180415_214321_ekonomika_lre,„Nového“ cukru stačí o třetinu méně. Firmy se chtějí vyhnout hrozící dani,Daň z cukru začala platit ve Velké Británii první dubnový týden. Zatím se týká jen sladkých...,idnes.cz,ekonomika
https://vary.idnes.cz/polygon-bmw-vlada-vyvojove-centrum-sokolovsko-frx-/vary-zpravy.aspx?c=A180416_143631_vary-zpravy_ba,"Stát podpoří polygon firmy BMW u Sokolova, chce ale práci pro Čechy",Vláda v demisi se během své návštěvy Karlovarského kraje vrátila k záměru mnichovské automobilky...,idnes.cz,ekonomika
https://ekonomika.idnes.cz/stiraci-losy-loterie-prosazeji-cesi-miliardy-faw-/ekonomika.aspx?c=A180415_214915_ekonomika_lre,"Češi v loteriích ročně prosázejí miliardy, půlka se vrátí ve výhrách",Provozovatelé loterií milují pátek třináctého. Lidé totiž sázejí třikrát více než obvykle. Češi...,idnes.cz,ekonomika
https://sdeleni.idnes.cz/lety-budovana-sit-prepravnich-linek-gebruder-weiss-fx6-/eko-sdeleni.aspx?c=A180409_164841_eko-sdeleni_rest,Léty budovaná síť přepravních linek Gebrüder Weiss,"Historie společnosti Gebrüder Weiss sahá více než 500 let zpět. Proto i síť přepravních linek je budována již po několik desítek let a celá Evropa je jimi...  
                    celý článek",idnes.cz,ekonomika
https://ostrava.idnes.cz/vitkovice-heavy-machinery-jan-svetlik-ocelarna-fr7-/ostrava-zpravy.aspx?c=A180416_102348_ostrava-zpravy_jog,Vítkovice Heavy Machinery obnovily provoz ocelárny a ruší omezení výroby,Společnost Vítkovice Heavy Machinery (VHM) ze strojírenské skupiny Vítkovice Machinery Group...,idnes.cz,ekonomika
https://ekonomika.idnes.cz/cla-usa-cina-obchodni-valka-tarify-ocel-hlinik-fa4-/eko-zahranicni.aspx?c=A180410_394281_eko-zahranicni_rts,"ANALÝZA: Vyhlásit obchodní válku na Twitteru je snadné, málokdy však pomůže",Začalo to čínskou ocelí a hliníkem. Pak přišly americké sójové boby. Nyní seznamy v USA a Číně...,idnes.cz,ekonomika
https://hradec.idnes.cz/stavba-dalnice-d11-hradec-jaromer-trutnov-obchvat-pozemky-pey-/hradec-zpravy.aspx?c=A180416_395561_hradec-zpravy_pos,"Na obchvatu Jaroměře závisí D11, zatím však nemá povolení ani pozemky",Kolaudace dálnice D11 k Jaroměři je podmíněná stavbou severního obchvatu tohoto města ležícího...,idnes.cz,ekonomika
https://ekonomika.idnes.cz/vystava-cenin-tiskarna-penize-ochranne-prvky-obcansky-prukaz-pbp-/ekonomika.aspx?c=A180409_143552_ekonomika_fih,Motýlí efekt a duha na českých bankovkách. Podívejte se na nové prvky,Státní tiskárna cenin slaví devadesát let od svého vzniku. Významné jubileum spojila s unikátní...,idnes.cz,ekonomika
https://ekonomika.idnes.cz/aero-vodochody-giuseppe-giordo-reditel-tryskace-letouny-vyroba-p8b-/ekonomika.aspx?c=A180413_204928_ekonomika_pmk,Šéf Aera Vodochody vede firmu novou cestou. Začne opět vyrábět letadla,Aero Vodochody obnovuje výrobu proudových letounů a vydává se pro ně hledat kupce. Na změnu...,idnes.cz,ekonomika
https://ekonomika.idnes.cz/eura-dolary-dovolena-smenarny-vymena-dw5-/ekonomika.aspx?c=A180413_143216_ekonomika_fih,"S nákupem eur na dovolenou nemusíte spěchat, moc ale neušetříte",Chytrým načasováním nákupu eur před dovolenou letos ušetříte maximálně stokoruny. Přestože se podle...,idnes.cz,ekonomika
https://ekonomika.idnes.cz/foto-pristavy-nejrusnejsi-rotterdam-asie-mezinarodni-preprava-obchod-1m4-/eko-zahranicni.aspx?c=A180412_153211_eko-zahranicni_rts,"OBRAZEM: Nejrušnější přístavy světa jsou v Asii, Rotterdam je až desátý","Nejrušnější přístavy světa nemusí být nezbytně i největší, ale často tomu tak je. Námořní doprava...",idnes.cz,ekonomika
https://ekonomika.idnes.cz/otevrene-bankovnictvi-platba-v-jedne-aplikaci-fow-/ekonomika.aspx?c=A180413_394983_ekonomika_are,Ovládat víc účtů z jedné appky? Očekávaná bankovní revoluce zatím nevypukla,"Klient, který chce zadávat platby z různých bank přes jednu aplikaci, má smůlu. Bude si ještě muset...",idnes.cz,ekonomika
https://ekonomika.idnes.cz/pohonne-hmoty-cena-narust-ropa-benzin-nafta-palivo-f81-/ekonomika.aspx?c=A180413_202909_ekonomika_pmk,"Motoristická sezona začíná, cena benzinu a nafty roste. I kvůli Sýrii",S nástupem motoristické sezony začínají v Česku stoupat ceny pohonných hmot. Cenu ropy zvedá...,idnes.cz,ekonomika
https://ekonomika.idnes.cz/coop-farmaraske-potraviny-park-slope-food-fir-/eko-zahranicni.aspx?c=A180413_111552_eko-zahranicni_fih,"V supermarketu pracují sami zákazníci, jídlo pak mají za poloviční cenu","Představte si obchod, kde seženete zeleninu, maso i drogerii od místních farmářů jen za půlku ceny....",idnes.cz,ekonomika
https://ekonomika.idnes.cz/nejobdivovansji-lide-sveta-bill-gates-a-angleina-jolie-pp3-/eko-zahranicni.aspx?c=A180413_110230_eko-zahranicni_are,"Nejobdivovanější lidé jsou Gates a Jolie, uspěli i Obamovi a Jackie Chan","Nejobdivovanějším mužem světa je zakladatel Microsoftu Bill Gates, mezi ženami vyniká herečka...",idnes.cz,ekonomika
https://ekonomika.idnes.cz/pseudomor-newcastleska-nemoc-ochranne-pasmo-karantena-drubez-nemoc-11b-/ekonomika.aspx?c=A180413_145834_ekonomika_ane,"U české drůbeže se po dvaceti letech objevil pseudomor, vzniká karanténa","V Česku se po dvaceti letech objevil v chovu drůbeže pseudomor, takzvaná Newcastleská nemoc. Pro...",idnes.cz,ekonomika
https://ekonomika.idnes.cz/potraviny-dvoji-kvalita-evropska-komise-zakaz-fl5-/eko_euro.aspx?c=A180412_394750_eko_euro_rts,KOMENTÁŘ: Češi uspěli v Evropě. Už nebudou jíst hůře než Němci,Evropská komise představila nová pravidla boje proti dvojí kvalitě potravin. Brzy si snad koupíme...,idnes.cz,ekonomika
https://ekonomika.idnes.cz/marihuana-celebrity-mike-tyson-bob-marley-snoop-dogg-pco-/eko-zahranicni.aspx?c=A180411_100850_eko-zahranicni_div,Byznys s konopím láká slavné. Tyson i Goldbergová mají vlastní značku,"Snoop Dogg, Mike Tyson, Whoopi Goldbergová, Tommy Chong a mnoho dalších amerických celebrit...",idnes.cz,ekonomika
https://ekonomika.idnes.cz/prace-zamestnani-spokojenost-pruzkum-prescasy-zmena-dojizdeni-p8g-/ekonomika.aspx?c=A180413_115110_ekonomika_ane,"Většina čtyřicátníků je v zaměstnání spokojená, práci si domů nenosí",Zhruba sedmdesát procent českých čtyřicátníků je se svým zaměstnáním spokojeno a neuvažuje o změně....,idnes.cz,ekonomika
https://budejovice.idnes.cz/ceska-narodni-banka-petr-kral-pisek-jihocech-fzj-/budejovice-zpravy.aspx?c=A180411_394610_budejovice-zpravy_mm1,"Z Písku by mohlo být malé Brno, věří ekonom České národní banky","O České národní bance, o podnikání na jihu Čech i o svém rodném městě v rozhovoru pro MF DNES...",idnes.cz,ekonomika
https://ekonomika.idnes.cz/cestovni-kancelare-dovolena-zajezdy-ochrana-klientu-garancni-fond-upadek-1l7-/ekonomika.aspx?c=A180413_111805_ekonomika_ane,"Cestovky musí odvádět část tržeb na ochranu klientů, rozhodli poslanci",K lepšímu zajištění ochrany klientů cestovních kanceláří v případech úpadku by měl sloužit nový...,idnes.cz,ekonomika
