link,link_text,txt,site,area
https://www.lidovky.cz/novinar.aspx?idnov=3899,Jaroslav Totušek,"Kniha Pád Gondolinu (Fall of Gondolin) popisuje osud velkého města, kterého se dotýkal už Silmarillion. Kromě velkého a tragického milostného příběhu...",lidovky.cz,kultura
https://www.lidovky.cz/james-franco-jako-kral-pouste-prvni-ukazka-snimku-future-world-divaky-neohromila-ggy-/kultura.aspx?c=A180410_114806_ln_kultura_jto,James Franco jako král pouště. První ukázka snímku Future World diváky neohromila,Hvězdně obsazený postapokalyptický snímek Future World (Svět budoucnosti) se představil první ukázkou. Podle ohlasů ale vypadá jako laciný...,lidovky.cz,kultura
https://www.lidovky.cz/utikame-pred-upachtenosti-zivota-mysli-si-britsky-umelec-mat-collishaw-1a5-/kultura.aspx?c=A180410_103016_ln_kultura_jto,"Utíkáme před upachtěností života, myslí si britský umělec Mat Collishaw","Britský umělec Mat Collishaw, blízký přítel Damiena Hirsta, rád diváky provokuje svými krutými a nepohodlnými obrazy. I když obsahují zlo a násilí,...",lidovky.cz,kultura
https://www.lidovky.cz/vystavu-milana-knizaka-v-karlovych-varech-vysetruje-policie-pt0-/kultura.aspx?c=A180410_174341_ln_kultura_ele,Výstavu Milana Knížáka v Karlových Varech vyšetřuje policie,"Knížákovu výstavu Žít jinak v Karlových Varech vyšetřuje policie na popud ruské stěžovatelky, podle které jde o dětskou pornografii. Výtvarník to...",lidovky.cz,kultura
https://www.lidovky.cz/jsi-uvnitr-mrtvy-spolecnost-disney-obrazkem-pinocchia-pohorsila-rodice-14q-/kultura.aspx?c=A180410_105958_ln_kultura_jto,‚Jsi uvnitř mrtvý.‘ Společnost Disney obrázkem Pinocchia pohoršila rodiče,"Společnost Disney na svém Twitterové účtu s téměř 6 miliony odběrateli zveřejnila obrázek Pinocchia s popiskem: „když ti někdo složí kompliment, ale...",lidovky.cz,kultura
https://www.lidovky.cz/novinar.aspx?idnov=3899,Jaroslav Totušek,"„Stříbro nebo olovo“ (plata o plomo). Touto slavnou větou dával Pablo Escobar svým oponentům najevo, že se mohou nechat buď podplatit anebo...",lidovky.cz,kultura
https://cestovani.lidovky.cz/nomadi-jine-pary-spolu-dum-stavi-my-ho-borime-prestehovali-jsme-se-do-dodavky-1w1-/aktuality.aspx?c=A180415_171334_aktuality_ape,"NOMÁDI: Jiné páry spolu dům staví, my ho boříme. Přestěhovali jsme se do dodávky","""Do nájmu jsme jít nechtěli, a splácet třicet let hypotéku už vůbec ne,"" popisuje začátek života na cestě Tomáš Horáček. Domov se svou přítelkyní...",lidovky.cz,cestovani
https://cestovani.lidovky.cz/kubansky-rum-odolava-americkemu-embargu-fdo-/aktuality.aspx?c=A180412_153307_aktuality_ape,Kubánský rum odolává americkému embargu,"Kubánský rum, který je známý po celém světě, dokáže konkurovat největším značkám, přestože nemá přístup na americký trh kvůli embargu vyhlášenému...",lidovky.cz,cestovani
https://cestovani.lidovky.cz/na-kole-vysokymi-i-nizkymi-taurami-poznejte-rakouske-colorado-p7v-/aktuality.aspx?c=A180409_122344_aktuality_ape,Na kole Vysokými i Nízkými Taurami: Poznejte rakouské Colorado,Chystáte se na letní cyklo-dovolenou? Doporučujeme třeba Rakousko! Tamější cyklostezky s výhledy na alpské velikány a zastávkami na občerstvení v...,lidovky.cz,cestovani
https://www.lidovky.cz/novinar.aspx?idnov=3560,Tomáš Málek,"Je to místo, kde najdete všechny verze slavné Tatry 613 na jednom místě. Ale také úplně první multikáru, kterou “soudruzi z NDR” nevybavili ani...",lidovky.cz,cestovani
https://cestovani.lidovky.cz/george-town-v-malajsii-pestra-smes-kultury-i-kuchyne-pcs-/aktuality.aspx?c=A180411_110436_aktuality_ape,George Town v Malajsii: Pestrá směs kultury i kuchyně,Strategická poloha Malajsie se v mnohém podepsala do kultury a života této východoasijské země. Během britské správy do Malajsie přicestovali za...,lidovky.cz,cestovani
https://cestovani.lidovky.cz/na-kole-pres-afriku-na-dne-v-bahne-dol-/aktuality.aspx?c=A180410_110430_aktuality_ape,Na kole přes Afriku: Na dně v bahně,"Skončil asfalt. Z gabonského města Ndendé je to padesát kilometrů na hranice s Kongem. Dnes mám narozeniny. Poprchává. „Bude to sranda,” říkám si,...",lidovky.cz,cestovani
https://cestovani.lidovky.cz/mokry-svet-a-zamecke-kviti-vydejte-se-do-rozkvetle-trebone-pa6-/aktuality.aspx?c=A180409_133641_aktuality_ape,Mokrý Svět a zámecké kvítí. Vydejte se do rozkvetlé Třeboně,"Pozvěte známé na cestu kolem světa a zavezte je do Třeboně: nikde jinde totiž taková cesta neměří necelých dvanáct kilometrů. Řeč je o rybníku Svět,...",lidovky.cz,cestovani
https://cestovani.lidovky.cz/nemit-v-26-letech-zadne-deti-kreolske-zeny-jich-maji-uz-pet-rika-ceska-1p2-/aktuality.aspx?c=A180409_104124_aktuality_ape,"Nemít v 26 letech žádné děti? Kreolské ženy jich mají už pět, říká Češka","Veronika Holubová se na ostrov Réunion přestěhovala na dva měsíce kvůli práci. „Většina místních lidí nemá ponětí, kde Česká republika leží, ba že...",lidovky.cz,cestovani
https://cestovani.lidovky.cz/nekteri-odchazeji-se-slzami-v-ocich-salcburske-loutkove-divadlo-vraci-dospelym-detskou-radost-igh-/aktuality.aspx?c=A180405_105552_aktuality_msk,‚Někteří odcházejí se slzami v očích.‘ Salcburské loutkové divadlo vrací dospělým dětskou radost,"Město Mozarta či jeviště světa. I s pouhými 150 tisíci obyvateli je Salcburk místem, které se může srovnávat s evropskými metropolemi. Ročně přitáhne...",lidovky.cz,cestovani
https://cestovani.lidovky.cz/nomadi-transporterem-evropou-dali-jsme-vypoved-a-zacali-cestovat-a-zit-13o-/aktuality.aspx?c=A180404_145643_aktuality_ape,NOMÁDI: Transportérem Evropou. Dali jsme výpověď a začali cestovat a žít,"“Takhle už to dál nejde. Dělat práci jen pro peníze mně nebaví. Nevidím žádné výsledky, jsem v kolotoči. Frustrovaný”. Tyhle myšlenky nás donutily...",lidovky.cz,cestovani
https://cestovani.lidovky.cz/okoli-byci-skaly-na-blanensku-se-pro-turisty-uzavrelo-kvuli-sokolum-1iu-/aktuality.aspx?c=A180408_202829_aktuality_ele,Okolí Býčí skály na Blanensku se pro turisty uzavřelo kvůli sokolům,Ochranáři po roce opět uzavřeli okolí Býčí skály v Moravském krasu kvůli hnízdění vzácného sokola stěhovavého. Omezení posune termíny otevření tamní...,lidovky.cz,cestovani
https://cestovani.lidovky.cz/pred-turistickou-sezonou-pojede-znojemsky-vinobus-v-dubnu-zdarma-108-/aktuality.aspx?c=A180408_201243_aktuality_ele,Před turistickou sezonou pojede znojemský Vinobus v dubnu zdarma,Ještě před startem hlavní turistické sezony v květnu vyrazí Vinobus VOC Znojmo na svou trasu po vinicích a vinařstvích poslední dva dubnové víkendy....,lidovky.cz,cestovani
https://cestovani.lidovky.cz/na-motorce-do-cjinskeho-statu-za-zapadlymi-kouty-myanmy-p2u-/aktuality.aspx?c=A180403_152713_aktuality_ape,Na motorce do Čjinského státu za zapadlými kouty Barmy,"Maximálně dva tři mezinárodní lety za den do celé země, každý z nich obsazený tak na šedesát procent, po přistání je v potemnělé hale policistů v...",lidovky.cz,cestovani
https://cestovani.lidovky.cz/kachni-zarodky-ci-mravenci-vejce-ochutnejte-nejzvlastnejsi-jidla-vietnamu-160-/aktuality.aspx?c=A180326_130952_aktuality_ape,Kachní zárodky či mravenčí vejce. Ochutnejte nejzvláštnější jídla Vietnamu,"Vietnam je proslulý svou výtečnou kuchyní a je doslova rájem pro gurmány. Kromě toho, že umí připravit rýži, nudle, maso i zeleninu na milion...",lidovky.cz,cestovani
https://cestovani.lidovky.cz/v-kyselce-otevreli-stezku-po-stopach-mattoniho-a-mistnich-skritku-1do-/aktuality.aspx?c=A180404_104713_aktuality_ape,V Kyselce otevřeli stezku po stopách Mattoniho a místních skřítků,"Naučnou Mattoniho stezku s podtitulem Po stopách skřítků otevřeli dnes v Kyselce na Karlovarsku. Seznámí návštěvníky s historií bývalých lázní, ale i...",lidovky.cz,cestovani
https://cestovani.lidovky.cz/slovenska-stalice-jasna-dubnova-lyzovacka-jako-v-alpach-pjt-/aktuality.aspx?c=A180403_095457_aktuality_ape,Slovenská stálice Jasná. Dubnová lyžovačka jako v Alpách,"Kalendář hlásí jaro, ale slovenským Tatrám zima jen tak vale nedá. Dubnovou lyžovačku si můžete užít u našich slovenských bratrů a díky počtu a...",lidovky.cz,cestovani
https://cestovani.lidovky.cz/na-kole-pres-afriku-gabon-je-pro-me-ten-nejhezci-stat-kterym-jsem-zatim-projizdel-gfv-/aktuality.aspx?c=A180401_140202_aktuality_ele,"Na kole přes Afriku: Gabon je nejhezčí stát, kterým jsem zatím projížděl","Rozřízněte někdo tu dvoumetrovou krabici!“ Křičí podsaditý celník na librevillském letišti. „Hej, pomalu, pomalu!“ Ozývám se, schovaný za svým...",lidovky.cz,cestovani
https://cestovani.lidovky.cz/nomadi-expedice-dolu-a-doleva-dil-/aktuality.aspx?c=A180327_110746_aktuality_ape,NOMÁDI: Expedice dolů a doleva. Na Balkán s veteránem,"Začalo to přesně 2. května. Vlastně tenhle příběh začal už o něco dříve, kdy jsem se (Jiřina) kolem sebe začal rozhlížet po něčem. Nevěděl jsem...",lidovky.cz,cestovani
https://cestovani.lidovky.cz/kolem-mista-jezisova-krtu-se-zacalo-s-odstranovanim-min-p2g-/aktuality.aspx?c=A180329_150324_aktuality_ape,Kolem místa Ježíšova křtu se začalo s odstraňováním min,Po čtyřech letech obtížného vyjednávání s církevními představiteli začala nedaleko Jericha u břehu řeky Jordánu složitá operace odstranění tisíců...,lidovky.cz,cestovani
https://cestovani.lidovky.cz/milujete-umeni-pak-je-pro-vas-postupimske-muzeum-barberini-nove-must-see-1q5-/aktuality.aspx?c=A180319_145221_aktuality_ape,Milujete umění? Pak musíte navštívit nové postupimské muzeum Barberini,"Postupim láká nejen na krásné zámky v parku Sanssouci, díky novému muzeu výtvarného umění Barberini se stala doslova magnetem milovníků kultury a...",lidovky.cz,cestovani
https://cestovani.lidovky.cz/kde-slavit-velikonoce-svatky-na-draze-i-na-hradech-f7s-/aktuality.aspx?c=A180326_144015_aktuality_ape,Kde slavit Velikonoce? Svátky na dráze i na hradech,"Velikonoční jízda vlakem a soutěž o nejhezčí vajíčko? Prvorepublikové slavnosti v přístavišti? Anebo třeba „jen“ obyčejný výlet na hrad nebo zámek,...",lidovky.cz,cestovani
https://cestovani.lidovky.cz/si-areal-arabba-lyzovani-v-lednu-stejne-jako-na-jare-f86-/aktuality.aspx?c=A180327_114321_aktuality_ape,Ski areál Arabba. Lyžování v lednu stejné jako na jaře,"Arabba je svými parametry sjezdovek a počtem černých sjezdovek možná nejsportovnějším střediskem celého komplexu Dolomiti Superski, proto na...",lidovky.cz,cestovani
https://cestovani.lidovky.cz/polaci-se-doma-neprezouvaji-a-obed-ve-dvanact-na-to-zapomente-rika-ceska-1my-/aktuality.aspx?c=A180326_110628_aktuality_ape,"Poláci se doma nepřezouvají. A oběd ve dvanáct? Na to zapomeňte, říká Češka","Monika Alberovská se do Polska přestěhovala se svým přítelem před čtyřmi lety. „Poláci Čechy milují, což je až neuvěřitelné, když si vezmu postoj...",lidovky.cz,cestovani
https://cestovani.lidovky.cz/nomadi-co-delat-kdyz-zapadnete-a-proc-je-dobre-upustit-pneumatiky-kdyz-vjizdite-do-pouste-gvu-/aktuality.aspx?c=A180319_132848_aktuality_ape,"NOMÁDI: Volím 4x4, dává mi mnohem větší svobodu, říká muž na cestě kolem světa",Právě teď jsou teď v Latinské Americe. Marek Havlíček a Kateřina Božková s upravenou dodávkou Mercedes pokračují v cestě kolem světa. Proč si na...,lidovky.cz,cestovani
https://cestovani.lidovky.cz/ostrov-vecneho-jara-je-rajem-pro-pesi-turistiku-rika-o-madeire-cestovatel-1rg-/aktuality.aspx?c=A180315_101840_aktuality_ape,"Ostrov věčného jara je rájem pro pěší turistiku, říká o Madeiře cestovatel","Ostrov Madeira nadchne především vyznavače aktivní dovolené, není to typický „koupací“ ostrov. Na své si zde přijdou hlavně turisté, cyklisti,...",lidovky.cz,cestovani
https://cestovani.lidovky.cz/na-kole-pres-afriku-lodi-se-nejede-dqa-/aktuality.aspx?c=A180323_135140_aktuality_ape,Na kole přes Afriku: Lodí se nejede!,"„Ahoj Tede, příteli. Víš, my tě nemůžeme vzít na naší lodi, která dneska odplouvá. Na gabonské straně by tě nepustili na břeh. Imigrační v Gabonu teď...",lidovky.cz,cestovani
https://cestovani.lidovky.cz/ski-areal-hlubocky-lyzovani-po-praci-i-kdykoli-jindy-f93-/aktuality.aspx?c=A180322_102220_aktuality_ape,Ski areál Hlubočky. Lyžování po práci i kdykoli jindy,"Hlubočky jsou příměstským areálem vzdáleným cca 20 min od Olomouce a s příznivou provozní dobou pro pracující, tedy od 9 do 21 hod. My zavítali do...",lidovky.cz,cestovani
https://cestovani.lidovky.cz/soutez-vyhrajte-knihu-cestovatele-havlicka-cesty-k-sobe-pkl-/aktuality.aspx?c=A180320_140528_aktuality_ape,SOUTĚŽ: Vyhrajte knihu cestovatele Havlíčka Cesty k sobě,"Surovou a stručnou formou napsaný soubor šestnácti strhujících příběhů z cest, které Marku Havlíčkovi změnily život. Často balancuje na samotné hraně...",lidovky.cz,cestovani
https://cestovani.lidovky.cz/jednicka-ceske-sumavy-spicak-konecne-i-pro-deti-fln-/aktuality.aspx?c=A180320_103509_aktuality_ape,Jednička české Šumavy. Špičák konečně i pro děti,U šumavského Špičáku je za posledních pár let znatelná transformace z ryze sportovního střediska s nejprudší sjezdovkou v tuzemsku na areál příhodný...,lidovky.cz,cestovani
https://cestovani.lidovky.cz/cesi-jsou-k-politice-lhostejni-resi-ji-jen-u-piva-rika-armenka-pti-/aktuality.aspx?c=A180319_123835_aktuality_ape,"Češi jsou k politice lhostejní, řeší ji jen u piva, říká Arménka",Marine Zulueta se rozhodla s rodinou přestěhovat do Evropy před více než dvaceti lety. Do Česka z Arménie přišla v roce 1992. „Česky jsem se začala...,lidovky.cz,cestovani
https://cestovani.lidovky.cz/nomadi-rodina-s-detmi-cestuje-po-evrope-s-karavanem-f8a-/aktuality.aspx?c=A180315_114133_aktuality_ape,NOMÁDI: Rodina s dětmi cestuje po Evropě s karavanem,"My rodiče, i naše děti máme něco odcestováno, takže by se dalo říct, že jsme taková podivná rodina z karavanu. Ale pro nás jsme pořád Víťa, Renata,...",lidovky.cz,cestovani
https://www.lidovky.cz/novinar.aspx?idnov=3653,Eliška Nová,Historie sahá až do 14. století. V osmnáctém mu vnukli barokní podobu slavní architekti Kryštof a Kilián Ignác Dientzenhoferovi. Turisté bloumající...,lidovky.cz,cestovani
https://cestovani.lidovky.cz/cyklostezky-dolomit-a-vychodnich-tyrol-aneb-po-rovine-mezi-horami-106-/aktuality.aspx?c=A180313_151000_aktuality_ape,Cyklostezky Dolomit a Východních Tyrol aneb po rovině mezi horami,"Nebojte se vyrazit do Dolomit a Tyrolska na kole s CK TRIP. Najdete zde i pohodové trasy, na kterých nevypustíte vlastní duši kvůli převýšení.",lidovky.cz,cestovani
https://cestovani.lidovky.cz/ve-tvaru-pismena-d-jesenicky-ski-areal-premyslov-aneb-lyzovani-s-milosem-148-/aktuality.aspx?c=A180314_103128_aktuality_ape,Ve tvaru písmena D. Jesenický ski areál Přemyslov aneb Lyžování s Milošem,"Sjezdovky jesenického Přemyslova tvoří jasné písmenko D - nožičku představuje nekompromisní černá pista Přímá, bříško zas jezdivá modrá sjezdovka....",lidovky.cz,cestovani
https://cestovani.lidovky.cz/na-kole-pres-afriku-z-accry-do-toga-drl-/aktuality.aspx?c=A180315_132059_aktuality_ape,Na kole přes Afriku: Z Accry do Toga,Ještě jsem ani nevystoupil z autobusu a už jsem dostal sedm nabídek svezení od dotěrných taxikářů. Vytahuji Apache ze zavazadlového prostoru autobusu...,lidovky.cz,cestovani
https://cestovani.lidovky.cz/vysoke-tatry-nejdelsi-sjezdovka-i-jizda-na-skutru-fsa-/aktuality.aspx?c=A180309_172813_aktuality_ele,Vysoké Tatry. Nejdelší sjezdovka i jízda na skútru,"Vysoké Tatry zahrnují známé resorty Tatranskou Lomnici a Štrbské pleso, které jsou od sebe vzdálené cca 20 minut autem. V Lomnici si užijete přes 5...",lidovky.cz,cestovani
https://relax.lidovky.cz/amatersti-archeologove-nasli-na-rujane-stribrny-poklad-pjg-/zajimavosti.aspx?c=A180416_164732_ln-zajimavosti_ele,Amatérští archeologové našli na Rujaně stříbrný poklad,"Archeologové našli na německém ostrově Rujana v Baltském moři stovky více než 1000 let starých mincí, prstenů, perel, náramků či náhrdelníků. Podle...",lidovky.cz,relax
https://relax.lidovky.cz/obri-modry-penis-na-budove-pobouril-obyvatele-stockholmu-bude-premalovan-1rs-/zajimavosti.aspx?c=A180416_083203_ln-zajimavosti_lar,"Obří modrý penis na budově pobouřil obyvatele Stockholmu, bude přemalován",Vztyčený modrý penis namalovaný přes pět pater na fasádě jedné budovy ve Stockholmu pobouřil místní obyvatele. Dílo švédské umělkyně Caroliny...,lidovky.cz,relax
https://relax.lidovky.cz/cinan-ohrozoval-posadku-plnicim-perem-letoun-nouzove-pristal-pbr-/zajimavosti.aspx?c=A180415_222423_ln-zajimavosti_ele,"Číňan ohrožoval posádku plnicím perem, letoun nouzově přistál","Letoun společnosti Air China byl v neděli nucen přistát v centrální Číně, protože jeden z cestujících ohrožoval člena palubního personálu plnicím...",lidovky.cz,relax
https://relax.lidovky.cz/slozeni-rostlin-dodnes-ukazuje-na-biblicka-sidla-ukazali-vedci-p7s-/veda.aspx?c=A180412_152332_ln_veda_ape,"Složení rostlin dodnes ukazuje na biblická sídla, ukázali vědci","Tým vědců pod vedením Michala Hejcmana z České zemědělské univerzity (ČZU) zjistil, že bývalá lidská sídliště ovlivňují rostliny v místě ještě po...",lidovky.cz,relax
https://relax.lidovky.cz/jen-vcasna-lecba-cukrovky-muze-zabranit-amputacim-nohou-shoduji-se-lekari-150-/zdravi.aspx?c=A180412_151946_ln-zdravi_ape,"Jen včasná léčba cukrovky může zabránit amputacím nohou, shodují se lékaři","Pouze včasná léčba cukrovky může podle lékařů zabránit vzniku diabetické neuropatie, která může vést až k amputacím nohou. Podle nejnovějších...",lidovky.cz,relax
https://www.lidovky.cz/novinar.aspx?idnov=2240,Barbora Postránecká,"Pijeme ji, aby nás povzbudila. Bereme ji jako rituál i symbol odpočinku. A často míváme výčitky svědomí, jestli si jí nedopřáváme nadmíru. Jak se ale...",lidovky.cz,relax
https://relax.lidovky.cz/na-zacatku-n-l-byla-pry-symbolem-statusu-v-dansku-husa-pfa-/zajimavosti.aspx?c=A180411_164320_ln-zajimavosti_ape,Na začátku našeho letopočtu byla prý symbolem statusu v Dánsku husa,"V současné době mohou být symbolem společenského postavení třeba drahá auta či šperky, v Dánsku to v prvních staletích našeho letopočtu byla husa,...",lidovky.cz,relax
https://relax.lidovky.cz/zeptali-jsme-se-vedcu-odkud-se-dostava-rtut-do-odpadnich-vod-a-jak-se-pak-odstranuje-g29-/veda.aspx?c=A180409_153232_ln_veda_ape,Zeptali jsme se vědců: Odkud se dostává rtuť do odpadních vod a jak se pak odstraňuje?,"Rtuť je těžký kovový prvek, který se vyskytuje přirozeně v přírodě, ale je také zanášen do životního prostředí lidskou činností. Na otázku odpověděl...",lidovky.cz,relax
https://relax.lidovky.cz/spravny-sef-by-mel-byt-dobry-psycholog-dyp-/zdravi.aspx?c=A180404_132030_ln-zdravi_ape,Správný šéf by měl být dobrý psycholog,"Zaměstnavateli se vyplatí, když lidi pustí na půl hodiny zaběhat si do nedalekého fitcentra, říká docent Martin Anders, předseda Psychiatrické...",lidovky.cz,relax
https://relax.lidovky.cz/pres-70-procent-ceskych-muzu-trpi-obezitou-cesi-totiz-nesportuji-ph5-/zdravi.aspx?c=A180409_113748_ln-zdravi_ele,Přes 70 procent českých mužů trpí obezitou. Češi totiž nesportují,"Nadváhou či dokonce obezitou trpí v Česku podle aktuální analýzy projektu Česko v datech 71% můžu a téměř 57% žen, což je nejvíce v historii, vyplývá...",lidovky.cz,relax
https://relax.lidovky.cz/k-empatii-prispivaji-take-geny-zeny-jsou-na-tom-lepe-nez-muzi-p5n-/veda.aspx?c=A180404_132537_ln_veda_ape,K empatii přispívají také geny. Ženy jsou na tom lépe než muži,Schopnost vcítit se do myšlenek a emocí druhých lidí máme zčásti vepsánu v genech. Ty nám na jedné straně napomáhají v pochopení společenských...,lidovky.cz,relax
https://relax.lidovky.cz/nova-kniha-o-guernice-tvrdi-ze-jde-o-rodinny-portret-picassa-plc-/zajimavosti.aspx?c=A180412_100900_ln-zajimavosti_ape,"Nová kniha o Guernice tvrdí, že jde o rodinný portrét Picassa","Obraz Guernica, který je už několik desítek let mnohými považován za nejslavnějším umělecké ztvárnění války v novodobé historii, nemá nic společného...",lidovky.cz,relax
https://relax.lidovky.cz/nahradni-matce-v-cine-se-narodilo-dite-ctyri-roky-po-smrti-rodicu-pxb-/zajimavosti.aspx?c=A180412_142315_ln-zajimavosti_ape,Náhradní matce v Číně se narodilo dítě čtyři roky po smrti rodičů,"Náhradní matce v Číně se narodilo dítě čtyři roky poté, co jeho rodiče zemřeli při dopravní nehodě. O ojedinělém případu informovala BBC s odkazem na...",lidovky.cz,relax
https://relax.lidovky.cz/lalucky-boltce-pozor-nausnice-se-staly-tim-cim-byly-v-devadesatkach-extravagantni-boty-g5n-/cekstajl.aspx?c=A180404_132912_ln-cekstajl_ape,"Lalůčky, boltce, pozor! Náušnice se staly tím, čím byly v devadesátkách extravagantní boty","Náušnice, náušnice, všude samé náušnice… Chtělo by se při pohledu na svět módy říci v parafrázi ikonické reportáže Jana Tuny o hromadění ojetých...",lidovky.cz,relax
https://relax.lidovky.cz/psi-blog-jak-nas-chlupac-o-vlasek-utekl-nicive-bouri-v-rumunsku-p7o-/domaci-mazlicci.aspx?c=A180410_151702_domaci-mazlicci_ape,PSÍ BLOG: Jak náš chlupáč o vlásek utekl ničivé bouři v Rumunsku,"Jedno se tomu Rumunsku musí nechat - sehnat v něm ubytování zdarma pro psa, není žádný problém. Problém nastává až ve chvíli, kdy chcete to ubytování...",lidovky.cz,relax
https://relax.lidovky.cz/le-figaro-casne-vstavani-nesvedci-organismu-fzq-/veda.aspx?c=A180407_202706_ln-zdravi_ele,"Časné vstávání nesvědčí organismu, tvrdí studie","Pokud využijete víkendu a jdete spát o hodně později než obvykle, pak to nesvědčí vašemu organismu, i když si ráno přispíte. Alespoň to tvrdí autoři...",lidovky.cz,relax
https://relax.lidovky.cz/nemoci-z-povolani-postupne-ubyva-meni-se-jejich-pocet-ale-i-spektrum-1gr-/zdravi.aspx?c=A180404_131534_ln-zdravi_ape,"Nemocí z povolání postupně ubývá. Mění se jejich počet, ale i spektrum",Ještě v 70. letech minulého století mezi nemocemi z povolání převažovaly infekční a respirační choroby nebo otravy. „Na klinice jsme tehdy nejčastěji...,lidovky.cz,relax
https://relax.lidovky.cz/mene-skodlive-koureni-kuraci-maji-dalsi-moznosti-fb5-/zdravi.aspx?c=A180411_102602_ln-zdravi_lar,"Méně škodlivé kouření, kuřáci mají další možnosti","Kuřáci nevábně voní, v hospodě si nezakouří, z domácnosti jsou vyháněni před dům. Tak hledají náhražky – momentálně třeba IQOS a další. Pomohou jim...",lidovky.cz,relax
https://relax.lidovky.cz/psici-s-plochymi-nosy-maji-casto-dychaci-obtize-frb-/domaci-mazlicci.aspx?c=A180409_144708_domaci-mazlicci_ape,Psíci s plochými nosy mají často dýchací obtíže,V Česku si čím dál více lidí pořizuje plemena malých psů a koček s plochými nosy. Podobný trend je i ve světě. Chovatelé by si podle Komory...,lidovky.cz,relax
https://relax.lidovky.cz/objev-vedcu-posune-lecbu-rohovky-transplantace-nebude-nutna-prh-/veda.aspx?c=A180410_092454_ln_veda_ape,"Objev vědců posune léčbu rohovky, transplantace nebude nutná","Českým a britským lékařům se podařilo odhalit nová fakta, která mohou výrazně posunout léčbu onemocnění oční rohovky. Onemocnění zvané Fuchsova...",lidovky.cz,relax
https://relax.lidovky.cz/nevolnost-i-zubni-kazy-co-vsechno-s-nasim-telem-dokaze-stres-prz-/zdravi.aspx?c=A180410_092141_ln-zdravi_ape,Nevolnost i zubní kazy. Co všechno s naším tělem dokáže stres,"Projevuje se to jako choroby a poruchy, ale je to „pouze“ stres. Bolení hlavy, nevolnost, a dokonce zubní kazy jsou nečekané a překvapivé způsoby,...",lidovky.cz,relax
https://relax.lidovky.cz/nejstarsim-muzem-planety-je-112lety-japonec-masazo-nonaka-pee-/zajimavosti.aspx?c=A180410_130231_ln-zajimavosti_ape,Nejstarším mužem planety je 112letý Japonec Masazo Nonaka,Nejstarším mužem planety je ve svých 112 letech a 259 dnech Japonec Masazo Nonaka. Podle agentury AP dnes obdržel od Guinnessovy knihy rekordů...,lidovky.cz,relax
https://relax.lidovky.cz/co-mozna-jeste-nevite-o-maturite-otazky-a-odpovedi-fw0-/veda.aspx?c=A180410_131705_ln_veda_sij,Co možná ještě nevíte o maturitě. Otázky a odpovědi,Vyznat se v pravidlech současných maturit je oříšek. Přinášíme odpovědi na nejčastější důležité otázky,lidovky.cz,relax
https://relax.lidovky.cz/riziko-ciha-i-v-kancelari-suchy-vzduch-muze-vyvolat-respiracni-onemocneni-1tk-/zdravi.aspx?c=A180404_131206_ln-zdravi_ape,Riziko číhá i v kanceláři. Suchý vzduch může vyvolat respirační onemocnění,"Že hasiči, horníci nebo třeba truhláři mají rizikové povolání, v němž mohou utrpět větší či menší újmu na zdraví, je každému jasné. Ale pracovní...",lidovky.cz,relax
https://relax.lidovky.cz/s-nanovlakny-chce-ceska-firma-proniknout-i-do-kosmetiky-pji-/veda.aspx?c=A180409_140730_ln_veda_ape,S nanovlákny chce česká firma proniknout i do kosmetiky,"Česká firma Nanopharma chce využít nanovláknové technologie i v kosmetice. Dosud se specializovala na farmacii, mimo jiné na léčbu jizev. Účinné...",lidovky.cz,relax
